인문학 열풍?… 인문대 졸업생엔 '냉풍'	http://news.naver.com/main/read.nhn?mode=LSD&mid=shm&sid1=102&oid=022&aid=0002723632	인문학적 소양 중시한다면서도 정작 인문학도는 원서도 안받아금융권 마저도 이공계 우대 양상정책 의식한 겉치레 비난 목소리개화기 조선을 침략한 국가를 순서대로 나열한 것을 고르시오.지난 12일 실시된 삼성그룹의 하반기 대졸자 공채 인적성검사SSAT에 출제된 문제다. 인문학적 역량을 갖춘 인재 선발을 강조하는 최근 기업들의 경향을 반영한 질문이다. 하지만 인문학을 강조하면서도 정작 삼성디스플레이와 삼성테크윈 등 삼성그룹 6개 계열사는 아예 인문계 출신을 뽑지 않고 있다.사학을 전공하는 취업준비생 박모25여씨는 인문학 소양을 높이 평가하겠다고 해서 기대했지만 실제 전형에서는 제대로 적용되지 않고 있는 것 같다며 전형적인 기업의 보여주기식 채용 행태라고 말했다.최근 기업들이 역사한자 등 인문학적 소양을 중요한 평가 기준으로 삼고 취업 관문 중 하나인 인적성 검사에 이를 활용하고 있다. 하지만 4년간 인문학을 전공한 대학 인문계 졸업생들은 입사 지원 서류조차 낼 수 없는 경우가 증가하고 있어 인문학 홀대 현상은 여전한 것으로 나타났다.17일 대기업 등에 따르면 삼성 SK LG GS 포스코 CJ 신세계 롯데 국민은행 등 대부분 10대 그룹이 올 하반기 신입직원 공채에서 역사 등 인문학 문제를 출제한다.하지만 이공계 졸업생을 선호하는 현상은 올해 더 뚜렷해졌다. LG화학 LG디스플레이 GS건설 주두산 두산인프라코어 두산건설 등은 올해 하반기 공채에서 역사학이나 국문학은 물론 경제학 등을 포함한 인문계 졸업생을 아예 뽑지 않기로 했다. 현대자동차그룹은 올해부터 인문계열 학생들은 신입사원 공채 대상에서 제외하고 상시 채용으로 전환해 논란을 빚기도 했다.상대적으로 인문계생들의 활약이 두드러졌던 금융권마저도 이공계생들을 우대하는 분위기다. 국민은행 하나은행 우리은행은 하반기 채용 공고에서 이공계통신정보기술IT 관련 전공자 우대를 명시하고 있다.같은 인문계 내에서도 역사학 철학 등을 전공한 순수 인문학도들은 취업 관문을 뚫기가 더 어렵다. 대한항공의 경우 일반관리직무 분야에서 상경 법정 외국어 등의 전공자를 채용하지만 국문학 역사 철학 등 순수 인문 전공자들은 채용대상에서 빠졌다.취업준비생 김모25여씨는 기업에서 인문학도에게 기회를 준다고 했지만 정작 채용공고를 보면 이공상경 계열을 선호하고 있다며 복수전공을 하지 않고 국문과를 심화 전공한 나 같은 학생들은 어쩔 수 없이 공무원 시험을 준비해야 한다고 말했다.이 때문에 인문학을 강화한다는 대기업들의 인재 채용 정책이 정부의 인문학 진흥 정책을 의식한 겉치레가 아니냐는 비판이 나온다.취업준비생 박모23여씨는 한 유통업체에서 인문학 소양을 평가한다며 논술 시험을 치렀는데 기업형 슈퍼마켓SSM에 대해 어떻게 생각하느냐는 문제가 나왔다며 이런 문제들로 인문학 소양을 평가할 수 있을지 의문이라고 말했다. 단국대 신은종 교수경영학는 인문학 열풍에 맞춰 최근 기업들이 채용 정책을 변화시키고 있지만 인문학에 대한 의미를 아주 좁게만 정의하고 있는 것 같다며 본질을 변화시키지 않는 인문학 강조가 계속된다면 창의적 기업으로 발전할 수가 없다고 말했다.com 세계일보 앱 설치하면 영화티켓을 드립니다.  세상을 보는 눈 세계일보  Segye.com  세계일보 관련뉴스언론사 페이지로 이동합니다
각국 국민들이 본 '세계의 가장 큰 위협'은	http://news.naver.com/main/read.nhn?mode=LSD&mid=shm&sid1=104&oid=022&aid=0002723705	한국 불평등 일본 핵 중국 환경오염 꼽아한국인들은 빈부 격차가 세계의 가장 큰 위협이라고 생각한다는 조사 결과가 나왔다. 일본인과 중국인들은 각각 핵무기와 환경오염을 지목해 대조를 보였다.16일현지시간 미국 여론조사기관인 퓨리서치센터가 발표한 2014 봄 글로벌 인식 조사 결과에 따르면 핵무기와 불평등 종교인종 혐오 환경오염 에이즈후천성 면역결핍증 등 질병 5가지 가운데 세계의 가장 큰 위협이 무엇이냐는 질문에 한국인 1009명 중 32가 불평등이라고 입을 모았다. 이어 환경오염29과 핵무기26 종교인종 혐오11 에이즈 등 질병2의 순이었다. 한국은 조사 대상 아시아 11개국 중 유일하게 불평등이 세계의 가장 큰 위협이라고 답했다. 이번 조사는 지난 3월17일6월5일 44개국 18세 이상 4만8643명을 대상으로 한 전화면접 방식으로 진행됐다.지역별로 심각한 위협을 바라보는 인식 차이가 컸다. 미국과 유럽에서는 불평등이 각각 27와 32로 1위를 차지했으나 종파 간 갈등과 종교 분쟁이 끊이지 않는 중동에서는 종교인종 혐오34가 1위였다. 아시아는 환경오염22이 남미는 핵무기26가 가장 심각한 위협으로 꼽혔다. 각종 질병에 신음하는 아프리카는 에이즈 등 질병29이 1위를 기록했다.국가별로는 일본인 49가 핵무기를 세계의 가장 큰 위협이라고 응답했다. 이에 대해 퓨리서치센터는 일본인들은 전 세계에서 유일하게 2차 세계대전 당시 피폭된 경험이 있기 때문이라고 분석했다. 중국인은 환경오염33이 가장 많았고 이어 핵무기26 불평등14 등의 순이었다.또 종교인종 혐오에 대한 우려가 7년 전보다 크게 증가한 것으로 확인됐다. 2007년에 이어 올해에도 조사에 참가한 28개국을 분석한 결과 종교인종 혐오가 2007년 17에서 올해 24로 증가해 불평등과 함께 공동 1위를 차지했다.퓨리서치센터는 세계의 가장 큰 위협에 대한 의견은 국가별 지역별로 다양하고 명확한 합의가 없다면서도 전 세계 대중들은 종교인종 혐오가 미래에 점점 큰 위협이 되는 것으로 보고 있다고 설명했다.com 세계일보 앱 설치하면 영화티켓을 드립니다.  세상을 보는 눈 세계일보  Segye.com  세계일보 관련뉴스언론사 페이지로 이동합니다
'원전-암 발병' 관련 첫 인정…유사 소송 잇따를 듯	http://news.naver.com/main/read.nhn?mode=LSD&mid=shm&sid1=102&oid=055&aid=0000289239	원전 이야기 하나 더 있습니다. 원자력 발전소 주변에 오래 살던 주민이 갑상샘암에 걸렸다면 원전 운영회사가 배상할 책임이 있다는 판결이 나왔습니다. 비슷한 소송이 잇따를 것 같습니다.기자발달장애인 법 제정을 촉구하며 3년 전 자폐증 아들과 전국으로 도보 여행을 떠나 유명해진 이진섭 씨입니다.고리 원전 근처인 부산 기장군에서 20년 가까이 산 이 씨는 아내가 갑상샘암 진단을 받자 원전 운영사인 한국수력원자력에 2억 원의 위자료를 청구하는 손해배상 소송을 냈습니다.재판부는 고리 원전에서 방출하는 방사선이 기준치 이내에 있지만 절대적인 안전을 담보한다고 단정할 수 없다며 이 씨에게 1천500만 원을 지급하라고 판결했습니다.재판부는 원전에서 반경 30km 안에 사는 주민의 갑상샘암 발병률이 다른 지역주민보다 1.8배 높다는 2011년 서울대 역학 조사도 인용했습니다.다만 갑상샘암은 발병 뒤에도 장기간 생존하고 한수원이 방사선량을 기준치 이하로 관리하기 위해 노력했다며 청구한 위자료 2억 원 중 일부만 인정했습니다.또 이 씨 아들의 자폐증과 이 씨 본인의 직장암과는 원전과의 관련성이 확인되지 않았다며 이에 대한 손배소는 기각했습니다.이번 판결은 암 발병과 원전의 관련성을 인정한 첫 판결로 유사 소송이 잇따르는 등 상당한 파장이 예상됩니다
北 계산된 몽니 + 南 전략부재… 군사접촉 예고된 파탄	http://news.naver.com/main/read.nhn?mode=LSD&mid=shm&sid1=100&oid=022&aid=0002723690	정부 시종일관 오락가락 불신 키워남북 군사당국자 접촉이 파탄에 이른 데는 북측의 계산된 몽니 전략 외에 우리 정부의 전략 부재와 무능도 한몫했다는 비판이다.특히 박근혜정부의 외교안보 컨트롤타워인 청와대 국가안보실NSC은 북한의 의도를 오판하고 남북협상을 밀실 뒤에서 요리하려다가 북한의 전말 공개라는 기습을 당했다. 북측은 비공개 약속을 지키려 한 NSC를 농락했다. 애당초 정부가 비공개 군사당국자 접촉 형식을 원했던 것은 NSC의 패착이었다는 지적이다.비공개 약속 고수하다 뒤통수 맞은 정부정부는 군사당국자 접촉의 언론 공개 여부와 회담 당사자에 대해 시종일관 오락가락하는 모습을 보였다.군사작전을 방불케 한 이번 회담 사실을 숨기기 위해 한민구 국방장관까지 나섰지만 결과적으로 정부에 대한 불신만 키웠다. 정부는 군사당국자 접촉 당일인 15일 정치권을 중심으로 군사회담 개최 사실이 흘러나오고 있는데도 확인해줄 수 없다며 모르쇠로 일관했다. 일부 국방부 직원들은 류제승 국방부 정책실장이 우리 측 대표로 참석했다는 보도에 대해 언론이 허위보도까지 한다며 은폐에 나섰다. 이 시점에 한 장관은 국회 국방위 위원에게 군사당국자 접촉 사실을 공개하지 못하는 점에 대한 양해를 구한 것으로 알려졌다.결국 북한 조선중앙통신이 16일 군사당국자 접촉 성사 과정의 전말을 공개하면서 성과도 없이 끝난 접촉은 남북 양측의 진실공방으로 비화됐다. 군 고위 관계자는 남북 간에 비밀리에 군사회담을 해서 성공한 걸 보지 못했다며 우리 정부의 투명하지 못한 태도를 비판했다.2014 인천아시안게임 폐막식 참석차 방남한 북한 황병서 군총정치국장 등 실세 3인방이 지난 4일 인천시 남동구 한 식당에서 김관진 청와대 국가안보실장 등 우리 측 대표와 오찬 회담을 갖기에 앞서 대화하고 있다.세계일보 자료사진남북회담 프로토콜 무시한 청와대 NSC국방부와 통일부는 15일 군사당국자 접촉이 비공개로 이뤄진 경위와 관련 북한의 비공개회담 요청을 수용한 것이라고 설명했지만 거짓으로 드러났다. 북한이 접촉 성사 전말을 공개하자 국방부는 우리 측이 비공개 군사당국자 접촉을 먼저 제의했다는 사실을 인정하며 말을 바꿨다. 남북회담 경험이 풍부한 북한 전문가는 정부가 군사회담을 비밀접촉과 혼동한 것 같다며 접촉과 관련한 모든 것을 비밀에 부치는 비밀접촉과 달리 군사회담의 경우 남북 당국 간 공식 회담이므로 회담 내용은 비공개로 하더라도 개최 사실은 공개하는 것이 관행이라고 말했다. 그는 정부가 판문점에서 열리는 군사회담을 비공개로 제의했다는 것 자체가 말이 안 된다고 지적했다. 여러 차례 개최된 남북 군사회담 전례에도 이런 촌극이 빚어진 것을 청와대 국가안보실의 인적 구성과 연관짓는 시각도 있다. 외교안보 컨트롤타워가 필요하다는 지적에 따라 5년 만에 NSC가 부활했으나 대부분 외교부와 국방부 출신 인사로 채워져 남북회담의 기본적인 프로토콜조차 작동되지 않았다는 것이다. 외교안보 분야 전문가는 다른 부처는 몰라도 통일부는 당연히 북한과 어떻게 회담을 준비하고 북한 주장이 어떤 의도인지 알고 있을 것이라며 통일부의 기능과 역할이 NSC에 녹아들지 않는 것은 큰 문제라고 비판했다. 국책연구소의 한 관계자는 대통령이 통일준비위원회 2차 전체회의에서 524 문제도 대화로 풀자고 언급한 상황에서 NSC가 북한의 NLL 도발 의도를 알고 있었다 하더라도 제대로 보고하기는 어려웠을 것이라며 NSC마저 대통령 입만 쳐다보면 외교안보 컨트롤타워가 아니라 외교안보 부실타워로 전락할 것이라고 쓴소리를 했다.정부 뒤늦은 북한의 천안함 입장 공개국방부는 17일 남북 군사 당국자 접촉에서 북한은 천안함 피격사건과 연평도 포격도발과 관련해 태도 변화를 보이지 않았다고 밝혔다. 국방부의 한 관계자는 이날 언론브리핑에서 천안함과 연평도 문제에 대한 북측의 태도에 변화가 있었느냐는 질문에 달라진 것이 없었다면서 이같이 말했다. 이 관계자는 우리 측은 기조발언을 통해 천안함 폭침과 연평도 포격도발은 귀북측에 책임이 있다고 분명하게 전달했으나 북측은 전혀 입장 변화가 없었고 그에 대해 사과하거나 유감을 표명하지 않았다고 설명했다. 국방부는 회담 직후 천안함 사건 등에 대한 북한의 반응을 묻는 질문에 함구로 일관 북측의 태도가 완화됐을 것이란 추측을 불러일으켰다. 정부가 오는 30일로 제안한 2차 고위급 접촉을 성사시키기 위해 접촉 결과를 숨긴 것 아니냐는 의구심을 불러일으키는 대목이다.박병진 군사전문기자 김민서 기자 worldpksegye.com 세계일보 앱 설치하면 영화티켓을 드립니다.  세상을 보는 눈 세계일보  Segye.com  세계일보 관련뉴스언론사 페이지로 이동합니다
'가출청소년 쉼터' 범죄 온상? 10대 범죄조직 적발	http://news.naver.com/main/read.nhn?mode=LSD&mid=shm&sid1=102&oid=214&aid=0000425901	가출 청소년 쉼터에서 만난 10대들이 범죄조직을 결성해 상점을 털고 취객의 지갑을 훔쳐오다 경찰에 붙잡혔습니다. 리포트 컴컴한 창문을 넘어 청소년 한 명이 상점에 들어옵니다.핸드폰 불빛으로 계산대를 뒤져 돈을 챙기고 유유히 빠져나갑니다. 서울 관악구의 한 PC방.청소년 두 명이 두리번거리더니 무언가를 훔쳐 달아납니다.범행을 저지른 10대 21명은 가출청소년들이 머무는 청소년쉼터에서 만났습니다. 가출과 패밀리를 합친 뜻의 가출팸을 만들었습니다.이들은 2명에서 7명씩 5개 가출팸을 조직한 뒤 주로 새벽 시간대에 범행을 저질렀습니다.PC방이나 찜질방 영업이 끝난 가게 등에서 현금과 스마트폰을 훔쳐 2천만 원 넘게 챙긴 것으로 드러났습니다. 피해자 금고 돈 통이 밖으로 빠져나와 있는 거에요. 이게 무슨 일이냐고 깜짝 놀랐죠.지하철에서도 술 취한 사람들의 지갑을 털었습니다.   신종호 교수서울대 교육학과 자기가 원하는 것은 많고 그것을 채우기 위해서 일탈 행동들을 생각하게 되고
'삼시세끼' 이서진·나PD 조합은 환상입니다	http://news.naver.com/main/read.nhn?mode=LSD&mid=shm&sid1=106&oid=109&aid=0002906891	김경주 기자 다시 뭉친 이서진과 나영석 PD의 조합은 역시나 시청자들에게 큰 웃음을 선사했다.17일 오후 방송된 tvN 예능프로그램 삼시세끼에서는 톰과 제리 이서진나영석 PD의 관계에서 나오는 웃음부터 새로운 형제로 등장하게 된 옥택연의 허당 그리고 시골생활에서 나오는 자연스러운 웃음 등으로 성공적인 시작을 알렸다.이날 방송에서 이서진은 강원도 정선에서 진행되는 요리 프로그램에 투덜본능을 발동시켰다. 그는 나영석 PD에게 미쳤구나 너라며 버럭 이후 시골로 향하는 길 도중 도시 남자같다는 말에 시끄러라고 또다시 투덜거려 웃음을 자아냈다.또 정선에 도착해서도 그의 투덜 본능은 멈추지 않았다. 그는 샤워는 어디서 하냐고 질문 이에 제작진이 마당에서 하면 된다고 답하자 카메라 있는데 빨개벗고 샤워하라고라며 으르렁 이후 제작진의 전화 도청을 의심하는가 하면 탈출을 감행하는 등 제작진에 소심하게 반항하는 모습으로 시종일관 웃음을 유발했다.그리고 그런 그에게 깐족대는 나영석 PD의 모습도 웃음 포인트 중 하나. 멘붕에 빠진 이서진과 옥택연에게 다짜고짜 달래 된장찌개와 무밥을 해 먹으라고 하는가 하면 이서진의 투덜거림에도 아랑곳하지 않고 이서진을 요리하게 만들어 톰과 제리다운 면모를 보여주기도 했다. 더불어 상황에 맞는 적재적소의 자막 센스는 프로그램의 재미를 배가시켰다.이미 두 사람의 호흡은 꽃보다 할배를 통해 확인된 바 두 사람은 꽃보다 할배 보다 훨씬 더 어려운 상황인 시골에서 요리를 한다는 설정 속에서도 관계 속에서 피어나는 리얼리티한 모습으로 프로그램의 재미를 책임졌다.뿐만 아니라 짐꾼으로 사랑받았던 이승기에 이어 새롭게 나영석 PD의 파트너가 된 옥택연은 어딘가 모자란 듯한 모습으로 빙구라는 별명을 얻으며 앞으로에 대한 기대치를 높였다
