'폭풍전야' 헌재…어떤 결론 나든 후폭풍 클 듯	http://news.naver.com/main/read.nhn?mode=LSD&mid=shm&sid1=100&oid=022&aid=0002757038	19일 통진당 운명의 날통합진보당 해산심판 청구 사건 선고를 하루 앞둔 18일 서울 종로구 재동 헌법재판소는 적막감에 휩싸였다. 이날 오후 통진당 해산을 반대하는 대학생들이 시국선언을 한 것 외에는 헌재는 폭풍 전야와 같이 고요했다. 헌재 관계자들 역시 극도로 말을 아꼈다. 자칫 통진당 해산과 관련해 불필요한 오해를 피하려는 이유에서다. 야당은 연좌농성을 벌이는 등 강력 반발했다. 헌재가 통진당에 대해 어떤 결론을 내릴지에 대해선 불확실하다. 헌법재판관 9명 중 6명 이상이 찬성하면 해산된다. 박한철61사법연수원 13기 헌재소장 안창호5714기 재판관은 검사 출신이고 이진성5810기 김창종5712기 재판관은 이명박정부 때 양승태 현 대법원장 추천으로 조용호5910기 서기석6111기 재판관은 박근혜 대통령 추천으로 재판관이 됐다는 점에서 보수 성향으로 분류된다. 사건 주심인 이정미5216기 재판관은 이용훈 전 대법원장 추천으로 김이수619기 재판관은 민주당 추천으로 재판관이 됐기 때문에 진보 성향으로 분류된다. 강일원5614기 재판관은 여야 합의로 재판관이 됐다. 전반적으로 보수 성향이 우세하다고 분석할 수 있지만 재판관들이 개인성향 등에 상관없이 선고를 하는 경우도 많기 때문에 결과를 예측하기 어려운 실정이다. 헌재 관계자는 헌재 재판관을 두고 보수 성향과 진보 성향으로 분류하지만 실제로는 사건마다 입장이 다르다며 결과를 예측하기 어렵다고 말했다.헌법재판소의 통합진보당 정당 해산심판 선고일을 하루 앞둔 18일 국회 본회의장으로 올라가는 2층 계단 앞에서 통진당 김재연이상규김미희 의원왼쪽부터이 피켓을 들고 당 해산 반대를 위한 연좌농성을 벌이고 있다. 이재문 기자통진당은 이날 비상체제를 선언하고 전면전을 선포했다. 진행 중이던 동시 당직선거를 중단하고 최고위원회의를 통합진보당 강제해산저지 민주수호 투쟁본부로 전환했으며 김미희김재연이상규 의원 등이 국회 본회의장으로 올라가는 앞 계단에서 연좌농성을 시작했다.의원단은 농성 돌입 기자회견문에서 청와대 비선 실세 국정개입 사건으로 인한 위기를 탈출하기 위해 헌재가 서두르는 것 아닌가 하는 의구심이 든다며 정치적 압력에 휘둘리지 말고 헌법과 양심에 따라 공정하게 결정을 내려야 한다고 촉구했다. 지난 11일 중남미 출장을 떠났던 오병윤 원내대표는 이날 급거 귀국했다. 오후에는 헌재 앞에서 중앙위원지역위원장 긴급 연석회의를 여는 등 지역 조직도 급박하게 움직였다. 저녁에는 당원 300여명이 당사 앞에서 촛불집회를 열었다.야권 인사 일부도 통진당의 입장을 지지하고 있다. 전날 국회에서 열린 통합진보당 강제해산 반대 민주수호 2차 원탁회의에서 새정치민주연합 정동영 상임고문은 진보당 해산은 헌재 결정이 아니라 선거에 의해 선택될 문제라고 말했다. 2012년 분당사태를 거치며 갈라진 정의당 노회찬 전 대표도 해산에 반대 입장을 밝혔다. 그러나 외곽의 움직임이 분산돼 있어 파급력을 갖기는 어렵다는 게 중론이다.통합진보당 해산 심판 결정을 하루 앞둔 18일 오후 서울 종로구 헌법재판소 앞에서 경찰관들이 경계근무를 서고 있다.남정탁 기자통진당 해산심판 선고 당일인 19일에 헌재는 안팎으로 소란스러울 것으로 보인다. 헌재 앞에서는 보수단체와 진보단체의 대규모 맞불 집회가 열릴 예정이다. 보수단체인 어버이연합과 엄마부대 회원 200여명과 진보단체인 한국진보연대가 각각 헌재 인근에서 집회 신고를 해 놓은 상태다
시진핑 "中, 한반도 비핵화 실현에 건설적 역할 다할 것"	http://news.naver.com/main/read.nhn?mode=LSD&mid=shm&sid1=100&oid=421&aid=0001174617	불법조업 관련국 적절히 처리 희망베이징 박상휘 기자  시진핑 중국 국가주석은 18일 한반도 비핵화 실현을 위해 중국이 건설적 역할을 하겠다고 밝혔다. 아울러 시 주석은 박근혜 대통령과 추가적인 양자회담 개최와 조속한 한중 FTA 후속조치를 희망한다고 밝혔다. 시 주석은 이날 중국 베이징 인민대회당에서 정의화 국회의장을 만나 중국은 한반도 비핵화 실현에 건설적 역할을 다할 것이라며 중국은 한국과 마찬가지로 한반도 비핵화와 동북아 평화 안전 수호를 견지하고 있다고 말했다. 시 주석은 이어 협상과 대화를 통해 문제를 해결해야 한다고 생각하고 한국과 함께 각 측을 설득하려고 한다며 이를 통해 6자회담을 재개하고 동북아 평화안정을 추진해야 한다고 강조했다. 그러면서 지난 세기 중국과 한국 양국은 외국의 침범을 받았고 같은 운명 같은 입장을 갖고 있다며 항구적 평화가 정착되도록 노력하고 내년은 세계 반파시즘 승리 70주년으로 중국과 한국 양국 등은 함께 행사를 진행하면 좋겠다고 제안했다. 시 주석은 박 대통령과의 추가적인 양자회담도 희망했다. 그는 박 대통령과 여러 기회를 이용 양자 면담을 더 가지는 것을 희망한다며 이를 통해 중국과 한국 양자관계가 공동인식을 더 높여가기를 바란다고 말했다. 중국 어민들의 서해 불법 조업 문제와 관련해서는 불법어업을 엄격히 관리하는데도 이런 현상이 발생하고 있다며 계속해서 관리를 강화하겠다고 말했다
미국·쿠바 재결합, 교황이 중매섰다	http://news.naver.com/main/read.nhn?mode=LSD&mid=shm&sid1=104&oid=469&aid=0000037112	작년 10월 양국 대표단 바티칸 초청 쿠바 억류 미국인 석방 물꼬 트고오바마카스트로에 서한 보내 설득프란치스코 교황과 가톨릭 교회의 역할에 감사 드린다. 버락 오바마 미국 대통령은 17일 쿠바와 관계 정상화 내용을 담은 특별성명 발표 후 백악관 기자회견에서 양국의 화해를 끌어내려는 교황의 노력이 관계 정상화에 큰 자극과 동력이 됐다며 이렇게 말했다. 프란치스코 교황의 78번째 생일에 쿠바와 관계정상화를 발표한 것도 감사의 뜻이 아니냐는 해석도 나온다. 오바마의 성명 발표 직후 교황청도 성명을 내고 미국과 쿠바 관계 정상화를 위한 협상에서 교황이 한 적극적인 역할을 구체적으로 소개했다. 성명에 따르면 프란치스코 교황은 지난해 10월 미국과 쿠바 대표단을 바티칸으로 초청해 미묘한 양국 현안을 논의하는 자리를 주선했다. 미국이 쿠바에 수년간 억류된 앨런 그로스의 석방을 위해 교황청이 나서 달라고 요청한 데 대한 응답이었다. 교황은 이 만남으로 그로스 석방의 물꼬를 터 결국 양국 관계 정상화 협상의 돌파구를 마련했다고 가디언은 분석했다. 교황은 또 최근 몇 달 사이 오바마 대통령과 쿠바의 라울 카스트로 국가평의회 의장에게 서한을 보내 일부 수감자들의 상황을 포함해 인도주의적인 문제와 관련된 공동 관심사 해결도 촉구했다고 성명은 밝혔다. 카스트로에게는 미국인 그로스를 석방하라고 요청하고 오바마에게는 수감된 쿠바인 석방을 설득한 것으로 전해졌다.  하이메 오르테가 쿠바 추기경 역시 쿠바 측 중재자로서 협상에 중요한 역할을 한 것으로 알려졌다. 쿠바 가톨릭 최고위 성직자 오르테가 추기경은 쿠바 정부의 개혁을 공개 지지하고 정치범 석방 등 각종 정치 현안에도 적극 개입해왔다. 이처럼 가톨릭계가 양국 관계 복원에 영향력을 발휘할 수 있었던 데는 쿠바가 가톨릭 전통이 매우 강한 나라라는 점이 작용했다. 그로스 석방을 결단해 미국과 관계 정상화라는 역사의 한 페이지를 장식한 라울 카스트로83 의장에도 눈길이 간다. 1959년 혁명을 주도한 뒤 오랫동안 쿠바를 이끌어온 피델 카스트로 전 의장의 동생인 그는 부의장 겸 국방장관을 지내다 형이 2006년 장 출혈로 건강이 급속히 나빠지자 임시로 정권을 물려받은 뒤 2008년 정식 취임했다. 라울 카스트로는 독재자혁명가 이미지가 강했던 형에 비해 다소 온건하고 실용적인 정책을 펼치는 지도자로 비쳐왔다. 정권을 잡은 뒤 자영업 허용 경제특구 개발 등 개혁 개방을 적극적으로 추진하며 자본주의 시장체제를 단계적으로 도입한 것이 그런 성향을 단적으로 드러낸다. 오바마 취임 직후인 2009년 초 미국과 직접 대화할 용의가 있다고 밝힌 적도 있고 지난해 말 넬슨 만델라 전 남아공 대통령 추모식장에서 오바마와 첫 대면해 악수하면서 영어로 오바마 대통령 난 카스트로요라고 말해 이목을 끌었다. 최근에는 서아프리카에 창궐한 에볼라 구호활동에 세계에서 가장 큰 지원 활동을 펼쳐 미국을 포함한 각국 언론의 찬사를 받기도 했다. 그는 이날 직접 아바나 국제공항으로 가 미국에서 풀려난 쿠바인 수감자들을 맞아 포옹했다. 그 뒤 성명에서는 오바마 대통령의 이번 결정은 존경 받아야 한다고 말했다
 추위 내일 반짝 주춤…퇴근길 다시 눈·비	http://news.naver.com/main/read.nhn?mode=LSD&mid=shm&sid1=103&oid=214&aid=0000445212	기록적인 한파 조금씩이나마 누그러지고 있습니다.오늘 아침만 해도 서울 기온 영하 13.2도까지 내려가 추위가 절정에 달했는데요.내일 아침도 영하 8도로 다소 춥겠지만 낮에는 모처럼 영상권을 회복하겠습니다.모레 오전까지는 추위가 반짝 주춤하다가 찬바람이 불면서 일요일에는 영하 10도 안팎까지 뚝 떨어질 전망입니다.눈은 내일 퇴근길 무렵부터 다시 내립니다.경기 동부와 영서지방에 최고 15cm 이상 경기 북부와 충북 경북 북부에도 2에서 7cm의 많은 눈이 쏟아지겠는데요.서울과 그 밖의 내륙에도 다소 쌓일 수 있겠지만 적설량의 차이가 클 것으로 보입니다.지금 위성영상 보시면 모처럼 눈 구름 없이 전국이 대체로 맑은 하늘 보이고 있습니다.하지만 내일은 북서쪽에서 기압골이 다가오겠습니다.낮기온이 서울 1도 대전 4도 광주지방 영상 6도까지 오르겠습니다.저녁에는 서해안지방을 시작으로 밤에는 전국 대부분 지방에서 비나 눈이 내리겠습니다
'비리 의혹' 서울축산농협 압수수색	http://news.naver.com/main/read.nhn?mode=LSD&mid=shm&sid1=101&oid=052&aid=0000625333	서울축산농협이 전현직 임직원 비리 혐의로 검찰 수사를 받고 있습니다.   불법으로 대출금리를 조작하거나 승진 인사 명목으로 금품을 받는 등 수십억 원의 부당이익을 취한 혐의입니다.  취재기자 연결해 자세한 내용 알아보겠습니다. 최아영 기자  서울 축협이 내부 비리로 검찰 수사를 받고 있다고요  기자  검찰이 서울 등촌동에 있는 서울축산농협 본사를 압수수색 했습니다.   서울축협 전현직 조합장과 이사장 등 임직원 이십여 명이 비리 의혹에 연루됐기 때문입니다.5의 은행대출 금리를 자체적으로 조작 인상하는 방법으로 수십억 원의 부당이익을 얻은 혐의를 받고 있습니다.  또 내부 승진 인사 청탁 명목으로 금품을 받아 챙긴 혐의도 받고 있는데요.  서울 남부지검은 현재 관련자들의 통장계좌 내역을 조사하고 있습니다.  검찰은 필요에 따라선 관계자들도 소환해 추가 조사를 벌일 방침입니다.   앵커  그런데 서울축산 농협의 비리가 오랬동안 이어져 왔다는 주장도 있다고요   기자  전 서울축산농협 관계자는 YTN과의 전화 통화에서 이러한 비리가 수십년 동안 이어져 왔다고 주장했는데요.  축협이 조합원으로 이루어진 폐쇄적인 구조인데다 최고 인사권을 가지 조합장 등 주요 인사가 의사 결정권을 갖고 있기 때문에 인사 청탁 등이 만연했다고 전해왔습니다.  현재 서울축산농협은 서울 지역에 27개 사업소를 가지고 있고 축산물 유통 외에도 대출 등 신용업무를 담당해 오고 있습니다.   검찰 조사 결과 금리 조작 혐의가 사실로 드러나게 된다면 은행 고객들에게도 적지 않은 파장을 일으킬 것으로 예상됩니다
인천서 대형 상수도관 파열…19만 가구 단수 예정	http://news.naver.com/main/read.nhn?mode=LSD&mid=shm&sid1=103&oid=001&aid=0007310215	파열된 상수관  DB 19일 0시20일 낮 12시 서구 검단영종용유도 단수     인천 손현규 기자  인천에서 대형 상수도관이 터지는 사고가 발생해 오는 20일까지 36시간 동안 19만 가구의 단수가 예상된다.     18일 인천시 상수도사업본부에 따르면 이날 오전 11시 30분께 인천시 서구 공촌사거리의 한 도로 아래에 묻힌 대형 상수관이 터졌다.    길을 지나던 한 주민은 도로에서 갑자기 물이 쏟아져 흘러나온다며 시 상수도사업본부에 신고했다.      이날 상수관에서 흘러나온 물로 도로 곳곳이 침수돼 이 일대 도로는 온 종일 차량 흐름이 지체됐다.    5m 깊이에 묻힌 직경 1천800의 이 상수관은 서구 공촌정수장에서 서동구 전체와 중구 영종용유도 등 29만 가구로 수돗물을 공급하는 주라인인 것으로 알려졌다.          인천시 상수도사업본부는 이날 오후부터 터파기 작업을 통해 상수관 파열 지점을 찾고 있지만 이날 오후 9시 30분 현재까지 정확한 위치를 파악하지 못했다.    유정복 인천시장과 시 상수도사업본부 관계자들은 이날 오후 늦게까지 현장에서 복구 작업을 지휘했다.      그러나 공촌사거리 지하에는 300 600 1천800 등 여러 상수관이 뒤섞여 있어 복구 작업에 어려움을 겪고 있다.      시 상수도사업본부 공촌정수장 주요 상수관을 통한 수돗물 공급을 갑자기 중단하면 여파가 커 현재까지 단수 조치는 하지 않았지만 인근 다른 정수장의 수돗물 공급량을 늘린 후 공촌정수장의 수돗물 공급을 중단할 계획이다.    이에 따라 19일 0시를 기해 영종용유도와 서구 검단 일대 19만 가구가 20일 낮 12시까지 36시간 동안 단수될 예정이다.    시 상수도사업본부의 한 관계자는 이날 오후부터 문자 메시지를 통해 서구와 중구 영종용유도 주민들에게 단수 계획을 알렸다며 사고 원인을 찾아 최대한 빨리 복구하겠다고 말했다
'토토가' 터보로 시작해 김건모로 끝…환상 공연	http://news.naver.com/main/read.nhn?mode=LSD&mid=shm&sid1=106&oid=109&aid=0002955314	황미현 기자  무한도전토요일 토요일은 가수다토토가가 터보로 시작해 김건모로 끝나는 구성을 갖췄다. 18일 방송계에 따르면 이날 펼쳐지는 토토가의 공연 순서는 터보가 오프닝 공연을 시작 김건모가 엔딩을 장식하는 그림으로 짜여졌다. 터보는 18년만에 뭉쳐 오랜만에 팬들 앞에 서 화려한 오프닝 무대를 꾸밀 전망이다. 이들은 초반 분위기를 고조시키며 팬들을 열광케 할 것으로 보인다. 이후 무대는 김현정이 꾸민다. 김현정은 1990년대 히트곡 메이커로 떼창을 예감케 한다. 임신으로 출연이 불발된 유진 대신 소녀시대 서현이 S.S 무대를 함께 하며 하하와 정형돈이 영어 랩을 담당해 더욱 다양한 볼거리를 선사한다. 그 뒤로는 쿨이 나선다. 해외에 머물고 있는 유리 대신 쥬얼리의 예원이 빈자리를 채운다. 이후 소찬휘가 무대에 오른다. 섭외 과정 당시 티어스로 돌고래 고음을 펼친 소찬휘는 이날 무대에서 역시 소름 돋는 고음으로 분위기를 절정으로 이끌 전망. 소찬휘 무대 이후에는 지누션이 나선다. 두 사람이 지상파를 통해 한 무대에 오르는 모습 자체만으로 큰 환호가 나올 것으로 기대된다. 지누션의 무대에는 배우 엄정화가 함께해 90년대 완전체를 이뤄 더욱 기대를 높인다. 이후 조성모가 무대에 올라 100만장 판매고를 올렸던 히트곡을 부르며 이후에는 엄정화가 솔로 무대를 통해 관객들과 호흡한다. 배우로 활약 중인 엄정화의 무대가 신선하게 다가올 것으로 보인다. 이후 이정현이 와와 줄래 등으로 후반 분위기를 더욱 고조시키며 엔딩 무대에는 김건모가 올라 정점을 찍는다. 김건모는 무한도전 멤버들의 회유에 출연을 결정 오랜만에 관객들과 가까이서 호흡할 예정이다.  토토가는 이미 방청 신청률 만으로 압도적인 인기를 입증한 상황. 웬만한 가요대전을 능가하는 출연진이며 그간 볼 수 없었던 이들의 향수 짙은 모습에 10대들은 잘 모르는 어른들만의 가요 대축제가 펼쳐질 것으로 보인다
