'심하게 흔들린다' 여수·광양 이순신대교 전면 통제	http://news.naver.com/main/read.nhn?mode=LSD&mid=shm&sid1=103&oid=003&aid=0006158515	여수배동민 기자  전남 여수시 묘도동과 광양시 금호동을 잇는 이순신대교에서 심한 흔들림 현상이 발생해 경찰과 지자체 등이 다리 통행을 전면 통제하고 있다.26일 전남도소방본부에 따르면 이날 오후 6시부터 오후 6시10분 사이 이순신대교가 평소보다 심하게 흔들린다는 내용의 신고가 119와 112에 10여건 접수됐다.신고자들은 흔들림 때문에 속이 울렁거린다고 진술한 것으로 알려졌다. 현재까지 이로 인한 사고나 부상자는 없는 것으로 확인됐다.현장에 도착한 소방당국과 경찰 지자체 공무원들은 만일의 상황에 대비해 이날 오후 6시20분부터 광양과 여수 쪽에서 이순신대교로 진입하는 차량을 전면 통제하고 있다.여수시 한 관계자는 차량 통제를 계속하면서 전남도 광양시 건설사 등과 함께 원인을 파악할 계획이라고 밝혔다.신고가 접수된 이날 오후 6시부터 오후 6시20분 사이 전남 여수에 8. 광주기상청 관계자는 이순신대교가 흔들릴 정도의 바람 세기는 아니다라고 설명했다.이로 인해 현재 진행 중인 이순신대교의 도로 포장공사가 흔들림 현상의 원인일 수 있다는 분석도 나오고 있다.이순신대교는 최근 여수에서 광양 방향의 2차선 도로 포장공사를 마치고 현재 광양에서 여수 방향 2차선 도로의 포장공사를 진행하고 있다.총 길이 2260m 국내 최대 해상 특수교량인 이순신대교 자체가 워낙 길고 밑에 받침이 없는 형태이기 때문에 한 쪽만 포장을 할 경우 그 무게와 바람이 만나 흔들림 현상이 발생할 수 있다는 것이다.이에 대해 이순신대교를 준공한 건설사 측은 상판 포장 보수공사 진행 중 날이 추워져서 도로 옆 분리대에 천을 씌워뒀다며 그러다 보니 바람의 영향으로 1m 정도 상판이 흔들리고 있으나 기본적으로 2m까지는 흔들려도 안전하도록 설계됐다고 말했다.이어 현재 천막을 제거 중이며 안전에는 문제가 없다면서 조기 개통과 최근 재포장은 이번 일과 무관하다. 바람이 안 통해서 흔들린 것으로 보인다고 덧붙였다.이순신대교는 지난 2012년 5월 여수세계박람회 개최로 인해 여수시 월내동과 묘도동 구간을 부분 개통한 바 있는데 이 같은 조기 개통과 최근 재포장 공사가 흔들림 현상과는 무관하다는 주장이다.한편 지난해 2월8일 전면 개통된 이순신대교는 향후 5년 동안 전남도와 여수시 광양시가 60억원의 비용을 분담해 관리키로 했다. 전남도는 현재 여수에 유지관리사업소를 설치 이순신대교를 관리하고 있다
2014년 노사갈등 '통상임금 폭탄'은 피했다	http://news.naver.com/main/read.nhn?mode=LSD&mid=shm&sid1=102&oid=022&aid=0002727749	2 2013년 수준현대차 처럼 대부분 논의 미뤄 갈등 잠재로 지뢰 터질 가능성올해 노사관계는 통상임금을 둘러싼 대립 등으로 매우 어려울 것이라는 예상과 달리 예년과 크게 다르지 않은 것으로 나타났다. 전문가들은 그러나 임금체계 개편 근로시간 단축 등 산적한 노동현안을 해결하기 위해서는 갈등이 잠재한 지금의 상황이 결코 바람직하지 않다고 입을 모은다.26일 고용노동부에 따르면 올해 노사관계 지표는 예년과 비슷한 수준이다. 9월 말 현재 임금 타결률은 45.2로 지난해 46와 크게 다르지 않다. 1998년 이후 9월 기준 임금타결률이 꾸준한 하락세였기 때문에 그런 차원에서 해석 가능한 수준이다. 고용부는 국정감사 업무보고에서 통상임금과 정년 연장 등 노사 간의 견해차로 임금단체협상 타결이 초반에는 다소 지연되는 듯했지만 지금은 예년 수준에 도달한 상황이라고 보고했다.지난해 말에는 통상임금 판결의 여파로 올해 노사갈등이 폭발할 것이라고 점쳐졌다. 예상과 다른 올해 상황을 두고 전문가들은 우려 섞인 시선으로 바라보고 있다. 현대차처럼 논의를 미뤄놓은 사업장이 많거나 영세 사업장은 아예 논의 자체를 못했기 때문이다.유경준 KDI한국개발연구원 재정복지정책연구부장은 올해 분규의 소지가 많았지만 법원이 판결을 미루거나 해석의 여지가 많은 판결을 해서 더 기다려보자는 식으로 미루고 있는 것 같다면서 큰 틀에서 사회적 논의를 해야 하는 문제인데도 그게 안 되는 구조가 답답하다고 지적했다
주춤하더니…강남 3구로 다시 몰리는 학생들	http://news.naver.com/main/read.nhn?mode=LSD&mid=shm&sid1=102&oid=469&aid=0000026487	교육 특구로 온 순유입 학생 3년 연속 감소하다 작년에 증가학부모들 경제적 부담 크지만 만족 전학생 78가 초등생 쏠림 심각   경기의 한 신도시 아파트에 거주하며 그 지역 종합상가에서 병원을 운영하는 의사 A씨는 올해 2월 서울 역삼동으로 이사했다. 초등학교 졸업을 앞둔 아이의 교육 문제 때문이었다. 그는 아내가 좋다고 꼽은 강남 B중학교에 아이를 입학시키기 위해 부랴부랴 이사를 감행했다. 병원까지 출퇴근 시간도 길어졌고 급히 집을 구하느라 260만원의 월세도 부담해야 했지만 아내는 여기서 전교 1등 해도 강남에서는 중간 정도이니 차라리 교육여건이 좋은 강남이 낫다고 강조했다. 아이의 초등학교 친구도 같은 중학교에 입학하기 위해 이사했지만 정원 초과로 다른 중학교에 진학했다는 소식을 듣고 A씨는 더 늦었으면 내 아이도 입학하지 못할 뻔 했다며 위안을 삼았다. 그는 아이의 친구들 중엔 이미 지난해 강남으로 이사한 경우도 꽤 된다며 살던 곳은 학원도 마땅찮고 학교 면학 분위기도 좋지 않은데 강남은 여건이 좋아 경제적 부담이 크지만 만족한다고 덧붙였다.  최근 몇 년 간 주춤했던 서울 강남서초송파 등 교육특구의 학생 쏠림 현상이 다시 고개를 들고 있다. 내신 중심의 특목고 선발 방식 변경 자율형사립고 등장 등으로 강남의 학생 유입이 감소 추세를 보이다 지난해 반전했다. 교육당국의 일반고 살리기 대책이 지지부진하고 지역별 성적 격차가 심화되면서 학부모들 사이에서 역시 교육은 강남 3구라는 분위기가 형성된 탓으로 풀이된다.  26일 입시업체 하늘교육이 올해 4월 기준으로 학교알리미에 나타난 학교별 전출입 변동 현황을 분석한 결과에 따르면 강남서초송파 등 강남 3구의 순유입 학생은 20102012년 3년 연속 감소 추세를 보이다 지난해를 기점으로 증가 추세로 전환했다. 순유입 학생은 이 지역으로 전학 온 학생수에서 이 지역에 살다 다른 지역으로 전학 간 학생수를 뺀 것이다.  강남구의 작년 순유입 학생은 1339명으로 2012년 653명에 비해 2배가 넘게 증가했다. 서울 25개 자치구 가운데 증가 규모가 가장 컸다. 서초구도 2012년 752명이던 순유입 학생이 작년 962명으로 증가했고 2012년 순유출 298명이었던 송파구도 작년 51명 순유입으로 전환했다. 전문가들은 대학진학자수와 학력수준이 높은데다 수시 모집 확대 등에 따른 강남 지역의 대입 강세 현상이 여전하기 때문으로 분석했다. 비교육특구 내 자사고들이 지역 명문고로서 자리매김을 하지 못하면서 학부모들의 위기감이 높아졌다는 것이다. 강남3구와 나머지 지역의 학력 격차가 심해지면서 학생 쏠림 현상이 장기화 고착화될 수 있다는 우려가 제기된다. 서울지역 일반고 출신 서울대 합격자 가운데 강남서초송파구 출신 비율은 2011학년도 39. 입시정책이 바뀌어도 이른바 강남 불패 신화가 이어지면서 초등학교 때부터 쏠림 현상이 두드러지고 있다. 실제 지난해 강남3구 순유입 학생 2352명 가운데 초등학생은 1829명으로 77
경찰, 전국 모든 운행 차량 실시간 감시시스템 구축했다	http://news.naver.com/main/read.nhn?mode=LSD&mid=shm&sid1=102&oid=028&aid=0002250902	전국 도로 CCTV 6천여대에서차량 번호 실시간 전송받아전국민 이동 경로 추적 가능수사권 남용사생활 침해 심각경찰청 시험 운영 중단 클릭하면 확대됩니다. 경찰이 전국 도로에서 운행중인 차량을 자동 식별감시할 수 있는 통합 시스템을 구축해 시험운영까지 한 것으로 확인됐다. 수사권 남용과 사생활 침해 가능성을 막을 안전장치 없이 시스템이 구축돼 도로 위 실시간 사찰이라는 논란이 불가피할 것으로 보인다. 26일 국회 안전행정위원회 소속 진선미 새정치민주연합 의원이 경찰청에서 제출받은 수배차량 검색체계 개선사업 자료를 보면 경찰은 차량번호 자동 수집이 가능한 전국의 차량방범용 카메라 5929대에 찍히는 차량정보를 경찰청 서버로 실시간 전송하는 시스템을 지난 3월 구축하고 7월까지 4개월 동안 시험운영까지 했다. 경찰이 전송받은 차량정보를 미리 입력해놓은 차량번호와 자동 비교판독한 뒤 수배도난 차량 등으로 확인되면 지역 경찰에 곧바로 모바일 검문 지령이 내려가게 된다. 경찰은 1992년 실시간 검색과 현장 검문소를 연결한 시스템AVNI을 도입해 서울 9곳을 포함해 전국 주요 길목 76곳에서 가동하며 해당 지역을 통과하는 차량의 사진을 촬영하고 차량번호를 수집하고 있다. 여기에 경찰이 구축한 새 시스템을 가동하면 각 지자체 관제센터에서 보관 중인 동영상까지 더욱 쉽게 검색할 수 있어 차량 이동 상황 파악이 수월해진다. 차량정보는 최소 석 달 이상 저장할 수 있으며 차량번호만 입력하면 과거현재의 이동 경로와 탑승자 영상까지 곧바로 확인할 수 있다. 진 의원은 기존 시스템이 작동하는 76곳에서 한 달 동안 수집되는 차량정보는 2300만건에 달한다며 새 시스템이 본격 가동되면 차량 이동 감시가 사실상 무제한적인 수준으로 발전할 수 있다고 내다봤다. 경찰은 살인강도성폭력납치절도 등 범죄 수사에 효과를 거둘 수 있다고 보고 있다. 경찰은 새 시스템에서 개인정보 오남용을 막기 위해 접속자 로그 기록을 주기적으로 관리하도록 했지만 조회 권한을 누구에게 어떤 범죄 혐의에 한정해 어디까지 부여할 것인지에 대한 명확한 기준조차 마련하지 못한 상태다. 이와 관련해 시스템 구축 주무 부서인 경찰청 정보통신담당관실은 인권침해 우려가 있어 시험운영을 중단하고 구체적인 운영 방법을 수사 부서와 협의 중이라고 밝혔다. 하지만 카카오톡 사찰 논란에서 보듯 투망식 사찰이나 수사에 악용될 가능성은 여전하다. 진 의원이 공개한 자료를 보면 경찰은 지난해 말 철도노조 파업 당시 업무방해 혐의로 수배된 노조 간부의 행적을 찾겠다며 기존 수배차량 검색 시스템을 통해 노조 간부 친인척들의 몇 달치 차량 이동 정보까지를 추적했다. 진 의원은 일반 국민들의 차량운행 정보를 영장도 없이 수집하는 것은 헌법이 정하는 영장주의에 어긋날 뿐 아니라 심각한 사생활 침해다. 경찰은 국민들의 차량을 사찰하는 수배차량 검색체계 도입을 전면 백지화해야 한다고 주장했다.  박태우 기자 ehothani
감사원, 'MB 자원외교' 동서발전에 "부실투자" 결론	http://news.naver.com/main/read.nhn?mode=LSD&mid=shm&sid1=101&oid=003&aid=0006158319	박정규 기자  이명박정부 때인 2011년 한국전력 자회사인 한국동서발전이 처음으로 해외 전력공기업을 인수해 MB 자원외교로 불렸던 자메이카전력공사JPS 투자사업에 대해 감사원이 부실투자라는 결론을 내렸다. 감사원은 지난 2월 국회 산업통상자원위원회로부터 감사를 요구받은 동서발전의 JPS 투자실태와 관련 지난 45월 감사를 실시해 이 같은 감사결과를 확정했다고 26일 밝혔다. 감사 결과에 따르면 동서발전은 JPS의 지분을 인수하는 과정에서 해외사업 추진 관련 규정을 무시한 채 해외사업심의위원회의 의결을 거치기도 전에 이길구 당시 사장과 담당자가 일본의 A사로부터 지분을 넘겨받는 인수가격을 합의했다. 당시 동서발전은 2011년 자메이카전력공사의 지분 40를 A사로부터 2억8500만달러에 인수했으며 이 같은 절차 위반으로 인해 적정 지분가치보다 고가로 인수한 것으로 추정된다는 게 감사원의 판단이다. 동서발전 내부 해외사업심의위에서도 해당 지분의 가치가 2억1000만달러 정도라는 의견이 나왔던 것으로 전해졌다. 이와 함께 지분 인수가격을 산정하는 과정에서도 사업경제성 판단기준인 기준수익률을 산정하지 않았으며 프로젝트파이낸싱PF 대출가능성이나 전력판매 성장률 송배전 손실률 등 가정사항의 적정성도 제대로 검증하지 않은 것으로 드러났다. 이사회 등 의사결정 과정에서도 해외사업심의위의 의결 내용보다 PF 대출금액을 500만달러 더 늘려 안건을 상정하는 한편 이사회에서 결정된 민간전문가 의견수렴 조건도 제대로 이행되지 않았다. 재정자문사 선정과정에서도 입찰공고 전 계약과 관련된 정보를 특정 업체에 제공하거나 입찰공고 내용과 다르게 업체를 평가한 문제점도 발견됐다. 이 같은 부실투자로 인해 2012년 10월 이후 배당금을 받지 못하고 JPS의 경영실적이 악화되면서 1753만달러의 손상차손이 생겼다고 감사원은 지적했다. 이 때문에 동서발전은 결국 해당 지분 전체를 2017년부터 전량 매각하는 절차에 나설 예정이다. 이에 대해 감사원은 동서발전이 손해를 끼친 이 전 사장과 당시 사업 담당자에게 손해배상 책임을 검토하는 등 손실을 보전할 방안을 마련할 것을 산업통상자원부에 요구했다. 한편 지난 2월 국회가 요구한 이번 감사 처리와 관련해 앞서 일부 야당 의원들은 감사결과 보고가 늦어지고 있다는 점을 지적하면서 문제를 제기하기도 했다
'진짜사나이' 신병 5인방, 특이 캐릭터 종합선물세트	http://news.naver.com/main/read.nhn?mode=LSD&mid=shm&sid1=106&oid=109&aid=0002914280	정유진 기자 신병 5인방이 각기 다른 캐릭터로 웃음을 줬다. 자신감이 넘치든 넘치지 않든 어딘지 모르게 고달픈 신병들의 삶은 웃기고도 슬펐다. 뿐만 아니라 신병들은 5명 모두 누구 하나 빠짐없이 특이한 캐릭터를 갖고 있어 앞으로를 기대하게 만들었다.26일 오후 방송된  예능프로그램 일밤진짜사나이이하 진짜사나이에서는 신병으로 합류한 유준상 임형준 김동현 문희준 육성재의 고군분투가 그려졌다. 이날 신병 5인방은 각기 다른 매력으로 웃음을 줬다. 단연 돋보이는 것은 유준상. 46세로 최고령 훈련병인 유준상은 자신이 나온 이기자 부대로 신병 훈련을 간다는 사실에 긴장감과 즐거움을 동시에 내비쳤다. 그 누구보다 자신감이 충만해 기대감을 자아냈던 그는 다른 훈련병들을 챙겨주는가 하면 이기자 개구리는 먹으면 안 된다 발성 연습을 해보자며 군대 생활에 도움이 될만한 잡지식을 설파하며 동료 훈련병들을 이끌었다. 뿐만 아니라 그는 체력 측정에서도 팔굽혀펴기를 80개 해내며 프로 운동선수인 김동현 다음으로 좋은 성적을 거둬 눈길을 끌었다. 유준상이 담임 선생님 같고 아빠 같은 매력으로 훈련병들을 이끌었다면 그와 대척점에 서 있는 인물은 임형준이었다. 18개월 방위 출신이라는 임형준은 왠지 모르게 짠한 눈빛으로 안타까움을 자아냈다. 특히 그는 하루라도 현역으로 살아 보고싶다며 젊은 시절 누리지 못했던 군생활을 누려 보고자 하는 의지를 내비쳐 슬픈 배경 음악과 어울리는 분위기를 조성했다. 이어 김동현은 자랑스럽게 K.O패를 당해서 강해지기 위해 입소했다며 프로 파이터답게 패기 넘치는 모습을 보였다. 그는 체력 측정에서 제일 우수한 성적을 얻었을 뿐 아니라 다른 이들을 위축되게 만드는 건장한 체격으로 에이스 병사의 자질을 보였다. 그러나 그런 그에게 반전 면모가 있었다. 각개전투에서 벌레를 보고 치우며 소녀 감성을 드러낸 것. 반전되는 캐릭터가 웃음을 줬다. 문희준은 처음부터 두 번 입대를 하는 것에 대해 남다른 기대와 두려움을 드러냈다. 그는 록으로 인해 악플 세례를 받았던 과거를 허심탄회하게 이야기하며 웃음을 줬고 스스로를 드라이문이라 부르며 머리 스타일에 대해 확고한 신념을 보였다. 더불어 문희준은 저질체력으로 고생을 했다. 허리 디스크와 무릎이 좋지 않은 그는 각개전투에서 아픔을 참고 훈련에 참여하다 조교로부터 많은 지적을 받아 마음고생을 했다. 결국 유준상의 도움으로 그는 의무실에 갈 수 있게 됐고 의외로 자상하게 챙겨주는 조교의 마음 씀씀이에 감동한 모습을 보이기도 했다. 꽃미남 육성재는 시도때도 없이 터지는 웃음과 다나까 말투로 인해 고생했다. 아이돌 가수 답게 자연스럽고 해맑은 미소를 가진 그는 그로 인해 조교 및 교관들로부터 진지하지 못하다는 지적을 받았고 미소를 보일 때마다 혼이 나야했다
