야당, 전면투쟁·철야농성…여당, 민생행보 확대	http://news.naver.com/main/read.nhn?mode=LSD&mid=shm&sid1=100&oid=056&aid=0010064613	새정치민주연합이 세월호 특별법 협의를 위한 여야와 유가족 3자 협의체를 만들기 위한 전면적인 투쟁에 돌입했습니다.새누리당은 내일 세월호 유가족들을 다시 만나는데 합의 가능성도 조심스럽게 나오고 있습니다. 리포트 강경 투쟁을 선언한 새정치연합 의원들이 청와대 앞에서 결의대회를 열었습니다. 박근혜 대통령이 세월호 참사의 진상규명을 외면하고 있다며 청와대를 정면 겨냥했습니다.  녹취 박영선새정치연합 원내대표  국민과의 소통은 대통령이 만나고 싶은 사람만 만나고 만나고 싶을 때만 만나는 것이 국민과의 소통이 아닙니다. 문재인 의원이 단식중인 광화문 농성장과 단식중 입원한 김영오씨 등을 방문하며 투쟁 결의를 다졌습니다. 새정치연합은 오늘밤 소속 의원 전원이 국회 예결위 회의장에서 철야 농성에 들어갔습니다. 야당이 국회에서 숙박하는 것은 지난해 국정원 개혁 투쟁이후 1년만입니다.  새누리당은 야당의 이런 장외투쟁을 강하게 비판하며 독자적인 민생 행보에 나섰습니다. 김무성 대표는 호우 피해를 입은 부산을 긴급 방문해 특별 재난지역 선포를 검토하겠다고 밝혔습니다.녹취 김무성새누리당 대표  국가가 세월호 특별법 문제로 발목이 잡혀서 아무 일도 못하는 것은 말이 안 되죠. 모든 게 현장에 답이 있기 때문에. 새누리당은 3자 협의체 대신 내일 유족들과 2차 면담을 갖고 특별법 문제를 논의합니다
금융노조 내달 3일 하루 총파업…투표 가결	http://news.naver.com/main/read.nhn?mode=LSD&mid=shm&sid1=101&oid=001&aid=0007088408	금융노조 조합원 총파업 투표      최재구 기자  26일 서울 외환은행 본점에서 노조관계자가 금융노조 총파업 찬반 투표에 참여하고 있다. 파업 당일 은행업무 지장 불가피최경환 파업 자제해달라     이지헌 기자  금융권이 14년 만에 총파업을 벌이기로 했다.    내달 3일 하루로 예정된 총파업 전에 노사 교섭 등 특별한 진척이 없는 한 은행 등 이용자의 불편이 빚어질 전망이다.         전국금융산업노동조합금융노조은 내달 3일 하루 총파업 실시를 두고 26일 지부별로 조합원 찬반투표를 벌인 결과 오후 8시 현재개표율 67 투표자의 91가 파업에 찬성해 쟁의행위가 가결됐다고 밝혔다.    총파업은 약 10만명인 조합원 재적인원 중 과반이 투표에 참여해 투표자 과반이 찬성하면 가결된다.    금융노조는 쟁의행위 가결에 따라 27일 여의도 문화마당에서 조합원 5만명 이상이 참가하는 총파업 진군대회를 열고 이어 내달 3일 하루 파업을 벌일 예정이다.    금융노조는 시중은행과 특수은행 금융공기업 카드사 등 37개 금융기관을 소속 지부로 두고 있다.    총파업이 실행되면 은행 등 영업점의 정상적인 영업이 어려워 소비자의 불편이 예상된다.     다만 관리자와 비조합원을 중심으로 부분적인 영업은 이뤄질 것으로 보인다.    노조는 총파업 가결에 앞서 26일 전국 은행 영업점에 총파업을 알리는 대국민 안내문도 붙였다.    노조는 안내문에서 관치금융의 그늘 아래 금융산업의 안정성이 심하게 훼손되고 정부의 반노동 정책 아래 근로조건과 고용안정이 위협받는 상황을 좌시할 수 없다며 이번 파업으로 금융기관을 이용하는 데 불편을 초래하게 된 점에 깊이 양해를 구한다고 밝혔다.    노조는 이날 투표의 찬성률이 90를 넘은 데 따라 내달 3일에는 7만여명이 실제 파업에 가담할 것으로 기대하고 있다.    노조 관계자는 KB금융 징계 사태와 외환하나은행 합병을 비롯해 현안이 걸려있지 않은 지부가 없을 정도라며 이런 일련의 사태들이 금융노동자들의 총파업 투쟁에 기름을 부은 것이라고 말했다.    한편 최경환 경제부총리 겸 기획재정부 장관은 이날 김문호 금융노조 위원장을 만나 파업 자제를 요청했다.    배석자 없이 이뤄진 오찬 회동에서 김 위원장은 금융권 노동 현안에 관한 금융노조의 입장을 전달하고 파업 자제 요청에 대해서는 거부 의사를 전했다.    같은 시각 홍완엽 금융노조 수석부위원장은 이기권 고용노동부 장관과의 간담회에 참석 총파업 관련 노조의 요구사항을 전달하기도 했다.    금융노조는 현재 관치금융 철폐 및 낙하산 인사 저지 금융산업 재편 등 구조조정 분쇄 정부의 노사관계 개입 분쇄 및 복지축소 저지 고용안정 및 근로조건 개선 등을 요구하고 있다.    교섭에 진척이 없으면 무기한 쟁의행위에 돌입하고 10월과 11월에 2차 3차의 총파업을 벌인다는 계획이다.    노조는 지난 4월부터 18차례에 걸쳐 임단협 교섭에 나섰으나 성과가 없자 교섭결렬을 선언했고 지난달 23일 중앙노동위원회 조정이 종료되고서 총파업을 결의했다.    금융노조는 앞서 2000년 7월 정부 주도의 인위적 합병에 반대하며 24개 사업장 6만5천여명이 참여하는 총파업을 벌인 바 있다.    2012년에는 91.3의 찬성률로 총파업을 가결했지만 실제로 파업을 하지는 않았다
'경찰관 모욕죄' 현행범 체포…공권력 확립일까 남용일까	http://news.naver.com/main/read.nhn?mode=LSD&mid=shm&sid1=102&oid=028&aid=0002244041	경찰 정상적 공무집행 위해 필요체포중 인권침해 진정 작년 33건사후처벌 가능공권력 남용 비판ㄱ씨는 지난해 12월 불법주차 차량을 이동시키라는 경찰 순찰차량의 방송을 들었다. 술집에서 생일파티를 한 뒤 2차로 클럽이 밀집한 지역으로 걸어가던 ㄱ씨는 이를 보고는 아 . 도 아니고 저렇게 떠든다고 들리겠냐고 욕을 했다. 클럽에서 춤추는 사람들이 방송을 들을 리 없는데도 방송을 하는 경찰을 조롱한 것이다. 잠시 뒤 경찰관 2명이 자신들을 모욕했다며 ㄱ씨를 현행범으로 체포했다. 경찰관을 모욕했다는 이유로 현행범으로 체포되는 사례가 늘고 있다. 경찰은 공권력의 권위 실추를 막기 위해 경찰관 개인의 인격을 모욕하는 행위를 처벌할 수밖에 없다는 입장이지만 감정적 대응이 공권력 남용을 부추긴다는 반론도 만만치 않다. 26일 국가인권위원회의 자료를 보면 경찰관을 모욕한 현행범으로 체포되는 과정에서 인권침해를 당했다는 진정 사건은 2011년 20건에서 2012년 22건 2013년 33건으로 늘었다. 진정 사유로는 체포 요건 미비58.5 과도한 물리력 및 수갑 사용25. 체포 과정에서 상해를 입었다8. 인권위는 모욕 행위자의 신원을 확인해 사후에 처벌할 수 있는데도 법원이 발부한 체포영장 없이 집행하는 현행범 체포는 공권력 남용이라는 입장이다. 최은숙 인권위 조사총괄과 조사관은 형사소송법은 현행범에 대해 누구든지 영장 없이 체포할 수 있도록 하고 있다. 모욕행위를 한 사람을 현행범으로 보는 경찰의 논리대로라면 교통사고가 난 뒤 서로를 모욕하며 싸우다가 서로를 모욕죄로 체포할 수도 있게 된다. 일반인들은 그렇게 하지 않는데 경찰관이 공권력을 지니고 있다는 이유로 체포하는 것은 공권력 남용이라고 했다. 반면 경찰은 이런 식으로라도 모욕행위를 제지할 필요가 있다고 주장한다. 우상진 송파경찰서 가락지구대장은 인권위에 진정이 들어간 사건들을 보면 경찰관이 부적절하게 조처한 것도 있어 보인다. 하지만 대개는 지속적으로 경찰관에게 욕을 하는 경우인데 욕이 끝날 때까지 기다렸다가 사후적으로 고소한다는 것은 실질적으로 어렵다. 정상적 공무집행을 위해 체포를 하는 일이 많다고 했다. 이성기 성신여대 교수법학는 경찰관을 모욕한 사람은 처벌받아야 한다면서도 현장을 녹음하는 등 절차나 적용 요건을 명확하게 해 시민들의 불만을 사는 일이 없도록 해야 하는데 경찰관이 즉흥적이고 감정적으로 대응하면서 문제를 악화시키는 측면이 있다고 했다. 인권위는 27일 서울 중구 을지로1가 인권위 인권교육센터 별관에서 경찰 모욕죄 현행범 체포의 문제점과 개선 방안 토론회를 연다.   진명선 기자 toranihani
'야경꾼일지' 정일우, 화염 속 고성희 구했다 	http://news.naver.com/main/read.nhn?mode=LSD&mid=shm&sid1=106&oid=213&aid=0000536429	김문정 기자 야경꾼일지 정일우가 고성희를 구하러 불길 속으로 뛰쳐 들었다.26일 방송된  야경꾼일지 유동윤방지영김선희 극본 이주환윤지훈 연출에서는 이린정일우 분이 박수종이재용 분을 의심하는 장면이 그려졌다.이린은 자신을 습격했던 자객이 수종의 사람이라 의심했고 고스트 3인방을 시켜 목에 상처 난 자를 찾아달라 부탁했다. 이에 송내관이세창 분은 한 사내를 지목했고 이린은 그를 미행했다.이어 이린은 약재 창고에서 자객과 마주쳤고 혈투를 벌였다. 그때 사담이 푼 화귀불귀신가 약재 창고로 흘러들어왔고 창고는 화염에 휩싸였다.사투를 벌이던 이린은 선반에 깔렸고 화귀를 쫓던 도하고성희 분는 위험에 처한 이린을 구한 뒤 빨리 나가라고 소리쳤다. 이에 이린은 밖으로 나갔고 물을 뒤집어쓴 후 다시 불길 속으로 뛰쳐 들었다.이린은 쓰러진 도하를 보며 너까지 가면 사람들 말이 맞는 거잖아. 내가 불길해서 내 곁을 떠나는 거라고 그 말이 맞는 거잖아. 나 혼자 두지 마.다행히 도하는 눈을 떴고 이린은 도하를 무사히 구출했다. 이어 이린은 내 곁에 있어줘서 고맙다.며 애틋한 마음을 전해 향후 전개에 기대감을 모았다.한편 야경꾼일지는 조선 시대를 배경으로 귀신을 부정하는 자 귀신을 이용하려는 자 그리고 귀신을 물리치려는 자 세 개의 세력 사이에서 펼쳐지는 이야기를 경쾌한 감각으로 그려낸 판타지 로맨스 활극이다. 매주 월화 밤 10시에 방송된다
준비안된 60세 정년시대…얽히고 설킨 실타래	http://news.naver.com/main/read.nhn?mode=LSD&mid=shm&sid1=102&oid=011&aid=0002564574	장년층 직무개발임금체계 개선 안돼 산업현장 진통 예고 나이직급 동일시하는 문화 지속땐 인사 적체조직 사기저하 등 불러해외기업과 경쟁 갈수록 힘들어져연공서열 따른 고임금 구조 안깨면 청년 고용에 부정적 영향 불가피기업들 늘어나는 비용부담 피하려 비정규직 채용 확대 선호할 수도정년 60세 시대가 바로 코앞으로 다가왔지만 우리나라 기업의 경우 나이가 많은 근로자들에게 어떤 업무를 맡겨야 할지 또 그들에 대한 처우를 어떻게 해야 할지 등에 대한 아무런 준비가 돼 있지 않습니다.국내 대기업의 한 고위관계자는 장년층이 회사 내에서 기존에 맡아오던 일을 계속하게 되면 인력순환이 안 돼 조직은 노쇠화하고 역동성은 떨어지게 된다며 이렇게 되면 40세 이하로 평균연령을 맞춰 민첩성을 높이려는 움직임을 보이고 있는 해외 기업들과 경쟁이 힘들어진다고 강조했다. 그는 그렇다고 후배가 임원 또는 조직의 장이 돼 선배를 지휘 감독하게 되는 경우에 대한 준비가 돼 있느냐면 그것도 아니다라며 나이와 직급을 동일시하는 경향이 있는 우리 사회에서는 그 나이에 아직도 그 직급이냐는 등의 따가운 시선을 보내기 일쑤라고 지적했다.장년층에게 적합한 업무를 개발하지 않은 채 정년만 연장할 경우 인사적체와 그에 따른 조직의 사기 저하도 간과할 수 없는 문제다. 재계의 한 관계자는 우리나라 대기업의 경우 장년층에게 적합한 업무라는 개념 자체가 성립돼 있지 않다며 이 같은 상황에서 법으로 60세 정년을 강제하게 되면 근로자들의 퇴직과 승진 등이 원활히 이뤄지지 않아 인사적체가 가중될 수 있고 이는 조직의 사기 저하로 이어지게 될 것이라고 말했다.윤동열 울산대 경영학부 교수는 연령이 높아질수록 신체능력과 기술 습득 속도 등이 떨어져 노동생산성이 하락한다는 게 일반적인 주장이지만 이를 뒷받침할 만한 실증적인 근거는 미흡한 것이 현실이라면서도 하지만 장년층의 육체적 능력이 상대적으로 청년층보다 떨어지고 문제 해결이나 사고 등 정신적인 능력도 나이가 들면서 다소 감퇴하는 사실마저 부정할 수 없기 때문에 장년층에 맞는 업무를 발굴하려는 노력이 필요하다고 말했다. 일본의 기업들이 이미 오래전부터 장년층에 적합한 업무 개발에 적극 나서고 있지만 우리나라는 아직 이 같은 업무 개발작업에는 손을 놓고 있는 실정이다.장년층의 고임금 문제도 풀어야 할 과제다. 우리나라 생산직 근로자의 연공여러 해 동안 근무한 공로에 따른 임금 격차는 세계에서 가장 크다. 한국노동연구원에 따르면 30년 이상 근무한 근로자와 새내기 근로자의 임금 격차는 3. 문제는 이 같은 임금 격차가 직무나 노동 강도 숙련도 등과 무관하게 발생하는 경우가 적지 않다는 점이다. 이를테면 우리나라에서는 같은 업무를 같은 시간에 처리하더라도 근속연수가 많은 근로자가 더 많은 임금을 받는다. 생산직 근로자의 경우 나이가 들면서 육체적 능력이 저하돼 생산성이 떨어지더라도 상황은 달라지지 않는다. 55세 이상 고령 근로자의 임금은 34세 이하 근로자의 3배 이상이지만 생산성은 34세 이하 근로자의 60 수준이라는 게 한국노동연구원의 분석이다. 노동생산성과 괴리된 임금 체계는 비단 생산직 근로자에게만 적용되는 얘기는 아니다.장년층의 고임금은 청년과 경력단절여성 중간퇴직자 고용 확대에 걸림돌이 될 것이라는 주장도 제기되고 있다. 일각에서는 장년층 고용 확대가 청년고용 축소로 이어진다는 실증적 근거가 없다는 이유로 반론도 제시하고 있기는 하지만 적어도 기업현장에서는 임금 조정 없는 정년 60세 의무화는 청년고용에 부정적인 영향을 미칠 것으로 보고 있다. 실제로 대한상공회의소가 지난 4월 300여개 기업을 대상으로 정년 60세 의무화에 따른 기업 애로 및 정책과제를 조사한 결과에 따르면 전체 응답업체의 56.1가 정년 60세가 의무화되면 신규 채용이 감소할 것이라고 답했다. 이에 따라 대한상의는 임금 체계 개편 등 대책이 마련되지 않으면 청년과 중장년들의 일자리 경합은 불가피하기 때문에 서둘러 대책을 마련할 필요가 있다고 강조한다. 이처럼 직무구조와 임금 체계가 경직돼 있다 보니 기업들 사이에서는 정년 연장 전에 근로자들을 조기퇴직하도록 유인하는 움직임도 감지되고 있다. 이철희 서울대 경제학부 교수는 기업의 임금 체계와 직무구조가 경직돼 있어 근로자의 생산성이 떨어져도 이에 맞게 임금과 직무를 조정하기 어려운 측면이 있다고 지적했다. 기업들 입장에서는 근속연수가 높아질수록 고용비용이 급증하게 되는 근로자들의 희망퇴직을 유도하고 사내 하도급을 활용하는 게 유리하다는 판단을 할 수밖에 없는 구조인 것이다.이 같은 고용환경은 결국 은퇴 후 비정규직 신분으로 노동시장에 참여하는 근로자들을 양산하는 결과를 낳고 있다. 경제협력개발기구OECD에 따르면 한국 남성들은 공식 은퇴연령과 무관하게 71세까지 일을 하고 있는 것으로 나타났다. 퇴직 후에도 새로 일자리를 구한다는 의미다
20대 젊은층 자동차 안 산다	http://news.naver.com/main/read.nhn?mode=LSD&mid=shm&sid1=103&oid=029&aid=0002239409	신규 구매비율 4년연속 감소 렌터카쉐어링 등 이용 늘어 연령대별 맞춤형 전략 필요20대 젊은 층의 자동차 구매 비율이 4년 연속 줄고 있다. 자동차 업계 입장에서는 맞춤형 접근이 필요한 상황이다.26일 한국자동차산업협회 2014년 상반기 국내 자동차 신규등록 현황을 살펴보면 20대 연령대 판매 비중은 지난해 9. 판매량 역시 지난해 같은 기간 5만5670대에서 올해 5만4594대로 소폭 감소했다. 반면 30대 이상 연령대의 판매량은 모두 늘었다.7 수준에 이르렀던 20대 자동차 신규등록 점유율은 2012년 9.0로 매년 1포인트 가량 빠르게 줄고 있는 추세다.협회는 이와 관련 청년실업 가계부채로 인한 소비심리 위축 영향이 20대에서 상대적으로 크게 나타난 반면 대체수요와 세컨드카 수요가 많은 40대 이상에서는 증가세를 보였다고 배경을 설명했다.하지만 단순하게 20대 수요층의 지갑이 닫혔다고만 보긴 어려운 측면도 있다. 업계 일각에서는 개성과 실용성을 추구하는 20대 수요자들이 구매보다는 렌터카나 카쉐어링 등 다양한 방법을 찾고 있다는 분석도 나오고 있다. 실제 전국자동차대여사업조합연합회에 의하면 국내 렌터카 시장은 운행대수 기준으로 2004년 이후 연 평균 16.3의 성장세를 보이고 있으며 특히 개인 장기 렌터카의 경우 2011년부터 3년간 연평균 65. 20대 개인 고객은 주로 단기 렌터카를 주로 이용하지만 최근에는 35년 단위의 장기 렌터카를 이용하는 비율도 늘고 있다고 렌터카 업계 관계자는 설명했다. 완성차 업계 역시 20대 수요층 공략을 위해 다양한 디자인의 소형 세단을 선보이고 홍대 등 2030세대 밀집 지역에 수입차 전시장을 개설하는 등 다양한 노력을 하고 있다.SK네트웍스 관계자는 젊은 고객들이 시내에서 자주 볼 수 있는 차보단 개성 있는 차를 더 선호하고 있으며 자동차에 대한 인식 역시 소유에서 이용으로 바뀌고 있다며 임대차 업계에서도 다양한 장단기 제품을 마련해 시장 공략을 강화할 것이라고 말했다
영업정지에도 이통사들 9월 실적 크게 오른다	http://news.naver.com/main/read.nhn?mode=LSD&mid=shm&sid1=105&oid=277&aid=0003318699	영업정지 보조금 대란 없을 것 9월 이통사 실적 오를 전망영업일수 적고 분리공시 도입 등 긍정적아시아경제 이초희 기자단말기 유통구조 개선법이하 단통법 시행이 한 달여 앞으로 다가온 가운데 통신사들의 9월 실적이 크게 오를 것이란 전망이 나왔다.27일부터 불법보조금에 대한 제재 조치로 LG유플러스의 신규 영업이 정지되지만 9월 보조금 대란이 현실화될 가능성은 낮다는 분석도 제기됐다.김홍식 하나대투증권 애널리스트는 26일 9월 통신서비스 업종의 실적 기대감이 고조된다며 9월까지도 강한 주가 상승이 지속될 것이라고 말했다.이 같은 분석에는 78월 시장 안정과 9월 영업정지 여파로 3분기 통신사 실적 호전이 기대되기 때문이다. 또 분리 공시 도입 등 단통법 하위 고시 제정 방향 긍정적인 데다 제 4이동통신 사업자 등장 가능성이 희박한 것도 영향을 미칠 것이라고 분석했다.요금 인가제 폐지 가능성 고조로 인위적인 통신 요금 인하 가능성이 낮아진 것이 요인으로 제기됐다.영업정지 사태로 인한 보조금 대란 현실화 가능성은 낮다고 전망했다. 김 애널리스트는 다른 통신사의 영업정지 기간 중 보조금을 쏟아부을 수 있다는 걱정을 할 수 있지만 현실적으로는 방송통신위원회의 대리점 감독 강화 시기이어서 보조금 폭탄 투여가 쉽지 않다고 말했다.이어  918일 이후 공격적인 마케팅에 나선다 해도 단통법 시행 전까지 영업일수가 많지 않은 데다 국내 아이폰6 출시가 9월이 아닌 10월이 유력한 것도 긍정적이라고 진단했다.한편 정보통신기술ICT 육성론으로 출발한 박근혜 정부의 통신산업 규제 변화가 무선에서 유선 부문으로 확산될 가능성이 높다고 주장도 제기했다.그는 정부가 콘텐츠플랫폼 산업 육성을 위해 공격적인 유선 자본투자CAPEX 집행을 유도하고 방법론상 인터넷 종량제 도입 방송통신 융합 상품 할인율 제한을 추진할 가능성이 높아 주목할 만하다고 말했다
