'부산급 폭우' 덮치면 서울도 속수무책	http://news.naver.com/main/read.nhn?mode=LSD&mid=shm&sid1=102&oid=022&aid=0002705077	현재 하수처리시설 30가 한계 시간당 95 대비 하수관 건설2020년 이후 돼야 완공 가능 철저한 예보 시스템만이 최선지난 25일 부산에 시간당 130의 폭우가 쏟아지면서 도시 기능이 마비됐다. 1000만명 이상이 모여 사는 서울에 이 같은 물폭탄이 쏟아진다면 어떻게 될까.전문가들은 서울이 다른 지역보다 상대적으로 폭우 대비가 잘되어 있지만 부산과 마찬가지로 단시간에 집중 호우가 쏟아질 경우 침수 피해를 막기는 어려울 것이라고 내다봤다. 이상기후로 매년 집중호우의 발생 빈도가 느는데 하수시설은 단기간에 증설할 수 없는 만큼 기존 시설에 대한 정비를 강화하고 경보 체계를 점검해야 한다는 지적이 나온다.26일 기상청에 따르면 2000년대 들어 시간당 강수량이 30 이상인 집중호우의 발생 빈도가 1980년대보다 약 30 증가했다. 땅의 가장 윗부분인 표토층이 얇아 빗물에 취약한 우리나라의 지질 특성상 폭우가 쏟아지면 3년 전의 우면산 산사태 같은 대형 참사가 재발할 수 있다.서울시는 2009년 시간당 95의 비를 견딜 수 있는 하수관을 설치한다는 계획을 세웠지만 부산에 내린 시간당 130의 강수량에는 턱없이 부족한 수치다. 그나마 서울시가 매년 2500억원가량의 예산을 들여 공사를 진행하고 있지만 현재 공정은 10 미만으로 2020년 이후나 돼야 공사가 완료될 것으로 예상된다.조원철 연세대 방재관리안전센터장은 현재로서는 평균적으로 하수관이 시간당 강수량 30까지 견딜 수 있다고 말했다.또 다른 보강 대책으로 서울시는 침수 취약 지역인 광화문과 강남 신월 등 34곳에 빗물저류조와 펌프장을 설치할 계획이지만 이것 역시 2021년 완공을 목표로 하고 있다. 서울에 부산과 같은 집중호우가 쏟아질 경우 현재로서는 그 피해를 막기 어렵다는 얘기다.서울메트로는 1998년 이후부터 서울역 등 428개역에 계단턱 높임 공사를 진행하고 차수판 492개를 설치했다. 또 지하철역 바깥에 폐쇄회로CCTV를 설치해 역무실에서 비가 얼마나 오는지를 살피기 때문에 지하철 침수 가능성이 작다고 보고 있다.하지만 이 같은 대책만으로는 흘러넘치는 빗물을 막기는 어려워 보인다. 2010 2011년에는 시간당 75 내린 비에 1호선 4호선 일부 구간의 지하철 운행이 중단됐다. 또 상습 침수지역인 2호선 강남역은 시간당 20의 비만 내려도 침수될 수 있다. 지난달에는 10분 동안 내린 소나기에 2호선 홍대입구역이 잠겨 시민들이 불편을 겪었다. 이상기후로 인한 집중호우에 서울의 도시 기능도 마비를 피하기 어렵다는 정황이 곳곳에서 보인다. 다만 서울 지하철의 경우 일부 구간이 침수된다고 해도 운행이 전면 중단될 가능성은 작다. 서울메트로 관계자는 회차할 수 있는 구간이 곳곳에 있어 일부 구간이 침수된다고 해서 모든 운행이 중단되는 것은 아니다라고 설명했다.2011년 물에 잠긴 대치동 시간당 최고 100가 넘는 폭우가 쏟아진 서울 강남구 대치동 사거리가 완전히 물에 잠겨 차량 지붕만 물 위로 드러나 있다.세계일보 자료사진전문가들은 현재 상황에서 폭우 피해를 최소화하기 위해서는 철저한 방재 및 예보 시스템을 마련하고 국민을 대상으로 대처법 등을 적극 홍보해야 한다고 조언한다.조 센터장은 부산의 경우 재난 시 대피 교육이 제대로 돼 있지 않아 피해가 더 컸다며 사고가 나도 나는 안 죽고 안 다친다는 안전불감증을 버려야 한다고 강조했다.대구보건대 최영상 교수소방안전관리과는 지자체나 안전관리 기관에서 침수지도를 만들어서 주민들에게 보다 구체적인 지침을 줘야 한다며 한 차례 비가 많이 오니 주의가 필요하다는 문자메시지만 보낼 것이 아니라 강수량과 단계별 행동요령 등을 상세히 공지해야 한다고 말했다
WHO, 전자담배 규제 촉구…공공장소·사무실 금연해야	http://news.naver.com/main/read.nhn?mode=LSD&mid=shm&sid1=104&oid=001&aid=0007088464	DB전자담배 광고판촉 금지와 과일향 등 첨가 금지 권고     제네바 류현성 특파원  세계보건기구WHO는 26일현지시간 전자담배가 건강에 위해를 줄 수 있다고 밝히고 전자담배에 대한 국제적 규제를 촉구했다.     WHO는 이날 스위스 제네바 유럽 유엔본부에서 기자회견을 통해 전자담배가 건강에 미치는 영향을 종합적으로 분석한 연구보고서를 발표하고 청소년과 비흡연자를 대상으로 한 전자담배 광고와 판촉 후원 등을 엄격하게 규제해야 한다고 밝혔다.     이에 앞서 지난 2012년 11월 서울에서 열렸던 제5차 담배규제기본협약FCTC 당사국 총회에서 회원국들은 전자담배가 건강에 미치는 영향에 대해 분석을 해줄 것을 WHO에 요구한 바 있다.     WHO는 보고서에서 전자담배 제조업체들이 전자담배가 금연 보조제이며 건강에 좋다는 주장을 하고 있으나 과학적 증거가 확보되고 규제당국의 허가를 받을 때까지 이 같은 주장을 할 수 없도록 해야 한다고 강조했다.     또한 간접 흡연자의 피해를 줄일 수 있도록 흡연이 금지된 공공장소나 사무실 같은 실내에서 피울 수 없도록 하고 청소년을 겨냥해 전자담배에 과일이나 사탕 또는 술과 같은 향을 첨가하는 것도 금지할 것을 권고했다.     아울러 전자담배가 니코틴 중독과 호흡기 질환을 유발하고 눈코목 등을 자극하며 니코틴 노출로 임신에도 부정적 효과를 줄 가능성이 있다는 경고를 해야 한다고 주문했다. 또 청소년들에 대한 전자담배 판매를 금지하고 자동판매기 설치도 엄격히 제한해야 한다고 지적했다.     보고서는 전자담배 흡연 시 나오는 기체는 제조업체들이 주장처럼 단순한 수증기가 아니어서 비흡연자나 곁에 있는 사람들이 니코틴이나 폐암을 유발하는 독성물질에 노출되는 정도를 높이고 특히 전자담배의 니코틴은 심혈관 질환이나 암을 유발할 수 있다고 경고했다.     특히 전자담배는 임신 8주 이후의 태아와 청소년에게 위협이 되고 있으며 지난 2008년에서 2012년 사이에 청소년의 전자담배 흡연이 두 배나 증가했다고 말했다.       한편 WHO는 오는 10월 러시아 모스크바에서 FCTC 제6차 당사국 총회를 열어 전자담배 규제 문제 등을 논의할 예정이다
문자메시지만 받았는데 '좀비폰' 된다고?	http://news.naver.com/main/read.nhn?mode=LSD&mid=shm&sid1=105&oid=029&aid=0002239451	안드로이드폰 대상 악성 하트앱 확산 문자 송수신 조작사이버테러 악용 가능성사이버테러 주요 수단으로 사용되던 좀비PC가 좀비폰으로 확대될 양상을 보이고 있다. 좀비폰이 되면 해커가 스마트폰의 권한을 탈취해 개인정보를 빼가는 것은 물론 향후 사이버테러와 같은 대단위 공격에도 악용될 수 있어 매우 위험하다. 26일 한국인터넷진흥원과 관련업계에 따르면 구글 안드로이드 운영체제를 사용하는 스마트폰 이용자들을 대상으로 한 악성 앱이 중국을 중심으로 빠르게 확산되고 있다. 한국인터넷진흥원KISA 침해대응단 침해기술대응팀은 중국에서 문자메시지를 통해 급속도로 유포되는 하트앱이라는 악성 앱이 발견됐다고 밝혔다. 이 악성앱은 안드로이드폰 주소록을 탈취한 뒤 해당 주소록에 있는 사람에게 악성앱 설치를 유도하는 문자메시지를 보내게 된다.특히 이 악성앱을 설치하면 문자 송수신 기능을 해커가 마음대로 조작하는 등 폰을 좀비폰으로 만들어버린다. 해당 앱을 설치할 때 com.Trogoogle이라는 트로이안 악성코드가 이용자가 알지 못하는 사이에 설치 실행되는데 이 프로세스를 통해 해커가 문자메시지나 또 다른 방법으로 해당 폰을 제어하는 등 좀비화가 되는 것이다아직 국내에 감염된 사례는 보고되지 않았다. 하지만 전문가들은 좀비폰이 될 경우 해커가 스마트폰을 마음대로 조종할 수 있어 상당히 위험하다고 경고하고 있다. 실제로 스마트폰이 국내에서도 빠르게 확산되면서 보안 전문가들은 스마트폰을 악용한 사이버테러 위협을 제기해왔었다. 임종인 고려대 사이버국방학과 교수는 과거 7.7 분산서비스거부DDoS 이하 디도스 공격이나 3.4 디도스처럼 PC를 악성코드에 감염시켜 좀비PC로 만든 뒤 정부 시스템을 공격하는 사례가 적지 않았다면서 특히 스마트폰의 경우 언제 어디서나 네트워크에 연결돼 있고 PC수준의 컴퓨팅 능력을 갖춘 단말기임에도 PC보다 보안 수준이 낮아 사이버 공격에 악용될 우려가 있다고 설명했다. 스마트폰을 좀비폰으로 만들어버리면 해커의 명령에 따라 정부 시스템은 물론 통신망 교통통제시스템 전력설비 등 국가 기반시설을 공격할 수 있다.앱을 설치할 때 통화 문자 사진 위치정보 등 다양한 폰 기능에 대한 접근 권한을 허락하게 되는데 악성앱의 경우 이용자가 알지 못하는 새 스마트폰에 대한 이러한 권한을 탈취하는 것이다. 예를 들어 악성코드에 감염돼 좀비폰이 된 스마트폰 이용자는 자신이 알지 못하는 새 스마트폰이 스스로 전화를 걸거나 문자를 보낼 수 있다. 만약 해커가 디도스 공격처럼 감염된 좀비폰에게 일제히 소방방재시설로 전화를 걸어라라는 공격 명령을 내린다면 수십만대의 전화가 일제히 소방전화로 연결될 테고 주요 안전대비시설인 소방망이 순식간에 통화량 급증으로 마비되는 사태가 올 수 있는 것이다. 뿐만 아니라 스마트폰의 인터넷 접속기능을 악용해 특정 사이트에 대한 디도스 공격 또한 PC와 동일하게 명령할 수 있다. 익명을 요구한 보안업계 관계자는 모바일에 의한 사이버테러는 언제든 발생할 수 있다. 이미 PC를 겨냥한 악성코드보다 모바일 단말기를 노린 악성코드의 증가량이 압도적으로 높다면서 특히 현재 국내 통신사들은 모바일 보안에 상당히 취약하며 경쟁적으로 구축하고 있는 4G LTE 망에 대한 보안투자도 전혀 하지 않아 사실상 사이버테러에 무방비 상태라고 지적했다. 한편 중국에서 발견된 이 악성앱은 최근 유행하는 소셜데이팅 앱으로 가장해 인연을 소개시켜 준다며 문자를 받은 사람을 현혹하는 것이 특징이다. 문자를 받은 사람은 지인의 번호로 문자가 왔기 때문에 의심없이 앱을 내려받는 사례가 많은데 이렇게 감염된 사람은 또 다른 자신의 주소록 목록 사람들에게 자기도 모르게 악성앱 설치 문자를 보내게 된다. 앱 설치시 최초 99개의 지인번호로 악성 앱 설치를 유도하는 URL이 포함된 문자메시지를 보내게 되며 폰 안에 있는 모든 개인정보가 해커에게 문자로 전송된다
'연애의 발견' 에릭, 이제보니 의외의 순정남	http://news.naver.com/main/read.nhn?mode=LSD&mid=shm&sid1=106&oid=213&aid=0000536430	이혜미 기자 연애의 발견 에릭이 의외의 순정남으로 분했다.26일 방송된 KBS2 월화드라마 연애의 발견 4회에서는 하진성준과 아림윤진이의 관계를 오해 여름정유미이 상처 받을까 전전긍긍하는 태하에릭의 모습이 그려졌다.옛 남자 태하와의 재회 후 여름은 그와의 관계에 선을 긋고 있는 바. 태하와 사업파트너로 맺어졌지만 그뿐이었다. 반대로 그와의 관계를 의심하고 있는 하진은 둘의 다정한 모습을 보곤 착잡해 했다. 이어 여름에게 전화를 걸어 반응을 살폈으나 여름은 오해의 여지를 남기지 않았다. 태하와 식사 중이라고 솔직하게 고백한 것. 그러나 하진은 여전히 복잡한 심경을 감추지 못했다.이런 와중에 오해까지 싹 텄다. 여름을 하진의 성형외과까지 데려다준 태하가 포옹 중인 하진과 아림을 발견한 것. 여기엔 감동적인 사연이 있었다. 하진과 보육원 인연인 흉터 소녀가 바로 아림. 애초에 하진은 그녀의 흉터를 재건시켜주고자 성형외과 의사가 됐다. 아림과의 재회 후 하진은 무료로 성형수술을 시켜주겠다 나섰으나 아림은 그 제안을 정중하게 제안했다. 대신 흉터로 고통 받는 소년과 할아버지의 수술을 해달라고 청한 것. 하진이 이를 흔쾌히 받아들이자 아림은 그를 끌어안고 기뻐했다.그러나 이 같은 사정을 알 리 없는 태하는 둘의 관계를 오해했다. 여름이 볼까 재빨리 화제를 바꾸기까지 했다. 이어 태하는 너 남자보는 눈이 그렇게 없어 나쁜 남자 나 때문에 질렸을 텐데. 남자 보는 눈은 남자가 더 정확해. 그 남자는 아니야라고 조언했다. 이에 여름은 하진을 욕하지 말라며 불쾌한 반응을 보였다. 하진에 여자 있나 봐요 한여름 씨가 알기 전에 정리하는 게 어때요 아님 한여름 씨를 정리하던가라 직구를 날렸다. 이에 분노한 하진이 주먹을 휘두르면서 육탄전이 발발 한층 고조된 다각관계를 예고했다
"대우, 밉보여 해체"vs"터무니없다"…15년 만의 진실공방	http://news.naver.com/main/read.nhn?mode=LSD&mid=shm&sid1=101&oid=214&aid=0000410595	굴지의 대기업 회장에서 돌연 비운의 총수로 전락했던 김우중 회장.김우중 전 회장은 대우그룹 해체에 대한 과거사를 밝히기도 했는데 논란이 적잖이 일고 있습니다. 리포트 김우중 전 회장이 옛 대우 임직원들이 모인 행사에 모습을 드러내 회고록 출간 배경을 밝혔습니다. 김우중전 대우그룹 회장 시간이 충분히 지났으니 적어도 잘못된 사실을 바로잡아야.인사말을 하던 중 김 전 회장은 감정이 북받친 듯 눈물을 보였습니다. 김우중전 대우그룹 회장 앞만 보고 성취를 향해 열심히 달려왔습니다.지난 1967년 세운 자본금 500만 원의 대우실업을 자산 76조 재계 2위의 그룹으로 키웠지만 1999년 외환위기로 그룹은 해체됐고 자신은 해외로 떠났습니다.김 회장의 비공개 증언을 모아 대담집을 집필한 신장섭 싱가포르국립대 교수는 대우는 지나친 확장에 따른 부실로 해체된 게 아니라고 주장했습니다.이른바 기획해체론으로 김 전 회장이 IMF 당시 경제관료들의 무리한 국내산업 구조조정 방식에 반대하다 밉보여 자금줄이 막히고 자산이 헐값 매각돼 주저앉았다는 겁니다.당시 이헌재 전 금융감독위원장과 강봉균 전 재정경제부 장관을 정면으로 겨냥한 발언입니다. 김우중전 대우그룹 회장 과연 대우 해체가 합당했는지 명확히 밝혀지기를 기대하기 때문입니다.강 전 장관은 터무니없다며 반박했습니다.당시 경제관료들은 대규모 실업사태를 우려해 대우를 살리려 애썼고 GM과의 제휴협상 결렬도 당시 정부가 방해할 이유가 없었다고 선을 그었습니다
알코올 중독자들 "주류회사·정부가 책임져라" 21억 소송	http://news.naver.com/main/read.nhn?mode=LSD&mid=shm&sid1=102&oid=214&aid=0000410587	알코올 중독자들이 집단으로 소송을 제기했습니다.지나친 술 광고 때문에 알코올 중독에 빠졌으니 정부와 주류회사가 배상하라는 건데 담배에 이어 주류까지 법정공방으로 이어지고 있습니다. 리포트 일주일에 서너 번 이상 많을 때는 소주 5병도 넘게 술을 마셨다는 50대 김 모 씨.10년 전 알코올 중독 진단을 받았습니다.중독을 치료하기 위해 병원을 다녀야 했고 사회생활에도 심각한 문제가 생겼습니다. 김 모 씨 여러 가지 이상한 증상이 많이 일어나요. 귀에 뭐가 들린다든지 눈에 이상한 것이 보이고.김 씨는 자기와 비슷한 처지의 알코올 중독자 20여 명과 함께 정부와 주류회사를 상대로 소송을 냈습니다.이들은 주류 회사들이 대대적인 술 광고를 하면서 술병에는 알아보기 힘들 정도로 작은 글씨로 경고 문구를 써놨다면서 술에 대한 폐해를 전혀 인식하지 못했다고 주장했습니다.이에 더해 정부는 알코올 남용과 중독 문제 등에 대해 오직 소비자에게만 술을 절제할 책임을 떠맡겼으니 주류회사와 함께 치료비와 위자료 등으로 모두 21억 원을 배상하라고 요구했습니다
美 '테러단체와 협상 불가론' 흔들리나	http://news.naver.com/main/read.nhn?mode=LSD&mid=shm&sid1=104&oid=022&aid=0002705134	기자 참수 계기 자국민 보호 목소리 높아테러단체에 몸값을 주면 국민을 더욱 비싼 상품으로 만들 뿐이다.유럽은 몸값을 주고 국민을 구해오는데 미국만 원칙을 지키나미국사회에서 테러단체에 대한 몸값 지급 필요성을 놓고 논쟁이 일고 있다. 미 언론인 참수사건을 계기로 테러단체에 몸값을 지급해서라도 미국인을 구해내야 한다는 주장이 제기되고 있다. 미국 정부는 테러단체와 협상도 몸값 지급도 하지 않는다는 원칙을 거듭 밝히고 있다.조시 어니스트 백악관 대변인은 25일현지시간 정례브리핑에서 전날 프리랜서 기자가 테러단체에서 풀려난 것과 관련 석방을 주선한 카타르 정부에 몸값 지급을 요청하지 않은 게 확실하다. 미국의 오랜 정책을 지켜줄 것을 요청했다고 밝혔다. 2012년 10월 알카에다 시리아 지부 격인 알누스라 전선에 납치됐던 미 프리랜서 기자 피터 테오 커티스45가 전날 갑작스레 석방되면서 몸값 지급설이 유력하게 제기됐었다. 특히 이슬람 수니파 무장세력인 이슬람국가IS가 몸값으로 1억유로약 1360억원를 요구한 것으로 알려진 미국인 기자 제임스 폴리의 참수사건과 비교되면서 이 같은 소문은 기정사실처럼 받아들여졌다.이라크의 수니파 무장반군 이슬람국가IS가 19일현지시간 유튜브 등에 공개한 동영상에서 복면을 한 IS 대원이 흉기를 손에 든 채 미국인 기자 제임스 라이트 폴리 옆에서 미국을 향한 경고 메시지를 보내고 있다. 사진  유투브 동영상 캡쳐미국은 197080년대 이란과 인질 석방을 협상하면서 몸값이나 무기를 지급할 경우 테러단체 세력을 키울 뿐이라는 교훈을 얻은 이후 테러단체와 협상을 하지 않는다는 원칙을 이어오고 있다. IS에는 미국인 인질 3명이 추가로 억류돼 있는 것으로 알려졌다.미국이 테러단체와 협상을 아예 외면하는 건 아니다. 지난 5월 말 카타르 정부 주선으로 관타나모 수용소에 수감 중인 탈레반 포로 5명을 풀어주는 대가로 탈레반에 잡혀 있던 보 버그달 병장을 구해냈다. 하지만 미국 정부는 포로가 된 군인과 민간인에는 차이가 있다는 입장이다. 마리 하프 미 국무부 부대변인은 21일 몸값 지급은 미국 정부가 활동을 억제하려는 단체들에 자금지원을 하는 꼴이며 오히려 더 많은 납치를 부추길 뿐이라고 지적했다.유럽 국가들은 공식적으로 부인하지만 물밑에서 테러단체와 협상해 인질을 구해오는 게 공공연한 비밀이다. 영국은 1991년 분리독립을 주장하던 아일랜드공화국군IRA이 다우닝가를 테러한 이후에도 IRA와 비밀 막후채널을 유지했다. 독일 정부도 2003년 말리의 무장단체에 납치된 자국민 석방 대가로 인도적인 지원 명목으로 500만유로약 70억원를 지급했다. 올봄에는 프랑스 언론인 4명과 스페인 언론인 2명이 IS에 억류됐다가 몸값 지불 조건으로 풀려나기도 했다. 뉴욕타임스NYT는 알카에다와 그 연계세력이 2008년 이후 납치를 통해 주로 유럽 국가로부터 1억2500만달러의 수입을 올렸다고 보도했다. 2008년 피랍됐던 미 언론인 데이비드 로드는 최근 미국과 유럽의 상반된 대응이 유럽인 인질은 구출되고 미국인 인질에게는 암운이 드리우는 차이를 낳고 있다면서 미국도 테러리스트와 협상하지 않는다는 원칙을 이제 바꿀 필요가 있다고 지적했다
"쌀·돌무더기 샤워'도 등장…얼음물 샤워 '변형'	http://news.naver.com/main/read.nhn?mode=LSD&mid=shm&sid1=104&oid=001&aid=0007087892	인도와 팔레스타인 가자지구서각각 빈곤문제참상 알리자     유창엽 기자  루게릭병 인지도를 높이고 기부를 호소하기 위한 이른바 얼음물 샤워가 지구촌에서 빠르게 번지는 가운데 인도와 팔레스타인 가자지구에선 이 캠페인의 변형이 속속 등장했다.    인도에선 물 대신 쌀 한 양동이를 빈민에게 주자는 아이디어가 나왔고 가자지구에서는 이스라엘 측 공격에 따른 참상을 알리기 위해 허물어진 건물이나 도로의 돌무더기를 이용하는 캠페인이 시작됐다.    인도 남부도시 하이데라바드에 사는 만주 라타 칼라니디라는 여성은 쌀을 양동이에 담아 주변 빈민에게 주자는 내용의 글을 최근 페이스북에 올렸다고 dpa통신이 26일 인도 언론매체를 인용 보도했다.    칼라니디는 이는 물을 절약하고 배고픈 사람들을 먹일 수 있어 우리에게 알맞은 빈민지원 방법이라고 말했다.    또 캠페인 참가자들이 가장 가까운 공공병원에 약을 기부할 수도 있다고 덧붙였다.    12억 인구의 인도에서는 빈부격차가 격심한 실정이다.    이스라엘과 팔레스타인 무장정파 하마스 간 교전으로 큰 피해를 보는 있는 가자지구에서는 참상을 지구촌에 알리기 위해 얼음물 샤워를 빗댄 아이디어가 나타났다.    이 지역 주민 사이에서 참상을 알리고자 돌무더기를 담은 양동이를 머리에 붓는 퍼포먼스들이 등장했다고 영국 일간 데일리메일 인터넷판이 이날 보도했다.    폭격에 망가진 가자지구 도로에서 처음으로 돌무더기 샤워를 찍은 현지 언론인 아이만 알 알로울은 영상에서 가자지구의 참상을 세계에 알리기 위해 뭔가 해야했다고 말했다.    알로울은 얼음물 샤워 아이디어도 좋지만 귀한 물을 사용하는 행위를 정당화할 수 없었다면서 물이 있다손 치더라도 얼릴 수 없어 돌무더기 샤워를 구상했다고 덧붙였다.    그의 돌무더기 샤워 영상은 지난 23일 페이스북에 처음 오른 뒤 25일 오전까지 약 2천명이 호응을 보이는 등 인기를 끌고 있다
