"세월호 유가족 뜻 반영한 특별법 제정" 도심 집회	http://news.naver.com/main/read.nhn?mode=LSD&mid=shm&sid1=102&oid=001&aid=0007095546	세월호 특별법 즉각 제정 구호 외치는 집회 참가자들     황광모 기자  30일 오후 서울 광화문 광장에서 열린 세월호 특별법 제정 촉구 830 범국민 대회에서 참석자들이 세월호 특별법 즉각 제정을 촉구 구호를 외치고 있다.     정빛나 채새롬 기자  세월호 가족대책위와 세월호 참사 국민대책위원회는 30일 오후 광화문광장에서 특별법을 제정하라 청와대는 응답하라 국민대회를 개최하고 유가족들의 뜻이 반영된 특별법 제정을 촉구했다.    김병권 가족대책위원장은 유가족과 시민 등 4천여 명경찰 추산 2천여 명이 참석한 이날 집회에서 현재 세월호 특별법 제정은 어려운 상황이다. 가족과 국민의 너무나 당연한 요구가 근거 없는 이유로 더럽혀지고 있다며 하지만 우리가 포기하는 순간 아이들의 희생과 국민의 성원은 헛되어질 것이라고 말했다.    그러면서 이 사회가 더 안전해질 수 있도록 조금만 더 함께 해달라고 호소했다.    집회에는 세월호 특별법 제정을 요구하며 지난 11일 전남 진도 팽목항에서 출발 이날 오후 광화문광장에 도착한 생명과 정의의 도보 순례단 소속 호남신대와 장로회신학대 부산장신대 학생과 교수 등 20여 명도 참석했다.    이들은 590가량 걸으며 착용한 세월호 실종자 10명의 얼굴이 새겨진 노란색 조끼를 가족대책위에 전달했다.    유경근 가족대책위 대변인은 아직도 바다에 갇혀서 돌아오지 못하는 실종자들을 생각하면 일주일 만에 아이를 시신으로나마 되찾은 나는 행복하다는 마음이 들 정도로 마음이 무겁다며 귀하지만 무거운 선물을 받은 만큼 마지막 실종자가 돌아올 때까지 유가족들은 실종자 가족들과 한길을 갈 것이라고 밝혔다. 경찰 세월호 특별법 촉구 행진 저지     황광모 기자  30일 오후 서울 광화문 광장에서 열린 세월호 특별법 제정 촉구 830 범국민 대회를 마친 세월호 희생자 가족들과 집회 참가자들이 청와대로의 행진을 시도하다 청운효자동 동사무소앞 사거리에서 경찰 저지선에 막혀있다.    경찰은 집회가 열린 광화문 광장 주변에 차벽을 치고 30개 중대 2천400여 명을 투입했으며 미신고 집회라는 이유를 들어 집회 해산 명령을 내렸다. 이에 대해 주최 측은 서울시로부터 광화문광장 정식 사용 허가 공문을 받았다고 반박했다.    집회 후 참석자 가운데 300여 명경찰 추산은 대통령 면담을 요구하며 9일째 농성 중인 유가족들을 방문하기 위해 청운동 주민센터로 향했다.    하지만 경찰이 유가족들이 모인 청운동 주민센터 앞 접근을 가로막자 한때 몸싸움이 벌어지기도 했다.     이들은 주민센터 맞은편에서 집회를 벌이다 2시간여 만인 오후 9시 40분께 해산했다. 연행자는 없었다고 경찰은 전했다.    앞서 새정치민주연합은 이날 오후 4시께 서울 세종문화회관 앞에서 세월호 특별법 제정 촉구를 위한 문화제를 열었다. 야당의 장외집회는 지난 2월 간첩조작사건 규탄대회 및 기초선거 정당공천 폐지 관철 집회를 벌인 이후 반년 만에 열렸다
살빠지고 젊어지는 근육운동 열풍…과하면 '독'	http://news.naver.com/main/read.nhn?mode=LSD&mid=shm&sid1=103&oid=055&aid=0000285774	근육 운동을 적당히 하면 다이어트 효과도 있고 삶의 활력도 생기고 또 성인병 예방에도 도움이 됩니다. 하지만 역시 지나치면 좋지 않겠죠. 근육운동을 과도하게 하면 면역력이 떨어지고 콩팥에도 무리가 갈 수 있습니다.근육 운동법 강좌가 열리는 날인데 환자와 노인들로 발 디딜 틈이 없습니다.석정란서울 성북구  제가 허리를 다쳐서 수술을 한 상태예요. 그래서 이걸 조금 배워서 해봐야겠다.최근 일본 연구에서는 노인이 근육 운동을 하면 남성은 테스토스테론 여성은 에스트로겐의 분비가 늘어 갱년기 극복에 도움이 되는 것으로 나타났습니다.하지만 과도하면 문제가 생길 수 있습니다.3개월 동안 근육을 단련한 두 남성의 건강 상태를 점검해봤습니다.이진희직장인체중감소 목적 근육운동  하루에 1시간 정도 운동을 했고요. 약 10kg 정도 감량을 했습니다.체성분 분석을 해보니 이 남성은 단백질과 지방분포가 정상이었는데 눈에 띄게 근육이 도드라진 이 남성은 지방은 거의 없고 단백질은 정상범위를 초과했습니다.체성분의 균형이 깨졌고 콩팥 수치도 비정상이었습니다.이상엽직장인대회출전 목적 근육운동  일단 체력적으로 직장 일을 같이 하다 보니까 피곤합니다. 그러다 보니까 많이 지치고요.최근의 연구를 보면근육이 과도하면 성호르몬이 많이 분비되는 장점이 있는 반면 면역력을 떨어뜨려 독감 같은 감염성 질환에 걸리기 쉽습니다.또 몸속 염증 수치가 올라가 콩팥에도 악영향을 주는 것으로 나타났습니다.조현순천향대병원 가정의학과 전문의  세포성장이라든지 면역기능 이런 문제들이 다 전반적으로 떨어지기 때문에 질병에 취약하게 되거나.근육 운동의 적정선은아직 명확하게 밝혀지지 않았지만 통증을 느끼지 않는 범위에서 근육을 키우는 것이 바람직해 보입니다
"꿈인 것 같다" 눈물로 끝난 '무한도전'의 감동	http://news.naver.com/main/read.nhn?mode=LSD&mid=shm&sid1=106&oid=117&aid=0002503633	허설희 기자 무한도전 멤버들과 팬들의 만남이 감동을 줬다.30일 방송된  무한도전에서는 무한도전 팬들이 함께하는 형광팬캠프 편이 그려졌다. 멤버들은 각자 10명의 팬들과 직접 만나 시간을 보냈다.이날 하루를 함께 보낸 무한도전 팬들은 각자의 스타와 저녁 시간을 보냈다. 이들은 늦은 밤 진심 가득한 이야기를 나눴다.한 팬은 정준하에게 무거운 질문을 던졌다. 앞으로의 무한도전에 대한 이야기였다. 이에 정준하는 우리도 인간인지라 얼마나 마음 속으로 갈등과 번민 고민이 얼마나 많겠나라며 진심을 전했다.정형돈 역시 나이가 먹어감에 있어서 아무 힘이 안 든다고 하는건 거짓말인 것 같다. 그 시간을 늦추기 위해 노력한다고 고백했다.박명수는 정말 열심히 노력하고 고생하면 내가 몰랐던 혹은 내가 꿈꾼 일을 너희가 느낄 수 있다. 인생은 짧다고 인생 선배로서 진심 어린 조언을 했다.이후 숙소에 모인 팬들의 대화가 공개됐다. 팬들은 꿈인 것 같다. 계속 꼬집어 봤다 딱 자면 그냥 꿈일 것 같다. 현실로 돌아올 것 같다 아쉽다. 다시 아침이었으면 좋겠다 아 벌써 아쉽다 벌써 시간이 훅 간다 등의 대화를 나누며 감동 받은 마음을 드러냈다.또 한 팬은 아쉬움에 눈물을 흘리기도 했다. 노홍철의 팬은 노홍철을 위해 써온 편지를 읽으며 우리들의 연예인이 되어 주셔서 감사합니다고 말해 감동을 줬다.팬들의 진심 어린 벅찬 마음과 눈물이 시청자들에게도 감동을 줬다. 사진   방송캡처허설희 기자 husullllmydaily
속도 규제 없는 자전거 '씽씽'…과속 사고 빈발	http://news.naver.com/main/read.nhn?mode=LSD&mid=shm&sid1=103&oid=055&aid=0000285773	자전거 인구가 늘어나면서 사고도 크게 증가했습니다. 주로 과속으로 인한 사고인데 아직까지 자전거 속도와 관련한 규제는 없습니다. 운전자들은 자전거 블랙박스를 설치하며 대비하고 있습니다.기자한강공원을 질주하는 자전거가 도로를 가로지르며 들어오는 또 다른 자전거를 그대로 들이받습니다.자전거 한 대는 갑자기 속도를 내며 추월해가고 또 한 대는 방향을 틀다 뒤따르던 자전거와 부딪힙니다.자전거가 보행자와 다른 자전거 사이를 비집고 나오려다 넘어지기도 합니다.모두 속도를 내던 자전거 때문에 발생한 사고입니다.한강 둔치엔 최고 속도를 시속 20km로 권고하는 표지판이 설치돼 있지만 누구도 신경 쓰지 않습니다.제가 직접 스피드건으로 속도를 재보니 시속 20km가 넘는 자전거를 쉽게 찾아볼 수 있었습니다.시속 30km는 기본이고 48km까지 속도를 내며 곡예운전을 하기도 합니다.한강 자전거 사고는 매년 증가해 올해에만 145건의 사고가 발생했습니다.도로가 꺾이는 코너구간이나 길이 합쳐지는 교차로 또 보행자가 많은 공원 인근 도로가 위험 지역입니다.한승재자전거 사고 목격자  조금 앞에 자전거가 밀려 있으니까 피해서 지나가다가 아줌마랑 부딪혀야간에는 시야가 좁아져 속도감이 둔해지기 때문에 낮시간보다 사고가 날 확률이 더 높아집니다.하지만 자전거의 속도를 규제하는 법령은 따로 없습니다.서울시 담당자  저희들이 임의로 규제를 할 수 없잖아요. 법이 정해지기 전에 조심하라는 의미로 해서 20km 속도 제한을 해주는 거죠.그러다 보니 사고가 날 경우를 대비해 자전거에 블랙박스를 설치하는 운전자도 늘고 있습니다.이호남인천 부평구  시시비비를 가릴 때 증거로 활용할 수 있으니까 유용하게 사용하고 있습니다. 가격이 싸진않지만 가지고 있으면 더 큰 비용이 드는 걸 미연에 방지할 수 있으니까요.자전거 이용자들과 도로 시설 관계자들은 시속 30km 정도를 현실적인 제한 속도로 보고 있습니다.적정 속도로 다른 운전자나 보행자와 공존하는 자세가 필요한 시점입니다
전국 맑다가 낮부터 구름…큰 일교차 주의	http://news.naver.com/main/read.nhn?mode=LSD&mid=shm&sid1=103&oid=437&aid=0000050495	8월 내내 주말마다 비가 내리는 날이 참 많았는데요. 오늘30일은 모처럼 전국이 맑았습니다. 내일도 대체로 맑은 날씨가 이어진다고 합니다. 자세한 날씨 소식을 윤영탁 기자가 전해드립니다. 기자전국적으로 모처럼 맑은 하늘이 드러난 주말 오후 시민들은 집 근처 공원을 찾았습니다. 가족과 산책을 하고 배드민턴을 치면서 한 주간 쌓였던 피로도 씻어냅니다.내리 쬐는 햇살이 아직은 뜨겁지만 시원한 그늘 밑에 돗자리를 펴고 앉으면 성큼 다가온 가을이 느껴집니다. 추석을 일주일여 앞두고 미리 성묘길에 오른 차량과 나들이 차량이 뒤섞이면서 고속도로는 하루종일 몸살을 앓았습니다.휴일인 내일도 나들이 하는데 날씨로 인한 불편은 없겠습니다. 고기압의 가장자리에 들면서 전국이 맑다가 낮부터 차츰 구름만 많아지겠습니다.내일 낮 기온은 서울 30도 대전 28도 강릉 26도 부산 27도로 오늘과 비슷하겠습니다.다만 일교차가 10도 넘게 벌어지는 곳이 많아 체온 유지 등 건강 관리에 주의가 요구됩니다.이동희기상청 통보관  건조한 공기 성질을 가지고 있어서요. 낮에는 일사에 의해서 기온이 오르고낮과 밤의 기온 차가 크게 나타나겠습니다.다음 주 초반까지 맑은 날씨가 이어지다가 수요일과 목요일 사이 전국적으로 비가 내릴 전망입니다.윤영탁 JTBC 뉴스 공식 SNS 트위터 페이스북 카카오스토리 유튜브 JTBC 뉴스는 여러분의 생생한 제보를 기다립니다
'앵그리버드' 제작사 실적부진에 CEO 교체	http://news.naver.com/main/read.nhn?mode=LSD&mid=shm&sid1=105&oid=001&aid=0007095241	강훈상 기자  공전의 히트를 기록했던 모바일게임 앵그리버드 제작사의 최고경영자CEO가 실적부진으로 교체된다.    영국 파이낸셜타임스FT 등 외신은 이 게임의 제작사인 로비오의 창업자 미카엘 헤드가 자신이 올해 말 사임하고 노키아 임원 출신인 펙카 란탈라가 후임으로 결정됐다고 밝혔다고 29일현지시간 보도했다.    미카엘 헤드는 앵그리버드를 직접 개발했던 주인공이기도 하다.    로비오의 지난해 순이익은 3천700만 달러로 전년보다 52 줄었고 매출은 거의 변화가 없었지만 직원수는 500명에서 800명으로 급증했다.    미카엘 헤드는 앵그리버드 캐릭터로 영화와 TV용 콘텐츠를 제작하는 로비오애니메이션의 회장으로 자리를 옮길 예정이다.    로비오의 최대주주이자 미카엘 헤드의 아버지 카즈 헤드는 회장직을 그대로 유지한다.    앵그리버드는 스마트폰 보급과 함께 2009년부터 다운로드수 20억회를 기록할 정도로 큰 인기를 끌었지만 최근 경쟁이 치열해지면서 예전 명성을 잃고 있다.    로비오는 앵그리버드 게임을 무료화하면서 캐릭터의 높은 인지도를 바탕으로 옷 장난감 영상 등 다른 분야로 확장하는 방향으로 사업구조를 변환중이다.    반면 경쟁사들은 무료로 게임을 제공하는 대신 게임에 필요한 아이템을 유료화하는 전략으로 차별화하면서 앵그리버드의 아성을 무너뜨리고 있다
러시아 이민국 "우크라이나 난민 82만명 유입"	http://news.naver.com/main/read.nhn?mode=LSD&mid=shm&sid1=104&oid=001&aid=0007095221	알마티 김현태 특파원  우크라이나 동부지역을 탈출해 러시아로 넘어온 우크라이나 국적 난민이 약 82만명에 이른다고 러시아 이민국이 30일현지시간 밝혔다.    리아노보스티 통신 등을 따르면 러시아 이민국은 이날 보도자료를 통해 최근 들어 우크라이나에 접경한 러시아 지역으로 탈출하는 우크라이나 난민 수가 크게 늘고 있다며 이같이 말했다.    이민국은 지난 4월1일부터 러시아로 넘어온 우크라이나 난민은 약 82만명이며 이 가운데 약 13만명은 망명을 신청하거나 난민 지위를 요구했다고 설명했다.    이민국은 앞서 6월 우크라이나 동부 사태 이후 러시아로 넘어온 우크라이나 난민이 약 40만명이라고 밝힌 바 있다.      당시 우크라이나 정부군과 분리주의 민병대 간 교전이 치열한 우크라이나 동부 도네츠크주 루간스크주와 접경한 러시아 남부 로스토프주로 대규모 난민이 유입되는 것으로 알려졌다.    러시아 당국은 이에 우크라이나 접경지역에 약 200개의 임시 난민수용소를 설치하고 난민들에게 음식 의료 심리 상담 등을 제공하고 있다고 주장했다.    그러나 우크라이나 정부는 러시아가 동부 지역 혼란 상황을 과장하고자 난민 수를 부풀려 발표한다며 맞서고 있다.    한편 유엔 인권최고대표사무소OHCHR는 전날 발표한 보고서를 통해 정부군과 반군의 전투가 이어지는 우크라이나 동부에서 하루 평균 36명이 살해당하고 있다고 밝혔다.     보고서는 또 올해 4월 중순부터 지난 27일까지 최소 2천593명의 민간인이 사망했다며 우크라이나 동부 사태에 따른 대규모 민간인 피해 발생을 우려했다
