솜방망이 징계 지적에 軍 "진급 못해" 황당 답변	http://news.naver.com/main/read.nhn?mode=LSD&mid=shm&sid1=100&oid=022&aid=0002718489	GOP 난사윤일병 사망 당시 사단장들 각각 감봉근신 징계지난 7월 4일 영장실질심사를 받기 위해 법원에 출두한 임 병장.육군은 22사단 GOP일반전초 총기사건과 28사단 윤모 일병 폭행사망 사건 발생 당시 두 사단장에 대해 지휘감독 책임을 물어 각각 감봉 및 근신 징계 처분을 내렸다고 3일 밝혔다.육군 관계자는 이날 지난달 30일 열린 중앙징계위원회에서 서모 전 22사단장소장과 이모 전 28사단장소장은 각각 감봉 1개월 근신 10일의 징계를 받았고 2일 김요환 육군참모총장이 감경 없이 이를 최종 승인했다고 말했다.육군 관계자는 이번 징계 수위가 낮은 것 아니냐는 일각의 지적에 서 소장과 이 소장에 대해 이미 두 사건의 책임을 물어 보직 해임했고 이번에 추가로 징계위를 열어 징계한 것이라며 장성급 고위 장교는 이 정도 징계를 받으면 진급이 사실상 불가능하다고 설명했다. 그는 또 사단장은 두 사건이 발생한 부대소대의 지휘계선으로 따지면 4차 상급자에 해당한다며 직접 지휘하는 것이 아니기 때문에 지휘감독 소홀 책임만 물은 것이라고 말했다.박병진 군사전문기자오늘은 HOT포토 오늘의 지면보기   세상을 보는 눈 세계일보  Segye
'대리기사 폭행' 연루 김현 의원, 피해자와 대질	http://news.naver.com/main/read.nhn?mode=LSD&mid=shm&sid1=102&oid=001&aid=0007165147	폭행 의혹 김현 의원 피의자 신분 경찰 출석      김도훈 기자  세월호 유가족의 대리기사 폭행 사건에 연루된 새정치민주연합 김현 의원이 3일 피의자 신분으로 조사를 받기 위해 서울 영등포 경찰서에 출석해 기자들의 질문의 질문을 듣고 있다.김 의원 폭행장면 목격 못했다기존 진술 고수대리기사 이씨 김 의원과 말다툼 없었으면 사건 안 났다     황철환 기자  세월호 유족들의 대리기사 폭행 사건에 연루된 새정치민주연합 김현 의원이 3일 피의자 신분으로 경찰에 출석해 10시간 넘게 조사를 받았다.    김 의원은 이날 오전 10시 정각 서울 영등포경찰서에 도착했으며 오후 2시께 출석한 대리기사 이모52씨와 대질 신문을 받았다.    김 의원은 지난달 17일 0시 40분께 영등포구 여의도 거리에서 세월호 유족들과 함께 술을 마신 뒤 대리기사 행인 2명과 시비가 붙어 폭력을 행사한 혐의를 받고 있다.    김 의원은 당시 직접적인 폭력을 휘두르지는 않았지만 피해자들은 김 의원의 명함 뺏어라는 말과 함께 유족들의 폭행이 시작됐다면서 강력한 처벌을 요구해 왔다.    대리기사 이씨는 이날 대질신문에 들어가기 전 기자들과 만나 이번 폭행사건의 시발점은 김 의원이라면서 김 의원과 저 사이에 말다툼이 없었으면 이 사건은 안 일어났을 것이라고 말했다.    그는 처음 제가 말다툼을 피하려고 두 번 세 번 그냥 간다고 했는데도 계속 나를 붙잡았기에 감정이 격해졌고 이렇게까지 사고가 난 것이라면서 김 의원이 이 사건에서 빠진다는 것은 제가 보기에 뭔가 아닌 것 같다고 주장했다.손으로 얼굴 가린 김현 의원      김도훈 기자  세월호 유가족의 대리기사 폭행 사건에 연루된 새정치민주연합 김현 의원이 3일 피의자 신분으로 조사를 받기 위해 서울 영등포 경찰서에 출석해 카메라 스트로브 불빛을 손으로 가리며 건물 안으로 들어서고 있다.         이씨는 대질신문을 마친 뒤 오후 6시께 귀가했으며 조사 과정에서 김 의원으로부터 사과를 받긴 했으나 진정성 없는 인사 수준의 사과였다고 말했다.    김 의원은 이보다 2시간가량 늦은 오후 8시 10분께 영등포경찰서를 떠났다.    그는 유가족이 피해자를 폭행하는 장면을 보지 못했다는 기존 진술에서 바뀐 것이 있느냐는 질문에 예. 대리기사와의 폭행장면을 목격하지 못했습니다라고 답했고 사건 당시 대리기사에게 반말하지도 않았다고 주장했다.    이어 김 의원은 이씨에게 다시 한번 죄송하다는 말씀을 드렸다고 밝혔다.    하지만 그는 잘못한 것이 없는데 왜 사과했느냐 당내 일각에서 출당요구가 있다 국회 안전행정위원회를 탈퇴해야 하는 것 아니냐는 질문에는 답하지 않은 채 자리를 떴다.    경찰 관계자는 김 의원의 진술은 지난달 23일 참고인 조사 당시와 달라진 것이 없고 대부분의 진술이 피해자나 목격자의 진술과 다르다고 말했다.    이 관계자는 앞서 조사를 받은 유가족들은 김 의원이 사건 현장에 없었고 폭력행위를 보지도 못했다고 진술했다면서 지금까지의 조사 내용을 종합해 김 의원의 혐의 여부를 확정할 방침이라고 덧붙였다.    hwangchyna
주유소 '가짜 기름' 바로 확인…무료 검사에 포상금은 덤으로	http://news.naver.com/main/read.nhn?mode=LSD&mid=shm&sid1=101&oid=214&aid=0000421574	차를 몰다가 갑자기 소음이 나거나 연비가 확 떨어지면 혹시 내 차 기름이 가짜는 아닐까 이렇게 의심하게 되죠.그런데 가짜 기름을 확인하는 새로운 시스템이 나왔습니다. 리포트 고속도로 휴게소에 들른 자동차에서 정비사들이 기름을 뽑아냅니다. 최근에 어디서 언제 주유하셨어요 뽑아낸 기름은 이동식 시험차량으로 옮겨져 즉석에서 10여 가지 검사가 이뤄집니다. 석유관리원이 설치한 가짜 기름 검사소입니다. 검사를 맡기고 30분 정도만 기다리면 가짜 기름인지 여부를 운전자가 알 수 있습니다.  전화나 문자메시지로도 결과를 알 수 있어 시간에 쫓기는 화물차 운전자들에게도 인기입니다.   조남익화물차 운전자 똑같은 양을 넣고 왔다갔다해도 연비가 조금씩 다르니까. 주유소마다 다르니까한 번 해보면 좋죠. 가짜 기름 판정이 나오면 해당 주유소를 역추적해 단속에 들어가는데 이 경우 연료를 뽑은 차량의 운전자를 신고자로 인정해 포상금도 줍니다
태티서, '제시카 탈퇴'에도 '뮤뱅' 1위	http://news.naver.com/main/read.nhn?mode=LSD&mid=shm&sid1=106&oid=117&aid=0002518534	이승길 기자 걸그룹 소녀시대 유닛 태티서가 제시카 탈퇴 논란 속에도 KBS 2TV 뮤직뱅크 1위 트로피를 차지했다.태티서는 3일 오후 2014 오송 국제바이오산업엑스포가 열리고 있는 충북 청주 특설무대에서 오송 특집으로 진행된 KBS 2TV 뮤직뱅크에서 Holler할라로 정상에 올랐다.수상 후 멤버 태연은 많이 사랑해준 소원에 감사하다. 항상 응원해준 멤버들과 스태프에 고맙다고 말했다. 티파니도 SM엔터테인먼트 식구들에 감사하다고 덧붙였다.또 태티서 멤버들은 앞서 인터뷰에서 밝힌 1위 공약에 따라 서로를 백허그하는 모습을 보이기도 했다.지난달 30일 불거진 제시카 탈퇴 사태 이후 소녀시대는 팬사인회 드라마 촬영 라디오 진행 등 정상적으로 스케줄을 소화하고 있다. 다만 태티서의 KBS 쿨FM 슈퍼주니어의 키스 더 라디오 출연 스케줄은 취소되기도 했다.한편 이날 뮤직뱅크에는 비스트BEAST 태티서 씨스타SISTAR 걸스데이 에이핑크 틴탑 비투비BTOB 주니엘 에일리 AOA 방탄소년단 소유X어반자카파 티아라 스피카.S 라붐 포텐 밍스 등이 출연했다. 사진  KBS 2TV  캡처이승길 기자 winningsmydaily
'오원춘사건' 유족 국가배상금 항소심서 대폭 삭감	http://news.naver.com/main/read.nhn?mode=LSD&mid=shm&sid1=102&oid=001&aid=0007164982	1심 1억원에서 2심 2천130만원으로 줄어     이신영 기자  2012년 발생한 오원춘 사건 피해자 유족이 국가를 상대로 낸 손해배상 소송 항소심에서 배상액이 대폭 삭감됐다.     서울고법 민사8부배기열 부장판사는 오원춘에게 납치살해된 A28여씨의 유족 4명이 국가를 상대로 낸 손해배상 소송에서 2천130만원을 배상하라고 판결했다고 3일 밝혔다.     국가가 1억원 가량을 배상해야 한다고 판결했던 1심보다 배상액이 대폭 줄어든 것이다.     재판부는 112 신고센터에서 피해자가 집안에 있다는 정보를 제대로 전달하지 않는 등 일부 위법행위가 있었다면서도 이런 정보가 분명히 전달됐더라도 피해자가 무사히 구출됐으리라고 단정하기 어렵다고 밝혔다.     재판부는 경찰이 일찍 수색에 성공해 범행 현장에서 피해자가 생존해 있는 상태에서 오원춘을 발견했다고 하더라도 오원춘의 난폭성과 잔인성을 고려하면 피해자가 생존상태에서 구출될 수 있었을 것이라고 장담할 수도 없다고 설명했다.     재판부는 이런 점을 고려할 때 국가가 피해자의 사망이라는 결과까지 책임져야 한다고 볼 수는 없다며 1심에서 인정한 재산상 손해와 피해자의 사망에 대한 위자료 청구를 받아들이지 않았다. 다만 유족들의 정신적 고통에 대한 위자료만 인정해 배상액을 정했다.     오원춘은 2012년 4월1일 오전 10시30분께 수원시 지동에서 자신의 집앞을 지나던 A씨를 끌고 가 성폭행하려다 실패하자 살해하고 시신을 토막냈다.     당시 A씨는 납치된 이후 경찰에 전화로 구조요청을 했지만 경찰이 늑장 출동한 사실이 알려져 책임 논란이 불거졌다.     유족들은 112신고를 했는데도 초동 수사가 미흡해 고귀한 생명을 잃게 됐다며 국가를 상대로 3억6천만원의 손해배상을 청구했다.     eshinyyna
50년 퇴직연금이 매달 천 원?…원금 보장이 우선	http://news.naver.com/main/read.nhn?mode=LSD&mid=shm&sid1=101&oid=056&aid=0010077914	기자 멘트직장인들의 중요한 노후보장 수단인 퇴직금이 퇴직금이 오는 2016년부터 기업규모에 따라 단계적으로 퇴직 연금으로 전환돼 2022년에는 모든 기업에 의무화됩니다.그럼 퇴직연금이란 뭘까요지금까지는 기업이 내부에 적립하던 퇴직적립금을 금융사에 맡겨 운용한 뒤 그 수익을 합쳐 퇴직 근로자에게 돌려주는 상품입니다.퇴직 연금 시장 2030년엔 900조 원대로 예상되는데요.6 정도니까 금융사들에겐 해마다 5조 원을 안겨주는 엄청난 시장이 생기는 겁니다.퇴직연금이 금융사의 배만 불린다는 비판에 정부는 근로자의 노후도 든든해 진다고 설명하는데요퇴직연금이 풍족한 노후를 보장할 수 있을까요 리포트윤모 씨의 어머니는 1961년 삼성생명의 전신인 동방생명의 연금 상품에 가입했습니다.17600환을 내고 50년을 기다리면 해마다 당시 대기업 연봉 수준인 12만 환을 받는 조건이었습니다.그런데 10환이 1원으로 화폐개혁됐다며 보험사가 인정한 연금액은 고작 12000원.50년을 기다리며 든든한 연금을 기대했지만 물가 상승으로 물거품이 된 것입니다.인터뷰 윤모씨연금 가입자 자녀  이제 50년이 지나고 나니까 정말 너무나 작은 돈이 되었고 진짜 기가 막힌 거죠.삼성생명은 상법상 10년만 서류를 보존하면 된다며 윤씨가 가입할 당시 보험약관의 원본 공개를 거부했습니다.이 같은 문제는 지금도 마찬가집니다.퇴직 연금의 평균 수익률이 계속 하락하면서 최근 6분기 연속 0대를 기록했습니다. 인터뷰 김미숙보험이용자 협회 대표  노후연금액의 화폐가치가 인정되지 않는데다가 투자손실을 볼 수 있는 위험에 처할 수 있습니다.퇴직금을 민영 금융회사에 맡기는 퇴직연금 제도가 반드시 근로자에게 유리하다고 볼 수만은 없는 이윱니다. 기자 멘트보신 것처럼 퇴직연금이 정부의 생각처럼 장밋빛 일 수만은 없다는 얘긴데요.왜 그런지 좀 더 구체적으로 살펴보겠습니다.예를 들어 연봉 5천만 원인 근로자가 앞으로 25년 더 일하면 1억 원 정도의 퇴직금을 받는데요이를 퇴직연금으로 전환해 25년 동안 받으면 한 달에 44만 원을 받을 수 있습니다.최근 10년 동안의 물가상승률을 적용하면 50년 뒤 현재가치는 11만 원에 불과합니다.더 큰 문제는 자산가격이 폭락하는 위기 상황이 왔을 땐데요2007년 금융 위기 직후 미국의 퇴직연금401K은 대부분 30 가까이 손실이 났고 일본도 25나 손실을 봤습니다.특히 2012년 일본에서는 한 자산 운용사AIJ가 파산해 88만 명이 90의 퇴직연금을 날렸습니다.자칫 불황으로 직장을 잃었는데 퇴직금까지 사라지는 이중고를 겪을 수 있습니다.기업이 지급을 책임지는 퇴직연금도 결코 안심할 수 없습니다.퇴직연금의 투자 손실을 메우다 GM과 크라이슬러 델타 항공 등 세계 굴지의 기업들이 금융위기 이후 파산 위험에 내몰렸기 때문입니다.더구나 일자리를 구하기 어려운 사회적 약자들은 퇴직연금에서 소외될 수밖에 없는데요호주와 스위스 미국 등 선진국 중 빈곤율이 높은 나라들은 모두 공적 연금 대신 퇴직연금을 활성화했던 나라들입니다.그렇다면 보다 나은 노후를 위한 방법은 없는 걸까요공아영 기자가 취재했습니다. 리포트독일의 직장인 파벨스 씨는 2002년부터 퇴직연금 상품인 리스터 연금을 붓고 있습니다.매달 175유로씩 연간 2천100유로 우리 돈으로 280만 원을 적립하면 정부가 매년 154유로 20만 원을 보조해 줍니다. 지난 2001년부터 도입된 리스터 연금의 핵심은 원금 보장.인터뷰 디르크 파벨스독일 직장인  리스터 연금은 원금손실 없이 다 보장되기 때문에 안심할 수 있습니다하지만 우리나라는 위험자산에 투자할 수 있는 범위를 오히려 현재 40에서 70까지로 확대했고 예금자보호도 한 사람에 5천만 원까지만 가능합니다.그것도 회사가 파산했을 때만 가능할 뿐 투자손실에 대한 보호는 아닙니다.따라서 최대한 원금 보장이 가능하도록 사전 감독을 강화하고 사후에는 투자자 소송 등을 통해 책임을 물을 수 있도록 해야 합니다.또 원할 경우 퇴직금 중간정산을 허용해야 합니다.저소득층을 위한 안전장치 마련도 시급합니다
청소년 편의점 알바 최저임금도 못받아	http://news.naver.com/main/read.nhn?mode=LSD&mid=shm&sid1=102&oid=022&aid=0002718508	패스트푸드빵집커피숍 4곳 중 근로계약서 작성 비율 41 최저집 나간 아버지와 몸이 아픈 어머니를 대신해 동생들을 돌보는 A양19은 대학에 가는 대신 돈을 번다. A양은 시급 5210원 즉 최저임금을 보장한다고 공고한 집 근처 편의점에서 하루 7시간씩 아르바이트를 하기로 했다. 하지만 A양은 근무 첫날 시급은 3800원이고 원래 편의점들은 시급 제대로 쳐주는 곳이 없다는 사장의 말을 듣고 당황했다.어린 동생들 때문에 집에서 멀리 떨어진 일자리를 잡기가 쉽지 않은 탓에 A양의 고민은 깊어졌다.유명 아르바이트 알선 사이트들에는 편의점 알바에 대해 성토하는 글이 넘친다. 약속한 것보다 더 일하고 대가를 제대로 받지 못한 고발 사례도 이어지고 있다.3일 고용노동부가 새누리당 이자스민 의원에게 제출한 2013년 비진학청소년 근로환경 실태조사에 따르면 청소년이 주로 일하는 4개 업종 가운데 편의점이 가장 나쁜 알바로 나타났다. 실태조사는 만 1423세의 고교대학 비진학 청소년 가운데 편의점과 패스트푸드점 빵집 커피전문점 등 4개 업종에서 근무한 경험이 있는 200명을 대상으로 이뤄졌다. 이들의 일주일 평균 근로일수는 4일 하루 평균 근로시간은 6. 평균 시간당 임금은 4750원으로 지난해 시간당 최저임금 4860원에 미치지 못했다. 편의점은 가장 낮은 4668원 빵집은 4687원 패스트푸드점은 4757원이었고 커피전문점만이 4987원으로 최저임금을 넘겼다.지난해 고용노동부 제4기 알바지킴이 청소년리더들이 청소년 근로권익 보호를 위한 가두캠페인을 하고 있다. 세계일보 자료사진근로계약서를 작성한 편의점 비율이 41.6로 4개 업종 중 가장 낮았다. 또한 약속한 임금보다 적게 받은 적이 있는 비율31.2과 연장야간 근로에 대한 가산 임금을 받지 못한 비율27. 그럼에도 그냥 참고 일했다는 비율은 57.패스트푸드점은 근로계약서나 부모동의서 작성률이 80 가까이 됐다. 이는 대기업에서 나온 지점장들이 비교적 근로보호법 테두리 안에서 근로지휘를 하기 때문인 것으로 풀이된다.이 의원은 사회적 책임 측면에서 편의점 가맹 본사에서 근로보호 미준수와 부당행위를 한 대리점의 사업권을 취소하는 등의 자체적인 관리가 필요하다면서 청소년을 상대로 근로조건을 위반한 업체에 대해서 정부의 실태조사와 철저한 근로감독이 이뤄져야 한다고 지적했다.com오늘은 HOT포토 오늘의 지면보기   세상을 보는 눈 세계일보  Segye
'세관검사 훼손' 직원이 배상? "겁나서 하겠나"	http://news.naver.com/main/read.nhn?mode=LSD&mid=shm&sid1=101&oid=055&aid=0000288078	해외에서 들어오는 모든 물품은 엑스레이 검사를 하고 또 의심스러우면 세관 직원이 직접 열어서 검사하기도 합니다. 그런데 이 과정에서 물품이 훼손될 경우 직원이 물어내야 해서 자칫 검사가 움츠러들 수 있다는 지적이 나오고 있습니다.기자인천공항에서 수하물을 검사하는 세관 직원 정현숙 씨는 최근 여행객 가방을 열어보다 액자를 깨뜨렸습니다.정현숙인천공항 관세행정관  의약품 검사를 하기 위해서는 액자를 들어내야 했습니다. 그 와중에 유리가 파손되는 사고가 발생했습니다.약품에 큰 문제는 없었고 액자비용만 개인 돈으로 물어줬습니다.요즘 부쩍 늘어난 해외 직접 구매 물품들도 검사과정에서 훼손되곤 합니다.마약 검사기에서 이상 반응이 감지되면 뜯고 열어서 확인하는 게 규정이기 때문입니다.세관 화물검사 담당  뜯어봤어요 신발 밑창을. 거기에 마약은 나오지 않았고 다량의 본드가 나왔는데 그게 마약 반응을 일으킨 것 같아요.밑창을 다시 붙여 보냈지만 주인은 변상을 요구했고 책임은 규정대로 업무를 처리한 직원에게 돌아갔습니다.마약이나 밀수품이 나오지 않을 경우 물품 훼손에 대한 보상 규정이 없기 때문입니다.해외 직접 구매가 크게 늘면서 마약류 밀반입도 함께 늘고 있지만 세관 검사는 움츠러들게 되는 겁니다.오제세 의원국회 기획재정위원회  마음 놓고 검사할 수 있도록 적법한손실이 발생했을 때는 국가에서 보상하도록 하는 그런규정이 필요하고예산이 필요하다. 일본 홍콩 등 해외에서는 세관 검사과정에서 물품이 훼손되면 국가가 배상하도록 규정하고 있습니다
달러 강세 시대…귀금속값 추락, 신흥국 달러 썰물	http://news.naver.com/main/read.nhn?mode=LSD&mid=shm&sid1=101&oid=028&aid=0002248266	미 경기회복세에 금리인상 예고달러인덱스 4년만에 정점 찍어한달새 금 5.12 값떨어져구리철은 공급증가까지 겹쳐 심각골드만삭스 철 시대의 종말 보고서금리인상 대비 투자자들 자금 회수타이 인도 외 모든 신흥국 순유출지난달 한국 5억 대만 18억8천달러미국 달러 가치가 오르면서 주요 상품 가격들은 하락하고 아시아의 신흥국가들에서는 자금이 빠져나가고 있다.  미국의 경기 회복 속도가 유럽이나 일본 같은 다른 선진국에 견줘서 빠르고 미국이 내년에는 금리 인상을 단행할 전망이라 당분간 이런 추세는 계속될 것으로 보인다. 주요 6개국 통화 대비 달러 가치를 나타내는 달러인덱스는 3일에도 85 이상을 나타나며 강세 기조를 보이고 있다. 블룸버그에 따르면 달러인덱스는 지난달 30일 85.9로 4년 만에 최고치를 기록했으며 1일에는 85.6으로 다소 떨어지기는 했지만 전반적으로 강세 추세다. 달러인덱스 숫자가 클 수록 달러 가치가 강세라는 뜻이다. 달러가 약세일 때는 금은 같은 귀금속을 포함한 상품 가격이 오르는 경향이 있지만 달러가 강세일 때는 반대 경향을 보인다. 상품 가격이 투기적 수요에 의해서도 상당 부분 좌우되기 때문이다. 최근 달러 가치가 오르자 달러 대체 자산으로서 금의 매력이 떨어지면서 금 현물 가격은 지난달 1일 트로이온스31.1035 당 1286달러에서 이달 2일에는 1214. 은 현물 가격도 같은 기간 트로이온스 당 19. 구리와 철 등은 유럽 경기 회복에 대한 회의감과 공급 증가까지 겹쳐 상황이 더 심각하다. 구리 3개월물 선물 가격은 2일 런던금속거래소에서 t당 6600달러로 5개월 사이 가장 낮은 가격을 기록했다고 로이터 통신은 전했다. 싱가포르 유비에스UBS 웰스 매니지먼트의 도미닉 슈나이더는 강해진 달러가 열쇠를 쥐고 있다며 몇달 내 구리 가격이 t당 6350달러로 떨어질 것으로 전망하고 있다고 말했다. 철은 세계적 공급 증가까지 심각해 미국 투자은행 골드만삭스가 철 시대의 종말이라는 보고서를 낼 만큼 가격 하락세가 이어지고 있다. 미국의 양적완화 정책으로 아시아 신흥국에 투자된 달러도 빠져나가는 추세다. 월스트리트 저널은 2일 투자자들이 미국 연방준비제도연준의 금리 인상에 대비하기 시작하면서 그동안 아시아 신흥국들의 자본시장에 투자했던 돈을 회수하고 있다고 전했다. 지난달 말레이시아 링깃과 인도네시아 루피아가 달러에 견줘 모두 4.1 절하되는 등 통화 가치가 떨어지고 있다고 신문은 전했다. 신문은 크레디트스위스 자료를 인용해 아시아 국가 중 타이와 인도를 제외하고는 모두 펀드 시장에서 자금 순유출을 기록하고 있다고 전했다.  블룸버그에 따르면 지난달 아시아 각국 주식시장 가운데 타이와 인도는 각각 6억5700만달러와 9억2900만달러 순매수를 기록했으나 한국 5억3600만달러 대만은 18억8000만달러 인도네시아는 6억1600만달러 베트남은 4000만달러의 순매도를 기록했다. 각국 정책 당국도 자금 유출입에 관심을 기울이고 있다. 차티브 바스리 인도네시아 재무장관은 지난달 미국 금리 인상이 인도네시아를 혼란에 빠뜨릴 수 있다고 말했으며 필리핀 중앙은행도 자국 페소가 지나치게 변동이 심하면 외환시장에 개입할 수 있다고 밝혔다고 월스트리트 저널은 전했다
