과태료 '안내고 버티기'…15억 밀려도 '어쩌나'	http://news.naver.com/main/read.nhn?mode=LSD&mid=shm&sid1=101&oid=055&aid=0000288073	과속이나 신호위반으로 적발되면 과태료가 부과되죠. 이걸 안 내서 체납한 금액이 1조 2천억 원이나 됩니다. 20억 원 가까이 체납한 경우도 있는데 징수하는 게 그렇게 쉽지가 않습니다.기자체납 징수 차량이 카메라로 자동차들의 번호판을 찍습니다.밀린 과태료가 있는지 번호판을 조회하는 겁니다.경보음이 울리고 과태료 122만 원을 내지 않은 차가 적발됐습니다.체납차량 운전자  요즘 불경기에 돈이 백 얼마가 어디 있어요. 그 이전 사람들 것이 따라서 온 거예요 그냥.체납된 법인 소유 차량의 과태료를 받아내기 위해 주소지로 찾아가 봤습니다.해당 회사 직원  현재 그 차가 여기 없어요. 다른 사람이 가져가서 쓰면서 계속 여기로 고지서가 날아오고 있다고요.경찰  저희가 이제 어떤 제재를 가해도 납부가 안 되는 상황이시잖아요.이렇게 징수하지 못하고 체납된 교통 과태료는 지난 8월까지 1조 2천억 원이 넘습니다.경찰청 한 해 예산의 약 13에 해당하는 금액입니다.체납액 순위를 살펴봤더니 1위는 이미 폐업한 중고 자동차 매매회사로 체납액이 17억 원이나 됐습니다.2위는 15억 원이 밀린 임 모 씨 개인이었고 3위와 4위도 개인이었는데 밀린 과태료를 낼 형편이 안 되는 사람들이었습니다.이들 모두 직접 중고차 매매업을 했거나 업자에게 명의를 빌려준 경우로 경찰은 보고 있습니다.체납 중고차 매매회사의 경우 법인을 만들어 차량을 등록한 뒤 고의로 폐업시켜 대포차를 만드는 수법을 쓴 것으로 추정됩니다.이미 없어진 회사에 등록된 차량이 대포차 상태로 계속 돌아다니다 보니 과태료가 쌓이기만 하고 있는 겁니다.이호근대덕대 자동차학과 교수  법인 폐업을 관할하는 기관과 자동차의 등록과 운행을 책임지는 기관이 이원화되어 있기 때문에 행정적인 절차를 통일한다든지 일원화시킨다면 충분히 해결될 수 있다고 보여지고요.경찰은 지난달 기동징수팀을 꾸려 본격적인 징수에 나섰습니다.그렇지만 막상 압류 절차에 들어가도 추심에 드는 비용을 누가 부담할지 규정조차 없는 상황입니다.근본적 대책은 없이 과태료가 쌓이는 동안 대포차의 무법운행은 도로의 안전까지 위협하고 있습니다
납골당 유행 편승…동물 불법 화장터 '우후죽순'	http://news.naver.com/main/read.nhn?mode=LSD&mid=shm&sid1=102&oid=214&aid=0000421578	개나 고양이를 기르는 인구가 1000 만에 육박하면서 반려동물의 사후처리를 담당하는 장례문화가 점차 확산되고 있습 니다.그런데 이런 분위기에 편승해 불법영업을 하는 업체들이 늘어나고 있습니다. 리포트  꽃으로 장식된 추모실.개와 고양이의 유골함이 놓인 납골당.  한 동물 장묘업체가 운영하고 있는 화장터입니다. 동물 장묘업체 직원 하늘나라로 갈 때 내 집을 가지고 가라는 의미를 담아서사람처럼 똑같이 염을 하고 최고급 수의까지 선택하면 비용이 180만 원까지 나갑니다. 그런데 이 화장터가 들어선 곳은 개발제한구역.이곳은 애완동물 화장터를 운영하기 위해 불법으로 용도 변경을 하고 건물을 증축해 시로부터 이미 두 번이나 시정명령을 받았습니다.게다가 동물을 정식으로 화장하는 기계 없이 사체를 녹여 사리같은 장식품을 만드는 기계로 화장을 해 온 것으로 드러났습니다.  동물 장묘업체 사장 설비는 사실 스톤사리 보조 설비에요. 화장을 할 수 있는 것은 1억 정도 나갑니다.불법인 줄 알아도 영업을 계속하는 이유가 있습니다. 현행법상 동물 사체는 폐기물로 분류돼 쓰레기봉투에 버려야 합니다.그러나 동물이 가족처럼 인식되기 시작하면서 화장장을 선택하는 사람들이 계속 늘어나기 때문입니다. 농림축산식품부 관계자 인력이나 예산이나 뭔가 갖추고 일이 이뤄져야 하는데 저하고 사무관님 한 분이 업무를 다해야 전국의 동물 화장터 가운데 정식 허가를 받은 곳은 11곳뿐
'꽃청춘' 유연석, 이서진 능가하는 사기 행각	http://news.naver.com/main/read.nhn?mode=LSD&mid=shm&sid1=106&oid=117&aid=0002518616	신소원 기자 꽃청춘 유연석이 제작진을 속이며 라오스 방비엥 여행을 했던 사실이 탄로났다.3일 오후 케이블채널 tvN 꽃보다 청춘 라오스편 최종회가 전파를 탔다. 이날 방송에서는 루앙프라방에서 6박 8일간의 여정을 정리하는 멤버들의 모습이 그려졌다.꽃청춘 3인방 중 엄마로 불렸던 유연석은 남은 돈을 정리했고 생각보다 많은 액수의 돈이 있었다. 제작진은 자막을 통해 수상하다라며 심증은 있지만 물증이 없기에 지켜보기로 했다라며 유연석의 불법 행위에 대해 의구심을 품었다.마지막날 이들은 야시장에 갔고 유연석은 야시장에서 배 터지게 먹어도 된다 선물을 사도 된다라며 여유를 부렸다.이에 제작진은 유연석을 불러 사건의 전말을 캐물었다. 유연석은 뭐 이제 여행이 끝났으니까라며 사이트 결제 시스템 중에 페이팔Pay pal이라는 미국의 전자 결제 시스템이 있었다. 그런데 내가 해외결제를 하면서 있었던 계정으로 결제를 했던 것이라고 말했다.결국 방비엥에서 있었던 3일간의 좋은 숙소는 유연석이 개인 돈으로 결제를 했던 것이었다. 유연석은 이서진 형님도 그러더라라며 이서진을 모방해 제작진에게 거짓말을 했다고 밝혔다. 유연석은 크게 지나치지 않으면 그 정도는 해도 되겠다고 생각했다고 전했다.한편 앞서 꽃청춘 40대 멤버 중 유희열은 자신의 신용카드를 몰래 사용하려 숨겼지만 쓰기도 전에 제작진에게 들켜 사용을 하지 못하기도 했다. 당시 유희열 또한 이서진도 그렇게 하던데라며 이서진을 따라한 것이라고 말한 바 있다.한편 오는 10일 오후 9시 50분에는 방송에 공개되지 않은 미방영분을 담은 꽃보다 청춘 in 라오스 감독판이 방송될 예정이다.케이블채널 tvN 꽃보다 청춘 4회. 사진  tvN  캡처신소원 기자 hopesswmydaily
불법이민 알선에 속아… 눈물의 유턴	http://news.naver.com/main/read.nhn?mode=LSD&mid=shm&sid1=102&oid=022&aid=0002718494	무허가 업체 난립 부작용 속출미국 보스턴에서 새롭게 시작해보려고 했는데 포기했어요.미국 취업이민을 준비했던 이모30씨는 최근 이민 알선업체의 미숙한 업무처리로 인해 꿈이 좌절됐다. 이씨는 지난 2월 미국 이민 수속을 대행하는 한 업체에 계약금으로 4000만원을 주었다. 알선업체는 건설업쪽 일자리를 소개해주겠다고 약속했다. 취업이민을 하려면 미국 고용주가 이민자를 보증한다는 서명을 해야 한다. 그런데 고용주 대신 미국측 알선업체가 서류에 서명했다. 결국 그의 이민신청은 연방정부에서 허가를 받지 못했다. 한국 알선업체는 우리는 서류를 보내는 일만 한다며 6개월간 진행상황에 대해 전혀 설명을 해주지 않았다. 이씨는 서울 강남대로에서 버젓이 영업하는 회사인데 무허가업체인 줄은 꿈에도 몰랐다고 말했다. 그는 한국소비자원에 중재를 신청했다.무허가 이주알선업체 난립으로 이민 희망자들의 피해가 끊이질 않고 있다. 미국은 911테러사건 이후 이민법을 강화했으며 호주도 최근 이민법을 강화했다. 이 때문에 현지 사정에 어두운 이민 희망자들의 피해가 줄지 않고 있다. 소비자원에 이민알선과 관련해 신고된 피해 구제신청은 2012년 22건에서 지난해 34건으로 늘었다. 상담건수도 매년 300400건씩 접수되고 있다.외교부에서 허가를 받아 이주공사란 이름으로 영업하는 업체는 전국적으로 70여곳이다. 서울 중구 남대문 일대와 미 대사관 근처 강남구 강남대로 인근에 수십개의 업체들이 서류대행 미국비자 대행 등 간판을 내걸고 영업하고 있지만 상당수가 무허가이다. 서울 종로구청 주변의 경우 25개 이주대행사가 영업을 하는데 이 중 허가를 받은 업체는 3곳에 불과하다. 나머지는 모두 무허가로 영업하는 것이다. 외교부에 따르면 유학과 어학연수 취업이민을 포함한 해외이민알선업 시장은 연간 5000여억원에 달한다.무허가 업체들은 보험가입이 안 돼 이민희망자들이 일이 꼬였을 경우 구제받기가 어렵다. 지난해 8월 캐나다 이민을 추진했던 최모43씨는 최장 6개월을 기다리면 취업비자를 받을 수 있다는 알선업체의 말을 믿고 캐나다로 향했다. 하지만 그는 현지 알선업체가 보증을 거부해 가족과 함께 쫓겨났다. 최씨는 국내 알선업체를 다시 찾았지만 도산해버리는 바람에 대행료 1300만원을 고스란히 떼였다. 무허가 알선업체에 대한 정부의 단속은 거의 이뤄지지 않고 있다. 외교부의 한 관계자는 단속을 해야 하는 경찰청 외사계 인원이 많지 않아 미등록 업체에 대해 손을 대지 못하고 있다고 말했다. 한국소비자원의 한 관계자는 허가받은 업체보다 무허가 업체와 분쟁하는 경우가 많다며 외국의 이민법이 강화되면서 이민수속을 알선업체에 맡기는 사람이 많은데 주의가 필요하다고 말했다.com오늘은 HOT포토 오늘의 지면보기   세상을 보는 눈 세계일보  Segye
세 살 '골밀도' 여든 간다…뼈 건강 어릴 때부터 챙겨야	http://news.naver.com/main/read.nhn?mode=LSD&mid=shm&sid1=103&oid=214&aid=0000421575	세살 버릇 여든 간다는 말 골다공증에도 통한다고 합니다. 앵커  뼈에 좋은 음식은 어릴 때부터 먹어야 좋다는 겁니다. 리포트  조금만 몸을 돌려도 저도 모르게 나오는 신음소리.넘어진 것도 아닌데 다리가 부러졌습니다. 강옥녀골절 골다공증 환자  일어나다 쓰러진 것도 아니고 철퍼덕 주저앉았는데 이렇게 됐어요.작은 충격에도 뼈가 부러진 건 골다공증 때문 이처럼 노년기 골절로 이어지기 쉽다고 알려져 여성들은 호르몬이 감소하는 중년 이후 칼슘 제재 등을 복용하는 경우가 많습니다.그러나 최근 미국 소아과학회는 노년의 뼈 건강은 성장기에 뼈가 얼마나 밀도 있게 형성되는지에 달렸다는 연구를 발표했습니다. 이재협서울의대 보라매병원 정형외과 교수 유아기와 청소년기때 충분히 골량이 향상 돼서 20대에 최대 골량을 유지를 해야 향후에 골감소증과 골다공증을 예방할 수 있습니다.하지만 우리 아이들의 뼈 건강은 열악한 수준입니다.10명 중 7명이 칼슘 섭취가 부족한 상태고 뼈를 튼튼하게 하는 비타민D는 초등학생은 8가 고등학생은 25가 부족한 것으로 나타났습니다.햇볕에 노출될 기회가 적어 비타민D 합성도 잘 안된 것입니다. 신민주엄마 손다현6살 밖에서 많이 놀아요 아니요.어린이집에서 많이 생활을 하니까 낮에 햇빛을 쐴 기회는 많이 없는 거 같아요
나도 모르게 없어진 철도 포인트…'쿠폰' 꼼수	http://news.naver.com/main/read.nhn?mode=LSD&mid=shm&sid1=103&oid=055&aid=0000288074	코레일도 항공사처럼마일리지 제도를 운영해 왔습니다. 그런데 지난해 7월에 이 마일리지 대신에 할인쿠폰 방식으로 제도를 바꿨습니다. 지금까지 모두 198만 6천 장을 제공했는데 이용객이 유효기간 전에 사용한 건 넉 장가운데 한 장에 그쳤습니다.기자거래처가 지방에 있어 KTX를 자주 이용하는 김영철 씨는 최근 요금을 결제하면서 이상한 점을 느꼈습니다.김영철서울 강남구  결제 과정에서 보면 포인트 부분이 따로 뜨지가 않더라고요. 그래서 저는 포인트가 아직덜 쌓였다고 생각했었는데.철도 마일리지 제도가 포인트 적립에서 할인쿠폰 지급 방식으로 바뀐 걸 몰랐던 겁니다.뒤늦게 이런 사실을 알고 할인쿠폰을 사용하려고 했지만 이미 유효기간이 지난 뒤였습니다.기존의 철도 포인트 유효기간은 5년인데 반해 새롭게 도입된 할인쿠폰의 유효기간은 단 3개월에 불과하기 때문입니다.송교준세종시  당연히 손해 보는 입장이죠. 소비자한테 미리 알려주지 않고서 3개월 안에 쿠폰 발급하고 하는 건.실제로 발급된 쿠폰 4장 가운데 3장이 유효기간 만료로 소멸 됐습니다.연간 할인쿠폰 이용액도 30억 원으로 제도 변경 전 193억 원의 16 수준으로 급감했습니다.강석호새누리당 의원  유효기간을 좀 더 늘리고 또한 대국민 홍보를 강화해서 할인 쿠폰을 제시간에 제때 사용할 수 있도록 해야 할 것입니다.조금이라도 부채를 줄여보겠다는 게 코레일의 의도라고 하더라도 소비자의 주머니를 터는 방식은 곤란하다는 지적이 나오고 있습니다
토요일 오전 동네병원 진료비, 4천원→4천5백원..	http://news.naver.com/main/read.nhn?mode=LSD&mid=shm&sid1=102&oid=214&aid=0000421565	내일부터는 개인병원을 토요일 오전에 가더라도 평일보다 진료비를 500원 더 내야 합니다.그동안 오후에만 적용하던 토요진료비 가산제를 오전 시간에도 적용하는 겁니다. 리포트 토요일 오후 1시 이후 동네 개인병원에서 진료를 받으면 평소보다 1천 원 비싼 5천 원을 내야 합니다.휴일인 토요일에 병원을 운영하는 데 드는 비용을 이용자인 환자가 부담한다는 토요 진료비 가산제 때문입니다.이 제도는 이제까지 토요일 오후에만 적용됐는데 내일부터는 토요일 오전에도 진료비 가산제에 따라 환자가 5백 원을 더 부담하게 됐습니다. 장은미병원 직원 토요일 오전부터 환자분들 초진 비용이 기존 4천 원에서 4천5백 원으로 인상 됩니다내년 이맘때면 또 5백 원이 오릅니다.당초 1천 원을 올리기로 했던 복지부 계획이 2년에 걸쳐 단계적으로 시행되는 것입니다.진료비가 10 이상 오르는 데 대한 불만의 목소리도 적지 않습니다.평일에 시간을 내기 어려운 직장인과 학생들은 주로 토요일에 병원을 가기 때문입니다. 심별님 32살직장인 평일에 병원에 갈 시간이 없거든요. 토요일에 갈 수 밖에 없는데부담스러울 것 같아요
