문화전파? 선전도구?…美·中, 공자학원 갈등	http://news.naver.com/main/read.nhn?mode=LSD&mid=shm&sid1=104&oid=008&aid=0003339334	베이징중국송기용 특파원시카고대학 공자학원 폐쇄  철폐운동 거세 소프트파워 중요수단 적극 육성중국 정부가 중국어와 문화 전파를 위해 세운 공자학원이 미국에서 퇴출위기를 맞고 있다. 미국은 공자학원이 단순한 교육기관이 아니라 중국 정부와 공산당의 선전 도구로 활용되고 있다며 공자학원 확산에 공을 들이는 중국에 제동을 걸었다.AP 통신 등 외신에 따르면 미국 시카고 대학은 지난 25일 성명을 발표해 29일로 계약이 만료되는 공자학원과의 계약을 갱신하지 않을 것이라고 밝혔다. 시카고 대학의 이번 조치는 소속 대학 교수들의 폐쇄 요구를 수용한 것으로 미국 내 다른 대학에도 영향을 미칠 전망이다.이에 앞서 4만7000여 명이 등록된 최대 규모의 미국대학교수협회AAUP는 지난 6월 공자학원 철폐운동을 선언했다. AAUP는공자학원이 중국 정부 산하기관으로 학문의 자유를 무시하고 공자학원 교수들의 임용과 교육을 통제하고 있다며 공자학원을 운영 중인 대학은 학원을 폐쇄하라고 주장했다.AAUP는 공자학원이 수업 중에 달라이 라마 티베트 등 중국 측에 민감한 주제를 언급하지 못하도록 하는 등 학문의 자유를 짓밟고 있다고 비판했다. 류옌둥 공산당 정치국위원 겸 국무원 부총리가 공자학원 이사장을 맡고 있다는 점을 들어 공자학원이 사실상 중국 공산당의 선전기구라는 의혹도 제기했다공자학원 측은 중국 정부로부터 정치적 색채의 내용을 가르치라고 지시받은 적이 없다며 AAUP의 문제제기는 터무니없다고 반박했다. 미국 내에서 이처럼 반발이 거센 것은 공자학원이 급속도로 증가하고 있기 때문이다. 공자학원은 2004년에 서울에서 세계 최초로 문을 연 뒤 10년 만에 123개국에 465개의 공자학원이 설립됐다. 특히 미국에는 스탠퍼드 컬럼비아 등 100개 대학에 공자학원이 개설됐다. 중국은 2015년까지 세계 각국에 60개의 공자학원을 추가로 설립키로 하는 등 적극적으로 나서고 있다. 중국 공산당 기관지인 인민일보는 24일 공자학원 10주년 관련 기사에서 공자학원이 중국의 소프트 파워 형성에 중요한 매개체가 되고 있다며 공자학원의 확산을 긍정적으로 평가했다
제주 허파 '곶자왈'도 잠식…한라산 허리에 '차이나타운'	http://news.naver.com/main/read.nhn?mode=LSD&mid=shm&sid1=102&oid=032&aid=0002526882	중국 녹지그룹이 제주국제자유도시개발센터와 제주 서귀포시 동홍동 일대에 조성중인 제주헬스케어타운의 분양사무소 위에 지난 27일 태극기와 중국 국기인 오성홍기가 나란히 나부끼고 있다. 왼쪽으로 서귀포 앞바다에 섶섬이 보인다. 수년 전부터 제주도에 급격히 투자를 늘리고 있는 중국자본들이 한라산 기슭에서 대규모 개발을 벌이면서 논란이 커지고 있다.제주  강윤중 기자 yajakyunghyang.com상 한라산 보호구역 위험제주에서 오른쪽으로 한라산과 오름제주에 분포하는 소형 화산체을 왼쪽으로는 바다를 끼고 서귀포시 표선면에서 동홍동 방면으로 1119번 지방도를 달리다 서귀포시 남원읍으로 접어들면 대규모 건설현장이 눈에 들어온다. 27일에도 이 일대에서는 이층주택 형태의 휴양 콘도미니엄을 짓는 작업이 한창이었다. 공사장 입구에는 기린산장이라는 중국어 공사 가림막이 선명하다. 중국 백통그룹이 추진 중인 백통신원 제주리조트 조성사업 공사현장이다. 헬스케어타운 콘도 분양 먼저 고도제한도 완화시민단체 숙박시설에 불과 경관 훼손은 불가피 보존 필요한 중산간에 개발붐2012년 11월 허가된 이 사업은 서귀포시 남원읍 위미리 55만에 콘도 472실과 관광호텔 200실 맥주박물관을 건립하는 내용이다. 하지만 해발 260320m 사이 중산간 지대에 들어서는 대규모 관광위락시설이라는 점에서 초기부터 논란을 불렀다.제주도의 해발 200600m 지역인 중산간은 지하수 함량이 풍부한 원시림인 곶자왈이 분포해 보존가치가 높다. 하지만 중산간이 수년 전 국내 자본들의 골프장 개발로 수난을 겪은 데 이어 최근 들어 중국 자본의 집중매입 대상이 되면서 우려가 커지고 있다. 중국자본인 람정제주개발이 추진 중인 신화역사공원 복합리조트도 곶자왈 지역이다. 2010년을 기점으로 투자를 급격히 늘린 중국자본들이 중산간 지역을 매입해 대규모 개발사업을 추진하면서 난개발 논란을 불러일으키고 있다. 제주의 청정자연이 돌이킬 수 없이 훼손당하는 것 아니냐는 우려도 나온다.붉은 물결 지난 27일 제주 솔오름 정상에서 바라본 서귀포 일대 전경. 아래쪽에 중국 종합부동산업체인 녹지그룹이 제주 서귀포시 동홍동 일대에 조성 중인 제주헬스케어타운이 그 위쪽 녹지 너머로 해안쪽에 제주 주민들이 거주하는 서귀포 시가지가 보인다.  강윤중 기자 yajakyunghyang.com제주시 한림읍 금악리 평화로 부근. 오름들이 물결무늬를 이루며 녹음을 자랑하는 중산간 지역에 붉은색 지붕을 씌운 주택이 수십채 건립돼 있다. 제주도가 부동산투자 이민제를 도입한 뒤 중국인을 대상으로 콘도를 짓기 위해 객실수를 지속적으로 늘려왔다. 2004년 사업 승인 당시 100실 규모였던 아덴힐 리조트는 현재 객실이 414실로 늘어났고 이 중 293실이 중국인에게 분양된 것으로 보인다. 아덴힐 리조트 인근에는 중국 흥유개발이 콘도 636실과 호텔 544실 어린이 테마박물관을 조성하는 차이나비욘드힐이 들어선다.서귀포시 동홍동 일대에선 제주헬스케어타운 공사가 한창이다. 중국 녹지그룹이 153만9000의 부지에 의료연구개발센터 휴양 문화시설 숙박시설 등을 조성할 계획이다. 하지만 단순히 대규모 숙박단지로 전락하는 것 아니냐는 의심 어린 시선을 받고 있다. 휴양 콘도 분양 사업을 우선 실시하면서 고도제한 완화 숙박시설과 상업시설의 면적을 늘리는 절차를 추진했기 때문이다. 건물 고도가 높아지면 한라산에서 서귀포를 잇는 경관을 훼손할 것이라는 우려가 나온다.   개발과 보전 균형 잃은 제주 중국 분마그룹은 제주이호랜드와 합작해 이호유원지에 유원지 개발사업을 추진하고 있지만 해수욕장 사유화 논란이 일고 있다. 중국계 자본인 오삼코리아주는 제주도의 절경인 섭지코지 일대에 콘도를 건설 중이다. 이를 포함해 제주 10여곳에서 중국자본에 의한 대규모 개발 사업을 추진하고 있다. 제주도에 중국자본이 급격히 유입된 것은 투자 기업에 세금을 감면해주고 5억원 이상을 투자한 외국인에게 영주권을 주는 부동산투자 이민제가 영향을 미쳤다. 하지만 투자유치에만 급급해한 결과 개발과 보전의 균형이 허물어지고 있다는 논란이 끊이지 않는다. 이영웅 제주환경운동연합 사무국장은 최근 제주개발 논란은 중국자본이기 때문이라기보다는 이윤 창출만을 노리는 대규모 자본의 공통된 문제라고 말했다.제주  박미라 기자 mrparkkyunghyang.com 모바일 경향 경향 뉴스진  경향신문 앱  모바일웹  공식 SNS 계정 경향 트위터 페이스북 세상과 경향의 소통 커뮤니티  경향신문www
'팝의 전설' 마이클볼튼, '불후' 위해 한국 땅 밟다	http://news.naver.com/main/read.nhn?mode=LSD&mid=shm&sid1=106&oid=108&aid=0002342651	김소연 기자본문 이미지 영역 팝 스타 마이클 볼튼 사진인천국제공항 이기범 기자팝의 전설 마이클 볼튼이 불후의 명곡전설을 노래하다 출연을 위해 한국을 찾았다.마이클 볼튼은 28일 오후 6시께 인천국제공항을 통해 입국했다. 마이클 볼튼은 오는 29일 서울 여의도 KBS 신관 공개홀에서 진행될 KBS 2TV 불후의 명곡전설을 노래하다이하 불후의 명곡 녹화에 전설로 참여할 예정이다. 이날 마이클 볼튼은 청바지에 재킷을 입은 간편한 차림으로 한국 취재진 앞에 등장했다. 팝의 전설의 등장에 취재진의 시선은 단숨에 쏠렸다.마이클 볼튼은 자신의 입국을 취재하기 위해 온 취재진을 향해 손을 흔들며 반갑게 인사를 했다. 또한 공항에서 자신을 알아보는 팬들에게 환한 미소를 지었다. 마이클 볼튼 측 관계자는 마이클 볼튼은 불후의 명곡 출연을 위해 직접 한국을 찾았다며 불후의 명곡 출연 이외에 방송 프로그램은 하지 않을 것이라고 밝혔다. 관계자는 마이클 볼튼은 불후의 명곡 녹화를 마친 후 오는 30일 오후 출국할 예정이다고 말했다.본문 이미지 영역 팝 스타 마이클 볼튼 사진인천국제공항 이기범 기자마이클 볼튼은 지난 1975년 1집 앨범 Michael Bolotin으로 데뷔했다. How am i supposed to live without you를 비롯해 수많은 히트곡으로 세계적으로 사랑 받았다. 그래미 어워드 2번 아메리칸 뮤직어워드 6번을 수상했다.불후의 명곡에 외국인 전설이 등장하는 것은 마이클 볼튼이 처음이다. 불후의 명곡  관계자는 마이클 볼튼의 단독 무대 가능성에 대한 여지도 밝힌 바 있어 기대감이 고조되고 있다.한편 마이클 볼튼이 출연하는 불후의 명곡 녹화에는 소향 박정현 문명진 에일리 효린 박재범 서지안 등이 출연한다. 오는 10월 중 방송 예정
아동학대 평가 지표도 없이… 특례법 불안한 출발	http://news.naver.com/main/read.nhn?mode=LSD&mid=shm&sid1=102&oid=469&aid=0000021096	특례법 오늘 시행 남은 과제는 상신고 때 출동 상담원 턱없이 부족 재학대 가능성 평가 척도도 미완성전문심리치료사 등 사후관리도 부재   지난해 사회적으로 큰 충격을 줬던 울산과 칠곡의 아동학대 사망 사건은 남이 개입할 수 없는 가정 내부의 일 교육적으로 불가피한 체벌 등으로 여겨졌던 아동학대에 대한 사회적 인식을 송두리째 바꿔놓았다. 그 결과 아동학대 범죄자의 처벌 강화와 피해 아동에 대한 신속한 보호를 골자로 한 아동학대범죄의 처벌 등에 관한 특례법이 지난해 말 국회를 통과했고 29일부터 시행된다. 법과 제도가 바뀌었지만 아동학대 범죄에 대한 신속한 초기 대응과 원활한 사후관리가 이뤄질 수 있을지 현장의 우려는 크다. 당장 아동학대 신고가 들어오면 경찰관과 아동보호전문기관 상담원이 현장에 동행 출동해야 하지만 상담 인력은 턱없이 부족하다. 학대 위험성을 평가공유하는 지표도 아직 마련되지 않았다. 28일 보건복지부와 중앙아동보호기관 등에 따르면 아동학대범죄행위자 및 학대피해아동 처분을 위한 아동학대위험도 평가척도가 아직 개발 중이다. 평가척도는 상담원과 경찰관들이 현장에서 목격하고 들은 것을 적어 아동학대와 관련해 일관성 있는 상황 판단을 내리고 지속적인 사후관리를 하기 위해 필수적인 항목이다. 법무부가 예산 1500만원을 들여 중앙아동보호기관과 올해 6월 연구 용역을 맡겼지만 아직 완성되지 않았다. 피해아동을 원가정으로 복귀시키는데 중요한 영향을 미칠 재학대 가능성 평가 척도도 아직 다듬어지지 않았다. 중앙아동보호기관 관계자는 아직 평가 척도를 지역아동보호기관에 보내 신뢰도와 타당성을 검증하진 못했다며 적어도 1년은 해야 할 연구를 5개월 만에 급하게 진행하게 돼 평가척도가 현장 의견과 괴리가 생길 수 있다고 말했다. 특례법 시행으로 아동학대 신고를 접수한 아동보호전문기관 상담원은 조사 권한을 받아 지체 없이 출동해야 하지만 경찰과 보조를 맞출 인력은 턱 없이 부족하다. 한선희 전남아동보호전문기관장은 그 동안 상담원들은 인력부족 때문에 12시간 내에 출동해야 했던 기존 규정도 지키는 것이 힘든 상황이었다며 전화로 피해아동의 안전을 체크하며 다음날 현장 출동할 수 밖에 없었는데 전남 지역 보호기관 3곳에서 관할경찰서 21곳과 지구대 206곳의 동행 출동 요구를 어떻게 이행할 수 있을 지 난감하다고 말했다. 상담원 부족 문제는 26일 열린 전국 50곳 아동보호기관장 회의에서 예산 문제와 함께 주로 논의된 안건이기도 했다. 한 관장은 피해아동은 초기에 누가 어떻게 상담조사하느냐에 따라 진술하는 학대 내용이 크게 차이난다며 진술이 왜곡되지 않도록 경찰의 학대예방 교육 정례화도 필요하다고 했다. 학대 피해 아동의 종합심리검사를 할 수 있는 전문 심리치료사도 부족해 사례관리사후관리가 체계적으로 진행되기 어렵다는 지적도 있다. 중앙아동보호기관에 따르면 현재 종합심리검사를 수행할 수 있는 임상심리치료사2급석사 학위 소유자 자격을 가진 전문가는 10명 미만이다. 낮은 처우에 지원자가 적어 회당 25만30만원에 이르는 심리검사비를 주고 외부 심리검사센터에 의뢰한다는 게 아동보호기관의 설명이다. 이영선 남양주아동보호전문기관 상담팀장은 그동안 심리검사비는 시 보조금으로 충당해 왔는데 학대행위자에게도 의무화된 심리치료에 별도의 정부 예산 투입이 이뤄지지 않으면 운영 자체가 곤란한 상황이라고 말했다. 학대를 인지하거나 알리기 힘든 영유아에 대한 학대방지책도 보완돼야 한다는 지적이다. 장화정 중앙아동보호기관장은 영유아에 대한 학대를 조기 발견하고 예방하려면 가정에 들어가 모니터링하는 수밖에 없어 아동보호전문기관의 가정방문서비스가 의무화돼야 하는데 아직 국가 정책에 반영되지 않았다며 특별한 사유 없이 영유아에게 예방접종을 하지 않는 가정 등 아동학대방임이 의심되는 가정을 모니터링할 수 있어야 한다고 말했다
내부고발 보호 못하는 '보호法'	http://news.naver.com/main/read.nhn?mode=LSD&mid=shm&sid1=102&oid=022&aid=0002716161	부패비리 예방 기여 불구배신자로 찍혀 왕따 여전국내 굴지의 A기업은 실제 아무런 역할도 하지 않는 계열사를 중간유통 단계에 넣고 수십억원의 유통마진을 챙겨주다가 적발됐다. 이 계열사 대주주인 총수 일가의 배를 불려주기 위해 통행세라는 명목의 관행을 저지르다 외부에 발각된 것이다. A기업은 지난 4월 공정거래법 위반 혐의로 공정거래위원회로부터 27억여원의 과징금을 부과받았다. 이 내용을 처음 신고한 제보자는 공익신고자 보호법에 따라 2억여원의 보상금을 받을 예정이다.재작년 8월 B씨는 부산에서 산업기능요원으로 근무하다가 방사선 피폭 위험 현장을 발견하고 고용노동부 등에 신고했다. 신고내용 중 상당 부분이 사실로 드러나면서 B씨가 일하던 회사는 산업기능요원 종사 지정업체 등록이 취소됐다. B씨는 공익신고자 표창을 받았으나 440일 복무연장 처분도 당해야 했다. 병역 혜택을 받을 수 있는 생산 분야가 아니라 기획 분야에서 근무한 사실도 신고과정에서 드러난 탓이다. 회사 지시에 따른 근무처 변경이었으나 정상 참작이 되지 않았다. 공익신고자 보호법의 빛과 그림자공익신고자 보호법이 시행된 지 30일로 3년째를 맞는다. 이 법은 공익을 침해하는 행위를 신고한 사람을 보호하고 지원함으로써 투명하고 깨끗한 사회 풍토를 확립하기 위한 목적으로 2011년 제정됐다. 공익신고자의 인적사항 공개를 금지하고 공익신고를 이유로 신고자에게 불이익 조치를 내릴 경우 징역 2년 이하 또는 2000만원 이하의 벌금을 부과하는 게 골자다. 세계일보가 28일 국민권익위원회로부터 입수한 공익신고 접수 및 처리 현황 자료에 따르면 시행 첫해 292건에 불과했던 공익신고가 올해는 벌써 5300건지난 12일 기준을 돌파할 정도로 급증했다.공익신고로 국가나 지방자치단체의 과태료 과징금 벌금 등의 수입이 발생한 475건에 대해서는 3억979만원의 신고보상금이 지급됐다. 공익신고자 보호법은 감독기관의 노력만으로는 통제하기에 한계가 있는 일선 현장의 부패비리 등을 제보를 통해 적발할 수 있도록 해 사회에 경종을 울리고 범죄 예방에도 상당 부분 기여한 것으로 평가된다. 하지만 B씨처럼 여전히 우리 사회 다른 한쪽에서는 내부고발자로 낙인찍혀 따돌림을 당하고 해고 등 신분상 불이익을 당하는 사례가 되풀이되고 있다. B씨는 현행 법령상 불리한 행정처분을 감면받을 근거 조항이 없어 보호받지 못했다. 공익신고자 보호법의 사각지대는 행정처분뿐이 아니다. 차명계좌를 이용한 기업의 비자금 비위생적인 학교급식 현장을 신고하더라도 보호받을 수 있는 길이 없다. 애초에 법 적용 대상이 180개 법률로 제한돼 공익제보의 상당 부분을 차지하는 형법상 배임이나 횡령 사립학교법 위반 등은 포함되지 않는다.손질해야 하지만 법개정은 지지부진전문가들은 공익신고자 보호법 전반에 대한 대대적인 보완이 필요하다고 입을 모은다. 현행법의 적용 대상을 확대하고 보호장치도 강화해야 한다는 것이다. 공익제보자를 지원하는 시민단체 호루라기재단의 이지문 상임이사는 통화에서 법을 만들 때부터 문제를 제기했는데 전체 법률의 15 정도만 보호대상에 들어가고 정부기관이 아닌 언론에 제보하면 보호받지 못하는 것은 국가편의주의적 발상이라며 공익제보자가 합리적인 보호를 받는 것은 물론이고 기업 내부에서 승진 가산점을 주는 등 혜택을 확대하는 방향으로의 전환을 검토해야 한다고 주장했다. 한국반부패정책학회장을 맡고 있는 김용철 부산대 교수는 사회 전반에 내부고발자는 배신자 고자질쟁이라는 부정적인 이미지가 형성돼 있다며 사회적 분위기를 바꾸기 위해서는 정부 차원의 강력한 의지가 가장 중요하다고 지적했다.3년 전 법 제정을 주도한 국민권익위도 제도 운영의 한계를 인식하고 법 개정을 추진 중이다. 권익위는 공익신고자 보호법 대상 법률을 280개로 확대하는 내용의 개정안을 지난해 9월 국회에 제출했다. 그러나 1년째 국회 정무위에 계류 중이다.com오늘은 HOT포토 오늘의 지면보기   세상을 보는 눈 세계일보  Segye
"상가 권리금 보호, 재건축 땐 어떻게 할 건가요"	http://news.naver.com/main/read.nhn?mode=LSD&mid=shm&sid1=101&oid=469&aid=0000021087	권리금 보호 입법 풀어야 할 세 쟁점재건축재개발 때 보호장치 필요 권리금 양성화 증세 이어질 가능성권리금 보호 명목 임대료 올릴 우려  현 정부에서 쏟아낸 많은 정책 중 지난 주 상가 임차권 권리금 보호방안만큼 진보시민단체로부터 극찬을 받은 정책은 없었다. 현 정부의 유일한 서민정책노동당 가짜 민생법안들과는 차원이 다른 민생 입법 사례참여연대 등 호평이 쏟아졌다.  하지만 아무리 취지와 방향이 좋다고 해도 촘촘한 입법이 이뤄지지 않는다면 자칫 실효성이 없고 형평성이 떨어지는 대책으로 전락할 수 있다. 시간이 지날수록 제도 보완을 요구하는 목소리들이 점점 커져가는 양상. 향후 입법 과정에서 반드시 풀어야 할 숙제들을 쟁점 별로 짚어본다. 재건축 시 임차인 권리금  2년 전 서울 강남역 인근 3층짜리 S빌딩에 권리금 1억2600만원을 포함해 총 3억원을 투자해 10평 남짓 규모의 카페를 시작한 엄모씨. 그는 얼마 전 건물주로부터 청천벽력 같은 소식을 들었다. 조만간 건물을 부수고 14층 규모로 재건축하겠다는 내용이었다. 1억원이 훨씬 넘는 권리금을 불과 2년 만에 떼일 처치가 된 것이다. 엄씨는 보증금에 거의 맞먹는 권리금을 내고 임차를 했는데 돌려받을 방법이 전혀 없다니 너무 기가 막힌다고 깊은 한숨을 내쉬었다.  권리금 법제화 이후 남겨진 가장 큰 논란 거리는 엄씨의 경우처럼 임차 점포가 속한 건물이 재건축이나 재개발 될 경우의 권리금 보상 장치가 포함되지 않았다는 점이다. 권구백 전국상가세입자협회 회장은 건물주가 재산 증식을 위해 재건축을 시행하면 1억원이 넘는 권리금을 내고 불과 1년을 장사했더라도 빈손으로 쫓겨나야 한다고 지적했다. 국회 정무위원회 민병두 의원새정치민주연합은 2009년 용산참사의 배경이 되었던 용산 재개발과 같은 경우에는 상가권리금이 전혀 보호되지 않는다며 일반적인 경우보다는 보호 수위가 낮아질 수는 있다 하더라도 재건축이나 재개발 시에도 최소한의 권리금 보호는 필요하다고 주장했다. 권리금 양성화  증세  이번 대책에는 전현 임차인 간에 표준계약서를 쓰도록 권고하는 내용이 담겨 있다. 권리금과 관련된 증빙이 별도 계약서 없이 영수증 수수로만 이뤄지고 있어서 분쟁을 사전에 예방하고 안전한 권리금 거래를 가능하게 하기 위한 것이라는 게 정부의 설명이다.  하지만 표준계약서를 통해 권리금이 그대로 노출되는 경우 과세당국의 세금 부과로 이어질 공산이 크다. 기획재정부 역시 증세를 위한 것은 아니다고 선을 그으면서도 권리금은 소득세법에 나와 있는 기타소득의 하나라고 인정을 한다. 물론 의무가 아니라 권고 사항이라지만 임차인 입장에서 권리금을 보호받으려면 표준계약서를 쓸 수밖에 없을 거라는 관측이다. 게다가 권리금이 적힌 계약서를 공인중개사 거래정보망에 등록하는 방안까지 추진 중인 만큼 세원 노출에 대한 우려는 증폭될 수밖에 없다. 일각에서 증세 꼼수가 아니냐는 지적이 끊임없이 제기되는 이유다. 이에 따라 세금을 회피하기 위한 다운계약 작성 등 편법이 횡행할 가능성도 배제할 수 없는 상황. 그렇잖아도 담뱃세 주민세 인상 등으로 증세 논란에 휩싸여있는 정부로선 충분한 설득이 필요해 보인다. 임대료 상승 기폭제  그 동안 적지 않은 임대인들은 임차인들끼리 주고 받는 권리금에 대해 큰 관심을 두지 않아온 것이 사실. 하지만 이번 대책으로 모든 임대인이 임차인 권리금 회수를 방해했다고 판단되는 경우 손해배상책임을 질 수 있도록 한 만큼 권리금에 대해 신경을 곤두세울 수밖에 없다. 전문가들은 본인들이 받지도 않는 권리금에 대해 배상 책임이 부과된 만큼 임대인들은 높게 형성된 권리금을 임대료로 전가할 공산이 크다고 지적한다. 선종필 상가뉴스레이더 대표는 권리금이 높게 형성된 상권에서는 임대인들이 임대료를 인상하려는 움직임이 늘어날 것이라고 내다봤다.  이밖에 정당한 사유가 없다면 기존 세입자가 주선한 새 임차인과 계약하도록 한 것을 두고도 정당한 사유에 대한 좀더 명확한 기준이 필요하다는 지적이 많다
