한 발 앞은 '절벽'…우린 지금 너무 '절박' 하다	http://news.naver.com/main/read.nhn?mode=LSD&mid=shm&sid1=102&oid=028&aid=0002267588	청년실업률 왜 오를까2월 청년실업률 16년만에 가장 높은 11.1 기록청년들 적극적 구직 나섰지만 채용의 벽 높아일자기 찾기 나서지 않던 청년 비경제활동인구 지난해 27만2천명 줄어14만8천명만 취업 성공 청년실업률이 2012년 8.3에서 해마다 상승 추세를 보이며 올 2월에는 16년 만에 가장 높은 11. 하지만 청년고용률도 2월 기준으로 2013년 39에서 올 2월 41. 비경제활동인구가 줄어들면서 실업률과 고용률이 동시에 오르고 있는 것은 청년들이 일자리를 구하려고 적극 나서고 있지만 이들을 다 흡수하기에는 일자리가 부족하다는 뜻이다. 18일 통계청의 2월 고용동향을 보면 일자리 찾기에 나서지 않던 청년층 비경제활동인구는 줄어들고 경제활동인구가 438만3000명으로 1년 전434만2000명보다 4만1000명 늘었다. 이 가운데 3만명은 일자리를 찾았고 1만1000명은 실업자로 남았다. 청년 비경제활동인구가 줄어드는 추세는 지난해부터 뚜렷해지고 있다. 2013년 2월 545만7000명이던 비경제활동인구가 지난해 2월 27만2000명이나 줄었다. 14만8000명이 취업에 성공했고 실업자로 남은 청년이 10만2000명이다. 4주간 일자리를 찾아 적극적으로 구직활동을 하고 일자리가 주어지면 즉시 취업이 가능해야만 비경제활동인구에서 경제활동인구로 포함될 수 있다.전문가들채용시장 어려워지면 청년구직자들은빨리 취업하려고 뛰어들게 된다정부는 다른 분석고용시장 나아지고 있다 생각해구직에 나선 것 아닌가 싶다 이처럼 취업에 나서지 않던 청년들이 일자리를 얻으려고 뛰어들고 있는 이유는 뭘까 등록금 대출과 부모들의 조기은퇴로 경제적인 문제가 영향을 주거나 갈수록 취업이 힘들어져 위기감이 커지고 있기 때문이라는 지적이 나온다. 취업포털 잡코리아 현영은 과장은 갈수록 취업문이 좁아지니까 지금 아니면 안 되겠다는 마음이 생기는 것 같다. 예를 들어 삼성 직무적성검사SSAT는 올해 상반기 지원이 마지막 기회다. 이 기회를 잡으려고 거의 폭주하고 있다며 채용시장이 어려워지면 청년 구직자들은 하루빨리 취업하려고 뛰어들게 된다고 말했다. 정준영 청년유니온 정책국장은 구직활동을 하지 않던 청년들이 경제적 문제 등으로 더 이상 버티기 힘든 상황이 되면서 일자리가 좋지 않더라도 일단 취업 활동에 나선 것으로 보인다고 말했다. 정부는 지난해 전체 취업자 수가 증가하는 등 일자리가 늘어난 것에 영향을 받은 것 같다고 분석했다. 통계청 관계자는 지난해 50만명 이상 취업자가 늘어나는 등 고용시장이 나아지고 있다고 생각해 청년들이 구직에 나서고 있는 것 아닌가 싶다고 말했다. 비록 청년고용률은 높아졌지만 일자리의 질은 형편없이 낮은 수준이다. 청년들은 제조업이나 숙박 및 음식점 쪽에 취업을 많이 한 것으로 나타났다. 통계청 경제활동인구 조사의 청년층 부가조사를 보면 지난해 학교를 졸업하거나 중퇴하고 처음 가진 일자리가 1년 이하 계약직이었던 1529살 청년은 76만1000명이나 됐다. 취업을 경험했던 389만5000명 중 19.5로 5명 중 1명은 1년 이하의 계약직으로 직장생활을 시작하는 셈이다. 통계청 자료를 보면 지난해 기준으로 1519살 청년 중 69.5는 아르바이트 등 비정규직으로 일하고 있으며 2029살에서도 비정규직 비중이 32에 이른다. 올해는 30대 그룹에서 신규채용을 줄일 계획이어서 좋은 일자리는 더욱 줄어들 것으로 보인다. 전국경제인연합회는 최근 30대 그룹에서 올해 신규채용 규모를 1년 전보다 6.3 줄인 12만1801명을 채용한다고 밝혔다. 정준영 정책국장은 절박한 마음에 비정규직으로 취업한 청년들은 곧 실업자가 되고 다시 구직 포기를 할 가능성이 높다며 이런 악순환을 되풀이하지 않기 위해서는 대기업은 신규채용을 줄일 게 아니라 정규직 채용을 늘려야 하고 중소기업도 좋은 일자리를 만들 수 있는 산업생태계가 만들어져야 한다고 강조했다.세종김소연 기자 김정필 기자 dandyhani
튀니지 박물관서 괴한 총기난사…외국 관광객 등 9명 사망	http://news.naver.com/main/read.nhn?mode=LSD&mid=shm&sid1=104&oid=001&aid=0007473270	다른 관광객 21명 부상하고 범인 2명도 숨져인질극 상황 종료    카이로 한상용 특파원  북아프리카 튀니지 수도 튀니스의 한 유명 박물관에서 18일현지시간 무장 괴한이 외국인 관광객 등을 인질로 잡고 군경과 대치하다 최소 9명을 살해했다고 튀니지 국영TV 등 현지 언론이 보도했다.    보도에 따르면 칼라시니코프 소총과 사제 폭탄으로 무장한 군복 차림의 남성 2명이 이날 정오께 튀니지 국회의사당 주변에서 총격을 가하고 나서 인근 바르도 국립박물관에 진입했다.    괴한들은 이후 박물관 내부에서 총탄을 발사해 관광객 8명이 목숨을 잃었다고 보안 관계자는 전했다.     부상자도 폴란드인 4명 이탈리아인 2명을 포함해 21명에 달하는 것으로 나타났다. 나머지 대부분 관광객은 사건 발생 즉시 박물관을 빠져나왔다.    한 목격자는 괴한들이 의사당을 거쳐 박물관에 들어가 관광객들을 인질로 잡았다고 말했다.    인질 중에는 영국과 이탈리아 프랑스 스페인 국적 관광객들이 포함돼 있었다고 BBC는 보도했다.    당시 이 박물관에는 버스를 타고 온 관광객 100여명이 머물고 있었다.    튀니지 내무부 대변인 무함마드 알리 아루이는 희생자 가운데 1명은 튀니지인이고 나머지 7명은 외국인이라고 밝혔으나 이들의 국적은 즉각 확인되지 않았다.    튀니지 대테러부대와 경찰이 박물관 내부 진입 작전을 펼친 끝에 인질극 상황도 종료됐다. 이 과정에서 경찰관 1명이 숨지고 범인 2명은 현장에서 사살됐다.    괴한들의 정체는 아직 알려지지 않았다.    사건이 발생한 박물관은 튀니지 역사 유물과 로마시대 모자이크 수집물 기독교이슬람 양식의 조각품 등을 전시한 것으로 유명해 외국인 관광객들이 자주 찾는 곳이다.    튀니지에서는 2002년 남부 휴양지 제르바의 유대인 회당 유적 밖에서 차량 폭탄테러가 발생해 관광객 21명이 숨지는 참사가 벌어진 바 있다. 당시 알카에다가 테러공격 배후라고 스스로 주장했다.    튀니지는 2년 전 이른바 재스민 혁명으로 지네 엘 아비디네 벤 알리 정권을 무너뜨리고 아랍의 봄을 촉발시켰으나 이후에도 이슬람주의와 세속주의 세력의 대립으로 정치적 불안정이 지속하고 있다.    이런 상황에서 수니파 무장조직 이슬람국가IS에 가입하기 위해 이라크와 시리아로 떠난 튀니지인들은 3천여명에 달하는 것으로 추산된다고 AFP통신은 전했다
자위대 족쇄 푼 일본…미국과 군사동맹 범위 '전 세계로'	http://news.naver.com/main/read.nhn?mode=LSD&mid=shm&sid1=104&oid=028&aid=0002267629	일본 연립여당 안보법제 큰틀 합의일본 안보법제와 미일 안보협력지침 어떻게 변하나 클릭하면 확대됩니다.18일 일본 연립여당인 자민당과 공명당이 안전보장의 법적 정비에 관한 여당협의이하 여당협의를 열어 합의 문서를 채택했다는 사실은 아베 정권 들어 2년 넘게 이어져 온 집단적 자위권 행사를 비롯한 안보 법제 정비와 관련된 논의가 거의 마무리 됐음을 뜻한다. 일본 정부는 이같은 합의 내용을 바탕으로 4월 말께 유사시 미군과 자위대의 역할 분담 내용을 정해 둔 미일 안보협력지침가이드라인 개정안을 확정하게 된다. 4월 말께 확정되는 미일 안보협력지침의 특징은 크게 두 가지를 꼽을 수 있다. 첫째는 미일 동맹의 활동 지역이 기존의 일본 주변이라는 지역적 한계를 넘어 그야말로 전 세계로 확장된다는 점이다. 이날 합의문에는 이 내용이 명확히 표현되지 않았지만 미일 양국 정부는 지난해 10월3일 발표한 미일 방위협력지침의 개정에 관한 중간보고에서 미일 동맹은 아시아태평양과 이것을 넘어서는 지역에 대한 긍정적인 공헌을 계속하는 국제적 협력의 기반 미일 양국의 전략적 목표와 이익은 완전히 일치하며 아시아태평양과 그것을 넘어서는 지역의 이익이 된다고 못박은 바 있다. 이에 견줘 1997년 9월 작성된 현행 가이드라인엔 미일 동맹에 대해 동아시아 지역에 긍정적 영향을 주는 것 정도의 언급에 그치고 있다.동아시아 한정한 활동지역 확장파견 제약 조항도 대폭 완화해집단적 자위권 위해 새 요건 명기미일 안보지침 개정때 반영할듯 두번째 특징은 일본이 미국의 무력행사를 후방 지원하는 과정에서 그동안 스스로에게 부과해왔던 제약들을 과감하게 벗어던졌다는 점이다. 일본은 지난해 7월 각의결정을 통해 미국을 후방 지원하는 공간적인 배경을 현재의 공해 등 지금까지 전투행위가 일어나지 않았고 활동 기간 동안 전투행위가 벌어지지 않을 것이라고 인정되는 곳에서 현재 전투행위가 벌어지지 않는 곳으로 완화한 데 이어 이번 여당협의를 통해 그동안 금지해 왔던 탄약 등까지 미군에 공급할 수 있도록 논의를 진행하고 있다. 이와 함께 현재는 금지돼 있는 현재 발진 대기 중인 전투기에 대한 급유도 허용 쪽으로 기울고 있다. 이런 적극적인 모습은 일본이 앞으로는 자위대가 미국의 무력 행사와 일체화될 수 있다는 국내외의 우려에 더 이상 신경 쓰지 않기로 태도를 정했다는 의미로 해석할 수 있다. 이같은 방향으로 일본 안보 법제가 개정되고 나면 미일 동맹은 지역 동맹에서 전 세계를 무대로 지원을 주고 받는 글로벌 동맹으로 위상이 올라가게 된다. 미일의 지휘체계도 지금보다 더 일체화된다. 한국과 달리 독자적인 작전권을 행사하는 일본은 미일이 각각 독자적인 지휘 체계를 유지하고 있다. 이와 관련해 아사히신문은 18일 앞으로 방위성 지하 중앙지휘소에 미군 간부가 상주하는 방향으로 미일이 조정 중이다라면서 중앙지휘소는 사실상 자위대의 최고사령부에 해당하기 때문에 유사사태나 재해가 발생했을 때 양국간의 연대가 강해지게 된다고 보도했다. 집단적 자위권에 대해선 지난해 7월 각의결정 때 일본 정부가 만든 무력행사를 위한 새로운 3요건의 내용을 미일 방위협력지침 안에 명기할 예정이다. 그러나 일본의 사정을 고려해 집단적 자위권이라는 단어는 사용하지 않을 가능성이 높다고 일본 언론들이 전했다. 미일간의 방위협력 지침은 냉전시대 말기인 1979년에 처음 만들어진 뒤 1993년 시작된 제1차 북핵위기 등 안보 환경의 변화를 반영해 1997년 1차 개정이 이뤄진 바 있다. 이번 2차 개정은 미국의 쇠퇴와 중국의 부상이라는 거대한 힘의 역학 변화를 반영해 자위대가 전 세계를 배경으로 미국을 좀더 적극적으로 후방 지원할 수 있도록 하는 내용이 뼈대가 되고 있다.  도쿄길윤형 특파원 charismahani
1%대 금리 시대가 금을 가져다주진 않아요	http://news.naver.com/main/read.nhn?mode=LSD&mid=shm&sid1=101&oid=036&aid=0000033934	21 한국은행 금융통화위원회 본회의서 사상 처음으로 기준금리를 1.75로 내려이자 부담은 줄겠지만 자산 소득은 줄어드는 효과가 더 클 수도한국은행이 돈을 쥐고 있지 말고 부동산과 주식 투자에 나서라는 종을 울렸다. 한국은행은 3월12일 금융통화위원회 본회의를 열어 기준금리를 연 2에서 1. 기준금리가 1대로 떨어진 것은 사상 처음이다. 기준금리 1대 사상 처음 이주열 한국은행 총재는 내수 회복세가 생각보다 상당히 미약했다. 이 상태가 오래가면 성장 잠재력의 저하까지 연결될 수 있다. 이런 가능성을 미리 방지하기 위한 차원이라고 금리 인하의 배경을 설명했다.기준금리는 은행의 은행 한국은행이 금융사와 자금 거래를 할 때 쓰는 금리를 말한다. 한국은행은 시장에 흘러다니는 돈의 양을 조정하는 방법의 하나로 만기가 7일인 채권환매조건부증권을 금융사에 사고파는데 이때 기준금리를 적용한다. 이 기준금리를 인하하면 은행이 가계와 기업 등 소비자에게 빌려주는 시중금리가 내려가는 효과가 있다. 이주열 한국은행 총재가 지난 3월12일 서울 중구 남대문로 한국은행 본점에서 금융통화위원회 전체회의의 시작을 알리는 의사봉을 두드리고 있다. 이날 한국은행은 기준금리를 2에서 1.  신소영 기자따라서 기준금리 인하는 예금과 대출금리 인하 대출금리 인하에 따른 대출 증가 대출 증가에 따른 주택 매매 증가 저금리 장기화로 인한 전세의 월세 전환 가속화 등 일반 시민의 경제활동에 큰 영향을 끼칠 것으로 전망된다. 기준금리 1 시대를 맞아 일반 시민의 관점에서 주요 쟁점을 전문가들에게 물어 정리했다.  일반 시민에게 끼치는 영향은예금과 대출 금리가 떨어지는 게 직접적인 효과다. 가계 입장에서 보면 대출에 대한 이자 부담이 줄어드는 효과가 있지만 동시에 예금이나 자산으로 얻는 수익이 문제될 수 있다. 한국은행은 금리 인하 효과를 이야기하면서 대출비용이 줄어드는 것보다 연금이나 이자로 얻는 소득이 축소되는 효과가 더 클 수 있다고 했다. 예금으로 노후 생활을 준비하는 사람에게는 민감한 부분이다.장보형 하나금융경영연구소 경제연구실장장보형 경제연구실장은 금리 인하를 마냥 반길 일은 아니라고 했다. 금리 인하로 시중에 돈이 풀리면서 소비와 투자가 느는 등 경기가 부양되는 효과를 보겠다는 것인데 금리 인하와 소비투자 증대의 연결고리가 끊어진 상태라고 했다. 저금리가 유지되면서 돈이 그동안 많이 풀렸다. 그 돈 가운데 대기업에 가 있는 게 많다. 기업이 투자나 고용을 늘리기보다 보수적 경영으로 유동성을 확충하고 있었다. 결국 기업을 통해 돈이 돌지 않는 동맥경화와 비슷한 상황이다. 돈을 계속 풀어도 큰 효과가 없을 수 있다.  주식이나 펀드 살까 말까 일반 시민은 그래도 고민이다. 예금 이자가 중요한 수입원이거나 향후 재테크 수단으로 적금을 고려하는 사람이 적지 않기 때문이다. 반면 돈이 풀리면 주가가 오를 가능성은 크다. 금리 인하가 발표된 다음날인 3월13일 주식시장코스피은 전날보다 15. 지금이 주식이나 펀드를 사야 할 때인지 고민을 던져준다. 주식은 가격 변동의 위험이 있다. 위험을 감수할 수 있느냐를 생각해야 한다. 물론 한국 기업의 주가가 저평가된 면이 있고 외국인 투자자들의 평가도 나쁘지 않다. 원론적인 이야기이지만 여윳돈이 있는 사람에게만 주식투자를 권한다.장보형 경제연구실장금리가 떨어졌다고 예금에서 펀드로 자금을 이동하는 것은 추천하고 싶지 않다. 거액의 예금이 있는 사람은 고려해볼 만하지만 예금과 펀드는 나눠서 투자돼야 한다.임일섭 우리금융경영연구소 금융연구실장 리스크 감당할 자신이 있다면  이참에 집을 사야 하나예금의 이동뿐만 아니라 부동산 시장의 변화도 예측된다. 금리 인하로 인해 집주인이 전세로 보증금을 받아 은행에 맡기는 것보다 월세 받는 것을 더 선호하게 된다는 전망이다. 한국은행 자료를 보면 전세 가격은 수요가 커지면서 오름세가 확대되고 있다고 분석하고 있다. 전세난 속에 세입자들이 금리가 낮아질 때 집을 사야 할지 고민이 커질 수밖에 없다. 최근 돈을 빌려 집을 사고 월세 낼 돈으로 은행에 이자를 내자는 생각을 하는 사람들이 있다. 언론에서 분양이 잘된다는 기사가 나오니 더 오르기 전에 집을 사야 하나 조바심을 내는 사람까지 봤다. 전세가 줄고 월세가 늘어나는 등 주택 환경이 바뀌는 것은 맞다. 그렇지만 수도권에서 평생 살 집을 마련하는 게 아닌 몇 년만 살 생각을 한다면 저금리가 끝날 수 있어서 리스크가 큰 편이다.장보형 경제연구실장 정부에서 전세난이 심각하고 주택대출 이율이 낮으니 집을 사라고 유도하고 있다. 현재 주택 거래 건당 주택담보대출액을 보면 건국 이래 사상 최대다. 부동산 가격 폭등기인 2006년과 비교해도 더 크다. 과거와 비교해서 빚내어 집을 살 사람이 많다는 이야기다. 금리 인하는 집값을 계속 떠받치라는 것이다. 그러나 금리가 현 상태로 머무를 것이라고 생각하면 굉장한 오산이다.선대인 선대인경제연구소장금리 더 내려갈까역사상 처음으로 1대에 진입한 기준금리가 앞으로 어떻게 변할지도 관심사다. 기준금리가 더 떨어진다면 집을 사거나 사업자금을 마련하기 위해 은행을 찾는 것을 미뤄야 한다. 박형민 신한금융투자 연구원은 기준금리가 더 내려가지는 않을 것으로 전망했다. 박형민 연구원은 은행의 주택담보대출은 2월 약 4조원 지난해 8월 이후 25조원이 증가했다고 말했다. 집으로 인한 빚이 커서 지갑을 열기 어려운 상황이다. 한국은행도 금리를 더 내려 가계부채를 늘리는 건 부담스럽다.선대인 소장은 오히려 금리 인상에 대비해야 한다고 했다. 금융통화위원 7명 가운데 2명은 동결 의견을 냈다. 정부나 언론에서 금리를 내리라고 압박했지만 모두 찬성하지는 않은 것이다. 미국이 올해 안에 금리를 한 번 이상 올릴 것은 명확하다. 미국이 금리를 올리기 시작하면 미국으로 돈이 빠져나가는 것을 막기 위해 한국도 바로 올리진 않더라도 머지않아 올릴 것이다. 미국이 금리를 올릴 때 보면 기준금리보다 시장금리가 먼저 반응한다. 사람이 느끼는 것은 시장금리니까 그 여파를 분명히 느끼게 된다. 올해 말이나 내년 초에 금리 인상이 시작될 가능성이 크다.  미국 경제가 회복되면서 그동안 0 수준으로 유지했던 금리를 인상할 차례가 오고 있다는 것이다. 선대인 소장의 의견과 다른 의견도 있다. 임일섭 금융연구실장은 한국의 금리가 바로 따라 올라간다고 생각하지 않는다고 했다. 역사적으로 항상 미국 금리를 따라 움직이지는 않았다. 또한 미국이 금리를 올리더라도 자본 유출은 크게 걱정할 수준이 아니다. 외환위기 이후 정부가 관리를 해왔고 한국에 투자된 돈은 예전과 달리 단기성이 아니라 연기금 등 장기 투자금이 많다.신용도 이미 낮은 이에겐 무소용 금리 인하가 저축은행 등 제2금융권의 이용자나 신용불량자 등에게 미치는 영향은 작다. 장보형 경제연구실장은 제2금융권의 높은 이자비용을 조금 낮출 수는 있지만 이미 신용도가 낮은 이들이 금리 인하 효과를 볼 낮은 대출이자로 갈아타기는 힘들다. 중산층에게는 금리 인하 효과가 크지만 신용도가 낮은 이에게는 효과가 있기 힘들다고 설명했다
'한국판 신분제' 비정규직…6백만 차별 합리화	http://news.naver.com/main/read.nhn?mode=LSD&mid=shm&sid1=102&oid=055&aid=0000308304	현대판 신분제 비정규직의 열악한 현실을 표현한 말입니다.한 번 비정규직이 되면 정규직 되는 건 하늘의 별 따기여서 첫 취업을 어떻게 하느냐로 사실상 신분이 결정된다는 뜻입니다.현재 노동시장의 근본 틀을 바꾸기 위한 논의가 노사정 3자 간에 진행되고 있는데 타결 시한이 이달 말로 다가왔습니다. SBS는 앞으로 사흘 동안 노동시장 개혁의 쟁점과 대안을 집중 보도합니다.첫 순서 엄민재 기자가 600만 비정규직 문제를 짚어봤습니다.기자 26살 이 청년의 첫 직업은 의류업체 비정규직이었습니다.여섯 달만 일하면 정규직이 된다는 말만 믿고 매일 열너댓 시간 고된 일을 견뎠습니다.비정규직 종사자  제가 매장에서 한번 쓰러져 본 적도 있어요. 그러나 약속한 여섯 달이 지나자 고용주의 말이 달라져 회사를 그만두고 말았습니다.정규직으로 넘어가면서 수습기간이 3개월 더 있더라고요. 그 계약서를 보니까 언제든지 우리를 자를 수도 있고 기간제 교사인 이 남성은 비정규직 생활이 벌써 6년째입니다.어느 학교에 가든 계약 기간은 1년을 넘지 못했습니다.기간제 교사  2주짜리 근무를 한번 했었고요. 그다음에 8개월 그다음 3개월 그때그때 학교에 결원이 생길 때마다 비정규직이 정규직으로 전환되는 비율은 12에 불과합니다.대기업 정규직의 시간당 평균 임금은 2만 1천 원인 반면 대기업 비정규직은 1만 4천 원 중소기업의 비정규직은 절반도 안 되는 8천700원을 손에 쥘 뿐입니다.비정규직 문제를 풀려면 지속적이고 상시적인 업무 종사자들을 정규직으로 전환하는 데서 시작해야 합니다.이런 방식으로 비정규직 500명을 정규직으로 전환한 부천시청은 노사가 상생할 수 있는 길을 보여주고 있습니다.이연숙부천시 사례관리전문가 정규직 전환  고용이 계속된다는 생각이 있으니까 교육이라든가 장기적인 계획을 갖고 업무에 집중할 수 있어요.정규직 전환을 실행하는 기업에 대한 정부 지원을 더 늘려 임금 부담을 덜어주는 방안도 검토해야 합니다.김종진한국노동사회연구소 연구위원  기업의 다양한 법인세 혜택이라든가 고용창출 지원금 같은 걸 지원해줘서 적극적으로 노동시장에 활력을 전체 근로자의 32.4 600만 명을 넘어선 비정규직 문제 해결은 우리 아이들의 미래를 위해서라도 더 이상 미룰 수 없는 노동개혁의 최우선 과제입니다
'여제자 성추행' 서울대 교수, 경찰 수사 때도 성추행	http://news.naver.com/main/read.nhn?mode=LSD&mid=shm&sid1=102&oid=028&aid=0002267630	변호인 상습성 부인하자 서울대 자체 조사 결과 공개 피해 학생 공소 사실 포함된 9명 외에 25명 더 있어지난해 12월 서울대 수리과학부 강석진 전 교수 성추행 사건과 관련해 학생들로 꾸려진 비상대책위원회 피해자 엑스X가 서울대 대학본부 앞에서 철저한 진상조사와 처벌을 요구하는 기자회견을 열고 있다.kr여학생들을 상습 추행한 혐의로 구속 기소된 강석진54 서울대 수리과학부 교수가 경찰 조사를 받은 뒤에도 성희롱성추행을 했다는 정황이 확인됐다. 서울대 자체 조사 결과 피해자는 공소 사실에 포함된 9명 외에도 25명이 더 있는 것으로 나타났다. 18일 서울북부지법 형사9단독 박재경 판사 심리로 열린 강 교수의 3차 공판에서 검찰은 서울대 인권센터로부터 받은 조사 결과를 공개했다. 인권센터가 수리과학부 재학생졸업생연구원 등 42명을 조사해 보니 12명이 22차례 강제추행 14명이 27차례 성희롱을 당했다고 답했다고 한다.특히 검찰은 조사 내용 중에는 강 교수가 경찰 수사를 받던 지난해 10월에도 성추행성희롱을 한 사실이 들어있다고 했다. 검찰 관계자는 와의 통화에서 강 교수는 지난해 10월 이전에 경찰 조사를 이미 받은 상태였다고 했다. 검찰은 변호인이 2차 공판 때와 달리 상습성을 부인하는 취지의 주장을 하자 서울대 자체 조사 결과를 공개했다. 인권센터 조사 대상들 중 공소사실에 포함된 피해자 9명과 겹치는 이는 1명뿐다. 한편 변호인이 여교수와 여제자들까지 선처를 호소하는 탄원서를 제출했다고 하자 재판부는 지인의 탄원보다 피해자들을 위한 진지한 반성과 사과가 가장 중요하다. 범행은 자백하고 있지만 진지한 반성에 기초한 것인지 의문이라고 했다
