"용산 보도침하, 지하수 차단막 공사 잘못해서 발생한 듯"	http://news.naver.com/main/read.nhn?mode=LSD&mid=shm&sid1=102&oid=003&aid=0006366451&cid=428288	손대선 기자  지난 20일 발생 서울 용산구 주상복합건물 신축공사장 인근 보도침하 사고는 시공사가 지하수 차단공사를 제대로 하지 않아 발생한 것으로 추정된다.   서울시는 22일 이번 사고와 관련해 관할 지역 자치구인 용산구와 외부전문가 시공사 등과 합동으로 실시한 1차 현장점검 결과를 발표했다.  서울시는 지하수와 함께 토립자 유출이 지속되면서 세립분이 유실되어 동공이 발생하고 이것이 점차 확대되어 도로표면에 가까운 퇴적층까지 이르러 일시에 함몰된 것으로 추정한다고 밝혔다. 쉽게 말해 도로 아래 지하수가 흐르면서 주변 흙까지 함께 쓸려나가는 현상이 지속확대되면서 도로표면을 지탱해주는 층이 일시에 무너졌다는 얘기다.   서울시는 이와 관련 지난 5일 시공사의 흙막이 벽체의 누수대책 검토 의견서에서 시공사가 지하수를 차단하기 위한 설치한 흙막이 사이가 떠 누수가 발생한 것을 확인했다.  서울시는 정확한 사고조사를 위해 지난 21일 서울시품질시험소 등에서 주변지역에 대한 GPR 지반조사를 실시했다. 조사결과는 25일에 나올 예정이다 이와 관련 서울시 관계자는 보다 명확한 사고원인 규명을 위해 서울시 용산구 민간전문가와 합동으로 TF를 구성해 조사할 계획이라며 시공 및 감리부실 등 시공사의 책임이 확인되면 공사중지 등 상응하는 조치를 취할 계획이라고 밝혔다. 서울시는 유사한 사례가 발생하지 않도록 하기 위해 금번 사고사례를 서울시내 모든 공사장에 전파하고 시공사 등에 대한 감독을 더욱 철저히 해나갈 것이라고 설명했다. 서울시는 나아가 이번 사고를 계기로 중앙정부에 지하수법 개정 노후하수관 보강을 위한 국비지원 등과 함께 시에서 자체적으로 진행중인 도로함몰 탐지기술 개발에 공동으로 참여할 것을 요청할 계획이다
즐거워야 할 명절인데…쓸쓸한 죽음 잇달아	http://news.naver.com/main/read.nhn?mode=LSD&mid=shm&sid1=102&oid=001&aid=0007422531&cid=428288	황철환 정빛나 이도연 기자  설연휴 마지막 날인 22일 서울 곳곳에서 독거노인이 시신으로 발견되고 삶에 지친 시민들이 스스로 목숨을 끊는 사건이 잇따랐다.    서울 은평경찰서에 따르면 이날 오후 2시께 은평구 대조동의 다세대 주택에서 A75여씨가 숨져 있는 것을 조카54가 발견해 신고했다.    조카는 보통 명절 전에 전화를 드리는데 이번에는 받지 않으셨다면서 뒤늦게나마 찾아갔더니 고모가 엎드려 쓰러진 채 숨을 쉬지 않았다고 경찰에서 진술했다.    명씨는 오래전 이혼한 뒤 홀로 살아왔으며 자녀는 없었던 것으로 전해졌다.    명씨의 호주머니에서는 현금 11만원이 발견됐고 외부 침입 흔적은 없었다. 경찰은 명씨가 노환으로 숨졌을 가능성에 무게를 두고 있다.    앞서 이날 오전 10시 45분에는 강서구 화곡동 까치산근린공원에서 김모33씨가 나뭇가지에 묶인 전깃줄에 목이 매여 숨진 채 발견됐다.    경찰 조사결과 김씨는 전날 오전 9시께 일하러 간다며 집을 나선 뒤 귀가하지 않았던 것으로 드러났다. 김씨의 소지품은 지갑과 담배 1갑이 전부였고 유서 등은 발견되지 않았다.    경찰은 김씨가 특별한 직업이 없는데도 직장에 다니는 척했고 우울증 증세를 보여왔다는 가족의 진술 등을 토대로 정확한 사망 경위를 조사하고 있다.    비슷한 시각 동호대교에서는 20대 여성이 한강으로 뛰어내렸다.    경찰과 소방당국에 따르면 오전 10시 52분께 동호대교에서 투신한 곽모29여씨는 불과 5분여만에 구조돼 인근 병원으로 옮겨졌지만 5시간 만인 오후 3시 50분께 숨을 거뒀다.    이날 오후 2시 53분에는 구로구 개봉동의 한 빌라 다용도실에서 방모58씨가 목을 매 숨진 채 발견됐고 오후 3시 25분에는 성북구 정릉동의 한 주택에서 유모42여씨가 역시 목이 졸린 시신으로 발견됐다.    방씨와 유씨의 시신은 각각 아내와 남편에 의해 발견됐다. 경찰은 두 사람이 경제적 어려움을 비관해 스스로 목을 맸을 가능성을 염두에 두고 있다.    경찰 관계자는 상대적 박탈감 때문에 명절일수록 오히려 극단적인 선택을 하는 사람이 늘어날 수 있다면서 주변 사람들에 대한 관심이 어느 때보다 필요한 시기라고 말했다
쉽게 벗어나기 힘든 '공공임대주택의 굴레'	http://news.naver.com/main/read.nhn?mode=LSD&mid=shm&sid1=101&oid=469&aid=0000048218	민간 아파트 전셋값 상승 너무 커소득 늘어 임대료 할증 붙어도이주 못 하는 붙박이 가구가 70내집마련 정책 혜택 고루 돌아가게 순환율 높일 대책 필요 지적  8년 전 인천 서구의 전용면적 49 국민임대아파트에 입주한 40대 김모씨는 최근 서울 노원구로 이사하려던 계획을 포기했다. 근무지가 경기 구리시로 바뀐데다 큰 딸이 중학교에 입학해 상대적으로 학군이 좋은 곳으로 이사하려 했지만 집값을 감당할 곳을 찾을 수 없었기 때문이다. 김씨는 현재 보증금 2000만원 월세 30만원관리비 10만원 포함 정도를 내고 있는데 이 가격에는 서울은커녕 경기도에도 임대 물건을 구하기 어렵다며 소득이 늘어 앞으로 임대료 할증이 붙을 것을 감안해도 국민임대주택에 사는 게 훨씬 이득인 상황이라고 말했다.   공공임대주택 거주자들이 일반 아파트로 이동하기가 갈수록 어려워진다는 분석이 나오고 있다. 민간아파트의 전월세 가격상승폭이 워낙 커 공공임대주택에 한번 발을 들이면 자력으로 빠져 나오기 힘들다는 것이다. 때문에 빈 자리를 기다리는 저소득층의 임대주택 진입도 덩달아 어려워지고 있다. 서민 거주 안정을 위한 공공임대주택의 혜택이 골고루 미치도록 순환율최초 거주자 교체 비율을 높일 대책 마련이 시급하다는 지적도 나온다.  22일 국회 국토교통위원회 이노근 의원이 국토교통부와 한국토지주택공사LH에 의뢰해 받은 공공임대주택의 유형별 계속거주가구 현황에 따르면 현재 전체 공공임대주택 입주가구총 57만5626가구 가운데 최초 입주 후 계속 거주 중인 가구수는 전체의 69.  공공임대주택은 크게 일정기간 이후 분양전환이 가능한 5년10년 공공임대주택 영구적인 임대를 목적으로 건설한 50년 공공임대주택 30년 동안 임대하는 국민임대주택 기초생활수급자 국가유공자 등을 대상으로 하는 영구임대주택 등으로 나뉜다.   이 가운데 국민임대주택과 영구임대주택 50년 공공임대주택 등은 사실상 영구 거주가 가능하지만 모두 순환율이 너무 낮다는 지적을 받는다. 특히 물량이 압도적으로 많은 국민임대주택38만여가구과 영구임대주택14만여가구이 논란의 대상이다.   국민임대주택은 입주 자격이 까다롭고전년도 도시근로자 가구당 월평균소득의 70이하 등 거주 중에도 2년마다 입주조건을 심사해 재계약하는 형태를 취한다. 소득이 늘어날 경우 임대료에 할증이 붙고 자산이 늘어나면 퇴거명령을 받을 수도 있다. 그럼에도 최근 5년 사이 자의나 타의로 퇴거한 가구의 비율은 28. 영구임대주택은 퇴거기준 자체가 작년 10월에야 마련됐다. 이런 까닭에 1990년 이후 20년 이상 거주한 가구가 64 수준에 달했다.   이 같은 현상은 임대차 시장이 요동치면서 공공임대주택 거주자들의 이동이 쉽지 않은 현실과도 무관치 않다는 분석이다. LH에 따르면 2008년부터 2013년까지 공공임대주택의 임대료 상승률은 18. 반면 KB국민은행 부동산통계에 따르면 같은 기간 전국 아파트의 전셋값 상승률은 48.75도 공공임대아파트의 임대료 상승률에 못지 않았다. 공공임대에 거주하면서 모은 자금으로는 주택 구매는 물론이고 치솟는 전셋값을 따라가기 버겁다는 얘기다.  이노근 의원실 관계자는 공공임대주택은 서민층의 주거비를 보전해줌으로써 내집 마련을 장려하려는 정책적인 목적이 컸는데 장기적으로 거주하는 이들이 많은 것은 그만큼 정책의 혜택이 골고루 돌아가지 못한다는 의미라고 지적했다
아기 보면 짜증·분노…'육아우울증' 방치 마세요	http://news.naver.com/main/read.nhn?mode=LSD&mid=shm&sid1=103&oid=022&aid=0002786997&cid=428288	감정조절 어렵고 불안감 시달려엄마 우울증 아이까지 영향끼쳐증상 심하면 항우울제 치료 가능아빠 역할 중요 부담 덜어줘야첫아이를 낳은 지 반년이 다 돼가는 전업주부 이모30씨는 요즘 극심한 스트레스와 불안감으로 소리를 지르거나 눈물을 흘리는 일이 잦아졌다. 젖을 물려도 기저귀를 갈아도 온 세상이 떠나가라고 우는 아기만 보면 짜증이 난다. 새벽부터 그칠 줄 모르는 아이 울음으로 잠을 설치고 나면 하루 종일 기운이 없다. 이씨는 아기가 울 때 함께 울고 싶은 심정이라고 하소연한다.출산 후 아이를 기르는 데서 비롯한 스트레스를 호소하는 초보 엄마가 많다. 핵가족이 보편화하면서 육아 경험이 풍부한 어른의 도움을 받기 어려워진 게 주된 원인이다. 하지만 육아 스트레스를 어쩔 수 없는 일로 여겨 방치하면 육아우울증으로 악화할 수 있다. 강동경희대병원 정신건강의학과 김태사진 교수와 육아우울증을 주제로 얘기를 나눴다. 하지만 아이를 가진 엄마들의 대화에서 자주 들리는 것처럼 육아우울증은 이제 분명한 문제가 됐습니다. 엄마의 우울증은 자신은 물론 아이에게도 영향을 끼친다는 점에서 매우 심각해요. 2013년 미국의학협회 학술지는 어린 시절 엄마의 우울증에 노출된 아이들은 정서 문제를 일으킬 가능성이 크다고 밝혔습니다. 엄마와 아이 둘 다 울리는 육아우울증을 그냥 참고 넘겨선 안 돼요.김 교수에 따르면 육아우울증은 아이로 인한 스트레스는 물론 다양한 신체적심리적환경적 이유로 발생한다. 아무래도 가족 등의 조력 없이 홀로 육아를 도맡는 경우 자주 아프고 보채는 아이를 돌보는 경우 육아 탓에 사회생활 등 다른 기회를 포기한 경우 열등감이 심하고 부정적 성격인 경우 육아우울증이 발병하기 쉽다.육아우울증의 대표적 증상은 감정 조절의 어려움 불안감 죄책감 수면장애 식욕저하 등이다. 김 교수는 육아우울증이라고 해서 일반적 우울증 진단 기준과 다르지 않으므로 자가진단도 가능하다고 말한다.아이를 키우는 엄마가 우울증이 있다고 해서 모두 육아우울증으로 단정해선 곤란해요. 육아우울증과 비슷한 산후우울증일 가능성도 있기 때문이죠. 산후우울증이란 출산 후 4주일 이내에 시작한 우울증을 뜻합니다. 심한 경우 엄마와 아이의 생명까지 위협하는 심각한 상황으로 이어질 수 있어 더욱 각별한 주의를 기울여야 합니다.최근 부작용이 작은 항우울제가 개발됨에 따라 육아우울증도 이것으로 치료하는 게 가능해졌다. 써트랄린 파록세틴 등 항우울제는 모유를 먹는 아기의 혈중에서 검출되지 않아 비교적 안전하게 쓸 수 있다. 김 교수는 흔히 엄마가 항우울제를 복용하면 수유를 통해 아이에게 나쁜 영향을 준다는 막연한 믿음이 있지만 우울증 치료가 꼭 필요한 상황에서 적절한 항우울제를 적용하면 수유 중에도 부작용 없이 약물로 치료할 수 있다고 소개했다.증상이 심각해지면 정신건강의학과를 찾아 전문의의 정확한 진단을 받아야 한다. 병원에선 항우울제 처방 외에 개인 부부 또는 가족 전체를 대상으로 한 심리상담도 실시한다. 김 교수는 일단 치료를 시작하면 6개월가량 꾸준히 받는 게 좋다고 권한다.무엇보다 엄마가 내가 부족해 아이를 제대로 못 기른다라는 죄책감을 갖지 말아야 합니다. 아빠의 역할도 매우 중요해요. 육아는 물론 집안 청소와 설거지 등 가사 분담에 적극 동참함으로써 아내의 부담을 최대한 덜어줘야 해요
북, 호텔·골프장까지…국제 관광지 개발	http://news.naver.com/main/read.nhn?mode=LSD&mid=shm&sid1=100&oid=056&aid=0010132576	멘트 북한 김정은 제1위원장이 최대 역점 사업의 하나로 추진하고 있는 원산금강산 관광지구 개발 계획 최종안을 KBS가 단독 입수했습니다.북한은 오는 2025년까지 이곳을 사계절 국제 관광지로 개발해 한해 백만 명을 유치한다는 구상을 세웠습니다. 먼저 개발 계획 내용을 유광석 기자가 전합니다. 리포트 김정은의 지시로 지난해 말 북한 내각의 국가설계지도국이 수립해 보고한 원산금강산 관광지구 개발총계획입니다. 1단계 개발은 2017년까지 원산에 집중됩니다. 도심부에 호텔 등 숙박시설과 오락시설이 들어서고 마식령 스키장엔 골프장과 산악승마장이 추가로 건설됩니다. 폭포소리가 4킬로미터까지 울린다는 울림폭포 일대는 생태공원으로 조성됩니다. 2025년까지인 2단계 개발 계획은 기존의 금강산 특구를 확대하고 시설물을 대폭 확충하는  내용으로 채워졌습니다. 현대아산이 개발 운영해온  내금강과 외금강 삼일포해금강 지구에 통천 지구와 석왕사 지구가 추가되고 호텔과 골프장  휴양소 해양 오락시설 등이  대거 들어섭니다. 원산에서 해금강까지 109킬로미터 개발 총면적은 427제곱킬로미터로 서울시 면적의 70에 해당합니다. 하루짜리부터 3박 4일까지 4가지 유형의 관광 일정도 제시됐습니다. 인터뷰 남성욱 고려대 북한학과 교수  자신의 할아버지 아버지의 나진 선봉 신의주 개성과는 차별화되는 종합적이고 글로벌 수준의 종합개발계획입니다
정부, 서해안에 중국 진출 밸리 조성한다	http://news.naver.com/main/read.nhn?mode=LSD&mid=shm&sid1=101&oid=005&aid=0000741146	정부가 한중 자유무역협정FTA 타결을 계기로 서해안에 중국 시장 진출의 교두보가 될 기업 밸리 조성을 추진한다. 대규모 항구와 경제자유구역 등의 이점을 활용할 수 있는 인천평택군산영암을 잇는 라인이 검토되고 있다.  22일 관계 부처에 따르면 정부는 한중 FTA 체결 이후 중국 진출을 위해 한국을 생산기지로 활용하려는 국내외 기업을 유치할 방안을 마련 중이다. 정부는 이를 위해 기획재정부 산업통상자원부 국토교통부 금융위원회 관세청 등 관계자들과 민간 전문가들로 태스크포스TF를 구성해 운영 중이며 상반기 중 구체적 방안을 내놓을 계획이다.  정부는 한국에 좋은 투자환경만 만들어지면 5000조원에 이르는 중국 내수 시장에 진출하려는 기업들의 투자 수요를 한국으로 충분히 끌어들일 수 있다고 보고 있다. 최경환 경제부총리 겸 기재부 장관도 최근 한중 FTA로 중국 시장에 한국이 직접 진출하는 효과도 있지만 외국 기업이 한국을 교두보 삼아 중국에 진출하려는 수요도 있다고 말한 바 있다.  지리적으로 중국과 가까운 서해안 지역이 유력하다. 경제자유구역이 있는 인천과 군산새만금 대규모 항구가 있는 평택과 기업도시 영암을 잇는 라인 등이 검토되고 있다. 이들 지역은 기업 유치에 필요한 인프라가 마련돼 있어 제도적 지원만 추가하면 된다는 이점이 있다. 새만금은 이미 한중 경제협력단지 조성이 논의되고 있다.  정부는 국세나 지방세 등 다른 특구와 동등한 수준의 지원과 수출입 통관 간소화 건축노동출입국 규제 완화 인허가 원스톱 서비스 등 대대적 규제완화를 통해 기업을 유치한다는 구상을 갖고 있다.  그러나 중국의 기업환경이 한국보다 나쁘지만 비용 측면에서 여전히 싸다는 점 등은 극복해야할 한계다
"커지는 무선인터넷 시장, 韓비중은 작아져"-BCG	http://news.naver.com/main/read.nhn?mode=LSD&mid=shm&sid1=105&oid=001&aid=0007422543	워싱턴 김세진 특파원  2017년까지 한국과 미국 등 주요 13개국에서 무선인터넷 관련 시장이 1조5천460억 달러약 1천709조원로 커지겠지만 그중 한국이 차지하는 비중은 감소할 것이라는 전망이 나왔다.    22일현지시간 컨설팅업체 보스턴컨설팅그룹BCG의 글로벌 무선인터넷 경제의 성장 보고서를 보면 2017년에 한국의 무선인터넷 시장 규모는 400억 달러로 증가하겠지만 13개국 전체에서 차지하는 비중은 2.     지난해 한국의 무선인터넷 시장 규모는 280억 달러로 13개국 가운데 4.    2017년까지 연평균 23의 성장률이 예상되는 이 시장에서 한국이 같은 기간에 나타낼 것으로 예상되는 성장률은 연평균 9에 불과했다.    일본의 연평균 성장률이 8로 전망됐지만 한국의 예상 성장률은 인도와 브라질이 각각 39와 29를 기록할 것으로 전망된 것과는 큰 격차를 보였다.    시장 규모로 볼 때 2017년 무선인터넷 분야의 최대 시장은 미국5천440억 달러으로 예상됐고 중국3천740억 달러 독일 등 유럽 5개국3천20억 달러 일본1천150억 달러 등으로 지목됐다.     2017년 한국의 무선인터넷 시장 규모는 캐나다410억 달러와 비슷하고 인도690억 달러보다는 작지만 브라질370억 달러보다는 클 전망이다.    BCG는 한국 시장 현황과 관련해 지난 2년간 한국의 안드로이드 애플리케이션앱 개발자 수는 3배로 증가했고 안드로이드 앱 개발자 수에서 세계 5위권에 포함됐다며 한국이 앱 개발 부문에서 아시아태평양 지역의 중심지 역할을 할 수 있다고 설명했다.    그러나 한국 시장 비중의 축소나 상대적으로 낮은 성장률에 대해서 BCG는 특별한 분석을 하지 않았다.    BCG는 앞으로 기계 간 통신과 사물인터넷IoT이 무선인터넷 시장 성장의 중심축 역할을 할 것이라고 전망했다
