아파트 분양 '봇물'…공급과잉 우려 '솔솔'	http://news.naver.com/main/read.nhn?mode=LSD&mid=shm&sid1=101&oid=055&aid=0000341140&cid=428288	웬만한 축구장만 한 이 건물은 이틀 전에 문을 연 아파트 모델하우스입니다. 이렇게 큰 모델하우스가 등장했다는 건 그만큼 아파트 분양시장의 열기가 뜨겁다는 얘기겠죠. 이번 주에만 분양 물량이 2만 2천 가구나 되는데 주말 사흘 동안 전국의 모델하우스에는 30만 명이 넘는 방문객이 다녀갔습니다. 분양 물량이 이렇게 쏟아져 나오다 보니까 이번엔 공급이 넘쳐서 분양받았다가 손해 보는 건 아닌지 걱정도 나오고 있습니다.기자드넓은 잔디밭을 가로질러 고급 빵집과 카페가 들어섰습니다.용인에 분양하는 한 아파트 모델하우스 옆에 함께 들어설 거리의 모습을 상상해 미리 만들어 둔 겁니다.지난 금요일 문을 연 이곳엔 사흘간 무려 15만 명이 다녀갔습니다.실수요자는 물론 투자 목적 방문객도 많습니다.이광우신규 분양 아파트 모델하우스 방문객  투자 목적도 있는데요 주변 시세에 비해서는 평당 단가가 조금 더 낮아서. 아무래도 손해보지 않진 않을까하는 생각에.최근 수도권 모델하우스마다 등장하는 떴다방도 어김없이 등장했습니다.떴다방 업자  한 집당 기본 1천만 원은 붙을 거예요. 분위기가 더 되면 나중에 1천 2천만 원 이상 갈 수도 있고.지난주 32곳에 이어 이번 주에만전국적으로 이런 모델하우스 35곳이 문을 엽니다.분양 열기가 뜨거웠던 올해 들어서도최대 규모입니다.올해 분양 물량은 지난달까지 33만 5천 가구를 넘었습니다.지난해 같은 기간보다 11만 가구 넘게 증가한 것으로 관련 통계가 나오기 시작한 2007년 이후 가장 많습니다.따라서 공급과잉 우려도 제기되고 있습니다.내년 이후 경기가 침체되면 미분양 아파트가 급증하고 실제 입주가 시작되는 2017년쯤엔 집값이 떨어질 수 있다는 겁니다.김규정NH투자증권 부동산연구위원 실수요자들이 받쳐주지 못하는 상황에서는입주 지연 상태나 빈집 사태 또 역전세난 같은부작용들이 속출할 수도 있습니다.따라서 전문가들은 대출 등을 동원해 무리하게 내 집 마련에 나서는 건 신중을 기할 필요가 있다고 조언합니다
'질소' 오명 이제 그만, 변화하는 과자 업계	http://news.naver.com/main/read.nhn?mode=LSD&mid=shm&sid1=101&oid=214&aid=0000550314&cid=428288	대학생들이 과자 봉지를 이어붙이고 한강을 건넜던 이 이벤트 기억나시죠봉지 안에 과자가 아닌 질소를 가득 채워 넣는 국내 제과업계를 아프게 꼬집었던 행사였는데요.최근 이 같은 질소 과자 관행이 조금씩 달라지기 시작했다고 합니다.국내 과자 업계에 불고 있는 변화의 바람과 그 배경을 먼저 박민주 기자가 보도합니다. 리포트 서울의 한 대형마트. 개장하자마자 고객들이 과자 코너에 놓인 허니버터칩을 집어들더니 10분 만에 5상자 분량이 다 나갔습니다.유난스럽던 작년의 인기가 여전한 겁니다.지난해 30여 년 만에 출현한 대박과자에 허니라는 이름을 쓰거나 노란색 비슷한 포장을 한 과자들이 잇따라 출시됐고 이런 제품들은 수입과자로 쏠렸던 소비자들의 관심을 국산으로 되돌리는 데 성공했습니다.작년에 마이너스를 기록했던 해태제과의 매출은 올해 들어 오름세로 돌아섰고 롯데제과 역시 매출 상승폭이 눈에 띄게 늘었습니다.최근 2년간 가파르게 성장하던 수입과자의 매출 점유율은 주춤해진 상탭니다.이우영  대형마트 직원작년까지는 수입과자의 점유율이라든지 매출이 많았었는데 올해부터는 국내산 과자의 매출과 점유율이 조금씩 올라가는 추세입니다.그럼에도 과자 수입액은 지난 3년 동안 2천억 원 이상 급증했습니다.다양한 맛과 저렴한 가격에 수입과자를 찾는 사람들이 끊이지 않는 겁니다. 장효원수입과자는 다양한 게 많고 포장도 내용물이 깔끔하게 잘 들어 있어요. 우리나라 것은 거품이 많아요.수입과자의 맹공에서 일단 한숨 돌린 국산 과자업계.질소 과자라 부르듯이 소비자들의 반감과 불신이 여전하기 때문입니다. 리포트 전 세계 60개국에 수출되며 연간 21억 개가 소비되는 초코파이입니다.수십 년째 잘 팔리고 있지만 최근 큰 변화를 시도했습니다.가격은 그대로 둔 채 중량을 11 늘린 겁니다.강기명 총괄 이사  오리온포장을 줄인 원가 절감분을 소비자에게 돌려 드리기 위해 포카칩에 이어 초코파이까지 가격 변동 없이 증량을 단행했습니다.이에 앞서 해태제과는 3종 구이 스낵의 중량을 20 이상 늘려 같은 가격에 출고하기 시작했습니다.과대포장에도 변화가 생겨 롯데 찰떡 파이는 제품 속 플라스틱 용기를 없애 포장 크기를 줄였고 꼬깔콘도 포장지 속 질소 비율을 절반으로 줄였습니다.슬그머니 중량을 줄여 가격 인상 효과를 내고 갈수록 포장만 키우던 관행이 확실히 달라지기 시작했습니다.이주홍 사무국장  녹색소비자연대시작은 긍정적으로 평가할 수 있겠지만 모든 업계가 참여할 수 있는지에 대해서는 정부와 식품업계가 더 관심을 가져야 하겠습니다
사고 내고도 '배짱 영업' 무법천지 발레파킹	http://news.naver.com/main/read.nhn?mode=LSD&mid=shm&sid1=101&oid=214&aid=0000550296	주차를 대신 해 주는 발레파킹에 차를 맡겼다가 차가 망가지거나 연료가 크게 주는 등 피해를 보는 사례가 많습니다.하지만 발레파킹 업체에게 제대로 보상을 받기는커녕 오히려 적반하장 식의 반응을 보게 되는 경우가 적지 않은데요.배짱 영업으로 일관하는 발레파킹 업체들.먼저 그 실태를 윤성철 기자가 보도합니다. 리포트 사업을 하는 여 모 씨는 지난 11일 인천공항 주차장에 대형 밴을 주차했다 낭패를 봤습니다.차의 앞부분을 누군가 망가뜨려 놓은 겁니다.경찰 신고 끝에 붙잡은 가해자는 사설 발레파킹 업체 직원.고객 차를 몰다 여 씨 차를 들이받은 뒤 연락처 하나 남기지 않고 달아났습니다.여 모 씨발레파킹 차량 피해자사설 업체기 때문에 보험 가입이 안 돼 있다고 얘기하더라고요. 법대로 하든지 민사로 하든지 마음대로 해라. 차 가격이 1억 원이 넘어 범퍼와 그릴 교체비로 견적이 7백만 원이 나왔지만 발레파킹 업체 측은 허위견적 아니냐며 오히려 따지고 듭니다.사설 발레파킹 업체 직원금액으로 봤을 때 허위 견적이라고 예측을 하고 있고요. 허위로 판명이 됐을 때 저는 100 고소합니다.도심 골목길에서는 발레파킹 차에 부딪혀 다치는 경우도 비일비재합니다.하지만 제대로 된 보상을 받기는 힘듭니다. 무보험 상태로 영업하는 업체들이 대부분이기 때문입니다.발레파킹과 상관 없는 보험을 들어놓고 보험에 가입했다고 홍보하는 경우도 상당수입니다.발레파킹 업체 관계자주차장 보험이나 대리운전 보험은 있는데 정확하게는 발레파킹 보험이라는 게 특별한 게 없어요.발레파킹 업체가 늘면서 피해가 잇따르지만 마땅한 방법이 없습니다.경찰 관계자물피물적 피해 같은 경우는 형사처벌 대상이 아니니까. 개인이 소송을 해야 하는 건가요 상호 간에 처리를 하셔야죠.현재로선 발레파킹에 차를 맡겼다 피해가 날 경우 차주도 일정 부분 책임을 질 수밖에 없는 상황입니다. 리포트 음식점에서 발레파킹 비용을 내고 현금영수증을 요구했습니다.발레파킹 직원현금 영수증은 안 되는 거예요 예.또 다른 직원은 발레파킹 주차 카드에 적혀 있던 차 번호를 수시로 지웁니다.이렇게 하면 몇 대를 받았는지 당국이 불시에 단속을 해도 매출 규모를 파악할 길이 없어집니다.현행 주차장 사업은 일정한 땅을 갖추고 하는 주차장 운영업으로 사업자 등록을 내야 합니다.하지만 발레파킹업은 현행 법 어디에도 관련 근거가 없습니다.이렇다 보니 단속도 어렵고 현금 거래지만 소득 추적도 안 됩니다.국세청 관계자현금 영수증을 안 주면 문제가 있을 수 있겠죠. 세금 탈루할 수도 있는 가능성도 있죠.두세 명만 모이면 적은 돈으로도 쉽게 사업을 할 수 있는 구조.이른바 목 좋은 곳을 중심으로 발레파킹 업체들 간에 영역 다툼도 치열합니다.발레파킹 업체 전 직원강남 신사동 가로수길이나 역삼동은 업체 간 다툼이 있는 것으로 알고 있어요. 기존에 하던 사람이 78년 하고 새로 개척하기가 좀 힘들어요.  때문에 최근 들어 발레파킹 업계에서는 양성화 요구가 나오기도 합니다.홍승수발레파킹 업체 직원식당 같은 경우는 저희를 다 필요로 하거든요. 법적으로 제도를 만들어 주신다면 세금 낼 의향은 있거든요
'질소' 오명 이제 그만, 변화하는 과자 업계	http://news.naver.com/main/read.nhn?mode=LSD&mid=shm&sid1=101&oid=214&aid=0000550314&cid=428288	대학생들이 과자 봉지를 이어붙이고 한강을 건넜던 이 이벤트 기억나시죠봉지 안에 과자가 아닌 질소를 가득 채워 넣는 국내 제과업계를 아프게 꼬집었던 행사였는데요.최근 이 같은 질소 과자 관행이 조금씩 달라지기 시작했다고 합니다.국내 과자 업계에 불고 있는 변화의 바람과 그 배경을 먼저 박민주 기자가 보도합니다. 리포트 서울의 한 대형마트. 개장하자마자 고객들이 과자 코너에 놓인 허니버터칩을 집어들더니 10분 만에 5상자 분량이 다 나갔습니다.유난스럽던 작년의 인기가 여전한 겁니다.지난해 30여 년 만에 출현한 대박과자에 허니라는 이름을 쓰거나 노란색 비슷한 포장을 한 과자들이 잇따라 출시됐고 이런 제품들은 수입과자로 쏠렸던 소비자들의 관심을 국산으로 되돌리는 데 성공했습니다.작년에 마이너스를 기록했던 해태제과의 매출은 올해 들어 오름세로 돌아섰고 롯데제과 역시 매출 상승폭이 눈에 띄게 늘었습니다.최근 2년간 가파르게 성장하던 수입과자의 매출 점유율은 주춤해진 상탭니다.이우영  대형마트 직원작년까지는 수입과자의 점유율이라든지 매출이 많았었는데 올해부터는 국내산 과자의 매출과 점유율이 조금씩 올라가는 추세입니다.그럼에도 과자 수입액은 지난 3년 동안 2천억 원 이상 급증했습니다.다양한 맛과 저렴한 가격에 수입과자를 찾는 사람들이 끊이지 않는 겁니다. 장효원수입과자는 다양한 게 많고 포장도 내용물이 깔끔하게 잘 들어 있어요. 우리나라 것은 거품이 많아요.수입과자의 맹공에서 일단 한숨 돌린 국산 과자업계.질소 과자라 부르듯이 소비자들의 반감과 불신이 여전하기 때문입니다. 리포트 전 세계 60개국에 수출되며 연간 21억 개가 소비되는 초코파이입니다.수십 년째 잘 팔리고 있지만 최근 큰 변화를 시도했습니다.가격은 그대로 둔 채 중량을 11 늘린 겁니다.강기명 총괄 이사  오리온포장을 줄인 원가 절감분을 소비자에게 돌려 드리기 위해 포카칩에 이어 초코파이까지 가격 변동 없이 증량을 단행했습니다.이에 앞서 해태제과는 3종 구이 스낵의 중량을 20 이상 늘려 같은 가격에 출고하기 시작했습니다.과대포장에도 변화가 생겨 롯데 찰떡 파이는 제품 속 플라스틱 용기를 없애 포장 크기를 줄였고 꼬깔콘도 포장지 속 질소 비율을 절반으로 줄였습니다.슬그머니 중량을 줄여 가격 인상 효과를 내고 갈수록 포장만 키우던 관행이 확실히 달라지기 시작했습니다.이주홍 사무국장  녹색소비자연대시작은 긍정적으로 평가할 수 있겠지만 모든 업계가 참여할 수 있는지에 대해서는 정부와 식품업계가 더 관심을 가져야 하겠습니다
법무부, 친일파 이해승 100억대 재산환수 재심 청구	http://news.naver.com/main/read.nhn?mode=LSD&mid=shm&sid1=102&oid=009&aid=0003603231	법무부가 친일파 이해승 후손 소유의 100억원대 재산을 환수하기 위해 이르면 26일 재심을 청구할 방침으로 알려졌다. 법무부는 이날 재심을 청구하는 한편 부당이득금 반환 청구 소송과 소유권 이전등기 말소 소송 등 별도의 민사 소송을 함께 제기하며 총력전을 펼친다. 25일 법조계에 따르면 법무부가 이번에 소송을 제기할 이해승 후손 소유의 재산은 경기도 포천시 선단동 등의 토지 192필지192만5238 공시지가 기준 110여억원다. 이는 친일반민족행위자 재산조사위원회가 2007년 이해승을 친일반민족행위자로 규정하고 그가 친일 대가로 얻었다고 판단한 재산이다. 당시 정부는 해당 토지를 국고로 귀속했으나 이해승의 후손이 이를 취소해달라고 소송을 제기했고 대법원은 2010년 10월 28일 이를 최종적으로 받아들였다. 대법원 확정 판결에 대한 재심을 청구할 수 있는 기한은 5년이기 때문에 오는 28일을 넘기면 재심 청구가 불가능하다. 법무부는 재심 청구할 수 있는 기한이 촉박한 만큼 이르면 26일 대법원 판결에 대한 재심 청구와 함께 부당이득금 반환 청구 소송 소유권 이전등기 말소 소송 등을 함께 제기할 방침이다. 특히 2007년 환수한 이해승의 친일 재산은 시가로 300억원대에 달했던 만큼 이번 소송이 주목을 끈다. 법조계에 따르면 이번 소송 말고도 이해승 후손이 친일 재산 환수에 불복해 제기한 소송은 3건에 이르는 것으로 알려졌다. 이 가운데 200억원대의 부당이득 반환 청구 소송은 법무부가 2심에서 승소한 후 대법원에서 게류 중이다. 또한 이와는 별도로 소유권등기말소 청구 소송과 친일재산확인 결정처분 취소 소송도 대법원 판결을 기다리고 있다. 조선 왕실의 종친이던 이해승은 1910년 일제에게 후작 작위를 받은 대표적 친일 인사다. 친일반민족행위자 재산조사위원회는 2007년 이해승을 친일반민족행위자로 규정하고 그가 친일행위로 얻은 재산을 국가에 귀속했으나 상속자인 손자가 귀속결정 처분을 취소해달라고 소송을 냈다
사투리로 "나야"…김무성 사칭해 보이스피싱	http://news.naver.com/main/read.nhn?mode=LSD&mid=shm&sid1=102&oid=055&aid=0000341138	나 김무성인데 이렇게 여당대표를 사칭하는 전화를 걸어서 돈을 요구해 온 50대 남자가 경찰에 붙잡혔습니다. 목소리가 진짜 김무성 대표하고 구별이 힘들 만큼 비슷했다고 합니다.기자새누리당 김무성 대표는 지난 3월 자신의 목소리를 흉내 내는 보이스 피싱에 속지 말라며주의를 당부했습니다.김무성새누리당 대표 지난 3월  저하고 목소리가 거의 비슷한 사람이 주로 여성들에게 전화를 해서 돈을 요구해 돈을 송금한 분들이 지금 여러 명 있습니다.김 대표로 행세하던 55살 남성은 그제23일 대학교수에게 돈을 뜯어내려다 붙잡혔습니다.교수는 사기라는 걸 직감하고 친분이 있던 김 대표에게 알려 신고하게 한 것으로 알려졌습니다.또 발신 번호 추적 스마트폰 앱을 작동시켜 경찰의 검거를 도왔습니다.또 다른 전화 사기를 벌이다 붙잡힌 이 남성은 대학교수와 호텔 사장 등 66명의 연락처가 든 메모지를 갖고 있었습니다.장기성 경감부산진경찰서  통화를 하신 분들은 어떻게 들으면 목소리가 거의 똑같다고 하신 분도 있어요. 부산 사투리로 나야 이렇게 하니까 자기한테 반말을 할 수 있는 사람은 김무성 대표라고 착각을 한 것 같아요.붙잡힌 남성은 한 자치단체 의원에게 김 대표라고 전화한 뒤 만날 때는 김 대표 특보라고 속여 500만 원을 받은 것으로 조사됐습니다.경찰은 사기 등 전과 25범인 이 남성이 좋은 일에 참여해 달라고 접근하는 수법으로 사기 행각을 벌인 것으로 보고 추가 범행을 수사하고 있습니다
