"동네 뒷산 아닙니다"…느슨한 겨울산행 '위험천만'	http://news.naver.com/main/read.nhn?mode=LSD&mid=shm&sid1=103&oid=437&aid=0000101987&cid=428288	얼마 전 덕유산을 등반하던 50대 여성이 숨지는 등 최근 겨울철 등산객들의 사고가 잇따르고 있습니다. 시시각각 날씨와 환경이 변하는 겨울철 산행에 대한 준비가 부족했다는 목소리가 나옵니다.밀착카메라 박소연 기자가 현장을 점검해 봤습니다. 기자영하의 날씨에도 이곳 북한산에는 이른 아침부터 등산객의 발길이 이어지고 있습니다. 특히 겨울 산행은 조심해야 할 점들이 많다고 하는데요 이곳에서 어떤 일이 벌어지는지 등산객을 따라가 보겠습니다. 지난 밤 내린 싸락눈으로 등산로에는 하얀 눈이 내려앉았습니다. 고예분강원 춘천시 신동면  오니까 기분은 상쾌하고 좋은데 형제들하고 같이 왔거든요.이영진경기 남양주시 도농동  겨울은 눈 오고 난 다음에 오면 더욱 멋있습니다.그런데 등산화가 아닌 운동화를 신은 채 산에 오르는 일부 등산객이 보입니다.북한산은 바위산이어서 등산로 곳곳이 이렇게 암석으로 돼 있습니다. 쌓인 눈과 낙엽을 밟아 미끄러지지 않도록 조심해야 합니다.등산할 때 덥다고 간단한 운동복이나 청바지를 입으면 체온 유지가 어려워 저체온증에 빠질 수도 있습니다.2시간여 만에 해발 836미터 북한산 백운대 정상에 올랐습니다. 서울 시내가 한눈에 내려다보입니다.모여앉아 도시락을 펼친 자리 곳곳에 막걸리가 보입니다.음주 산행이 대수롭지 않다는 반응이 이어집니다. 등산객  친구 꼬임에 막걸리 반 잔 했다고. 술 다 깨고 내려가야지.등산객  습관인데 하나씩 갖고 오면 좋던데. 나이 먹어야 막걸리 맛을 알지.절벽 근처에서 사진을 찍는 등산객들.안전벨트나 로프를 갖추지 않고 출입 제한지역에 들어가거나 심지어 바위 위에서 두 팔을 짚고 물구나무를 서기도 합니다. 이동윤북한산 국립공원 재난안전구조대  절벽이죠. 자칫 실수하면 바닥으로 떨어지거든요. 제재할 수 있는 특별한 것도 없고.작은 부주의가 큰 사고로 이어지기도 합니다. 북한산 향로봉에서 하산하던 53살 김모 씨는 발목을 접질려 119산악구조 헬기가 출동했습니다.  이동윤북한산 국립공원 재난안전구조대  하산 길에 약주를 드셨다든지 다리가 풀려서 실족사하는 사고가 80퍼센트 이상입니다.지난 3년간 국립공원에서 발생한 겨울철 사망사고 14건 중 9건은 심장돌연사가 원인이었습니다.때문에 체온 유지를 위해 방한의류를 제대로 챙겨 입는 게 기본입니다.권기봉북한산 국립공원 재난안전구조대  내의가 땀 흡수도 잘 되지만 잘 말라요. 그다음에는 기모로 된 보온 의류를 입어주는 거죠.지난 17일 경남 거창군 덕유산을 오르던 등산객 27명이 조난돼 1명이 숨지는 사고가 발생했습니다.당일 대설이 예보됐지만 일기 예보를 제대로 확인하지 않았고 추위에 대비한 충분한 장비를 갖추지 않은 것으로 드러났습니다. 겨울 산행의 가장 큰 적은 바로 과욕입니다. 체력에 맞는 등산로와 등산 시간을 정하는 게 산악 사고를 예방하는 첫 걸음입니다.박소연 JTBC 뉴스 공식 SNS 트위터 페이스북 카카오스토리 유튜브 JTBC 뉴스는 여러분의 생생한 제보를 기다립니다
일본 카페인 중독 첫 사망, 에너지 드링크 때문?	http://news.naver.com/main/read.nhn?mode=LSD&mid=shm&sid1=104&oid=214&aid=0000573811&cid=428288	에너지 드링크로 불리는 카페인 음료를 즐겨 마시던 일본인 남성이 숨졌습니다. 카페인 중독으로 숨진 첫 사례여서 일본 사회에 큰 충격을 주고 있습니다. 리포트 졸음을 쫓으려고 카페인이 든 청량음료를 자주 마셨던 20대 남성. 늦은 밤과 새벽 시간에 24시간 영업하는 주유소에서 일해 왔습니다. 집으로 돌아와 토하고 잠들었는데 몇 시간 뒤 숨진 채 발견됐습니다. 이 남자는 숨지기 1년 전부터 몸 상태가 나빠졌지만 에너지 드링크로 불리는 이 음료를 끊지 못했던 것으로 전해졌습니다. 이 남성을 부검한 후쿠오카대 법의학 교실은 카페인 중독으로 숨졌다고 경찰에 통보했습니다. 위와 혈액에서 높은 농도의 카페인이 검출됐는데 일본에서 카페인 중독으로 숨진 첫 사례입니다.구보 신이치후쿠오카대 법의학 교수약물 분석을 한 결과 카페인이 다량 검출됐습니다.일본에서 판매 중인 카페인 음료에는 커피 한잔의 카페인보다 50배 많은 양이 들어 있는 경우도 있습니다
흐리고 포근한 '동지'…수도권 등 미세먼지 '나쁨'	http://news.naver.com/main/read.nhn?mode=LSD&mid=shm&sid1=103&oid=001&aid=0008067815&cid=428288	채새롬 기자  화요일이자 절기상 밤이 가장 길다는 동지인 22일 전국이 가끔 구름 많다가 낮에 서쪽 지방부터 점차 흐려지겠다.    전국이 중국 북동지방에 있는 고기압의 가장자리에 들다가 남서쪽에서 다가오는 기압골의 영향을 점차 받을 전망이다.    아침 최저기온은 영하 4도에서 영상 7도로 21일보다 조금 낮겠고 낮 최고기온은 6도에서 12도로 21일과 비슷할 것으로 예보됐다.    기상청은 당분간 기온이 평년보다 조금 높을 것이라고 내다봤다.    바다의 물결은 전 해상에서 0.    미세먼지 농도는 국외 미세먼지의 영향과 국내 대기정체로 인해 수도권 강원 영서 충청권에서 나쁨 그밖의 권역은 보통으로 예보됐다.    수도권 일부지역에서는 일시적으로 매우나쁨 수준의 농도가 나타날 수 있어 건강관리에 주의해야 한다.    다음은 22일 지역별 날씨 전망
中 "재정적자 확대‥유연한 환율정책"…추가부양..	http://news.naver.com/main/read.nhn?mode=LSD&mid=shm&sid1=101&oid=018&aid=0003432126&cid=428288	경제공작회의 채택 내년 거시경제계획이데일리 장순원 기자 중국 정부가 내년에 재정적자폭을 확대하고 유연하게 환율정책을 펴기로 했다. 돈을 더 풀어 경기하강을 막겠다는 의미다. 중국 정부는 21일현지 시간 중앙경제공작회의에서 채택한 내년 거시경제계획에서 재정정책이 한층 단호하게 운영하면서 구조개혁을 위해 적절한 통화정책을 활용하겠고 밝혔다. 이어 재정적자 비율은 점진적으로 확대할 계획이라고 덧붙였다. 경제공작회의 매년 12월 중국공산당 중앙위원회와 국무원이 공동 개최하는 중국 최대 경제회의로 한 해 경제적 성과를 평가하고 내년의 거시적 경제운용 계획을 수립한다. 이번 회의는 중국 경제가 분기기준으로 25년 만에 가장 낮은 성장세를 보이는 시기에 개최됐다. 중앙은행인 인민은행이 지난해 말 이후 여섯 차례 금리를 내리고 정부도 재정을 풀며 경기부양에 나섰지만 아직 경제에 온기가 제대로 돌지 않고 있다. 블룸버그통신은 둔화하는 중국 경기에 온기를 불어넣기 위한 추가 부양을 시사한 것이라고 평가했다.중국정부는 아울러 내년 공급부문 개혁에 매진할 계획이다. 농민의 도시지역 주택매입을 독려하고 부동산 개발업자의 비용을 줄여주는 방안도 포함됐다. 도시지역에 과잉공급된 주택을 해소하기 위해서다. 또 세밀하게 금융 위험을 살펴보고 지방정부 부채문제를 효율적으로 관리하는 한편 부채축소에도 중점을 두기로 했다
경찰 준비생이 '3시간 감금 폭행'…벌금 200만 원	http://news.naver.com/main/read.nhn?mode=LSD&mid=shm&sid1=102&oid=057&aid=0000862839&cid=428288	이번에는 경찰 준비생이 알고 지내는 여성을 3시간이나 폭행해 논란이 되고 있습니다.그런데 이 남성은 재판도 받지 않고 벌금 200만 원의 처분만 받았다고 합니다. 박상호 기자가 단독 보도합니다. 기자 시퍼렇게 멍이 들고 함몰돼버린 오른쪽 눈 심하게 내려앉은 코뼈 여기에 갈비뼈와 손가락 골절까지.25살 김 모 씨가 폭행을 당한 모습입니다. 인터뷰  피해자 외삼촌 하늘이 도와서 얘가 살아난 거지 우리는 이건 살인미수다. 목을 졸라 죽이려고 했으면.김 씨가 무차별 폭행을 당한 건 지난 8월 몇 달 전부터 알고 지내는 25살 정 모 씨에게 매일 술만 먹고 다니느냐며 충고를 하자 새벽에 집으로 찾아와 주먹을 휘둘렀습니다. 무려 3시간 동안 이어진 감금 폭행에 1차 수술비만 1천만 원이 넘었습니다. 그런데 검사가 기소와 동시에 벌금형에 처해달라는 뜻의 약식명령을 청구하면서 가해자는 재판도 받지 않고 벌금 200만 원의 처분을 받았습니다. 이런 사실을 믿을 수 없었던 김 씨 어머니는 몇 번이나 검찰에 확인 전화를 했습니다. 인터뷰  피해자 어머니 200요 2천도 아니고 2억도 아니고 200요 사람이 죽을 뻔했는데 200이에요현재 김 씨는 큰 정신적 충격을 받아 대학원 입학까지 포기한 상황입니다. 김 씨 가족들은 이해할 수 없는 판결이라며 대검찰청과 국민권익위원회에 탄원서를 제출했고 가해자 정 씨는 형량이 무겁다며 울산지방법원에 정식 재판을 청구했습니다
대학 졸업 유예하는 서러운 'NG족'…학교선 찬밥신세	http://news.naver.com/main/read.nhn?mode=LSD&mid=shm&sid1=102&oid=437&aid=0000101986&cid=428288	NG족이란 말 들어보셨는지요 No Graduation의 약자로 취업을 준비하기 위해 졸업을 미루는 학생들을 가리키는 말입니다. 지난해에만 2만 명을 넘어섰는데 재학생이 아니라는 이유로 학교에서 찬밥 대우를 받고 있다고 합니다.기자대학 4학년생인 김모 씨는 취업난에 졸업을 한 학기 미루기로 했습니다.이미 학점을 다 채웠지만 60만 원이 넘는 등록금을 다시 내야 합니다.김씨대학생  또 등록금을 내야 하는 것이 부담이 되죠. 주변에 95 이상은 졸업을 유예하는 것 같아요.2012년 수료 후 3년째 취업준비중인 27살 이모씨는 학교 열람실 아르바이트를 그만둬야 했습니다.수료생은 더 이상 교내 아르바이트를 할 수 없도록 규정이 바뀌었기 때문입니다.이씨졸업 유예자  일방적으로 통보해서 막막했죠. 앞으로 생활할 돈이 있어야 하는데지난해 졸업을 미룬 수료생은 2만 5천여 명에 달했습니다.채용 시장에서 재학생이 유리하다는 인식 때문입니다.박하현이화여대 4학년  졸업하게 되면 조건이 대학 재학 중 이런 건 아예 지원도 못하잖아요. 그래서 일부러 수료생으로 남으려는 거죠.하지만 교내 시설 이용을 일부 제한되거나 등록금을 의무적으로 내야 하는 학교가 늘면서 졸업 유예생들의 설움이 커지고 있습니다.이선화 JTBC 뉴스 공식 SNS 트위터 페이스북 카카오스토리 유튜브 JTBC 뉴스는 여러분의 생생한 제보를 기다립니다
