가을볕 쬐기 좋은 날, 전국이 축제장…구름 인파 몰려	http://news.naver.com/main/read.nhn?mode=LSD&mid=shm&sid1=103&oid=437&aid=0000093491&cid=428288	개천절인 오늘3일 가을볕 쬐기 좋은 날이었지요. 여기저기 다양한 행사가 열리면서 전국이 축제 분위기였습니다. 기자시민들이 자유롭게 차도를 오고 갑니다. 한쪽에선 셰프들이 먹음직스러운 요리를 만듭니다. 마라톤을 마치고 숨을 돌리는 시민들도 보입니다.  홍순기경기 남양주  가을이잖아요. 모처럼 가족들하고 소풍 겸 해서 나오게 됐습니다.개천절이자 10월 첫 주말인 오늘 서울 도심 곳곳에서 축제가 열렸습니다. 서울 삼성역 인근에선 국제평화마라톤대회와 강남 페스티벌 국화꽃 축제가 동시에 열렸습니다. 잠실 종합운동장 일대에도 오늘 하루만 4만 여명의 인파가 몰렸습니다.  오후 2시부터 야구장에서 LG와 롯데의 경기가 열린데다 인기 가수의 팬미팅이 이어지면서 북새통을 이뤘습니다.  임진각에선 한국말산업중앙회 주최로 광복 70주년을 기념한 통일말 대축전이 열렸습니다.  말 70필이 통일대교를 왕복하는 퍼포먼스를 선보였습니다.윤홍근한국말산업중앙회장  통일로 세계로 나아가고자 파주 임진강에서 개최하게 됐습니다.서울 여의도에선 세계불꽃축제가 막을 올렸습니다. 오후 2시부터 시작된 사전 공연에 사람들이 몰려들기 시작해 본격적인 행사가 열린 저녁 무렵엔 한강 둔치에 발디딜 틈이 없을 정도였습니다. 서울시는 오늘 50만명 이상의 인원이 여의도에 몰렸을 것으로 보고 있습니다.신진 JTBC 뉴스 공식 SNS 트위터 페이스북 카카오스토리 유튜브 JTBC 뉴스는 여러분의 생생한 제보를 기다립니다
시티투어 대신 숨은 명소, 젊은 유커들의 '똑똑한' 관광	http://news.naver.com/main/read.nhn?mode=LSD&mid=shm&sid1=101&oid=214&aid=0000543028	이 유커들이 한국에 오면 무엇을 제일 많이 할까요.서울 명동을 찾고 또 화장품 건강식품을 사는 게 이들의 주 코스였습니다.하지만 요즘 젊은 유커들은 관광방식이 무척 달라졌습니다.이어서 양효걸 기자가 전해 드립니다. 리포트 수조에서 막 건져낸 킹크랩을 들고 연거푸 사진을 찍고 삼삼오오 모여 가게 주인과 흥정을 합니다.명동과 동대문 대신 수산시장을 찾은 유커들입니다.5배는 늘어난 것 같아요 중국인 관광객분들이. 킹크랩이라든가 대게 같은 해물류를 많이 찾으십니다.이 노량진 수산시장은 중국인 관광객이 하루 1천 명 가까이 몰리면서 메르스 사태 이전 수준을 완전히 회복했습니다.최근 유커들의 관광형태를 보면가이드를 따라 버스로 명소를 도는 시티투어 방식이 급감한 대신 인터넷과 SNS로 정보를 얻어 개인적으로 맛집을 찾아가거나 이태원이나 홍대 주변의 숨은 명소를 찾는 경향이 뚜렷해졌습니다.푸다이저중국인 관광객인터넷에서 찾아 지하철을 이용해 왔는데 이렇게 큰 수산시장은 처음보고 수산물도 싱싱해 신기합니다.맛집 앞에서는 긴 시간 줄을 서는 수고도 마다하지 않습니다. 유커의 절반 이상이 230대의 젊은 세대인데 무작정 명품과 화장품을 싹쓸이하던 부모세대와 달리 스마트폰으로 가격과 품질을 꼼꼼하게 비교해 구입합니다. 박승찬용인대학교 중국학과 교수최근 유커들은 모바일과 온라인 공간을 통해 한국 어디를 가면 가장 알맞은 제품을 싸게 구입할 수 있는지 다 공유한다는 것이죠
"음란사진 유포" 협박해 초등생에 몹쓸 짓	http://news.naver.com/main/read.nhn?mode=LSD&mid=shm&sid1=102&oid=055&aid=0000336309	스마트폰 채팅 어플로 만난 초등학생을 야외 공원으로 불러내 성폭행한 고등학생이 경찰에 붙잡혔습니다. 여학생을 꼬드겨서 신체 노출 사진을 받았는데 이걸 유포하겠다고 협박해서 범행을 저질렀다고 합니다.기자경기도 한 시내의 주택가 공원입니다.고등학생 17살 김 모 군은 오늘 오후 초등학교 여학생을 이곳으로 불러냈습니다.이들은 스마트폰 채팅 애플리케이션을 통해 지난달 처음 만나 연락해 온 사이입니다.여학생 집과 가까운 공원에서 여학생을 만나자마자 김 군은 흑심을 드러냈습니다.초등학생인 여학생을 윽박지르며 공원 화장실로 강제로 끌고 가 성폭행한 겁니다.담당경찰  내가 네 얼굴을 알고 있다 이렇게 협박을 시작한 거고요 오늘 만나자. 안 만나면 네가 보낸 사진 진짜로 공개하겠다라고 협박해서 만나게 된 겁니다.김 군이 피해 여학생을 꼬드겨 신체를 노출한 사진을 찍어 메신저로 전송받아 보관해왔는데 김 군이 이를 유포하겠다고 협박해 여학생을 불러낸 겁니다.공원 화장실에서 이상한 소리가 난다는 신고를 받고 출동한 경찰이 현장에서 김 군을 붙잡혔습니다.현장에서 압수한 김군의 휴대전화엔 피해 여학생의 찍은 노출 사진이 여러 장 포함돼 있었습니다
'여주 암매장 사건' 인출책, 살인사건 연관성 부인	http://news.naver.com/main/read.nhn?mode=LSD&mid=shm&sid1=102&oid=003&aid=0006791561&cid=428288	여주이종일 기자  경기 여주시에서 암매장된 농장주의 돈을 찾아간 우즈베키스탄인이 살인사건과의 연관성을 부인했다. 여주경찰서는 전자금융거래법 위반 혐의로 조사를 받고 있는 우즈베키스탄인 R39서울 거주씨가 살인사건과 관계돼 있지 않다고 진술했다고 3일 밝혔다.   R씨는 경찰에서 농장주 암매장 사건을 알지 못하고 있었다며 지난달 26일 F50우즈베키스탄씨로부터 원화를 우즈베키스탄 화폐로 바꿔달라는 요청을 받았고 계좌 4개로 이체된 3090만원을 같은 달 2728일 찾아갔다고 진술했다. 이어 찾은 돈 가운데 2000만원을 썼고 나머지 돈을 보관하고 있다며 지인에게 부탁해 3000만원 상당의 우즈베키스탄 화폐를 우즈베키스탄에 있는 F씨의 아내에게 주도록 했다고 말했다 R씨는 지난달 2728일 서울의 한 은행 현금입출금기를 이용해 자신의 계좌와 A씨 등 다른 우즈베키스탄인 3명의 계좌 등 모두 4개의 계좌로 이체된 3090만원을 찾은 혐의를 받고 있다. R씨가 소지하고 있던 계좌카드의 명의자 A씨 등 3명은 2014년 5월지난달 8일 출국했기 때문에 경찰은 3명이 살인사건과 연관성이 없는 것으로 보고 있다. 살인사건 용의자인 F씨와 D24우즈베키스탄씨는 같은 달 2630일 숨진 안모54씨의 통장에 있던 5890만원 가운데 3090만원을 R씨에게 이체하고 나머지 2000만원을 직접 인출한 것으로 조사됐다. 경찰은 R씨를 상대로 암매장 사건의 공범 여부 등을 조사한 뒤 구속영장을 신청할 계획이다. 한편 지난달 25일 실종된 버섯농장주 안씨는 이달 2일 오후 2시50분께 자신이 운영하던 여주시 능서면 농장 주변에서 땅에 묻혀 숨진 채 경찰에게 발견됐다
14년 만에 차등수가제 폐지…"의료질 저하" 반발	http://news.naver.com/main/read.nhn?mode=LSD&mid=shm&sid1=102&oid=055&aid=0000336320	의사 1명이 하루에 환자 75명 이상을 진료하면 건강보험의 수가를 깎는 차등수가제가 시행 14년 만에 폐지됩니다.진료 시간이 짧다는 불만이 여전한데 정부가 뾰족한 대안도 없이이 제도만먼저 폐지한 게 아니냐는 비판이 나오고 있습니다.기자건강보험정책심의위원회에서 차등수가제 폐지 안이 과반수 찬성으로 의결됐습니다.차등수가제는 특정 의원에 환자가 몰리고 진료시간이 짧아지는 것을 막기 위해 지난 2001년부터 시행돼왔습니다.의사 1명이 환자를 하루에 75명 이상 진료하면 건강보험 수가를 줄이는 방식입니다.시행 14년이 지났는데도 진료시간이 늘어나는 효과가 나타나지 않았다며 정부가 오는 12월부터 차등수가제를 폐지하기로 한 겁니다.그동안 차등수가제는 대형병원이 아닌 동네 의원에만 적용돼 형평성 논란도 제기돼 왔습니다.또 차등수가제를 적용받는 의원이 전체 의원의 14에 불과해 정책 효과를 거두기 어려운 한계도 있었습니다.하지만 민주노총과 경실련 등 건강보험 가입자 단체는 진료 환자 수를 제한하는 최소한의 안전장치가 없어지면 진료 수준이 더 떨어질 것이라며 반발했습니다
독일 통일 25년…난민 유입에 폭스바겐 조작까지..	http://news.naver.com/main/read.nhn?mode=LSD&mid=shm&sid1=104&oid=421&aid=0001658966&cid=428288	2일현지시간 독일 베를린에서 베를린 빛 축제Berlin leuchtet를 맞아 건물 외벽에 빛을 쏴서 예술작품을 만드는 미디어파사드가 한창이다. 한 커플이 슈프레 강을 지나는 다리에 걸터 앉아 미디어파사드를 구경하고 있다. 로이터서울 신기림 기자  독일이 국민 자동차 폭스바겐의 조작 파문과 대규모 난민 유입 문제에 직면한 가운데 3일현지시간 통일 25주년을 맞았다. 유럽 최대 경제국인 독일이 폭스바겐 조작과 난민 문제로 안팎에서 압박을 받고 있다는 점에서 25년을 맞은 통일 독일은 기로에 섰다고 해도 과언이 아니다. 통일 25주년인 올해의 모토로 정한 국경을 넘어Overcoming Borders는 공교롭게도 현재 독일 상황을 그대로 대변하고 있다. 앙겔라 메르켈 독일 총리 역시 오는 11월 취임 10년을 맞이하지만 마냥 자축할 수 없는 입장이다. 독일이 견고한 경제 성장을 지속하면서 메르켈 총리는 10년째 자리를 지키고 있다. 독일 경제가 비교적 탄탄한 성장세를 꾸준히 이어가면서 다수의 유권자들은 메르켈 총리가 내세운 난민 수용을 비롯해 다양한 정책을 지지하고 있다. 하지만 올 들어 100만명에 달하는 이민자들이 전쟁과 배고픔을 피해 독일로 몰려 들면서 메르켈 총리의 인기도 예전같지 않다. 독일 내부뿐 아니라 주변국에서도 난민 수용 부담이 가중되는 상황에 대한 불만이 끊이지 않고 있다. 메르켈 총리는 2일 동부 도시 할레에서 가진 연설에서 할 수 있다는 정신을 재차 강조했다. 그는 연설에서 목표가 달성하기 힘들 정도로 야심차고 어마어마하며 갈등이 해소하기 힘들 정도라도 우리는 좌절할 필요가 없다. 가능한 일을 할 수 있다며 이는 우리가 독일 역사에서 배운 것이라고 말했다. 역사학자 폴 놀테 베를린 자유대학교 교수는 메르켈 총리가 지난 25년 동안의 통일 독일에 누구보다 정통하다며 미래 독일의 새로운 책임도 질 수 있다고 여긴다고 말했다. 놀테 교수는 일부 반대론자들이 공포를 조성하며 차질이 빚어질 수 있다면서도 상대적으로 좀 더 부유한 서독의 중산층들은 메르켈 총리의 할 수 있다는 정신을 지지하는 편이라고 강조했다. 하지만 독일이 유럽을 대표하며 주도하는 상황에 대한 반감도 상당하다. 특히 난민 문제가 대두되면서 빅토르 오르반 헝가리 총리는 메르켈 독일 총리에 대해 도덕적 제국주의moral imperialism를 이끌고 있다고 비난했다. 안드레아스 로에데르 역사학자는 통일 독일의 부흥에 대한 공포에 대해 딜레마적 상황을 반영하는 것이라고 분석했다. 로에데르 역사학자는 독일이 리더십을 발휘할 것이라는 기대를 받는다. 하지만 동시에 독일이 그렇게 하면 과거 나치 독일의 지배가 연상될 수 밖에 없다고 말했다. 게다가 이번 독일 통일 25년 기념식을 코 앞에 두고 공교롭게도 폭스바겐의 조작 파문이 확산되면서 독일의 국가 이미지까지 흔들리고 있다. 폭스바겐 사태가 확산되면서 독일 기업 전체와 더 나아가 독일산 기술과 신뢰에 대한 명성까지 무너질 수 있다는 우려까지 나오고 있다. 통일 독일을 사실상 이끌어온 장본인격인 볼프강 쇼이블래 재무장관은 이번 조작 파문의 근원이 탐욕이라고 힐난하며 자구책 마련을 촉구했다. 그는 모두가 최대가 되고 싶어한다며 유명세와 인지도에 대한 욕망이라고 비난했다.일각에서는 이번 파문이 독일의 자동차 업계와 정부 사이 유착관계에 대한 비난의 목소리도 나온다. 폭스바겐은 독일어로 국민차라는 뜻으로 태생부터 독일 정권의 전폭적 지지를 받으며 탄생한 회사다.별명이 자동차 장관이었던 게르하르트 슈뢰더 전 총리 독일 10대 대통령 크리스티안 불푸 독일 현 부총리 겸 경제장관 지그마어 가브리엘 등등이 폭스바겐 경영감독위원회 이사회 멤버로 활동했다
