경찰 "2차 민중총궐기, 1차 연장선상이면 불허 검토"	http://news.naver.com/main/read.nhn?mode=LSD&mid=shm&sid1=102&oid=001&aid=0008006503	지난14일 서울 광화문 사거리 인근에서 민주노총 등 노동농민시민사회단체로 이뤄진 민중총궐기 투쟁본부가 개최한 정부 규탄 민중총궐기 투쟁대회 참가자들이 행진도중 차벽을 무너뜨리려 하자 경찰이 캡사이신과 물대포 등을 발사하고 있다.     박성민 기자  경찰은 23일 진보진영 시민단체가 다음달 5일 예고한 2차 민중총궐기 집회와 관련 이달 14일 1차 집회 때의 연장선상에 있으면 불허를 검토할 수도 있다는 입장을 밝혔다.     경찰청 고위 관계자는 이날 와의 통화에서 아직 신고가 들어오지 않았지만 2차 집회 신고 주체와 인원 장소를 종합적으로 고려해 1차 집회의 연장선상으로 나온다면 불허할 가능성이 있다고 말했다.    이러한 입장의 근거는 집회 및 시위에 관한 법률이다.     집회 및 시위의 금지를 규정한 이 법률 5조 2항에는 집단적인 폭행 협박 손괴 방화 등으로 공공의 안녕 질서에 직접적인 위협을 끼칠 것이 명백한 집회 또는 시위가 금지 대상으로 적시돼 있다.    1차 집회가 과격폭력 시위로 얼룩졌기 때문에 그때와 신고 주체와 인원 장소 등이 비슷해 또다시 불법 시위가 예상되는 경우 신고 내용을 면밀히 검토해 금지를 통고할 수 있다는 것이다.살인진압 사과 공안탄압 중단      신준희 기자  23일 오전 서울 청운동 주민센터 앞에서 민주노총 관계자들이 민중총궐기 대회 경찰 과잉 진압을 규탄하고 12월 2차 민중총궐기 및 총파업을 경고하는 기자회견을 벌이고 있다.     당시 불법 시위를 기획주도한 것으로 의심받는 민주노총은 이날 종로구 청운효자동주민센터 앞에서 기자회견을 하고 강력한 투쟁 기조를 유지해 2차 민중총궐기는 전국 각지에서 열려던 것을 상경 투쟁 방식으로 치를 것을 검토하고 있다고 밝혔다.    이에 대해 경찰 관계자는 아직 신고가 들어오지 않았고 벌써부터 불허를 얘기하면 집회시위권에 대한 과도한 침해라는 비판을 받을 수 있다면서도 예를 들어 2차 집회 주체가 민중총궐기투쟁본부로 같고 인원 수만명에 도심 광장을 장소로 신고할 경우 불허할 가능성이 있다고 설명했다.    경찰이 공공 안녕 질서에 직접적 위협을 이유로 금지를 통고한 건수는 2009년 379건 2010년 413건 2011년 79건 등을 기록했다. 그러나 2012년 2건 2013년 15건 2014년 6건으로 최근 몇년 사이 크게 줄었고 올해 들어서는 지난달 말까지 1건만 금지 통고됐다
정부, 벨기에 여행경보…수도 브뤼셀엔 '여행자제'	http://news.naver.com/main/read.nhn?mode=LSD&mid=shm&sid1=100&oid=001&aid=0008006420	인적 드문 역전 광장에 장갑차만 덩그러니    브뤼셀 AP 22일현지시각 브뤼셀 중심부 기차역 광장에 벨기에 군 장갑차가 세워져 있다.     이틀째 최고 수준의 테러 경보가 발령된 가운데 거리는 텅 비어 있고 모든 지하철 역이 폐쇄됐다.     파리 테러에 직접 가담한 8번째 용의자 살라 압데슬람26이 자폭 테러를 저지르려고 벨기에 브뤼셀에 숨어있는 것으로 추정되고 있다.호텔 인질극 말리 바마코에는 철수권고     김효정 기자  외교부는 테러 위협이 높아진 벨기에에 대해 23일 여행경보를 발령했다.    외교부는 이날 벨기에 수도 브뤼셀에는 여행자제에 해당하는 황색경보를 벨기에 나머지 지역에는 여행유의에 해당하는 남색경보를 각각 발령했다.    외교부는 여행유의남색여행자제황색철수권고적색여행금지흑색 등 4단계의 여행경보제도를 운용하고 있다.    외교부는 브뤼셀 방문을 계획 중인 우리 국민은 여행 필요성을 신중히 검토하기 바란다며 나머지 지역에 체류 또는 방문하는 국민도 신변안전에 주의하기 바란다고 밝혔다. 바마코말리 AP 지난 20일현지시간 인질극이 종료된 말리 수도 바마코의 래디슨블루 호텔에서 경찰들이 희생자의 시신을 흰 천으로 덮고 있다.     이날 이슬람 무장단체가 이 호텔에서 벌인 인질극으로 인질 19명과 테러범 2명 등 총 21명이 사망했다.    벨기에 정부는 지난 20일현지시간 구체적인 테러 정보에 의해 브뤼셀 지역 테러 경보를 최고 등급인 4단계로 격상했다. 벨기에 당국은 파리에서 13일현지시간 일어난 테러의 주요 용의자도 추적하고 있다.    외교부는 20일 극단주의 세력에 의한 인질 사태가 발생한 말리 수도 바마코에 대해서도 여행경보를 종전 황색경보에서 철수권고에 해당하는 적색경보로 상향했다.    외교부는 추가 테러 가능성을 배제할 수 없다며 바마코에 체류 또는 방문 중인 국민들은 긴급 용무가 아닌 한 귀국하고 이 지역 방문을 계획 중인 국민들은 가급적 여행을 취소 또는 연기하기 바란다고 권고했다.    말리의 나머지 지역에는 이미 철수권고가 발령돼 있다
입시 상담 1분에 5000원…  제재도 못하는 '폭리 학원'	http://news.naver.com/main/read.nhn?mode=LSD&mid=shm&sid1=102&oid=005&aid=0000843938	교육부가 학생과 학부모의 불안감을 틈타 성업 중인 고액 입시상담학원에 대한 특별 점검에 나선다. 서울 강남의 입시상담학원에서는 1시간 상담에 최대 30만원을 내야 하는 것으로 파악됐다. 교육부는 2016학년도 수능 이후 입시철을 맞아 신고한 것보다 수강료를 비싸게 받거나 불법 특강하는 입시상담학원을 점검한다고 23일 밝혔다. 서울경기 지역을 중심으로 12월 말까지 필요할 경우 경찰 등 유관기관 협조를 받아 추진한다. 입시상담학원을 특정해 점검에 나서기는 처음이다. 교육부에 따르면 서울경기 지역에 등록된 입시상담학원은 약 60곳이다. 서울 강남에 고액 입시컨설팅업체 19곳이 밀집돼 있다. 교습비 상한액도 분당 5000원으로 가장 높다. 이런 입시학원의 경우 패키지 프로그램을 통해 수일에서 수개월 단위로 학생을 모집하기 때문에 컨설팅 비용만 수백만원씩 된다. 교육부 관계자는 지역 여건을 감안해도 지나치게 비싼 데다 입시철에 학생이 전국에서 몰려들어 문제라고 말했다. 분당 교습비 상한액은 담당 공무원 학원장 회계사 대학교수 시민단체 관계자 등으로 구성된 교육지원청 교습비조정위원회가 물가인상률 전년 대비 상승률 시설 지역 특성 등을 고려해 설정한다. 학원은 이 기준에 준하는 교습비를 책정해 등록해야 한다. 서울시교육청 산하 강남교육지원청은 입시상담학원이 늘어나면서 상한액을 설정할 필요가 생기자 2012년 관할 학원을 전수조사했다고 설명했다. 이후 2013년 11월 교습비조정위원회를 열고 입시상담학원의 분당 상한액을 최고액의 약 70로 설정해 지난해 6월 16일부터 적용하고 있다. 인근 강동송파교육지원청의 경우 수요가 적어 분당 210원인 교습학원 상한액을 입시상담학원에도 적용한다. 강남지원청 관계자는 상한액을 올려달라는 학원 측 요구도 많았지만 협의조정을 통해 동결유지하고 있다고 설명했다.  교육부가 점검에 나선 데도 현행법으로는 고액 입시컨설팅을 제재하기가 쉽지 않다. 상한액 자체가 높게 설정돼 있는 데다 개별 학원의 요청이 있으면 회계분석 등을 거쳐 분당 교습비를 상한액보다 비싸게 조정하는 것도 가능하다. 교육부 관계자는 책정한 교습비만큼 시간을 채우지 않거나 등록하지 않고 상담 비용을 받는 곳을 가려내는 등 학원법에 저촉되는 모든 사항을 단속하는 식으로 접근할 수밖에 없다고 설명했다
내일 밤부터 비 흠뻑, 강원 산간 폭설	http://news.naver.com/main/read.nhn?mode=LSD&mid=shm&sid1=103&oid=214&aid=0000560230	한동안 온화한 날씨가 이어졌지만 이번 주는 급격하게 추워지겠습니다.추위를 몰고 오는 비구름이 내일 밤부터 수요일 밤까지 전국에 다시 흠뻑 비를 뿌리겠고요.뒤따라 영하 30도 이하의 매우 차가운 공기가 내려오면서 목요일부터는 본격적으로 겨울 추위가 시작되겠습니다.바람도 강하게 불어 낮 동안에도 체감온도가 영하권을 맴돌 전망입니다.강원 산간에서는 폭설이 우려되고 있습니다.오늘은 설악산 등 북부 산간에서만 눈이 왔는데요. 차츰 눈구름이 퍼지면서 강원도 대부분 산지에서 눈이 오겠고요.내일 낮에는 올가을 들어 처음으로 대설주의보가 내려지겠습니다.수요일인 모레는 경기 북부와 강원 영서 경북 북부 일부 지방에서도 눈이 내려 쌓이겠습니다.차츰 동풍이 강화되면서 동해안을 따라서는 눈구름이 발달하겠습니다.또 현재 동해상에는 풍랑주의보가 발효 중입니다.내일 아침은 오늘보다 조금 더 추워지겠습니다.서울 아침 기온 4도까지 내려가겠고요.남부지역의 경우 광주가 14도로 예상됩니다
파키스탄서 여객기 내 폭탄 첩보에 승객 대피	http://news.naver.com/main/read.nhn?mode=LSD&mid=shm&sid1=104&oid=001&aid=0008006578	지난해 6월 파키스탄 페샤와르의 바차칸 국제공항에서 샤힌항공 소속 여객기가 이륙하고 있다. 자료사진 남부 카라치서는 괴한이 대테러부대에 폭발물 투척    뉴델리 나확진 특파원  파키스탄 페샤와르에서 23일현지시간 한 여객기에 폭탄이 탑재됐다는 첩보가 입수돼 승객들이 모두 대피하고 한동안 여객기 운항이 중단됐다.    파키스탄 민간항공국CAA은 이날 오후 2시30분 페샤와르의 바차칸 공항에서 두바이로 떠날 예정인 샤힌 항공 NL786 여객기에 폭탄이 탑재됐다는 정보당국의 첩보에 따라 200여명의 승객을 모두 내리게 한 뒤 기내를 수색했다고 현지일간 익스프레스 트리뷴 인터넷판이 보도했다.    CAA는 바차칸 공항의 다른 항공기도 한동안 모두 운항을 중단시켰으며 수색결과 폭탄이 없는 것으로 확인돼 운항을 재개했다고 설명했다.    조지 페르베즈 CAA 대변인은 승객들의 생명이 위험한 상태에서 운항할 수는 없다며 앞으로도 테러 대비에 최선을 다하겠다고 밝혔다.    한편 같은 날 파키스탄 남부 상업도시 카라치에서는 괴한이 대테러국CTD 주차장으로 5의 급조폭발물IED을 가방에 넣어 던졌으나 불발됐다.    CTD 측은 폭발물의 전선이 끊겨 폭발하지 않았다며 직원들을 대피시킨 상태에서 폭탄제거반원이 안전하게 해체했다고 설명했다.    파키스탄에서는 지난해 12월 파키스탄탈레반TTP의 페샤와르 학교학살 테러로 학생 등 150명이 사망했다.    나와즈 샤리프 파키스탄 총리는 이후 6년간 유예했던 사형 집행을 재개하는 등 강경한 테러 대응에 나섰으며 지난 13일 시리아와 이라크를 중심으로 활동하는 수니파 무장단체 이슬람국가IS의 프랑스 파리 테러에 대해서도 범인들이 처벌받을 수 있도록 지원하겠다고 밝혔다
검진항목서 빠진 C형간염 '건강사각지대'	http://news.naver.com/main/read.nhn?mode=LSD&mid=shm&sid1=102&oid=022&aid=0002960415	양천 집단감염 계기로 본 실태최근 서울 양천구 다나현대의원에서 대거 발생한 C형간염 바이러스 감염 환자가 전국적으로도 증가세인 것으로 나타났다. 건강검진 항목에도 포함돼 있지 않은 C형간염이 국민 건강의 사각지대에 놓여 있다는 지적이다.23일 대한간학회에 따르면 국립암센터 국제암대학원 기모란 교수팀이 전국의 병의원이 국민건강보험공단에 제출한 C형간염 환자20세 이상의 진료기록 8년치20052012년를 분석한 결과 2012년 C형간염으로 치료받은 환자는 7만3502명유병률 0.14보다 2만987명이 늘어난 것으로 집계됐다. 16개 광역 지방자치단체시도 세종시 제외 중 C형간염 유병률이 가장 높은 곳은 부산0. 광역 지자체 중 유병률이 최저인 곳은 충남0.06으로 부산의 6분의 1 수준이었다.17 등 수도권은 전국 평균과 비슷하거나 낮았다. 기초지자체 중에서는 전남 진도0.97가 전국에서 유병률이 가장 높았다.기 교수는 부산의 C형간염 유병률이 높은 이유는 과거 C형간염이 일본에서 부산으로 전파됐다는 얘기가 있었고 마약 투약 과정에서 오염된 주사기 사용이 C형간염의 감염 위험을 높이는 경향이 있는데 부산의 마약 투약률이 높은 것과도 관련이 있을 수 있다고 말했다. 이어 전남 진도신안 등 해안도서 지역의 C형간염 유병률이 높은 것은 과거 이 지역 노인들을 상대로 침술치아치료가 비위생적으로 이뤄졌던 것과 상관성이 있어 보인다고 설명했다.기 교수는 대다수 사람들이 C형간염에 감염된 사실을 인지하지 못하고 넘어가는 경우가 많아 실제로는 건보공단이 파악한 수치보다 훨씬 많은 환자가 있을 것이라며 증상이 경미하고 심각한 질병으로 발전하는 경우가 많지 않아 건강검진 항목에도 포함되지 않고 있는데 간암이나 만성간경변으로 발전할 수 있는 만큼 주의를 기울여야 한다고 당부했다
'유럽의 지도자' 슈미트 전 독일 총리 함부르크에 영면	http://news.naver.com/main/read.nhn?mode=LSD&mid=shm&sid1=104&oid=001&aid=0008006457	슈미트 독일 전 총리 조문록에 서명슈미트 전 총리 별세 직후 조문록에 서명하는 가우크 대통령 옆에 서 있는 메르켈 총리 가우크 대통령 뒤 슈미트 전 총리 초상화김태호 의원 정부 조문 사절로 참석    베를린 고형규 특파원  향년 96세로 지난 10일현지시간 작고한 헬무트 슈미트 전 독일 총리의 장례가 23일현지시간 함부르크에서 국장으로 엄수됐다.    슈미트 전 총리는 생전 자신의 유언에 따라 수도 베를린이 아니라 고향인 함부르크에서 마지막 장례의식을 거쳐 영면에 들어갔다.     이날 장례식이 열린 성 미하엘리스 중앙교회에는 앙겔라 메르켈 총리와 요아힘 가우크 대통령 등 독일 주요 정치지도자들이 참석해 고인의 족적을 기렸다.    모두 1천 800명의 공식 참석자 가운데는 고인이 총리로 재직한 19741982년 유럽의 두 축으로 활약했던 프랑스의 발레리 지스카르 데스탱 전 대통령 헨리 키신저 전 미국 국무장관 조르조 나폴리타노 전 이탈리아 대통령 옌스 슈톨텐베르크 북대서양조약기구나토 사무총장 등 국내외 주요 인사들이 망라됐다.     우리나라에서는 김태호 새누리당 의원과 이경수 주독대사를 대신한 장시정 함부르크 총영사가 정부조문 대표로 함께해 예를 표했다.    국장이 엄수된 성 미하엘리스 중앙교회는 함부르크의 상징 가운데 하나로 미헬 교회로도 불리며 132.     이곳에선 2010년 먼저 세상을 떠난 슈미트 전 총리의 부인 로키의 장례식도 열렸고 이 인연으로 고인은 공식 장례식장으로 이곳을 희망한 것으로 알려졌다. 슈미트 전 총리 고향 함부르크에 영면    함부르크 AP 향년 96세로 지난 10일현지시간 작고한 헬무트 슈미트 전 독일 총리의 장례가 23일현지시간 함부르크에서 국장으로 엄수됐다.    슈미트 전 총리는 생전 자신의 유언에 따라 수도 베를린이 아니라 고향인 함부르크에서 마지막 장례의식을 거쳐 영면에 들어갔다.     사진은 헨리 키신저 전 미국 국무장관이 슈미트 전 총리의 장례식에서 연설하는 모습.    이들 장례식 참석자 외 수 많은 시민은 함부르크시청 등에 마련된 조문실을 찾고 조문록에 추도글을 남기며 슈미트 전 총리를 추도하고 있다고 현지 언론은 전했다.    고인은 장례식 이후 화장 절차를 밟고 나서 올스도르프 지역에 있는 사설 가족묘역에 유해가 안장될 예정이다.     동방정책의 빌리 브란트 전 총리가 측근의 스파이 사건으로 사임하고서 총리직 바통을 넘겨받은 슈미트 전 총리는 사회민주당을 대표하는 최고지도자로 활약했다.    시기적으로는 브란트와 이후 자신의 후임 총리였던 헬무트 콜을 잇는 냉전 완화와 독일 통일의 가교 총리였고 재임 중 닥친 오일쇼크 적군파 테러 구 소련의 핵미사일 유럽향 배치 통화체제 위기 등 온갖 위기를 헤쳐나간 위기 시대의 총리이자 유로통화체제의 기반을 다진 유럽의 지도자였다.     총리 사임 후에도 시사주간지 차이트의 공동발행인이자 독일사회가 귀 기울이는 최고 현자로 역할하면서 현안에 대해 왕성하게 발언하고 메르켈 전 총리에게도 조언했다.     독일인들은 그런 초고령의 고인을 역대 총리 가운데 가장 가까이 느끼며 존경하면서 때와 장소를 가리지 않고 멘솔 담배를 입에 물던 애연가 슈미트를 기끼이 용인했다.    주간지 슈피겔은 슈미트 전 총리의 타계를 다룬 최근호에서 세기의 인물로 고인을 묘사했고 이날 독일 주요 언론은 모두 그의 마지막 가는 길을 조명했다
