그리스·채권단 '치킨게임'…그렉시트 현실화되나	http://news.naver.com/main/read.nhn?mode=LSD&mid=shm&sid1=101&oid=022&aid=0002864256	국민투표 이틀 앞 파국타협 분수령기차가 서로 마주보고 달리는 형국이다. 사실상 디폴트채무 불이행 상황에 처한 그리스와 유럽 채권단이 서로 한치의 양보도 하지 않고 있다. 양측의 치킨 게임의 끝이 파국이 될지 대타협이 될지는 일단 5일현지시간 치러질 국민투표 결과에 따라 가늠할 수 있을 것으로 보인다.치프라스 vs 채권단 5일 국민투표서 결투알렉시스 치프라스 그리스 총리는 1일현지시간 긴급연설을 통해 채권단 제안과 관련한 찬반 국민투표를 예정대로 시행하겠다고 밝혔다. 그는 그리스는 지금 협박당하고 있다며 더 공정한 합의안을 압박할 수 있도록 국민투표에서 반대 투표를 해 달라고 역설했다. 앞서 치프라스 총리가 채권단의 제안을 일부 수정하면 수용할 수 있다는 내용의 서한을 장클로드 융커 유럽연합EU 집행위원장 마리오 드라기 유럽중앙은행ECB 총재 크리스틴 라가르드 국제통화기금IMF 등 이른바 채권단 트로이카의 수장들에게 보낸 사실이 알려지면서 국민투표를 철회할 수 있다는 관측도 나왔으나 그리스 정부의 입장은 달라지지 않았다.이에 대해 유로존유로화 사용 19개국 재무장관 협의체인 유로그룹은 이날 저녁 전화회의를 열고 그리스 국민투표 결과가 나오기 전에는 추가 협상은 없을 것이라고 응수했다. 특히 최대 채권국인 독일의 앙겔라 메르켈 총리는 그리스에 대한 입장을 이미 정했으며 더 덧붙일 것이 없다며 국민투표 전에는 협상하지 않겠다는 입장을 재확인했다. 그는 유럽 공동체가 서 있는 법 규정과 책임의식을 잊으면 유로화는 실패하고 유럽도 실패할 것이라며 원칙을 벗어난 양보는 하지 않겠다는 방침을 드러냈다.양보 없이 팽팽히 맞서는 이유는그리스는 지난달 30일 만기가 도래한 IMF 채무 16억유로약 2조원를 못 갚은 데 이어 오는 20일에는 ECB 채무 34억6000만유로를 상환해야 한다. 그리스 국민이 투표를 통해 채권단 제안을 반대하고 결국 구제금융 협상이 타결되지 않으면 그리스 은행들에 대한 ECB의 긴급유동성지원ELA도 끊길 가능성이 농후하다. 은행들이 붕괴하고 그렉시트Grexit그리스의 유로존 탈퇴 우려가 현실화할 수 있다.그리스가 파국을 맞게 될 경우 유럽 입장에서도 하나의 유럽이라는 꿈이 흔들리게 된다. 하지만 양측 간에는 타협의 징후가 전혀 없다며 채권단은 치프라스 정부에 굴욕감을 주고 좀더 유순한 정부가 등장하기를 기대하고 있는 것이 분명하다고 영국 일간 가디언이 지적했다. 채권단이 비타협적 태도를 고수하는 이유는 결국 스페인 포르투갈 등 유럽 내 다른 재정 취약국들이 그리스를 따라 긴축 종식과 채무 탕감 요구에 나설까봐 두려워서라는 설명이다. 스페인에서는 좌파정당 포데모스Podemos우리는 할 수 있다가 최근 두각을 나타내고 있으며 포르투갈에서도 올해 하반기 총선에서 반긴축 노선의 사회당 집권 가능성이 커지고 있다. 유로화 구상자인 오트마르 이싱 전 독일 중앙은행 이사는 그리스가 채무를 제대로 이행하지 않으며 유로존에 계속 남을 경우 포데모스도 유권자에게 봐라 꼭 허리띠를 졸라 맬 필요는 없다고 외칠 것이라며 그렉시트가 바람직하다는 입장을 밝혔다.뉴욕타임스는 자본통제 등 사태가 길어질수록 그리스는 더 열악한 조건에서 협상을 할 수밖에 없다고 지적했다. 시중 은행이 6일 정도까지밖에 못 버틸 정도로 급속히 돈이 말라가고 있으며 경제성장 전망이 악화될수록 채권단은 더 가혹한 긴축 요구를 할 것이라는 점에서다. 하지만 협상 과정에서 온탕과 냉탕을 수시로 번갈아 들락거리던 치프라스 총리는 결국 강경 입장을 택했다
'병실 하나당 3억' 음압격리병실 설치 꺼린다…대책은?	http://news.naver.com/main/read.nhn?mode=LSD&mid=shm&sid1=102&oid=214&aid=0000512834	메르스 치료를 위해선 음압 병실이 절실하단 얘기 많이 들으셨습니다.의료진이 이 병실에 들어오려면 방 하나를 더 거쳐야 하고요.나갈 때 머리부터 발끝까지 살균을 해야 합니다.그리고 병실 안엔 음압기 즉 외부보다 공기 압력을 낮춰 바이러스가 밖으로 빠져나가지 못하게 하는 장치도 있고요.문제는 병실 하나당 3억 원이 넘게 드는 고가라 병원들이 설치를 꺼린다는 겁니다.메르스 사태가 남긴 과제를 짚어보는 연속기획 오늘은 초기 방역 실패 원인의 하나로 지적되는 국내 음압병실 실태 오현석 기자가 취재했습니다. 리포트 음압 병실을 출입한다는 건 숙련된 의료진에게도 부담스런 일입니다.머리부터 발끝까지 보호 장구 착용은 기본.차단문 두 개를 지나야 들어갈 수 있고 밀폐에 또 밀폐된 공간에서 몇 시간씩 환자를 보다 보면 탈진 직전까지 갈 때도 많습니다.정유진경기도의료원 수원병원나로 인해 다른 사람이 또 감염 전파가 되면 안 되기 때문에 거기에 대해 철저히 차단을 하자 이런 생각에서.이렇게까지 하는 건 음압 병실이 바이러스와의 전쟁 최전선이기 때문.바이러스가 조금이라도 새어나간다면 걷잡을 수 없는 확산으로 이어집니다.그렇지만 병실 하나 만드는 데 드는 돈이 3억 원 민간 병원에 아예 음압 병실이 없거나 있더라도 간이시설에 불과한 건 이 때문입니다. 김윤 교수서울대학교 의과대학음압병실이 원가가 많이 들어가는데도 불구하고 제대로 된 건강보험 수가를 주지 않으니 병원이 시설을 안 갖추게 되는 거죠. 손해를 보지 않으려고33개 공공 지방의료원 가운데도 음압 병실을 갖춘 곳은 절반이 되지 않습니다.현재 전국의 음압 병실 개수는 평상시에 맞춰진 수준일 뿐 메르스 같은 전염병이 또 엄습할 수 있다는 걸 감안하면 공공병원에서만이라도 음압 병실을 늘려야 한다는 목소리가 높습니다.김민기 서울의료원장국가지정 격리병상이라고 하는 것들이 이렇게 만들어 놓으면 꼭 필요한 언젠가는 반드시 필요한 역할을 하게 되는 것이고요.현황 파악이 안 돼 있는 병실도 제대로 못 썼던 초기의 어설픈 대응도 돌아봐야 할 부분입니다.메르스 담당 의사전체를 총괄해서 알고 있는 어떤 시스템이나 사람이 아무도 없었어요
일본 관방장관 "혐한시위 실태 조사하겠다"	http://news.naver.com/main/read.nhn?mode=LSD&mid=shm&sid1=104&oid=001&aid=0007702401	자료사진연립여당 공명당 인종차별해소 기본법 제정 촉구    도쿄 조준형 특파원  일본 정부는 사회문제로 떠오른 혐한 시위의 실태를 조사하겠다고 밝혔다.     정부 대변인인 스가 요시히데 관방장관은 2일 연립여당인 공명당으로부터 혐한 시위로 대표되는 헤이트스피치특정 인종과 민족에 대한 혐오 시위 또는 발언 실태를 조사하라는 요망서를 접수한 뒤 곧바로 해야한다며 금년도 예산을 써서 대응에 나설 뜻을 밝혔다고 교도통신이 보도했다.    스가 장관은 이날 기자회견에서 전국에서 어떤 상황으로 헤이트스피치가 일어나고 있는지 등을 확실히 조사하라는 요망서가 있었기 때문에 구체적인 건수나 문제점 등을 제대로 조사해야 한다고 말했다.     공명당은 이날 요망서에서 인종 차별 해소를 위한 기본법 제정을 포함한 인종차별 철폐 정책 수립 도 요구했다
한일, 세계유산협의 막판진통…"등록결정시 韓의견진술 새.."	http://news.naver.com/main/read.nhn?mode=LSD&mid=shm&sid1=100&oid=001&aid=0007702549	지난달 21일 도쿄에서 회담한 윤병세왼쪽 외교부 장관과 기시다 후미오 일본 외무상.교도 등재결정 후의 의견진술 내용 조율하자 요구에 난색    도쿄 조준형 특파원  사실상 합의점을 찾은 듯했던 일본 산업혁명 시설의 유네스코 세계유산 등록 관련 한일 협의가 새 쟁점의 등장으로 막판 진통을 겪고 있는 것으로 2일 알려졌다.     교도통신은 세계유산 등재 여부를 결정하는 유네스코 세계유산위원회에서 일본 산업시설의 등재가 결정됐을 때 한국이 할 의견 진술이 새 쟁점으로 부상했다고 보도했다.     한국은 세계유산위원회의 위원국으로서 등재 결정된 세계유산에 대해 의견을 밝힐 권리가 있다.     일본 측은 한국이 이 기회를 활용해 조선인 강제징용 등 역사 문제를 거론하면 세계유산으로서의 가치가 떨어질 수 있다고 보고 의견 진술 내용을 사전에 조율할 것을 요구하지만 한국은 난색을 표하고 있다고 교도는 전했다.     이 문제에서 타협점을 찾기 위해 일본은 스기야마 신스케 외무심의관차관보급을 지난달 30일 서울에 파견 2일까지 조태열 외교부 제2차관 등 당국자들과 협의토록 했다.     만약 양측이 합의점 도출에 실패한 채 오는 4일 이뤄질 유네스코 세계유산위원회 회의독일 본에서 표결까지 가게 되면 양국 관계에 중대한 변수가 될 전망이다.     이런 가운데 일본은 표결까지 가는 상황을 대비하는 듯한 움직임을 보였다.      이번 세계유산 등록 추진을 주도한 아베 신조 총리는 2일 세계유산위원회 의장국인 독일의 연방 상원의장과 총리 관저에서 만나 세계유산 등재를 위해 협력해줄 것을 요청했다.     또 같은 날 스가 요시히데 관방장관은 산업시설의 세계유산 등록을 위해 도시경제 평론가인 가토 고코 씨를 내각 관방 참여총리 자문역에 임명했다고 밝혔다.      한국과 일본은 지난달 21일 외교장관 회담을 계기로 일본 산업시설에서 이뤄진 조선인 강제노동 사실을 세계유산 등재문 주석에 명기하는 방안에 대략적으로 합의를 도출했다.      지난달 유네스코 자문기구인 국제기념물유적협의회ICOMOS는 일본 규슈 지역을 중심으로 한 8개 현에 걸친 총 23개 산업 시설의 세계 문화유산 등재를 유네스코에 권고했다. 일본 정부가 추천한 이들 23개 시설에는 나가사키 조선소 하시마일명 군함도 탄광 등 조선인 수만 명이 강제노동한 현장 7곳이 포함됨에 따라 한국 정부는 등재 추진 과정에서 강제징용 역사를 반영할 것을 일본에 요구해왔다
동네 다방인 줄 알았더니 '마약 유통창구'… 중국인 검거	http://news.naver.com/main/read.nhn?mode=LSD&mid=shm&sid1=102&oid=214&aid=0000512897	평범해 보이는 도심 한복판의 다방이 마약을 사고파는 거래소로 드러났습니다.중국인이 운영하는 이 다방에서 무려 4천 명이 동시 투약할 수 있는 양의 마약이 발견됐습니다. 리포트 경기도 오산의 한 상가입니다.사람들이 많이 지나다니는 상가 한구석에 평범한 다방이 눈에 띕니다. 얼마 전 경찰이 이 다방을 덮쳤습니다.에어컨 뒤에서 검은 비닐봉지를 찾아내 풀어헤치자 가만히 앉아 있어요.중국 한족 출신인 53살 양 모 씨는 1년여 전부터 이 다방을 운영해 왔습니다.하지만 다방 영업은 눈속임이었고 실제론 주변 중국동포들을 상대로 마약 장사를 해 온 것으로 경찰은 보고 있습니다. 박완영인천경찰청 마약수사대 팀장마약을 중국에서 들여온 것으로 추정하고 있고요 인터폴과 공조해서 계속 상선에 대해서 수사할 예정입니다. 양 씨가 중간 판매상인 중국동포들에게 마약을 건네면 이들이 다시 한국인이나 다른 중국동포들에게 팔아왔다는 겁니다.다방 안에서 철저히 직거래만 해 경찰 추적을 피해왔습니다.인근 상인마약 팔았다는 그거는 못 들어봤어요
"금융 사기 당한 돈 539억 원, 빨리 찾아가세요"	http://news.naver.com/main/read.nhn?mode=LSD&mid=shm&sid1=101&oid=056&aid=0010191305	멘트보이스피싱 같은 금융 사기를 당한 피해자들이  지급 정지를 신청해 놓고도   찾아가지 않은 돈이  539억 원에 이르는 것으로 나타났습니다.사기 피해 당한 분들은  꼭 한번  확인해보시는 게 좋겠습니다.  리포트 검찰을 사칭하는 전화 사기에 속아  통장 비밀번호를 알려준 이 여성. 620만 원이 빠져나갔지만  곧바로 경찰에 신고해 사기범의 계좌를 정지시킬 수 있었습니다. 인터뷰 보이스피싱 피해자  보이스피싱을 당했다 그랬더니 112에서는 어느 은행에 이체가 됐냐 그래서 연결을 해주더라고요. 그래서 바로 지급정지를 했고. 이렇게 지급 정지를 한 뒤  피해구제 신청을 하면 사기범의 계좌에 남아있는 돈을 돌려받을 수 있습니다. 그런데 신청을 하지 않아  계좌에 묶여 있는 돈이 539억 원에 이릅니다. 찾아가지 않은 사람은 21만 5천 명이나 됩니다. 잔액이 5만 원 이하인 계좌가 84를 차지하지만 100만 원 넘게 남은 계좌도 만3천개 가까이 됩니다. 금액이 적어서 안 찾아가는 경우도 있지만 돌려받을 돈이 있다는 사실을  모르는 경우도 적지 않다는 얘기입니다. 금융감독원은  다음달까지 집중적으로  환급금 찾아주기 운동을 펼치기로 했습니다. 인터뷰 김용실금융감독원 서민금융지원국 팀장  피해자들께 유선이라든가 이메일 여러가지 방법을 통해서 알린 다음에 피해구제를 신청할 수 있도록 지도할 방침입니다
'모뉴엘 뒷돈' 무역보험공사 전 사장 징역 1년 6개월	http://news.naver.com/main/read.nhn?mode=LSD&mid=shm&sid1=101&oid=056&aid=0010191238	서울중앙지법 형사합의23부는 가전업체 모뉴엘로부터 뇌물을 받은 혐의로 기소된 조계륭 전 한국무역보험공사 사장에게 징역 1년 6개월과 벌금 2천만 원 추징금 9천140만 원을 선고했습니다. 재판부는 조씨가 업무 관련자에게 뇌물을 받고 퇴직 뒤에도 청탁을 알선하거나 직접 청탁하는 등 업무 처리의 공정성과 적정성을 침해했다고 밝혔습니다. 또 수사가 시작되자 뇌물을 건넨 측과 진술을 맞추기도 해 엄벌할 필요가 있다고 지적했습니다. 2011년 6월부터 2013년 12월까지 무역보험공사 사장으로 재직한 조씨는 2013년 5월 박홍석 모뉴엘 대표로부터 여신 한도를 늘려달라는 청탁과 함께 천만원 상당의 상품 카드를 받은 혐의를 받고 있습니다
막말에 욕설…여당, '유승민 사퇴' 놓고 내홍 심화	http://news.naver.com/main/read.nhn?mode=LSD&mid=shm&sid1=100&oid=056&aid=0010191287	멘트유승민 원내대표 퇴진을 둘러싼 새누리당의 내홍이 깊어지고 있습니다.오늘 최고위원회의에서는 당 대표와 최고위원 사이에 충돌이 벌어지고 일부 당직자들이 욕설을 하는 일까지 있었습니다. 리포트 순조롭던 최고위원 회의는 김태호 최고위원이 유 원내대표의 사퇴를 꺼내면서 순식간에 얼어붙었습니다.녹취 김태호새누리당 최고위원  당과 나라를 위해서 또 이 모두를 위해서 저는 용기 있는 결단을 촉구합니다.녹취 원유철새누리당 정책위의장  그만두라고 계속 얘기하는 것이 도저히 이해가 안 갑니다. 해도 좀 너무한다는 생각이 듭니다. 김 최고위원이 다시 반박하려 하자 김무성 대표는 불편한 속내를 드러내며 회의장을 박차고 나갔습니다. 녹취 김무성새누리당 대표  회의 끝내겠습니다.녹취 김태호새누리당 최고위원  대표님.  대표님 이렇게 할 수 있습니까  맘대로 해.   사퇴할 이유를 모르겠다고 하니까 계속 얘기하는 거 아닙니까 사퇴할 이유가 분명히 있는데. 결국 회의는 중단됐고 일부 당직자는 김 최고위원에게 욕설을 하기도 했습니다. 김무성 대표는 유 원내대표에게 시간을 줘야 한다는 입장을 거듭 밝혔습니다.녹취 김무성새누리당 대표  그걸 못 참고 연일 그렇게 비판을 하고 공격을 하고 하는 건 나는 옳지 못하다고 생각합니다. 이처럼 일촉즉발의 분위기가 계속되면서 파국을 막기 위해 결단을 내릴 수밖에 없지 않느냐는 주장도 나오지만 유 원내대표는 여전히 입을 다물었습니다
 "연구원도 자료 갖고 망명"…생체실험 만행 폭로되나?	http://news.naver.com/main/read.nhn?mode=LSD&mid=shm&sid1=100&oid=214&aid=0000512832	 북한은 이곳을 포함해 7곳에 생화학무기 개발 연구소를 운영하고 있는 것으로 파악되고 있습니다.그런데 이곳 자강도 연구소에서 사린가스를 개발하던 한 연구원이 지난달 유럽에 망명한 것으로 전해졌습니다.망명 당시 생체실험 연구자료를 지닌 것으로 알려졌는데 북한의 생체실험 만행을 폭로하는 계기가 될지 주목됩니다. 리포트 북한 자강도의 강계 미생물 연구소 소속 연구원 47살 이 모 씨가 지난달 6일 핀란드로 망명했다고 국내 북한 인권 단체가 밝혔습니다.지난해 중국 의료 기관에 파견됐던 이 씨는 벨기에 인권단체의 도움받았으며 망명 직전 생체실험 관련 사실을 인권단체에 폭로한 것으로 전해졌습니다.강계연구소에서만 한해 2백여 명의 북한 주민을 사린가스와 탄저균 성능강화 시험에 이용했다는 것입니다.이 씨는 실험대상이 된 북한 주민들을 연구소 지하 2층에 있는 유리챔버에 가둬 사린가스 실험을 했고 국가보위부가 정치범이나 기독교 신자들을 실험 대상으로 공급했다고 밝혔으며 또 15기가 분량의 생체실험 연구자료를 USB에 담아 갖고 있는 것으로 전해졌습니다.지난해 유엔 북한인권조사위원회에 비공개 보고된 생체실험 증언과 거의 일치하는 내용입니다.김상헌 북한인권정보센터 대표가장 많은 증언 예가 이런 가스를 살포했을 때 몇 분 후에 효과를 나타내느냐하는 실험.이 씨는 또 북한이 장기간의 생체실험 통해 탄저균 100kg으로 1백만 명을 살상할 수 있다고 말한 것으로 전해졌습니다.실제로 북한은 생물학 무기 성능을 지속적으로 개량하고 있습니다
블랙박스 명백해도 덤터기, '과실 비율 기준' 개선 시급	http://news.naver.com/main/read.nhn?mode=LSD&mid=shm&sid1=102&oid=056&aid=0010191297	멘트차량 접촉사고 때 명백한 한쪽만의 과실임에도 보험사들이  양측 모두에게  책임을 나눠서 물리는 실태 엊그제 전했는데요.보험사들이 과실 비율 인정 기준이라는 근거가 있다고 항변했습니다.   하지만  이 기준 자체가 시대에 뒤떨어지고  또 비현실적이라는 지적이 나옵니다.   임명규 기자입니다. 리포트 승용차가 방향 지시등도 켜지 않은 채 갑자기 끼어들기를 시도합니다. 피할 새도 없이 받힌 차량은 차량 넉 대를 더 들이받고 나서야 멈춰섭니다. 100 피해자라고 생각했던 운전자는 자신에게도 과실이 있다는 상대 차량 보험사 때문에 소송에 휘말렸습니다. 녹취 피해 차량 운전자  저는 피할 수 있는 상태가 아닌데 과실이 있다라는 형태로 금액적인 소송이 들어가 버리니까. 사고 당시 화면이 고스란히 차량 블랙박스에 담겨 있어도 인정하지 않는 겁니다.  녹취 보험 업계 관계자  블랙박스는 굳이 안 봐도 되고 보상팀들은 도표를 가지고 책정한다고 하더라고요. 보험사들이 적용하는 과실 비율 인정 기준을 보면 차선 변경 사고의 경우 피해 차량의 기본 책임은 30이고 가해 차량의 중과실이 인정돼도  최소 10는 책임져야 합니다. 하지만 1970년대 일본 기준을 그대로 도입한 이 기준은 시대에 뒤떨어진다는 지적을 받고 있습니다.인터뷰 한문철변호사  보험사 직원도 피할 수 없고 그 누구도 피할 수 없는 그런 사례인데도 우리 기준에 80대20이고 70대30이니까 그렇게 적용한다 다만 억울하시니까 10 빼드리겠다. 손해보험 업계는 일부 문제점을 인정하면서도 기준 자체보다는 적용의 문제라는 입장입니다.인터뷰 고봉중손해보험협회 홍보부장  보상 과정에서 원만한 합의를 유도하다 보니 그런 오해가 발생할 수도 있는 것 같습니다
방통위, 종편·보도채널 방송통신발전기금 내년부터 징수	http://news.naver.com/main/read.nhn?mode=LSD&mid=shm&sid1=102&oid=001&aid=0007702411	5 분담야당 측 1 즉시 시행해야 반발     김인철 기자  방송통신위원회는 2일 최성준 위원장 주재로 전체회의를 열어 방송채널사용사업자PP 중 종합편성채널과 보도채널에 대해 내년부터 전년도 방송광고 매출액의 0.5를 방송통신발전기금방발기금 분담금으로 징수하는 내용의 방송통신발전기금 분담금 징수 및 부과 등에 관한 고시 개정안 보고안을 결정했다.    방발기금은 방송통신 산업 진흥을 지원하기 위해 허가승인을 받은 방송사로부터 걷는 법적 부담금으로 매년 해당 방송사의 재정상태와 방송 공공성 등을 고려해 징수율을 결정한다.     방통위는 지상파와 종편보도PP에 대해 전년도 방송광고매출액의 6 내에서 세부 징수율을 결정하지만 그동안 종편보도PP는 신생 매체라는 점에서 징수율이 0로 책정돼 분담금을 면제받았다.    최성준 위원장은 회의에서 종편보도PP에 대해 방발기금 징수율을 0.5 하되 시행 시기를 올해 2016년 2018년 등 3개 중 하나로 결정하는 방안을 제시했다.    그러나 야당 측 김재홍고삼석 의원이 징수율 1에 즉시 시행을 요구하며 논쟁을 벌이다가 결국 퇴장하자 최 위원장 등 나머지 위원 3명이 징수율 0.5 2016년 시행 안으로 결정했다.     최 위원장은 개정 방송통신발전기본법과 시행령이 기금을 명확한 기준에 의해 체계적으로 징수하고자 한 것이라며 시행령 시행시기6월22일 방송시장 상황 종편보도PP의 작년 1천109억 원 적자 등을 고려해 징수율을 0.5로 하되 2015년분부터 적용2016년 시행하는 게 적당하다고 생각한다고 말했다.    허원제 부위원장은 SO와 위성방송. IPTV 등 사업자는 최소 6년 이상 기금 면제 또는 유예를 받아 시장에 안착하고 안정적인 사업을 유지할 수 있었다며 정책의 일관성과 예측 가능성 등을 위해 종편보도PP에 대해서도 여타 사업자와 같이 6년간 즉 2017년까지 징수 유예를 하는 것이 좋다는 의견을 냈다.    이기주 위원은 최 위원장과 같은 의견을 제시했다.    반면 고삼석 위원은 방발기금 면제대상은 전년도 방송광고 매출 50억원 이하에 당기 순손실 발생 사업장 등 두 가지로 종편보도PP는 대상이 아니다며 면제대상을 엄격히 규제해 가급적 많은 사업장에서 징수하자는 게 시행령의 취지인 만큼 징수율 1를 적용해 바로 시행해야 한다고 주장했다.    김재홍 위원도 종편4사는 지난해 매출이 32 급성장한데다 시청점유율도 높다며 우리나라 인프라를 이용해 방송사업을 하는 것인 만큼 당연히 분담금을 내야 한다며 분담률 1에 즉시 시행안을 요구했다.    한편 지상파는 방통위가 이날 어려운 시장 상황과 경영 여건 등을 고려해 광고매출 구간별로 징수율을 차등 적용키로 함에 따라 총 방발기금 납부액이 작년 720억원에서 올해 603억원 정도로 줄어들 전망이다
