이통사들, '싼 요금제' 안 알려…220만 명 '바가지'	http://news.naver.com/main/read.nhn?mode=LSD&mid=shm&sid1=105&oid=056&aid=0010220648&cid=428288	멘트휴대전화 요금을 할인 받을 수 있는 방법은 두 가지가 있습니다. 그런데 200만 명이 넘는 사람들이 할인 혜택이 훨씬 적은 방법을 택해 왔습니다.이익이 줄어들 것을 우려한 이동통신사들이 제대로 설명을 해주지 않았기 때문이라는데요. 리포트 정부는 지난해 10월 휴대전화 구입때 보조금을 주는 대신 매월 전화비를 깍아주는  선택약정할인 제도를 도입했습니다. 하지만 최근  휴대전화를 구입한 김덕준 씨는 이런 사실을 전혀 몰랐습니다.인터뷰 김덕준서울 문래동  요금제는 뭐 쓰시면 될것 같고 얼마 기간 동안만 사용하시면 된다라고. 한 이동통신사가 만든 내부 문건을 보면 그 이유를 알 수 있습니다. 20 선택할인약정제를 적용하면 2년간 36만 4천 원의 요금 할인을 받을 수 있지만 기존 보조금 제도로는 10만원선에 불과합니다. 결국 어떤 요금제어떤 단말기를 선택해도 선택약정할인이 유리하다고 명시했습니다. 그런데도 이동통신사들은 이익이 줄 것을 우려해 이 제도를 제대로 알리지 않아왔습니다. 이때문에 기존 보조금제를 선택한 소비자 220여 만 명이 할인받지 못한 돈만 900억 원이 넘는 것으로 추정됩니다.인터뷰 민병주국회 미래창조과학방송통신위원  이통사가 소비자를 우롱하고 바가지를 씌운거라고 생각을 합니다.  그래서 정부는 이 부분에 대해서 더 관리를 철저히
너무 많이 자도 안 좋다…'7시간 꿀잠의 비밀'	http://news.naver.com/main/read.nhn?mode=LSD&mid=shm&sid1=103&oid=055&aid=0000333006	 잠이 부족하면 건강에 좋지 않다는 건 많이 알려졌는데 너무 많이 자도 좋지 않다고 합니다.7시간 꿀잠의 비밀을 남주현 기자가 알려드립니다.기자일주일에 3회 이상 운동을 하고 술과 담배도 멀리한 50대 남성입니다.그런데 CT 촬영을 해보니 심장에 혈액을 공급하는 관상동맥에 석회 즉 칼슘이 쌓여 있는 것으로 나타났습니다.김명수54세 직장인  출근이 빠른 편입니다. 하루에 5시간에서 많이 자야 6시간 자는데 그게 영향을 미치지 않았을까.이처럼 7시간이 채 못 되게 자거나 너무 오래 자면 심장 건강을 좌우하는 관상동맥에 문제가 생기는 것으로 나타났습니다.수면 시간이 5시간 이하면 동맥경화의 한 요인인 관상동맥 석회화 수치가 7시간씩 자는 사람보다 50 높았고 9시간 이상인 사람은 70 높게 나타났습니다.두 경우 모두 스트레스가 원인인데 잠자는 시간이 9시간을 넘더라도 푹 자지 못하고 중간에 깨는 경우가 많기 때문입니다.성은주강북삼성병원 가정의학과 교수  스트레스 호르몬 증가 등의 변화를 일으켜서 자율신경에 변화 줘서 혈압도 올리고 혈관에 부담을 줘서 이런 결과가 도출됩니다.이번 연구는 협심증이나 심근경색을 예방할 수 있는 적정 수면시간의 기준을 제시했다는 점에서 의미가 있습니다
'박물관 화승총' 동호회가 복제해 발사 실험까지	http://news.naver.com/main/read.nhn?mode=LSD&mid=shm&sid1=103&oid=056&aid=0010220659	멘트박물관에 소장된 유물은 연구나 교육 목적으로 허가를 받으면 실제와 똑같은 복제품을 만들 수 있는데요.한 역사 동호회가 이런 방법으로 화승총을 복제해 발사 실험까지 한 것으로 드러났습니다.엄연한 총기류인데 관리의 사각지대에 놓인 겁니다.  유동엽 기자가 보도합니다. 리포트 조선 시대 모습 그대로 화승총을 발사하는 장면입니다. 이 총은 한 역사동호회가 국립중앙박물관에 소장된 것을 그대로 복제해 만든 것인데 발사 소음이나 충격으로 화면이 흔들리는 모습이 총의 위력을 짐작케 합니다. 동호회 측도 위험성 때문에 총기 소지 허가 신청을 냈지만 경찰은 이를 받아주지 않았습니다.녹취 복제 화승총 제작자  경찰서 담당자들이 굉장히 답답해 하시는 거예요. 소지 허가를 내드릴 수도 있지만 내드릴 수가 없다. 복제 허가를 내준 박물관 측은 화승총의 외형만 복제하라고 한 것이지 총기를 만들라고 한 것은 아니라고 설명합니다. 녹취 이정근국립중앙박물관 학예연구관  외형적인 복제만 승인해준 것이거든요. 총기로서의 기능을 할 수 있는 복제가 저희가 해줄 수 있는 영역도 아니고 해줄 수도 없어요. 결국 유물을 복제한 총기류에 대해선 아무런 관리 규제가 없는 것입니다. 인터뷰 배재정국회 교육문화체육관광위원  누구라도 복제를 할 수 있다는 것이고요 그 이후에 어떻게 쓰이는 지에 대해서는 전혀 점검이 안되는 것이기 때문에. 문화재 연구를 위해 둔  유물 복제 제도
폭우가 할퀴고 간 동일본서 3명 사망·20여명 실종	http://news.naver.com/main/read.nhn?mode=LSD&mid=shm&sid1=102&oid=001&aid=0007850256	기누가와가 범람한 이바라키현 소조시의 모습AP.특별경보는 모두 해제됐지만 산사태 등 추가 피해 우려후쿠시마 오염제거 작업으로 생성된 폐기물 떠내려가    도쿄 조준형 특파원  일본 동부의 간토와 도호쿠 지역을 강타한 기록적 폭우로 1011일 3명이 숨지고 20명 이상이 실종된 것으로 집계됐다.      일본 언론에 의하면 이바라키현 기누가와 미야기현 시부이가와 등 7개의 하천에서 폭우로 제방이 붕괴된 가운데 11일 밤 9시 현재 도치기현과 미야기현에서 총 3명의 사망자가 확인됐다. 또 이바라키현 등지에서 23명이 행방불명됐고 중경상자도 20명을 훌쩍 넘겼다.    조소 이바라키현 AP교도통신연합1일현지시간 이바라키현 조소에서 강의 범람으로 물바다가 된 도로에서 경찰들이 피해를 살펴보고 있는 모습.    bullsyna.kr    이바라키현을 흐르는 하천 기누가와의 제방이 10일 붕괴되면서 물바다가 된 조소시에는 가옥 등 1만 채 이상이 침수됐다.     또 11일 오전 5시께 미야기현 오사키시를 흐르는 시부이가와의 제방이 무너져 일대 주택가가 침수되면서 80명 이상이 고립됐다가 헬기 등으로 구조됐다. 오사키시에는 11일 새벽 9월 관측 사상 최고인 시간당 43mm의 비가 쏟아졌다.     이번 수해로 단수된 지역도 이바라키도치기미야기후쿠시마 등 4개 현에서 2만 5천 가구가 넘었다.      또 후쿠시마현 이이타테무라의 하천이 범람 원전 사고2011년 3월 후의 방사성 물질 오염 제거 작업으로 생성된 폐기물 포대가 11일 강으로 유출됐다고 환경성이 발표했다.     교도통신에 따르면 오염제거 사업자 등이 유출된 포대 중 약 30개를 회수했지만 주변 일대가 침수됨에 따라 전체 유출 규모는 확실히 파악되지 않고 있다고 환경성은 전했다.     조소 이바라키현 AP  사진은 기누가와의 둑이 터진 이바라키현 조소에서 노도같이 범람한 강물에 잠기고 있는 가옥과 전봇대 옆에 서있는 사람이 애처롭게 보인다. 일본 TBS TV 화면을 캡처한 사진.    bullsyna.kr    기상청은 11일 미야기현에 폭우 특별경보를 발표했다가 당일 오후 7시 30분 해제했다. 간토도호쿠 지역에서 추가로 폭우가 내릴 우려는 없어졌다고 기상청이 11일 밤 밝혔다.      현재 특별 경보가 발령 중인 지역은 없지만 폭우가 내린 지역에서 하천 범람과 토사 붕괴를 경계하라고 기상청은 촉구했다
차가운 가을비…주말 비온 뒤 쌀쌀	http://news.naver.com/main/read.nhn?mode=LSD&mid=shm&sid1=103&oid=422&aid=0000135382	날씨 차가운 가을비주말 비온 뒤 쌀쌀 밤사이 전국으로 차가운 가을비가 내리겠습니다. 예상되고있는 비의 양은 제주와 전남 경남지방으로 1040mm 제주산 간 많은 곳에서는 60mm도 내릴 것으로 보고 있고요. 그밖에 남부지방과 충청 영동지방은 530mm 서울경기와 영서지방 5mm 안팎이 예상됩니다.특히 비가 내리는 동안 충청이 남을 중심으로 돌풍이 불고 벼락이 치기도 해 주의하셔야겠습니다. 또 이 비가 그친 뒤에는 찬바람이 불면서 날이 쌀쌀해지겠습니다.내일도 종일 평년기온을 조금 밑돌겠고요.특히 일요일 아침 시간에는 서울 기온이 15도 안팎까지 뚝 떨어지겠습니다.기온 자체도 크게 내려가지만 바람이 불기 때문에 더 쌀쌀하게 느껴질 수 있겠습니다. 옷차림 약간 도톰하게 하시는 게 좋겠습니다.현재 레이더 영상 보시면 비구름대가 유입되면서 중부지방과 전남지방을 중심으로 약하게 비가 오고 있는데요.차츰 이 비는 전국으로 확대되겠습니다.중부지방 같은 경우는 내일 낮시간에 비가 대부분 그치겠지만 남부지방에서는 내일 저녁에 그칠 것으로 보고 있습니다.또 비가 그친 뒤에도 모레 아침 시간까지 서해안을 중심으로 바람이 무척이나 강하게 불겠습니다.내일 아침 기온은 서울 17도 대구가 19도까지 떨어지고요.낮에는 서울이 24도 등 대구가 25도를 크게 밑돌아 쌀쌀하겠습니다
야근도 실적도 숨겨야 하는 경찰서 무기계약직	http://news.naver.com/main/read.nhn?mode=LSD&mid=shm&sid1=102&oid=469&aid=0000088046	시설관리 등 종사하는 1600여명에 수당 안 주려 초과근무 기록 말라주무관 노조  9시간 통계는 꼼수 설문조사 결과 평균 20시간 달해법 수호 조직이 근로기준법 위반 무기한 차별직 서러움만 쌓여가   서울 A경찰서에서 전기보일러 시설을 관리하는 무기계약직 이모42씨의 초과근무 수당은 0원이다. 난방과 보일러 사용이 폭증하는 겨울이면 새벽에 퇴근하는 날이 다반사라 초과근무를 얼마나 했는지 기억조차 나지 않을 정도인데도 그렇다. 상사인 경찰이 예산이 부족하니 초과근무 시간을 기록하지 마라고 지시한 탓이다. 반면 같은 업무를 하는 정규직 행정관은 초과근무 수당을 꼬박꼬박 챙겨가고 있다.  경기 B경찰서에서 회계 업무를 담당하는 무기계약직 최모37씨는 지난해 전기료가 과다 지급되는 사실을 파악하고 수천만원을 절약했다. 보람도 잠시 팀장은 당신은 실적을 내도 혜택이 없으니 동료 경찰의 성과로 돌려 특진을 시켜주자고 강요했다. 최씨는 밤을 세워 자료실을 뒤졌는데 남은 것은 서러움뿐이라며 분통을 터트렸다. 경찰이 비정규직 대책의 일환으로 고용 안정성을 보장하는 무기계약직을 대거 채용했으나 근로기준법에 규정된 초과근무 수당도 받지 못하는 등 차별이 만연한 것으로 나타났다. 무기계약직이 정년을 보장하기는 하나 고용조건은 여전히 비정규직과 비슷해 무기한 차별직 반쪽 짜리 정규직이라는 비판이 나온다. 정부는 2011년부터 비정규직 차별 해소를 목표로 비정규직의 무기계약직 전환을 추진하고 있다. 현재 경찰청과 전국 일선서 249곳에서 무기계약 직원 1654명이 시설관리 회계처리 사무보조 등에 종사하고 있다. 11일 새정치민주연합 진선미 의원이 경찰청에서 제출 받은 경찰청 근무신분 별 월 평균 초과근무시간 자료를 보면 지난해 경찰 공무원의 월 평균 초과근무 시간은 78.5시간이나 됐지만 무기계약직은 9시간에 그쳤다. 물론 무기계약 직원들만 유독 일을 덜하는 것은 아니다. 무기계약직 노조인 경찰청주무관노조는 이를 통계의 꼼수라고 지적한다. 초과근무를 해도 기록에 남기지 못하도록 해 집계되지 않을 뿐 같은 업무를 하는 경찰과 근무 시간은 동일하다는 것이다. 실제 경찰청주무관노조가 올해 무기계약직 158명을 대상으로 실시한 설문조사에 따르면 이들의 월 평균 초과근무시간은 20시간에 달했다. 전남 등 일부 지역에서는 야근과 특근으로 90시간을 넘긴 경우도 있었다. 안규현 경찰청주무관노조 부위원장은 초과근무 수당을 받지 못하면 대체휴가라도 써야 하지만 눈치가 보여 연차휴가도 소진하지 못하고 있는 실정이라고 말했다.  차별은 이뿐만이 아니다. 경찰과 공무원에게 매달 지급되는 위험수당5만원 민원처리수당3만원 휴일근무수당5만7109원 피복비연 20만원 등의 각종 수당에서도 배제되고 있다. 한국노동사회연구원의 조사에 따르면 공공부문 무기계약직 근로자의 월 평균 임금2013년 기준은 정규직 임금211만4310원의 60에 불과한 127만430원으로 조사됐다.  경찰청 관계자는 기획재정부에서 예산을 늘려주지 않아 수당을 지급하는 데 어려움이 있다며 초과근무를 하지 않도록 유도하고 있지만 일부 경찰서에서 초과근무 관행이 남아 있는 것은 사실이라고 해명했다. 진선미 의원은 초과근무 수당 지급은 정책적 판단이 아니라 근로기준법 제56조에 규정된 사용자의 의무라며 법을 집행하는 경찰마저 법을 무시하는 현실이 우리나라 노동인권의 현주소라고 말했다
문재인-野중진 심야회동 '결렬'…재신임투표 강행	http://news.naver.com/main/read.nhn?mode=LSD&mid=shm&sid1=100&oid=003&aid=0006752304&cid=428288	박주연 기자  새정치민주연합 중진의원들이 문재인 대표와 11일 밤 심야회동을 갖고 재신임 문제를 국정감사 이후에 논의하자고 요청했지만 끝내 접점을 찾지 못했다. 이석현 국회부의장과 박병석 의원은 이날 밤 9시30분부터 11시30분까지 약 두 시간 가량 서울 프라자호텔에서 문재인 대표와 회동을 가졌지만 아무런 합의를 이루지 못했다.  중진의원들은 16일로 예정된 중앙위원회와 대표 재신임 투표를 국감 이후로 늦춰달라고 요청했고 문 대표는 재신임은 미룰 수 있지만 중앙위 소집은 예정대로 해야 한다고 한 발 물러섰다.  하지만 중진 의원들이 공천혁신안을 논의하는 중앙위를 연기해야 한다는 입장을 고수하면서 논의는 결렬됐다. 앞서 새정치연합의 3선 이상 중진의원 17명은 이날 오후 5시부터 약 두 시간에 걸쳐 국회 이석현 부의장실에서 회동을 갖고 문재인 대표 재신임 사태에 대한 해법을 고민했다.  5선의 문희상이석현정세균 의원 4선의 김성곤박병석원혜영신기남이종걸김영환신계륜 의원 3선의 오영식강창일주승용최규성김동철신학용이상민 의원이 이 자리에 참석했다.  모임에 참석한 박병석 의원은 중진들이 지금은 국민을 대변해 국감에 전념해야 할 때니까 당내 문제는 국감이 끝난 후 본격적으로 논의하는 것이 좋겠다는 뜻을 모았다고 설명했다
"저작권료 100억 달라" IPTV에 조정 신청	http://news.naver.com/main/read.nhn?mode=LSD&mid=shm&sid1=105&oid=214&aid=0000536596&cid=428288	가왕의 복귀를 알린 이 곡은 지난 2년 동안 각종 매체에 6000번 넘게 방송됐다죠.방송 출연 없이 노래만 나오더라도 저작인접권료라는 일종의 사용료를 받는데 그런데 IPTV업체들은 이 돈을 8년째 주지 않고 있습니다. 리포트 예능프로그램에 노래가 깔리면서 극적인 효과를 키웁니다.프로그램 중에 배경음악이나 효과음으로 노래를 쓰는 대가로 방송사는 가수나 연주자 음반제작자가 속한 협회와 매년 협상해 비용을 지불합니다. 등 지상파는 물론 케이블 TV와 라디오 홈쇼핑 채널도 마찬가지입니다.이들 방송사들이 지난해 지불한 금액은 58억 원정도 됩니다.하지만 인터넷 IPTV는 이런 비용을 지불하지 않고 있습니다.가수와 연주자 등에게는 사용료를 주지 않는 건 앞뒤가 맞지 않다는 주장이 나옵니다.김종환 가수피와 땀의 노고로 만들어진 결정체를 그냥 쓰고 이 사람들의 노고를 인정하지 않는 것 앞으로 음악 발전하는데 무진장 힘들 거라고IPTV측은 이미 사용료를 지급한 지상파 등의 프로그램을 틀었을 뿐이라고 맞섰습니다.IPTV 협회 관계자방송 제작자가 지급하고 있는 상황인데요. IPTV 사업자에게도 요구하는 것이 이중징수 등의 문제가 있고 성실하게 협의하고 있는 중입니다
