비정규직 덫…'임금 상향'이 관건	http://news.naver.com/main/read.nhn?mode=LSD&mid=shm&sid1=102&oid=056&aid=0010147516	멘트앞서 보셨듯이 이른바 장그래5포세대로 대변되는  미래세대의 좌절을 막기위해서는 노사정이 서로 힘을 합쳐  노동시장의 낡은 틀을 바꾸는 대타협을 끌어내야합니다. 협상시한은 이제 닷새 남았습니다. 더 이상 시간을 끌어서는 안됩니다. 실제로 날로 극심해지는 정규직과 비정규직 대기업과 중소기업간 양극화는 사회통합을 해치고 있습니다. KBS는 오늘부터 사흘 연속 노동시장 구조개혁 시리즈를 마련했습니다. 첫날은 덫에 빠진 비정규직 실태와 해법을 살펴보겠습니다. 먼저 최광호 기자가 보도합니다. 비정규직 6백만명 임금은 정규직의 37 리포트 대학 졸업 후 기업에서 행정보조 업무를 했던 20대 여성입니다. 비정규직으로 일하다가 계약이 만료돼 지금은 아르바이트를 전전하고 있습니다. 짧은 회사 생활동안 느꼈던 정규직과의 차별은 사회 초년병에게 큰 상처가 됐습니다.   인터뷰 이모 씨비정규직 퇴사  억울해서라도 정규직을 가든가 공무원하는게 훨씬 낫겠다는 생각이 들다가도 현실은 이런게 아니면 돈을 벌수가 없잖아요. 정규직과 비정규직의 격차는 갈수록 커져가고 있습니다.지난 2004년 62만원이었던 임금 차이는 10년만에 두 배 가까이 늘었습니다.특히 중소기업에 다니는 비정규직의 경우 대기업 정규직 대비  시간당 임금이 37에 불과합니다. 하지만 부당한 처우를 받고도 대응할 마땅한 수단이 없습니다. 인터뷰 오민규민주노총 미조직비정규전략본부  고용이 불안하기 때문에 나서면 혹시 해고되지 않을까.  이런 불안에 항상 시달리고 있습니다.OECD 국가 가운데 우리나라 비정규직의 정규직 전환율은 최하위 수준. 녹취 김모 씨대기업 비정규직  내가 기술력이나 좋아지고 이렇게 열심히 하면  뽑아주겠지 하는 그런 믿음을 가지고 했었는데 지금은 희망이 아예 없는거죠. 비정규직은 정규직으로 가는 디딤돌이 아니라 벗어날 수 없는 굴레가 된지 오래입니다.격차 해소는 공감 타협안 도출은 난항기자 멘트 노.정이  저임금 일자리라는 굴레를 쓴 비정규직에 집중하는 건 바로 이 굴레가 우리 경제의  발목도 잡고 있기 때문입니다. 비정규직 근로자들이 돈을 쓰지 않으니  내수가 살아나지 않고 기업입장에서는 근로자들이 자주 바뀌어서 숙련도도 낮아지고 있습니다. 비정규직의 절대적 수를 줄이고  비정규직과 정규직 간의 격차도 줄여나가자는 당위성에는 일단 노사정이 공감했습니다. 하지만 해법은 서로 다릅니다. 비정규직 고용불안을 해소를 위한 정부 방안은 이렇습니다. 현재 2년까지 제한된 계약 기간을 최대 4년까지 늘리고 이직 수당과 퇴직금도 주자는 겁니다. 이러면 기업들이 정규직을 자발적으로 늘릴 거라는 분석입니다. 노동계는 최대 4년으로 기간을 연장하는 것은 오히려 비정규직만 더 늘리는 것이다 차라리 늘 계속해야 하는 일들은 정규직화 해야 한다고 주장합니다. 재계는  상시 지속 업무라는 기준 자체가 고용 시장을 더욱 경직화하는 것이라며 반대하고 있습니다. 임금 격차를 어떻게 줄일것이냐  이 부분에 대해선 어떤 대안들이 제시되고 있을까요 노동계는  정규직이든 비정규직이든 법에 있는대로  동일 노동에는 동일 임금 원칙을 지켜야 한다고 강조합니다. 재계는 왜 비교 대상을 정규직으로  삼느냐고 반발하고 있고요. 중재에 나선 정부는 각종 복리후생 등 만이라도  모든 근로자에게 동일하게 적용하자는  안을 제시했습니다. 노동시장 구조개선 특위의 전문가들은  언제 해고될 지 불안해하지 않으면서 임금 격차도 해소하려면 임금을 주는 체계를 직무에 맞춰 바꾸는 것이 필수다라고 지적한 상탭니다. 평행선을 달리고 있는 비정규직 대책 타협점을 어디서 찾을 수 있을까요 유원중 기자가 살펴봤습니다.유연화가 아닌 임금 상향이 관건 리포트 상시적인 일자리지만  비정규직을 썼던 관행이 공공 부문에서부터 바뀌고 있습니다. 서울시는 청소와 시설 경비 분야에서 5천6백여 개 일자리를 정규직화했습니다. 인터뷰 이재관서울문화재단 시설반장정규직 전환  일용직 비슷하게 용역으로 있다가 직원이 돼서 대우도 남다르다고 생각되고 가족처럼. 하지만 민간기업은 변화에 뒤떨어져 있습니다. 기간제와 파견 등 비정규직 근로자가 차지하는 비중이 전체의 32. 비용절감을 이유로 대기업들까지 비정규직 고용의 유혹을 떨쳐내지 못하고 있습니다. 인터뷰 김유선노동사회연구소 선임연구위원  10대 재벌에서 일하는 비정규직이 42만 명으로 집계 되거든요. 사내하청은 현행법상 대부분 불법파견으로 분류가 될 수 있고요. 노사정 대타협을 이룬 네덜란드는 정규직의 시간제 일자리를 늘려 고용의 유연성과 안정성을 동시에 확보했습니다. 성공의 가장 큰 비결은 동일노동 동일임금 원칙. 여기에 촘촘한 사회복지망이 힘을 보탰습니다.인터뷰 김동원고려대 경영대학장  정규직과 비정규직에게 동일한 임금을 주도록하거나 선진국처럼 오히려 기간이 짧은 비정규직은 봉급을 더 많이 주도록하면 자연스럽게 비정규직이 늘어나지 않고 적정 수준으로 유지가 될 것으로 봅니다. 현재 본인만 할 수 있는 차별금지 시정요구권을 노조나 제3자도 행사할 수 있도록 법으로 허용해야 한다는 주장도 나오고 있습니다
포스코 본부장 압수수색…정동화 소환 임박	http://news.naver.com/main/read.nhn?mode=LSD&mid=shm&sid1=101&oid=056&aid=0010147506	멘트검찰이 포스코건설 현직 본부장의 자택을  압수수색했습니다.베트남 사업 현장의 임원을 지낸 최 모 본부장은 당시 비자금 조성과 전달 과정에 개입한 것으로 알려졌습니다.  남승우 기자의 단독 보도입니다. 리포트 검찰이 포스코건설 최 모 토목환경사업본부장의 자택을 어제 압수수색했습니다. 포스코건설 현직 임원을 겨냥한 첫 압수수색입니다. 최 본부장은 베트남 고속도로 사업 현장을 2009년부터 2년간  국내 본사에서 관리. 최 본부장이 당시 베트남에서 만들어진 비자금 100억 여원 조성에 깊숙이 관여했을 것으로 검찰은 보고 있습니다. 검찰은  100억 원 가운데 47억 원 가량이 하도급 업체 등을 거쳐 국내로 들어온 물증과 진술을  확보했습니다.검찰은 국내로 들어온 비자금이 누구에게 흘러갔는지 또 어디에 쓰였는지를 밝히는 데 주력하고 있습니다. 특히 이 돈의 일부가 포스코건설 김 모 전 부사장 등을 거쳐 당시 사장이었던 정동화 전 포스코 부회장에게까지 흘러갔을 가능성에 무게를 두고 있습니다. 검찰 관계자는 정 전 부회장의 비자금 상납 여부는 이번 수사에서 밝히고 싶은 부분이라며 더디지만 조금씩 앞으로 나가고 있다고 말했습니다. 정 전 부회장은 외부와의 접촉을 피하며 검찰 수사에 대한 대응을 고심중입니다.녹취 정동화전 포스코 부회장  아 예 제가 인터뷰 안 하겠습니다
쌍용차 굴뚝농성 이창근씨 구속영장 기각	http://news.naver.com/main/read.nhn?mode=LSD&mid=shm&sid1=102&oid=003&aid=0006428207	평택 이정하 기자  법원이 굴뚝농성 101일 만에 내려온 쌍용자동차 해고자 이창근씨에 대한 구속영장을 기각했다.  수원지법 평택지원은 26일 쌍용차 평택공장에서 굴뚝농성을 한 혐의폭력행위 등 처벌에 관한 법률 위반 업무방해 등로 평택경찰서가 신청한 구속영장을 기각했다고 밝혔다.  법원은 이씨와 함께 굴뚝농성을 벌여 같은 혐의로 구속영장이 신청됐던 김정욱씨와 마찬가지로 도주나 증거인멸의 우려가 없다며 이씨의 영장을 기각한 것으로 전해졌다.  이씨는 지난해 12월13일 쌍용차 평택공장 내부에 침입 60m 높이의 굴뚝에 올라가 101일간 농성하면서 쌍용차의 업무를 방해한 혐의를 받고 있다
서해 5도 전력 얼마나 늘었나? '방위력 대폭 강화'	http://news.naver.com/main/read.nhn?mode=LSD&mid=shm&sid1=100&oid=214&aid=0000478740	천안함은 서해 NLL에서 멀지 않은 백령도 근처에서 북한 잠수정의 공격을 받았습니다.이후 우리 군은 북한군의 잇단 도발에 대응해 최신 무기를 배치하고 감시 장비도 확대했습니다.신형 미사일과 다연장 로켓포를 배치해 포병 화력을 키웠고 기습 남침을 막을 공격 헬기도 배치했습니다.5년 동안 서해 5도 지역의 방위력은 얼마나 커졌는지 박영일 기자가 전해드립니다. 리포트 5년 전 오늘 경계 임무 중이던 천안함은 북한 잠수정의 어뢰 공격에 침몰했고 그해 가을 연평도는 북한군의 포격 도발로 화염에 휩싸였습니다.우리 군은 이듬해 서북도서방위사령부를 창설하고 서해 5도 지역 전력을 강화했습니다.산 뒤쪽이나 동굴 속 북한 해안포를 정밀 타격할 수 있는 스파이크 미사일이 백령도와 연평도에 배치됐습니다.사거리 40km의 K9 자주포대가 3배 이상 확대됐고 다연장로켓 구룡도 투입됐습니다.사거리 80km인 다연장로켓포 천무도 내년에 배치됩니다.하늘에선 코브라 공격헬기가 공기부양정을 이용한 북한의 기습에 대비하고 있습니다.신형 유도탄 고속함 17척이 서해 NLL을 지키고 구축함에는 잠수함 공격용 폭뢰가 설치됐습니다.하지만 북한의 잠수함은 여전히 위협적입니다.신인균 자주국방네트워크 대표북한의 잠수함이 기지에서 출발할 때부터 탐지할 수 있는 감시전력 이런 것들이 필요하다고
야간 촬영 가능 '아리랑 3A호' 발사 성공…과제는?	http://news.naver.com/main/read.nhn?mode=LSD&mid=shm&sid1=105&oid=056&aid=0010147514	멘트국내 기술로 개발한 다목적 실용위성 아리랑3A 호가 오늘 무사히 발사돼 지구 궤도진입에 성공했습니다. 국내 최초로 적외선센서를 단 위성까지 우주로 쏘아올리면서 우리나라는 이제  전천후 지구 관측망을 구축하게 됐습니다. 정연욱 이은정 기자가 의미와 과제를 차례로 보도합니다.국내 첫 야간 촬영 가능 아리랑3A 발사 성공리포트 오늘 오전 7시 8분. 드네프르 발사체가 아리랑 3A호를 싣고 우주로 올라갑니다. 발사 15분 뒤 지구상공 537 궤도에 진입한 발사체는 아리랑 3A호와 분리됩니다. 남극 트롤 지상국  노르웨이 스발바르 지상국과 연이어 교신에 성공한 3A호. 발사한지 5시간 57분이 지난 오늘 오후 1시 5분. 위성이 정상적으로 작동한다는 전파 신호를  대전 위성관제센터로 보냅니다. 아리랑 3A호가 궤도에 자리를 잡아 발사 성공을 확인한 순간입니다. 인터뷰 최해진항우연 위성정보활용센터장  태양전지판이라든지 안테나가 전개된 것을 확인을 다 했고요.위성이 자세를 잡기 위한 휠의 움직임들까지 확인을 다 한 상태입니다. 아리랑 3A호는 국내 위성 가운데 처음으로 고성능 적외선 센서와  고해상도의 광학카메라를 갖추고 있습니다.인터뷰 조광래항우연원장  한층 업그레이드 된 위성정보 영상을 확보할 수 있는 기술적 토대를 구축했다 아주 상당히 큰 의미가 있다고 말씀드리겠습니다. 아리랑 3A호는 앞으로 3달에서 6달 동안 시험 운영을 마지면 하루에 지구를 15바퀴 돌면서 관측 임무를 수행합니다. 전전후 관측망 완성 향후 과제는기자 멘트 이곳은 아리랑 3A호가 작동할 가상의 우주공간입니다. 지구 상공 528km 입니다. 중형 승용차 크기의 이 위성이 앞으로 4년간 지구상공을 돌며  지구를 관측하게 됩니다. 가장 핵심 부품은 앞쪽에 있는 적외선 센서입니다. 육각형 몸체 앞쪽에 달려있는데요. 이 센서가 제대로 작동하면  우리나라는 세계에서 적외선 위성을 가진 4번째 보유 국가가 됩니다. 지금 보이는 산불 영상처럼 야간에도 쉽게 영상을 획득할 수 있는 것이 아리랑 3A호의 특징입니다. 기존 위성이 촬영해 온 낮시간 영상 흐린 날의 영상을 합하면  24시간 365일 지구를 관측하는 위성망이 완성되는 겁니다. 하지만 아리랑 위성은 정말 돈이 되는 통신 위성과는 다른데요. 무궁화위성 같은 KT의 위성 6기는 수 천억 원씩을 들여  외국에서 사온 것입니다. 3만 6천킬로미터 상공의 통신위성을 우리 기술로 만들기는 아직 부족하기 때문이죠. 전세계 위성시장은 더욱 커져 앞으로 10년 동안 1000 기가 넘는 위성이 제작되고 시장규모도 10년동안  270조원에 달합니다
北, 한수원 해킹 북소행 반박…"추악한 음모"	http://news.naver.com/main/read.nhn?mode=LSD&mid=shm&sid1=100&oid=003&aid=0006428208	박대로 기자  북한이 26일 한국수력원자력 해킹사건 북한 소행설에 반박을 내놨다. 북한 인터네트중앙연구소는 이날 진상공개장에서 박근혜패당은 사이버공격을 단행한 원전반대그룹의 실체를 정확히 수사할 가망이 없게 되자 지금까지 추적한 IP주소가 중국 심양에 집중돼있었고 우리 공화국의 인터넷IP주소와도 접속한 흔적이 있었으며 공격에 이용한 문구가 북한식 표현이었다는 증거 아닌 증거를 가지고 북 소행이 분명하다는 잠정수사결과를 날조해 여론에 공개했다고 지적했다. 연구소는 박근혜패당은 이번 사건의 북 소행을 입증하는 핵심적 증거로 김수키 악성코드를 내들었다. 김수키는 원래 김숙향이었지만 발음이 와전돼 그 후에 김수키 악성코드로 공인됐다고 한다며 우리 공화국에서 김숙향이라는 이름을 표기할 때 향자를 Hyang으로 표기하지 Kyang컁이라고 표기하지 않는다고 반박했다. 연구소는 괴뢰당국이 북 소행으로 결론지은 핵심적인 근거는 악성코드의 IP주소가 중국 심양의 IP주소와 유사하다는 것이라며 우리가 알건대 괴뢰정부합동수사단이 심양의 IP주소를 이용한 가입자에 대한 신원확인을 중국사법당국에 요청했으나 확답을 받지 못했다고 한다고 지적했다. 연구소는 모략과 날조는 결코 진실을 이길 수 없는 법이라며 남조선 괴뢰들이 원전해킹사건의 북 소행을 입증하는 증거 아닌 증거들을 내놓을수록 추악한 음모꾼의 정체만을 더 드러내보이게 될 뿐이라고 꼬집었다. 연구소는 원전해킹의 북 소행설에는 우선 더는 수습할 수 없을 정도로 위기에 처해있는 저들의 통치기반을 유지하고 잔명을 부지해보려는 비열한 기도가 있다며 이 사건을 북 소행으로 내돌리는 경우 격노한 민심을 눅잦히고 집안 내부위기도 수습할 수 있다고 타산한 것이 박근혜패당인 것이라고 비판했다
헛도는 노후실손보험…노인 71% 가입 거부, 왜?	http://news.naver.com/main/read.nhn?mode=LSD&mid=shm&sid1=102&oid=056&aid=0010147522	멘트 정부는 지난해 노인들의 의료비 부담을 덜어 주기 위해 노후 실손 의료보험제도를 도입했는데요.까다로운 가입 조건 때문에 대부분의 노인이 가입하지 못한다고 합니다. 리포트 4년 전 디스크 수술을 받은 60대 할머니입니다. 병원 신세를 지게될까 걱정돼 실손보험을 알아봤습니다.녹취 디스크가 있으면 보장받기 어려우시죠. 그럼 못 들겠네요 힘들죠. 다른 보험사들도 가입을 거절했습니다.녹취 변영숙서울 종로구  속상하죠. 우리같은 없는 사람들이 저렴하게 보험을 들어서 어디 아프면 보탬도 되고. 정부는 지난해 실손보험 가입이 가능한 나이를 65세에서 75세로 늘렸습니다. 노인층 의료비 부담을  덜어주기 위해서입니다. 하지만 노인의 71가 가입을 거부당했습니다. 고혈압이나 당뇨는 물론 현재의 약물 복용 까지 문제삼았습니다.인터뷰 김종명정의당 건강정치위원장  사실 이걸 못하게 해야합니다. 외국에서는 보험사가 가입 거부를 못하게 법으로 금지하고 있습니다. 정부 조사결과 8개월 동안 실손보험의 문턱을 넘은 노인은 만 여 명에 불과했습니다. 이런 파행은 수익성을 먼저 따지는 보험사로서는 당연한 측면도 있습니다.녹취 금융위원회 관계자음성변조  판매초기에 보수적으로 접근하는 부분은 있는 것 같습니다. 정부가 가입을 조종하면 민간시장이 작동할 수 없는
