3월인데 제주에 여름같은 폭우…온실가스 탓	http://news.naver.com/main/read.nhn?mode=LSD&mid=shm&sid1=103&oid=055&aid=0000308320	오늘18일 서울엔 약한 비가 내렸지만 남해안과 제주도에는 여름 같은 폭우가 쏟아졌습니다. 최근 들어 이런 집중 호우가 잦아지고 있는데 온실가스의 영향이 크다는 분석입니다.기자제주에는 3월이지만 여름철 같은 폭우가 내렸습니다.오늘 하루 동안 한라산 중턱엔 200mm 성산포엔 150mm의 많은 비가 내렸습니다.2000년대는 1970년대에 비해 강수량이 19 늘었고 집중 호우도 잦아졌습니다.박정민기상청 예보관  30년 동안 관측자료를 분석해보면강수일수는 거의 변함이 없지만 강수량이 증가하고 있는 추세에 있어서 이는 비가 한번 내릴 때많은 양의 비가 집중되는 형태로 변해가고 있음을 알 수가 있습니다.한반도의 온실가스가 꾸준히 증가하면서 평균 기온이 높아진 것이 강수 형태를 바꾸는 데 큰 영향을 미쳤다는 분석입니다.7ppm이던 이산화탄소 농도는 지난해 404.특히 반도체나 타이어 제조 공정에서 발생하는 육불화황은 일 년 전보다 4.4나 늘어 온실가스 가운데 증가 폭이 가장 컸습니다.박록진서울대학교 지구환경과학부 교수  이게 한 번 대기 중으로배출이 되면 잔존 기간이 3200년 정도 됩니다. 기후변화의 주된 원인인 이산화탄소에 비해서 미래의 지구 온난화 영향이 거의 2만 배 이상 되는 아주 강력한 온실 기체입니다.중국 등 외부 영향도 있지만 우리나라 자체에서 발생하는 온실가스 영향이 큰 만큼 효과적인 감축 방안이 필요하다는 지적입니다
3대 경제 현안 후속 논의에 탄력… 합의 도출까진 '가시밭'	http://news.naver.com/main/read.nhn?mode=LSD&mid=shm&sid1=100&oid=469&aid=0000052966	최저임금 인상  여 노동자 급여 50 법제화는 반대서비스산업발전기본법  야 3자 회동 발표문이 협상의 바탕공무원 연금 개혁  여야정노 4자 접점 도출은 미지수박근혜 대통령이 18일 청와대에서 이병호박 대통령 오른쪽 국가정보원장에게 임명장을 수여한 뒤 환담장으로 이동하고 있다.kr  박근혜 대통령과 여야 대표간 3자 회동에서 경제정책 현안에 대한 집중적인 논의가 진행되면서 이들 현안과 관련한 정치권의 후속 논의에 관심이 집중되고 있다. 특히 공동발표문에서 언급된 최저임금 인상과 공무원연금 개혁 서비스산업발전기본법 제정안 등 3대 현안은 내년 총선을 앞두고 여야 모두 어떤 식으로든 나름의 성과를 내야 할 필요성이 크다는 점에서 향후 논의가 주목된다.   최저임금 인상 너머 법제화 필요  최저임금 인상 필요성과 관련해선 여야간에 이견이 없다. 물론 최저임금은 노사가 참여하는 최저임금위원회에서 결정하는 만큼 정치권이 직접 개입할 여지가 크지는 않지만 그간 소극적이었던 여권도 소비가 살아나야 경기가 살아난다는 판단에 따라 적극적인 자세를 보이고 있다.   여야간 이견 지점은 야권이 추진하고 있는 생활임금제 법제화 부분이다. 일부 지방자치단체에서 최저임금보다 다소 높은 수준의 생활임금을 최저임금의 기준으로 삼고 있는데 야권은 입법을 통해 이를 모든 지자체로 확대하자는 입장이다. 새정치연합은 특히 최저임금 산출 기준의 법제화도 추진하고 있다. 최저임금을 물가상승률을 고려해 전체노동자 평균 정액급여의 50 이상으로 하는 문재인법이 대표적이다.   새누리당은 그간 최저임금 법제화에는 반대하면서도 생활임금제 확대에 대해선 다소 유연한 입장이었다. 하지만 박 대통령이 3자 회동에서 공개적으로 생활임금제에 대한 반대 입장을 밝히면서 제동이 걸리는 모양새다. 박 대통령의 발언이 나온 뒤 새누리당에선 임금은 민간이 자율적으로 결정할 문제라는 얘기가 쏟아졌다.  다만 유승민 원내대표를 비롯한 새누리당 핵심인사들 가운데 최저임금이나 생활임금을 일반적인 임금과는 다른 차원에서 접근해야 한다는 시각이 많아 여야가 접점을 찾을 가능성은 열려 있다.  서비스산업발전기본법 향후 정국 운영 지렛대  서비스산업발전기본법의 국회 처리는 여권의 숙원 중 하나다. 김무성 새누리당 대표가 의료민영화 시도라는 야당의 우려를 수용해 보건의료 부문을 제외하자고 양보안을 내놓으면서 4월 임시국회 처리 가능성이 높아졌다는 전망이 많다.   하지만 유 원내대표가 3자 회동에서의 합의에 난색을 표하면서 투 톱간 이견이 불거진 상태다. 유 원내대표는 18일 국회에서 기자들과 만나 우리는 당초 입장대로 보건의료를 포함해서 통과시키는 것으로 일단 노력할 것이라고 말했다. 유 원내대표는 문 대표가 오케이수용 했는지도 불분명하고 대통령이 뭐라고 말했는지도 불분명하다고 덧붙였다.   새누리당 내에선 유 원내대표의 이 같은 발언이 본격적인 협상 과정에서의 주도권을 의식한 포석이라는 해석이 많다. 김 대표도 3자 회동에서는 원론적인 이야기만 한 것이고 원내대표들 간의 논의가 우선이라며 유 원내대표에 힘을 실었다.   새정치연합은 서두를 게 없다는 입장이다. 한 핵심당직자는 박 대통령과 김 대표가 함께 뜻을 모은 3자 회동 공동발표문 내용이 향후 협상의 기본 바탕이라고 못박았다. 서비스산업기본법 처리를 향후 원내 협상의 지렛대로 쓰겠다는 뜻으로 풀이된다. 공무원연금 개혁 5월 2일 시한까지 격론 예고  공무원연금 개혁은 3자 회동에서 5월 2일을 처리시한으로 한다는 데 일정 부분 공감대를 형성한 만큼 논의에 탄력이 붙을 전망이다. 당장은 공무원연금개혁 국민대타협기구가 개혁안을 내놓기로 한 28일이 1차 분수령이다.   대타협위에선 논의에 속도가 붙으면서 소득재분배 문제 등이 최대 쟁점으로 부각된 상태다. 새누리당은 강력한 소득재분배 방식을 적용해 공무원 직급간 연금 격차를 줄이는 방식을 주장하는 반면 공무원노조 측은 소득비례연금 방식이 유지돼야 한다는 입장이다.  이런 가운데 새정치연합은 소득재분배 방식이 가미된 구조개혁 방안을 제시할 것으로 알려졌다. 여권 내부에서 정부 측 개혁안의 별도 제출 여부를 두고 혼선이 빚어졌지만 여야 모두에서 여야정노 4자 사이에 접점이 도출될 가능성이 이전보다 커졌다는 얘기가 나오고 있다
중·고 모두 '학년마다 다른 수능'…교육현장 혼란	http://news.naver.com/main/read.nhn?mode=LSD&mid=shm&sid1=102&oid=448&aid=0000092465	앵커지금 대한민국 교육 현장에서는 믿기 힘든 일이 일어나고 있습니다. 앞으로 해마다 입시제도가 바뀌면서 중학교 1학년부터 고등학교 3학년까지 6년동안 매년 다른 수능을 보게 되는것입니다
인터넷 쇼핑·뱅킹 때 공인인증서 사용의무 폐지	http://news.naver.com/main/read.nhn?mode=LSD&mid=shm&sid1=101&oid=001&aid=0007472381&cid=428288	인터넷쇼핑이나 인터넷뱅킹 등 전자금융 거래 때 공인인증서 사용의무가 사라진다. 또 옐로페이 페이팔 등 직불전자지급 수단의 1일 이용한도가 현행 30만원에서 200만원으로 높아져 모바일을 활용한 쇼핑결제가 한층 더 늘어날 전망이다. 금융위원회는 18일 정례회의를 열어 이런 내용을 골자로 한 전자금융감독규정 개정안을 의결하고 즉시 시행하기로 했다. 전자직불 쇼핑 1일 한도 30만200만원으로 확대     유경수 기자  인터넷쇼핑이나 인터넷뱅킹 등 전자금융 거래 때 공인인증서 사용의무가 사라진다.    또 옐로페이 페이팔 등 직불전자지급 수단의 1일 이용한도가 현행 30만원에서 200만원으로 높아져 모바일을 활용한 쇼핑결제가 한층 더 늘어날 전망이다.    금융위원회는 18일 정례회의를 열어 이런 내용을 골자로 한 전자금융감독규정 개정안을 의결하고 즉시 시행하기로 했다.    금융위는 이번 규정 개정으로 기술중립성 구현 전자지급수단 활용성 증대를 유도하고 다양한 판테크 서비스의 출현활용 기반을 확대할 수 있게 됐다고 설명했다.    개정안은 전자금융거래시 공인인증서 또는 이와 동등한 수준의 안전성이 인정되는 인증방법을 사용할 의무를 폐지했다.    이에 따라 금융사와 기업들은 다양한 전자금융거래 인증수단을 선택해 활용할 수 있게 됐다.     개정안은 정보보호시스템에 사용하는 정보보호제품을 국가기관의 평가인증을 받은 제품으로 한정하던 의무도 없애 금융사가 자율적 판단에 따라 다양한 정보보호 제품과 솔루션을 쓸수 있도록 했다.    비대면 직불수단 이용한도는 현행 30만원에서 200만원으로 상향 조정된다.     개정안은 이와 함께 금융결제원과 코스콤의 정보공유분석센터 기능 등이 금융보안원으로 이관됨에 따라 침해사고대응기관을 금융보안원으로 변경했다
 불법총기 4200정 방치… 용도외 사용 많다	http://news.naver.com/main/read.nhn?mode=LSD&mid=shm&sid1=102&oid=022&aid=0002799532	수렵용 총 사격장서 발포 등 총단법 위반건 중 90 차지범죄 악용될 위험 높은데도 과태료 13만원 부과에 그쳐최근 들어 총기 사건이 잇따르는 가운데 전국적으로 4200여정의 불법총기가 방치돼 있는 것으로 확인됐다.총기를 수렵 등 본래 목적에 사용하지 않아 적발된 건수는 190여건에 이르지만 과태료 부과금이 10여만원에 그쳐 실효성이 떨어진다는 지적이다.18일 경찰청이 새누리당 이철우 의원에게 제출한 2014년 허가취소 총기 및 미수거 현황에 따르면 소유자가 금고 이상의 형사상 처벌을 받거나 분실미점검 사유로 인해 총기소지 허가가 취소됐음에도 아직 회수하지 못한 총기는 4272정에 달했다.지역별로는 울산이 1626정으로 가장 많았고 경기도822정 대구338정 서울322정 대전170정 등의 순이었다.원인별로는 도난분실됐다고 신고한 총기가 3813정으로 가장 많았고 경찰의 정기점검에 응하지 않거나 총기 소유자 사망 이후 허가를 갱신하지 않은 총기도 360정에 달했다. 금고 이상의 처벌을 받은 소유자에게서 회수받지 못한 총기 등 기타 사유는 99정이었다.총포를 신고된 용도대로 사용하지 않아 과태료를 부과받은 건수는 190건이었다. 이는 전체 총포도검화약류 등 단속법총단법 위반 과태료 부과 건수214건의 90. 이어 소지자 준수사항 위반 20건 화약 신고관리 위반 4건 순이었다.총단법 제17조는 총포도검분사기전자충격기석궁의 소지허가를 받은 사람은 허가받은 용도나 그 밖의 정당한 사유가 있는 경우 외에는 그 총포도검분사기전자충격기석궁을 사용하여서는 안 된다고 규정해 허가받은 용도 외 사용을 엄격하게 제한하고 있다. 이 규정을 위반한 경우에는 300만원 이하의 과태료 처분을 받게 된다. 하지만 지난해 이 규정 위반자에게 부과한 과태료 총액은 2504만원으로 적발건수당 13만원에 불과했다.지난 2월 25일 세종특별자치시 조치원읍 번암리 세종경찰서에서 이자하 서장이 엽총살인 사건 수사상황을 브리핑하고 있다. 세계일보 자료사진잇따른 총기 사건은 방치된 불법총기와 미미한 과태료 제재 등이 복합적으로 작용한 결과다. 지난달 25일 발생한 세종시 편의점 총기난사 사건이나 같은 달 27일 발생한 경기도 화성시 총기난사 사건에서도 수렵용으로 허가받은 총기를 범죄에 악용한 경우다. 유해조수 수렵용 총기로 소지허가를 받은 후 일반 사격장에서 연습용으로 사용하는 사례도 있다
MS, 익스플로러 퇴출…인터넷 한 시대 저문다	http://news.naver.com/main/read.nhn?mode=LSD&mid=shm&sid1=105&oid=469&aid=0000052972	윈도 10에는 스파르탄 탑재키로인터넷 접속용 소프트웨어의 대명사로 통하던 마이크로소프트MS의 웹브라우저 인터넷 익스플로러IE가 역사 속으로 사라진다. 스마트폰 등 모바일기기 시대를 맞아 컴퓨터PC를 이용한 인터넷 접속이 줄어들면서 20년 만에 퇴출을 당하게 됐다. 18일 외신에 따르면 MS는 올 가을 출시 예정인 새로운 운영체체OS 윈도10에 IE 대신 다른 웹브라우저를 탑재하기로 했다. 스파르탄 프로젝트라는 이름으로 개발 중인 새로운 웹브라우저는 스마트폰태블릿PC 등 모바일 기기에 적합하도록 제작된다. 이에 따라 더 이상 윈도에서 IE를 볼 수 없을 전망이다. 대신 MS는 당분간 새 웹브라우저에 익스플로러 표시를 병기해 IE를 대신하는 새로운 웹브라우저를 알릴 예정이다. IE는 1990년대 윈도가 설치된 PC에 기본 탑재되며 널리 확산됐다. 그 바람에 먼저 나온 웹브라우저 넷스케이프를 밀어 내고 전세계 웹브라우저의 절대 강자로 군림했다. 2000년대에 들어서며 이용자가 10억 명에 이르고 전체 웹브라우저 시장에서 점유율이 95까지 올라 사실상 독점 체제를 굳혔다. 그러나 스마트폰이 등장하며 이용자들이 모바일기기로 인터넷 접속을 하면서 여기 발빠르게 대응하지 못해 위기를 맞게 됐다. 미국 정보기술IT 전문지 컴퓨터월드 집계에 따르면 IE는 웹브라우저 시장에서 여전히 점유율 47로 1위를 달리고 있지만 모바일 부문 점유율은 구글 크롬과 애플 사파리 등에 밀려 2
해군 중장, 부대 골프장 캐디에 상습 성희롱	http://news.naver.com/main/read.nhn?mode=LSD&mid=shm&sid1=100&oid=469&aid=0000053005	버디하면 섹시춤 춰라 모욕감 줘 해군은 조치 없이 넘겨 은폐 의혹  현역 해군 중장이 군부대 골프장에서 캐디에게 상습적으로 성희롱을 하다 군 감찰에 적발된 것으로 18일 전해졌다. 해군 수뇌부는 이 같은 사실을 확인하고도 국방부 보고와 후속 조치를 취하지 않아 은폐 의혹까지 일고 있다. 국방부와 해군 관계자에 따르면 해군 A중장은 지난해부터 수개월 간 부대 체력 단련장에서 골프를 치면서 본인이나 일행이 버디를 할 때마다 동행한 캐디에게 노래를 불러라섹시하게 춤을 춰라엉덩이를 흔들어라등의 불합리한 요구를 해왔다. 캐디들은 모욕감을 느끼면서도 고위 장성의 요구를 거부하지 못했을 뿐 아니라 정식으로 문제를 제기하지도 못했다고 한다. 이 같은 사실은 캐디들의 하소연을 전해 들은 관리소장이 관할 부대장에게 보고하면서 알려졌다. 해군본부는 이에 따라 이달 초 특별감찰에 착수 A중장의 언행에 심각한 문제가 있다는 점을 확인했지만 아무런 조치 없이 넘어간 것으로 전해졌다. 또한 현역 고위장성이 연루된 비위사항인데도 상부기관인 국방부에 보고하지 않았다. 이 같은 해군의 대응을 둘러싸고 국방부 지침 위반 논란도 일고 있다. 앞서 국방부는 올해 들어 군 장교들이 연관된 성 군기 위반사건이 잇따르자 11일 성폭력 방지 종합대책을 마련했다. 종합 대책에 따르면 지휘계통에 있는 관련자가 성범죄를 묵인방조할 경우 가중처벌토록 하고 있다. 이에 대해 국방부 관계자는 해군이 제 식구를 감싸느라 A중장의 성 군기 위반을 쉬쉬하며 외부로 발설하는 것을 막고 있다며 국방부 차원의 조사가 필요하다고 말했다. 하지만 해군 관계자는 확인되지 않는 사안이라 뭐라 말할 수 없다고 답했다
