내년부터 수입차 보험료 인상…왠지 억울한 소비자	http://news.naver.com/main/read.nhn?mode=LSD&mid=shm&sid1=101&oid=437&aid=0000095788&cid=428288	정부가 수리비가 많이 드는 차량에 대한 보험료를 올리기로 했는데요. 주로 수입차를 소유한 분들의 보험료가 오르게 됩니다. 비싼 차니까 당연하다고 생각할 수도 있지만 수입차 업체의 부실한 서비스로 공임과 부품값이 비싸다는 문제는 놔두고 소비자 부담만 키우는 것 아니냐는 비판도 나옵니다.기자지난해 수입차를 구입한 35살 박진홍 씨는 보험료로 140만 원을 냈습니다.그런데 내년에는 15가 올라 20여만 원을 더 내야 합니다.어떻게 된 일일까지난해 등록 수입차는 112만 대로 전체 5.5를 차지했지만 수리에 들어간 비용은 전체 자동차 수리비의 21나 차지하면서 처음으로 1조 원을 넘겼습니다.국산차보다 수입차 평균 수리비가 3배 정도 비싸다 보니 생긴 현상입니다.손해보험사들은 지난해 자동차보험에서 5000억 원의 손실을 봤고 수입차가 이 손실의 주범으로 꼽힙니다.그러자 정부가 수리비가 비싼 차들에 대해 내년부터 보험료를 올리기로 한 겁니다.수입차 소유자들은 불만이 적지 않습니다. 박진홍사업  수리내역 같은 건 불투명한데 그런 규제는 강화되지 않으면서 왜 보험료만 인상해서 보험사 배만 불리는지 많은 불만이 있습니다.전문가들은 보험료만 인상할 게 아니라 비싼 수리비와 부품값으로 수익을 올리는 일부 수입차의 영업행태도 바뀌어야 한다고 지적합니다.정원석 JTBC 뉴스 공식 SNS 트위터 페이스북 카카오스토리 유튜브 JTBC 뉴스는 여러분의 생생한 제보를 기다립니다
"방 얻으려 200만원 빌린 게 1000만원…" 청년은 출발부터..	http://news.naver.com/main/read.nhn?mode=LSD&mid=shm&sid1=101&oid=032&aid=0002644895	사회초년생 한민규씨 이야기흔들바위 아세요 커다란 돌덩이를 가슴 안에 올려두고 사는 기분이에요. 돈에 쫓기다 보니까 하루에도 몇 번씩 흔들바위가 내려앉는 것 같아요. 제가 옛날에는 밝고 잘 웃었어요. 지금은 웃지를 못해요 자꾸 초췌해지고.지난 16일 서울 신림동의 한 카페에서 만난 한민규씨가명23의 겉모습은 다른 젊은이들과 다를 바 없어 보였다. 하지만 그는 게임 캐릭터 머리 위에 화살표가 떠 있잖아요. 제 머리 위에도 대출 1000만원이라는 말풍선이 떠 있는 것 같아요. 빚 없는 사람들과 저를 구별하는 다 갚기 전엔 절대 행복할 수 없을 거라는이라고 했다.지방의 한 공업고등학교를 졸업하고 조선소에서 일하던 한씨는 코미디작가가 되고 싶어 그때까지 모은 300만원을 들고 지난해 9월 상경했다. SNL케이블방송의 코미디 프로그램의 유병재 같은 작가가 되고 싶었지만 몇몇 방송사 공채에서 낙방하자 생계가 막막해졌다. 고졸인 한씨가 구할 수 있는 일은 거의 없었다. 치킨집에서 아르바이트를 하다 한 카드사에 영업사원으로 입사했다. 한씨는 영업엔 소질이 없어서 실적이 거의 없었어요. 처음 대출을 받게 된 것도 그때부터였어요라고 말했다.150만200만원 월급은 서울에 의지할 곳 없는 한씨가 살림을 꾸리기에 턱없이 부족했다. 4평짜리 원룸 보증금 500만원을 만들려고 올해 초 한 대부업체에서 2년 상환조건으로 200만원을 빌렸다. 이자가 비싸 봐야 얼마나 되겠나 일해서 갚으면 되겠지라고 생각한 것이 잘못이었다. TV에 광고도 자주 나오니까 다들 받는구나라고 쉽게 생각했다. 대부업체 가상계좌가 적힌 문자메시지를 처음 받고서야 한씨는 나도 빚쟁이가 됐구나하고 실감했다. 납부해야 할 금액은 이자와 원금을 합쳐 30여만원. 한 달치 월세에 맞먹는 금액이었다. 아무리 아껴 써도 납부일을 꼬박꼬박 지키려다 보면 통장은 마이너스가 됐다. 연체는 생각도 할 수 없었다. 납부일만 되면 대부업체에서 전화와 문자가 몇 통씩 왔다. 고객 앞에서 전화를 받은 적도 있다. 하루에 적게는 23번 조금만 이체가 늦을 기미가 보이면 최대 8번까지 연달아 독촉 문자가 날아왔다. 휴대폰 울리는 소리를 들을 때마다 심장이 내려앉았다.적성에 맞지 않는 영업을 그만두고 콜센터 아웃소싱업체에 취직했다. 카드사나 저축은행에 용역으로 고용돼 고객들에게 대출을 권하는 일이었다. 하루에도 수백통씩 전화를 걸었다. 회원님 XX카드 보유하고 계신데 실적이 좋으셔서요 저희가 낮은 금리로 제공해드리는 금융상품이 있는데 상냥한 말투로 고객한테 돈 빌리라고 권했다. 정작 빚 때문에 죽을 것 같은 사람은 난데 고객한테 빚을 지게 해야 제가 사는 거죠. 주말에는 회사가 쉬었기 때문에 급여는 영업사원 때보다도 적었다. 적은 급여로는 생활비와 월세를 대기도 빠듯했다. 이자와 원금을 제때 내려고 대출받고 불어난 이자를 감당하려고 또 대부업체를 찾았다. 연체보다 신용등급 떨어지는 게 더 무서웠다. 카드사에서 일하는 한씨는 연체 기록이 쌓여 신용불량자가 된다는 게 어떤 의미인지 누구보다 잘 알았다. 이미 대부업체에서 돈을 빌린 것만으로 신용등급이 두 단계 떨어진 상태였다.8개월 동안 3곳의 대부업체에서 총 1000만원을 빌렸다. 이곳저곳에서의 독촉 연락에 시달리다 대출금을 한군데로 묶기 위해 대출 알선업체를 찾았다. 한씨는 한꺼번에 1000만원을 빌리려면 정상적인 방법으로는 도저히 안돼요. 그런데 알선업체가 대출에 필요한 서류를 가짜로 꾸며줄 테니 달라는 수수료가 따져보니까 대출금의 절반이 넘더라고요라고 말했다. 어이가 없어서 코웃음이 나왔는데 생각해 보면 제가 얼마나 막장에 몰렸으면 그런 곳까지 찾았겠어요라고 했다. 지난 9월 한씨는 이자만 2년 동안 납부하는 조건으로 모 저축은행에서 1000만원을 대출받아 흩어진 대출금을 하나로 묶었다. 한 달에 30만원씩 2년간 총 720만원의 이자를 내야 한다.20대 초반의 청년에게 1000만원의 빚은 무겁기만 하다. 남들이 보기엔 작은 금액일지도 모르지만 저한테는 건물 한 채나 다름없는 정말 큰 금액이에요. 돈 아끼려고 퇴근길에는 걸어서 집에 오곤 하는데 한강 건널 때마다 뛰어내릴까 고민한 적이 한두 번이 아니에요. 한씨는 이튿날 공장 생산직 면접을 앞두고 있다고 했다. 그는 이 회사만 합격하면 정말 개같이 벌어서 내년 생일 때까지는 빚 갚을 돈을 모을 거예요라고 말했다.규모는 작아도 부채 느는 정도 청년층 가장 심각대학 입학과 동시에 청년들은 학자금 대출이라는 빚을 떠안는다. 전국 4년제 대학들의 올해 평균 등록금 636만원. 학교를 마치기까지 학비로만 최소 2500만원가량이 필요하다. 여기에 생활비 주거비까지 합쳐 수천만원의 빚을 떠안고 시작하는 경우가 적지 않다. 최근 중소기업에 취직해 학자금을 상환하고 있는 김지해씨가명28여는 급여가 많지도 않은데 학자금 대출이 공제되니 집은 더 좁은 곳으로 밥도 더 저렴한 것으로 생활할 수밖에 없다며 빚이 있다는 건 어깨에 무거운 짐을 진 상태로 내려놓지 못하는 것이라고 했다. 김하용씨가명27는 2013년 돈을 벌기 위해 지인의 소개로 다단계 업체에 들어갔다. 다단계 업체는 건강식품이나 알뜰폰을 팔면서 지인을 데려오도록 하고 성과가 낮으면 대출을 받게 했다. 대출을 쉽게 하는 알선업체를 통해 대출 심사 시나리오를 받았다. 대부업체에서 전화로 대출심사를 하면 대본 읽듯이 줄줄 읽고 대출을 받는 식이다. 네 군데에서 총 1200만원을 빌렸다. 연이율이 3536나 되는 고금리였다. 200만원가량의 한 달 급여 중 절반 이상이 이자로 빠져나갔다. 김씨는 대출을 받고 나서 공황상태에 빠졌다며 빚은 있고 돈 값을 능력은 안되고 걱정만 쌓여서 잠도 설쳤다고 했다. 다단계를 그만둔 김씨는 아직까지도 아르바이트를 하면서 빚을 갚고 있다. 김덕영 청춘희년운동본부 사무처장은 지금 청년들은 다른 시대에 비해서 받는 구조적 압력이 크고 그것이 부채문제로 드러나고 있다며 빚의 규모로만 따지면 다른 세대보다 적지만 부채가 늘어나는 정도는 청년층이 가장 심각하다고 말했다.com 모바일 경향 경향 뉴스진  경향신문 앱  모바일웹  공식 SNS 계정 경향 트위터 페이스북 세상과 경향의 소통 커뮤니티  경향신문www
쌀쌀한 월요일 출근길…낮에는 20도 안팎	http://news.naver.com/main/read.nhn?mode=LSD&mid=shm&sid1=103&oid=422&aid=0000145074&cid=428288	날씨 쌀쌀한 월요일 출근길낮에는 20도 안팎곳곳에서 단풍이 절정이었는데 때마침 날씨도 좋았습니다.월요일인 내일 출근길은 제법 서늘하지만 낮에는 선선한 바람도 불어오며 쾌적하겠습니다. 낮기온 대부분 20도 안팎으로 보이겠고요. 공기는 평소보다 더 깨끗해서 먼지 걱정 안하셔도 되겠습니다. 다만 이번 주는 갈수록 차가워질 가을 날씨에 대비를 하셔야겠는데요. 화요일 전국에 가을비가 내리고 나면 기온이 크게 떨어지겠습니다. 수요일부터는 아침기온이 한자릿수로 떨어져 주후반에는 5도안팎까지 내려가겠고요. 기온변화가 커서 감기 걸리지 않도록 조심하셔야겠습니다.  내일은 가끔 구름 많다가 오후 늦게 서쪽지방부터 흐려지겠고요.밤늦게는 경기북부지역에 비가 시작돼 모레는 전국으로 확대되겠습니다. 아침기온은 서울 12도 전주 11도로 오늘과 비슷하겠고요. 낮기온은 서울 19도 전주 21도로 오늘보다 약간 낮겠습니다. 바다물결은 풍랑특보가 내려져 있는 남해와 동해상으로 내일도 높은 물결이 일겠습니다. 다가오는 화요일은 전국에 목요일은 중북부지방에 비가 내리겠고요
생수 한 병도 카드 결제…수수료 부담 '고민'	http://news.naver.com/main/read.nhn?mode=LSD&mid=shm&sid1=101&oid=055&aid=0000341145&cid=428288	최근 카드 수수료율을 재조정하기 위한 작업이 진행되고 있는데특히 영세 중소상인들이 큰 관심을 갖고 있습니다. 껌 한 통 살 때도 카드로 살 만큼 카드로 소액결제하는 사람이 늘면서 수수료 부담이 날로 커지고 있기 때문입니다.기자슈퍼마켓을 운영하는 한 모 씨는 손님들이 물건값을 계산할 때마다 예민해진다고 합니다.한 모 씨슈퍼마켓 운영  예전에는 1만 원 이상 보통 카드를 많이 사용하셨는데 이제는 소액 결제 작은 금액도 카드를 쓰니까요.1300원 짜리 생수 한 병 3200원 받는 음료수 두 병 4500원짜리 담배 한 갑을 팔아도 꼬박꼬박 카드 수수료를 내야 합니다.1천 원 1500원짜리 메뉴가 대부분인 대학가 주스 가게에서는 학생 손님 80가 카드를 냅니다.1천 원 미만 제품이 많은 편의점이나 빵집에서도 카드 내미는 손님들이 상당수입니다.김효석대학생 현금 찾기 귀찮고 하니까 그냥 다 카드 써요. 현금은 아예 안 들고 다니시고요 네.자영업자가 부담하는 수수료는 얼마나 될까요한 슈퍼마켓에서 카드로 결제된 매출액과 카드사에서 입금된 금액을 살펴봤습니다.차액이 매달 20만 원 올 들어 지난달까지 180만 원가량이 수수료로 나간 셈입니다.김 모 씨자영업자  카드 수수료가 1달에 기본 5060만 원 나가는데 동전이 싫다는 이유로 오백 원짜리 껌 하나 사가도 카드를 긁어줘야 해서 그래서 정말 그거는 불만이에요.연 매출 2억 원 이하인 영세 가맹점과 2억 원3억 원 이하인 중소 가맹점은 신용카드의 경우 각각 매출액의 1.카드 사용이 대세가 돼 소비자더러 카드를 쓰지 말라고 할 수 없는 지금 상인들은 이번 재산정 작업을 통해 수수료율이 인하될지 촉각을 곤두세우고 있습니다
'언어호봉제' 안지켰다며 때리고 욕하고..	http://news.naver.com/main/read.nhn?mode=LSD&mid=shm&sid1=100&oid=081&aid=0002623818&cid=428288	서울신문언어 호봉제를 제대로 구사하지 않고 말을 얼버무려 때렸습니다.지난 6월 28일 김포 해병 제2사단 공병대대 소속 지뢰탐지병 신모20 일병은 선임병들의 폭행 등 가혹행위를 견딜 수 없어 생활관 3층 창문에서 뛰어내렸다. 방모22 일병 등 가해자들이 밝힌 가혹행위의 이유는 신 일병이 언어 호봉제를 지키지 않아 말이 어눌했다는 것. 언어 호봉제는 후임병이 대화할 때 그렇습니다 알겠습니다 똑바로 하겠습니다 를 알고 싶습니다 알아보겠습니다 등 5가지 말만 해야 한다는 해병대의 악습이다. 군에 입대한 지 1년도 안 된 20살 안팎의 젊은이들은 후임병에게 악습을 가르치겠다며 폭행과 가혹행위를 일삼아 온 것이다.지난 5월 22일 해병대 2사단에 배치된 신 일병은 군가를 부를 때 박자를 실수했다 말끝을 흐렸다 평소 뛰어다니지 않고 행동이 느리다 눈치가 없고 소리가 작다 선임병이 깨웠는데 일어나지 않았다 등의 이유로 방 일병 등 선임에게 수차례 맞았다. 특히 박모20 일병은 신 일병이 평소 예의가 없다는 소문을 듣고 샤워장까지 찾아아 샤워 중인 신 일병의 뺨을 때리기도 했다. 이들에게 병영 내 폭행과 가혹행위는 소위 군대생활 잘하는 법을 가르쳐 주기 위한 수단이었다. 투신자살을 시도한 신 일병은 왼쪽 다리를 크게 다쳤고 정신적 후유증을 앓고 있는 가운데 결국 사단 본부로 전출됐다. 국가인권위원회가 신 일병에 대한 가혹 행위 문제를 제기하지 않았으면 이 문제는 영원히 묻힐 뻔했다.이는 군 당국이 지난해 8월 육군 28사단 윤모 일병 폭행 사망 사건을 계기로 병영문화를 대대적으로 혁신하겠다고 공언했지만 이 약속이 1년도 안 돼 공염불에 그쳤음을 의미한다.25일 국가인권위원회에 따르면 2012년부터 올해 7월까지 군 관련 인권침해 진정 사건 접수 건수는 586건으로 나타났다. 매년 140180명이 군 당국이 스스로 해결하지 못하는 인권침해 문제를 외부에 호소한 셈이다.새정치민주연합 임내현 의원실에 따르면 지난해 육군의 경우 병사들의 가혹행위는 73건으로 2013년의 41건보다 늘었다. 폭행사건은 2013년 554건에서 지난해 936건으로 폭언 사건은 27건에서 56건으로 각각 늘었다.하지만 군 당국은 이 같은 병영 사고의 문제를 현역병 입대율이 90 가까이 높아지면서 군에 들어와서는 안 되는 부실자원들이 문제를 일으킨다며 개인의 문제로 의미를 축소하려 한다는 지적이 제기된다. 군의 한 관계자는 돈 없고 빽 없는 사람들만 입대해 현역병 입대율이 낮았던 과거에는 그럼 가혹행위가 적었단 말인가라고 반문했다.전문가들은 병영 내에서 근절되지 않는 폭행과 가혹행위가 병영문화 지체현상과 인권 문제에 대한 군 수뇌부의 소극적인 대응 때문이라고 진단했다. 기본적으로 군의 인권 의식이 21세기의 흐름을 따라가지 못하고 20세기에 머물러 있다는 뜻이다. 국방부 조사본부장을 지냈던 윤종성 성신여대 교양교육대학 교수는 일제의 잔재라고도 볼 수 있는 맞아도 싸다. 맞아야지 정신 차린다는 식의 사고가 아직 군 문화에 남아 있다는 증거라고 지적했다. 최병욱 상명대 군사학과 교수는 상명하복이 절대적 가치였던 강압적인 옛날 모델이 군대에는 아직도 남아 있는 것이라며 병영문화 지체현상을 극복하기 위해 군 지휘관들이 보편적 인권이라는 시대 변화를 적극 수용할 필요가 있다고 말했다.국회 군 인권개선 및 병영문화혁신 특별위원회 소속인 새정치민주연합 김광진 의원은 병영 내 구타나 가혹행위 자체의 횟수보다 그 범죄가 제대로 처리되고 있느냐가 문제라며 잘못을 저지른 사람들이 단죄받고 그 단죄의 효과를 통해서 다음에 범죄가 일어나면 안 되겠다는 생각을 갖게 하는 것이 중요하다고 말했다.군 당국이 병영 내 폭행 사건 등을 처리한 이후 후속 조치가 미흡하다는 점도 2차 피해를 키우고 있다. 임내현 의원이 군으로부터 제출 받은 자료에 따르면 최근 3년간 육군에서 폭행사건 등의 가해 병사 144명 중 71명은 소속이 변경되지 않은 것으로 파악됐다. 사건이 벌어져도 가해자와 피해자가 실효적으로 분리돼 있지 않아 피해 병사가 고스란히 보복을 당하는 구조라는 점이다.앞서 가혹행위를 당하다 못한 신 일병은 지난 5월 29일 민간전문상담관에게 폭행 피해 사실을 고백했으나 소속 중대에 그대로 남게 되면서 또 다른 2차 피해의 대상이 됐다. 신 일병이 간부와 상담한 대화 내용은 함께 있던 동기생들과 같은 소속 부대 간부를 통해 중대 전체에 퍼졌다. 군 당국은 폭행 사건 이후 집단 따돌림은 없었다고 발표했지만 당시 소속 부대 정모21 상병은 신 일병보다 한 기수 후임인 병사들에게 신 일병을 보면 경례하지 마라고 지시했다.해병대사령부는 지난 7월 24일 신 일병 사건에 대한 전면 재조사 결과를 발표했다. 재조사 결과 최초 2사단 헌병대에서 3명이라고 했던 가해자는 7명으로 늘어났다. 해병대는 해당 공병대대장을 비롯한 소속부대 간부 6명을 징계위원회에 회부했고 당시 수사를 담당했던 2사단 헌병대를 포함한 3명을 부실 수사로 처벌하겠다고 밝혔다. 그러나 징계 결과 공병대대장은 근신 5일 중대장은 감봉 3개월 소대장은 근신 10일 주임원사는 견책 부소대장은 근신 5일의 징계에 그쳤고 행정관과 분대장은 혐의 없음 처분을 받았다. 군 당국은 현재 사단장에 대한 징계를 검토하고 있고 헌병대장에 대한 형사사건을 진행 중이지만 군의 부실 수사에 대한 국민적 불신은 여전하다.윤 교수는 군 지휘관들은 아직도 병영 내 폭행가혹행위를 대부분 범죄가 아닌 사고라고 부른다는 점이 인식 수준을 보여주는 것이라고 말했다.김 의원은 군은 초동 수사부터 전문가나 가족의 출입을 제한하고 자체적인 조사 결과를 공식 발표해 버리는 관행을 반복한다며 지난번 윤 일병 사건 당시처럼 군 부대에 들어갈 권한과 능력이 없는 유족이 군의 거짓 주장을 뒤집기는 힘들다고 지적했다
대형마트로 옷사러 가는 남자들	http://news.naver.com/main/read.nhn?mode=LSD&mid=shm&sid1=101&oid=009&aid=0003603108&cid=428288	대형마트는 식품 생필품 등 장을 보러 가는 고객이 대부분이지만 최근 들어 마트에서 옷을 구매하는 고객이 늘고 있다. 여기에는 구매력이 커진 남성 소비자 맨슈머Mansumer남성과 소비자의 합성어의 기여도가 컸다.25일 산업통상자원부의 한국 패션시장규모조사 보고서를 분석한 결과 패션제품 구매 유통채널별 조사에서 3년 연속 판매가 늘어난 곳은 대형마트가 거의 유일했다. 대형마트의 패션제품 구매 비중은 2013년 상반기 11.9에서 2014년 같은 기간 13. 대세라는 인터넷쇼핑몰조차 의류 구매 비중이 작년 9.6로 하락한 상황에서 이례적인 수치다. 백화점은 2013년 상반기 판매 비중이 30.8에서 2014년 같은 기간 16.5로 반 토막이 났다가 2015년 들어 가까스로 소폭 상승18한 수준이다. 아웃렛 역시 2013년 상반기 15. 대형마트가 오프라인 패션제품 판매의 중축으로 떠오른 데는 스마트한 남성 소비자가 있었다는 분석이다. 최근 마트들이 머리부터 발끝까지 10만원내 전략하에 보급형 슈트와 비즈니스캐주얼 제품을 잇달아 내놓고 있는 데다가 수입 디자인을 입힌 자체 브랜드를 출시하는 등 맨슈머 잡기에 적극 대응하고 있는 것도 한몫했다. 패션업계 관계자는 패션시장규모조사 보고서에 따르면 남성들의 정장 구입 개수는 2013년 1.9개로 늘어났으나 평균 구입 가격은 2013년 21만원대에서 2015년 16만원대까지 떨어졌다면서 낮은 가격대의 제품을 구매하되 구매 개수를 늘리는 것이 트렌드라고 볼 수 있다고 설명했다. 홈플러스가 최근 론칭한 남성슈트 중심 패션 브랜드 F2F는 아예 타깃을 2030대 사회초년생으로 잡고 9만9800원짜리 슈트를 전면에 내세우고 있다. F2F는 마트표 슈트라는 오명을 벗기 위해 영국의 디자인하우스에서 디자인해 가져온 것이 특징이다. 소재 문제를 해결하기 위해 도네갈 매트폴리 헤링본 등의 고급소재를 사용한 것도 이례적이다. 그러면서도 글로벌 소싱 파워가 있는 외국 각지에 생산라인을 확보해 가격을 낮췄다. 홈플러스 관계자는 마트 판매 슈트는 품질이 떨어진다든지 디자인이 별로라는 편견을 깨기 위해 소재를 다양화하고 디자인에도 최대한 신경 썼다면서 도네갈 소재의 경우 촉감도 좋고 두께감도 있어 가을부터 겨울까지 착용이 가능한 데다가 재킷 팬츠뿐 아니라 베스트까지 스리피스로 구성해 고급스러움을 주려고 했다고 설명했다. 홈플러스는 F2F를 비롯한 패션부문 성장세에 힘입어 작년 2600억원이던 패션 매출이 올해 3000억원까지 올라갈 것으로 보고 있다. 이마트의 자체 브랜드 데이즈Daiz도 지난봄 남성 비즈니스캐주얼 시장에 뛰어들며 셔츠와 팬츠 스니커즈까지 9만8800원에 코디가 가능하도록 하는 상품을 내놨다. 치노팬츠 비즈니스팬츠가 1만2만원대 셔츠가 2만원 이하 스니커즈가 6만원대라 부담이 없다. 롯데마트 역시 자체브랜드PB 베이직아이콘BASICicon을 통해 비즈니스캐주얼로 활용 가능한 아이템을 10만원 미만 가격에 판매 중이다. 대표 제품인 세미슬림핏팬츠2만9900원 체크패턴 드레스셔츠2만5900원 남성 가디건2만9000원을 다 합쳐도 8만원이 조금 넘는 수준이다. 패션전문 컨설팅회사와 계약을 맺고 상품 기획을 공동으로 진행하며 해당 상품기획자들이 직접 홍콩 중국 등에서 소싱을 하고 있다. 바지 사이즈를 2인치 단위가 아닌 1인치 단위로 제작하는 등 핏감을 살리고 싶은 젊은 층을 겨냥한 상품이 많다는 것도 대형마트 남성의류 판매를 늘리고 있는 요인 중 하나다
"코엑스 폭파" 대사관에 협박…"가능성 낮아"	http://news.naver.com/main/read.nhn?mode=LSD&mid=shm&sid1=102&oid=055&aid=0000341139	테러단체 알 카에다와 연계된 조직이 서울 코엑스를 폭파하겠다고 협박해서 경찰이 경계를 강화했습니다. 실제로 테러가 발생할 가능성은 그리 높지 않아 보입니다.기자우리 시간으로 그제23일 저녁 아프리카 코트디부아르 한국 대사관으로 전화 한 통이 걸려왔습니다.자신을 안사르 알딘의 조직원이라고 밝힌 발신자는 25일 즉 오늘 서울 코엑스 안의 상점을 폭파하겠다고 주장했습니다.안사르 알딘은 테러단체 알 카에다와 연계된 조직으로 아프리카 말리에 본거지를 두고 있습니다.국정원 등을 통해 첩보를 전달받은 경찰은 어제와 오늘 이틀에 걸쳐 폭발물 처리반을 투입해 코엑스 내 상점들을 수색했습니다.폭발물이나 테러 징후는 발견되지 않았습니다.경찰은 실제 테러 가능성은 낮은 것으로 보고 있습니다.서울경찰청 대테러계장  25일 코엑스라는 것 외에 구체적인 시간과 장소가 특정되지 않았고 다른 요구사항 또한 없었습니다.다만 가능성을 100 배제할 순 없어 코엑스 근처에 경찰 두 개 중대 160명을 투입해 경계를 강화하고 있습니다.김동환서울 강남구  실제 테러 조직이 테러 위협을 한다는 소식을 들으니까 좀 많이 불안했습니다.박세리서울 송파구  우리나라가 설마 하는 생각에 그렇게까지 불안하지는 않았던 것 같아요.국정원은 대테러 관련 부서에서 사실 관계를 확인하는 중이라며 만일의 사태에 대비하고 있다고 밝혔습니다
