기재부, 맥통법 논란 진화 "수입맥주 할인, 규제 안한다"	http://news.naver.com/main/read.nhn?mode=LSD&mid=shm&sid1=101&oid=366&aid=0000302222	기재부 맥주가격 통제법맥통법 비난 커지자 진화 나서기획재정부는 19일 수입맥주의 가격 할인을 규제하는 방안은 검토하고 있지 않다고 밝혔다.이날 임재현 기재부 재산소비세정책관은 정부세종청사에서 기자간담회를 열고 지난달 맥주업체와의 간담회에서 정부가 맥주의 세금 문제에 대해 종합적으로 검토하겠다는 입장을 밝혔을 뿐이고 할인판매를 금지하겠다고 언급한 적은 없다라고 설명했다.기재부가 긴급 브리핑에 나선 것은 지난달 27일 맥주업계 관계자들이 참석한 간담회에서 정부 고위 관계자가 기준가격을 제시해 수입맥주의 할인 판매를 제한하겠다는 입장을 전달한 것으로 알려지면서 부정적인 여론이 확산됐기 때문이다.온라인을 중심으로 정부가 맥통법을 추진하려 든다는 비난이 쏟아졌다. 맥통법이란 정부가 휴대폰단통법과 책책통법 가격을 법으로 규제한 데 이어 맥주에도 손을 댄다는 의미에서 붙여진 별명이다.수입 맥주업체들이 구입가격을 부풀려 마치 할인율이 큰 것처럼 홍보하는 행위에도 법적인 문제는 없다고 기재부는 판단했다. 국세청 고시에 따르면 주류는 구입 단가보다 낮은 가격으로 판매해서는 안된다. 임 정책관은 일부 수입맥주의 경우 할인율이 커 구입단가보다 낮춘 것처럼 보이지만 사실상 그보다는 높은 가격을 책정했기 때문에 고시 위반은 아니다라고 설명했다
 밤사이 다시 전국 비…내일도 쌀쌀	http://news.naver.com/main/read.nhn?mode=LSD&mid=shm&sid1=103&oid=052&aid=0000732891&cid=428288	온종일 하늘이 흐리고 쌀쌀했는데요 밤부터는 전국에 다시 비가 내린다는 예보입니다.  자세한 날씨 중계차 연결해 알아보겠습니다. 박희원 캐스터  어제 비가 내리고 단풍이 많이 떨어진 것 같은데 퇴근길 무렵부터 또 비가 온다고요  기자 오늘 퇴근길에도 우산 챙기셔야겠습니다.  요즘 마치 늦가을 장마처럼 비가 자주 내리고 있는데요.  비가 내릴때마다 겨울이 성큼 성큼 다가오는 느낌입니다.  하루 사이 공기가 부쩍 차가워졌고 도심 풍경도 겨울빛에 가까워졌습니다.  공원 곳곳에는 막바지 단풍이 낙엽이 되어 수북이 쌓여있고요 겨울 채비를 하는 앙상한 나무들도 보입니다.  지금 서울 하늘은 잔뜩 흐린데요.  충청과 전라도에는 약하게 비가 오거나 빗방울이 떨어지는 곳이 있습니다.  밤에는 다시 전국으로 비가 확대되겠습니다.  내일 아침까지 전국에 5mm 안팎의 비가 내린 뒤 개겠습니다.  내일 아침 기온은 서울과 대구 9도 대전 10도 등으로 오늘만큼 쌀쌀하겠고 내일 낮 기온은 서울 13도 대전 15도 광주 17도 등으로 오늘과 비슷하거나 조금 높겠습니다.  이후 주말에는 영동지방에만 비가 내릴 뿐 내륙은 대체로 맑고 포근하겠습니다.   하지만 다음 주 월요일에는 다시 전국에 겨울 추위를 몰고 오는 비가 내릴 것으로 보입니다
출생아수 줄어도 '2만명대는 유지'	http://news.naver.com/main/read.nhn?mode=LSD&mid=shm&sid1=102&oid=018&aid=0003399776	전년 116명  다문화 부부 첫째 아이 출산까지 평균 2년 걸려세종 이데일리 윤종성 기자 다문화 출생아 수가 소폭 감소했지만 5년째 2만명대는 유지했다. 다문화 부부는 평균 결혼 후 2년 만에 첫째 아이를 낳는 것으로 나타났다. 통계청이 19일 발표한 2014년 다문화 인구동태 통계에 따르면  지난해 다문화 출생아 수는 2만1174명으로 집계됐다.5 줄어든 것이지만 5년째 2만명대 출생아 수는 유지했다. 다문화 출생아 수는 2010년2만312명 처음으로 2만명을 넘어선 뒤 2011년 2만2014명 2012년 2만2908명 2013년 2만1290명 2014년 2만1174명 등 한 번도 2만명 밑으로 내려가지 않았다. 지난해 우리나라 전체 출생에서 다문화 출생이 차지하는 비중은 4.9을 기록해 2013년과 유사한 수준을 보였다. 남아와 여아는 각각 1만 686명 1만488명으로 나타났다. 성비여아 100명당 남아는 101.다문화 출생아 중 첫째아가 차지하는 비중은 56.9로 가장 높았고 둘째아는 35. 다문화 부모의 첫째아 비중은 한국인출생기준 부모보다 높으나 지속적인 감소 추세를 보이고 있다. 둘째아와 셋째아 이상의 비중은 전년대비 각각 1. 다문화 출생에서 모의 평균 출산 연령은 첫째아가 28. 첫째아 둘째아 셋째아 이상 모두 모의 연령이 전년대비 상승했다.유형별로는 한국 부  외국 모가 차지하는 비중이 67.1였고 외국 부  한국 모의 비중은 14. 다문화 부부의 첫째아 출산까지의 결혼생활 기간은 2. 특히 다문화 모가 한국인인 경우 첫째아 출산까지의 결혼 생활 기간은 2.5년으로 외국인한국인귀화기준이 모인 경우 보다 첫째아 출산까지의 기간이 0
서울대 운동권 출신 40대 밀입북 후 판문점 귀환	http://news.naver.com/main/read.nhn?mode=LSD&mid=shm&sid1=102&oid=001&aid=0007998242	1986년 부산 문화원 점거 농성 경력국보법 위반 영장     전성훈 기자  1986년 부산 미국 문화원 점거 농성 사건에 연루됐던 서울대 학생 운동권 출신 40대 남성이 밀입북했다가 공안당국에 체포됐다.    검찰 등에 따르면 서울중앙지검 공안1부백재명 부장검사는 19일 국가보안법 위반 혐의로 이모48씨의 구속영장을 청구했다.     이씨는 최근 우리 정부의 허가를 받지 않고 중국을 경유해 북한에 들어간 혐의를 받고 있다.     공안당국은 17일 오후 4시 30분께 판문점을 통해 송환된 이씨의 체포영장을 집행해 신병을 확보했다.     북측은 이씨의 밀입북 사실을 파악한 뒤 비교적 신속하게 이를 우리 정부에 통보한 것으로 전해졌다.     검찰은 이씨를 상대로 밀입북 경위와 북한에서의 행적 북측 인사 접촉 여부 등을 조사하고 있다.     이씨는 1986년 3월 서울대생 중심으로 형성된 운동권 조직 구국학생연맹구학련의 일원으로 활동했다. 반미투쟁을 기치로 내건 구학련은 1980년대 후반부터 학원가에 널리 퍼진 주사파의 효시로 알려져 있다.      같은해 5월에는 구학련 소속 다른 학생 20여명과 광주민주화운동 진상 규명 등을 요구하며 부산 미국 문화원을 점거해 농성을 벌이다 구속된 뒤 기소유예로 풀려났다.      이씨는 20일 오후 3시 법원에서 구속 전 피의자심문영장실질심사을 받는다. 구속 여부는 당일 밤늦게 결정될 전망이다.    공안당국은 지난달 5일 북한에서 송환된 한국 국적 미국 대학생 주원문21씨의 국가보안법 위반 혐의도 계속 수사하고 있다.     주씨는 올 4월 22일 중국 단둥에서 밀입북하려다 붙잡혀 5개월 넘게 북한당국에 억류됐다. 그는 판문점을 통해 송환되자마자 체포됐다가 이틀 뒤 석방됐다.     공안당국은 이적행위 여부 등을 확인한 뒤 조만간 주씨를 재판에 넘길 예정이다
정부 "아베, 소녀상 철거 요구는 사실과 다르다"	http://news.naver.com/main/read.nhn?mode=LSD&mid=shm&sid1=100&oid=018&aid=0003400031	언론 보도 공식 반박정부 왜곡 보도에 유감 표명이데일리 장영은 기자 정부는 19일 아베 신조 일본 총리가 최근 박근혜 대통령과의 정상회담에서 위안부 소녀상 철거를 요구했다는 일본 언론의 보도에 대해 사실과 다르다며 공식 부인했다.조준혁 외교부 대변인은 이날 정례브리핑에서 양국 정상간 협의내용 상세를 밝히는 것은 자제하고자 한다면서도 다만 단독회담에서 아베 총리가 소녀상의 철거를 요구했다는 것은 사실과 다르다고 반박했다. 위안부 문제의 해결과 관련 일본측에서는 협상의 조건으로 위안부 소녀상 철거와 함께 더이상 위안부 문제를 거론하지 않을 것을 요구해왔던 것으로 알려져 있다. 아사히신문은 아베 총리가 지난 2일 청와대에서 열린 한일 정상회담에서 위안부 협상 타결의 최소한의 조건으로 주한 일본대사관 앞에 설치된 소녀상 철거를 박 대통령에게 요구했다고 보도했다. 이 신문은 한국 정부가 위안부 소녀상 철거 조건을 받아들일 경우 일본 정부는 2007년 해산된 아시아여성기금 후속사업을 확충하고 아베 총리 명의의 편지를 전달하는 방식의 위안부 협상안을 검토 중이라며 비교적 구체적인 협상 일정을 공개하기도 했다. 이에 조 대변인은 우리 정부로서는 일본에서 이렇게 사실과 다르거나 왜곡된 보도가 잇따르고 있는 것을 유감으로 생각한다고 지적했다. 정부는 앞서 최근 열린 위안부 문제 관련 제10차 한일 국장협의 때도 한일 정상의 단독 양자회담 시 오갔던 내용에 대한 일본 언론의 왜곡보도가 계속해서 나오고 있는 점에 대해 유감을 표명한 바 있다
'개정 도서정가제 1년'…값 떨어져도 책 안 본다? 해법은	http://news.naver.com/main/read.nhn?mode=LSD&mid=shm&sid1=103&oid=421&aid=0001743655&cid=428288	AFP서울 권영미 기자  완충장치 없이 갑자기 시작돼 독자들의 가격저항감을 높였다.서점이 출판사의 책을 사가는 가격인 공급률이 조정되지 않은 채 도서정가제로 매출이 줄어 출판사들의 타격이 컸다.  가격 할인 10와 간접 할인경제상의 이익 5를 합해 최대 15까지만 할인이 가능한 개정도서정가제가 실시된지 만 1년이 됐다. 출간 시기 규모나 온오프라인 상관없이 모든 서적과 서점에 총 15의 할인만 적용된 제도다. 도서정가제 실시는 책의 생산과 공급 소비와 관련된 이들에게 모두 영향을 미쳤지만 그 정도는 편차가 있었으며 각각의 불만과 개선점에 대한 의견도 달랐다. 현재까지 나온 문화체육관광부 한국출판인회의 등의 자료와 이 출판사들과 서점 독자들의 도서정가제에 대한 반응을 취합한 결과 대체로 출판사들은 매출의 하락을 호소했지만 제도의 필요성에 대해서 동의했다. 대부분의 독자들은 할인과 사은품이 제한되면서 책값이 과도하게 비싸다고 주장했지만 일부 독자는 이벤트나 할인폭 등에 현혹되지 않고 책의 내용을 기준으로 구매가 이루어지게 돼서 좋다는 의견도 있었다. 서점들은 크게 악영향을 호소하지는 않았으며 설문조사 결과 매출이나 수익이 소폭 늘거나 최소한 변동은 없는 수준이었다. 독자들 도서정가제로 책값만 높였다vs.책 구매시 내용만 평가하게 돼 좋다최근 문체부와 통계청은 도서정가제 이후 약 11개월간 도서발행은 5만 3353종으로 전년비 7.4 감소했고 신간가격은 1만7916원으로 전년비 6. 가계 도서구입은 1만8773원으로 전년동기대비 13. 기대대로 책값은 떨어졌지만 독자들은 도리어 책을 사보지 않은 것이다. 웅진지식하우스 관계자는 도서정가제를 전면적으로 시작하기 전에 단계적으로 할인 규제를 하면서 소비자들이 책값을 정상적으로 인지하는 기간을 주어야 했다고 아쉬워했다. 그 과정이 없이 도서정가제의 시행을 예고해 출판사들이 대폭 할인을 통한 대대적인 밀어내기가 있었고 그 결과 도서정가제 시행 후엔 책값이 더 비싸게 느껴졌다는 지적이다.실제로 도서정가제 관련 기사마다 책값이 너무 비싸다 도대체 누구를 위한 제도냐는 비난이 빗발치는 게 현실이다. 반면 이벤트나 할인폭 등에 현혹되지 않고 책의 내용을 기준으로 구매하는 분위기가 조성된 게 좋다고 한 독자도 있었다. 출판사 나무를 심는 사람들의 이수미 대표는 오랫동안 도서할인에 익숙해진 독자들을 위한 배려로 신간이나 전자책 정가를 현행보다 1020 낮출 필요가 있다고 지적했다.도서정가제가 중소서점 동네서점들 숨통 틔웠다문체부와 통계청이 실시한 도서정가제 관련 설문조사에 따르면 지역 단위의 중소서점의 매출과 영업이익은 다소 증가한 것으로 나타난 반면 온라인 및 대형서점의 매출은 줄고 영업이익은 증가했다. 다만 학습참고서를 주력 상품으로 하는 소형서점의 경우에는 매출 등에 거의 변동이 없었다.  대형온라인서점인 예스24의 2015년 상반기 영업이익은 93억 원으로 518증가한 것으로 보고된 바 있다. 당시 예스24는 도서가 아닌 문구 음반 DVD 공연 영화 패션 등 다른 상품 및 서비스 매출의 성장이 큰 역할을 했다고 설명했다. 도서정가제 1년의 변화를 묻는 질문에 예스24는 최근 도서 매출이 전년동기대비 15 감소했다고만 밝혔다. 전문가들은 할인율을 축소하고 적용대상을 확대한 개정 도서정가제의 영향으로  온라인 대형서점의 영업이익이 사실상 개선된 것으로 보고 있다. 지방 서점들도 도서관 납품 이 가능해지면서 숨통이 트였고 동네서점들도 궤멸 직전에서 소생한 것으로 본다. 대형서점의 가격 경쟁력이 사라지면서 독자들의 발길이 작고 친근한 중소서점 특색있는 동네서점으로 분산되고 있다고 보기 때문이다. 출판평론가 김성신씨는 도서정가제를 기반으로 특색있는 전국의 작은 동네 서점들이 의미있는 가능성을 만들어가고 있다면서 이 변화를 높이 평가했다. 하지만 여행전문 동네서점인 일단멈춤은 중대형 서점들과 달리 독립출판물과 단행본을 함께 다루는 우리의 특성상 도서정가제의 영향을 거의 받지 않았다고 말했다. 또한 책값 면에서도 여행이라는 콘텐츠와 공간을 즐기고 싶어하는 고객들이 위주라 도서의 할인 여부가 매출에 미치는 영향은 아주 미미하다고도 했다. 독자들의 눈을 작은 동네서점으로 돌리는 데는 성공한 반면 아직 매출증가를 실감할 단계는 아닌 것으로 풀이된다. 출판사는 매출하락 호소완전정가제 공급률 조정 실시돼야한국출판인회의가 최근 도서정가제 시행 1년을 맞아 회원사들을 상대로 조사한 내용을 보면 출판사들의 71는 매출이 감소했다고 답했다. 웅진지식하우스는 구간 매출이 30정도 줄었다고 밝혔고 나무를심는사람들은 약 15매출이 줄었다고 답해 이를 뒷받침했다. 출판사들은 대체로 도서정가제 시행을 매출 감소 요인으로 꼽았다. 하지만 나무를 심는사람들의 이수미 대표는 매체의 변화로 독서환경이 급격히 변화한 것이 도서정가제와 함께 결합돼 사태가 악화됐다. 어느 쪽이 더 큰 요인인지는 알수 없다고 밝혔다. 매출하락을 호소하면서도 출판사들은 60.5가 도서정가제는 유지돼야 한다고 말했다. 장기적으로는 도서정가제가 긍정적인 역할을 할 것임을 믿고 있었다. 이수미 대표는 현재는 할인을 당연한 것으로 받아들이지만 90년대만 해도 책값은 할인이 없었다. 인터넷서점이 등장하면서 할인도 시작됐다면서 책값을 가능한한 내리고 대신에 할인이 전혀 없는 완전정가제로 나아가야 한다. 이 과도기를 지나면 다시 할인을 이상하게 여기는 시대가 오지 않을까 생각한다고 덧붙였다.  할인율이 감소했지만 대형온오프라인 서점의 공급률서점이 출판사의 책을 사오는 가격 변화가 없어 출판사 수익률에는 변화가 없거나 매출감소로 수익률도 함께 감소한 것은 당장의 큰 문제점으로 지적됐다. 출판사들과 전문가들은 최근 교보문고가 채택한 온오프라인 공급률 통일과 같은 공급률 조정이 이루어져야 한다고 본다.책의 가치는 가격 아닌 내용이 결정도서정가제의 취지와 시행도 필요하지만 결국 중요한 것은 책의 내용일뿐이라는 의견도 나온다. 한 독자는 책값을 못하는 책이 있는 반면 좋은 책은 여러권 사서 주위에 선물로 주는 경우가 있듯이 책 가격이 근본적인 문제는 아니다고 말했다. 결국 도서정가제와는 별도로 책의 수준을 높이는 것이 출판계의 활로를 찾는 데 중요하다는 의미다. 한 번역가는 좋은 콘텐츠는 좋은 인재에서 나온다고 말했다. 그를 위해선 콘텐츠 최초 생산자인 작가 및 번역가에 대한 처우와 원고료가 더욱 인상되고 출판사 직원들의 급여도 인상돼야 한다. 무명작가들에 대한 출판계의 갑질이나 김훈 산문집에 양은냄비와 라면 사은품을 끼워 판 것과 같은 대형출판사의 불법행위가 있어서는 안된다는 말이 이어졌다.김성신 출판평론가는 꾸준히 양서를 내는 출판사들에 대한 정부차원의 지원이 매우 중요하다고 주장했다. 김 평론가는 전국의 공공도서관들의 신간구매 비용을 대폭 증가시킬 필요가 있다.  엄격한 심사를 거쳐 도서관에 비치해야만 할 양서라는 판단이 되는 양서라면 최소 1000권 정도는 정부가 지원해야 한다고 본다고 덧붙였다
