"한국사람, 많이 벌건 적게 벌건 다들 밤새우다시피 일해"	http://news.naver.com/main/read.nhn?mode=LSD&mid=shm&sid1=102&oid=032&aid=0002573111&cid=428288	술 문화상하관계 어려워혼자서 밥 먹고 싶은데 불러 정 문화가 때로는 간섭으로 어른 앞에서 담배 금지 등본받아야 할 한국 문화 많아차별 비판 차이 존중 노력인도계 미국인인 라나크 푼갈리아 교수는 성균관대 풀타임 MBA 과정인 SKKGSB에서 금융재무를 가르친다. 한국에 오기 전 미국 금융업계에서 일을 해 장시간 근무에도 제법 익숙하다. 그런 그도 한국의 오랜 근무시간에는 혀를 내두른다. 미국에서도 일 많이 하는 사람들은 정말 많이 하죠. 주 80시간 일하는 사람도 있어요. 그런데 그들은 그만큼 돈을 많이 벌어요. 그는 한국은 돈을 많이 버나 적게 버나 무슨 일을 하든 다 똑같이 밤을 새우다시피 일을 하는 것 같다고 했다. 어느덧 우리의 일부가 된 그들에게 한국은 삶의 터전이지만 어떤 한국 문화는 여전히 낯설기만 하다. 대표적인 게 장시간 노동이다. 일중독 사회 술 권하는 사회최근 현대경제연구원이 한국에 체류 중인 외국 전문인력 115명을 대상으로 실시한 설문조사에서도 일과 삶의 균형이 어렵다는 응답이 가장 많았다. 유학생으로 한국에 왔다가 대기업 건설사에 취직한 레바논 출신 이브라힘27가명도 생각이 비슷하다. 그는 일을 빨리 끝내고  퇴근하는 게 더 효율적인데 한국은 무조건 일을 더 많이 해야 좋다고 생각하는 것 같다고 말했다.한국 특유의 직장 술자리 문화도 익숙해지기 어렵다. 일도 많은데 툭하면 회식을 해서 배로 힘이 든다. 이브라힘은 나도 술을 좋아하지만 주중에는 왜 마시는지 이해를 못하겠다면서 술 마신 다음날에도 회사에 나와 10시간 넘도록 일해야 하지 않나라고 반문했다.술 문화가 어려운 건 한국 생활 20년이 넘은 라이문드 로이어 자생한방병원 국제진료센터 원장51도 마찬가지다. 그는 국내에서 한 명뿐인 서양인 한의사다. 1990년대 초반 입학한 국내 한의대에서 한의학뿐 아니라 한국 술문화까지 배웠다. 잔 돌리고 폭탄주 만들고 이것저것 많이 배웠죠. 필름 끊긴 적도 여러 번이고. 로이어 원장이 쑥스럽다는 듯 웃으며 말했다. 그는 고향 오스트리아에서는 술을 거의 입에 대지 않았다. 하지만 한국에 온 이후로는 술 없이 살 수가 없었다. 대학에서도 병원에서도 사람들과의 관계는 술을 매개로 이뤄졌다. 청바지 입고 신입생 OT 참석하니엄격한 상하관계도 외국인들이 낯설어 하는 문화다. 푼갈리아 교수는 27세에 한국에서 대학 교수가 됐다. 청바지에 백팩을 메고 신학기 오리엔테이션에 참가했다. 그가 교수일 거라고는 전혀 생각지 못한 옆자리 한국인 학생과 농담을 주고받으며 한참을 편하게 이야기했다. 이후 자신이 착각했다는 걸 알게 된 학생이 푼갈리아 교수를 찾아 몇 번을 고개 숙여 사과했다. 푼갈리아 교수가 그 학생보다 더 당황했다.KBS교향악단에서 호른을 담당하는 알렉산더 아키모프62는 벨라루스에서 한국으로 넘어온 지 올해로 23년째다. 인터넷으로 연말정산까지 살뜰하게 챙길 정도로 한국 생활에 익숙해졌지만 위아래를 엄격하게 나누는 문화에는 적응하기 쉽지 않다. 그는 오케스트라 연습시간에는 좋은 쪽이든 나쁜 쪽이든 말을 많이 해야 한다. 그래야 모두에게 도움이 된다면서 그런데 한국은 그게 잘 안된다. 지휘자가 한마디 하면 모두 네 하고 넘어간다고 했다. 이브라힘은 신입사원은 좋은 아이디어가 있어도 상사한테 말하기 어려워한다. 반대로 힘든 일이 있어도 속으로만 끙끙 앓는다. 자기가 약해서 힘든 거라고 생각하는 것 같다면서 본인과 회사 모두에 도움이 안되는 문화라고 지적했다.한국 특유의 정 문화가 때로는 간섭으로 느껴지기도 한다. 네팔 출신 우다야 라이43는 민주노총 이주노동자 담당으로 일한다. 가끔 혼자 식당에서 밥을 먹는데 그걸 볼 때마다 동료들이 손짓해 부른다. 라이는 혼자 밥 먹고 있으면 쓸쓸해 보이나 보다. 정작 나는 불편한 게 없는데라고 했다. 같이 밥 먹자고 부르는 건 관심을 보이는 것이니 그래도 고맙다. 문제는 관심이 선을 넘을 때다. 몇 년 전 할머니가 돌아가셨을 때 라이는 고향 풍습을 따라 며칠 동안 소금과 고기를 먹지 않았다. 공장의 한국인 동료들은 고기가 얼마나 몸에 좋은데 안 먹느냐며 핀잔을 줬다.차별 문제를 호소하는 외국인도 적지 않다. 특히 라이와 같은 동남아 출신 이주노동자들의 경우 일상적으로 차별을 경험한다. 라이는 쇼핑하러 백화점에 가면 불친절하게 대하거나 심한 경우 반말을 하기도 한다며 네팔에 있을 때보다 월급은 많이 받지만 차별 때문에 살기가 쉽지 않다고 말했다.  공존 위해 필요한 건 이해와 조화아키모프는 한국인 며느리까지 온 가족이 모여 술자리를 가질 때마다 대한민국을 위하여라고 건배한다. 로이어 원장은 오스트리아로 휴가 갔을 때마다 다들 어찌나 느긋한지 답답하다며 이제는 한국이 훨씬 편하다고 말했다. 이들이 적잖은 어려움에도 성공적으로 한국에 정착할 수 있었던 비결로 손꼽는 것은 바로 이해와 조화다. 푼갈리아 교수는 한국 사람들 정말 일 많이 하지만 경제적으로 두 세대에 걸쳐 해야 할 일을 한 세대에서 다하다 보니 어쩔 수 없는 측면도 있을 것이라고 했다. 아키모프는 한국에 와서 어른 앞에서 담배 피우면 안된다는 것을 배웠다. 이런 건 좋은 문화라고 생각한다면서 본받아야 할 한국 문화가 많다. 때로 안 맞는 것도 최대한 맞출 수 있도록 나부터 노력해야 한다고 했다.차별은 비판하되 차이에 대해서는 어떤 맥락에서 나온 문화인지 먼저 이해하고 존중하려 애쓰는 게 필요하다는 얘기다.com 모바일 경향 경향 뉴스진  경향신문 앱  모바일웹  공식 SNS 계정 경향 트위터 페이스북 세상과 경향의 소통 커뮤니티  경향신문www
무심코 올린 만화때문에 '1300만원 폭탄'	http://news.naver.com/main/read.nhn?mode=LSD&mid=shm&sid1=105&oid=029&aid=0002269418	저작권 인식 낮은 고등학생 P2P에 공유 과도한 합의금 요구 논란 고등학생 A군은 한 달 전 파일공유사이트인 P2P에 만화 13건을 올렸다. 유명한 만화도 아니었고 편 수도 13편밖에 되지 않아 크게 신경 쓰지 않았다. 그런데 얼마 후 A군은 모 법무법인으로부터 저작권을 침해했으니 건 당 100만원 씩 모두 1300만원을 지급하라는 내용증명서를 받았다. 소스라치게 놀란 A군은 저작권을 침해했다는 문제를 인정하고 사과했지만 법무법인은 계속 1300만원을 요구했다. A군은 부모님께 얘기하자니 혼날 일이 두렵고 돈을 내지 않을 경우 감옥에 들어갈까 두려워 혼자 끙끙 앓다가 상담센터를 찾았다.대학생 B씨는 다른 곳에서 내려받은 소설을 웹하드에 올린 후 모 법무법인으로부터 고소를 당했다. 처음 이 법무법인은 합의금으로 660만원을 요구했다. 그런데 갑자기 다른 작가로부터 추가 고소가 들어올 수 있으니 빨리 일을 마무리 짓는 게 좋겠다며 합의금으로 880만원을 요구했다. 합의금이 990만원까지 오를 수 있다며 으름장을 놨다. 공무원 시험을 준비 중인 B씨는 혹여 이번 일이 결격 사유로 작용할까 두려워 합의금을 빨리 마련하려다 상담센터에 문의했다.22일 업계에 따르면 저작권 침해로 과도한 합의금을 요구받거나 비슷한 저작권자로부터 줄줄이 고소를 당하는 이른바 시간차 저작권 공격으로 소송에 휘말리는 사례가 늘고 있다. 이들 다수가 10대 청소년이나 금전 여력이 없는 대학생들로 저작권 인식이 낮다는 것을 법무법인 등이 악용하고 있는 것이다.이같은 저작권 문제를 상담해주는 저작권위원회 저작권상담센터에 따르면 2013년 46건에 불과하던 상담건수가 지난해 207건으로 450 가량 증가했다. 당초 위원회에서 활동하던 법률상담관은 3명에 불과했지만 최근 몇 년 사이 상담 건수가 급증하면서 지난해 10명으로 늘었다.상담가들은 저작권을 위반한 부분은 명백한 죄에 해당하지만 이를 악용한 사례들은 주의해야 한다고 조언했다. 특히 A군처럼 미성년자의 경우 극한 선택을 하는 상황까지 갈 수 있다는 점에서 주변인의 관심과 조언이 필요하다는 지적이다. 실제 2000년대 후반 저작권 합의금 마련 때문에 괴로워하던 한 청소년이 스스로 목숨을 끊어 문제가 되기도 했다. 사법부는 이 같은 합의금을 노린 이들을 막기 위해 법적 안전장치를 마련해 시행 중이다. 당시 만들어진 청소년 저작권침해 고소 사건 각하제도는 침해 행위가 우발적인 경우 한 번에 한해 조사 없이 각하 처분할 수 있도록 하고 있다. 교육 조건부 기소유예제도는 한 번에 한해 저작권 교육을 받는 것을 조건으로 불기소 처분기소유예하는 제도로 2008년부터 시행했다. 전문가는 무엇보다 저작권을 침해하지 않는 것이 중요하다고 지적했다. 또 만약 저작권 침해 사실을 모른 채 이 같은 상황에 처했을 경우 정부나 각종 시민단체 등에서 제공하는 법률 전문가 조언이나 상담을 권했다.  김지선기자 dubs45                                                                                                                                                                                                                                                                                                                                                                                                                                                                                                                                                                                                                                                                                                                                                                                                                                                                                                                                                                                                                                         네이버 뉴스스탠드에서 디지털타임스 구독 하세요김지선기자의 블로그  httpblog
우크라 정부군-반군, 포로 190여명 맞교환	http://news.naver.com/main/read.nhn?mode=LSD&mid=shm&sid1=104&oid=001&aid=0007422535&cid=428288	교환장소로 호송되는 우크라 정부군 포로들AP 우크라이나 동부도시 루간스크 인근 졸로보크에서 21일현지시간 정부군과 반군 간의 포로 교환이 처음으로 이루어졌다. 양측은 각각 포로로 잡고 있던 반군 52명과 정부군 139명을 상대방에게 남겼다. 사진은 무장한 친러시아 반군이 정부군 포로들을 이날 포로교환 장소로 호송하고 있는 모습.  2차 민스크 휴전협정 후 처음하리코프선 폭탄테러로 10여명 사상    모스크바 유철종 특파원 정열 기자  휴전협정이 체결됐음에도 불구하고 교전을 계속하는 우크라이나 정부군과 반군이 협정 발효 이후 처음으로 포로를 맞교환했다.    타스와 AFP 통신 등에 따르면 양측은 21일 밤현지시간 우크라이나 동부도시 루간스크주의 콜로복 마을에서 포로들을 교환했으며 반군은 139명의 정부군을 정부군은 52명의 반군을 석방했다.     페트로 포로셴코 우크라이나 대통령도 자신의 트위터를 통해 보안국으로부터 포로교환 절차가 시작됐다는 통보를 받았다고 확인했다.    반군 측은 이번에 풀려난 정부군 포로들이 주로 최근 동부 전략 거점도시인 데발체베를 들러싸고 벌어진 전투과정에서 붙잡은 군인들이라고 설명했다. 우크라이나 보안기관 관계자는 포로 교환 절차가 내달 45일까지 계속될 것이라고 밝혔다.     정부군과 반군의 포로 교환은 지난해 12월 말 중단됐다가 이달 15일 제2차 민스크 휴전협정이 발효하면서 재개됐다.     러시아 우크라이나 프랑스 독일 4개국 정상들은 지난 12일 벨라루스 수도 민스크 정상회담에서 우크라이나 휴전협정에 합의한 바 있다.     정부군과 반군이 억류 중인 포로 수가 정확히 몇 명인지는 확인되지 않았지만 반군 측은 우크라이나가 약 580명의 반군을 포로로 잡고 있다고 주장했다.    정부군과 반군은 22일부터 휴전 협정의 또다른 합의 사항인 중화기 철수에도 착수할 예정이라고 우크라이나 신문 우크라인스카야 프라브다가 자국군 소식통을 인용해 보도했다.     민스크 휴전협정에 따르면 우크라이나 정부군과 반군은 휴전 개시 이틀 내에 대포 다연장포 등의 중화기 철수를 시작해 50140km 폭에 이르는 비무장지대를 구축해야 했지만 양측이 협정 발효 이후에도 데발체베를 중심으로 교전을 계속하면서 합의가 제대로 지켜지지 않았다. 드디어 자유의 몸이 되는 건가AP 친러시아 반군에 붙잡혀 있던 우크라이나 정부군 포로들이 21일현지시간 동부도시 루간스크 인근 졸로보크에서 반군 포로와의 맞교환 시간을 기다리며 서 있다. 정부군과 반군은 각각 포로로 잡고 있던 반군 52명과 정부군 139명을 이날 처음으로 교환했다.    데발체베를 점령하기 위해 정부군과 반군이 벌인 치열한 전투로 179명의 정부군이 사망했다고 유리 비류코프 우크라이나 대통령 고문이 밝혔다.    OSCE 감시단은 단원들이 데발체베를 사찰하던 21일 오후에도 도시 주변에서 양측의 교전이 계속됐다고 전했다.     도시는 그동안 이어진 정부군과 반군의 교전으로 거의 모든 건물이 부서졌고 생수 식료품 의약품 등이 고갈됐으며 가스와 전기 공급도 끊긴 상태라고 OSCE는 소개했다.     데발체베 외에 동부 도시 도네츠크 주변 지역에서도 교전이 계속되고 있는 것으로 알려졌다.     분리주의 세력인 도네츠크인민공화국 의회 부의장 데니스 푸쉴린은 전반적으로는 휴전이 지켜지고 있지만 중앙 정부의 명령에 따르지 않는 일부 부대들이 도네츠크에 포격을 가하는 등 도발행위가 이어지고 있다고 밝혔다. 그는 이 부대들이 도네츠크 북쪽 도시 아브데예프카에서 포격을 가하고 있지만 반군은 대응하지 않으려고 애쓰고 있다고 주장했다.     한편 22일엔 우크라이나 동부 도시 하리코프 시내에서 폭발이 일어나 최소 3명이 숨지고 10여명이 부상했다고 타스 통신 등이 전했다.     폭발은 친정부 세력이 정권 교체 혁명 1주년을 맞아 시내 쥬코프 원수 대로에서 기념 가두행진을 벌이던 도중 지나던 자동차에 탄 괴한이 시위대를 향해 폭발물을 던지면서 일어난 것으로 알려졌다. 현지 경찰은 이 사고를 테러로 규정하고 조사를 벌이고 있다.     우크라이나에선 1년 전 2월 21일 저녁 친러시아 성향의 빅토르 야누코비치 전 대통령이 반정부 시위를 벌이던 야권의 압박에 밀려 수도 키예프를 떠나 자신의 정치적 지지기반인 동부 지역으로 도피했다가 러시아로 망명하면서 친서방 세력으로 권력이 넘어갔다
MWC 관전포인트 5가지…삼성 갤럭시 S6·커넥티드 카	http://news.naver.com/main/read.nhn?mode=LSD&mid=shm&sid1=105&oid=366&aid=0000249298	내달 2일현지시각 개막하는 세계 최대 이동통신 전시회 모바일월드콩그레스MWC 2015를 앞두고 미국 경제전문 방송 CNBC가 다섯가지 관전 포인트를 소개했다. 삼성 갤럭시S6삼성전자005930는 1일 기자회견을 통해 신제품 갤럭시 S6를 공개한다. 한 때 스마트폰 업계를 재패했던 삼성은 고사양의 제품을 저가에 제공하는 중국 샤오미 등에 그 자리를 내주고 말았다. 또 큰 화면을 앞세운 아이폰6와 아이폰6플러스에 시장 점유율을 뺏기고 있는 상황이라고 CNBC는 전했다.프랜시스코 제로니모 IDC 애널리스트는 삼성은 샤오미 같은 저가나 애플 같은 고가 정책을 쓸 수 없다며 갤럭시S6가 이 문제를 어떻게 해결할 지 관심이 쏠려 있다. 갤럭시 S6가 정말 혁신적이라면 삼성의 명성을 되찾을 수 있을 것이라고 말했다. 스마트워치애플워치 대항마 나올까이번 행사에선 첨단 기술을 결합한 웨어러블 기기스마트폰이나 태블릿과 무선으로 연동해 사용하는 안경이나 손목 시계가 눈길을 끌 전망이다. 특히 애플워치에 대항할 수 있는 스마트워치가 나올 것인지 관심이 쏠려있다.LG전자066570는 MWC에 앞서 어베인Urbane을 발표하며 스마트워치 전쟁에 참여했다. 하지만 소비자의 이목을 집중시키는데 실패했다고 CNBC는 전했다.닐 모스턴 스트래티지애널리틱스 수석 이사는 이번 행사에서 모든 사람들이 애플워치의 대항마를 찾고 있을 것이라고 강조했다. 떠오르는 별  IT기업지난해 중국의 샤오미와 인도 마이크로맥스 등 스마트폰 업체들은 이른바 돌풍을 일으켰다. 이들 기업은 이번 행사에서 입지를 다지기 위해 공격적인 활동을 펼칠 것으로 보인다.CNBC는 알리바바가 5억 달러약 5500억원 이상 투자한 중국 기업 샤오미 제오니 레노버 ZTE 화웨이 메이주가 이번 MWC에 참석할 것이라고 전했다. 이들은 그동안 저가전략을 통해 시장점유율 확보에 성공했지만 경제 전문가들은 이들의 경쟁력이 얼마나 지속될 수 있을 지 우려하고 있다. 커넥티드 카이번 행사에서 주목받는 제품은 커넥티드 카통신망을 통해 정보기술기기로 활용하는 차량다. 얼라이어드마켓리서치에 따르면 커넥티드 카 시장은 연 32.7씩 성장해 2020년까지 1410억 달러약 155조 8300억원에 달할 전망이다.애플은 차량용 운영체제OS 카플레이CarPlay를 통해 현대기아차볼보벤츠 등과 제휴에 나섰다. 카플레이는 아이폰과 차량시스템을 연결해 차량에 설치된 78인치 터치 디스플레이를 이용할 수 있는 시스템이다. 이에 질세라 구글은 안드로이드 OS를 통해 혼다아우디 제너럴모터스 등과 손을 잡았다. 이 시스템은 음성 인식 기술을 이용해 음성만으로 자동차의 모든 기능을 제어할 수 있도록 했다. 초고속 5G이번 MWC의 가장 뜨거운 주제 중 하나는 5세대5G의 초기 주도권 전쟁이 될 전망이다. 5G는 한 시간짜리 고화질 영화를 6초 만에 다운로드 할 수 있는 기술이다.가장 적극적인 곳은 유럽연합EU과 아시아다. 5G 기술 중심에는 한국이 있다고 CNBC는 전했다
경제활성화에 'OECD 2배' 돈 퍼붓는 한국	http://news.naver.com/main/read.nhn?mode=LSD&mid=shm&sid1=101&oid=032&aid=0002573128	복지예산 OECD 최하위와 대조경제 관련 지출 구조조정 나서야한국 정부가 경제부문에 지출하는 예산 비중이 경제협력개발기구OECD 평균의 2배가 넘는 것으로 나타났다. 하지만 사회보장에 쓰는 돈은 OECD 평균의 절반에도 미치지 못했다. 지금도 미흡한 수준인 복지지출에 손을 대기보다는 경제 관련 지출에 대한 구조조정이 필요하다는 지적이 나온다. 22일 경향신문이 OECD 자료를 분석한 결과 한국 정부가 2012년에 지출한 451조원 중 산업 증진과 연구개발RD 경기부양 등 경제활성화에 쓴 돈은 전체 지출중앙지방정부 및 사회보장기금 지출 대비 19.한국의 경제부문 지출 비중은 2012년 기준 OECD 27개 국가 중 1위로 2위 스페인16. 경제부문 지출이 10를 넘는 국가는 체코 헝가리 에스토니아 폴란드 등 개발도상국으로 분류될 수 있는 동구권이 다수였다. 미국 독일 프랑스 등 선진국과 노르웨이 스웨덴 핀란드 등 북유럽 국가들은 10를 넘지 않았다. 반면 한국 정부가 생활보호 노인아동보호 등 사회복지 사회보험 보건위생 대책비 등 사회보장에 쓴 돈67조원의 비중은 OECD 최하위인 14. 이 밖에 한국 정부는 2012년 공공서비스에 15. 전문가들은 정책금융 등 더 이상 정부가 하지 않아도 되거나 자원낭비로 이어질 수 있는 분야를 포함해 경제예산 전반에 대한 타당성 검토와 구조조정이 필요하다고 지적했다.  김상조 한성대 교수는 한국이 후발 성장국가이다 보니 경제부문 지출의 비중이 높은 면도 있지만 그중 상당수가 이제 더 이상 정부가 하지 않아도 되는 것들이라며 경제예산 중 불필요한 분야를 구조조정해야 한다고 말했다.com 모바일 경향 경향 뉴스진  경향신문 앱  모바일웹  공식 SNS 계정 경향 트위터 페이스북 세상과 경향의 소통 커뮤니티  경향신문www
보호 못 받는 '미등록' 아이들 지원…아동 보호? 불법체류..	http://news.naver.com/main/read.nhn?mode=LSD&mid=shm&sid1=102&oid=214&aid=0000468096&cid=428288	병원에도 학교에도 제대로 가지 못하고 있는데 이런 아동이 2만 명이 넘습니다. 리포트 경기도의 한 어린이집. 이주근로자와 다문화가정 자녀들 20명이 다니고 이들 중에 3명은 부모가 불법체류자 신분입니다.한국에서 태어나 살아도 현행법상 국적 등록과 출생 신고를 할 수 없고 당연히 보육료 지원은 물론 건강보험도 제외 대상입니다. 송연순어린이집 원장  관련 지원은 0입니다. 한국 음식 먹으며 한국 친구들과 한국말로 생활하는데도요. 이들을 돕기위해 미등록 이주아동도 출생 신고를 할 수 있도록 하는 법안이 국회에 제출됐습니다.의무교육과 의료 보호양육권을 주고 치료 등을 위해서는 특별 체류자격도 줘 부모의 강제 퇴거도 늦출 수 있게 하자는 것입니다. 이자스민새누리당 의원  건강한 어른이 될 수 있는 환경을 만들어 주는 것 그것은 국제사회의 일원으로서 마땅히 해야 할 의무라고.사정은 이해하지만 오히려 불법 체류자를 양산할 수 있고 5년간 7백억 원이 든다는 것입니다. 김동근청년대학생연합 대표 불법체류자에 대한 과도한 혜택은 세금을 내고 있는 자국민들에 대한 역차별입니다
