그리스 위기 해법 모색…국민투표 후 재협상 가능성	http://news.naver.com/main/read.nhn?mode=LSD&mid=shm&sid1=101&oid=001&aid=0007694014	EU유럽 지도자 협상 여지 남아그리스 유로존에 남아야    유럽종합 그리스와 채권단 간 구제금융 협상 결렬로 그리스가 채무불이행디폴트 상태에 빠질 우려가 커지고 있는 가운데 그리스 위기의 극적인 해결을 위한 막판 움직임이 활발하게 전개되고 있다.    유럽연합EU과 유럽 주요 국가 지도자들은 아직 협상의 여지가 남아 있다고 말하면서 그리스에 대해 협상 테이블에 다시 나설 것을 촉구함에 따라 막판 타결 가능성을 시사했다.    또한 채권단의 협상안에 대한 그리스 국민투표가 다음 달 5일 실시된 예정인 가운데 국민투표 이후 재협상 가능성이 제기되고 있다.    앙겔라 메르켈 독일 총리는 29일현지시간 그리스가 국민투표를 마치고 나서 대화를 원하면 응할 준비가 돼 있다고 밝혔다.     메르켈 총리는 이날 베를린에서 정당 및 의회 지도자들과 회동해 그리스 해법을 논의한 뒤 기자들과 만나 그리스가 국민투표 이후 협상 재개를 원한다면 우리로서는 당연히 그러한 협상을 거절하지 않을 것이라고 말했다.    이에 앞서 메르켈 총리는 자신이 속한 기독민주당CDU 창당 70주년 기념연설에서 유로화가 실패하면 유럽도 실패한다면서 그리스 구제금융 협상 주체들의 대타협을 촉구했다.    프랑수아 올랑드 프랑스 대통령도 이날 협상이 여전히 가능하다고 밝혔다.     올랑드 대통령은 그리스 사태를 논의하기 위한 비상 각료회의를 마친 뒤 기자들과 만나 오늘 여전히 협상할 수 있으며 그리스인들이 구제금융안 국민투표에서 어떤 답을 내놓느냐에 달려 있다며 이같이 말했다.     장클로드 융커 유럽연합EU 집행위원장은 그리스 국민에 대해 채권단의 제안에 찬성할 것을 촉구했다.    융커 위원장은 이날 기자회견에서 그리스 국민투표에서 채권단의 협상안이 부결되면 이는 그리스가 EU를 거부한 것을 의미한다고 말했다.    그는 국민투표 부결은 그리스가 유로존유로화 사용 19개국과 EU에서 거리를 두겠다는 신호로 받아들여질 것이라고 강조하면서 그리스 국민에 찬성표를 던질 것을 요청했다.    그는 채권단의 제안은 바보 같은 긴축 패키지가 아니라고 밝히고 지금은 그리스 정치인들이 국민의 진정한 이익을 위해 책임 있는 태도를 보여야 할 때라고 덧붙였다.    피에르 모스코비치 EU 경제담당 집행위원은 그리스와 국제 채권단 간에 아직 협상의 여지가 남아 있다. 협상의 문은 열려 있으며 그리스는 유로존에 남아 있어야 한다고 강조했다.    미셸 샤팽 프랑스 재무장관도 그리스의 유로존 탈퇴는 그리스 국민에 위기다. 그리스 국민은 협상을 계속하기를 원한다고 말했다.    루이스 데 귄도스 스페인 경제장관은 30일 밤 현재의 구제금융 프로그램이 종료하기 전까지 협상을 재개할 기회가 아직 남아 있다고 밝혔다.    앞서 알렉시스 치프라스 그리스 총리는 지난 27일 채권단의 협상안에 대한 국민투표 실시를 발표했으며 그리스 의회는 이 방안을 승인했다.    채권단이 그리스에 대한 구제금융 단기 연장을 거부함에 따라 그리스 정부는 은행 영업을 중단하고 예금 인출을 제한했다. 그리스는 30일까지 국제통화기금IMF에 채무 15억 유로약 1조9천억원를 상환해야 한다.    그리스 위기는 이번 국민투표가 분수령이 될 것으로 보인다. 국민투표에서 그리스 국민이 채권단이 제시한 구제금융 협상안에 찬성하는 것으로 나오면 그리스는 채권단과 다시 협상에 나설 수 있을 것으로 예상된다.    그리스 정부와 유럽중앙은행ECB도 그리스 위기 해결을 위해 긴박한 움직임을 보이고 있다.    알렉시스 치프라스 그리스 총리는 구제금융 유로존 정상들에게 구제금융 연장안 거부 결정을 재고해달라는 요청을 담은 서한을 발송했다.    ECB는 내달 1일 통화정책위원회 회의를 열어 그리스에 대한 긴급유동성지원ELA 문제를 논의한다.     이번 회의에서는 파국 위기에 처한 그리스에 대한 ELA 한도 문제를 다룰 것이라고 정책위원인 에발트 노보트니 오스트리아 중앙은행 총재가 전했다.     그리스는 국제채권단과의 구제금융 협상이 난항을 겪자 마지막 자금줄인 ELA에 의존해 유동성을 확보해 왔다
최저임금 결국 법정시한 넘겨…3일 전원회의서 다시 논의	http://news.naver.com/main/read.nhn?mode=LSD&mid=shm&sid1=102&oid=008&aid=0003497906	세종이동우 기자 시급월급 병기업종별 차등적용 안건 표결처리 논의노동계 양보본문 이미지 영역 최저임금위원회 법정활동시한 마지막 날인 29일 정부세종청사 전원회의실에서 열린 제8차 전원회의에서 박준성 최저임금위원회 위원장이 모두발언을 있다. 이날 전원회의는 사용자 위원 전원이 불참한 채 개회됐다.  사진내년도 최저임금이 결국 법정 시한을 넘겨서도 정해지지 못했다. 사용자위원 측이 전원회의 참석을 거부하는 등 파행을 거듭한 가운데 최저임금 논의는 다음 달까지 이어지게 됐다. 최저임금위원회는 29일 정부세종청사에서 열린 제8차 전원회의에서 내년도 최저임금 수준을 결정하지 못한 채 회의를 마무리 지었다. 9차 전원회의는 다음달 3일 열릴 예정이다. 이날 회의는 근로자위원 9명 전원 참석 공익위원 8명 참석으로 총 17명이 참석한 가운데 오후 3시30분 개의됐다. 사용자위원 측은 한 명도 참석하지 않은 상황에서 근로자위원 측과 공익위원 측은 세 시간 가량 회의를 진행했다. 당초 최저임금위는 이날 회의에서 시급월급 최저임금 결정단위 병기 문제와 사업 종류구분에 따른 업종별 최저임금 차등적용을 비롯해 내년도 최저임금 수준을 의결할 방침이었다. 하지만 한국경영자총협회는 이날 오전 긴급회의를 열고 전원 불참 결론을 내렸다. 지난 25일 열린 제7차 전원회의에서도 사용자위원 측은 최저임금 결정단위의 시급월급 병기안을 표결에 부쳐야 한다는 근로자공익위원들의 주장에 맞서 전원 퇴장한 바 있다. 사용자위원 측이 지난 25일에 이어 불참 함에 따라 이날 회의에서는 시급월급 병기안과 업종별 차등적용 건의 표결처리 여부가 논의되기도 했다. 지난 7차 전원회의 중도 퇴장을 불참으로 간주 2회 퇴장요건을 채워 법적으로는 표결처리가 가능하다는 최저임금위의 입장이다.그럼에도 두 안건에 대한 표결처리는 노동계의 양보로 다음 전원회의로 미뤄지게 됐다. 최저임금위 관계자는 법적으로는 표결처리에 아무런 문제가 없었지만 노동계가 통 큰 양보를 해 조금 더 논의를 진행토록 결정했다고 설명했다.  이날 회의가 아무런 소득 없이 끝남에 따라 논의는 달을 넘겨 이어지게 됐다. 최저임금 결정시한은 이날까지지만 기한을 넘겨도 법적제재는 발생하지 않는다. 법적 효력이 생기는 8월5일의 20일 전까지만 결론을 내리면 된다. 최저임금위는 이의제기 기간을 고려해 다음 달 7일을 마지노선으로 잡고 3일과 6일 7일을 남은 논의를 진행한다는 방침이다. 7일 회의는 경우에 따라 6일 오후 3시30분에 시작하는 전원회의의 연장선상에서 진행키로 했다.   다음 전원회의에 사용자위원 측이 참석할지는 여전히 미지수다. 사용자위원 측은 공익위원 측이 시급월급 병기안에 대한 수정된 입장을 요구하고 있는 상황이다. 이에 노동계와 공익위원 측은 사용자위원 측에 대한 설득을 통해 출석을 유도한다는 입장이다.  또 다른 최저임금위 관계자는 1일이나 2일 운영위원회를 통해 전원회의에 사용자위원 측 전원이 참석할 수 있도록 잘 설득할 것이라면서도 시급월급 병기 문제는 법적으로 문제가 없는 만큼 특별한 입장 조정이 있지는 않을 것이라고 설명했다
'日 '사토리 세대'…욕심도 돈도 없다	http://news.naver.com/main/read.nhn?mode=LSD&mid=shm&sid1=104&oid=214&aid=0000511517	우리보다 먼저 장기불황이 찾아온 일본에는 사토리 세대라는 신조어가 있습니다.사토리 깨달음 득도라는 뜻으로 돈과 출세에 관심없는 요즘 일본의 젊은 세대를 가리키는 말이라는데요.미래가 불확실하다 보니 욕심도 없고 소비조차 잘하지 않아서 경제 성장의 부담이 된다고 합니다.후지TV의 세키 순타로 기자가 취재했습니다. 리포트 도쿄 중심부에서 조금 떨어진 세타가야구 동갑인 23살의 회사원 히라노 가쿠씨와 요시다 카오리씨가 휴일 데이트를 즐깁니다. 자세 잡고한 시간 정도 산보를 즐긴 두 사람. 전차를 타고 산겐차야까지 갑니다. 태국요리점에서 즐거운 식사를 하고는 돈은 각자 냅니다. 이날 든 데이트 비용은 한 사람당 약 3000엔. 한화 2만 8천 원 최근 일본의 젊은이들은 그다지 돈을 쓰지 않는 듯합니다. 욕심도 그다지 없지 않나싼 곳에 가서 많이 먹습니다. 어렸을 때부터 불경기 속에서 자라난 지금의 일본 젊은이들은 유토리요령있는 여유세대 사토리애 늙은이 식의 달관세대라고 불리어지며 독특한 가치관을 가지고 있습니다. 2007년 이후 젊은 층의 수입은 오르락내리락 하고 있습니다.반면 소비는 수입의 증감에 관계없이 2009년 이후 보합상태에 있습니다. 버블을 경험한 세대들은 돈을 쓰지 않는 지금의 젊은이들을 어떻게 보고 있을까요 여자친구가 생기면 차를 사야 한다는 이야기가 있었지만 지금은 그렇지 않습니다. 저렴한 의류 브랜드 HM이라든가 Forever21에서도 찾아보면 디자인이 여러 가지가 있어요
"아직도 악몽"…'삼풍참사' 피해자 심리치료 절실	http://news.naver.com/main/read.nhn?mode=LSD&mid=shm&sid1=102&oid=056&aid=0010189765	멘트오늘은 502명의 희생자와 6명의 실종자 그리고 937명의 부상자를 낸 삼풍백화점 참사 20주기가 되는 날입니다.  20년이 지났지만 피해자들은 여전히  악몽에 시달리고 있다고 합니다.  이지윤 기자가 취재했습니다. 리포트 20년 전  단 한 명의 생명이라도  더 구하겠다는 마음 하나로  많은 사람들이 붕괴 현장으로 달려갔습니다.인터뷰 육광남당시 민간 구조대원  앉아서 잠을 자는 한이 있더라도 현장에 가 있어야 된다는 그런 마음으로. 언제 다시 붕괴될지 모르는 위험 속에서 라면 박스에 이름 석자만 남기고  구조 활동에 몰입했던  민간 구조대원들. 이제 머리 희끗한 노인이 되었지만 사고 당시의 참담함은  아직도 머리에서 떠나지 않습니다.인터뷰 고진광당시 민간 구조대원  그때 살려달라 그랬지만 살리지 못한 거. 지금 20년이 흘렀어도 새벽에 문득문득 잠자리에서 그 분들이 나오니까.  사고 현장 인근 병원의 간호사였던 박현숙 씨는 1년 뒤 응급실을 떠났습니다.인터뷰 박현숙당시 인근 병원 간호사  의식 없는 사람들 팔 다리 다 잘린 사람들 이런 사람들이 들어오기 시작하고. 부모를 잃고 응급실에서 울던 아이들 손을 붙들고 가족을 찾던 사람들을 떠올리면 지금도 절로 눈물이 난다고 합니다.인터뷰 박현숙당시 인근 병원 간호사  제가 거기응급실는 오래 못 있었던 것 같아요. 20년이 지났지만 참사를 직.간접적으로 경험한 사람들의 고통은 계속되고 있습니다.인터뷰 김선현대한트라우마협회 회장  개인을 떠나서 자치단체 국가에서 책임을 져야 하는 어려움에 대해 조금 더 쉽게 접근할 수 있는 국가 차원의 트라우마 센터가 생겨야
대구 검단공단 침구류업체 창고에 불	http://news.naver.com/main/read.nhn?mode=LSD&mid=shm&sid1=102&oid=001&aid=0007693959	대구 검단공단에 불    대구 김용민 기자  29일 오후 7시 10분께 대구시 북구 검단동 공단에서 불이 났다. 불이 나자 소방차 40여대가 출동 진화 중이다.29    yongminyna.kr    대구 이덕기 김준범 기자  29일 오후 7시 10분께 대구시 북구 검단동 검단공단 내 한 수입가구 및 침구류 판매업체 창고에서 불이 났다.     불은 연면적 5천여의 6층 건물 가운데 56층에서 발생 건물 1개 동을 모두 태우고 1시간 20여분만에 진화됐다. 대구 검단동 화재    대구 김준범 기자  29일 오후 7시 10분께 대구시 북구 검단동 검단공단 내에서 불이나 소방당국이 진화작업을 하고 있다.     psykimsyna.kr    불이 나자 소방차 43대와 150여명의 인력이 출동해 진화에 나섰다.     그러나 불이 난 건물 내부에 인화성 물질이 가득한데다 짙은 연기와 함께 불길이 좀처럼 사그라지지 않아 진화에 어려움을 겪었다.     불이 날 당시 건물 내부에는 퇴근을 앞둔 일부 직원들이 남아 있었지만 화재 직후 건물을 빠져나온 것으로 전해졌다.불과 싸우는 소방관    대구 김준범 기자  29일 오후 7시 10분께 대구시 북구 검단동 검단공단 내에서 불이나 소방당국이 진화작업을 하고 있다.    psykimsyna.kr    소방 당국은 현재까지 인명피해는 확인되지 않았다고 밝혔다.    경찰과 소방당국은 만일의 경우를 대비해 인명 수색에 나서는 한편 정확한 화재 원인과 피해 상황을 조사하고 있다
美기자 "산케이 기사는 가십…명예훼손 아니라고 생각"	http://news.naver.com/main/read.nhn?mode=LSD&mid=shm&sid1=100&oid=001&aid=0007693989	산케이 전 서울지국장 속행공판     서울 교도 박근혜 대통령의 명예를 훼손한 혐의로 기소된 산케이신문 가토 다쓰야 전 서울지국장이 29일 오후 속행공판을 위해 서초동 서울중앙지법으로 출두하고 있다.29    photoyna.kr도널드 커크 기자 가토 측 증인 출석재판부 9월 선고할 듯     임미나 기자  지한파 미국 언론인으로 유명한 도널드 커크 기자가 대통령 명예훼손 혐의로 기소된 산케이신문 가토 다쓰야49 전 서울지국장 재판에 증인으로 나와 명예훼손 혐의에 부정적인 의견을 냈다.    서울중앙지법 형사합의30부이동근 부장판사 심리로 29일 열린 가토 전 지국장재판에서 커크 기자는 솔직히 말하면 해당 기사는 매우 길고 촌스럽고 따분하긴 하지만 누군가의 명예를 훼손하는 기사는 아니라고 생각한다고 말했다.    1972년부터 시카고 트리뷴과 USA투데이 인터내셔널 헤럴드 트리뷴 등 미국 유수 언론의 한국 특파원으로 일하며 한국에 관한 수많은 기사를 써온 커크 기자는 특히 518 광주 현장을 보도해 세계에 알린 기자로 유명하다.     현재 프리랜서로 활동하는 그는 외신 기자들의 국내 취재 방식 등을 들어볼 필요가 있다는 가토 전 지국장 측의 요청으로 증인으로 나오게 됐다.    가토 전 지국장은 지난해 8월 3일 박근혜 대통령 여객선 침몰 당일 행방불명누구와 만났을까라는 제목의 기사에서 세월호 참사 당일 박 대통령이 정윤회씨와 함께 있었다는 의혹을 제기하면서 두 사람이 긴밀한 남녀관계인 것처럼 표현했다가 명예훼손 혐의로 기소됐다.    커크 기자는 이 기사에 대해 그냥 한 번 읽고 잊어버리는 사소한 가십성 기사인데 오히려 이 기사에 청와대가 과잉 반응하는 바람에 새로운 관심을 키운 것으로 보인다고 평했다.    이에 검찰은 기사 내용을 정확히 알고 있느냐 기사에 등장하는 정윤회나 최태민 등에 대해 아느냐고 추궁했고 커크 기자는 그들에 대해서는 잘 모르지만 그리 중요한 사람들은 아니라고 생각한다. 더 심각한 주제가 많다고 맞받아쳤다.    재판부는 표현의 자유를 보장한 미국의 수정헌법 1조와 인간의 존엄성 보호를 국가의 의무로 규정한 독일 헌법 1조를 언급하며 두 가치가 충돌할 때 무엇을 우선할지에 대한 해석은 국가마다 차이가 있는 것 아니냐고 물었다.     커크 기자는 인간의 존엄성을 중시하더라도 피고인의 기사가 누구를 비방할 목적은 아니라고 본다고 답했다.    한편 변호인 측이 가토 전 지국장이 인용한 기사의 작성자라며 증인으로 세우려 한 조선일보 최보식 기자는 지난 재판에 이어 불출석사유서를 제출하고 나오지 않음에 따라 재판부가 증인 채택을 취소했다.    재판부는 변호인과 검찰 양측의 나머지 증인 신문을 위해 다음 달 기일을 한 차례 열고 8월에 피고인신문을 끝으로 재판을 마무리하기로 했다. 선고는 9월께 내려질 것으로 전망된다
내일 전국 비…수요일부터 무더위	http://news.naver.com/main/read.nhn?mode=LSD&mid=shm&sid1=103&oid=052&aid=0000696036	주말에 이어 오늘도 내륙을 중심으로 무더운 날씨가 이어졌습니다.   장맛비 소식 기다리는 분들 계실텐데요.   내일 날씨 어떨지 오늘과 비교해서 자세히 알아보겠습니다.  오늘 낮 동안 햇살이 제법 내리쬔 곳도 많았는데요.   지금은 구름이 점차 많아지면서 흐려져있습니다.   내일은 충청 이남 지역에 장맛비가 내리겠고 서울 등 중북부 지역에는 빗방울만 떨어지겠습니다.   제주도 남쪽 해상으로 물러났던 장마전선이 내륙으로 서서히 북상하고 있습니다.   새벽에 제주도와 전남해안부터 비가 시작돼 낮에는 충청이남지역으로 확대되겠는데요.  제주도에는 최고 80mm의 제법 많은 비가 내리겠고 전남해안과 경남 해안에는 1040mm 그 밖의 지방은 520mm가 예상됩니다.   남해안에는 내일 아침부터 오후 사이 천둥번개가 치고 돌풍이 불겠습니다.   시설물 관리에 신경쓰시기 바랍니다.  오늘 서울 낮 기온 30.   내일은 27도에 머물겠습니다.   오늘보다 49도가량 낮겠는데요  다른 지역도 살펴보면 대구 23도 등 예년 기온을 밑돌겠습니다.  수요일부터는 다시 낮 기온이 오르면서 무덥겠고요.   다가오는 주말에 장마전선이 또 북상하면서 제주도부터 비를 뿌릴 것으로 전망됩니다
