수출 6개월째 맥없이 내리막길… 브레이크가 안 걸린다	http://news.naver.com/main/read.nhn?mode=LSD&mid=shm&sid1=101&oid=469&aid=0000072864	식어가는 경기6월 조업일수 많았지만 반등 못해석유화학 고전반도체값 하락 여파그리스 사태 등 하반기도 먹구름연간 목표치 달성 사실상 어려울 듯 최경환왼쪽에서 두 번째 경제부총리 겸 기획재정부 장관이 1일 국회 새누리당 정책위의장실에서 진행된 2015년 추경 관련 당정협의에서 모두 발언을 하고 있다.com  올해 1월부터 줄곧 감소했던 수출이 결국 상반기를 마이너스 성장으로 마감했다. 조업일수가 전년보다 많았던 지난달마저 마이너스 성장률을 기록하며 상반기 내내 수출은 마이너스 성장을 기록했다. 연간 6000억달러라는 정부의 올해 수출 목표 달성도 사실상 어렵게 됐다. 산업통상자원부가 1일 발표한 6월 및 상반기 수출입 동향에 따르면 6월 수출은 469억달러로 전년 동월 대비 1.8 감소하며 6개월 연속 마이너스 성장을 기록했다. 상반기 전체 수출은 2690억달러를 기록해 전년 동기 대비 5 감소했다. 정부는 유가하락 엔화유로화 약세 세계교역 및 중국 수입수요 둔화 등 대외여건이 좋지 않은 점을 주요 원인으로 꼽았다. 사실 정부는 연초부터 내내 뒷걸음질치던 수출이 6월에 반등할 것으로 기대했다. 지난해 6월 지방선거가 있었고 올해 현충일은 토요일과 겹치는 바람에 지난해 6월보다 평일 조업일수가 2일이 더 많았기 때문이다. 관세청 통관이 이뤄지는 토요일도 하루가 더 많았다. 그럼에도 불구하고 수출이 증가세로 돌아서지 못한 이유는 전체 수출의 약 80를 차지하는 13대 주요 품목이 고전했기 때문이다. 유가하락으로 고전을 면치 못하는 석유화학 및 석유제품 외에도 선박 반도체 등의 영향이 컸다. 산업부 관계자는 선박은 올해 두 번째로 많은 40억달러를 6월에 수출했지만 지난해 6월 수출 실적이 워낙 좋아 17.1 감소했고 반도체도 단가가 떨어져 물량이 늘어도 수출액이 늘지 않았다고 설명했다. 다만 수출 감소폭이 줄어든 것이 그나마 다행이다.9로 확대되던 수출 감소폭은 지난달 1. 하반기 수출 실적은 조금 나아질 것으로 정부는 보고 있다. 유가가 조금 오른데다 상반기에 부진했던 자동차 분야에서 줄줄이 신차 출시가 예정돼 있고 갤럭시S6와 G4 등 휴대폰도 선전하고 있어 상반기 보다 나아질 것이란 기대 때문이다. 하지만 세계 경제의 불확실성이 확대돼 낙관하기는 이르다. 우리의 최대 수출국인 중국의 수입둔화 주요 통화엔유로 대비 원화 절상 그리스 국가부도 사태를 비롯한 유럽 정세불안 등의 위협요인이 여전히 상존한다. 또 진정세를 보이는 중동호흡기증후군메르스이 조기에 종식되지 않을 경우 수출에도 후유증이 나타날 수 있어 주시하고 있다. 따라서 연간 수출 목표 달성은 어려울 전망이다. 산업연구원은 지난달 22일 발표한 하반기 경제산업 전망 보고서에서 올해 수출액이 5551억 달러로 지난해보다 3.1 줄고 수입액은 4746억 달러로 9. 정부도 지난달 25일 하반기 경제정책방향을 발표하며 올해 수출이 하반기에 회복하겠지만 상반기 부진한 탓에 전년보다 1.5 감소할 것으로 내다 봤다. 이에 정부는 이달 중 수출 경쟁력 제고 대책을 발표할 예정이다. 산업부 관계자는 수출 1.5 감소도 노력해야 나올 수 있는 수치라 연초 세운 수출 목표 달성은 어려울 것 같다고 말했다. 한편 상반기 무역수지는 수입이 2223억 달러로 전년 동기 보다 15.6가 감소하면서 반기별로 사상 최대인 467억 달러 흑자를 기록했다. 그러나 수출 보다 수입이 더 크게 줄어드는 불황형 흑자다
서울시 '공회전 2분 제한'…차에는 괜찮을까?	http://news.naver.com/main/read.nhn?mode=LSD&mid=shm&sid1=103&oid=437&aid=0000083266	차 가지신 분들은 다 관심 있으실 것 같은데요. 이제 내일모레3일부터는 서울 시내에서 공회전을 2분 이상 하면 안 됩니다. 어제 저희도 짧게 소식 전해드렸는데 이를 두고 너무 엄격한 것 아니냐 공회전 안 하면 차에 안 좋다는데 괜찮은 거냐 여러 말들이 나왔습니다. 오늘 팩트체크에서는 공회전과 관련한 궁금증들 풀어보겠습니다. 김필규 기자 원래 서울시에 이런 규정이 있었던 겁니까기자예 있습니다. 평소 시내에서 자동차 공회전 제한 시간은 5분이고 좀 덥거나 추운 때는 10분까지 공회전을 할 수 있게 해놨는데요.이번에 나온 조례에 따라 내일모레부터는 평소에는 2분 덥거나 추운 날은 5분으로 엄격해진 겁니다. 30도 이상이나 영하일 때 너무 덥거나 추울 때는 이런 제한을 두지 않기로 했습니다.앵커너무 덥거나 추울 때는 냉난방 때문일 테고 단속은 어떻게 합니까 이 사람이 2분을 했는지 2분 5초를 했는지 어떻게 압니까기자서울시에서는 단속반을 따로 운영하겠다는 건데 제가 만약 단속반원이라 하면 저기 도로에서 시동 걸고 서 있는 차를 발견했을 때 우선 가서 시동을 끄라고 경고합니다. 먼저 가서 경고를 하고 그다음부터 2분을 잽니다.그러고 나서 2분이 지났는데도 공회전을 멈추지 않으면 5만원의 과태료를 물리는 거죠.터미널이나 차고지 노상주차장 등 2662곳 중점 제한장소에선 경고 없이 과태료를 부과합니다. 앵커그러니까 무턱대고 가서 당신 2분 넘었어 이렇게 하는 건 아니다 그런 얘기. 그런데 어느 정도 공회전은 차를 위해서도 필요하다 이런 얘기들도 하잖아요기자예 차 오래 잘 타려면 항상 예열하고 출발하라는 이야기도 있죠.하지만 환경부에서는 요즘 차가 많이 좋아졌다 자동차 공회전은 80년대에나 필요했던 것이지 지금은 예열 없이 서서히 출발하는 것으로 충분하다는 입장입니다. 그런데 자동차 전문가들의 생각은 좀 달랐습니다. 박병일자동차 명장  사실 우리 사람으로 따지면 수영할 때 만약에 준비운동 안 하고 가면 심장병 걸리죠. 바로 출발하게 되면 엔진 성능이 1년만 지나면 계속 감소가 돼요. 3년만 지나면 배출가스가 많이 나온다는 거죠. 우리가 전자제어 엔진이기 때문에 바로 출발해도 이상 없다 엔진 오래갈 수 있다 이런 얘기는 실제로는 맞지 않는 얘깁니다.김필수 대림대 교수도 공회전을 전혀 안 하고 출발해 버릇하면 차를 오래 쓰는 데도 좋지 않다며 어느 정도의 공회전은 꼭 필요하다고 강조했습니다.앵커그러면 어떻습니까 2분 이내로 하면 안 좋습니까기자박병일 명장은 여름에는 1분 이상 봄가을에는 2분 이상 겨울에는 3분 이상 필요하다는 입장이었는데요.앵커물론 차 상태에 따라 다르긴 하겠죠. 추울수록 좀 더 해야 된다는 이야기는 너무 날이 추우면 엔진오일이 점성화 되기 때문에 그럴 때는 공회전이 조금 더 필요하다는 설명이었습니다. 앵커그러면 서울시에서 굳이 2분으로 정한 이유가 있을 것 아니겠습니까 기자서울시에 물어봤더니 역시 환경부와 비슷한 이유로 그동안 자동차 기술이 발달해 2분이면 충분하다는 설명이었습니다.자동차 제조업체에 물어보니 공회전의 필요성에 대해선 어느 정도 인정하면서도 과거만큼 긴 시간은 필요하지 않다면서 구체적인 시간을 언급하진 않았습니다.그래서 다른 나라는 어떤지 찾아봤는데요. 미국 워싱턴DC의 경우 공회전 제한 기준이 3분이었습니다. 뉴욕이나 캘리포니아에선 대형 경유차의 경우 5분 이상 캐나다 토론토 등에선 38분 이상 공회전 금지입니다. 반면 도쿄에선 조금이라도 공회전을 하기만 하면 과태료를 물고 그 액수도 150만원 정도나 됩니다.앵커그러면 도쿄는 아예 못합니까 기자네 규정상 그렇게 돼 있습니다. 나라마다 도시마다 기준이 다른데 이런 조치가 기본적으로는 대기오염을 줄이기 위한 것 아니겠습니까 도움이 될까요기자서울시에 등록차량이 약 3백만대입니다. 하루 5분 공회전을 줄일 경우 연간 온실가스 9만3천톤이 감소하고 초미세먼지도 6톤 이상 덜 배출될 거라는 게 서울시 예측인데요.그런데 지금 보시는 것처럼 공회전이 특히 문제가 되는 것은 도심에 서 있는 버스나 길가에 세워둔 차들입니다. 앞서 이야기대로 차를 처음 몰 때 공회전은 어느 정도 필요할 수 있겠지만 운전을 하다가 잠시 세웠을 때는 전혀 필요가 없거든요. 여러 상황에 맞는 적정한 규제와 또 정차 중 공회전에 대한 의식 개선 같이 따라가야 할 것 같습니다. 앵커저희들이 이 보도도 해드렸습니다만 관광버스가 줄지어서 하루 종일 매연 쏟아내는데 그것도 좀 단속을 했으면 좋겠습니다. 물론 관광버스 운전하시는 분들께는 서운하게 들릴 수도 있겠습니다만.김필규 JTBC 뉴스 공식 SNS 트위터 페이스북 카카오스토리 유튜브 JTBC 뉴스는 여러분의 생생한 제보를 기다립니다
검찰, 박성철 신원 회장 '탈세·횡령·회생 사기' 수사	http://news.naver.com/main/hotissue/read.nhn?mid=hot&sid1=101&iid=48978156&oid=001&aid=0007698685&ptype=021&cid=1021003	신원그룹 압수수색 중인 검찰     신준희 기자  검찰이 1일 지분 거래 과정에서 조세 포탈 혐의가 포착된 신원그룹 박성철 회장의 자택과 그룹 본사 등을 압수수색했다.     이날 오후 검찰 관계자가 압수 물품을 운반할 상자를 들고 서울 마포구 신원그룹으로 들어가고 있다.1    hamayna.kr    그룹 본사오너 자택 압수수색20억 탈세100억 횡령 혐의개인재산 숨기고 파산회생 절차 밟아 250억 탕감받은 정황     안희 김계연 기자  신원그룹 박성철75 회장이 경영권을 되찾는 과정에서 증여세 등을 탈루한 혐의에 대해 검찰이 본격 수사에 나섰다. 박 회장은 경영에 복귀한 이후 개인회생 절차를 밟으면서 수백억원대의 빚을 불법 탕감받은 혐의도 있다.    서울중앙지검 공정거래조세조사부한동훈 부장검사는 1일 서울 마포구 도화동에 있는 신원그룹 본사와 계열사 박 회장의 자택 등지를 압수수색했다.검찰 박성철 신원회장 탈세 등 혐의로 수사     경영권을 되찾는 과정에서 증여세 등을 탈루한 혐의로 검찰이        본격 수사에 나선 신원그룹 박성철75 회장.    서울중앙지검 공정거래조세조사부는 1일 서울 마포구 도화동 신원그룹 본사와 계열사 박 회장의 자택에 대한 압수수색을 했다.    2006년 9월  북측 개성공업지구 주신원 개성공장에서 열린 기업투자설명회 및 개성공단 신원 제2공장 착공식에서 박성철 회장이 인사말을 하고 있다.1      DB     photoyna.kr    검찰은 이날 오전 8시30분께부터 검사와 수사관 50여명을 투입해 컴퓨터 하드디스크와 회계장부 내부 경영 문건 박 회장 일가의 재산 관련 서류 등을 확보한 것으로 전해졌다.    앞서 국세청은 신원그룹의 지주회사 격인 신원의 경영권을 다시 확보하기 위해 사실상 가족과 지인 등 명의로 주식을 매입하고도 세금을 제대로 내지 않은 혐의를 잡고 검찰에 박 회장 등을 고발했다.    박 회장은 1999년 신원이 워크아웃에 들어가면서 보유 지분을 모두 포기했으나 2003년 워크아웃 졸업 후 대표이사를 맡아왔다.    박 회장의 부인 송모씨가 신원의 1대 주주이자 광고대행사인 티엔엠커뮤니케이션즈의 최대 주주26.6이기 때문에 가능했던 일로 여겨진다. 박 회장의 세 아들도 티엔엠커뮤니케이션즈 지분을 1씩 보유하고 있다.    박 회장은 티엔엠커뮤니케이션즈를 통해 신원 주식을 매입했고 이 과정에서 증여세와 종합소득세 등을 포탈한 혐의를 받고 있다. 세무당국은 20억원대 탈세 혐의를 포착해 형사고발 조치하고 송씨 등에게서 190여억원을 추징한 것으로 알려졌다.압수수색 중인 신원그룹     신준희 기자  검찰이 1일 지분 거래 과정에서 조세 포탈 혐의가 포착된 신원그룹 박성철 회장의 자택과 그룹 본사 등을 압수수색했다.     사진은 이날 오후 서울 마포구 신원그룹.1    hamayna.kr        검찰은 박 회장이 100억원 안팎의 회삿돈을 횡령한 혐의와 개인 파산회생 절차를 밟으면서 법원을 속여 250여억원의 채무를 탕감받은 혐의를 추가로 포착했다.    박 회장은 경영권을 되찾은 뒤 2008년 개인파산 2011년에는 개인회생 절차를 밟아 빚을 탕감받았다. 검찰은 박 회장이 이 과정에서 재산이 없는 것처럼 법원에 허위 신고를 한 정황을 확보한 것으로 알려졌다.    채무자 회생 및 파산에 관한 법률통합도산법은 이런 식으로 재산을 숨겨 회생절차 개시나 파산선고를 받은 경우 10년 이하의 징역 또는 1억원 이하 벌금형에 처하도록 했다.    검찰은 압수물 분석을 마치는대로 신원그룹 임직원들과 박 회장 일가를 차례로 불러 정확한 탈세횡령액과 은닉재산의 규모를 확인할 방침이다
日스기야마 왜 왔나…궁금증 키운 비공개 방한 	http://news.naver.com/main/read.nhn?mode=LSD&mid=shm&sid1=100&oid=001&aid=0007699699	스기야마신스케 일본 외무성 외무심의관차관보급세계유산 막판까지 기싸움 관측수교 50주년 후속 논의도      김효정 기자  일본 근대산업 시설의 세계유산 등재 여부 결정을 약 사흘 앞두고 일본 외무성 고위 당국자가 비공개로 한국을 찾아 관심이 쏠리고 있다.    스기야마 신스케 일본 외무성 외무심의관차관보급은 지난달 30일 한국을 찾아 1일 우리 외교부 당국자들과 만난 것으로 드러났다.    이번 방한은 기본적으로 조선인 강제노동이 이뤄진 일본 근대산업 시설의 세계유산 등재 문제가 주요 의제였던 것으로 보인다.      스기야마 심의관은 세계유산위원회의 우리 정부 공동 수석대표인 조태열 외교부 2차관을 예방했다. 이 자리에서 세계유산 등재와 관련해 마무리 협의 단계에서 조율이 있었던 것으로 안다고 정부 당국자는 전했다.     한일 양국은 지난달 21일 도쿄에서 열린 외교장관 회담에서 강제노동 사실을 반영한다는 데 큰 틀에서 합의했으며 어떤 내용을 명시할 것인지에도 의견 접근을 이룬 것으로 알려졌다.    이를 바탕으로 최근에는 구체적인 표현과 반영 방식절차 등을 포함한 최종 합의안을 조율해 온 것으로 전해졌다.     스기야마 심의관이 방한한 것도 합의안 도출을 위한 막바지 산고의 일환이라는 분석이 나온다.     특히 세계유산위원회가 이미 시작돼 한일 대표단이 독일 본 현지에서 의견을 조율하는 상황에서 일본 정부의 고위 당국자가 직접 한국을 찾은 배경에 궁금증이 인다.           회의 진행 등 실무적인 문제 이외에 한일이 아직 이견을 좁혀야 할 대목이 남아있음을 시사한다는 분석이다.     양국이 막판까지 여전히 치열한 기싸움을 벌이고 있거나 일본 측이 방한을 요청했다는 점에서 돌출 쟁점이 있는 것 아니냐는 관측도 일각에서 나온다.     그러나 윤병세 외교부 장관은 이날 국회 외교통일위원회에서 세계유산 등재문제는 한일 간 원만히 타결키로 인식을 같이 했다며 종전과 같은 입장을 밝혔다.     정부의 한 소식통도 현재로서 큰 상황 변동은 없다고 전했다.     일본 근대산업 시설의 세계유산 등재 여부는 본에서 열리는 세계유산위원회에서 현지시간으로 4일께 최종 확정될 예정이다. 조태열 차관은 내일 본으로 출국한다.    한편 이날 방한에서 양측은 지난달 한일 외교장관회담의 후속 조치에 대해서도 논의했다고 정부 당국자는 밝혔다.     한일 국교정상화 50주년을 계기로 이뤄진 당시 회담에서 양측이 관계개선 의지를 확인한 만큼 이후 대화 동력을 이어나가기 위한 논의가 이뤄진 것으로 보인다.    한중일 3국 고위급회의의 일본 측 대표인 스기야마 심의관의 방한에서 3국 정상회의 및 이를 계기로 한 한일 양자 정상회담과 관련한 논의가 오갔을지도 관심이다.    그는 지난달 29일 한 강연에서 초가을에 일정이 매우 빽빽한 가운데 한중일 정상회담 또는 유엔 총회에서 한일 정상회담이 열릴 수 있을지도 모르겠다고 말해 관심을 끈 바 있다
괘씸해서 동전으로 월급 지급? "도 넘은 모욕"	http://news.naver.com/main/read.nhn?mode=LSD&mid=shm&sid1=102&oid=055&aid=0000322748	한 PC방 업주가 아르바이트생의 태도가 마음에 들지 않는다고 10원짜리와 50원짜리 동전으로 임금을 지급했습니다. 얼마 전에도 이런 일이 있었는데 글쎄요 여러분 어떻게 생각하십니까 업주 입장에서도 할 말이 없는 건 아니겠습니다마는 꼭 이렇게까지 해야 했을는지요안서현 기자가 취재했습니다.기자PC방 앞에 커다란 상자 하나가 놓여 있습니다.상자를 열어보니 10원짜리 1만 9천여 개와 50원짜리 6천 800여 개가 들어 있습니다.25살 김 모 씨가 지난 5월 엿새간 피시방에서 야간 아르바이트를 하다가 관두겠다고 말하자 업주가 임금을 동전으로 준 겁니다. PC방 아르바이트생  사장이 너 때문에 힘들게 이렇게 은행 여러 군데 돌면서 동전을 구해 왔다고 가져가라고.하지만 업주는 김 씨가 한마디 말도 없이 그만뒀고 자신을 협박했다고 반박합니다.PC방 업주 다음에는 이러지 말라고 교훈적으로 동전을 준 것이지 그 사람을 해치거나 피해주려고 준 것은 아니라고그리고 일을 잘못했으면 와서 사장님 죄송하다고 말을 듣고 싶은 것이지 그 얘기 한마디만 했어도 동전으로 주지 않았을 것이다.앞서 울산에서도 주점에서 일한 박 모 양이 밀린 임금을 달라고 했다가 10만 원을 10원짜리 동전으로 받았습니다.주점 업주는 월급을 주는 과정에서 10대인 아르바이트생 친구들이 찾아와 자신에게 욕을 해 화가 났던 것이라고 해명했습니다.울산 주점 업주한수진의 SBS 전망대 인터뷰  아 후회하죠. 부끄러운 행동을 한 거죠. 전문가들은 직원이 아무리 괘씸하다고 해도 동전 더미를 떠안기는 것은 문제라고 지적합니다.손석한신경정신과 전문의  10원짜리의 상징성입니다. 10원짜리는 분명히 화폐가치가 있지만 잘 사용되지 않고요. 굉장히 모욕감을 줄 수가 있는 상대방의 수준을 상당히 낮게 보고 무시할 수 있는.업주가 오죽하면 그랬겠냐는 의견이 없는건 아니지만 종업원에게 동전 떠안기기는 인간에 대한 예우에서 벗어난 행동이라는 지적입니다
'비 새고 갈라지고…' 하청 압력에 멍든 국민체육센터	http://news.naver.com/main/read.nhn?mode=LSD&mid=shm&sid1=102&oid=214&aid=0000512407	건설면허도 없는 특정업체 공사를 맡기라고 압력을 넣고 공사가 끝나지도 않았는데 준공허가를 내주고. 한 지자체 공무원들이 세금 118억 원을 들여 체육센터를 지으며 벌인 일들입니다.건물이 제대로 지어졌을 리가 없겠죠. 리포트 경기도 양주 국민체육센터의 개관 당시 모습입니다. 건물 천장 내부에 물방울이 잔뜩 맺혀 있고 벽에서는 물이 흘러내립니다.지반은 무너져 한 눈에도 위험해 보이고 외벽 마감재는 떨어지기 직전입니다.  2013년 문을 열 때부터 부실시공 논란에 휩싸여 있었습니다.경찰이 수사해보니 부실시공에는 이유가 있었습니다.당시 양주시 남모 국장은 무면허 업자인 조모씨에게 하도급을 주라고 시공사에 압력을 가했습니다.조씨는 이렇게 따낸 공사를 다른 업체에 재하청을 줬고 이 과정에서 공사기간은 두 달 가까이 늘어났습니다.공사가 늦어져 준공날짜를 못 맞췄는데도 양주시 공무원들은 계약상의 공기를 맞춘 것처럼 서류를 꾸며 준공승인까지 내줬습니다.정덕길경기경찰청 지능수사대 팀장공무원은 무자격 업자한테 공사를 주도록 압력을 행사했고 무자격업자는 다시 다른 업자에게 공사를 하게 함으로써 부실공사로 이어진 것으로 판단됩니다
