거래소 지주사 전환, 코스닥 분리…뜻대로 될까	http://news.naver.com/main/read.nhn?mode=LSD&mid=shm&sid1=101&oid=469&aid=0000073118	금융위 거래소 개혁안 확정지주사 전환 기업공개  상장부작용 우려해 반대도 만만찮아특정 지역 위해 추진 등 논란  한국거래소 아래 코스피코스닥파생상품 등 각 시장이 이르면 내년에 독립법인 형태로 분리된다. 거래소는 이 법인들을 아우르는 지주회사로 재편되고 이 거래소 지주회사는 기업공개IPO 후 증시에 상장된다.  금융당국은 IPO를 활성화하고 거래소 경쟁력을 강화하기 위해 이런 체제 개편을 추진한다고 밝혔지만 부작용을 우려하는 반대 여론도 만만찮아 추진 과정이 순탄치만은 않을 것으로 보인다.  코스닥 분리거래소 지주회사화 2일 금융위원회는 제6차 금융개혁회의를 거쳐 거래소 시장 경쟁력 강화 방안을 확정했다. 이 안에 따르면 거래소는 한국거래소지주가칭라는 이름의 지주회사 구조로 전환된다. 새로 생기는 거래소 지주회사 아래 코스피 거래소 코스닥 거래소 파생상품 거래소 코스콤 비영리 시장감시법인 예탁결제원 등이 자회사 형태로 설치된다. 지금은 거래소라는 단일 법인 아래에 코스피코스닥파생상품 부문이 본부 형태로 배치되어 있다. 지주회사 체제 안에서 가장 두드러진 변화는 코스닥의 독립이다. 이 안에 따르면 코스닥은 코스피 법인과 완전히 분리되어 운영된다. 임종룡 금융위원장은 과거 코스닥이 거래소에 편입되었을 때 국제적 흐름은 시장 통합을 통해 정보통신IT 관련 투자 비용을 줄여보자는 것이었다면서 그러나 하나의 지붕 안에 섞여 있다 보니 경쟁이 없다는 문제가 발생했다고 지적했다. 금융위는 기업규모에 따라 상장 시장을 결정하던 관행을 버리고 코스닥 시장에도 대형 기업을 유치하는 등 경쟁을 강화할 계획이라고 밝혔다. 불공정거래를 감시하는 시장감시본부도 비영리 시장감시법인으로 분리된다. 그러나 시장감시업무는 공적 성격이 강하기 때문에 거래소 지주회사가 이 법인을 직접 통제하지는 않고 금융당국 등 공적 부문이 상당 부분 통제권을 가지게 된다. 예탁결제원 역시 거래소 지주회사에 편입되지만 주권을 독점 관리하는 업무의 특성상 공적인 통제를 받는다. 거래소 기업공개 차익은 사회환원 거래소의 지주회사 작업이 완료되면 곧바로 IPO가 추진된다. 지주회사가 시장에 상장되는 방식이다. 금융위 관계자는 회사가 상장되면 수익성을 위주로 하는 책임경영 문화가 정착되고 거래소의 해외 진출을 위한 자금 확보가 가능하다고 설명했다. 거래소를 IPO했을 때 생기는 상장차익은 공익기금을 조성하는 식으로 사회에 환원된다. 임 위원장은 상장차익은 독점 이익이 누적된 것인데 이를 모두 주주가 가져가는 것은 옳지 않다며 주주들과 상의해 처리방안을 마련하겠다고 밝혔다. 한국거래소의 주주는 증권사 선물회사 등 38개 금융회사다.  만만치 않은 반대여론  금융위가 거래소 조직을 근본부터 개혁하려는 이유는 부진한 상장 실적 때문이다. 현재 거래소가 상장업무를 독점하고 있는데 연간 상장 실적은 40여건에 불과하다. 코스피와 코스닥을 완전 분리시켜 상장 유치 경쟁을 시키겠다는 것이다.  그러나 상장 문턱을 낮췄을 때 발생하는 부작용을 우려하는 목소리가 높다. 한 업계 관계자는 예전에 코스닥 먹튀 기업 때문에 얼마나 많은 개미 투자자들이 눈물을 흘렸냐면서 혼탁한 시장을 어렵게 안정화시켰는데 왜 다시 예전으로 돌아가려는 건지 모르겠다고 지적했다. 벤처기업 거품기에 상장된 기업들의 퇴출로 피해를 본 소액주주가 188만명에 이르고 피해규모는 24조7000억원에 달한다는 조사도 있다. 전국사무금융노조와 거래소 노조는 이날 성명을 통해 금융위는 거래소 지주회사화를 관철하기 위해 IPO라는 미끼를 던졌다면서 금융위 안을 저지하기 위해 전면파업을 불사할 것이라고 했다. 일각에선 코스닥 분사가 결국 정치인이나 고위 공직자들의 자리 만들기를 위한 것 아니냐는 지적도 나온다.  국회 통과도 불확실 거래소를 지주회사로 만들기 위해서는 자본시장법을 개정해야 한다. 금융위는 9월 정기국회에서 개정안을 통과시켜 내년에 각 시장 분할 법인을 출범시키고 거래소 IPO를 실시하겠다는 계획이다.  그러나 국회가 내년 4월 총선을 앞두고 올해 말부터 사실상 총선체제로 들어가는 것을 감안하면 국회 통과를 낙관하기는 어렵다. 더구나 소관 상임위인 정무위원회 소속 야당 의원들의 견제도 넘어야 할 장벽이다. 새정치민주연합 김기식 의원은 이날 논평을 내고 상장된 특정 민간기업거래소에 공적 기능을 갖는 예탁결제원과 시장감시법인 등이 예속되는 것은 부당하다며 이들 조직은 거래소로부터 완전 독립돼야 한다고 밝혔다. 정무위 소속 또다른 의원실 관계자도 거래소의 경쟁력 강화와는 관련이 없고 특정지역부산을 위해서 추진되는 것이라서 쉽게 동의해 주기는 어렵다고 말했다
지원금 대신 20% 요금할인, 100만명이 선택했다	http://news.naver.com/main/read.nhn?mode=LSD&mid=shm&sid1=105&oid=008&aid=0003500445	최광 기자 지원금에 상응하는 요금할인 일평균 1만2213명 가입본문 이미지 영역지원금에 상응하는 요금할인 가입자 추이 자료미래창조과학부휴대폰을 구매할 때 지원금 대신 20의 요금할인을 받는 지원금에 상응하는 요금할인요금할인 가입자가 100만명을 돌파했다.미래창조과학부는 지난 4월 할인율을 12에서 20로 상향 조정한 후 가입자가 급증해 지난 6월30일 기준 100만6324명을 기록했다고 2일 밝혔다. 4월24일 이후 요금할인을 선택한 가입자는 일평균 1만2213명이었다.지원금에 상응하는 요금할인은 2014년 10월 이동통신 단말장치 유통구조 개선에 관한 법률단말기유통법 시행과 함께 지원금을 받지 않은 중고폰이나 자급제폰 구매자 약정 기간이 끝난 구형 단말기 이용자를 위해 도입됐다. 지원금 대신 1년이나 2년 약정을 하면서 통신요금의 12를 할인해주기로 한 것이다. 하지만 요금할인 폭이 크지 않고 최신 휴대폰을 구매하면서도 요금할인을 선택할 수 있다는 사실이 알려지지 않아 6개월이 다 되도록 이용자는 17만5873명에 그쳤다.지원금에 상응하는 요금할인율이 4월24일 12에서 20로 상향되면서 요금할인을 선택하는 이용자가 급증하기 시작했다. 요금할인율이 20로 상햔된 3일간요금할인을 선택한 1만6930명에 달했고 그 뒤 일주일 동안은 12 요금할인 기간인 6개월보다 많은 18만3394명이 20 요금할인을 선택했다. 미래부는 지원금에 상응하는 요금할인 12를 적용받는 가입자 중 절반 가량이 20 전환을 하지 않자 요금할인 전환 마감을 당초 6월30일에서 7월31일로 1달 연장했다
미국 실업률 5.3%…7년여만에 최저	http://news.naver.com/main/read.nhn?mode=LSD&mid=shm&sid1=101&oid=001&aid=0007702661	일자리 증가량 22만3천개로 감소 노동시장 참여율은 38년만에 최저    워싱턴 김세진 특파원  미국의 실업률이 한 달 만에 다시 하락하며 최근 7년여 동안 최저 수준을 기록했다.    새 일자리도 호조와 부진을 구분한다고 여겨지는 20만 개 이상 늘어났지만 한 달 전보다는 증가 폭이 둔화됐다.    미국 노동부는 지난 6월 실업률이 5.3로 하락했고 같은 달의 비농업부문 신규고용 증가량은 22만3천 개였다고 발표했다.    월간 실업률은 2008년 4월 이후 최저치였다.    금융시장 전문가들은 지난달 실업률을 5.4로 비농업부문 신규고용 증가량을 약 23만3천 개로 각각 예상했다.    지난 5월의 비농업부문 신규고용 증가량은 당초 발표됐던 28만 개에서 25만4천 개로 수정됐지만 두 달 연속 20만 개 이상을 유지했다.    전문 사무직과 소매유통 업종이 새 일자리 증가를 주도했지만 광업 분야의 일자리는 한 달 전보다 4천 개 감소했다.    이달 발표된 미국의 고용 지표 중에는 부정적인 대목도 있었다.    노동시장 참여율은 62. 이는 1977년 10월 이후 약 38년 만에 가장 낮은 수준이다.    일부 전문가들은 실업률의 감소가 기본적으로는 일자리 증가 때문이라면서도 점점 하향 곡선을 그리는 노동시장 참여율도 실업률 감소에 영향을 줬을 수 있다고 설명했다.    지난달 시간당 평균 근로소득 역시 한 달 전과 같은 24.96달러로 발표됐던 지난 5월의 시간당 임금 역시 24.    전년 같은 달보다 시간당 임금 증가율도 2.    전문가들은 지난달의 고용지표들에 대해 완만하지만 지속적인 고용 개선이라는 최근의 흐름이 유지되고 있다고 평가했다.    그러나 노동시장 참여율의 감소와 맞물린 임금 증가의 둔화는 최근 관측된 소비 경기의 회복 조짐에 걸림돌이 될 수 있다고 전문가들은 우려했다.    미국 중앙은행인 연방준비제도의 재닛 옐런 의장은 지난달 17일 기자회견에서 미국 경제의 전반적 상황에 대해 분명히 진전이 이뤄졌지만 더 개선될 여지도 있다고 말했다.    이날 함께 발표된 주간 신규 실업수당 청구 건수는 28만1천 건으로 한 주 전보다 1만 건 증가했지만 호조와 부진의 기준선으로 여겨지는 30만 건을 17주 연속 밑돌았다
美 총기난사 늘어나는데…총기 규제 목소리는 줄어들어	http://news.naver.com/main/read.nhn?mode=LSD&mid=shm&sid1=104&oid=469&aid=0000073085	세계는 지금액티브 슈터 사회문제로 20072013년엔 16.4회로 늘어 국민 반짝 관심도 한몫 사건 날 때만 목소리 높이고 사건 발생 후 총기 구입 급증가장 큰 걸림돌은  총기협회 오바마도 협회의 영향력 언급미국에서 총기규제 논란이 다시 불붙고 있다. 사우스캐롤라이나주 찰스턴 흑인교회에서 지난달 18일 발생한 총기난사 사건이 도화선이 됐다. 미국 언론들은 백인우월주의자인 범인의 행적을 조명하는 동시에 약물중독자였던 그가 총을 손에 쉽게 넣을 수 있었다며 총기규제의 허술함을 지적했다. 버락 오바마 미국 대통령도 사건 후 연설에서 다른 사람을 해치겠다는 마음을 먹은 누구라도 아무런 제약 없이 총을 살 수 있어 무고한 희생자들이 다시 한 번 생겼다며 다른 선진국에선 우리처럼 이런 사건이 빈번히 일어나지 않는다고 총기규제 필요성을 강조했다.  민주당 유력 대통령 후보인 힐러리 클린턴 전 국무장관도 지난달 20일 책임감 있는 총기소유자들은 존중하지만 범죄자나 정신이 극도로 불안정한 사람들이 총기를 갖지 못하도록 상식적인 총기 개혁을 추진해야 한다고 강경한 어조로 밝혔다.  잇따른 총기난사 참사 미국에서 총기소유는 전반적으로 줄어드는 추세지만 여전히 미국 가정 3분의 1이 총을 갖고 있다. 워싱턴포스트WP에 따르면 지난해 미국 총기소유 가정은 전체의 31였다. 인종 별로 백인41 히스패닉20 흑인19 순으로 많았다. 시골51이 도시25의 2배였으며 총기소유자의 연령은 50세 이상이 대부분80을 차지했다. 총기소유자 거주 지역은 남부38가 가장 많아 종합하면 미국에서도 남부 시골에 거주하는 백인 노인들이 총기를 소유할 가능성이 높았다.   미국 의회조사국이 2013년 발간한 보고서에 따르면 미국에선 1982년부터 지난해 5월까지 30년 동안 최소 4명 이상 사망한 공공장소 총기난사 사건이 78건 있었고 이 사건으로 547명이 사망했다.   이중에서도 액티브 슈터가 사회문제로 떠오르고 있다. 미국 사법당국은 주로 개인 단독 범행으로 사람이 붐비는 장소에서 화기를 이용해 무차별하게 사람들을 죽이거나 죽이려고 시도하는 살인사건 유형을 액티브 슈터로 정의하고 있다. 뉴욕경찰국NYPD의 통계에 따르면 범인은 경찰에 의해 사살47되거나 자살40하는 게 대부분이다. 미국 콜럼바인고교 버지니아 공대 샌디훅초교에서 발생했던 총기난사 사건이 이에 해당한다. 지난해 미국연방수사국FBI이 발표한 액티브 슈터 관련된 보고서에 따르면 이런 종류의 총기난사 사건은 20002006년 연평균 6.4회 발생했지만 20072013년에는 연평균 16.  총과 정치  총기규제 강화의 필요성은 분명히 커지고 있지만 막상 오랜 전통으로 굳어진 총기소유권을 제한하려면 여러모로 정치적 희생이 뒤따른다. 오바마 대통령이 총기법 개혁의 모범 사례로 꼽는 호주도 엄청난 저항에 맞닥뜨려야 했다.  호주 총기법 개혁의 발단이 된 사건은 호주 역사상 최악의 총기난사 참사인 포트 아서 사건이다. 정신분열증을 앓던 마틴 브라이언트란 청년은 1996년 유명 휴양지인 포트 아서에서 무차별 총격을 가해 관광객 등 35명이 숨지고 23명이 다쳤다. 당시 보수연립 정부를 이끌던 존 하워드 총리는 사건 발생 12일 만에 총기법 개혁안을 발표했다. 이에 따라 연발이 가능한 총기류는 금지되고 나머지 총기류는 전국적인 단일 기준에 따라 등록됐다. 총기소유 면허는 엄격해졌고 정부는 두 차례에 걸쳐 전국에서 약 60만정에 달하는 총기를 다시 사들여 이를 모두 폐기처분 했다. 불법 무기류에 대한 자진신고와 사면조치도 더해졌다. 총기소유 옹호론자들의 저항은 상상 이상이었다. 멜버른에 있었던 총기소유제한 반대 집회에는 7만명이 모여 베트남전 반전시위 이후 최대규모를 기록했다. 게다가 보수당의 표밭인 농촌지역에서 저항이 강력했다. 지지층의 반대를 무릅쓰고 끝까지 밀어붙인 총리의 결단과 정치력이 없었다면 개혁은 불가능한 일이었다.    반면 미국은 총기난사의 비극이 잇따르고 있는데도 총기규제론은 별 호응을 받지 못하고 있다. 갤럽의 설문조사 결과에 따르면 총기규제법을 강화해야 한다고 생각하는 미국인들은 1990년 이후로 꾸준히 감소하고 있다. 지난해 설문조사에선 응답자의 47만이 총기판매 제한을 포함하는 총기규제법 강화가 필요하다고 답했다. 전년도49와 비슷한 수준으로 샌디훅초교 총기난사 사건 직후인 2012년58 급상승한 것을 제외하고는 최근 5년 동안 이 수준을 유지해 왔다. 응답자의 38는 규제를 지금 상태로 유지해야 한다고 생각했고 14는 지금보다 완화해야 한다고 주장했다.  WP는 지난달 27일 총기난사 사건 발생 장소에서 총기소유를 옹호하는 공화당 득표율이 떨어지는 경향을 보인다는 연구 결과를 보도했다. 하지만 코네티컷 주정부에 따르면 지난해 치러진 주지사 선거에서 공화당 후보 톰 폴리의 득표율이 2012년 발생한 코네티컷주 뉴타운 샌디훅초교 총기난사 사건 이전인 2010년 주지사 선거보다 169개 타운에 걸쳐 평균 0.16포인트 떨어져 큰 차이가 없었다. 단지 샌디훅초교가 위치한 뉴타운에선 7.65포인트로 눈에 띄게 떨어졌을 뿐이다. 2010년과 2014년 주지사 선거에선 모두 같은 후보가 경쟁을 벌였다. 이번엔 NRA 벽 넘을까 오바마 대통령은 총기난사 사건과 악연이 깊다. 오바마 대통령 임기 내내 군 기지 영화관 초등학교 교회를 가리지 않고 발생한 총기난사 사건으로 대규모 인명피해를 냈다. 오바마 대통령의 재임 6년 동안 2009년 11월 포트 후드부터 최근 찰스턴 흑인교회까지 공식 석상에서 총기난사 사건과 관련해 열 두 차례 이상 언급했다. 오바마 대통령도 찰스턴 흑인교회 총기난사 사건과 관련해 나는 이미 너무 많이 이와 같은 비극과 관련해 말했다고 회고했다. 오바마 대통령에게 두 번째 임기 시작과 동시에 첫 쓰라린 정치적 패배를 맛보게 한 것도 총기규제법이다. 2년 전 민주당 소속 조 맨신 상원의원과 공화당 소속 팻 투미 상원의원이 총기거래자에 대한 예외 없는 신원전과조회를 골자로 한 초당적 포괄 법안을 내놓았지만 상원 문턱을 넘지 못했다. 당시 미국 언론들은 오바마 대통령의 패배이자 미국총기협회NRA의 승리로 평가했다.  미국 총기규제법 강화의 가장 큰 걸림돌은 NRA다. NRA는 미국의 어떤 이익단체보다도 막강한 조직과 자금력을 갖추고 있다. 2001년 5월에는 포천이 선정한 미국에서 가장 영향력 있는 이익단체 1위에 이름을 올렸다. 가디언에 따르면 NRA는 지난해 로비에만 300만달러를 쓰고 2800만달러를 대외지출에 쏟아 붓는 미국 최고의 정치자금원이다. NRA는 총기규제법 강화의 움직임이 있을 때마다 총기소유의 정당성과 필요성을 역설했다. 이들은 무기 소장과 휴대의 권리를 규정한 미국 수정 헌법 제2조를 총기소유의 정당성과 연결시킨다. 이를 두고 총기소유 반대론자들은 개인이 아니라 무장이 필요한 군대에만 해당하는 권리라고 해석하고 있지만 앞선 판결들에서 법원은 총기소유 옹호론자의 손을 들어줘 왔다.  정당방위를 위해서 총기소유가 필요하다는 논리도 옹호론자들의 주장을 뒷받침 하고 있다. 웨인 라피에르 NRA 부회장이 샌디훅초교 총기난사 사건 이후 여론이 악화하자 총을 든 나쁜 사람을 막는 단 한 가지 방법은 총을 든 좋은 사람이라고 항변했다.  총기소유 반대론자들은 통계를 들어 이를 반박한다. 미국 폭력방지정책센터VPC가 FBI와 법무부 통계국 자료를 바탕으로 분석한 결과에 따르면 2012년 민간인들이 총기로 살인을 저지른 경우는 8342건이었지만 정당방위 차원에서 총기 살인을 한 경우는 258건에 그쳤다. 급박한 상황에서 정당방위로 인한 살인이 1건 발생할 때 총기를 이용한 살인은 32건이나 발생하는 것이다. 또 총기로 인한 자살과 우발적 총격사건이 매년 2만2000건씩 발생하는 것으로 나타났다. NRA의 주장과는 다르게 총이 안전보다는 피를 부른다고 통계는 말하고 있다.   미국이 총기규제법 강화를 추진하려면 NRA와 국민들의 반짝 관심을 극복해야만 한다. 총기규제법 강화 전망이 밝지 않은 이유다.     오바마 대통령도 찰스턴 흑인교회 총기난사 사건 이후 미국 코미디언 마크 마론의 팟캐스트에 출연해 나는 의회가 어떤 입법적 조치를 취할 것이라고 생각하지 않는다며 또 미국인들이 일련의 총기난사 사건들에 대해 이건 정상이 아니다 우린 무언가를 바꿀 수 있다고 자각하고 심각성을 느낄 때까지는 어떤 현실적인 조치도 없을 것이라고 짐작한다고 회의적인 시각을 보였다. 오바마 대통령은 특히 총기난사 사건 이후 총기구매가 급증하는 것과 강력한 로비 그룹인 NRA가 의회에 막강한 영향력을 미치고 있는 현실이 애석하다고 했다고 가디언은 최근 전했다.    송옥진기자 clickhankookilbo
이종걸 당무복귀…문재인 "소통하겠다"	http://news.naver.com/main/read.nhn?mode=LSD&mid=shm&sid1=100&oid=001&aid=0007702709	당 통합이 가장 중요소통 부족에 공감     조성흠 임형섭 서혜림 기자  새정치민주연합 이종걸 원내대표가 3일 최고위원회의에 참석하고 당무에 복귀하기로 했고 문재인 대표는 당무 운영 전반에 대해 원만한 소통을 약속했다.    문 대표와 이 원내대표는 2일 문 대표의 당직인선을 계기로 불거진 당내 갈등과 관련해 서울 시내 모처에서 심야 회동을 통해 이 같은 내용에 합의했다고 김성수 대변인이 서면 브리핑을 통해 밝혔다.    이로써 이 원내대표는 지난달 24일 최고위원회의에 불참한 지 열흘째만에 정상적으로 당무를 수행하게 됐다.    양측은 또한 당무 전반에 대해 격의없는 의견을 교환하고 당의 통합이 가장 중요한 과제라는 데 인식을 같이 했다.    또한 일부 당직 인선에 관해 소통이 부족했다는 점에 공감했으며 문 대표는 당직 인선 등 당무 운영 전반에 대해 원내대표 및 최고위원들과 원만히 소통하기로 했다고 김 대변인이 전했다.    김 대변인은 정책위의장 인선 등 문제에 대해서는 정해진 바가 없다고 설명했다.    이와 관련해 문 대표측은 어떤 이야기가 있었는지 모르나 당직인선 등 당무운영 전반에 관해 원만히 소통하기로 했다고 이 원내대표측은 논의된 바 없다고 밝혔다.    이 원내대표는 1시간여의 회동 이후 기자들과 만나 일부 당직인선에 대해 소통이 부족했다는 점에 대해 문 대표가 공감했다며 앞으로 당직인선을 포함해 모든 당무에 대해 깊은 소통을 통해 같이 공감하는 정치를 하기로 했다고 밝혔다.    문 대표는 기자들의 질문에 대답하지 않은 채 곧바로 자리를 떴다
