5년?10년? 면세점 관련법 개정 '봇물'…"어느 장단에 맞추나"	http://news.naver.com/main/read.nhn?mode=LSD&mid=shm&sid1=101&oid=421&aid=0001750084	특허 수수료 인상 리베이트 금지 등 개정안 줄줄이 발의서울 류정민 기자  두산과 신세계에 승리를 안긴 현행 면세점 특허제도에 거센 후폭풍이 몰아닥치고 있다. 특히 정치권의 관세법 개정안 발의가 이어지면서 또 다시 대대적인 제도 개편을 예고하고 있다. 23일 국회와 면세점 업계에 따르면 현재 논의 중인 관세법 개정안의 주요 내용은 현행 5년인 특허 기간 연장 특허 수수료 인상 리베이트 관행 개선 등 크게 3가지로 압축된다.5년마다 사업자를 재선정하도록 한 현행 심사 방식은 기업들의 투자를 위축시킬 수 있다는 문제점이 제기되고 있다. 특허 수수료 인상은 황금알을 낳는 거위로 불리는 면세점에서 거둬들이는 기업의 이익을 국민들에게 더 돌려주자는 취지다. 리베이트 관행 개선은 면세점이 모객을 대가로 여행사에 지급하는 리베이트가 저가저질 여행의 한 원인으로 지목되면서 개선의 필요성이 제기되고 있는데 따른 것이다.  5년마다 바뀌는 특허 주인고용불안수천억 투자도 공염불지난 14일 특허 심사결과 롯데면세점 월드타워점과 SK네트웍스의 워커힐점이 문을 닫게 되면서 우선 제기된 문제점은 고용불안과 투자위축이다. 롯데면세점 월드타워점은 이번 특허 수성 실패로 직간접 고용인원 1300명이 당장 갈 곳이 막막해졌다. 워커힐 면세점도 소속인원 200명 파견 700명 등 900명에 달하는 직원들이 일터를 옮겨야 하는 처지에 놓였다.롯데면세점은 길 건너편 잠실 롯데백화점에서 월드타워몰 에비뉴엘동으로 면세점을 옮기는데 총 3000억원을 이전 비용으로 들였지만 특허 획득에 실패하며 투자금을 고스란히 날릴 처지에 놓였다. SK네트웍스는 연말까지 1000억원을 투자한 워커힐점 리뉴얼을 채 마치기도 전에 특허권을 빼앗겼다.  신규 오픈하는 면세점들에게도 5년 이라는 시간은 성과를 보여주기에는 상당히 촉박한 시간이다.다음달 24일과 28일 각각 오픈 예정인 서울 용산의 HDC신라면세점과 여의도 한화갤러리아타임월드 63빌딩 면세점은 명품 빅3로 불리는 샤넬 루이뷔통 에르메스 없이 오픈한다. 매장 입점 협의에만 6개월에서 1년 입점 합의 계약후 매장 디자인을 꾸미는 데에만 1년이 걸릴 만큼 명품 유치는 상당기간 공을 들여야 하는 작업이지만 준비기간은 6개월 사업기간은 5년에 불과하다. 호텔신라와 현대산업개발이 지분 절반식을 투자한 HDC신라면세점은 올해에만 3500억원 매장 오픈에 투자한다. 한화의 경우 2000억원을 들여 면세점 개장을 준비하고 있다.업계의 한 관계자는 신규 면세점 입장에서도 5년이라는 기간은 성과를 보여주기에는 너무 촉박하다며 당장 6개월의 준비기간도 모객을 좌우할 명품 브랜드 유치에는 턱없이 부족하다고 말했다. 상황이 이렇다보니 면세점 업계의 정치권을 향한 원망의 목소리는 그 어느때보다 높다. 업계의 또 다른 관계자는 의원들은 법안을 발의하면 그만이지만 기업은 바뀌는 제도로 인한 피해를 고스란히 떠안게 된다며 중국인 관광객에 힘입어 우리나라 면세점 시장이 세계 최대 규모까지 성장했지만 앞으로는 하향 평준화의 부작용으로 주도권을 이웃 중국이나 일본에 내 줄 수 있다고 우려했다. 이렇다보니 특허기간을 다시 10년으로 되돌리려는 움직임이 나타나고 있다. 심재철 새누리당 의원은 현재 5년으로 제한돼 있는 사업권을 10년으로 재조정하는 관세법 개정안 발의를 검토 중이다. 김관영 새정치연합 의원은 지난 9월 특허수수료를 최고가로 제시하는 기업에 사업권을 주는 최고가 입찰제 방식의 개정안을 발의했다. 그러나 업계의 반응은 여전히 싸늘하다.한 대기업 면세점 관계자는 면세점은 외국인 관광객을 주요 타깃으로 이웃국가 해외 면세점들과 경쟁하는 산업이지만 우리나라는 독과점과 중소중견과의 상생을 잣대로 시장 구조를 인위적으로 재단하고 있다며 솔직히 의원들이 면세산업을 제대로 이해를 하고 법안을 발의했는지 의구심이 든다고 푸념했다. 특허 수수료 인상 리베이트 관행 금지 내용 개정안 집중면세산업에 대한 국회 의원들의 관심도는 매우 높은 편이다. 면세점은 정부가 세금 징수를 포기한 면세품을 파는 일종의 특권을 주는 사업인만큼 관여할 명분이 충분하다고 판단하고 있기 때문이다.  이번에 마무리된 특허전을 전후해서는 특허 수수료를 높이고 리베이트 관행을 개선하는 내용의 개정안이 집중되고 있다.  홍종학 새정치민주연합 의원은 지난달 8일 대기업 면세점 매출액의 5 중소기업은 1를 특허수수료로 내도록 하는 관세법 개정안을 대표발의했다. 면세점이 고객 유치를 위해 여행사에 제공하는 리베이트를 금지토록 하고 이를 어기다 적발되면 2년 이하의 징역 또는 5000만원 이하의 벌금에 처하도록 하는 내용도 담고 있다.관세청에 따르면 롯데 신라 SK 신세계 등 4개 대기업이 시내 면세점에 외국인 고객을 유치하기 위해 지난해 여행사에 제공한 리베이트는 시내면세점 매출 5조790억원의 10.  리베이트는 중국인관광객유커 유치를 위해 출혈 경쟁을 벌이고 있는 국내 인바운드 여행사의 주 수입원이다. 저가 상품 판매로 인한 금전적 손해를 리베이트를 통해 충당하는 방식이다. 하지만 이는 곧 국내 여행상품의 질적 저하와 함께 한국에 대해 좋지 않은 이미지를 갖게 하는 원인으로 지목받는다. 여행업계의 한 관계자는 입장료가 무료이거나 저렴한 지역으로만 여행일정을 짜고 면세점을 포함한 쇼핑시설에 하루에 몇 차례씩 들르는 것은 이 같은 리베이트 관행이 주원인이라고 주장했다.    홍 의원은 정부는 대기업이 면세점 운영에 있어 경쟁력을 갖고 있다고 항변하지만 이는 수천억원의 리베이트에서 나오는 것이라며 리베이트의 전면 금지를 주장하고 있다. 그러나 업계에서는 리베이트 마저 사라지게 되면 당장 관광산업에 적지 않은 혼란이 발생할 수 있다고 우려한다. 여행업계의 한 관계자는 리베이트에 기대 여행업계가 출혈경쟁을 벌이고는 있지만 저질 여행의 근본적인 원인은 아니지 않느냐며 리베이트를 금지하면 영세한 여행사들 중 문을 닫는 곳이 속출 할 것이라고 주장했다.이연택 한양대학교 관광학부 교수는 매출의 일정 비율만 받도록 법으로 정해 여행사는 물론 면세점간 과당경쟁을 막는 방법도 고민해 볼 필요가 있다고 말했다. 이밖에 류성걸 새누리당 의원이 지난 17일 대표 발의한 개정안은 매출의 1만 분의 5를 내도록 하고 있는 특허 수수료를 대기업은 100분의 5 중소중견기업은 100분의 1의 범위에서 관광진흥기여금으로 납부하도록 하고 있다. 업계의 한 관계자는 면세점과 관련해 일부 기업이 많은 이윤을 얻는 것은 어느 정도 인정하지만 시장의 자율적인 기능을 지나치게 억제하는 측면도 있다며 지나친 규제는 면세점 산업의 동반 몰락을 불러올 수 있다고 우려했다
수익 악화·사업 중단…난파선된 '空空기관'	http://news.naver.com/main/read.nhn?mode=LSD&mid=shm&sid1=101&oid=022&aid=0002960353	총선 앞두고 기관장 공백 속출내년 총선이 다가오면서 기관장 자리가 비는 공공기관들이 속출하고 있다. 이들 기관은 비상대행체제를 가동하고 있으나 파행적인 경영 공백을 메우기는 역부족이다. 직원들은 내년도 사업계획이나 경영목표 등에 공을 들이기보다는 낙하산으로 꽂힐 후임자에 촉각을 곤두세우고 있다. 경영부실에 따른 피해는 국민부담으로 고스란히 전가되기 마련이다. 23일 공공기관들에 따르면 수장 공백 장기화로 직격탄을 맞은 곳은 산업통상자원부 산하의 시장형 에너지 공기업들이다.현재 사장 임기가 끝났거나 사장이 없는 곳은 한국석유공사와 한국광물자원공사중부발전남부발전동서발전 등 5곳이고 한국전력12월16일도 사장 임기 만료를 앞두고 있다. 이중 한국광물자원공사와 중부발전은 지난 6월 경영평가 최하등급 등 이유로 남부발전은 내부비리 등 이유로 사장이 사퇴한 뒤 공석이다. 석유공사의 경우 사장 임기가 지난 8월 끝났지만 후임자 선정이 안 돼 전임 사장이 계속 자리를 지키고 있어 식물 사장이라는 지적을 받고 있다. 지난 7일 사장 임기가 끝난 동서발전도 사정이 비슷하다. 상황이 이렇다 보니 수익성은 악화일로다. 석유공사의 경우 상반기 매출액 1조5229억원을 기록해 전년 대비 32 감소했고 영업이익은 지난해보다 5160억원이 감소한 1189억원의 적자를 기록했다.일각에서는 에너지 공기업들의 기관장 후속 인사가 총선 낙마자를 배려하기 위해 늦춰지고 있는 것 아니냐는 의혹까지 불거지고 있다. 한 에너지공기업 관계자는 공천 탈락자를 배려하기 위해 기관장 인사를 늦추고 있다는 얘기가 정설처럼 퍼져 있다며 책임지는 수장이 없는 회사 사업이 잘 될 리 없지만 낙하산 인사가 수장이 되는 것도 고질적인 문제라고 지적했다.6월 이후 경영 공백 상태가 이어지고 있는 한국시설안전공단은 그간 새롭게 조직을 만들거나 신규 사업을 추진하는 것과 같은 중요 업무가 모두 중단됐다. 당장 내달 진행될 경남 진주혁신도시 이전도 차질이 빚어지고 있다. 일부만 진주로 이전하고 나머지는 경기 일산에서 업무를 진행하는 이원화 체제가 불가피한 지경이다.보건복지부 산하 국민연금관리공단은 최광 전 이사장이 인사파동으로 물러난 직후 기획이사가 직무대행 체제로 운영 중이다. 내부적으로 비상경영체제가 가동되고 있지만 회사 분위기는 어수선하기 짝이 없다. 내년에 500조원에 달하는 기금의 투자 방향 설정 등 해야 할 일이 수두룩한데 기관장 공석으로 업무차질이 빚어지고 있다. 공단 관계자는 올해 서울에서 전주로 본사를 옮겨왔는데 직원들이 서울 출장도 쉽게 못 가는 분위기라며 연말 송년회도 제대로 못 할 정도라고 귀띔했다.미래창조과학부 산하 한국원자력의학원은 지난 8월 조철구 원장의 사퇴 후 최창운 방사선의학연구소장이 의학원을 노우철 진료부장이 원자력병원을 각각 이끄는 직무대행 체제가 이어지고 있다. 그럼에도 차기 원장 선출은 여태껏 감감소식이다. 조 전 원장이 수년째 지속된 병원 적자와 경영 정상화 추진을 둘러싸고 내외부와 마찰을 빚다 끝내 사퇴한 마당에 이런 위기를 해결할 차기 원장 선임은 난항을 겪을 수밖에 없고 그만큼 기관장 공백이 길어지고 있다는 게 의학원 안팎의 전언이다.보건복지부 산하의 보건의료인국가시험원은 올해 말 재단법인에서 법령에 의한 특수법인으로 변경돼 지난 7월 말 전임 원장 퇴임 이후 임기 4개월짜리 원장을 뽑을 수 없어 인사가 늦어지고 있다. 여성가족부 산하의 한국청소년활동진흥원은 김선동 이사장이 총선 출마를 위해 이달 초 사퇴하자 대책 마련에 부심하고 있다.기관장의 총선 출마설이 도는 공공기관 직원들도 동요하고 있다. 기관장이 출마를 결심할 경우 공직자 사퇴시한인 내년 1월 14일 이전에 기관장 공백 사태가 벌어질 수 있기 때문이다. 출마설이 나오는 국토교통부 산하 A기관의 한 직원은 기관장도 우리도 그 문제에 대해서는 서로 묻지도 답하지도 않는 분위기라고 전했다
거침없는 중저가폰 돌풍 '왕좌' 누가 이어받을까	http://news.naver.com/main/read.nhn?mode=LSD&mid=shm&sid1=105&oid=014&aid=0003547509	하반기 나온 LG 클래스 하루 3000대 팔리면서 다크호스로 떠올라갤럭시그랜드맥스 이어 갤럭시센스도 인기올해 삼성전자의 갤럭시그랜드맥스가 국내 중저가폰 시장의 최대 판매량을 기록하며 중저가폰 돌풍을 이끌어 온 가운데 연말을 맞아 본격적인 중저가폰 세대교체가 시작되고 있다. 하반기 출시된 LG전자의 메탈폰 LG 클래스는 하루에 3000대 가량 팔려나가며 새로운 중저가폰 시장의 다크호스로 주목받고 있으며 갤럭시센스갤럭시J5 역시 4000대 가량 팔려나가며 갤럭시그랜드맥스의 인기를 이어갈 후속작으로 주목받고있다.LG 클래스 LG클래스 하루 3000만대 팔려23일 관련업계와 아틀라스리서치에 따르면 갤럭시 센스와 LG 클래스가 나란히 11월 둘째주 스마트폰 판매량 9위와 10위를 차지하며 TOP10에 새롭게 진입했다. 갤럭시노트5와 아이폰6S등 다양한 프리미엄 신제품들과 함께 경쟁하며 나란히 TOP10의 자리를 차지한 것이다. 특히 LG클래스는 전 주에 비해 판매순위가 25단계나 오르는 기염을 토해냈다. 최근 공시지원금 확대효과가 판매량을 견인한 것이다.75인치 HD 디스플레이 전면 800만화소.후면 1300만 화소 카메라 등의 사양을 갖추고 있어 가성비가 좋다는 평가를 받고있다.LG전자 관계자는 11월 들어 LG클래스의 인기가 높아지면서 하루 20003000대 가량 팔려나가고 있다면서 메탈폰이면서 30만원대의 저렴한 가격이 인기를 끄는 요인이라고 설명했다.업계 관계자는 올 가을 인기를 끌었던 루나폰이 하루에 2000대 가량 팔렸는데 LG클래스의 인기도 이에 비등하다고 보면된다면서 루나폰과 같이 메탈폰이라서 느낌은 비슷하지만 루나폰보다 가격대가 저렴한 점이 강점으로 꼽히고 있어 향후 판매순위는 더욱 상승할 것이라고 내다봤다.루나폰은 최근 판매량 순위 안에는 들지 못했다.갤럭시센스갤럭시J5 갤럭시센스 그랜드맥스의 바통 이어라올 한해 단연 인기를 끌었던 중저가폰은 갤럭시그랜드맥스다. 갤럭시그랜드맥스는 올 한해동안 갤럭시S6 등의 출시에도 불구하고 판매순위 1위에 오르는 등 기염을 토해내며 중저가폰 전성시대를 이끌었다.이 제품의 뒤를 이어 삼성전자 중저가폰의 명성을 이어갈 제품으로 갤럭시 센스갤럭시J5가 꼽히고 있다. 이 제품의 출고가는 29만7000원이다.75인치 HD 슈퍼 아몰레드 디스플레이 1.5GB 램RAM 16GB 내장 메모리 2600mAh 배터리를 탑재했으며 지상파 디지털 멀티미디어방송DMB도 지원한다. 후면은 1300만 화소 전면은 500만 화소의 고화질 카메라와 전.후면 모두 LED 플래시를 탑재해 밤이나 어두운 곳에서도 밝고 또렷한 촬영이 가능하다.올 하반기 갤럭시 센스로 이름붙여 먼저 KT에서 먼저 판매를 시작한 갤럭시J5는 SK텔레콤 LG유플러스 알뜰폰MVNO 시장 등으로 유통 채널을 넓히면서 갤럭시그랜드 맥스의 자리를 이어 받았다
편의점 '묻지마' 출점경쟁…웃는 업계·우는 점주	http://news.naver.com/main/read.nhn?mode=LSD&mid=shm&sid1=101&oid=022&aid=0002960445	유통업계 중 나홀로 호황1인 가구 늘어 매년 10씩 성장빅3 점포만 올 2000개 이상 늘어제살 깎아먹는 점주들코앞에 경쟁점포 오픈 속수무책인건비도 못건져 온가족 총출동편의점이 나홀로 호황을 누리고 있다. 유통업계가 경기 침체로 고전하고 있는 것과 달리 편의점들은 매년 10 안팎의 성장세를 이어가고 있다. 1인 가구 비중이 늘면서 편의점에서 판매하는 대체식품 매출이 크게 증가한 것이 원인이다. 실제 편의점협회에 따르면 국내 편의점 도시락 김밥 등 쌀 가공식품 판매는 연간 3억7000만 개에 이른다. 하루 평균 100만명이 편의점에서 식사를 해결하는 셈이다. 올해 담뱃값 인상도 편의점 성장의 호재가 됐다. 담배는 편의점 매출의 3540를 점유한다. 담뱃값이 대폭 오르면서 영업이익에는 큰 차이가 없지만 매출액이 껑충 뛰었다. 그러나 점포수 증가에 따른 경쟁 심화로 점주들은 갈수록 상황이 악화하고 있다며 하소연하는 사례가 속출하고 있다.23일 업계에 따르면 GS25의 올해 3분기 누적 매출은 3조4098억원에 달했다. 지난 3분기 매출액만 1조2919억원 규모로 작년 같은 기간보다 36 증가했다. 영업이익은 618억원으로 43 급증했다. 씨유CU 편의점을 운영하는 BGF리테일의 올해 3분기 매출은 1조1881억원으로 작년 같은 기간보다 32. 3분기 누적 매출은 3조1509억원으로 28. 세븐일레븐의 3분기 누적 매출액과 영업이익은 각각 2조5107억원 460억원 규모였다. 각각 작년 대비 26. 이러한 실적 호조는 각 업체의 적극적인 점포 확대와도 맞물려 있다. CU 점포수는 작년 말 8408개에서 지난 9월 말 9142개로 734개 늘었다. GS25는 같은 기간 8290개에서 9045개로 점포를 755개 늘렸다.세븐일레븐도 7230개에서 7709개로 점포가 479곳 증가했다. 상위 업체 3곳의 점포수만 해도 올해 들어 약 2000 개가 늘어난 셈이다. 여기에 미니스톱 위드미신세계 등도 공격적인 점포 확장으로 시장공략에 나서고 있다. 편의점 업계의 호황에도 가맹점주들의 고통은 가중되고 있다. 업황 호조로 전체 매출은 늘었지만 출점 경쟁으로 점포수가 급증하면서 점주들의 걱정이 커지고 있다. 같은 업체 편의점은 일정 거리를 두게 돼 있지만 다른 편의점은 바로 옆에 문을 열어도 막을 방법이 없다. 서울에서 편의점을 운영하는 50대 점주는 올해로 6년째 편의점을 하는데 점포수가 너무 많아져 수익은 매년 줄어든다며 인건비를 줄이기 위해 매일 부부가 나와서 일하고 있다고 말했다
與, YS '정치적 유산 다툼'…野도 재평가 '끌어안기'	http://news.naver.com/main/read.nhn?mode=LSD&mid=shm&sid1=100&oid=469&aid=0000108754	변곡점 될 조문 정국김영삼 전 대통령이 서거한 22일 김무성오른쪽 새누리당 대표가 서울대병원에 마련된 빈소에서 김 전 대통령의 차남 현철씨와 대화를 나누고 있다. 사진공동취재단 김영삼YS 전 대통령 서거로 정치권이 사실상 휴전에 들어갔다. 하지만 새누리당 내 비박계와 친박계의 거두인 김무성 대표와 서청원 최고위원이 앞다퉈 YS의 정치적 장자를 자임하는 등 YS 유산 확보 경쟁이 벌써부터 치열하다. 새정치민주연합도 YS의 민주화 투쟁을 재조명하며 YS 끌어안기에 나섰다. YS 서거가 향후 정국에 어떠한 변곡점을 만들어낼지 주목된다. 김무성 vs 서청원 YS의 정치적 장자 경쟁 김 대표와 서 최고위원은 YS의 업적 추켜세우기에 경쟁적으로 나서고 있다. 김 대표는 23일 최고위원회의에서 김 전 대통령은 민주화를 이룩한 최대 공로자이자 문민개혁의 영웅으로 한국역사에 길이 남을 지도자라고 말했다. 서 최고위원도 고인의 리더십은 한마디로 용기와 결단이었다며 업적이 재조명 되길 바란다고 강조했다.  두 사람은 특히 빈소에서 보이지 않는 신경전을 펼치고 있다. 며칠 전까지만 해도 공천 룰 문제로 서로 얼굴을 붉혔던 김 대표와 서 최고위원이 YS의 차남 현철씨 옆에 나란히 서서 상주자리를 지키고 있는 것이다. 전날에도 YS의 서거 소식이 전해진 뒤 두 사람은 몇 분 차이로 앞서거니 뒤서거니 빈소를 찾았다.  정치권에서는 김 대표와 서 최고위원이 YS의 정치적 장자로 공인받기 위한 경쟁에 나섰다는 해석이 나온다. 두 사람은 같은 상도동계 출신이지만 김 대표는 비박계를 서 최고위원은 친박계를 대표하는 정치인으로 다른 길을 가고 있다. 당장은 YS의 서거로 여권 내 공천 룰 내분이 잠시 휴지기에 들어갔지만 친박계와 비박계의 정면충돌은 기정사실로 받아들여지고 있다. 한 여권 관계자는 공천 룰 다툼은 시작일 뿐 진짜 주도권 싸움은 차기 대선으로까지 이어지는 장기전이 될 수밖에 없다며 상도동계 주군의 정치적 유산을 누가 차지하는지에 따라 정국의 판도도 일정하게 달라질 가능성이 있다고 말했다.  상대적으로 보면 김 대표가 더 적극적이다. 그는 대부분의 일정을 취소한 채 빈소를 지키고 있다. 한 정치권 인사는 YS가 박정희 전 대통령과 줄곧 대척점에 서 있었던데다 YS가 발탁한 인사들의 상당수가 비박계라는 점과 무관치 않을 것이라며 김 대표가 명실상부한 비박계의 구심점으로 발돋움하겠다는 뜻이 아니겠느냐고 말했다.도 YS 끌어안기 정부 민주주의 후퇴 그간 YS에 대한 평가에 인색했던 야권에서도 재평가 움직임이 본격화하고 있다. 1990년 3당 합당 이전까지의 활동 뿐만 아니라 금융실명제 도입과 하나회 척결 518 특별법 제정 등 문민정부 당시의 각종 개혁들에 대해서도 적극적으로 인정하자는 것이다.  문재인 새정치연합 대표는 이날 김 전 대통령은 평생을 박정희전두환 군사독재와 맞서 싸운 민주투사였다면서 대통령 재임 당시에는 그 누구도 하지 못했을 과감한 개혁조치로 민주주의의 새 장을 열었던 위대한 지도자였다고 평가했다.  야권에서는 김대중 전 대통령과 함께 민주화운동을 주도한 YS를 당연히 야당의 자산으로 끌어안아야 한다는 기류가 강하다. 이는 고인에 대한 추모를 넘어 박근혜 대통령의 일방적인 국정운영으로 민주주의가 퇴행하고 있다는 상황인식과도 맞닿아 있다.  한 야권 인사는 민주주의에 헌신했던 YS의 업적으로 재조명하는 건 당연하다면서 닭의 목을 비틀어도 새벽은 온다던 그 말씀은 지금도 여전히 유효하다고 말했다.com왼쪽 위부터 시계방향으로 이희호 여사 이회창 전 국무총리 손학규 전 경기도지사 마크 리퍼트 주한 미국대사 박용만 대한상의 회장 이재용 삼성전자 부회장
'대통령 명예훼손' 산케이 前지국장 선고 내달로 연기	http://news.naver.com/main/read.nhn?mode=LSD&mid=shm&sid1=102&oid=001&aid=0008006426	가토 다쓰야 전 산케이신문 서울지국장  자료사진     임미나 기자  박근혜 대통령의 세월호 참사 당일 행적에 의혹을 제기해 명예훼손 혐의로 기소된 일본 산케이신문 가토 다쓰야49 전 서울지국장의 1심 재판 선고기일이 미뤄졌다.    23일 법원에 따르면 이 사건을 맡은 서울중앙지법 형사합의30부이동근 부장판사는 선고기일을 이달 26일 오후 2시에서 내달 17일 오후 2시로 변경했다.    법원 관계자는 재판부가 충분한 시간 여유를 갖고 증거관계와 법리적인 쟁점을 신중히 검토한 후 결론을 내리기 위해 선고기일을 연기했다. 기록 및 법리 검토 외국 판례 등을 심층 검토하는데 시간이 더 필요하다고 전했다.    가토 전 지국장은 지난해 8월 3일 박근혜 대통령 여객선 침몰 당일 행방불명누구와 만났을까라는 제목의 기사에서 세월호 참사 당일 박 대통령이 정윤회씨와 함께 있었다는 의혹을 제기하면서 두 사람이 긴밀한 남녀관계인 것처럼 표현했다가 명예훼손 혐의로 기소됐다.    검찰은 지난달 결심공판에서 가토 전 지국장에게 징역 1년6개월을 구형했다
