골방 속 '덕후 문화'스마트폰 타고 활짝	http://news.naver.com/main/read.nhn?mode=LSD&mid=shm&sid1=105&oid=015&aid=0003493510	양띵 등 1인 방송 스타 진행자 월 수입 3000만원 올리기도 네이버 웹소설 2년 만에 23만편아마 작가 11만명이 올려모바일용 10분 영상도 인기 콘텐츠업체 창작자 영입전네이버 5년간 500억 투자 추가영 기자   아프리카TV와 구글 유튜브에서 자신이 직접 게임을 하며 중계하는 게임 방송 진행자BJ 양띵본명 양지영25은 초통령으로 통한다. 방송하는 온라인게임 마인크래프트가 초등학생 사이에서 인기가 높다보니 양띵을 모르는 초등학생이 거의 없을 정도다. 팬들이 선물해주는 100원짜리 별풍선과 온라인광고 등으로 버는 월수입이 3000만원을 넘는다.콘텐츠를 전달할 수 있는 다양한 채널이 속속 나오면서 1인 콘텐츠 창작자가 전문직으로 떠오르고 있다. 콘텐츠가 인기를 끌면 돈도 벌고 명예도 거머쥐게 된다. 스마트폰 확산으로 이 같은 현상이 더욱 가속화할 전망이다. 동영상 웹툰 웹소설 등 문화 콘텐츠산업에 콘텐츠 소비 증가콘텐츠 창작자 증가시장 확대의 선순환 구조가 정착하고 있다는 분석이 나온다. 양띵 같은 고소득 스타 창작자가 속속 등장하고 있는 것도 선순환 요인으로 꼽힌다.전문직 떠오른 1인 창작자네이버가 서비스하는 웹툰 작품은 19만여개다. 14만명의 아마추어 작가가 올린 것이다. 네이버가 서비스를 시작한 지 2년밖에 안 된 웹소설도 11만명의 아마추어 작가가 23만편을 게재했다. 아마추어 작가들이 웹툰과 웹소설 서비스에 적극적인 것은 수익 기반이 갖춰졌다고 판단해서다. 다른 사람보다 먼저 다음편을 볼 수 있는 미리보기 같은 유료 서비스 배너광고 등 수익모델이 자리를 잡았다. 네이버 연재 작품으로 한 달에 7800만원을 번 웹툰 작가도 나왔다. 네이버 웹소설 작가 7명은 지난해 각각 1억원이 넘는 수입을 올렸다.웹툰이나 웹소설이 게임 영화 드라마 등 으로 제작되는 사례도 나오고 있다. 지난해 선보인 네이버 웹툰 가운데 2차 창작물로 나왔거나 준비 중인 것은 영상 9건 게임 14건 스티커 19건 출판 10건 등 52건에 달했다. 작가들의 활동 무대도 넓어지고 있다. 네이버 다음 등 포털뿐 아니라 레진코믹스 등 웹툰 전문 사이트와 문피아 조아라 등 웹소설 전문 사이트가 고수를 확보하기 위해 치열한 경쟁을 벌이고 있다.병장이라는 이름으로 활동 중인 웹툰 작가 황병엽 씨는 영화 등 판권 수입까지 거둘 수 있어 창작자들의 수익 기반이 그만큼 탄탄해졌다고 말했다.모바일 맞춤형 콘텐츠 봇물KT경제경영연구소가 올초 20대를 대상으로 벌인 설문조사에서 스마트폰으로 보기에 적합한 동영상 길이는 43. 짧은 시간에 소비할 수 있는 볼거리 읽을거리를 선호한다는 것이다. 10분 이내의 짧은 동영상이 인기를 끌고 있는 것과 무관치 않다는 분석이다. 최근 누적 조회 수가 4300만건을 넘어선 CJ EM의 웹예능 프로그램 신서유기는 편당 1015분짜리다. 짤막한 길이의 카드뉴스를 서비스하는 피키캐스트 누적 조회 수도 최근 2년 만에 53억건을 넘어섰다.10분 이내의 짤막한 영상을 제작하는 전문 업체도 나오고 있다. 지상파 등에서 경력을 쌓은 PD나 작가들이 참여해 모바일용 드라마나 연예물을 만드는 업체는 네오터치포인트 등 10여곳에 이른다. 김경달 네오터치포인트 대표는 스마트폰은 TV에 비해 몰입감이 강하고 개인화된 콘텐츠를 서비스할 수 있다는 장점이 있다고 말했다.창작자 키우기 열풍일반인 창작자가 제작한 콘텐츠의 인기가 높아지면서 네이버 카카오 구글 등 콘텐츠 서비스업체들이 창작자 육성에도 나서고 있다.카카오는 뉴스 책 음악 영화 등 창작물을 만드는 사람들이 펀딩받을 수 있도록 크라우드 펀딩인 스토리 펀딩을 운영 중이다. 펀딩 프로젝트 개설부터 콘텐츠 제작 후원자 관리까지 제작자가 효율적으로 운영할 수 있도록 지원하고 있다. 최근엔 브런치북 프로젝트를 통해 책 출간 기회도 주고 있다.네이버는 앞으로 5년간 콘텐츠 창작자 지원을 위해 500억원을 투자할 계획이다. 구글은 지난해부터 예비 영상 창작자를 대상으로 영상제작 교육 프로그램 등을 운영하고 있다. 덕후 문화일본어 오타쿠를 한국식으로 표기한 오덕후에서 온 덕후는 온라인상에서 주로 광팬 또는 마니아라는 뜻으로 쓰인다
문고리만 잡아도 스케줄 줄줄, '손목 전쟁' 스마트워치	http://news.naver.com/main/read.nhn?mode=LSD&mid=shm&sid1=105&oid=214&aid=0000564865	스마트폰의 액세서리 정도로 취급 받던 스마트워치가 최근 스마트기기 시장에 주연급으로 떠오르고 있습니다.새 기술과 아이디어로 빠르게 진화하면서 이제는 손목 위의 전쟁이라는 말까지 나왔는데요.스마트워치의 미래를 손병산 기자가 취재 했습니다. 리포트 미국 연구진이 개발한 전자기 센서 스마트워치입니다.스마트워치를 차고 물건에 손을 대자 어떤 물체인지가 화면에 뜹니다.전기가 통하는 물체마다 고유의 전자기 패턴이 있는데 스마트워치의 센서가 사람 몸을 통해 전해지는 전자기 패턴을 읽어내 알려주는 겁니다.스마트워치만 차면 배우지 않아도 처음 보는 사물을 알 수 있는 세상이 열리는 셈입니다.뿐만 아니라 그때그때 착용자에게 필요한 맞춤 서비스까지 제공합니다.사무실 문고리를 잡으면 일정을 바로 알려주고 메시지 12개가 왔고 12분 뒤 회의가 있습니다.오토바이 시동을 걸면 내비게이션이 켜지는 등 별도의 조작 없이 서비스가 제공됩니다.국내에서는 손 움직임에 따라 정보 전달 방식을 바꾸는 기술이 개발됐습니다.내비게이션 앱을 쓸 때 팔을 내리고 있으면 진동 횟수로 시계를 보면 화면으로손을 들면 소리로 방향을 알려줍니다.황성재스마트워치 특허 기업 연구소장이 시계가 어떤 방향을 보고 있는지를 판단을 해서 적합한 형태로 정보를 전달하는 기술입니다.사용자가 어떤 상황인지 알아채는 이런 기술에서 한 발 더 나아가 신체 변화와 감정까지 감지하는 전자 피부를 결합하는 연구도 진행 중입니다
'실거래가 무법지대'…단속 비웃는 '다운계약'	http://news.naver.com/main/read.nhn?mode=LSD&mid=shm&sid1=101&oid=055&aid=0000355190	이렇게 부동산 거래를 하면서 실거래 가격보다 낮게 신고하는 걸 다운 계약이라고 합니다. 이렇게 하는 이유는 파는 입장에선 양도소득세를 줄일 수 있고 사는 입장에선 취득세를 적게 낼 수 있기 때문입니다. 만약에 적발이 되면 원래 내야 할 취득세의 최고 3배에 달하는 과태료가 부과됩니다. 그런데도 여전히 다운계약이 근절되지 않고 있습니다.기자올해 초 서울 서초구의 아파트를 산 최 모 씨는 실제 매매 가격보다 2천만 원 낮게 신고하는 이른바 다운계약서를 썼습니다.최 모 씨다운계약서 매수인  원래 12억 2천만 원 중 2천만 원은 따로 좀 해달라. 안 하면 싫다라고 할 게 뻔하니까 현금으로 하게 됐죠.집이 마음에 들어 전 주인의 끈질긴 요청을 거절하지 못했습니다.실거래가 위반으로 처벌된 사례는 해마다 늘어 올 2분기까지만 1천 건을 넘겼습니다.위례와 동탄 등 신규분양시장은 말 그대로 실거래가 무법지대입니다.위례신도시 공인중개사  옛날에 사가지고 다 다운계약해서 단 한 건도 1억에 사서 1억에 신고한 경우는 없어요.다운계약서 상의 가격조정폭도 약속처럼 정해져 있다고 말합니다.국세청에 계속 신고가 들어온 게 계속1억 4천만 원에 들어온단 말이야. 근데 1억 3천만 원으로 딱 들어오면 조사 대상이지.다운계약으로 적발되면 탈루한 세금에 과태료는 물론 형사고발까지 당할 수 있습니다.최신형국토교통부 토지정책과 서기관  부동산 중개업소뿐만 아니라 매도 매수인까지 모두 처벌받을 수 있으므로 유의하셔야 되고 국세청 지자체들과 함께 단속을 더욱 강화해나갈 예정입니다.국토부는 또 향후 주택을 팔 때 양도세를 적게 내려고 거래가격을 실제보다 올려 신고하는 이른바 업계약에 대해서도 적극 단속할 방침입니다
1억대 강남아파트? 철거민 위한 '장기전세' 편법 이용	http://news.naver.com/main/read.nhn?mode=LSD&mid=shm&sid1=101&oid=214&aid=0000564853	서울시에 시프트 장기전세라는 제도가 있습니다. 주변보다 20 이상 싼 전세금에 최대 20년 동안 살게 해주는 건데요.서민 주거안정을 위해 도입된 만큼 신청자의 소득이나 자산이 일정 수준 이하여야 합니다. 그런데 이런 조건을 따지지 않고 돈만 내면 장기전세에 들어가게 해주겠다는 업자들이 있습니다. 전준홍 기자가 현장 취재했습니다. 리포트 1억 원에 강남 아파트 전세 입주가 가능하다는 솔깃한 광고. 수천만 원만 내면 장기전세 아파트를 골라서 갈 수 있다고 말합니다.기획부동산 업체서울시내 어디든지 다 가능해요. 강남권도 가능하고 상암도 괜찮고그러면서 소개해주는 건 철거 예정 주택. 공공시설을 짓는 과정에서 집이 철거가 되면 보상금과 함께 장기전세 입주권이 주어지는데 이런 철거민 자격을 사라는 겁니다. 철거 계획이 공표되기 전에 사야 입주권을 받을 수 있지만 그 내밀한 정보도 미리 알 수 있다고 떠벌립니다. 시의회라든지 이런 데는 보편적으로 오픈이 안되는 서류들이 있잖아요. 일개 구청 직원들한테 전화하면 모르죠 당연히.실제 지난 9월 서울시가 철거 계획을 발표한 한 노후 빌라는 전체 26가구 가운데 21가구가 최근 3년 반 사이에 주인이 바뀌었습니다. 인근 공인중개사무소전문적으로 하는 그 사람들이 와서 다 뒤지고 갔죠
코이카 봉사단원 라오스서 피살…용의자 검거	http://news.naver.com/main/read.nhn?mode=LSD&mid=shm&sid1=102&oid=055&aid=0000355198	한국국제협력단 코이카 소속 봉사단원인 20대 여성이 라오스에서 숨진 채 발견됐습니다.타살 가능성이 높은 것으로 보고 경찰이 수사팀을 현지에 급파했고 용의자를 검거했습니다.기자지난달 26일 오전 11시쯤 라오스 수도인 비엔티안의 한 아파트에서 코이카 소속 20대 여성 봉사 단원이 숨진 채 발견됐습니다.침대에 누워있는 상태로 얼굴엔 수건이 덮여 있었습니다.라오스 공안당국은 처음에는 사인을 급성 심장마비로 추정했습니다.라오스 공안당국의 1차 감식결과 발표와 달리달리 우리 경찰은 타살 가능성이 큰 것으로 보고 수사팀을 현지로 급파했습니다.코이카 관계자  라오스 경찰에서는 처음에는 심장마비로 추측이 된다고 했다가 다음에는 질식에 의한 살인일 것 같다고 알려 왔습니다.라오스 주재 한국 대사관 관계자  사건 담당하러 한국 경찰에서 파견 나온 분들이 조사하고 계세요.경찰은 숨진 여성의 신용카드로 두 차례 현금인출 시도가 있었던 사실도 확인했습니다.현지인인 용의자를 검거해 현재 범행 동기 등을 조사하고 있는 것으로 알려졌습니다.경찰은 동시에 정확한 사인을 규명하기 위해 숨진 여성의 시신을 국내로 운구해 부검한 뒤 결과를 기다리고 있습니다
삼성그룹 고위 임원들 합병 앞두고 '수상한 거래'	http://news.naver.com/main/read.nhn?mode=LSD&mid=shm&sid1=101&oid=056&aid=0010257190	멘트삼성그룹 계열사의 고위 임원들이 삼성물산과 제일모직 간 합병 과정에서 미리 주식을 대량으로 사들인 정황이 포착돼 금융당국이 조사에 착수했습니다.합병 발표와 관련된 미공개 내부정보를 이용했는지가 조사의 핵심입니다. 리포트 삼성물산과 제일모직의 합병 발표를 앞둔 민감한 시기 거래소 감시망에 미심쩍은 주식거래가 포착됐습니다. 삼성그룹 계열사의  사장급을 포함한 고위 임원 9명이 제일모직 주식을 집중 매입했습니다. 제일모직 주가는 삼성물산과 합병 발표가 임박했던 지난 5월 14일 이후 6거래일 연속 상승세를 보였고 발표 당일인 26일엔 가격제한폭까지 올랐습니다. 제일모직과 삼성물산의 합병 비율도 10.35로 당시 제일모직의 주가를 기준으로 산출됐습니다. 이에 따라 제일모직 주식을 많게는 수십억 원어치를 사들였던 삼성 고위급 임원들은 큰 이익을 본 것으로 알려졌습니다. 한국거래소로부터 이들의 수상한 주식 거래를 보고받은  금융위원회 자본시장조사단은 즉각 조사에 착수했습니다. 합병 발표 예정일과 합병 비율 등에 대한 정보를 미리 알아냈는지 여부에 초점을 맞추고 있습니다. 합병 당사자인 삼성물산과 제일모직 관계자들이 가담했는지도 조사대상입니다. 이에대해 삼성측은 내부정보를 이용한 불법거래는 없었다고 해명했습니다.녹취 삼성그룹 관계자    금융당국 등에서 조사가 진행되고 있으니 곧 사실 여부가 명확히 밝혀질 것입니다. 자체 확인한 바로는 단순 투자일 뿐 불법적 거래는 전혀 없습니다
