'스몸비족' 노린 광고 길바닥 점령, 보행자 안전 위협	http://news.naver.com/main/read.nhn?oid=214&sid1=102&aid=0000658987&mid=shm&mode=LSD&nh=20160815211834	요즘 길을 걸으며 스마트폰만 보는 사람들 흔히 보입니다.영화에 나오는 좀비 같다고 해서 스몸비Smombie라 불리기도 하는데요 고개를 숙인 채 걷는 스몸비 족이 늘어나다 보니 벽보나 전단지를 이렇게 바닥에 깔아놓는 경우가 많아졌습니다.하지만 불법 광고물인데다 시선을 바닥으로 빼앗다 보니 안전사고 위험도 커지고 있습니다. 리포트 도심을 지나는 사람들.  손마다 스마트폰이 들려 있습니다.차 옆을 지나거나 횡단보도를 건널 때도 고개는 늘 아래로 향합니다.헬스장이나 휴대전화 판매점 호객 광고가 굳이 길바닥에 붙어 있는 이유입니다.휴대전화 판매점 직원이렇게 마구잡이로 바닥에 붙여놓으면 보긴 보거든요.신호나 버스를 기다리는 사거리 횡단보도는 광고판과 같습니다.보도블록 끝마다 손바닥만 한 대출 광고가 붙어 있습니다.주말 저녁 번화가는 더욱 심각합니다.바닥에 깔린 유흥주점 전단지 낯 뜨거운 문구가 가득합니다.밤이 깊어지자 유흥업소 종업원은 대놓고 바닥에 광고지를 붙입니다.2인 1조로 구석구석 청테이프를 바르고 그 옆에는 종이 포스터까지 덧댑니다.박혜옥인천 서구 원당동바닥에 이런 것 하지 않았으면 하는 그런 바람이거든요. 내용도 정상적인 그런 게 아니더라고요.스몸비를 노렸든 아니든 공공장소인 보도에 광고물을 붙이는 건 불법입니다.떼어도 떼어도 끝이 없고 동전으로 긁어내도 쉽게 사라지지 않습니다.김태기서울시청 도시빛정책과장바닥에 붙이는 것은 절대적으로 붙일 수 없는 행위기 때문에 바닥에 붙이는 광고에 대해서는 앞으로 철저히 단속할 예정에 있고요.더 큰 문제는 안전사고 우려입니다.주의가 분산돼 횡단보도를 건널 때 차와 신호등에 대한 반응 속도가 떨어지는 겁니다.실제로 스마트폰 사용으로 인한 보행자 교통사고는 2009년 437건에서 지난해 1천3백여 건으로 3
제3의 후보지 '롯데 골프장' 떠올랐지만…현실성 있나?	http://news.naver.com/main/read.nhn?oid=437&sid1=100&aid=0000128542&mid=shm&mode=LSD&nh=20160815233218	한편 성주군 안에서 롯데스카이힐 골프장 등이 제3의 사드배치 후보지들이 거론되고 있습니다. 그런데 과연 제3후보지들의 현실성이 있는 것인지 지금으로선 불분명해 보입니다.기자지난 4일 박근혜 대통령이 경북 성주 내 다른 지역도 사드 후보지로 검토해 볼 수 있다고 말한 뒤로 사드배치 제 3후보지로 거론된 곳은 염속산 까치산 칠봉산 그리고 롯데 스카이힐 골프장까지 4곳입니다.이중 롯데 스카이힐 골프장은 성산포대보다 해발고도가 높은 해발 680m에 위치해있고 성주군청으로부터 북쪽으로 18km가 떨어져있단 장점이 있습니다.국방부 관계자들이 이곳을 잇따라 방문한 사실이 알려지면서 유력한 대체 후보지로 떠오르고 있습니다.하지만 4곳 모두 실현가능성은 미지수입니다. 염속산 까치산 등은 이미 한미 군 당국이 사드 배치 시점으로 공언한 내년 말까지준비가 어려워 사실상 배제된 상태입니다. 롯데 스카이힐 골프장은 기반 여건은 좋지만 부지매입에 막대한 추가재원이 필요합니다.제3후보지설이 계속 흘러나오면서 성주내 여론은 쪼개지고 있습니다.성주 내 보수 단체들을 중심으로 제3후보지를 검토해야 한다고 주장이 나오고 있는 반면 사드배치 철회투쟁위는 사드배치 자체를 반대한다며 맞서고 있습니다.구혜진 JTBC 뉴스 공식 SNS 트위터 페이스북 유튜브Copyright by JTBChttpjtbc
무더위에 에어컨 판매 사상최대.."올해 220만대 넘어설 듯"	http://news.naver.com/main/read.nhn?oid=421&sid1=101&aid=0002224234&mid=shm&mode=LSD&nh=20160815232704	경남 창원 LG전자 HA사업본부 에어컨 공장에서 작업자들이 휘센 듀얼 에어컨을 생산하고 있다. 롯데하이마트 78월 전년동기 대비 50증가삼성LG전자 에어컨 생산 한달이상 연장서울 박종민 기자  폭염무더위가 장기화되면서 국내 에어컨 판매량이 역대 최고에 달할 것으로 보인다. 업계는 올해 에어컨 판매량이 지난 2013년 200만대를 넘어설 것으로 보고 있다. 15일 한 전자 업계 관계자는 8월까지 지나봐야 알겠지만 현재 판매 추이로 볼대 올해 에어컨 판매량이 역대 최고였던 2013년의 200만대를 넘어설 것으로 보인다라고 말했다. 업계는 올 에어컨 판매량이 최대 220만대에 달할 것으로 예상하고 있다. 국내 최대 가전 양판점인 롯데하이마트 관계자는 8월1일부터 11일까지의 에어컨 판매 매출액은 전년 대비 50 증가했으며 같은 기간 매출액 기준으로 지난 5년 대비 최고 수준이라고 말했다. 이어 7월1일부터 8월11일까지의 판매 매출액도 전년동기대비 50 늘어나 최고 수준에 이른다라고 덧붙였다. 국내 에어컨 제조업체들도 더위에 따른 에어컨 특수에 좋은 판매 성적을 올리고 있다. 삼성전자가 지난 1월 출시한 무풍에어컨 Q9500은 출시 4개월 만에 국내 판매 10만대를 돌파했으며 최근에는 20만대도 넘어섰다. LG전자의 휘센 듀얼 에어컨 판매량도 지난 5월 누적 판매량 기준 전년 대비 30 이상 증가했다. 올해 에어컨 수요가 급증하자 삼성전자와 LG전자는 이례적으로 생산 라인 가동을 연장했다. 기존에는 8월에 접어들면 에어컨 라인 가동을 중단해왔다. 삼성전자는 8월 말까지 LG전자는 8월 중순까지 생산 기간을 연장했다. 중견 가전 업체인 대유위니아도 보급형 벽걸이 에어컨 생산 라인 가동을 기존보다 한 달 이상 연장했다. 대유위니아는 오는 20일까지 에어컨 양산을 지속한다는 계획이다. 위니아 에어컨의 7월까지 누적 판매량도 전년 동기 50 늘었다.최근 5년간 국내 에어컨 판매량은 지난 2011년 180만대 이후 2012년 150만대 2013년 200만대 2014년과 2015년 150만대를 기록해왔다. 2014년과 2015년은 각각 세월호 참사와 중동호흡기증흐군메르스여파로 전체 소비심리가 위축되면서 에어컨 판매량도 부진한 모습을 보였다
자소서 한장 수십만원… 취준생 절박감 파고드는 대필업체	http://news.naver.com/main/read.nhn?oid=022&sid1=102&aid=0003086664&mid=shm&mode=LSD&nh=20160815192544	하반기 공채 앞두고 고액 요구 업체 기승자소서 쓰는 법 강의료가 월 68만원이래요.졸업을 미룬 채 취업을 준비 중인 대학생 백모25여씨는 최근 인터넷에서 검색한 자기소개서자소서 첨삭대필 업체에 가격을 알아봤다가 괜스레 마음만 무거워졌다. 백씨는 다음달 하반기 주요 기업 공개채용을 앞두고 절박한 맘에 문의했지만 부르는 가격이 만만치 않았다.대부분 업체는 한두 장짜리 자소서 작성에 10만30만원을 불렀다. 어떤 곳은 한달 강의료로 68만원을 요구했다. 백씨는 자소서를 맡긴다고 서류전형을 통과한다는 보장은 없지만 한 번쯤 강의를 듣고 싶다며 씁쓸해했다. 하반기 공채가 임박하면서 자소서와 씨름하는 취업준비생들이 적지 않은 가운데 고액의 자소서 첨삭대필 업체들이 기승을 부리고 있다. 기업 채용 담당자들은 매번 결국 들통난다는 점을 강조하지만 등불에 달려드는 나방처럼 취준생들의 발걸음은 이어지고 있다.15일 취업커뮤니티 등에 따르면 자소서 부담으로 대필 업체를 찾는 취준생이 부쩍 늘고 있다. 인터넷에는 자소서 대필대행을 걸어둔 채 버젓이 운영 중인 업체가 10곳이 넘는다. 취준생이 대거 가입한 취업정보카페에는 자소서 대필 홍보글이 꾸준히 올라오고 있다. 관련 업계에서는 자소서를 대신 써주는 이들을 작가라고 부르는데 자소서가 아니라 자소설이 되는 꼴이다.취준생들은 할 수만 있다면 하고 싶다는 반응이다. 올해 초 취업포털 인크루트가 취준생 881명 등 1235명을 설문 조사한 결과 자소서 대필을 긍정적으로 생각한다는 응답자는 41로 부정적으로 생각한다35.2는 기회와 비용이 있다면 대필해도 무방하다고 답했다.8는 작성 능력이 없다면 적극적으로 대필해도 좋다는 반응을 보였다.문제는 서류전형 통과와 같은 결과를 보장하거나 서비스 수준이 어떻든 환불을 약속하는 곳이 없다는 점이다.업체 대부분은 합격 후기나 신춘문예 당선 경력 기자방송작가 경력 등을 내걸고 홍보하는데 대부분 사실 확인도 불가능하다. 현직 기자가 필진이라고 홍보 중인 한 업체에 대필 작가의 신원을 문의하자 업체 측은 다섯손가락 안에 드는 일간지 소속 기자라고만 밝힌 뒤 구체적인 언급을 거절했다. 이 업체는 어떤 업체도 합격이나 사후서비스AS를 약속하는 곳은 없다며 창작 행위의 특성상 한번 서비스가 이뤄지면 환불은 안 된다고 말했다.이 같은 대필 행위의 경우 위법은 아니다. 하지만 자격을 검증할 방법도 없어 전문성이 의심스러운 경우가 태반이다.2년차 대필 작가인 김모26씨는 기자와 만나 큰 업체는 구인 사이트를 통해 작가를 찾는다며 대부분은 문예창작과 출신 학생들이 아르바이트로 하는 경우라고 귀띔했다. 이런데도 대필 업체가 성황을 이루는 것은 수요가 끊이지 않기 때문이다. 경력 9년차인 유명 대필 작가는 형편이 넉넉해 대필을 의뢰하는 사람은 없다. 100명 중에 99명은 조금이라도 나은 점수를 얻어보려는 것이라며 경쟁이 심한 대기업 공기업 은행권 지원자들이 많다고 전했다. 이에 대해 한 대기업 채용 담당자는 대필 냄새가 나는 항목은 따로 골라 축적하고 있다며 일부 기업은 대필을 걸러내는 시스템도 도입한 것으로 안다고 말했다. 이어 기업이 원하는 인재는 글 잘 쓰는 사람이 아니라 서투르더라도 열정과 실행력을 갖춘 사람이라며 부정을 불사하는 태도는 역효과를 낼 것이라고 강조했다
나라꽃 무궁화?…10년째 말만 요란한 정치권	http://news.naver.com/main/read.nhn?oid=055&sid1=100&aid=0000441754&mid=shm&mode=LSD&nh=20160815214351	나라마다 그 나라를 상징하는 꽃 국화가 있죠. 미국은 장미 일본은 벚꽃입니다. 미국은 국화가 법으로 정해져 있지만 일본은 관습적으로만 정해놓고 있습니다. 그럼 우리나라 무궁화는 어떨까요남승모 기자입니다.기자장희태이지온최지수  우리나라 꽃 뭔지 알아요 네 무궁화요.하지만 무궁화가 국화라는 건 오랜 관습일 뿐 법적 근거는 없습니다.신선주경기도 수원시 영통동  그건 되게 놀라운데요 전 당연히 헌법이나 그런 데 정해져 있는 걸로 알고 있었거든요.국회에서도 무궁화를 국화로 법제화하자는 논의가 10년 넘게 계속되고 있습니다.국가적 상징으로서 위상을 높이고 보급 확대를 포함해 체계적으로 관리하자는 취지입니다.이번 20대 국회에 제출된 여야의 관련 법안입니다.조항이 1개씩 삭제된 걸 빼면 19대 때 제출됐던 내용과 거의 같습니다.19대 법안은 최근 2년 반 동안 단 한 번도 논의되지 않다 19대 임기 종료와 함께 자동 폐기됐습니다.정부 관계자  발의만 하시지 그냥 관심이 없으시고 또 당장 민생 법안은 아니기 때문에 후순위로 밀리고 하여튼 이벤트성으로 그치고 그렇습니다.규격을 통일해야 하는 국기와 달리 프랑스와 일본처럼 국화를 법으로 정하지 않은 나라들도 많습니다.하지만 구한 말부터 식민지배를 거치며 민족의 꽃이 된 특수성인 있는 만큼 무궁화의 위상을 정립하기 위한 사회적 논의는 필요해 보입니다
400조 '슈퍼 예산' 가시권…19일 편성 '데드라인'	http://news.naver.com/main/read.nhn?oid=008&sid1=101&aid=0003726934&mid=shm&mode=LSD&nh=20160815191944	세종정현수 기자 34 증액하기로 의견 모아복지예산 처음으로 130조원 넘길 듯400조원을 웃도는 슈퍼 예산이 가시권에 들어왔다. 나라살림은 2005년 200조원을 넘긴 이후 꾸준히 확대되고 있다. 복지와 국방 문화 예산의 증액이 이뤄지는 반면 사회간접자본SOC과 외교통일 예산은 줄어들 것으로 전망된다.15일 관계부처에 따르면 기획재정부는 이달 19일을 데드라인으로 정하고 내년 예산안 편성작업을 진행 중이다. 내년 예산안은 다음달 2일 국회에 제출된다. 현재로서는 사상 첫 400조원 예산 편성이 유력하다. 정부와 새누리당은 지난 9일 당정협의에서 내년 예산을 34 증액하기로 했다. 올해 총지출 기준 예산은 386조4000억원이다. 34 증액할 경우 내년도 예산은 398조402조원 수준에서 결정된다.기재부 내부에서는 상징적인 의미 등을 감안해 400조원대의 슈퍼 예산 편성을 검토하고 있는 것으로 알려졌다. 실제로 400조원은 상징적인 의미가 크다. 나라살림을 의미하는 예산은 2005년 209조6000억원으로 200조원을 처음 넘겼다. 2009년에는 사상 최대 규모의 추경 편성과 함께 총지출 규모가 301조8000억원을 기록하기도 했다. 내년도 예산이 400조원을 넘길 경우 8년 만에 앞자리를 바꾸게 되는 것이다.송언석 기재부 2차관은 지난 9일 기자들과 만나 경기 대응 차원에서 재정이 적극적인 역할을 해야 한다는 수요가 많기 때문에 총지출 증가율은 당초 계획보다 더 큰 숫자로 갈 수밖에 없다고 말했다.분야별로는 복지 예산의 확장적 기조가 이어질 전망이다. 각 부처의 내년도 예산 요구안을 보면 보건복지고용 분야 예산 요구액은 130조원으로 전년123조4000억원 대비 5. 요구안대로만 편성돼도 사상 처음으로 이 분야 예산이 130조원을 넘게 된다.반면 SOC 예산의 감소폭은 두드러질 전망이다. 각 부처가 요구한 내년 SOC 예산은 20조원으로 전년23조7000억원보다 15. 외교통일 예산 요구액 역시 4조4000억원으로 전년4조7000억원 대비 5. 개성공단 폐쇄 등의 영향이다.4 등의 분야에서 예산 요구액이 줄어들었다
저유가에 해외 수주 '반토막'… 비상 걸린 건설업계	http://news.naver.com/main/read.nhn?oid=005&sid1=101&aid=0000927688&mid=shm&mode=LSD&nh=20160815202752	국내 건설사의 해외건설 수주에 경고음이 울리고 있다. 저유가 여파로 중동시장에서 발주가 예상됐던 프로젝트들이 잇따라 지연취소되면서 초대형 물량이 급격히 줄어든 탓이다. 국내 주택 시장이 반짝 호황이지만 벌써 공급과잉 우려가 나오는 데다 해외 시장까지 춘궁기로 접어들자 건설업계가 바짝 긴장하고 있다. 15일 해외건설협회에 따르면 올해 8월까지 집계된 해외 건설공사 누적 수주액은 170억 달러로 지난해 같은 기간309억달러에 비해 45 줄었다. 거의 반토막 난 셈이다. 2009년 이후 최저 수준이다. 다만 같은 기간 수주 건수는 359건으로 지난해381건에 비해 22건 감소하는 데 그쳤다. 결국 눈에 띄는 대형 계약이 사라졌다는 얘기가 된다. 실제로 UAE는 지난해 50억 달러 규모의 후자이라 정유 프로젝트를 발주할 예정이었지만 사업성을 재검토 중인 것으로 알려졌다. 40억 달러 규모 에티하드 철도 프로젝트도 잠정 중단된 상태다.  이에 따라 국내 건설사의 실적도 크게 악화되고 있다. 지난해 6조5999억원을 수주한 삼성물산이 올해 4조8361억원을 수주해 그나마 선전했지만 지난해 1위였던 현대엔지니어링은 현재 수주액이 60 가까이 줄어들며 2위로 내려앉았다. 대우건설도 지난해 수주액이 3조141억원이었으나 올해는 5643억원에 그치고 있다. GS건설은 지난 한 해 해외건설에서만 6조4756억원을 수주했지만 올해는 현재까지 1조6474억원에 머물고 있다. SK건설도 지난해 5조517억원의 10분의 1 수주에 그치고 있다.  해외수주 감소는 최근 저유가와 중동지역의 지정학적 위험요인 탓이 크다. 게다가 지난 23년간 국내 주택시장이 호황을 맞으면서 건설사들이 해외진출에 소극적이었던 점 등도 작용했다. 실제로 올해 상반기 중동지역 해외건설 수주액은 지난해 상반기71억12만 달러보다 33 감소한 47억7773만 달러를 기록했다. 손태홍 한국건설산업연구원 연구위원은 유가가 배럴당 7080달러 수준으로 오르기 전까진 중동과 아시아 등에서 대형 공사를 꺼리는 추세가 이어질 것이라고 전망했다. 건설사들은 일단 국내 주택 분양에서 번 돈으로 해외 손실분을 막겠다는 생각을 하고 있다. 10대 건설사의 하반기 분양 물량은 총 16만9425가구로 상반기 10만8717가구에 비해 79가량 늘었다. 대형 건설사 관계자는 해외 사업과 국내 사업이 동시에 잘된 적은 거의 없다며 국내 사업이 호경기여서 그나마 다행이라고 말했다.  문제는 이런 주택시장 호황도 언제 끝날지 모른다는 점이다. 부동산 시장이 과열된 데다 실물경기가 받쳐주지 못해 조만간 한계에 이를 수 있다는 우려가 커지고 있다. 20172018년 전국 아파트 입주 예정 물량이 무려 70만 가구에 달해 공급과잉 조짐도 보인다. 대한건설협회는 불확실성 해소를 위해 지난 12일 국회에 매년 줄어드는 SOC 예산을 24조원 수준으로 확대 편성해 달라고 요청했지만 받아들여질지는 미지수다. 결국 국내에 안주하지 말고 새로운 먹거리를 위해 아프리카 등 해외를 개척하는 노력을 멈추지 말아야 한다는 목소리가 높다. 손 연구위원은 저유가 시대를 인정하고 새로운 분야의 해외건설시장을 개척해야 한다며 신시장으로 꼽히는 아프리카 등을 공략하기 위해선 정부의 정책금융지원 강화도 절실하다고 말했다
