잦은 야근에 밤샘 다반사… 저녁이 없는 '서글픈 미생들'	http://news.naver.com/main/read.nhn?mode=LSD&mid=shm&sid1=102&oid=022&aid=0002985961&cid=428288	주5일제 10년 여전히 긴 노동시간야근공화국이란 악명은 언제나 사라질까. 주5일 근무제가 100명 이상 사업장으로 확대된 지 올해로 10년째다. 그러나 우리 사회는 여전히 긴 노동시간에 허덕이고 있다. 경제협력개발기구OECD에 따르면 2014년 한국의 1인당 연간 노동시간은 2124시간이다. 32개 조사대상국 중 두 번째로 길다. 1371시간인 독일보다 800시간 가까이 많다. OECD는 기업 보고를 취합한 노동부 자료로 통계를 낸다. 통계청 경제활동인구조사를 기준으로 하면 노동시간은 2285시간으로 더 늘어난다. 야근에 지친 지 오래지만 획기적 변화는 요원해 보인다. 휴대전화 부품회사 엔지니어 공공 문화예술기관 여성 기획자를 통해 야근 실상을 알아봤다.휴대전화 부품회사 엔지니어문화예술기관 기획자의 하루1. 새벽 4시 어제 아침 8시 출근해 20시간째 근무 중이다. 사무실 의자에 기대 한 시간쯤 잤나. 뻑뻑한 눈을 비비며 다시 개발 샘플에 집중한다. 사내 식당에서 10분 만에 후다닥 밥을 입에 밀어넣는다. 오늘 밤도 집에 가기는 글렀다. 정신을 차려보니 일한 지 37시간이 됐다. 주위 밤샘 동지들을 둘러본다. 샤워는커녕 속옷도 갈아입지 못해 다들 산적 같다. 작업은 동틀 무렵에야 끝났다. 집에 갈 힘조차 바닥 났다. 회사 동료 기숙사 방에 들어가 곯아떨어졌다. 휴대전화 부품회사 개발팀에서 일한 지 올해로 5년이다. 대기업에 납품하다보니 한 달에 한 번꼴로 초인적 야근이 돌아온다. 여유 있으면 3 4일만 고생하지만 심할 때는 보름 가까이 야근과 밤샘이다. 갑인 대기업은 부품업체 사정을 봐주지 않는다. 납기일은 불변인데 갑이 돌연 사양이나 부품을 바꾸면 발등에 불이 초고속으로 떨어진다. 야근이 없다고 칼퇴근도 아니다. 오전 8시 출근에 오후 9시 퇴근이 보통이다. 이번 밤샘은 유난히 독했지만 젊어서 견딜 만하다. 두 시간에 한 번 믹스 커피만 털어넣으면 된다. 극한까지 일해보는 것도 다 인생 경험이다. 다음 회사에서는 그만큼 일이 수월해지지 않겠는가. 대기업 디스플레이 회사에 다니는 친구는 토요일 오전에 전화하니 그때 퇴근하고 있더라. 오후 7시 지친 몸을 끌고 책상 앞에 앉는다. 오전 회의 오후 외부 미팅과 현장답사로 돌아다닌 후라 피로가 몰려오지만 쉴 틈이 없다. 공공 문화예술기관에서 일하다보니 사업계획서 결과보고서를 정확히 챙겨야 한다. 몸은 하나고 시간은 한정돼 있다. 결국 밥 먹듯 야근이다. 일주일에 한두 번쯤 9시 전에 사무실을 나서면 6시 정시 퇴근하는 느낌이다. 그 시간에 지하철을 타면 신기하다. 10시에 가면 그냥저냥 일했구나 싶다. 한 달 초과근무가 5060시간쯤 된다. 야근이 반복되니 피로를 달고 산다. 가슴께가 따끔하거나 허리가 아프다. 지난해 해외 업무로 고생할 때는 거의 공황에 빠졌다. 시차 때문에 밤낮 가리지 않고 일이 진행됐다. 처음 맡는 해외 사업인 데다 혼자 하다보니 성과에 대한 부담도 컸다. 한 달쯤 이렇게 사니 심신이 피폐해졌다. 이럴 때 상담을 받으라던데 그것도 시간이 돼야 가능한 거였다. 몸이 한계에 이르렀는지 정신이 멍해졌다.결혼 4년차지만 둘다 바빠 집에서는 잠만 잔다. 지난 토요일 한 달 만에 가스레인지의 불을 켜봤다. 이렇게 스트레스 받으며 일하니 아이를 가질 엄두가 안 난다. 내 몸도 몸이지만 아이에게 영향이 가지 않을까 걱정이다. 야근하면서 아이를 키울 자신도 없다.야근은 의무 구태 여전 법제도적 허점 숭숭야근이 사라지지 않는 데는 밤 근무를 당연시하는 문화와 법제도적 허점이 두루 작용하고 있다. 일부 사업장에서는 여전히 야근근면 공식이 통용된다. 반도체 부품업체에서 일하는 김모 대리는 새로 온 부장이 얼마전 자네는 너무 야근을 안 한다고 말하고는 인사고과에서 가장 낮은 점수를 줬다며 입사 후 S A만 받았고 올해 업무 실수는커녕 세 사람이 할 일을 혼자 했는데도 그러더라며 분통을 터트렸다. 김 대리는 지인의 회사에서는 집에 가서 뭐 하냐 일 없으면 회사 나와서 공부라도 하지라고 공공연히 말한다고 전했다.한 사람당 업무가 늘어나도 기업에서 신규 채용을 꺼리는 것도 문제다. 실제 김 대리의 반도체부품회사는 지난 6년간 매출은 비슷했음에도 개발팀 인원이 9명에서 3명으로 줄었다. 김 대리는 일이 많다보니 한 동료는 아들이 태어날 때도 상사가 나도 아기 낳아봤다 굳이 아빠가 갈 필요 없다며 붙잡아 부인 옆에 있어주지 못했다고 말했다. 서울과학기술대 글로벌경영학과 노용진 교수는 세계적으로 기업 생산성이 올라가면 사람을 줄이거나 개별 노동자의 업무 시간을 줄여왔는데 기업은 통상 사람을 줄이는 걸 선호한다며 그럼에도 노동시간이 지속적으로 감소한 건 정부 정책과 노조의 활동 때문이라고 설명했다. 전문가들은 입을 모아 현행법의 허점을 꼬집는다. 한국노동사회연구소 김유선 선임연구위원은 현재 전체 노동자의 19 357만명이 주 52시간 이상을 일한다며 주 5일제에서 제외되는 특례업종적용제외 업종이 많은 데다 노동부가 토일요일 근무는 주 52시간에 포함하지 않아 문제라고 지적했다. 노동부 해석에 따르면 주 5일제 아래서도 휴일 16시간을 더해 최대 주 68시간 근무가 가능하다. 게다가 현행법조차 제대로 지켜지지 않는다. 지정노무법인 소민안 수석책임노무사는 근로기준법을 위반해 연장근로를 시키면 2년 이하 징역이나 1000만원 이하 벌금이 규정돼 있으나 사실상 처벌되는 사업장이 거의 없다고 설명했다.주 5일제가 남의 나라 얘기인 노동자도 여전히 많다. 소 노무사는 식당 등 요식업종은 주 6일 하루 12시간 근무가 보편적이라 저녁 없는 삶을 넘어 밤 없는 삶을 산다며 병원도 경쟁이 심화하면서 주 6일 하루 10시간 근무가 일반화한 곳이 많다고 밝혔다. 소 노무사는 운수업종은 대표적으로 근로시간이 많은 업종인데 특히 마을버스 기사는 월 26일 2교대로 일하고 택배업 종사자의 상황도 열악하다고 전했다.긴 노동시간 생산성 저하로 이어져일하는 시간은 길지만 OECD 기준 한국의 시간당 노동생산성은 하위권을 맴돈다. 한국생산성본부가 OECD 34개 회원국을 비교한 결과 2013년 기준 우리나라의 시간당 노동생산성은 29. 고생은 고생대로 하고 결실이 적은 이유는 영세 자영업자의 생산성이 떨어지기 때문이다. 일부 제조업의 생산성은 오히려 상위권이다.보다 근본적으로 오래 일하면 자연히 생산성이 떨어질 수밖에 없다. 노동생산성은 실질 국내총생산GDP을 노동투입량으로 나눠 구한다. 여기서 노동투입량은 총 노동시간에 취업자 수를 곱하기에 근로시간이 길면 자연히 분모가 커져 생산성이 떨어진다. 한국노동연구원 김승택 본부장은 우리나라의 1인당 노동생산성은 선진국보다 낮다고 볼 수 없으나 시간당 생산성이 떨어진다며 선진국보다 시설장비업무환경 투자가 부족한 데다 오래 일하는 게 습관이 돼 업무 집중력이 낮을 수밖에 없다고 설명했다. 이어 선진국형 경제로 가려면 장시간 근로는 오히려 저해요인이고 기술 발전을 통해 한 단계 올라서야 한다며 더 나은 관리시스템과 자원 투자로 일하는 시간을 줄여야지 언제까지 인건비로 돈을 벌 것인가라고 지적했다.수당이 제대로 책정되지 않는 것도 한 요인이다
'해맞이 가던 차량서 불'…영동고속도로 둔내터널 정체	http://news.naver.com/main/read.nhn?mode=LSD&mid=shm&sid1=102&oid=001&aid=0008088536&cid=428288	해맞이 가던 차량서 불    횡성 31일 오후 9시 41분께 강원 횡성군 둔내면 삽교리 영동고속도로 강릉 방면 166 지점 3차로를 달리던 소나타 승용차운전자 배모45에 불이 나 신고를 받고 출동한 소방대원이 진화작업을 하고 있다. 불은 차량 전체를 태우고 신고를 받고 출동한 119 소방대원에 의해 40여 분만에 꺼졌으며 이 사고로 둔내터널부근 5 구간이 극심한 정체를 빚고 있다.31 횡성소방서 제공    conanysyna.kr    횡성 박영서 기자  31일 오후 9시 41분께 강원 횡성군 둔내면 삽교리 영동고속도로 강릉 방면 166 지점 3차로를 달리던 소나타 승용차운전자 배모45에 불이 났다.    불은 차량 전체를 태우고 신고를 받고 출동한 119 소방대원에 의해 40여 분만에 꺼졌다.    배씨 등 일가족 4명은 강릉으로 해맞이를 가던 중이었으며 신속히 대피해 인명피해는 없었다.    이 불로 둔내터널부근 5 구간이 극심한 정체를 빚고 있다.    경찰과 소방당국은 갑자기 보닛에서 불꽃이 튀더니 30초도 되지 않아 불이 커졌다는 배씨 가족의 진술을 토대로 엔진과열로 불이 난 것으로 보고 정확한 화재 원인을 조사하고 있다
내 거 아닌 내 거 같은 '똑똑한 소비' 뜬다	http://news.naver.com/main/read.nhn?mode=LSD&mid=shm&sid1=101&oid=022&aid=0002986062&cid=428288	2016 나눔이 미래다 이제는 공유경제 시대세계 경제는 저성장으로 신음하고 있지만 되레 뜨고 있는 분야가 있다. 2008년 8월에 설립된 에어비엔비Airbnb가 단적인 사례다. 자기 집에 남는 방을 빌려주려는 사람과 그곳에서 묵고 싶은 이들을 연결해주는에어비엔비는 설립 4년 만에 전 세계 곳곳에 무려 65만개의 숙소를 확보해 동종 업계를 경악시켰다.세계 최대 규모의 호텔 체인을 보유한 인터콘티넨털호텔 그룹이 100개국에 64만5000개의 객실을 확보하는 데 65년을 쏟아부은 것을 감안하면기적에 가까운 일이다. 에어비엔비는 현재2015년 12월 190여개국 3만4000개 도시에 200만개의 숙소를 확보 누적 게스트 6000만명을 돌파했다. 차량 공유기업인 우버Uber는 포브스가 추산한 기업가치가 무려 680억달러약 80조원에 달한다. 창업 5년 만에 107년 전통의 제너럴모터스GM의 기업가치를 넘어선 것이다.2008년 로런스 레시그 하버드대 교수가 저서 리믹스에서 상업경제와 구분하면서 처음 쓴 공유경제가 저성장으로 신음하는 자본주의의 대안으로 부상했다. 미래학자인 제러미 리프킨 교수가 최근 펴낸 한계비용 제로 사회에서 예리하게 간파한 것도 공유경제의 힘이다. 한계비용이 제로에 달해 스스로 무너질 수밖에 없는 자본주의의 구원투수가 공유경제라는 논리다.구글에서 sharing economy를 검색하면 9160만건12월17일 기준의 검색 결과가 쏟아진다. capitalism자본주의3580만건나 marxism마르크스주의809만건과 현격한 차이를 보인다. 자동차 공유 서비스 기업인 집카Zipcar의 창업자인 로빈 체이스는 최근 파리 기후변화회의 세미나에서 산업 자본주의는 더 이상 미래가 아니다라며 공유경제 시대의 도래를 역설했다.미국 시장조사업체 매솔루션에 따르면 2014년 세계 공유경제 시장 규모가 100억달러약 11조8000억원를 넘었다. 미국 공유경제 조사기관인 크라우드 컴퍼니Crowd Companies의 제러미아 어우양이 조사한 결과에 따르면 지난 15년간 약 260억달러약 30조6800억원가 공유경제 분야로 유입됐다. 미국 컨설팅업체 프라이스워터하우스쿠퍼스PwC는 2025년까지 세계 공유경제 시장이 3350억달러약 395조원 규모로 커질 것이라고 전망했다.공유의 대상도 단순한 물건이나 시간을 넘어 지식과 재능 시간 등 무형의 자산으로 확장하고 있다. 일본에서 시작돼 미국과 영국 등 14개국에 퍼진 타임뱅킹은 개인들의 시간을 공유하는 것이다.공유경제의 성장은 스마트폰으로 촉발했고 사물인터넷생활 속 사물들을 유무선 네트워크로 연결해 정보를 공유하는 환경 시대와 함께 폭발적으로 팽창할 것이다. 이 모두가 빈 방이나 노는 차의 정보를 실시간으로 공유할 수 있는 길을 튼 스마트폰과 사물인터넷으로 거대한 공유지가 눈앞에 펼쳐졌기에 가능한 일이다. 모두에게 공유되는 자원은 이기심으로 비극을 초래한다는 공유지의 비극 이론의 자리를 공유지의 희극이 대체할 날도 머지않았다.돈의 흐름에 민감한 이들이 이를 놓칠 리 없다. 렌터카 업체 에이비스Avis는 집카를 2015년 3월 벤처캐피털은 자동차 공유기업 우버에 12억달러1조4160억원를 투자했다. 6월에 에어비엔비는 실리콘밸리에서 15억달러1조7700억원를 유치했다.영국은 유럽 공유경제의 수도로 불린다. 세계적인 공유경제와 연관된 사업의 10가량이 영국에 본사를 두고 있다.com은 앱을 통해 요청하면 근처에 있는 청소부를 찾아주는 서비스다. 엄청난 인기를 끌자 경쟁사인 독일 업체에 지난 7월 3200만파운드약 565억원에 인수됐다.프랑스에서는 카풀 중개 서비스를 제공하는 블라블라카BlaBlaCar가 폭발적인 인기다. 2006년에 설립된 블라블라카는 운전자가 출발지와 도착지를 올리면 일정이 맞는 이들이 비용을 내고 동승한다. 블라블라카는 1015의 수수료를 받는다. 블라블라카는 지난 9월 미국의 3개 벤처캐피털 회사로부터 1억8000만유로약 2303억원를 조달하면서 몸값이 15억달러약 1조7685억원로 평가됐다. 19개국에서 서비스를 제공하는데 이용자는 200만명에 달한다.독일에선 음식재료를 공유하는 푸드셰어링foodsharing과 집에 있는 공구를 나눠 사용하는 프렌츠Frents가 많은 인기를 얻고 있다. 공산주의 국가였던 러시아에서도 경제 위기 여파로 공유경제 산업이 부상하고 있다. 러시아에서 에어비엔비의 매출은 최근 1년간 두 배 이상 늘었다
잇따른 성폭행 의혹…미국 '국민 아빠' 결국 법정에	http://news.naver.com/main/read.nhn?mode=LSD&mid=shm&sid1=104&oid=437&aid=0000103480&cid=428288	끊임없는 성폭행 의혹을 받아온 미국의 국민 아빠 코미디언 빌 코스비가 결국 재판을 받게 됐습니다. 본인은 혐의를 부인하고 있지만 피해 여성이 50명이 넘습니다. 기자1980년대 방영된 TV 시트콤 코스비 가족.빌 코스비는 익살스러운 표정과 다정다감한 이미지의 아버지 역할로 큰 인기를 얻었습니다.2002년에는 미국인의 가장 큰 영예인 자유의 메달을 받기도 했습니다.사랑과 존경을 한몸에 받았던 코스비의 명성은 그러나 한 순간에 바닥에 떨어졌습니다.지난해 말 코스비에게 성폭행을 당했다는 피해 여성들의 증언이 줄지어 나오기 시작했습니다. 올 7월엔 피해 여성 35명이 잡지 표지모델로 등장해 코스비를 정면 비난했습니다. 피해 여성들의 호소에 드디어 법원이 응답했습니다.펜실베니아 주 검찰이 2004년 대학 여자 농구단 여성 코치를 성폭행한 혐의로 코스비를 가중 강제추행과 1급 중범죄 혐의로 기소한 겁니다.케빈 스틸르미국 펜실베니아 주 몽고메리 카운티 검사  빌 코스비는 여성에게 약과 술을 먹여 몸을 제대로 움직이거나 반응할 수 없게 만들었습니다. 코스비는 그동안 피해 여성을 맞고소까지 해가며 번번이 법의 심판을 피해왔습니다.부소현 JTBC 뉴스 공식 SNS 트위터 페이스북 카카오스토리 유튜브 JTBC 뉴스는 여러분의 생생한 제보를 기다립니다
日언론 "소녀상 이전과 10억엔 출연 연계는 아베의 뜻"	http://news.naver.com/main/read.nhn?mode=LSD&mid=shm&sid1=104&oid=001&aid=0008088515&cid=428288	자료사진아베 1월 4일 국회서 입장 밝힐 듯     도쿄 조준형 특파원  서울의 일본대사관 앞 소녀상의 이전과 군위안부 지원 재단 출연금을 연계하는 것이 아베 신조 총리의 의사라고 일본 언론이 보도했다.     교도통신은 31일 주한 일본대사관 앞 소녀상이 철거되지 않는다면 한국과 합의한 10억 엔약 97억 원을 출연하지 않을 의향을 일본 정부가 가지고 있다고 소개했다. 또 이 같은 의향은 아베 총리의 강한 의지를 반영한 것이라고 교도는 전했다.     또 지지통신의 취재에 응한 일본 정부 관계자는 주한 일본대사관 앞 소녀상이 철거되지 않는 한 자금을 낼 수 없다는 것이 총리의 의향이라고 말했다.     한국에서 한일간 군위안부 합의에 대한 반발 여론이 피해자 측과 야권을 중심으로 거세게 제기되는 가운데 일본이 소녀상 철거와 자금 출연을 강하게 연계할 경우 합의 이행이 미뤄질 가능성을 배제할 수 없을 전망이다.     12월 28일 한일 외교장관 회담 후 합의사항 발표때 윤병세 외교장관이 소녀상에 대한 일본 정부의 우려를 인지하고 적절히 해결되도록 노력하겠다고 했지만 합의 사항 중 소녀상과 일본의 자금 출연을 연계하는 내용은 없다.     아베 총리는 1월 4일 일본 정기국회가 개회하면 소녀상 철거와 재단 출연에 대해 질문을 받고 공식적인 입장을 밝힐 것으로 보인다
中 "독자기술로 두번째 항모 건조" 첫 공식발표	http://news.naver.com/main/read.nhn?mode=LSD&mid=shm&sid1=104&oid=001&aid=0008088192&cid=428288	AP자료사진일반동력 사용 5만t급 제2호 중국항모이자 제1호 중국산항모건조완료 시점은 2018년께로 추정       베이징 이준삼 특파원  중국 국방부는 현재 중국이 독자적인 기술로 배수량 5만t급의 두 번째 항공모함을 다롄에서 건조하고 있다는 사실을 처음으로 공개했다.    양위쥔 중국 국방부 대변인은 31일 열린 정례브리핑에서 유관기관이 현재 각 분야의 요소들을 종합적으로 고려해 두 번째 항공모함 연구제작프로젝트을 시작했다고 말했다.    또 이 항모는 완전히 우리나라가 자주적으로 설계했다. 현재 다롄에서 건조되고 있다고 설명했다.      중국은 2012년 9월 1호 항모 랴오닝호6만7천500t급 갑판 302m를 취역시키며 항모 보유국 대열에 들어섰다.    그러나 이 항모는 구소련이 제작하던 쿠즈네초프급 항공모함 바랴그호를 개조한 것이다.     따라서 다롄에서 건조되고 있는 항모는 중국의 두 번째 항모이자 중국이 자력으로 건조하는 첫 항모가 된다.  중국첫 항공모함 랴오닝호 자료사진    양 대변인은 이 항모의 배수량이 5만t급이라고 밝히며 핵동력이 아닌 일반동력을 채택했다고 설명했다.     또 중국산 젠15 등의 함재기와 다른 고정직 항공기 등을 탑재할 수 있다면서 전투기의 이륙 방식은 스키점프 방식이 채택됐다고 덧붙였다.    그는 이 두 번째 항모가 랴오닝호의 과학실험 훈련 등의 경험을 흡수했고 아주 많은 부분에서 새로운 개조개량이 이뤄졌다며 랴오닝호보다 전투력이 우수할 것임을 시사했다.    중국이 자국산 항모 건조 사실을 공식 확인한 것은 이번이 처음이지만 이는 사실 지난해 초부터 기정사실화됐다.    특히 왕민 랴오닝성 서기가 지난해 1월 성 인민대표대회 토론회에서 중국의 두 번째 항모가 다롄에서 건조되고 있다며 2018년께 해당 항모가 완성될 것임을 시사했다.     그는 중국이 4척의 항모를 보유하게 될 것이라고 말한 것으로 전해졌다.    중국은 1985년 호주로부터 배수량 1만 7천t급의 소형 퇴역 항모 멜버른호를 사들여 철저히 해체해가며 활주로 설계 등 주요 항모 건조 기술을 수십년 간 연구해온 것으로 알려졌다
안 주고, 늦게 주고…실손보험 불만 폭증	http://news.naver.com/main/read.nhn?mode=LSD&mid=shm&sid1=101&oid=056&aid=0010268198&cid=428288	멘트 실손의료보험  실제 부담한 의료비를 대부분 보장해 준다는 건강보험인데요. 보험회사들은  지난해 손해율이 138다 그러니까 가입자에게  보험료 100원을 받아 보험금 138원이 나갔다고 울상을 지을 정도로 가입자에게 유리하다고 알려진 보험입니다. 계약 건 수는 계속 늘고 있습니다. 올해 상반기 현재  3100만 건에 이릅니다. 어떤 보험보다 보험회사와 가입자의 이익이  크게 충돌하다보니 보험금 지급 거절 등에 대한 소비자 불만도 급증세입니다. 리포트 디스크 진단을 받고 지난달 목과 허리 시술을 받은 50대 주부입니다. 비용이 6백 만원 가까웠지만  지난해 가입한 실손의료보험만 믿었습니다. 그런데 보험사는 한 달 넘도록 보험금을 지급하지 않고 있습니다. 가입 23년 전 물리치료 받은 사실을  미리 알리지 않았다고 이유를 댔습니다.인터뷰 김추옥서울시 중랑구  교통사고 난 거만 고지가 돼 있지 나머지는 고지가 안돼 있다는 거예요.설계사가 기록을 안 했는지 몰라도 저는 했거든요. 제2의 국민건강보험이라 불릴 정도로 가입자가 늘었지만 실손의료보험 관련 소비자 불만은 급증세입니다. 올해 1200건을 넘어서면서 1년 전보다 3배 가까이 늘었습니다. 보험료를 제때 주지 않거나 아예 안 주는 경우가 가장 많고 판매원의 설명이 불충분한 불완전 판매 일방적인 계약 변경도 불만입니다.인터뷰 정지연한국소비자연맹 사무총장  약관상에서 보상의 내용에 대해서 충분하게 명확하게 기재돼 있지 않은 것이 분쟁의 원인으로 발생하고 있는 것 같습니다.분쟁을 예방하기 위해서는 보장 기간을 최대한 길게 하고 암과 골절 등의 특약이 포함된 비갱신형 가입이 좋습니다
문형표 국민연금 이사장 취임…노조 '임명 철회하라'	http://news.naver.com/main/read.nhn?mode=LSD&mid=shm&sid1=102&oid=079&aid=0002784988&cid=428288	전북CBS 임상훈 기자문형표 전 보건복지부장관사진윤성호 기자자료사진대행체제로 운영되던 국민연금공단 이사장에 문형표 전 보건복지부장관이 취임하자 공단 노조가 강하게 반발하고 있다.문형표 신임 이사장은 31일 오후 4시 전주시 덕진구 공단 본부 사옥에서 취임식을 열고 국민연금을 모든 국민이 진정으로 믿고 의지하며 사랑할 수 있는 제도로 발전시키겠다고 포부를 밝혔다.문 이사장은 이어 급속한 인구 고령화와 저출산 추세 저성장 기조와 세계 경제의 불확실성 등의 어려운 상황에서 국민연금은 노후소득보장 기능 강화와 건실한 연금재정 운영이라는 두 마리의 토끼를 모두 잡아야 하는 숙제를 안고 있다고 강조했다.취임사를 통해 문 이사장은 국민연금에 대한 국민의 신뢰 구축 연금 사각지대 해소 기금운용 능력 발전 등을 약속했다.하지만 국민연금공단노조는 환영 대신 문 이사장의 임명 철회를 촉구했다.노조는 이날 낮 12시 30분 공단 본부 앞에서 기자회견을 열고 메르스 확산을 방치해 38명의 생명을 앗아간 장본인인 문 전 장관은 국민연금공단 이사장이 될 자격이 없다며 메르스 사태의 최종 책임자가 징계는커녕 이사장으로 금의환향하는 것을 국민이 납득할 수 없을 것이다고 주장했다
