"흔들리는 느낌"…트라우마 시달리는 사람들	http://news.naver.com/main/read.nhn?oid=055&sid1=102&aid=0000453503&mid=shm&viewType=pc&mode=LSD&nh=20160914203846	지진처럼 큰 자연재해나 대형사고를 겪고 나면 트라우마 즉 불안감에 시달리는 사람들이 많습니다.주변이 조금만 흔들려도 큰 지진이 난 것 같은 공포감을 느낀다고 하는데 어떻게 대처해야 할지 송성준 기자가 취재했습니다.기자그제12일 지진의 여파로 주차장 도로 땅바닥이 심하게 갈라졌던 부산의 한 아파트.20년이 넘은 노후 아파트에서 벌어진 일이라 주민의 불안감은 더합니다.아파트 입주민부산시 영도구  심리적으로 매일 밤 누워있으면 막 흔들리는 듯한 느낌이 든다니까요.30층 고층 아파트에서 지진을 경험한 40대 주부도 그날의 공포심이 여전히 남아 있다고 말합니다.조재옥부산시 해운대구  그때의 공포심이 굉장히 컸던 것 같아요. 그게 남아있기 때문에 무서워요.영화관에서 영화를 보다가 놀라 뛰어 나오기도 하고 슈퍼에서 물건을 사다가 건물 밖으로 뛰쳐나오기도 하고 이후 겪을 수 있는 지진 트라우마는 젊은 사람들도 예외가 아닙니다.황인지경북 경주시  지진이 아닌데도 괜히 예민해져서 지진이라고 느끼는 경우도 있고 트라우마가 생겼어요.인터넷이나 SNS에도 이런 증상을 호소하는 사람이 적지 않습니다.전문의들은 이번 지진으로 가벼운 외상 후 스트레스성 장애가 나타날 수 있다고 지적합니다.이준혁정신과 전문의  가까운 사람들 하고 따뜻하게 지내는 것도 좋고 심할 경우 전문의를 찾아가 약물치료를 받는 것도 빨리 도움을 받을 수 있죠.증상이 심하지 않다면 시간이 지나면서 자연스럽게 증상이 사라질 수 있다며 심리적인 안정을 찾는 게 중요하다고 강조했습니다
뒷좌석이야말로 안전 벨트가 '생명줄'…사고 시 더 위험	http://news.naver.com/main/read.nhn?oid=437&sid1=102&aid=0000131381&mid=shm&mode=LSD&nh=20160914232341	지금 차타고 고향가시는 분들 안전벨트 모두 매셨는지요. 앞좌석에선 잘 매면서도 뒷좌석은 괜찮겠지 하는 분들 계실텐데. 실제 사고가 나면 앞좌석과 부딪혀 훨씬 위험하다고 합니다.기자터널 벽면을 들이받은 버스가 그대로 넘어집니다. 차량 앞부분이 완전히 부서졌고 옆 유리는 모두 깨졌습니다. 사고 당시 유치원생 21명 등 23명이 타고 있었지만 크게 다친 어린이는 없었습니다. 차량 옆면이 뒤틀어지고 차체는 내려 앉았습니다. 빗길에 미끄러져 옹벽을 들이받은 렌터카. 타고 있던 고교생 5명은 사고 즉시 모두 숨졌습니다.삶과 죽음을 가른 차이는 단 하나. 버스 승객은 모두 안전벨트를 착용했고 렌터카에 탄 고교생들은 운전자 1명을 빼면 모두 매지 않았습니다.우리나라 앞좌석 운전자 안전벨트 착용률은 93로 비교적 높습니다. 뒷자리는 상대적으로 안전할 거라는 인식 때문인데 실제로 사고가 나면 치명적입니다.  시속 48km로 달리는 차량의 충돌 실험 장면.뒷좌석 인형이 튕겨나가 운전자 뒤를 들이받습니다. 어린아이 인형은 앞좌석에 부딪힌 뒤 그대로 공중으로 뜹니다. 박천수 책임연구원삼성교통안전문화연구소  앞좌석 탑승자의 머리를 직접 부딪힐 수도 있고요. 앞 유리창을 깨면서 튕겨 나간다면 도로 노면과 직접 부딪힐 수도 있기 때문에이 때문에 전문가들은 모든 도로에서 모든 좌석의 안전벨트 착용을 의무화해야 한다고 지적합니다.문현경 JTBC 뉴스 공식 SNS 트위터 페이스북 유튜브Copyright by JTBChttpjtbc
독일 바이엘, 74조원에 몬산토 인수 합의	http://news.naver.com/main/read.nhn?oid=001&sid1=101&aid=0008686862&mid=shm&mode=LSD&nh=20160914230950	바이엘의 로고AP 자료사진전액 현금 지급인수 종료되면 세계최대 농업회사 중 하나로 탄생    뉴욕 박성제 특파원  독일의 화학제약 업체인 바이엘이 세계최대 종자 회사인 미국의 몬산토를 인수하기로 합의했다.    바이엘은 14일현지시간 660억 달러약 74조2천800억 원채권 포함에 몬산토를 인수하기로 두 회사가 합의했다고 발표했다.    바이엘은 주당 128달러를 전액 현금으로 지급할 계획이다.    이는 지난주 최종 제안이었던 주당 127.50달러보다 소폭 오른 것이라고 바이엘은 설명했다.    바이엘이 지난 5월에 주당 122달러에 처음 제시했던 가격보다는 약 5 높은 것이다.     또 바이엘의 인수가 수면위로 올라오기 하루 전인 5월 9일과 비교하면 44의 프리미엄이 붙은 것이다.     최종 타결된 인수금액은 올해 이뤄진 인수합병MA으로는 최대 규모이며 현금 MA로는 사상 최대이다.    또 독일 회사가 외국 기업을 인수한 사례로도 최대 규모이다.    이번 인수 합의는 주주들의 승인과 규제 당국의 심사를 거쳐야 한다.    인수가 마무리되면 세계최대 농업회사 중 하나가 탄생하게 됐다.    업계에서는 종자 및 살충제 산업의 약 25를 바이엘이 차지할 것으로 전망하고 있다.    바이엘은 5월에 처음 인수를 제안한 이후 3번이나 인수가격을 상향한 끝에 인수 협상을 타결지었다.    인수가 완료되면 바이엘은 제약사업과 곡물 사업의 비중이 50 대 50 수준으로 균형을 맞추게 된다.    지난해의 경우에는 제약사업이 70 곡물 사업이 30 수준이었다.    바이엘은 몬산토를 인수한 뒤 세 번째 연도부터는 15억 달러의 시너지를 만들어 낼 것으로 기대하고 있다.    지금까지 바이엘의 곡물 사업은 살충제 제조 위주여서 종자 개발이 주요 사업인 몬산토와는 별로 겹치지 않는다.    양사의 협상 타결 소식이 알려진 이후 몬산토의 주가는 뉴욕증시에서 0
대만 태풍 '므란티' 빠져나가기도 전에 '말라카스' 접근	http://news.naver.com/main/read.nhn?oid=421&sid1=104&aid=0002280400&mid=shm&mode=LSD&nh=20160914225122	제14호 태픙 므란티가 대만에 상륙했다. 사진출처 CNN 서울 정은지 기자  제14호 태풍 므란티가 대만을 지나가자 마자 16호 태풍 말라카스가 곧바로 대만에 상륙할 것으로 보인다. 대만 기상당국은 14일현지시간 므란티의 강도와 풍속이 다소 주춤해지기 시작했다고 밝혔다. 기상당국 관계자는 현재 방향과 속도대로 간다면 15일 오후 중국 대륙에 상륙할 것이라고 밝혔다. 그러나 므란티가 대만을 빠져나간 이후 다음 태풍이 접근할 것이라고 밝혔다. 이 관계자는 말라카스가 이미 중형급 태풍으로 확대됐다며 이르면 15일 밤 16일 새벽 사이 태풍 경보가 내려질 것이며 17일 대만 본토에 접근해 영향권에 들어설 것이라고 말했다. 중앙기상국에 따르면 말라카스는 대만 최남단 어란비 지역에서 1380km 가량 떨어져있다. 이 태풍은 현재 시속 1922km의 속도로 접근중이다. 한편 이날 므란티가 대만에 접근하면서 강풍을 동반한 큰 비가 내렸다.  오전 11시까지 핑둥의 다우산 지역에는 570mm에 달하는 비가 내렸다. 화롄과 타이둥 일부 지역에서도 300mm의 강우량이 집계됐다.므란티의 영향으로 최소 2명이 부상했고 26만명이 정전으로 불편을 겪었다. 또 370편에 달하는 국내선 및 국제선 항공편 및 열차편의 운항도 취소됐다. 대만 재난당국은 이날 오전까지 1500명이 긴급 대피했으며 약 4000명의 군경을 투입해 복구를 진행중이라고 설명했다
불길 속 이웃 살리고 '식물인간'	http://news.naver.com/main/read.nhn?oid=449&sid1=102&aid=0000110148&mid=shm&mode=LSD&nh=20160914213837	서울 도심의 한 주택가에서 한밤 중에 큰 불이나 자칫하면 큰 인명피해가 날 뻔 했는데요.잠든 이웃들을 깨우고 대피시킨 20대 의인이 있습니다. 그런데 정작 본인은 불 속에서 지쳐 쓰러진 뒤 사경을 헤매고 있습니다. 허욱 기자의 단독 보도입니다. 리포트이른 새벽 5층 짜리 빌라 창문으로 시커먼 연기가 뿜어져 나오고주민들은 소방관의 부축을 받아 가까스로 몸을 피합니다.이 건물에 사는 동거녀의 이별 통보에 격분한 20대 남성이 저지른 화재 사건. 다행히 큰 인명 피해를 막은 건 첫 신고자인 28살 안치범 씨 덕분이었습니다.이 건물 4층에 사는 안 씨는 신고 전화를 마치고 연기 자욱한 건물 안으로 뛰어 들기까지 했습니다. 가장 먼저 119에 신고한 안 씨는 건물 안으로 들어와 집집마다 다니며 문을 두들기고 잠자던 이웃들을 깨웠습니다. 심모 씨  빌라 4층 주민나오세요 소리가 계속 들리고 문을 두드리더라고요. 다른 두 분도 똑같은 소리를 듣고 잠에서 깼다고.하지만 정작 안 씨는 유독 가스에 질식해 5층 계단에 쓰러진 채로 발견됐습니다.일주일 가까이 식물인간 상태로 사경을 헤매고 있습니다.평소 정의감이 남달랐던 안 씨의 사고 소식에 가족들은 할 말을 잃었습니다.안치범 씨 누나엄마가 치범아 저런 상황이 생기면 네 몸 잘 챙기라고 얘기를 했는데 엄마는 그렇게 살면 안된다. 그런 일이 있으면 사람을 구해야지  가족들은 뇌사 판정이 임박한 안 씨의 장기를 기증하는 방안을 논의 중입니다.안치범 씨 누나 어쨌든 사람 구하러 들어갔다가 그렇게 된거니깐 치범이는 장기기증하는 것을 원하지 않겠느냐 채널A 뉴스 허욱입니다
탈북민 3만 명 시대…'마음의 거리' 좁혀야	http://news.naver.com/main/read.nhn?oid=055&sid1=102&aid=0000453521&mid=shm&mode=LSD&nh=20160914210820	1997년 북한 이탈 주민 보호와 정착 지원 관련법이 생긴 이래 국내에 들어온 탈북민은 다음 달 3만 명을 넘어설 것으로 보입니다. 이제까지 탈북민에 대한 도움은 경제적 지원 위주였지만 마음의 거리를 좁히는 일도 간과할 수 없는 과제입니다.탈북민 시리즈 첫 순서로 우리 사회에 적응하고 있는 탈북민의 모습을 정혜진 기자가 둘러봤습니다.경상북도에서 태어난 이재훈 씨와 함경북도가 고향인 박소현 씨.부부의 연을 맺은 지 올해로 6년째입니다.박소현  대한민국 남자들 대단하다 가족을 위해서 헌신을 하는 게 보이니까 너무 멋있는 거 같아요.이재훈  탈북주민이라는 걸 아내를 처음 봤고 처음 알았으니까요.2009년 남한에 온 박 씨는 다이어트를 위해 춤을 배웠다가 이제는 댄스학원 원장이 됐습니다.남편은 퇴직금을 중간 정산받아 보탰고 대회에 함께 나가 입상할 만큼 후원자 역할을 톡톡히 하고 있습니다.박소현  희망을 잃지 말고 포부를 가지고 내가 잘살 수 있다 내가 성공할 수 있다고 생각하면 잘 정착을 할 거 같아요.추석을 앞두고 탈북 여성 봉사단이 대학생들과 함께 송편 만들기에 나섰습니다.통일에 대한 염원을 안고 만들어 주시면 감사하겠습니다북한식 송편을 만들어 독거노인들에게 대접하려는 겁니다.백춘숙탈북여성 여원봉사단 회장  우리도 같은 민족이잖아요. 거리감 없이 바라봐줬으면 좋겠다는 바람이고요.이인정고려대 사회봉사단 대표  탈북민을 만나 뵙기 전에는 되게 긴장을 많이 했었는데 만나 뵙고 나니까 되게 엄마 같으시고.지난 6월 말까지 국내에 들어온 탈북민은 2만 9천5백 명 다음 달이면 3만 명을 넘어설 전망입니다.손광주남북하나재단 이사장  앞으로 통일 시대를 맞이해서 그 실질적인 통일 준비를 하는데 굉장히 소중한 존재들입니다.이제는 단순히 경제적 지원을 넘어 마음의 거리를 좁히기 위한 고민과 노력이 필요합니다
'청년 상인들'의 도전…전통시장을 바꾼다	http://news.naver.com/main/read.nhn?oid=056&sid1=102&aid=0010362139&mid=shm&mode=LSD&nh=20160914232244	멘트 침체됐던 전통시장에 청년 상인들이 속속 뛰어들고 있습니다.  젊은이들이 신선한 감각과 아이디어로 활력을 불어넣으면서 전통시장의 모습도 과거와는 크게 달라졌는데요.   박혜진 기자가 취재했습니다. 리포트 전통시장 옆 개울을 따라  판매대 수십 개가 길게 늘어섰습니다. 손으로 만든 카드에 봉제 인형 도자기까지. 바로 옆 전통시장에서는 볼 수 없는 아기자기한 물건들이  눈길을 사로잡습니다. 청년 상인들이 주말마다 문을 여는 개울장입니다. 인터뷰 김은주청년 상인  아무래도 연령층도 젊어진 것 같아요. 전통시장에 젊은 친구들은 잘 볼 수 없잖아요. 색다른 볼거리에 젊은 층의 발길이 이어지면서  만 명 정도이던 주말 손님은 두 배 넘게 늘었습니다. 인터뷰 백재선서울 정릉시장 상인  사람들이 많이 왕래가 많아졌다라는 게  피부로 느낄 수 있을 정도로 달라졌습니다. 직접 만든 폰 케이스를 진열해 판매하고  녹취 이건 제가 조금 더 늘려드릴게요. 손님에게 어울릴만한  액세서리를 추천하기도 합니다. 청년들이 만든 개성 있는 수제품 덕에 이 시장도 입소문이 났습니다. 인터뷰  이화영청년 상인  저렴한 가격으로 저희는 나와서 작업을 하면서 이제 이 시장을 중심으로 많은 사람이 찾아오시고
