美 '대입시험' SAT 문제 통째로 유출	http://news.naver.com/main/read.nhn?mode=LSD&mid=shm&sid1=102&oid=214&aid=0000618774	우리의 수능 같은 미국 대입자격 시험 SAT의 문제를 유출해서 강남의 유명학원들이 가르치고 있다는 얘기 있었는데요.몇 문항이 아니라 실제 시험지가 통째로 교재로 사용되고 있는 것이 확인됐습니다.SAT는 한 번 나온 문제의 조합이 반복 출제되기 때문에 기출문제지를 모아서 보면 만점도 받을 수 있다는 얘기입니다.저희 왕종명 기자가 이 시험지 몇 년치를 단독으로 입수했습니다. 리포트 강남 학원가를 돌며 SAT 시험지 사본이 있는지 물었습니다. 문제가 한두 문제가 아니고 세트가 15세트 이렇게 있거든요. 점수는 뭐 무조건 나올 거예요.C SAT학원14개세트를 어디서부터냐면 2013년 후반부터 15년 초 1월까지.학원가에서 교재로 사용되는 SAT 미국사 과목의 시험지 사본입니다.함부로 복사하는 건 불법이란 경고가 페이지마다 있지만 누군가 3년치 문제를 통째로 복사했습니다.김 모 씨A SAT학원 원장급했겠죠. 빨리 복사를 해서 원래 자리에 갖다 놔야지만 시험지를 그대로 다 회수를 해야만 하거든요.수학2 과목은 4년치 시험지를 한장 한장 사진 찍었습니다.SAT는 전 세계 170여 개 나라에서 대개 1년에 6번 치르는데 이미 개발해 놓은 문제 은행에서 문제를 뽑아서 출제합니다.한번 나온 문제가 반복해서 또 출제되기 때문에 시험을 주관하는 미국 칼리지보드사는 문제지를 절대 공개하지 않습니다.취재진이 입수한 시험지 사본을 비교해보니 2013년 12월 문제와 2012년 6월 문제 2014년 11월과 2013년 10월 두 쌍의 시험지가 내용은 물론 순서까지 완전히 똑같습니다.이런 시험지가 유출돼 강남 학원가에서 버젓이 교재로 사용되고 있는 겁니다.김 모 씨A SAT학원 원장같은 시험지를 반복적으로 풀려서 결국에는 답을 외우도록 하는 거죠. 만점 받을 수 있어요. 어느 날 가서 시험을 봤는데 이거 하고 똑같은 시험지가 나오지 않았다 그러면 취소를 하고 다음 시험을 보면 똑같은 시험지가 나올 때까지만.유출된 시험지로 공부하는 강의의 수강료는수천만 원에 이릅니다.D SAT학원각 과목마다 360만 원씩.한 달 가격이라는 거예요 이게 8주 시험 볼 때까지 총 다 하면 잠깐만 한 3천만원에서 3천5백 만원 조금.미국의 또 다른 대학 입학 시험인 ACT 문제지 역시 유출된 문제지 사본이 강남 학원가에 나돌고 있습니다. A ACT학원기출문제 분석을 해 가지고 선생님 도움 받아 가지고. 기출 문제가 다 있어 학원마다 ACT 기출 문제가 60개인가 70개 있는데.학원가에는 유출 문제로 공부해서 좋은 대학에 갔다고 소문난 유명 인사 자녀들의 명단까지 돌고 있습니다.이 모 씨E SAT학원 원장가수 000의 딸 00 호텔 집안 아들 배우 000의 아들 000 집안의 아들이 전부 다 치팅부정행위를 한 거죠.SAT 유출 사건이 심심찮게 터지고 학생들 점수도 비정상적으로 높다 보니 이른바 코리아 디스카운트도 생겼다고 합니다.박 모 씨F SAT학원 원장정말 열심히 한 애가 그런 사례가 있습니다. 점수를 제출했는데 학교에서 이상하다 이거예요 너 이상하다. 한국 애들은 불법일 거야라는 선입견을 학교에서 갖고 있을 거예요.유출 문제 진위 여부에 대한 확인을 위해 SAT 주관사인 미국 칼리지보드사와 여러 차례 접촉했지만 매번 돌아온 답은 확인해 줄 수 없다였습니다.칼리지보드 관계자확인하는데 얼마나 걸리는지 모르겠어요.그냥 이게 불법인지 뭔지저도 모르고 당신도 모르죠
北, 종업원 송환 또 요구…"유엔, 돌려보낼 대책 세워야"	http://news.naver.com/main/read.nhn?mode=LSD&mid=shm&sid1=100&oid=001&aid=0008402842	북한 해외식당 근무 종업원 13명 국내 입국     북한 해외식당에서 근무하는 종업원 13명이 집단 탈출해 7일 국내에 입국했다고 통일부가 8일 밝혔다.    정준희 통일부 대변인은 이날 정부서울청사에게 열린 기자회견에서 북한 해외식당에서 근무 중이던 지배인과 종업원 등 13명이 집단 귀순했다며 이들은 남자 지배인 1명과 여자 종업원 12명으로 4월 7일 서울에 도착했다고 말했다.8 통일부 제공    photoyna.kr외무성 대변인 조선중앙통신 기자 질문에 대한 대답서     임은진 기자  북한은 중국 내 북한식당 종업원들의 집단 탈북사건을 우리 정부의 반인륜 범죄라고 비난하며 유엔과 국제인권기구가 이들을 북으로 다시 돌려보낼 대책을 세워야 한다고 거듭 요구했다.    북한 외무성 대변인은 15일 조선중앙통신 기자의 질문에 대한 대답에서 집단 탈북사건은 우리 공화국북한의 존엄과 주권에 대한 난폭한 침해이고 북남대결과 긴장 격화를 고취하는 용납못할 엄중한 정치적 도발이며 우리 공민들의 인권을 무참히 유린한 전대미문의 특대형 범죄라고 비난했다고 통신은 보도했다.    대변인은 역사적인 조선노동당 제7차 대회에서 발표된 북남관계 개선을 위한 우리의 선의있고 아량있는 조치들에 호응할 대신 우리 공민들을 강제억류하고 있는 남조선 당국자들이야말로 천하에 둘도 없는 인권유린의 주범들이고 민족반역 집단임을 그대로 실증해주고 있다고 주장했다.    대변인은 이어 문제시하지 않을 수 없는 것은 다른 나라의 인권문제를 무턱대고 걸고들던 미국과 서방이 남조선의 제도적인 인권유린범죄에 대해 일체 함구무언하고 있는 것이라며 미국과 국제사회도 비난했다.    대변인은 종업원 가족들은 유엔인권고등판무관과 유엔인권이사회 의장에게 남조선 당국의 범죄행위를 고소하고 대책을 요구하는 편지를 발송했다며 유엔과 국제인권기구들은 남조선 당국의 반인륜 범죄를 응당 문제시하고 우리 공민들을 한시바삐 가족들의 품으로 돌려보내기 위한 해당한 대책을 취해야 할 것이라고 요구했다
"우리 아빠 찾아 주세요"…40대 건설사 대표 일주일째..	http://news.naver.com/main/read.nhn?mode=LSD&mid=shm&sid1=102&oid=032&aid=0002699161	대구에서 40대 중소 건설업체 대표가 일주일째 행방이 확인되지 않아 경찰이 수사에 나섰다.대구 수성경찰서는 대구의 ㄱ건설사 대표 김모씨48가 지난 8일 오후 10시쯤 수성구의 한 버스정류장 앞에서 하차한 뒤 연락이 끊겼다는 김씨 가족의 신고에 따라 김씨 행방을 찾고 있다고 15일 밝혔다.경찰 조사결과 김씨는 8일 오후 7시 40분쯤 경북 경산의 한 식당에서 회사 동료와 거래처 사장 등 3명과 술을 마신 뒤 동료 차를 얻어타고 오다 수성구 만촌동 자신의 집 근처 버스정류장 앞에서 내렸다.김씨의 휴대전화와 지갑은 자신의 회사 사무실에서 발견됐다. 김씨는 마지막 목격 시점부터 일주일이 지난 지금까지 아무런 연락이 없는 상태다.경찰은 지금까지 가족에게 금품을 요구하는 협박 전화도 없었다고 밝혔다. 경찰 조사에서 가족들은 김씨가 가출할 만한 이유가 전혀 없다고 진술한 것으로 알려졌다.김씨 가족은 우리 아빠를 찾아 주세요. 50일된 아기가 있습니다 등이 담긴 플래카드를 대구지역 주요 거리 곳곳에 내걸고 전단지를 배포하는 등 김씨의 소재를 애타게 찾고 있다.김지훈 수성경찰서 형사2팀장은 실종 당일 김씨의 이동 경로상의 폐쇄회로CC TV 확인 휴대전화 통신내역 및 계좌 거래내역 등을 조회 하고 있다면서 범죄 관련성 등 모든 가능성을 열어놓고 수사하고 있다고 말했다
대기업 '일감 몰아주기' 제재 돌입…경제민주화 '재점화'	http://news.naver.com/main/read.nhn?mode=LSD&mid=shm&sid1=101&oid=018&aid=0003543418	현대증권현대로지스틱스 현정은 회장 제부 보유회사 부당지원 공정위 과징금 13억검찰 고발.총수일가 사익편취 첫 제재 총수 일가 검찰 소환 가능성에 촉각 한진하이트진로한화CJ 조사도 속도세종이데일리 최훈길 기자 경제민주화 불꽃이 재점화 되고 있다. 공정거래위원회는 대기업 총수 일가의 일감 몰아주기에 대해 처음으로 제재를 가했다. 강화된 공정거래법이 시행된 지 1년3개월만이다. 현대그룹을 시작으로 한진그룹 등 다른 대기업에 대한 후속 제재나 총수 일가의 검찰 소환 가능성도 제기된다.공정거래위원회는 15일 현대증권 및 현대로지스틱스가 총수 친족 회사인 HST와 쓰리비를 부당지원한 행위에 공정거래법 위반각각 총수일가 사익편취 부당지원행위 혐의를 적용 이들 4곳에 총 12억8500만원의 과징금과 시정명령을 부과했다. 부당지원 규모나 시장 경쟁을 해친 혐의가 큰 현대로지스틱스는 검찰에 고발하기로 했다. 이는 지난해 2월 공정거래법에 총수일가 사익편취 금지 조항이 신설된 이후 적발된 첫 사례다. HST와 쓰리비는 현정은 현대그룹 회장의 동생인 현지선 씨의 남편 변찬중제부 씨가 대주주를 맡고 있는 곳이다. 현정은 회장 제부 회사에 수십억 일감 몰아주기현정은 현대그룹 회장.출처사진공동취재단현대증권은 2012년 당시 지점용 복합기를 임대차 거래를 할 때 제록스와 직거래를 할 수 있는데도 PC 등의 유지보수 업체인 HST와의 거래 단계를 끼워 넣었다. 2012년부터 올해 3월까지 HST와의 지원성 거래규모는 19억원작년 2월 이후 4억6000만원 개정 공정거래법 적용 기준에 달했다. HST는 앉아서 마진율 10를 챙겨갔다. 현대로지스틱스는 2012년 5월부터 재작년 4월까지 택배운송장 납품업체인 쓰리비로부터 타사보다 높은 단가11.7로 택배운송장을 구매해 부당지원 했다. 이 같은 지원성 거래 규모는 3년간 56억2500만원에 달했다. 총수 일가는 부당이득 14억원을 챙길 수 있었다.특히 현대로지스틱스는 기존 거래처와 계약기간이 1년 정도 남은 시점에 계약을 중도해지하고 쓰리비와 계약을 체결했다. 쓰리비는 2009년 외국 정유업체의 에이전시 사업을 위해 설립된 곳으로 거래 당시 택배운송장 사업 경험이 전무했다. 현대증권현대로지스틱스가 손해를 입으면서 석연치 않은 부당지원을 했지만 공정위는 총수 일가와는 무관하다고 판단했다. 정창욱 서비스업감시과장은 임원 정도 수준까지 개입했다면서 특수관계인총수 일가이 직접 사익편취 행위에 지시를 하거나 관여를 해야 하는데 이번 사안에선 이 같은 행위가 발견되지 않았다고 말했다.검찰공정위 후속조사 파장출처공정위이에 따라 검찰 수사에서 총수 일가를 상대로 한 수사가 진행될 지 여부가 주목된다. 현정은 회장이 일감 몰아주기 계약에 개입했는지 이를 알았거나 묵인했는지 등을 본격 수사할 경우 파장이 커질 전망이다. 이번 공정위 조사가 업체 신고로 진행된 만큼 일감 몰아주기로 피해를 입은 중소업체들의 추가 제보도 예상된다. 개정된 공정거래법에 따르면 일감 몰아주기가 적발되면 총수일가에게 3년 이하의 징역이나 2억원 이하의 벌금형이 부과될 수 있다. 앞으로 공정위는 한진002320 하이트진로000080 한화000880 CJ001040 등 일감 몰아주기 의혹이 있는 다른 기업들에 대한 조사에 속도를 낼 예정이다. 한진그룹은 싸이버스카이와 대한항공003490의 일감 몰아주기 문제로 지난해 국정감사에서 지적을 받았다. 싸이버스카이는 기내잡지 광고와 대한항공 기내 면세품 통신판매를 독점하는 비상장 계열사로 조양호 회장의 장녀 조현아 전 대한항공 부사장 등 세 자녀가 100 지분을 소유하고 있다. 정 과장은 순차적으로 일감 몰아주기 관련 조사를 해 가능한 빨리 조사를 마무리하겠다고 말했다. 현대그룹은 공정위를 상대로 한 취소소송 여부에 대해 일단 신중한 반응을 보였다. 현대그룹 홍보팀 관계자는 공정위로부터 관련 의결서를 받고 난 후 상세 내용을 법무법인 등과 면밀히 검토해 향후 대응 방안을 마련할 계획이라고 밝혔다.kr핫 클릭  월급 100만원 용역 끝나면 해고박사들의 무덤 정부 출연핫 클릭  금 더 구할 곳 없나요전례 없는  광풍핫 포토 이게 가능해 물 속에 얼굴을 묻고
유일호·강석훈 투 톱…구조조정 '올인'하나 	http://news.naver.com/main/read.nhn?mode=LSD&mid=shm&sid1=101&oid=003&aid=0007228128	세종안호균 기자  청와대가 15일 강석훈 새누리당 의원을 신임 경제수석으로 기용한 것은 집권 후반기 안정적 국정 운영과 함께 구조조정 등 경제 현안 돌파에 올인하겠다는 의지의 표현으로 풀이된다.  대학 선배서울대 경제학과이자 같은 학자 출신 정치인으로 성향이나 경력도 비슷한 유일호 경제부총리와의 정책 호흡도 염두에 둔 것으로 보인다. 강 신임 수석과 정책기획수석으로 이동한 안종범 수석은 모두 박근혜 정부 경제 정책의 핵심 브레인으로 통한다. 두 사람 모두 2012년 19대 총선에서 국회에 입성해 같은해 대선 과정에서 박근혜 캠프 정책 라인의 핵심 축으로 활약했다. 대선 후에도 안 수석은 대통령직인수위 고용복지분과위원 강 수석은 국정기획조정분과위원을 맡아 현 정부 경제정책의 밑그림을 그렸다. 청와대가 안 수석과 강 수석을 정책라인의 핵심에 배치한 것은 기존 경제정책 기조를 유지하면서 당청간의 소통을 강화하겠다는 의지로 풀이된다.  현 정부의 핵심 과제인 공공기업 개혁과 기업 구조조정은 이해관계자들의 반발과 정부 부처간 엇박자로 난관에 부닥쳐 있다. 때문에 정책통이면서 야당과 소통도 가능한 인사를 전진 배치 경제 현안을 돌파하겠다는 의미로 읽힌다. 강 수석과 안 수석은 최경환 전 경제부총리와 함께 새누리당 내 위스콘신대 3인방으로 불리며 협력 체제를 유지해 왔다. 이들은 유일호 현 부총리와도 국정 철학을 공유하고 있어 당청간 소통이 원만할 것이라는 전망이다. 이번 청와대 참모진 개편에 대해서는 여야간 평가가 엇갈린다.  새누리당은 내정자들은 박근혜 정부 운영 철학을 잘 이해하고 있는 적임자들이라고 긍정 평가한 반면 더불어민주당은 교체 폭과 인사의 내용이 총선에서 드러난 성난 민심에 최소한의 답도 되지 못한다는 평가를 할 수밖에 없다고 혹평했다. 특히 야권에서는 안 수석과 경제적 시각에서 큰 차이가 없는 강 수석을 기용한 것에 아쉬움을 표시하고 있다. 강 수석은 19대 국회에서 기획재정위원회 여당 간사를 맡아 서비스산업발전법 등 야당이 반대하는 정책들의 입법을 주도했다. 또 가업상속공제 확대 법안을 대표 발의하는 등 시장 친화적인 성향이 강하다는 평가다. 더민주는 안종범 경제수석을 정책조정수석으로 자리 이동만 시킴으로써 경제정책 등 국정 기조에 대한 변화를 기대하기 어렵다는 점 또한 실망스럽다고 지적했다. 하지만 야당과 여러차례 마찰을 빚어 왔던 현정택 정책조정수석이 물러나고 비교적 대야 관계가 원만한 정치인 출신이 정책 라인의 핵심 포스트에 서게돼 정무 기능이 더욱 강화될 것이라는 전망도 있다. 특히 강 수석은 기재위 여당 간사 시절에도 소통 측면에서는 야당으로부터 비교적 후한 평가를 받았다. 19대 국회에서 기재위 야당 간사로 활동했던 윤호중 더불어민주당 의원은 강 수석에 대해 굉장히 좋아하는 친구라며 정책적으로 이견은 많았지만 대화가 되는 사람이라고 평가했다
'페브리즈' 유해성 논란…성분 표시 없어	http://news.naver.com/main/hotissue/read.nhn?mid=hot&sid1=102&iid=1093395&oid=056&aid=0010317351&ptype=021&cid=1041649	멘트대표적인  섬유 탈취제인 페브리즈에도  폐를 손상시킬 수 있는 유해성 물질이  들어있다는 주장이 제기됐습니다.이에 대한  제조사의 대응이  옥시 사태 초기 옥시가 한 행태와 흡사합니다. 리포트 섬유탈취제 시장 점유율 1위인 피앤지의 페브리즈 입니다. 페브리즈에 들어있는 성분중 항균제로 쓰이는 제4급 암모늄 염이 인체에 유해할 수 있다는 주장이 나왔습니다. 스프레이 등으로 분사돼 작은 입자 상태가 된 이 물질을 흡입하면 폐에 손상이 갈 수 있다는 겁니다. 인터뷰 임종한인하대학교 의과대학 교수   입자가 아주 미세한 크기인 경우에는 신체 방어 기제를 뚫고 폐 깊숙히 침투되어집니다. 그러면 폐포에 손상을 받게 되고. 실제로 동물 실험 결과 제4급 암모늄 염 계열의 물질을 흡입한 쥐의 폐에서 심한 염증과 섬유화 증상이 나타났다는 논문이 다수 보고돼 있습니다. 문제는 소비자가 유해성 물질 함유 여부를 확인할 방법이 없다는 겁니다. 제품 겉면에는 미생물 억제제로 표시돼 있을 뿐 자세한 성분이 나와있지 않고 제조사 홈페이지에도 성분 안내는 없습니다. 이에 대해 한국 피앤지는 제4급 암모늄 염은 미국과 유럽에서도 허가된 안전한 물질이라고 해명했습니다. 또 한국의 관련 법규에 따라 성분표기를 한 것뿐이라고 답했습니다. 실제로  화학물질 등록과 평가 등에 관한 법률은 환경부에 등록된 유해화학물질 등에 대해서만 성분을 표기하도록 하고 있는데 제4급 암모늄 염은 이에 해당하지 않아 유해성 논란에도 불구하고 표기 의무는 없습니다. 인터뷰 손유진인천시 부평구  먹는 것도 성분 표시를 해주는데 가장 많이 쓰는 제품에 그런 게 없다는 게 좀
