'임금협상 난항' 현대차 노조, 다음주 초강도 파업 예고	http://news.naver.com/main/read.nhn?oid=003&sid1=102&aid=0007483905&mid=shm&mode=LSD&nh=20160923232902	울산구미현 기자  현대차 노사는 24일 울산공장 아반떼룸에서 열린 21차 본교섭에서 올해 임금협상 잠정합의안을 이끌어냈다. 박유기 노조위원장이 협상장에서 나오고 있다. 사진현대차 제공   photonewsis.com울산안정섭 기자  올해 임금협상에서 난항을 겪고 있는 현대자동차 노조가 다음주 내내 강도 높은 파업을 예고했다. 현대차 노조는 23일 오후 열린 중앙쟁의대책위원회 회의에서 다음주 5일 연속 파업 일정을 확정했다. 노조는 월요일인 오는 26일 8시간 전면파업을 시작으로 27일부터 30일까지 매일 각 조 6시간씩 부분파업을 벌이기로 했다. 단 2730일 사이 회사와의 교섭이 진행될 경우 파업시간을 2시간 줄여 4시간 부분파업하기로 했다. 파업이 시작되면 노조 상무집행위원들은 서울 서초구 양재동 현대차그룹 본사 앞에서 선전전을 벌이는 한편 조합원들은 각 선거구별로 단합대회와 결의대회를 이어갈 예정이다. 노조의 한 관계자는 회사가 임금인상을 포함한 추가제시안을 내지 않으면 더이상 교섭할 이유가 없다며 다음주 파업수위를 최대한 끌어올려 사측을 압박하기로 결정했다이라고 전했다. 현대차 노사는 이날 추석 연휴 이후 첫 교섭을 가졌으나 별다른 합의점을 찾지 못했다. 8시간 넘게 진행된 교섭에서 회사가 임금인상분 조기지급 등의 내용이 담긴 추가제시안을 냈으나 노조 교섭위원들은 조합원들이 납득할만한 임금인상안이 포함되지 않았다며 반발하다 결국 교섭장을 나왔다.울산구미현 기자  현대차 노사는 24일 울산공장 아반떼룸에서 열린 21차 본교섭에서 올해 임금협상 잠정합의안을 이끌어냈다. 윤갑한 사장이 협상장에서 나오고 있다. 사진현대차 제공   photonewsis.com 올해 들어 19차례에 걸친 노조의 연이은 파업으로 차량 10만1400여대를 생산하지 못해 총 2조2300억원 규모의 매출차질이 빚어질 것으로 회사는 추산했다. 현대차 노사는 앞서 지난 8월24일 잠정합의안을 마련했으나 조합원 찬반투표에서 투표자 대비 78. 당시 잠정합의안에는 임금 5만8000원 인상 성과급 및 격려금 350330만원 전통시장 상품권 20만원 주식 10주 지급 등이 담겼다. 핵심 쟁점이었던 회사의 임금피크제 확대 요구는 노조의 계속된 반발에 회사가 철회하기도 했지만 임금인상 폭이 예년에 비해 작다는 현장 정서가 찬반투표에 반영된 것으로 노조는 분석했다. 현대차 노조는 올해 임금협상에서 임금 15만2050원 인상기본급 대비 7.2호봉승급분 제외 전년도 순이익의 30 성과급 지급주식 포함을 요구하고 있다
부활 날개 못펴고 트위터 매각 추진	http://news.naver.com/main/read.nhn?oid=011&sid1=105&aid=0002889670&mid=shm&mode=LSD&nh=20160923233249	
터키 '쿠데타 비상조치' 계속될 듯…국가비상사태 연장 추진	http://news.naver.com/main/read.nhn?oid=001&sid1=104&aid=0008704060&mid=shm&viewType=pc&mode=LSD&nh=20160923231846	쿠데타 연루 혐의로 연행되는 터키군인들   7월 19일 터키 경찰이 남부 해안도시 메르신에서 쿠데타 연루 혐의로 터키군인들을 연행하고 있다. AP야당 반대에도 여당 의석으로 가결 가능여야 개헌범위 확대 합의      이스탄불 하채림 특파원  터키 정부가 쿠데타 이후 선포한 국가비상사태를 연장할 것으로 보인다.    비날리 이을드름 터키 총리는 22일 제1야당 공화인민당CHP의 케말 클르치다로을루 대표를 만난 자리에서 국가비상사태 연장 계획을 시사했다고 터키 매체들이 23일 보도했다.     이날 회동 후 CHP 관계자는 기자들과 만나 이을드름 총리가 클르치다로을루 대표에게 국가비상사태를 연장할 뜻을 내비쳤다고 전했다.     쿠데타 진압 후 국가비상사태 선포로 레제프 타이이프 에르도안 대통령에게 입법권을 비롯한 특별권한이 부여됐고 국민의 기본권이 제한됐다.     이를 바탕으로 터키에서는 쿠데타 배후로 지목된 재미 이슬람학자 펫훌라흐 귈렌 지지자와 에르도안 비판 진영에 대한 대대적인 숙청정국이 펼쳐졌다.     국가비상사태는 다음달 20일에 종료된다.         터키헌법에 따르면 국가비상사태는 한번에 4개월까지 의회 의결을 거쳐 연장할 수 있다. 쿠데타 연루 혐의로 조사받는 터키 언론인들   쿠데타 연루 혐의로 조사를 받는 터키 언론인들이 7월 29일 법정에 출석하고 있다. AP    앞서 이달 19일 에르도안 대통령도 언론 인터뷰에서 국가비상사태가 3개월 또는 그 이상도 연장될 수 있다. 국가비상사태를 연장하면 쿠데타 모의자들을 찾아내 검거 하는 데 도움이 될 것이라고 말했다.     CHP는 국가비상사태 연장에 반대하지만 집권 정의개발당AKP의 의석은 연장안을 가결하기에 충분하다.     이을드름 총리와 클르치다로을루 대표의 회동은 CHP가 쿠데타 수사 피해 민원 현황을 전달하고자 AKP에 요청해 이뤄졌다.     CHP의 쿠데타 수사 피해 신고창구에는 지금까지 약 3만7천명이 몰렸다.     23일 CHP는 법률과 동등한 효력을 갖는 국가비상사태 명령칙령 가운데 일부가 위헌 소지가 있다고 판단 23일 헌법재판소에 위헌심판을 청구했다.     한편 이날 쿠르드계 정당을 제외한 터키 여야 3당은 개헌 범위를 당초 발표보다 대폭 확대하는 데 합의했다.     쿠데타 진압 직후 터키 여당 정의개발당AKP은 사법제도에 국한한 소폭 개헌을 예고했다.     그러나 이날 여야 3당은 60개 조문 이상을 고치는 중폭 이상 개헌을 논의하기로 했다
폭염에 금값된 배추 대신 얼갈이배추·열무 '불티'	http://news.naver.com/main/read.nhn?oid=214&sid1=101&aid=0000674913&mid=shm&viewType=pc&mode=LSD&nh=20160923231520	폭염으로 치솟은 배추값 때문에 직접 김치를 담가 먹는 게 요즘 큰 부담인데요.이러다 보니 상대적으로 저렴한 얼갈이배추나 열무가 불티나게 팔리고 포장 김치도 없어서 못 팔 정도라고 합니다. 리포트 가정에서 김치를 담그고 있는 50대 주부.자세히 보니 배추보다 잎이 성글고 작은 얼갈이배추 그리고 열무를 절여서 김치를 담그고 있습니다. 평소 배추를 사서 김치를 만들었지만 비싼 배춧값 때문에 값이 저렴하면서도 맛이 비슷한 얼갈이배추와 열무를 대신 사용하고 있는 겁니다. 최선미배추가 한통에 1만 원 정도나 하니까 대체방안으로 열무랑 얼갈이배추를 섞어서 담그고 있죠. 맛에 큰 차이는 없는 거죠추석 이후 소폭 내리긴 했지만 배춧값은 여전히 작년보다 2배 이상 비싼 상황. 값이 절반 이상 저렴한 얼갈이배추와 열무가 대체재로 떠오르면서 작년 같은 기간보다 판매량이 3배 가까이 증가했습니다.이런 얼갈이배추나 열무는 보통 한여름에만 집중적으로 팔리지만 올해에는 지금까지도 판매량이 계속 늘고 있습니다.조은호대형마트 채소 담당열무와 얼갈이배추 가격도 작년보다 소폭 상승했지만 배추 가격이 워낙 비싸다보니 작년보다 23배 더 팔리는 추세입니다.포장 김치도 국산 중국산을 가리지 않고 매대에 진열해놓으면 당일에 모두 팔려나가면서 물량이 모자랄 정도입니다
침몰 이집트 난민선 사망자 최소 148명…"정원 3배 초과.."	http://news.naver.com/main/read.nhn?oid=001&sid1=104&aid=0008704081&mid=shm&viewType=pc&mode=LSD&nh=20160923230435	이집트 인근 해상서 난민선 침몰 AFP수백명 여전히 실종지금까지 164명 구조    카이로 한상용 특파원  지난 21일 이집트에서 출발한 난민선이 지중해에서 침몰하면서 발생한 사망자가 최소 148명으로 늘었다.    23일 이집트 일간 알아흐람 등 현지 언론에 따르면 이집트 당국은 육지로부터 약 12km 떨어진 사고 해상에서 지난 몇 시간 동안 시신 90구를 발견수습해 이날 오후 현재 난민선 침몰에 따른 사망자는 148명으로 확인됐다고 밝혔다.    숨진 이들 중에는 난민선이 침몰할 당시 수영을 할 수 없었던 여성과 어린이들이 다수 포함됐다고 당국은 전했다.    이집트 당국은 조만간 시신이 추가로 나올 수 있다고 말했다.    사고 선박에 탑승했다 구조된 난민이나 이주민들은 지금까지 모두 164명으로 집계됐다.     생존자 중에는 이집트인이 117명으로 가장 많고 수단인 26명 에리트레아인 13명 시리아인에티오피아인 각 1명 등이다.    소형 어선을 개조한 이 난민선의 사고 원인에 관한 증언도 속속 나오고 있다.이집트 인근 해상서 난민선 침몰 AFP    생존자들은 난민선이 정원보다 3배가량 많은 인원을 승선시킨 채로 운항하다가 갑자기 뒤집힌 뒤 침몰했다고 말했다.    사고 선박의 전체 탑승 인원은 최종적으로 확인되지 않았다.     그러나 목격자들은 그 배의 최대 수용 가능 인원이 150명이었지만 사고 당시 약 450명이 타고 있었다고 밝혔다.    이 가운데 100명가량은 어선 내부의 생선 저장용 냉장실에 머물고 있었다고 한 구조자는 말했다.    생존 이집트인 중 한 명인 아흐메드 모하메드27는 우리 200명이 이미 그 배를 가득 메웠으나 나중에 또 다른 200명에 배에 추가로 탔다고 증언했다.    그는 이어 사고 당시 상황에 대해 그때는 대재앙이었다. 모두가 살기 위해 발버둥을 쳤다며 나는 약 10km를 수영해 살아남았다고 설명했다.    이탈리아에 가기 위해 이 배를 탔다는 이집트인 용접공 무트왈리 모하메드28는 아내 아들과 함께 더 나은 삶을 위해 고국을 떠났는데 결국엔 나만 생존했다고 했다.    그러면서 모하메드는 이탈리아에 도착하면 중개인에게 5만 이집트 파운드약 620만 원를 지급하기로 브로커와 합의를 했다고 전했다.    또 다른 이집트인 학생 모하메드 아흐메드17는 불운한 배의 복도에 타기 위한 비용으로 2만 이집트 파운드약 250만 원를 빌렸다고 말했다
현금 준 뒤 '더치페이'…김영란법 빈틈 노리는 '꼼수'	http://news.naver.com/main/read.nhn?oid=437&sid1=100&aid=0000132154&mid=shm&mode=LSD&nh=20160923214322	김영란법 시행 이제 닷새 남았습니다. 저희 뉴스룸은 김영란법 이후의 달라지는 세상에 맞춰서 체질 개선하는 모습들 연일 소개하고 있는데요. 그런데 일각에서는 벌써부터 김영란법의 빈틈을 노리는 각종 꼼수가 등장하고 있습니다.기자대기업은 1호로 걸리는 건 무조건 피하자며 몸조심에 돌입했습니다.대기업 관계자  기존에 잡혔던 약속들도 다 취소하고 있는 상태입니다. 올해는 최소한 저녁 약속 안 잡고 이후에 좀 추이 변화를 일단 지켜보려고 합니다.하지만 처음부터 김영란법을 피해보겠다며 꼼수를 생각해내는 이들도 많습니다.미리 현금을 나눠줘 밥값을 각자 내는 것처럼 꾸미거나 신용카드 여러 장을 동원하는 카드 쪼개기를 해보겠다는 겁니다.서울 여의도나 광화문 등의 고급 식당들에선 아예 먼저 돈을 맡겨놓으면 식사를 할 땐 3만 원씩만 받겠다고 제안하는 경우도 있습니다.유흥업소들도 현금으로 결제하는 단골만 받아 김영란법 직격탄을 피해보려고 합니다.룸살롱 업주  이런 분들단골손님은 실수 안 해요. 그분들은 결제기록 자체가 남는 것을 안 좋아하기 때문에 법 시행 이후라도 어떤 식으로든 방법은 수십 수백 가지가 있어요.결국 이런 꼼수를 막으려면 정부와 사법당국이 초기에 강한 단속 의지를 보여 일벌백계 효과를 노려야 한다는 지적이 나옵니다.이가혁 JTBC 뉴스 공식 SNS 트위터 페이스북 유튜브Copyright by JTBChttpjtbc
6년 헛심 쓴 기상장비…행정력만 낭비	http://news.naver.com/main/read.nhn?oid=449&sid1=103&aid=0000110968&mid=shm&viewType=pc&mode=LSD&nh=20160923221701	공항 주변에 설치되는 돌풍 감지 장비를 놓고 기상청과 수입 중개사가 벌인 소송전을 단독 보도해드렸는데요 6년만에 기상청이 이겼지만 제대로 쓰지도 못한 채 행정력만 낭비한 셈이 됐습니다.리포트공항 주변에 설치되는 돌풍 감지 장비를 놓고 기상청과 프랑스 제작 회사가 소송을 벌이고 있습니다. 그런데 프랑스 업체가 성능이 기준에 미달한다고 자백한 녹취록을 단독으로 입수했습니다.항공기 이착륙 안전을 위협하는 돌풍 발생 여부를 알려주는 장비 라이다LIDAR기상청은 2011년 민간 기상업체인 케이웨더를 통해 프랑스산 라이다 2대를 들여왔습니다.설치된 곳은 난기류가 자주 발생하는 제주공항과 김포공항.하지만 오작동이 발생하면서 기상청은 라이다 도입을 철회하기로 했습니다.라이다 수입을 중개한 케이웨더는 잔금 11억여 원을 배상하라며 기상청을 상대로 소송을 제기했고 법원은 기상청이 물품 대금을 지급할 의무가 없다며 기상청의 손을 들어줬습니다.프랑스 업체에 지급한 계약금 10억 원은 아직 돌려받지 못한 상황.기상청 관계자충분한 성능을 보이던 장비와는 다른 장비가 계약이 돼서 문제가 야기된 면도 있고요.6년 동안 장비는 사용하지 못하고 소송전만 벌인 데 대해 계약부터 잘못됐다는 자성론이 나오지만 만시지탄이라는 지적입니다
손·발 씻고 양치질? 교육부의 황당 '지진 대처법'	http://news.naver.com/main/read.nhn?oid=214&sid1=102&aid=0000674891&mid=shm&mode=LSD&nh=20160923213723	가글로 입과 목의 청결 유지.그런데 뭔가 이상하지 않습니까 꼭 미세먼지나 황사 대처법 같죠.교육부 홈페이지에 올라와 있는 재난 대처 요령인데요.1년이 넘도록 잘못 올린 사실조차 모르고 있었다고 합니다. 리포트 지난 4월 일본 구마모토 강진 직후 교육부는 전국 학교에 공문을 보냈습니다.지진 발생시 행동 요령 등을 담은 교사용 자료와 이를 교육하라는 내용이었습니다.그런데 학교안전정보센터 홈페이지에 게시된 학생용 자료 중에 황당한 내용이 눈에 들어옵니다.손 발을 씻고 양치질을 해라. 외출 시 마스크를 쓰거나 긴소매 옷을 입고 이상 증세 땐 가글로 입과 목의 청결을 유지해라.지진이 아닌 황사 대처방법을 게시한 겁니다.이 자료는 1천 건 가까이 다운로드 됐지만 교육부는 이런 오류가 있다는 것을 1년이 지나도록 몰랐습니다. 교육부 관계자기자님도 기사를 쓰다 보면 오타도 있고 저도 신문기사 보면 그렇게 오타가 나옵니다.교육부가 만든 학교생활안전 앱도 허술하기는 마찬가지입니다.2천만 원을 들여 만든 앱에는 지진 발생 시 책상 밑으로 피하고 건물 밖에서는 공터로 대피하라는 등의 형식적인 내용의 20초짜리 영상이 전부입니다.이경호초등학교 교사준비가 안 된 상태에서 공문이 내려와서 시행하세요 하는 입장이기 때문에 학생들이나 선생님들도 인식하지 못한 상태에서송기석국민의당 의원자료와 매뉴얼이너무 부실하지 않습니까 그래서 이걸 시급히 보완해서 우리 학생들의 안전을 도모해야 합니다
