도쿄올림픽, 한국서 분산 개최?…IOC의 '압박 카드'	http://news.naver.com/main/read.nhn?oid=437&sid1=104&aid=0000134552&mid=shm&mode=LSD&nh=20161018233859	도쿄올림픽 일부 경기를 우리나라에서 개최하는 방안이 검토되고 있습니다. 국제올림픽위원회 IOC가 일본을 압박하는 카드로 꺼내든 건데요. 당초 계산에서 수천억원이나 불어난 경기장 건설비가 원인입니다.기자국제올림픽위원회 IOC가 도쿄올림픽의 한국 분산 개최 방안을 검토하고 있습니다.부득이한 경우 도쿄 올림픽 조정 경기를 우리나라 충주에서 열 수도 있다는 겁니다.도쿄만에 들어설 조정경기장이 눈덩이처럼 불어난 예산 문제로 난관에 부딪쳤기 때문입니다.올림픽 유치 당시 일본 측이 예상한 건설비는 약 760억 원 하지만 2013년엔 1조1400억 원까지 불어났습니다. 일본 마이니치신문은 예산이 너무 많다는 IOC 지적이 나오자 장부를 조작해 허위 보고까지 했다고 보도했습니다.이후 5400억 원으로 예산이 수정됐지만 비싼 계약서를 둘러싼 논란은 여전합니다.지난 8월 취임한 고이케 유리코 도쿄도지사는 도쿄에서 300km 넘게 떨어진 미야기현 경기장 활용 방안을 제시했습니다.도쿄에 경기장을 짓는다면 2000억 원가량 예산을 축소할 방침입니다.IOC는 앞으로 일본 정부 도쿄도 도쿄조직위원회까지 참여하는 4자 회담에서 이 문제를 논의할 계획입니다.전영희 JTBC 뉴스 공식 SNS 트위터 페이스북 유튜브Copyright by JTBChttpjtbc
만취 승객 폭행에 정신 잃은 택시기사 '5중 추돌'	http://news.naver.com/main/read.nhn?oid=214&sid1=102&aid=0000685825&mid=shm&mode=LSD&nh=20161018204444	만취한 택시 승객이 운전 중인 기사에게 마구 주먹을 휘둘러 기사가 기절했습니다.느리게 간다며 행패 부린 건데 그 탓에 5중 추돌 사고가 나고 8명이 다쳤습니다. 리포트 지난 토요일 저녁 7시쯤 서울 당산역 인근의 한 왕복 6차로 도로입니다.2차로를 달리던 택시가 차로를 벗어나 옆 차로의 택시와 부딪치더니 갑자기 급발진하듯 출발해 앞선 SUV차량을 들이받고서야 멈춰 섭니다.그런데 받힌 SUV차량이 그 충격으로 앞선 차량을 잇달아 들이받아 결국 5중 추돌사고로 이어졌고 8명이 다쳤습니다.서울 영등포소방서구급차가 여러 대가 나갔죠.사고는 택시기사가 만취한 40대 승객에게 맞으면서 시작됐습니다.느리게 간다는 이유로 기사의 뒤통수를 때리던 승객은 급기야 앞자리로 넘어와 3분 넘게 머리와 뺨을 때렸고 결국 정신을 잃은 기사는 병원으로 실려갔습니다.피해 택시기사 뒤통수 때리고 얼굴로 따귀를 때리고 욕하면서. 그러다가 내가 순간 정신을 잃은 거예요. 깨어나 보니까 에어백이 터져 있고 연기가 앞에서 나고.택시의 경우 버스와 달리 운전석 보호벽이 거의 설치돼 있지 않습니다.지난 2007년부터 운행 중인 기사를 폭행하면 가중 처벌하도록 법이 개정됐지만 여전히 많은 택시기사들이 폭행에 내몰리고 있습니다.백성문변호사교통사고로 인해서 다수의 사람들이 피해를 볼 수 있는 우려가 있기 때문에 특별법의 제정 취지에 맞춰서 좀 더 중하게 처벌할 필요가 있다라고 판단됩니다
"민중은 개·돼지" 나향욱 전 교육부 국장 소청심사 기각	http://news.naver.com/main/read.nhn?oid=421&sid1=102&aid=0002341660&mid=shm&mode=LSD&nh=20161018192612	인사처 소청심사위 파면징계 타당해 기각 결정서울 진성훈 기자  기자들과 식사 자리에서 민중은 개돼지 등의 부적절한 발언으로 파면 징계를 받은 나향욱 전 교육부 국장이 징계에 불복해 제기한 소청심사가 기각됐다. 인사혁신처는 18일 소청심사위원회를 열어 나 전 국장이 청구한 소청심사를 논의한 끝에 중앙징계위원회의 결정이 타당하다고 판단해 기각 결정을 내렸다고 인사처 관계자가 전했다. 앞서 중앙징계위원회는 지난 7월 19일 공직사회 전반에 대한 국민 신뢰를 실추시킨 점 고위공직자로서 지켜야 할 품위를 크게 손상시킨 점 등을 고려해 가장 무거운 징계처분이 필요하다며 교육부의 요구대로 최고 수위의 징계인 파면을 의결했다. 이에 나 전 국장은 징계 의결에 불복 8월 말 소청심사위원회에 소청심사를 청구했었다. 나 전 국장이 이날 소청심사 기각 결정에도 불복할 경우 행정소송을 진행할 수 있다. 한편 공무원에 대한 최고 수위 징계인 파면이 최종 확정되면 5년간 공무원에 재임용될 수 없고 연금 등도 절반 수준으로 깎인다
'쓰레기봉투' 고양이 사건은 자작극…신고자가 범인	http://news.naver.com/main/read.nhn?oid=052&sid1=102&aid=0000919253&mid=shm&mode=LSD&nh=20161018213329	발이 묶인 채 산채로 쓰레기봉투에 담겨 버려진 고양이가 발견됐다는 소식 전해드린 적 있는데요. 고양이를 버린 사람이 경찰에 붙잡혔는데 유기 사건을 처음 알린 신고자들이었습니다. 기자 지난 15일 충남 천안의 한 쓰레기통에서 살아 있는 고양이가 발이 묶인 채 발견됐다는 신고가 들어왔습니다. 신고자는 김 모 씨 등 20대 남녀 2명. 쓰레기장에서 이상한 소리가 나서 가보니 고양이가 쓰레기봉투 안에 버려져 있었다는 겁니다. 고양이는 오른쪽 눈 각막과 송곳니가 손상돼 동물 학대가 의심되는 상황이었습니다. 이경미  천안시 유기동물 보호소장 지난 16일  지속적인 학대가 조금 의심되는 그런 상황 그러니까 각막 손상이라든지 치아 파손이 조금 보이고 다리 상태도 조금 뭔가 변형이 된 것 같고 현재는 그렇게 보고 있습니다. 그런데 경찰 조사 결과 고양이를 버린 사람은 신고자들이었던 것으로 드러났습니다. 이들은 거리에서 배회하던 고양이를 판매하려다 잘 팔리지 않자 고양이가 유기된 것처럼 신고했다고 진술했습니다. 경찰 관계자  배회하는 고양이는 유기 동물 보호소에서 안 데리고 가요. 키우다 버린 것을 데리고 가기 때문에 키우다 버린 것처럼 보이기 위해서 이들이 조작한 거죠. 동물보호단체는 이들이 상습적으로 동물들을 무료로 입양 받아 돈을 주고 판매해온 정황도 있다며 경찰에 수사를 의뢰한 상태입니다
현역 육군 장교 2명 '여대생 집단 성폭행' 덜미	http://news.naver.com/main/read.nhn?oid=056&sid1=100&aid=0010374727&mid=shm&mode=LSD&nh=20161018233654	멘트  현역 육군 장교 2명이  임관 전 교육생 시절 여대생을 집단 성폭행한 혐의로 군 헌병대의 조사를 받고 있는 것으로 확인됐습니다.   이들 중 한 명은 현역 군인의 신분으로 또 다른 성폭행 사건을  저질렀다가 과거 사건까지 덜미를 잡혔습니다.     양창희 기자의 보도입니다. 현역 육군 장교인  A 소위와 B 소위 등 20대 남성 5명은 지난해 11월 이곳에서 평소 알고 지내던 여대생 한 명과 술을 마셨습니다. 여대생이 만취하자 이들은 인근 모텔로 데려가 집단으로 성폭행한 혐의를 받고 있습니다. 당시 A 소위와 B 소위는 임관을 앞둔 광주 모 대학의 ROTC 교육생 신분이었습니다.녹취 00 사단 관계자음성변조   A 소위가 현재 사단 헌병대에 구속돼서 구속 수사 중입니다. 현역 신분으로 한 건 아니고 임관 하기 전에 군인 되기 전에. 이들의 성폭행 혐의는 지난 7월 우연히 드러났습니다. 휴가를 나온 A 소위가 20대 여성을 성폭행했다는 신고가 경찰에 접수됐고  사건을 넘겨받은 군 헌병대가 A 소위를 조사하는 과정에서 노트북에 저장된  집단 성폭행 영상을 발견한 겁니다.녹취 대학 학군단 관계자음성변조    부대 안에서 그렇게 해서 군인 신분일 때 그 사건이 나서 헌병대에서 조사 중이라고. A 소위를 구속한 군 헌병대는  동료 B 소위를 입건해  범행 사전 공모여부를 조사할 계획이라고 밝혔습니다
판교 환풍구 붕괴사고 2년…'공연법' 아직 유명무실	http://news.naver.com/main/read.nhn?oid=057&sid1=102&aid=0001035574&mid=shm&mode=LSD&nh=20161018204117	  국내 공연장 사고 중 최대 사상자를 냈던 판교 야외공연장 환풍구 붕괴사고 기억나십니까  공연장 재난재해 예방을 위해 이후 공연법 개정법률안이 마련됐지만 아직 유명무실하다고 합니다.  김문영 기자가 단독보도합니다. 기자   지난 2014년 10월 경기도 판교의 야외공연장 환풍구가 무너지면서 그 위에 서있던 관람객 16명이 숨지고 10명이 다쳤습니다.  이른바 판교 참사 이후 공연장의 사전 안전 대책 강화를 위해 공연법이 개정됐습니다.  각 공연장 운영자가 매년 재해대처계획을 수립해 관할 지자체에 신고하면 지자체가 해당 계획을 소방서장에게 통보하도록 한 겁니다.  하지만 MBN 취재 결과 재해대처계획을 지자체에 신고한 공연장은 전체의 절반 수준인 것으로 드러났습니다.  미신고 공연장 관계자    특별시에 재난재해 대처계획 제출하세요  그런 건 모르겠어요.  더 심각한 건 각 지자체의 소방서 통보율.  지난 달까지 전국 공연장 가운데 소방서에 재해대처계획이 통보된 곳은 5곳 가운데 1곳에 불과합니다.  특히 강원 경북 전남 등 7개 지자체는 소방서에 각 공연장에서 받은 재해대처계획을 단 한 건도 통보하지 않았습니다. 인터뷰  미통보 지자체 관계자 아 우리가 그쪽에소방서에 통보해야 한다는 게 문구에 있나요 이게 문체부나 안전처나 이쪽저쪽에서 막 내려오니까 뭐라고 말을 못하겠네요.   인터뷰  김정우  더불어민주당 의원 공연법을 집행하는 과정에서 정부에서 우선 혼선이 있었습니다. 국민안전처와 문체부 간에 누가 컨트롤타워를 할지 정하고. 공연장 관리자에게 알려주는 게 필요합니다.  각 공연장과 지자체의 무관심 속에 관람객의 안전을 위해 마련된 공연법 개정안이 유명무실해지고 있습니다.   MBN 뉴스 김문영입니다
