공항 대테러장비 납품 비리…안전에 '구멍' 난 공항	http://news.naver.com/main/read.nhn?oid=437&sid1=102&aid=0000123893&mid=shm&mode=LSD&nh=20160701223030	국내 주요 공항의 대 테러 요원들이 뒷돈을 받고 엉터리 장비 납품을 눈감아 준 사실이 검찰에 적발됐습니다. 이렇게 구입한 폭발물 탐지장비는 지금도 김포와 김해 제주공항에서 사용되고 있는 것으로 나타났습니다.기자지난달 29일 터키 국제공항에서 발생한 폭탄테러로 270여명의 사상자가 발생했습니다.  이런 테러를 차단하기 위해 2010년 김포와 김해 제주 공항에 xray로 투시해 폭발물을 탐지하는 장비가 설치됐습니다.  1억 원이 넘는 고가로 대테러 장비의 핵심입니다.하지만 검찰 수사 결과 이 장비는 2천만 원짜리 저가에 검증도 안된 것으로 드러났습니다.공사 대테러 요원 45살 최모 씨가 군대 후배인 납품업체 대표 36살 김모 씨로부터 2천만 원을 받고 엉터리 제품을 들여오는걸 묵인한 겁니다.또 최 씨를 비롯한 대테러 요원 5명은 훈련은 부실하게 하고 서류상 훈련용 폭발물 사용량만 부풀려 3천 8백만원을 빼돌렸습니다.윤대진부산지방검찰청 2차장 검사  구매 과정 대부분을 납품업자와 유착된 대테러 요원에게 맡기고 아무런 사전 사후 관리 감독을 하지 않은 것으로 확인됐습니다검찰은 최씨와 김씨를 구속기소하고 다른 대테러요원 등 5명을 불구속기소했습니다.배승주 JTBC 뉴스 공식 SNS 트위터 페이스북 유튜브Copyright by JTBChttpjtbc
"부실 급식은 그만"…학부모·학생 뿔났다	http://news.naver.com/main/read.nhn?oid=056&sid1=102&aid=0010334594&mid=shm&mode=LSD&nh=20160701220947	멘트얼마전 KBS 드라마에 부실하고 위생마저 엉망인 급식 때문에 어린이들이 수시로  배탈이 나는 장면이 있었는데요이런 일이 현실에서  고스란히 재현됐습니다.대전의 한 초등학교에선 급식 대신 도시락을 싸오고 춘천의 한 고등학교는 학생들이 대자보까지 붙였습니다. 리포트  대전의 한 초등학교 급식시간. 그런데 학생 20여 명이 급식 대신 집에서 싸온 도시락을 먹고 있습니다.녹취 초등학교 2학년   왜 급식 안 먹고 도시락 먹어요 먹으면 배 아파요.급식에서 막 곰팡이  나오고 그래요 열흘 전 나온 급식을 보니 국수에 수박 한 조각 단무지 한개 닭꼬치가 하나였고 앞서는 새우볶음밥에 김치와 멜론 한조각이 나오기도 했습니다. 학교는 정상적으로 2천원 안팎의 재료비가 들어갔다고 말합니다.녹취 대전 봉산 초등학교 관계자음성변조   친환경을 먹이게 돼 있기 때문에 그런 걸 쓰다보니까 양은 적어도 단가가 높아지는 거죠. 부실한 위생문제까지 불거지면서 학부모들이 집단 반발을 하자 교육청이 뒤늦게 특별감사에 착수했습니다. 춘천의 한 고등학교에는 급식 개선을 요구하는 대자보까지 나붙었습니다. 급식양이 적고  반찬도 한 종류 밖에 없다는 등  불만스런 내용이 가득합니다. 녹취 학생  늦게 가면 맛있는 게 떨어질 때가 있어가지고 김이나 이런 걸로 대체하는 경우도 있어서. 양 자체가 적어서 배식이 골고루 돌아가지 않는다고요  네
홍콩 주권반환 19주년 수만명 거리행진 "행정수반 연임 저지"	http://news.naver.com/main/read.nhn?oid=001&sid1=104&aid=0008513753&mid=shm&mode=LSD&nh=20160701210811	거리행진 참가자들에게 전단지 배포하는 북한인권단체 회원홍콩 시민단체 주권반환 19주년 맞아 71 대행진 개최북한 인권 단체도 참석홍콩 민주화 약화 외면하면 북한 꼴 날 수 있어    홍콩 최현석 특파원  지난 4년간 홍콩 민주화를 후퇴시킨 렁춘잉 행정장관행정수반이 내년 선거에 출마해서는 안됩니다.      홍콩의 주권이 중국으로 반환된 지 19년째가 되는 1일 홍콩섬 빅토리아 공원 내 71대행진 행사장에서 만난 회계사 무이38모씨는 내년 3월 26일로 예정된 행정장관 선거에서 렁 장관이 연임하는 것을 막기 위해 행사에 참가했다고 말했다.    무이 씨 등 홍콩인 수만 명은 이날 오후 2시현지시간 코즈웨이베이라 빅토리아 공원에서 일치단결 홍콩수호라는 주제로 열린 집회에 참가해 렁 장관 퇴진과 중국에 구금된 정치범 석방 등을 요구했다.홍콩 민주화 요구 거리행진 참가자들    홍콩에서는 1997년 이후 매년 주권반환일인 7월1일 시민 수천수십만 명이 참여하는 민주화 요구 행진이 진행되고 있으며 50만명이 참가해 국가안전법 제정 시도를 무산시킨 2003년부터 중국 64 톈안먼 사태 추모 집회와 함께 홍콩 내 주요 시민 행사로 자리 잡았다.     행사장에는 우산혁명으로 불리는 2014년 도심 점거 시위 때 유행한 노래 아직 깨닫지 못한 사람이 있나요가 울려 퍼져 집회 열기를 북돋웠다. 이 노래는 영화 레미제라블의 오리지널사운드트랙OST을 광둥화로 번안해 편집한 것이다.    시민단체 민간인권진선민진이 주최한 집회에는 2005년 중국에서 날조된 간첩 혐의로 3년간 복역한 언론인 칭 청 1981년 중국 인권운동가를 도왔다가 10년간 복역한 라우산칭 등이 참가했다.     그러나 작년 10월 이후 8개월간 중국 당국에 강제 구금됐던 람윙키61 코즈웨이베이서점 점장은 신변 안전에 위협을 느껴 행사 참석 결정을 취소했다.     중국 당국의 납치 의혹을 폭로한 람 점장을 돕고 있는 앨버트 호 민주당 의원은 행사장에서 람 점장이 최근 며칠간 낯선 이의 미행을 받았다며 경찰에 신고한 뒤 람 점장이 안전한 장소로 이동했다고 설명했다.        집회에 참가한 시민들은 3시30분께부터 공원에서 3 떨어진 애드미럴티 정부청사를 향해 거리행진을 시작했다. 홍콩 민주화 요구 거리행진 참가자들    시민들은 섭씨 32도에 이른 무더운 날씨에도 도심 도로를 가득 메운 채 행진했으며 행진이 시작된 지 2시간이 지난 뒤에도 첫 집결지인 빅토리아 공원으로 참가자가 모여들었다.    행진 참가자들은 결전 689라는 글이 쓰인 대형 플래카드를 들고서 행진했다.         689는 2012년 행정장관 선거에서 1천200명의 선거위원회 위원 중 렁 장관에게 지지표를 던진 선거위원 수로 홍콩의 자치와 민주주의를 중시하는 범민주파가 홍콩 내 렁 장관의 지지자가 소수에 불과하다고 주장하기 위해 사용하고 있다.    참가자들은 취임 4주년을 맞은 렁 장관의 퇴진과 직선제 도입 등 정치개혁안 마련 등을 촉구하는 구호를 외쳤다.     영국 식민지 시절이 그립다는 의미를 담은 영국령 홍콩 깃발을 든 채 행진에 참가한 이들도 많이 눈에 띄어 홍콩인의 반 중국 정서가 확산하고 있음을 보여줬다.     홍콩대가 지난달 2023일 홍콩인 1천6명을 대상으로 설문 조사한 결과 중국 국적을 자랑스럽게 생각한다고 답한 응답자 비율이 31로 작년보다 7포인트 하락해 역대 최저치를 기록했다. 중국 국민인 것이 자랑스럽지 않다는 응답률은 65로 9포인트 높아졌다. 홍콩서 민주화 요구 행진북한 인권 단체도 참가    홍콩 최현석 특파원  홍콩의 주권이 영국에서 중국으로 반환된지 19주년인 1일 홍콩 시민 수만 명이 민주화와 렁춘잉 행정장관행정수반 퇴진을 요구하는 71대행진 행사를 진행했다.     도로변에는 북한 인권 단체 탈북자관주조가 도로변에 부스를 설치한 채 북한의 인권 상황을 설명하는 전단을 행진 참가자들에게 배포했다.1    harrisonyna.kr    1829세의 응답자 중에서는 86가 중국 국적이 자랑스럽지 않다고 답했으며 자랑스럽게 생각한다는 응답은 10에 그쳐 젊은 층의 반중 정서가 강화되고 있음을 보여줬다.    부친과 함께 행진에 참가한 대학생 찬22여모 씨는 렁 장관이 대학 등 홍콩 각계의 자치권을 제한했을 뿐 아니라 중국 정부의 내정 간섭을 환영했다며 행정장관을 교체한 뒤 직선제 도입 논의를 재개해야 한다고 주장했다.    북한 인권 개선을 요구하는 시민단체 탈북자관주조도 도로변에 부스를 설치하고 북한의 인권 상황을 설명하는 전단을 행진 참가자들에게 배포했다.    탈북자관주조의 오언 라우 공동설립자는 시민 자유를 억압하는 면에서 홍콩이 북한과 비슷해지고 있다며 홍콩인들이 민주주의가 약화하는 것을 모른 체하면 북한 같은 상황에 처할 수 있다는 것을 각인하고자 행사에 참가했다고 말했다.    홍콩판 쯔위로 불리는 반 중국성향의 홍콩 가수 데니스 호여와 우산혁명의 아이콘 조슈아 웡19 데모시스토Demosisto 비서장 등도 거리행진에 참가한 것으로 전해졌다.    민진은 이날 행진에 10만 명이 참가할 것으로 기대했지만 실제 참가자 수는 예상치에 미달할 것으로 관측되고 있다.    이날 저녁에는 친독립 성향 홍콩민족당과 본토민주전선 등 급진적 지역주의 단체들이 중국 정부가 홍콩에 파견한 대표처인 홍콩 주재 중국연락판공실중련판 앞에서 법치 보호와 폭력 반대 독립 등을 요구하는 별도 집회를 열 예정이다.    경찰은 이날 충돌에 대비해 홍콩섬 전역에 2천여 명의 경찰관을 배치했다.     경찰은 지역주의 단체의 집회에 대비해 중련판 부근에서 검문검색을 강화했으며 무기를 소지한 집회 참가자를 체포할 예정이다
법원, 피자헛 '갑질' 인정…부당이득금 반환하라	http://news.naver.com/main/read.nhn?oid=022&sid1=101&aid=0003071943&mid=shm&mode=LSD&nh=20160701201754	계약서에 없는 어드민피Administration Fee가맹점 서비스 수수료를 가맹점주들에게 부과한 한국 피자헛의 이른바 갑질이 불법이라는 법원의 판단이 나왔다. 서울중앙지법 민사합의33부부장판사 정인숙는 피자헛 가맹점주 강모씨 등 89명이 한국 피자헛을 상대로 낸 부당이득금 반환 청구 소송에서 원고 일부 승소 판결했다고 1일 밝혔다. 이에 따라 피자헛은 원고 이모씨를 제외한 88명에게 52만9239만원의 부당이득금을 반환하게 됐다. 가맹점주들은 피자헛과 최초 가맹계약을 맺을 때 가맹비를 지급한 후 매달 총수입을 기준으로 로열티와 원재료비 콜센터비용 광고비 등을 냈다. 피자헛은 가맹점주들에게 대금 청구서를 보내면서 어드민피라는 항목을 만들었는데 마케팅이나 전산지원 고객 상담실 운영 등에 들어가는 비용을 뜻했다. 이에 따라 가맹점주들은 월 매출액의 0.55씩 2012년 4월 이후부터는 0.가맹점주들은 피자헛이 가맹계약에 근거 규정도 없는 어드민피를 부과하고 있다며 지난해 6월 법원에 소송을 냈다.피자헛은 계약 체결 시 어드민피가 부과된다는 취지의 정보공개서를 공정거래위원회에 등록했고 일부 가맹점주들과는 어드민피에 대한 합의서를 작성했다며 반발했다. 일부 가맹점주가 오랜 기간 아무 문제 제기 없이 어드민피를 지급해 온 만큼 묵시적 합의가 성립됐다는 주장도 폈다.법원은 어드민피의 법률상 부과 근거가 없다며 가맹점주들 손을 들어줬다.재판부는 피자헛이 어느 항목에 구체적으로 얼마의 금액이 소요됐는지 아무런 기재 없이 어드민피를 청구하고 있다며 피자헛 스스로도 어드민피가 구체적으로 어떤 성격의 비용인지 충분히 설명하지 못하고 있다고 지적했다
"차량 워셔액 뿌릴 때마다…" 충격적 실험 결과	http://news.naver.com/main/read.nhn?oid=055&sid1=102&aid=0000425477&mid=shm&mode=LSD&nh=20160701212917	차량의 앞유리를 닦을 때 쓰이는 세정액을 보통 자동차 워셔액이라고 하죠. 국내에서 생산되는 이 워셔액의 90는 독성 물질인 메탄올을 주성분으로 하고 있습니다. 제조사들은 차량 바깥에서 사용하는 것이기 때문에 안전하다고 합니다만 저희 취재진이 직접 실험을 해봤더니 워셔액을 뿌릴 때마다 메탄올이 이 차 안으로 들어온다는 놀라운 사실이 확인됐습니다. 메탄올의 독성 때문에 유럽에서는 에탄올만 쓰도록 하고 있는데 우리나라엔 관련 규정이 전혀 없는 상태입니다.메탄올 워셔액 운전자들의 건강에는 문제가 없는 건지 김종원 기자의 생생 리포트입니다.기자워셔액을 차 앞유리에 뿌리면 그대로 흘러서 보닛 틈새로 흘러들어 갑니다.워셔액이 흘러들어 간 곳은 바로 공기 흡입구 플라스틱 부품을 뜯어내 보자 차 조수석 내부와 바로 연결되는 커다란 환기구가 드러납니다.유리창에서 흘러내린 워셔액이 바로 이 환기구 앞으로 줄줄 떨어지는 겁니다.박병일자동차 명장  워셔액이 이렇게 흘러내려 올 때 에어컨을 틀 거 아니에요. 그러면 공기를 흡입해서 당길 거 아니에요 그러면 공기가 들어가면서 워셔액 일부가 차 안으로 들어가는 거죠. 거의 모든 차 대부분이 이런 구조로 돼 있어요.문제는 국내에서 판매되는 워셔액 대부분은 주성분이 맹독성 물질인 메탄올이라는 겁니다.이덕환서강대학교 화학과 교수  메탄올은 아주 맹독성 알코올인데요 소량을 흡입해도 중추신경을 마비시켜서 시신경에 치명적인 손상을 주는 걸로 알려져 있습니다.금붕어가 담긴 수조에 메탄올 워셔액 100mL 넣자 30분 만에 2마리가 힘을 못 쓰고 옆으로 쓰러집니다.이런 유독한 메탄올 성분이 워셔액을 뿌릴 때마다 환기구를 통해 차 안으로 유입되는 겁니다.여기 이 유리 실린더는 메탄올을 측정하는 시료입니다.이 내부가 지금은 주황색으로 되어 있지만 공기 중에 메탄올이 있을 경우 파란색으로 변하게 됩니다.한번 직접 차 안에서 실험을 해 보겠습니다.외부 공기가 차량 안으로 들어 올 수 있게끔 공조기를 맞춰놓고 워셔액을 5초간 뿌려봤습니다.차량 내부 공기 100mL를 포집해 메탄올 농도를 측정해보니 무려 3천ppm이나 검출됐습니다.이번엔 외부 공기의 유입을 차단한 상태에서 차량을 시속 40로 주행하며 워셔액을 뿌려봤습니다.외부 공기를 막았는데도 메탄올이 400ppm 검출됐습니다.우리나라 산업보건법상 메탄올 노출 허용기준은 200ppm 워셔액을 뿌리면 외부 공기가 유입되는 경우엔 기준치의 15배 외부 공기를 차단을 해도 기준치의 2배나 되는 메탄올이 비록 순간적이나마 유입되는 겁니다.제조사들은 메탄올의 독성은 인정하지만 차 안으로 유입되는 양이 적어서 문제 될 것은 없다는 입장입니다.워셔액 제조사 관계자  지속적으로 냄새가 들어오는 게 아니기 때문에요 크게 문제는 없습니다.하지만 독일 등 유럽의 일부 국가는 메탄올 워셔액의 위험성을 인정해서 에탄올 워셔액만 쓰도록 규정하고 있습니다.운전자의 건강을 위협할 수 있는 상황이지만 아직 국내에는 메탄올 워셔액에 대한 규정이나 연구가 전무 한 상황입니다
"손소독제 안전한가?" 유해성 논란, 美 조사착수 	http://news.naver.com/main/read.nhn?oid=214&sid1=104&aid=0000638317&mid=shm&mode=LSD&nh=20160701212507	메르스나 지카바이러스 같은 신종 감염병이 퍼지면서 세계적으로 손소독제 사용이 늘고 있는데요.이 손소독제가 인체에 해로울 수 있다는 주장이 제기돼 보건당국이 조사에 착수했습니다. 리포트 물과 비누가 없어도 문지르기만 하면 세균을 없애준다는 손 소독제.휴대가 간편한데다 공공장소마다 비치된 곳들이 많아 사용이 꾸준히 늘고 있습니다.하지만 손 소독제가 인체에 해로울 수 있다는 주장이 의학계에서 제기됐습니다.스테판 캄벨 전문의 켈시시볼드 클리닉  소독제가 혈류에 스며들었을 때 임산부와 태아에 문제가 생길 수 있다는 연구 결과가 많이 나와있습니다.감염 예방 효과가 크지 않다는 의견도 있습니다.스테판 캄벨 전문의 켈시시볼드 클리닉  모든 바이러스와 박테리아를 완전히 제거할 수는 없습니다.이에 따라 FDA가 제조사들에게 안전성과 효능을 입증할 자료 제출을 요구하는 등 조사에 착수했습니다.손 소독제는 에탄올과 이소프로필알코올 등의 성분으로 제조되는데 이 성분들이 태아에 영향을 주거나 눈과 피부를 자극할 가능성에 주목하고 있습니다. 제조사들은 안전성에 문제가 없다는 입장입니다. 브라이언 산소니비누세제 협회몇 년 동안 연구한 결과에 따르면 이 제품들을 사용하는 건 안전하다는 게 입증됐습니다
'트집' 잡아 수출길 막는 중국…피해 속출	http://news.naver.com/main/read.nhn?oid=214&sid1=101&aid=0000638320&mid=shm&mode=LSD&nh=20160701210944	우리 최대 수출 시장은 전체 수출의 4분의 1을 차지하는 중국입니다.그런데 갈수록 중국 수출길이 어려워지고 있습니다. 자유무역협정 FTA로 관세는 없어졌지만 중국이 검역 기준이나 인허가 절차를 까다롭게 하는 식으로 무역 장벽을 높이고 있기 때문인데요.립스틱도 색깔별로 허가를 받으라면서 우리 수출 기업의 진을 빼놓고 있습니다. 리포트 중국에 의료기기를 수출하는 업체입니다. 시험성적서를 받는 데만 23년이 걸리고 한 번에 5천6천만 원이 드는 수입 허가도 5년마다 다시 받아야 합니다.이러다 보니 진출한 지 10년이 넘었지만 연매출은 제자리걸음입니다. 홍순욱한국의료기기산업협회 부회장허가 시점이 늦어지면 중국 내에서 자기들이 제조를 하기 때문에 상대적으로 경쟁이 생기고 매출에도 영향이 올 수가 있는 겁니다.한국산 화장품에 대한 견제는 더 심합니다. 이렇게 같은 화장품이라고 하더라도 중국에 수출하려면 색깔별로 따로따로 위생허가를 받아야 합니다.최용민한국무역협회 북경지부장중국인이 해외에서 사던 것을 국내에서 사게 만들고 국내에서 사더라도 중국 기업 것을 사게 만드는 큰 흐름으로 볼 수 있습니다.사소한 트집을 잡아 세계 최고 기술력을 가진 우리 전기차 배터리 업체를 안전 인증에서 탈락시키는가 하면 중국 문화를 보호한다는 이유로 프라임 시간대에 방영할 수 있는 해외 프로그램을 1년에 2편으로 제한해 우리 프로그램의 판권 수출에도 타격이 불가피합니다.한재진현대경제연구소 중국팀장FTA 추가 협상에서 종합적으로 대책안을 만들어서 중국 정부에 제시하는 게 오히려 더 효율적이고 빨리 이 문제를 타결할 수 있는 방법이 아닐까 합니다
경기는 바닥인데 세금은 잘 걷히네	http://news.naver.com/main/read.nhn?oid=022&sid1=101&aid=0003071927&mid=shm&mode=LSD&nh=20160701194406	올들어 5월까지 109조원작년 동기 비해 19조원 늘어정치권 과다징수 아니냐국세청 GDP 등 성장 영향올 들어 5월까지 정부가 거둬들인 세금이 약 109조원에 이르렀다. 1년 전보다 무려 19조원가량 불었다. 경기는 곤두박질해 추가경정예산까지 편성하는 마당인데 세수는 때아닌 호황을 구가하고 있는 셈이다. 이에 여야 의원들은 국세청이 과다 징수를 한 게 아니냐고 추궁했다.국세청은 1일 국회 기획재정위원회 업무보고에서 올해 15월 세수가 108조9000억원으로 작년 같은 기간에 비해 18조9000억원 늘었다고 밝혔다. 한 해 걷기로 한 세금 중 실제 걷힌 세금의 비율을 나타내는 진도비는 51.1로 전년 동기 대비 7.법인세는 작년 같은 기간보다 5조5000억원 더 걷혔다. 물건을 사고팔 때 붙는 부가가치세와 월급 및 부동산 거래수익에서 떼가는 소득세는 각각 5조6000억원이 더 징수됐다.국세청은 작년 명목 국내총생산GDP이 4.9 성장한 데다 소비실적이 개선된 영향을 받았다며 법인 영업실적이 증가하고 비과세감면 정비 등 경제적제도적 효과도 적지 않았다고 분석했다.그러나 정치권에서는 경기가 좋지 않은 상황에서 마른 수건 짜기식 과도한 징수가 있지 않았는지 지적하는 목소리가 컸다. 새누리당 이종구 의원은 국세청의 법인세 사후검증 건수는 줄었지만 사후검증 추징세액은 늘었다며 국세청이 추가로 자료를 요구하고 수정토록 하는 과정 자체가 납세자에게 다른 형태의 세무조사 압박을 가한 것 아니냐고 지적했다. 더불어민주당 김부겸 의원은 국세청이 사실상 지나치게 과세를 강화해서 올해 413 총선 민의에 영향을 미친 것 아니냐는 문제가 제기될 만큼 과다징수가 심각했던 것 아니냐고 말했다.임환수 청장은 세금 탈루를 포착할 수 있는 여러 장치가 갖춰지고 그 방법이 정교해지면서 세무조사 건수는 줄었지만 세무조사를 받는 사람으로서는 부담이 늘었다고 느낄 수 있을 것이라면서도 세무조사로 추징되는 세수는 전체 내국세의 23라고 말했다. 임 청장은 법인세 사후검증 건수는 주는 추세고 추징세액도 감사원 감사에 지적된 특정 업체 두 군데 때문에 는 것뿐이라고 해명했다.국세청은 어려운 경제여건을 감안해 총 세무조사 건수를 예년 수준으로 유지하기로 했다
