'계단걷기·아침먹기'…새해다짐은 소박하게	http://news.naver.com/main/read.nhn?mode=LSD&mid=shm&sid1=103&oid=001&aid=0008090283	김길원 기자  새해가 되면 저마다 건강계획을 세우기 마련이다. 대표적인 게 금연 다이어트 운동 등이다. 하지만 대부분의 계획은 작심삼일이 되고 만다. 자신의 평소 생활습관을 고려하지 않은 채 거창한 목표를 세우기 때문이다.    전문가들은 새해 건강 목표를 세울 때 일생생활에서 손쉽게 실천할 수 있는지를 최우선으로 고려하라고 조언한다. 새해 건강 목표를 세우는 데 도움이 될만한 생활습관 개선안을 알아본다.     엘리베이터 대신 계단을 이용한다    매일 일부러 시간을 내어 운동을 하는 게 부담스럽다면 생활 속에서 몸을 많이 움직여야 한다. 가급적 퇴근 때는 계단을 이용하고 가까운 거리는 차를 타기보다 걸어서 가는 습관을 생활화하는 게 좋다.    걷기는 만병통치약이라고 할 정도로 감기에서부터 골다공증 각종 암에 이르기까지 각종 질병의 치료 및 예방에 뛰어난 효과를 발휘한다. 특히 심장기능을 강화하고 심근육 발달을 촉진한다. 또 혈관의 탄성을 높여 우리 몸의 주요 기관에 혈액이 잘 공급되도록 돕는다. 이를 통해 당뇨 고혈압 심장병 등 성인병의 80를 예방할 수 있다.     대한심장학회는 1주일에 10층 계단을 두 번만 걸어 다녀도 심근경색을 20 가량 예방할 수 있다는 분석을 내놓기도 했다.    걷기는 뇌에도 적당한 자극을 줘 스트레스를 해소하는 효과가 있다.    걸을 때는 되도록 편안한 신발을 신고 보폭을 크게 해 걷는 게 바람직하다. 짬짬이 스트레칭을 해서 몸을 이완시켜주면 더욱 좋다.      아침밥은 꼭 먹는다 TV 캡처     밥이 보약 이라는 말이 있는 것처럼 하루 세끼를 규칙적으로 먹는 것은 건강의 기본이다. 그중에서도 아침식사는 특히 중요하다.    아침식사를 거르면 뇌 속의 식욕중추가 흥분 상태에 놓이게 돼 생리적으로 불안정 상태가 되고 집중력 사고력 등이 현저히 떨어진다. 그뿐만 아니라 아침에 부족했던 에너지를 보충하고자 점심이나 저녁에 폭식하는 경우가 많아지는데 이런 불규칙한 식생활은 위에 부담을 줘 위장병에 걸릴 확률을 높인다.    반면 아침밥을 먹으면 오전 중에 필요한 에너지를 확보하고 두뇌와 내장의 활동을 활발하게 촉진시켜 생활의 활력을 높여준다. 그런가 하면 점심과 저녁의 폭식을 막아 비만을 예방한다.      밥을 한 숟갈씩 덜어 놓고 먹는다    장수하는 사람들의 가장 큰 비결은 소식이다. 식사를 할 때 양껏 먹기보다는 조금 부족하다 싶을 정도로 절제된 식사를 하는 것이 좋다. 갑자기 많은 음식을 섭취하면 급격한 혈당치 상승을 가져오고 인슐린 분비도 과다해져 지방합성이 증가한다. 즉 매 끼니를 적당히 섭취한 경우보다 한 끼라도 폭식하면 더 많은 양의 지방이 체내에 축적되는 것이다. 때문에 비만 당뇨 등의 성인병이 생길 위험이 커진다.     또 음식을 많이 먹을수록 장내에서 세균들에 의한 부패물질이 그만큼 많이 만들어지고 각종 질병에 노출될 위험도 커진다. 특히 고지방 고단백질 음식을 좋아하면 더 많은 부패물질이 만들어진다. 따라서 지방과 단백질 음식은 1일 식단에서 20를 넘지 않도록 주의하고 음식을 삼킬 때 충분히 씹어서 삼키는 것도 중요하다.    과체중은 성인병의 원인이 될 수 있으므로 항상 적정 체중을 유지하는 노력을 게을리하지 말고 되도록 간식은 피하는 것이 좋다.     손을 수시로 깨끗이 씻는다.    손만 제대로 씻어도 감염질환의 60 정도는 예방할 수 있다. 감기는 물론 독감 콜레라 세균성 이질 식중독 유행성 눈병 등 대부분 전염병 및 식중독 예방에 큰 도움이 된다.    손은 언제나 바쁘게 움직이면서 뭔가를 잡고 나르고 만들면서 각종 유해 세균과 가장 많이 접촉하는 부위다. 일단 손에 묻은 세균은 눈 코 입 피부 등으로 옮겨져 그 자신이 질병에 걸릴 뿐 아니라 주변의 음식 물건 등에 옮겨졌다가 다른 사람에게까지 전염시키게 된다. 외출에서 귀가했을 경우 화장실에 다녀온 후 애완동물을 만지고 난 후 생선이나 고기를 요리하고 나서는 반드시 비누를 이용해 구석구석 손을 씻어야 손으로 전염되는 각종  질병을 예방할 수 있다. 농협유통 제공      술은 소주 반병 이하로 줄인다    사회생활과 스트레스 해소를 위해 술은 필요하지만 건강을 위해 절주하는 생활방식을 몸에 익혀야 한다. 사람마다 간에서 처리할 수 있는 능력 차는 있지만 보통 한 차례 마실 수 있는 양은 알코올 50g 정도이며 이는 소주로는 반 병34잔 양주는 스트레이트로 3잔 맥주 2병 분량이다. 또한 간이 알코올로부터 쉴 수 있도록 한번 술을 마신 뒤엔 23일 동안은 술을 마시지 말아야 한다.     알코올 자체도 문제지만 술과 함께 먹는 기름진 안주도 건강에 해가 된다. 평상시에는 간에서 만들어진 지방이 다른 조직으로 이동해서 저장되지만 음주 후에는 그대로 간에 지방으로 축적돼 지방간의 원인이 되기 때문이다.      채소와 과일을 충분히 먹는다    채소와 과일 도정하지 않은 곡물류현미 잡곡 등와 콩류에는 복합 탄수화물 섬유질 칼륨 비타민 항산화제 등 미세영양소가 들어있어 혈압을 낮추고 당 및 지질 대사를 호전시킨다. 또 심혈관질환의 발병 위험을 줄이는데도 도움이 된다. 다양한 색깔의 신선한 채소와 과일을 하루에 23회 이상 먹는 게 좋다.    다만 하루 활동에 필요한 칼로리 이상으로 섭취하는 건 주의해야 한다. 가급적 비타민과 미네랄 등 미세 영양소가 풍부하면서도 칼로리가 낮은 음식을 먹고 가공육류와 인스턴트식품 식품첨가물은 피하는 게 바람직하다.    식이섬유와 함께 물도 충분히 마셔야 한다. 식이섬유는 자기 무게의 3040배나 되는 많은 수분을 흡수해 변의 양을 늘리고 부드럽게 만들지만 물을 충분히 마시지 않으면 오히려 변이 단단해져 변비가 생길 수 있다.52 정도의 물을 마시는 습관이 필요하다. 물을 마실 때는 한 번에 많이 마시지 말고 조금씩 자주 마시되 식사 전후를 피하는 게 요령이다
"새해 유럽에서 '테러위협'은 일상이 된다"	http://news.naver.com/main/read.nhn?mode=LSD&mid=shm&sid1=104&oid=001&aid=0008090195&cid=428288	테러위협으로 폐쇄된 독일 뮌헨역에 투입된 독일 특수경찰부대원 AP정초부터 테러경고에 뮌헨역 폐쇄행사취소 잦아질 것     김선형 기자  우려했던 연말연시 대규모 테러는 없었지만 새해 유럽 대륙은 당분간 테러의 위협을 일상으로 받아들여야 할 것 같다.    지난달 31일 밤부터 올해 첫날 오전까지 독일 뮌헨에서 극단주의 무장단체 이슬람국가IS의 자살폭탄 테러 우려로 기차역 2곳을 폐쇄한 것이 그 신호탄으로 받아들여진다.    앞서 벨기에 브뤼셀과 프랑스 파리 등은 테러 걱정에 아예 신년맞이 축제 일정을 취소하거나 규모를 축소하기까지 했다.    1일현지시간 오전에는 네덜란드 암스테르담 스히폴 공항 입국장에서 29세 영국인 남성이 내게 폭탄이 있다고 거짓으로 외쳐 공항에 있던 사람들이 30분 동안 대피하는 소동도 벌어졌다.    이처럼 올해 유럽에서는 테러 위협의 일상화로 주요 행사가 취소되거나 경계경보 발령이 잦아져 피로도가 쌓일 것이라고 영국 일간 가디언이 이날 전망했다.    유럽의 테러전문가들은 지난해 11월 파리 테러 이후 각국 안보당국에서 IS가 유럽을 표적 삼아 전문적인 테러 계획을 세우고 공격을 수행할 의도와 능력을 보이기 시작한 것으로 파악했다고 입을 모았다.    마거릿 길모어 영국 왕립합동군사연구소RUSI 연구원은 가디언에 지난 15년간 인파가 많은 곳에서 테러가 자행됐다는 점은 새로울 것도 없다면서도 다만 IS의 파리 테러 이후 전통적 테러장소인 중동을 넘어서도 테러가 일어날 수 있다는 사실이 확인됐다고 말했다.네덜란드 암스테르담 스히폴공항에서 폭탄이 있다고 외친 영국인 남성이 경찰에 제압당하는 장면     그는 프랑스 수도인 파리에서 테러가 일어났다는 점은 IS가 굉장히 빠른 속도로 성장했음을 분명히 보여주는 상황이라고 설명하며 더 자주 혼란사태가 일어날 것이라고 경고했다.    또 대규모 테러를 감행할 수 있는 IS의 능력을 고려하면 각국에서 높은 수준의 보안 유지가 요구되고 이에 따라 대중적 관심이 쏠리는 행사가 종종 취소될 가능성이 있다는 것을 의미한다고 덧붙였다.     실제로 파리 테러 직후인 지난해 11월17일 독일 하노버에서 열릴 예정이었던 독일과 네덜란드 축구대표팀 친선경기가 구체적인 테러 첩보에 따라 취소된 바 있다.    테러전문가인 리크 쿨새트 벨기에 겐트대학 교수도 테러단체들이 새해 전야 축제와 같이 이목이 쏠리는 대규모 행사를 노린다는 점에는 변함이 없지만 IS의 등장은 그 자체로 유럽이 새로운 시대를 맞았다는 의미라고 밝혔다.    테러를 떠나 단순히 IS에 참여하고 싶어하는 사람들 때문에라도 안보당국의 역할은 더욱 힘들어질 것이라며 몇 달 내로 IS 선전광고는 사라지겠지만 그렇게 되기까지 계속 테러리스트들의 저항을 겪을 것이라고 주장했다.    유럽 난민위기와 갈수록 증가하는 테러위협을 하나의 문제로 보는 일각의 견해에 대해선 분리된 두 사안을 혼동해서는 안 되며 이 문제를 자신에게 유리하게 이용하려는 정치인들에 놀아나서도 안 된다며 난민 유입이 테러위협을 가중한다는 시각을 경계했다
"부모가 자율적으로 키운 자녀 스마트폰 중독성 낮다"	http://news.naver.com/main/read.nhn?mode=LSD&mid=shm&sid1=105&oid=001&aid=0008090180	자료사진가톨릭대 문두식최은실 교수 중학생 700명 대상 분석여학생이 남학생보다 스마트폰 중독 성향 높아     김용래 기자  부모가 자녀의 의견에 귀를 기울이고 자율적인 양육태도를 보일수록 자녀의 스마트폰 중독 가능성도 작다는 연구 결과가 나왔다.    2일 가톨릭대 문두식최은실 교수가 최근 학술지 청소년학 연구에 기고한 부모의 양육태도가 청소년의 스마트폰 중독에 미치는 영향에 따르면 부모의 양육 태도가 더 수용적이고 자율적일수록 자녀의 자아존중감이 높아지고 스마트폰 중독 정도도 덜한 것으로 나타났다.    스마트폰 중독은 스마트폰에 충동적으로 과도하게 몰입해 조절능력을 상실하고 결국 사회심리신체적인 문제를 일으키는 상태를 말한다.    일반적으로 학계에서는 스마트폰 중독이나 과다 사용은 성장기 청소년에게 사회참여를 감소시키고 심리적 안녕을 위협해 우울증 동기 저하 낮은 자존감 거절에 대한 두려움 등을 증가시키는 것으로 보고되고 있다.     가톨릭대 연구팀은 부모의 양육태도와 자녀의 스마트폰 중독의 상관관계를 분석하기 위해 서울경기강원의 중학교 12학년 학생 700명을 상대로 설문조사를 진행했다.    부모의 양육태도와 청소년의 자아존중감을 측정하는 문항들과 한국정보화진흥원의 스마트폰 중독 자가척도를 사용해 상관관계를 분석한 결과 청소년의 자아존중감이 높을수록 스마트폰 중독 성향도 감소하는 것으로 조사됐다.    청소년의 자아존중감은 부모의 양육태도와 통계적으로 유의미한 상관관계가 있는 것으로 나타났다.    부모가 양육 과정에서 자녀의 의견을 충분히 들어주지 않고 부모의 의견을 과도하게 강제할수록 자녀의 자아존중감이 낮아진다는 것이다.    또 부모의 자녀에 대한 성취 압력이 낮을수록 자녀의 스마트폰 중독 정도도 낮게 나타났다.     부모가 자녀의 학업성적이나 진학 등 성취에 과도하게 집착하면 스마트폰에 중독될 가능성이 크다는 의미다.    스마트폰 중독을 수치화했더니 남학생은 1.16으로 여학생이 스마트폰 중독에 더 취약한 것으로 나타났다.    논문은 부모의 양육태도에서 성취압력이 높을 때 성적이 뛰어나고 일류 상위학교에 진학해야 한다는 것을 과도하게 의식하게 되면서 반사적인 행동으로 스마트폰에 몰입한다고 할 수 있다고 지적했다.    이어 논문은 청소년이 스마트폰에 의존집착하지 않도록 청소년들이 건전한 모임과 활동을 할 기회를 국가지방자치단체학교가 제공해야 한다고 강조했다
주인 기다리는 미지급 휴면보험금 8천290억원	http://news.naver.com/main/read.nhn?mode=LSD&mid=shm&sid1=101&oid=001&aid=0008090187	휴면보험금찾아주기 현장  자료사진     임형섭 기자  고객들이 보험사에서 찾아가지 않은 휴면보험금의 규모가 8천억원을 넘는 것으로 나타났다.    2일 생명손해보험협회에 따르면 지난해 말 기준으로 보험사들이 보관 중인 휴면보험금은 모두 8천290억원으로 집계됐다.    이 가운데 생명보험사들이 보유한 미지급 휴면보험금은 6천35억원이며 손해보험사들이 환급하지 못한 휴면보험금은 2천255억원이다.    보험협회와 보험사들은 지난해부터 휴면보험금 환급 노력을 대폭 강화했다.    홈페이지를 활용해 환급방법을 안내하는 것은 물론 보험가입조회 때 휴면보험금 동시조회 서비스를 제공하는 등 시스템 개선에도 공을 들였다.     이 덕분에 작년 생명손해보험사들이 고객에게 돌려준 휴면보험금은 2014년에 비해 27 늘어난 3천649억원을 기록했다.    특히 생보협회가 지난해 8월부터 대대적인 휴면보험금 찾아주기 운동을 벌이는 등 1년간 2천983억원을 고객에게 돌려줘 전년보다 환급액을 64 늘렸다.    한 보험사 관계자는 일부 고객들은 휴면보험금이 보험사의 수익으로 귀속된다고 오해하지만 일정기간이 지나면 휴면보험금은 모두 미소금융중앙재단으로 출연해야 한다며 보험사들 입장에서도 고객들에게 돌려주는 편이 낫다고 설명했다.    손보생보협회는 올해도 휴면보험금 안내센터를 운영하는 등 환급노력을 강화할 계획이다
상행선 정체 오후 6시 절정… 자정께 해소	http://news.naver.com/main/read.nhn?mode=LSD&mid=shm&sid1=103&oid=003&aid=0006962488	배현진 기자  새해 연휴 둘째 날인 2일 서울 방향으로 차들이 몰리기 시작하면서 상행선 정체가 시작되고 있다.  한국도로공사는 이날 하루 총 342만대의 차량이 고속도로를 이용할 것으로 내다봤다. 지난해 새해 연휴 토요일 교통량365만대과 비교하면 23만대 줄어든 수치다.  수도권에서 지방으로 내려가는 차량은 31만대 지방에서 수도권으로 이동하는 차량은 36만대에 달할 예정이다. 오후 2시 기준 수도권을 빠져나간 차량은 17만대 들어온 차량은 15만대로 집계됐다. 현재 부산에서 서울까지 예상 소요시간승용차 요금소 기준은 4시간40분이다. 울산서울 4시간50분 대구서울 3시간50분 광주서울 3시간50분 강릉서울 5시간30분 대전서울 2시간이 각각 소요되겠다. 반면 서울에서 승용차를 이용해 부산까지 이동하는데 걸릴 것으로 예상되는 시간은 4시간20분이다. 서울울산 4시간30분 서울대구 3시간30분 서울광주 3시간 서울강릉 2시간20분 서울대전 1시간40분 등이다. 현재 전국 주요 고속도로의 정체구간은 83. 경부고속도로 서울 방향 양재나들목서초나들목 2.5 구간 부산방향 잠원나들목반포나들목 0.4 구간에서 차량이 답답한 흐름을 보이고 있다. 서해안고속도로 서울 방향 고창나들목선운산나들목 7.5 구간에서도 차량이 가다서기를 반복하고 있다. 영동고속도로 인천 방향 평창나들목면온나들목 6.9 구간에서도 정체를 빚고 있다. 대구포항고속도로 포항 방향 도동분기점와촌터널동측 10. 상행선 정체는 오후 6시 절정을 이루다가 자정이 넘어서야 완전히 해소될 것으로 보인다. 하행선은 큰 정체가 없겠다
중국, 핵전략 미사일 부대 '로켓군' 창설…군사굴기 과시	http://news.naver.com/main/read.nhn?mode=LSD&mid=shm&sid1=104&oid=003&aid=0006962414&cid=428288	베이징신화중국이 2015년 마지막 날 새로운 핵전략 미사일 부대인 로켓군 등 새로운 군 기구를 창설하면서 군사굴기의 의욕을 드러냈다. 1일 중국 관영 신화통신 중앙CC TV 등 언론은 전날12월 31일 오후 인민해방군이 육군사령부와 로켓군 전략지원부대를 창설한 가운데 시진핑 국가주석이 이 부대들에 군기를 수여했다고 전했다. 시 주석이 초대 로켓군 사령관에 웨이펑허에게 군기를 수여하는 모습.02베이징신화문예성 기자  중국이 2015년 마지막 날 새로운 핵전략 미사일 부대인 로켓군 등 새로운 군 기구를 창설하면서 군사굴기의 의욕을 드러냈다.  1일 중국 관영 신화통신 중앙CC TV 등 언론은 전날12월 31일 오후 인민해방군이 베이징의 국방부 건물에서 육군사령부와 로켓군 전략지원부대를 창설한 행사를 공식 개최한 가운데 시진핑 국가주석이 이 부대들에 군기를 수여했다고 전했다.  시 주석은 새로운 군 기구 지휘관들에게 군기를 수여하면서 새로운 부대는 당과 인민이 부여한 신성한 사명을 충실히 감당하고 중국의 꿈과 강군의 꿈을 이루기 위한 큰 공헌을 해야 한다고 촉구했다.  로켓군은 기존의 핵미사일 부대인 제2포병을 개편한 것으로 육해공군에 이어 중국군의 제4 병종이 될 것으로 예상되고 있다.  로켓군을 제4 병종으로 만든 것은 항공모함 공격방공 미사일 등 장거리 타격 능력을 키우겠다는 의도로 풀이된다. 시 주석은 로켓군에 대해 자국군의 전략적 위협력의 핵심역량이라고 평가하면서 핵 억지력과 핵반격능력을 강화할 것을 지시한 것으로 전해졌다.  중국이 2015년 마지막 날 새로운 핵전략 미사일 부대인 로켓군 등 새로운 군 기구를 창설하면서 군사굴기의 의욕을 드러냈다. 1일 중국 관영 신화통신 중앙CC TV 등 언론은 전날12월 31일 오후 인민해방군이 육군사령부와 로켓군 전략지원부대를 창설한 가운데 시진핑 국가주석이 이 부대들에 군기를 수여했다고 전했다. 왼쪽에서 오른쪽 순서로 육군 로켓군 전략지원부대의 벳지와 휘장. 사진출처 중국 국방부 홈페이지 2015.02 전략지원부대는 우주군과 전자 정보군 사이버전 부대 등 첨단 기술을 활용한 군사력을 총괄할 것으로 알려졌다. 시 주석은 초대 육군사령관에 리쭤청62 청두군구 사령관 로켓군 사령관에 웨이펑허61 현 제2포병 사령관 전략지원부대 사령관에 가오진56 현 군사과학원 원장을 임명했다. 이들 신임 사령관은 모두 시 주석의 측근 인사로 분류된다.  한편 중국군이 곧 대규모 군사개편을 진행할 것이라는 주장이 꾸준히 제기돼 왔다. 7대군구18개 집단군 체제는 군구 간 독립성이 강해 합동작전 능력이 떨어져 강군의 목표 실현에 걸림돌이 된다는 지적이 제기돼 왔기 때문이다
이스라엘 도심서 총기난사로 2명사망…아랍계 범인 도주	http://news.naver.com/main/read.nhn?mode=LSD&mid=shm&sid1=104&oid=001&aid=0008090293	이스라엘 총격 사건 현장AFP 자료사진현장 주변서 1명 더 숨져 연관성 수사가자지구서 로켓 발포도    카이로 한상용 특파원 김선형 기자  이스라엘의 경제 수도인 텔아비브에서 1일현지시간 총기 난사 사건으로 최소 2명이 숨지고 8명이 다쳤다고 예루살렘포스트 등 현지 언론이 보도했다.    이스라엘 경찰에 따르면 이날 오후 텔아비브 도심 상업지구에 있는 디젠고프의 심타란 이름의 식당을 향해 한 괴한이 총으로 30발가량을 무차별 발사하고 나서 달아났다.    이번 총격으로 이스라엘인 2명이 병원 이송 도중 숨졌고 또 다른 8명이 다쳤다. 부상자 중에 4명은 중태다.    인근 식료품점 폐쇄회로CCTV 영상에는 검은 옷을 입고 선글라스 또는 안경을 쓴 범인이 말린 과일과 견과류 가판대를 둘러보다가 갑자기 뛰쳐나가 가방에서 기관총을 꺼내 식당 쪽으로 난사하는 장면이 찍혔다.    부상자 중 1명은 병원을 찾아온 텔아비브 시장에게 식당에서 친구들과 함께 생일 축하를 하는데 한 남성이 바깥에서 우리를 향해 총탄을 발사했다고 당시 상황을 설명했다.    식당 주인인 나티 샤케드는 이스라엘 방송 채널 2와 인터뷰에서 분명한 테러리스트의 공격이라며 식당 바깥에서 범인이 사방으로 총을 쐈다고 당시 상황을 전했다.    이스라엘 경찰은 즉각 수색에 나서 용의자 1명을 인근 고든 거리에서 체포했으나 실제 총격을 가한 범인은 아닌 것으로 밝혀졌다. 범인은 아직 잡히지 않고 도주 중이다.    이날 TV를 통해 범행 장면을 본 한 남성이 범인의 아버지라고 주장해 이스라엘 경찰과 특수부대는 그의 발언을 토대로 범인을 추적 중이다.AP 자료사진    범인의 가방에서 쿠란이 나왔으며 총을 쏘는 자세로 미뤄 군사 훈련을 받았고 평소 차분한 성격일 것이라고 이스라엘 방송 채널10이 보도했다.    범인의 지인이라고 밝힌 한 남성은 이 방송에 그는 2006년 경찰이 자신의 사촌을 숨지게 한 뒤 정신적 외상을 겪었으며 경찰의 총을 낚아채려고 한 혐의로 이스라엘 감옥에 수감된 적이 있다고 전했다.    AP통신은 범인이 이스라엘에서 소수민족인 아랍계로 추정됨에 따라 이번 사건에 민족적 갈등이 내포된 것으로 보인다고 분석했다.    BBC 방송도 범행 동기는 불분명하지만 동성애에 우호적인 텔아비브 도시의 전반적 분위기에 반발한 공격일 수도 있다는 해석을 내놨다.    경찰은 또 총격사건이 발생한 현장 주변에서 총에 맞아 쓰러진 또 다른 아랍계 이스라엘인을 발견해 병원으로 옮겼으나 숨졌다며 총기 난사사건과의 연관성을 수사 중이라고 밝혔다.    이번 사건은 이스라엘과 팔레스타인 간 긴장이 고조된 와중에 발생해 팔레스타인인의 소행이 아니냐는 추측이 나오기도 했다.    총격사건 몇 시간 뒤인 이날 오후 가자지구 인근 이스라엘 영토에서는 로켓이 두 차례 발포됐으나 사상자는 없었다
