연간 125억원 쏟아붓는 수두 예방접종… 효과는 미미	http://news.naver.com/main/read.nhn?oid=022&sid1=102&aid=0003115925&mid=shm&mode=LSD&nh=20161113230633	서울대 연구팀 발표 수두백신 무용론 확대되나.한 해 125억원의 예산을 들여 실시하는 수두 예방접종이 효과가 낮거나 사실상 없는 것으로 나타났다. 의료계는 수년 전부터 이 같은 내용을 지적해 왔지만 보건당국은 여러 가지 원인을 분석 중이라는 답변만 내놓고 있다.13일 오명돈 서울대병원 교수감염내과 연구팀이 대한의학회지JKMS 최근호에 발표한 결과에 따르면 국내에서 사용이 허가된 백신 4종의 효과는 평균 13로 나타났다.연구팀이 2013년 수두에 걸린 12세 미만 537명을 대상으로 백신접종 효과를 조사한 결과다. 이는 백신이 수두를 줄이는 비율이 13에 불과하다는 뜻이다. 특히 조사 대상자 10명 중 6명이 접종한 2종의 백신은 접종효과가 5와 100로 나와 백신의 수두 예방효과가 전혀 없었다.수두는 전수감시 대상 55종의 법정감염병 중 환자 수가 가장 많고 그 증가 속도 또한 매우 빠르다. 지난해 국내 수두 발생 신고 건수는 4만6330건으로 전체의 36. 법정감염병 지정 첫해인 2005년 1934명이 신고된 이후 2010년 2만4400명 2012년 2만7763명 2014년 4만4450명으로 꾸준히 늘고 있다. 환자 대부분은 12세 이하 어린이로 전체의 91. 정부는 수두를 국가예방접종사업에 포함시켜 생후 1215개월 영유아에게 1회 접종을 하고 있다.여기에 소요되는 예산지난해 기준은 125억원국비 60억 지방비 65억에 이른다. 하지만 오명돈 교수팀의 연구에서 수두 백신 효과는 접종 첫해에만 75.8의 효과를 보였을 뿐 이듬해부터는 계속 줄어 4년이 지나면 7. 반면 외국의 수두 백신 접종효과 연구에서 미국은 87 독일 86 중국 84 등 상대적으로 높았고 시간이 흘러도 효과가 유지됐다.이와 관련해 질병관리본부와 식품의약품안전처 등 백신 관련 당국자들은 백신의 효과는 기준을 무엇으로 잡느냐에 따라 결과가 다를 수 있고 수두 신고 건수도 확진환자 수와는 다르다며 다만 접종 스케줄상의 문제는 없는지 부작용은 무엇인지 등에 대해 연구는 진행 중이라고 설명했다.국립보건연구원은 우리나라 수두 백신이 접종 대상자 97에게 면역효과를 보이고 이 중 90 이상은 6년간 항체가 유지되는 것으로 판단한다. 그러나 한양대 의대 오성희 교수 연구팀이 2년 전 국내 수두 백신 효과는 54여서 통계적으로 무의미하다는 내용을 발표하는 등 의료계에서는 백신 효과에 의문을 표하는 목소리가 적지 않다. 외국에 비해 유독 국내 백신의 효과가 낮게 나타나는 것은 백신의 공장 출하단계나 유통과정 의료기관에서의 보관관리 등에 있어 문제가 있을 수 있다는 뜻이다
최순실 공소장에 조사 결과 담길 듯…퇴임 후 소추 가능	http://news.naver.com/main/read.nhn?oid=056&sid1=100&aid=0010384080&mid=shm&mode=LSD&nh=20161113222206	멘트 검찰은  최순실 씨를  기소하면서  공소장에  박 대통령에 대한  직접 조사 결과를  담을 것으로  전망됩니다. 현직 대통령에 대한  기소는  퇴임 이후엔  가능합니다. 리포트 헌법상 불소추 특권이 있는 대통령은 검찰 조사에서 범죄 혐의가 드러난다 하더라도 임기 중에는 기소할 수 없습니다. 국가원수라는 특수한 지위에 대한 예우와 함께 헌정 질서 공백이라는 비상 상황을 초래하지 않기위한 헌법적 보호 장치입니다. 그러나 퇴임 이후에는 모든 특권이 사라지면서 기소될 수 있습니다.인터뷰 노희범변호사  대통령 불소추 특권이란 국정공백은 막아야 한다 재판을 받게 하고 처벌할 수 없다는 것이기 때문에 퇴임 이후에는 기소는 할 수 있다. 박 대통령의  퇴임 후 기소 여부는 오는 19일쯤으로 예정된 최순실 씨 기소 때 첫 판가름이 날 전망입니다. 최 씨의 공소장에 박 대통령과 관련된 피의 사실이 적시된다면 퇴임 이후 기소하겠다는 의미로 해석할 수 있습니다. 박 대통령에 대한  범죄 혐의가 확인되지 않으면 공소장에 대통령 관련 부분이 포함되지 않을 가능성도 있습니다. 만약 최 씨의 공소장을 통해 대통령의 혐의가 특정될 경우 국회가 탄핵을 추진하는 법적 근거가 될 수 있다는 분석도 법조계 일각에서 나옵니다
'소개팅앱' 돈만 내고 소개는 못 받고, "고객님 외모 탓"	http://news.naver.com/main/read.nhn?oid=214&sid1=102&aid=0000697409&mid=shm&mode=LSD&nh=20161113204547	스마트폰을 통해 커플을 맺어주는 소셜데이팅 어플리케이션이 인기인데요.업체들끼리 경쟁이 치열하다 보니 회원을 모으는데만 급급하고 서비스는 부실한 업체들이 적지 않습니다. 리포트 25만 원을 내고 가입하면 최대 20명까지 이성을 소개해준다는 소셜데이팅 앱입니다.지난 8월 이 앱에 가입한 직장인 37살 조 모 씨도 처음 한 달 동안은 여성 3명을 소개받았습니다.그런데 상대방에게 연락을 해봐도 답장이 없기 일쑤였습니다.해당 업체는 5개월 계약 기간이 넉 달이나 남았는데도 모든 서비스가 종료됐다는 통보를 해왔습니다.조 씨의 사진이 문제라는 이유였습니다.00소개팅앱 상담원다른 사람들은 여성 회원분 연락처 10명 20명 받아요. 여성 회원분이 사진보고 다 거절을 하세요.여성회원들이 조씨의 사진을 보고 거절했다는 건데 조씨는 이 말을 신뢰하기 어렵습니다.실제론 여성회원이 없는 건 아닌지 의심스럽다는 겁니다.조 모 씨피해자여성들이 제가 마음에 든다고 소개팅 수락을 했는데 제가 연락해도 연락도 안 받고.인터넷에서는 서비스에 만족한다는 댓글을 믿고 조 씨처럼 회비를 냈다가 소개는 제대로 받지 못했다는 피해자들을 쉽게 찾아볼 수 있습니다.소셜데이팅 업계 종사자좋은 내용댓글은 직접 작성해서 상단 노출이 되게끔 작업을 하고 악플 같은 경우는 항상 하단에 노출해서 유저들이 볼 수 없도록.해당업체는 남성 회원의 조건이 좋지 않아 자기들도 손해를 보고 있다고 말합니다.00소개팅앱 업체조금 더 괜찮은 사람을 가입받아야 하는데 여자가 소개팅을 수락할지 안 할지 모르는 거잖아요
미국보다 중국 유학 더 많이 간다…사상 첫 추월	http://news.naver.com/main/read.nhn?oid=009&sid1=102&aid=0003835978&mid=shm&mode=LSD&nh=20161113195046	한국인 유학생이 가장 많은 나라가 올해 처음 미국에서 중국으로 바뀐 것으로 조사됐다.13일 교육부의 연도별 한국인 유학생 현황 통계에 따르면 지난 4월 1일 기준 대학생 이상 한국인 유학생 수 22만3908명 가운데 29.8인 6만6672명이 중국에서 유학 중인 것으로 집계됐다. 중국에 유학 중인 한국인 수가 미국에서 유학 중인 한국인 수를 앞지른 것은 올해가 처음이다. 중국으로 유학 간 학생 수는 2009년 처음으로 6만명을 넘었으며 올해는 2015년보다 무려 3749명이나 증가했다. 반면 미국으로 유학 간 학생 수는 계속 감소 추세다. 2010년 약 7만5000명으로 정점을 찍은 뒤 2015년부터 다시 7만명 밑으로 떨어졌고 올해는 지난해보다 4395명 줄었다. 다만 학위를 따기 위한 유학으로는 여전히 미국이 선호됐다. 과정별로 살펴보면 중국 유학생의 654만3489명는 어학연수와 교환학생 등 기타 연수 형태였던 반면 미국으로 간 유학생은 82가 대학대학원 학위 과정으로 나타났다. 두 나라로 간 유학생은 전체 해외 유학생의 58. 전체 해외 유학생 수는 2011년 26만2465명으로 정점을 찍었다가 2015년까지 꾸준히 감소했지만 올해 들어서 다시 반등했다. 중국미국 외에 한국인 유학생이 가장 많은 나라는 1만6251명7
회계업계의 반격··· M&A; 중개업 인가제 '2라운드'	http://news.naver.com/main/read.nhn?oid=011&sid1=101&aid=0002917099&mid=shm&mode=LSD&nh=20161113191458	
3억 들인 '액티브X 대체사업'… 국방부 홈페이지 4곳만 개선	http://news.naver.com/main/read.nhn?oid=029&sid1=105&aid=0002371835&mid=shm&mode=LSD&nh=20161113191736	국방부측 급한 곳부터 교체수년 내 12개 모두 정비할것국방부가 올해 웹사이트 액티브X 대체사업에 3억원의 예산을 투자하고 단 4개의 홈페이지만을 개선한 것으로 드러났다.13일 국방부에 따르면 현재까지 액티브XActiveX를 제거해 개선한 홈페이지는 국방수송정보체계 육군인터넷홈페이지 해군인터넷홈페이지 군인연금 4개뿐이다. 액티브X란 마이크로소프트MS가 개발한 보안 기술로 호환성 등의 문제로 세계적으로 퇴출당하는 추세다.정부 또한 지난 2014년부터 액티브X 퇴출 정책을 시행 국방부도 발맞춰 세부 추진방안을 수립하고 2016년 국방정보화사업 예산 1천642억원 중 3억원을 배정했다. 국방부 관계자는 현재 행정자치부와 협의한 결과 액티브X를 제거해야 할 대상으로 보고 있는 홈페이지는 총 12개라고 밝혔다.현재 국방부 관련 홈페이지는 총 41개다.민간에서는 대대적으로 액티브X 퇴출 분위기가 일어나는데도 불구하고 국방부가 수십 개의 홈페이지 중 액티브X를 제거할 홈페이지를 따로 선정해 느린 속도로 사업을 진행하는 점은 비판이 일 수밖에 없는 상황이라고 지적하고 있다. 또 3억원이나 투자해 4개 홈페이지만을 개선했다는 것은 문제가 더욱 불거질 수 있다고 보고 있다. 국방부는 내년에도 액티브X 제거를 위한 예산을 추가 투입한다는 계획이다. 보안업계 관계자는 액티브X는 일반적으로 홈페이지 결제창 및 공인인증서 로그인 정도 할 때나 쓰이는 간단한 기술인데 4개의 홈페이지가 이를 제거하는데 3억원이 드는지 의문이라며 홈페이지 개편 작업까지 같이 했더라도 대단한 기술이 구축된 사이트를 만드는 것도 아닌데 이 정도로 비용이 들어가는지는 의심할 수 있다고 말했다. 관련 업계에 따르면 홈페이지 제작 비용은 구현 난이도에 따라 천차만별이지만 일반적으로 100만1천만원 선이다.이에 대해 국방부 관계자는 올해까지 총 몇 개의 홈페이지에서 액티브X를 제거하자고 목표를 정한 것은 아니고 남은 예산도 지속해서 가져갈 것이라며 현재 국방부 산하 기관들의 수요를 조사 후 급한 곳부터 개선 작업을 하고 있어 수년 내에는 선정한 12곳 모두 정비될 계획이라고 말했다. 임종인 고려대학교 정보보호대학원 교수는 액티브X 제거는 기술적인 문제보다는 예산이나 정부의 의지 등 다양한 문제가 얽혀있다고 지적했다
