 출근전쟁에 몸값 오른 '광역버스 벨트'	http://news.naver.com/main/read.nhn?mode=LSD&mid=shm&sid1=101&oid=214&aid=0000610493	어제 전해 드린 출근전쟁 어떻게 보셨습니까.출퇴근전쟁 겪을 걸 알면서도 시 외곽으로 나가는 이유.이른바 체인 마이그레이션 싼 집 찾아 도심에서 먼 곳으로 이주하는 현상입니다.집값보다 비싼 전세 월급만큼이나 오른 월세를 못 견디고 나간 사람들 그런데 또 다른 문제에 직면하고 있습니다. 리포트 경기도의 이 아파트 단지는 서울 잠실행 광역버스 노선이 생기면서 최근 몇 년 새 전세집 구하기가 어려워졌습니다. 안영아서울까지 기존에 1시간 20분 넘게 걸린 것 같아요 광역 버스는 넉넉잡고 40분서울 방면 출퇴근이 편리한 수도권 주택들은 전세가격도 크게 오르고 있습니다.구리시와 광주시의 전용면적 85 전셋값은 2억 67천만 원대로 인접한 서울 중랑구나 노원 도봉구 주택 평균 전셋값보다 비싸거나 비슷한 수준입니다.김학규공인중개사출퇴근 거리가 가능하게 되다 보니까 전셋값 경쟁이 치열해지는부동산의 변수가 된 이른바 광역 버스 벨트.실제로 광역 버스 정류장이 단지 앞에 있는 이 아파트의 경우 전셋값이 인근 아파트와 2천만 원 이상 차이가 날 정도입니다.민경진공인중개사출퇴근이 장거리이다 보니까 집 앞에서 바로 버스를 탈 수 있는 게 집값에 반영돼신규 분양 때도 역세권 못지않은 입지 마케팅 전략으로 떠올랐습니다.이수영건설업체 본부장서울에 출퇴근하시는 수요자가 많이들 접수를 하신 것 같아요. 앵커 작년에만 12만 명이 서울에서 경기도로 이동했습니다.크게 이 다섯 개축을 중심으로 나가고 있는데 대부분 서울에 직장을 둔 사람들이라는 게 경기도 분석입니다.이 주변으로 계속해서 대규모 주택이 공급되고 있는데 주로 버스나 자동차 통근이 가능한 이 지역들 집값은 어떻게 됐을까요파주 운정신도시 김포 한강 신도시 아파트 전세가격은 평균 30 이상 뛰었고요.광주시와 광명시 평촌과 하남시 등도 20 안팎으로 올랐습니다.함영진 미래에셋 리서치센터 팀장도심 반경 2030km 미만이었지만 최근에는 4050km까지 연장돼서 확대되고 있는데요 철도 교통보다는 도로망이 잘 갖춰지고 있는 지역 위주로 이동하고치솟은 전셋값이 출근 전쟁을 부르고 다시 전셋값을 끌어올리는 악순환인데 정부와 지자체 대책을 내놓지 않은 건 아닙니다. 리포트 출퇴근 버스 혼잡을 덜기 위해 2년 전 도입돼 운영 중인 2층 버스입니다.대당 가격이 일반버스의 세 배가 넘지만 좌석 수는 현행 버스보다 20석 정도가 많은 70여 석.게다가 광역 버스에는 탄력 적용되는 입석도 안전상의 문제로 원천 금지돼 있습니다.2천5백여 대 서울 진출입 버스 중 2층 버스는 9대 출퇴근 시간대에만 한두 차례 운행되고 있습니다.양다혜출퇴근 시간 외에는 타본 적이 없고 자주 보지도 못해 가지고또 다른 대책인 GTX 광역철도.최근에 수도권 외곽에서 서울까지 30분 안에 진입할 수 있는 제3차 국가철도망 구축 계획이 발표됐지만 필요 예산만 74조 원인데다 5년 전 마련된 1차 계획도 아직 시작되지 않아 실행시점은 불투명한 상황입니다.김현수단국대 교수광역도시계획의 수립을 통해서 이런 문제에 대응하는 것이 필요합니다. 일자리와 주택이 공존하는 복합도시 자급도시를 만들기 위해 앵커 신분당선 연장하겠다 역세권 개발하겠다.아직 삽도 못 뜬 GTX 연장하겠다까지 20대 총선에 나선 후보자들 공약 많이 내놨죠
"쉬운 해고 저항하라" 프랑스 청년들 연일 밤샘시위	http://news.naver.com/main/read.nhn?mode=LSD&mid=shm&sid1=104&oid=028&aid=0002315134	사회당 정부 노동법 개정안이 불지펴높은 청년실업 친기업 행보에 반발날마다 파리 레퓌블리크 광장에 집결밤샘시위 리옹 등 60개 도시로 번져구심점 없지만 시위 확대 양상에 촉각사회당 정부는 우리가 동의할 수 없는 정책을 제시했어요. 청년 실업이나 기후 변화와 같은 실제적인 문제를 해결하는 데 완전히 실패한거죠. 35살 마티외는 저녁이 되면 파리의 레퓌블리크공화국 광장으로 향한다. 광장 한 켠에서 사람들과 함께 혁명가를 부르는 그는 전형적인 청년 실업자다. 지난해 프랑스 청년 실업률은 25. 정부는 실업률을 낮추고 고용유연성을 높인다며 노동법 개정안을 발표했지만 오히려 마티외는 노동법 개정은 이번 시위의 결정타였다고 목소리를 높였다. 높은 청년 실업률 파리 테러 이후 계속되는 국가 비상사태 사회당 정권의 친기업적 행보에 분노한 프랑스 청년들이 광장으로 나서고 있다. 매일 밤 레퓌블리크 광장에는 밤샘 시위 nuit debout뉘드부가 벌어지고 있다. 지난달 31일 노동법 반대 시위에 참여했던 시위대들은 시위가 끝난 뒤 광장으로 모여 다음날 새벽까지 토론을 했고 지금까지 밤샘 시위는 이어지고 있다. 매일 저녁 6시가 되면 수천여명의 시민들은 무리지어 자유토론을 하며 광장을 점령한다. 광장 한 켠에 있는 칠판에는 헌법 개정 문제부터 여성 인권 파나마 페이퍼 난민 문제까지 다양한 토론 주제들로 채워진다. 누구나 발언할 수 있지만 2분의 제한 시간은 반드시 지켜야 한다. 참가자들은 누군가의 의견에 동의하면 두 팔로 동그라미를 동의하지 않는다면 가위표를 그린다. 레퓌블리크 광장에서 시작된 밤샘 시위는 툴루즈 리옹 낭트 등 프랑스 전역 60여개 도시로 확대됐다. 밤샘 시위에 주도적으로 참여하고 있는 청년들은 프랑스 사회당 정권의 우클릭 정책에 대해 실망과 배신감을 느꼈다고 입을 모은다. 해고를 쉽게 하고 노동시간 제한에 예외를 두는 것을 뼈대로 한 노동법 개정안과 테러 혐의를 갖고 있는 사람의 시민권을 박탈하는 것을 명시한 헌법 개정안은 특히 젊은층 사회당 지지자들로부터 거센 반발을 샀다. 지난 8일 밤샘 시위에 참여한 조셀랭26은 한때 올랑드 정부가 약속했던 모든 것들은 사라졌고 사람들의 분노가 지난 몇 년간 쌓였다며 테러 이후 시민들을 감시하는 법안은 매우 실망스러운 수준이었다고 말했다. 사회당 정부도 이번 시위에 촉각을 곤두세우고 있다. 지난 11일 마뉘엘 발스 총리는 청년 취업 지원금으로 4억5억유로5200억6500억원를 배정하겠다고 발표하며 성난 민심을 달래려 했다. 그러나 청년단체들은 노동법 개정안이 철회될 때까지 밤샘 시위를 이어가겠다고 밝혔으며 오는 28일 또 대규모 시위를 예고한 상태다. 말레크 부티 프랑스 하원의원은 르몽드와의 인터뷰에서 2012년 올랑드 대통령을 찍었던 청년 유권자들이 지금 거리로 뛰쳐나와 우리는 어리석었다. 다시는 이런 선택을 하지 말자는 구호를 외치고 있다며 밤샘 시위는 올랑드가 직면한 문제다라고 지적했다. 최근 발표된 대선 후보 여론 조사에서도 올랑드 대통령의 지지율은 16에 그치는 등 고전을 면치 못하고 있다. 전문가들은 스페인 좌파 정당인 포데모스를 키워낸 2011년의 인디그나도스분노한 자들이라는 뜻 시위처럼 이번 밤샘 시위가 대안적인 좌파 정당을 만들어낼 제2의 인디그나도스가 될 수 있을지 주목하고 있다. 지난 14일 한 여론조사업체가 1830살 청년을 대상으로 한 설문조사에서 응답자의 70가 밤샘 시위가 청년의 요구를 대변하고 있다고 응답한 것을 보면 시위에 대한 청년들의 관심도 높은 상태다. 여론조사업체 비아보이스 대표인 프랑수아 미케마르티는 밤샘 시위는 아직 조직화되지 않았지만 사회당 정부는 시위가 커지는 것을 두려워할 것이라고 말했다. 그러나 명확한 구심점이 없다는 것은 밤샘 시위의 한계로 지적된다. 언론 인터뷰에 응하는 청년들은 자신이 시위의 대표자처럼 보이는 것을 피하기 위해 이름 전체를 공개하지 않으며 레퓌블리크 광장에는 시위에 참여하는 단체들의 깃발이나 팻말도 세우지 않는다. 이는 단체나 노조가 조직적으로 주도하는 프랑스의 시위 문화에서 매우 드문 광경이다. 프랑스 사회학자 알베르 오지앵은 68혁명 당시에는 자본주의라는 분명한 적이 있었지만 지금의 밤샘 시위에서는 매우 분산된 주제로 토론이 이어지고 있다. 명확한 적이 없다면 또 다른 68혁명을 기대하긴 어렵다고 지적했다.  황금비 기자 withbeehani
'묵묵부답' 옥시, 회사 껍데기 바꾸기 '꼼수'	http://news.naver.com/main/read.nhn?mode=LSD&mid=shm&sid1=102&oid=055&aid=0000399777	피해자가 가장 많은 옥시의 등기부등본입니다. 2011년 12월 주식회사에서 유한회사로 조직을 변경하고 해산했다고 나와 있습니다.이때는 가습기 살균제의 유해성에 대해 논란이 되던 시기였죠.현행법상 기존 법인이 소멸되면 형사 책임은 승계되지 않습니다.결국 옥시 측이 책임을 회피하기 위해서 법인을 바꾸는꼼수를 쓴 게 아니냐는 의혹이 일고 있습니다.기자서울 여의도에 옥시레킷벤키저가 입주한 건물입니다.1층에서 전화를 해도 안내 데스크를 통해 연락해도 답은 없습니다.안내 직원  담당자분 오시면 이쪽 번호로 전화 주신다고 하거든요. 연락이 갈 때까지 기다려야 할 것 같아요.롯데마트와 홈플러스가 사과하고 보상계획을 밝혔지만 옥시 측은 여전히 아무런 말도 하지 않고 있습니다.유한회사로 법인을 바꾼 이유도 설명하지 않았습니다.옥시가 공식 입장을 밝힌 건 2013년 11월 국회 국정감사 때가 거의 전부입니다.쉐커라파카2013년 당시 옥시레킷벤키저 대표  진심으로 죄송합니다. 우리는 제품이 안전하다고 믿었습니다.가장 답답한 건 피해자 가족들입니다.강찬호피해가족모임 대표  옥시를 찾아갔을 때 문전박대당하기 일쑤였습니다. 옥시가 가해 기업 중에 피해자가 가장 많기 때문에.영국 본사까지 찾아갔지만 역시 제대로 된 설명을 듣지 못했습니다.현재 영국에서도 소송이 진행되고 있습니다.크리쉬넨두 무커지피해자 측 변호인  우리가 하는 일은 영국에 있는 대기업과 그 한국지사가 한 일에 대한 연관성을 밝히는 것입니다.피해자 모임 측은 옥시가 물밑에서 일부 피해자들과 개별접촉을 이어가고 있지만 구체적 보상 조건은 알려지지 않았다고 전했습니다
스마트폰 멀리했더니 '사시' 고쳤다	http://news.naver.com/main/read.nhn?mode=LSD&mid=shm&sid1=102&oid=056&aid=0010308554	멘트  우리 눈에는 각각 6개의 근육이 붙어 있어 상하 좌우와 대각선 방향으로 안구를 움직일 수 있습니다. 이 근육이 마비되거나 기능이 떨어지면 안구가 한 쪽으로 쏠리는 사시가 나타날 수 있는데요 안구가 안쪽으로 쏠리면 내사시 바깥쪽으로 치우치면 외사시라고 합니다. 사시는 보통 타고 나는데요 청소년기에 사시 증상이 생겼다면 과도한 스마트폰 사용이 원인일 가능성이 높다는 연구결과가 나왔습니다. 리포트 틈만 나면 스마트폰으로 게임을 하거나  친구에게 문자를 날립니다. 하루 종일  작은 화면을 들여다보니 눈은 피곤해만 갑니다.인터뷰 정수연고등학교 2학년 학생  친구들이랑 게임 계속 하게돼요. 친구들이랑 계속 연락을 해야되니까 끝까지 하게 되는 것 같아요. 전남대병원 연구진이 급성 내사시로 병원을 찾은  청소년 12명을 조사한 결과 모두 하루에 4시간에서 8시간까지 스마트폰을 사용한 것으로 나타났습니다. 급성 내사시는  뇌종양이나 심한 스트레스 장기간의 근거리 작업 등이 원인입니다. 조사 대상 청소년들이 뇌종양을 앓지 않았고 스트레스가 심한 것도 아니어서 과도한 스마트폰 사용이 사시의 원인인 것으로 보입니다. 가까운 물체를 보면 초점을 맞추기 위해 안구가 가운데로 모이는 현상 때문입니다.인터뷰 최철명안과 전문의  눈을 움직이는 근육들이 장시간 그 상태가 오래되면 경련이 일어나고 뻣뻣해지면서 눈이 안 쪽으로 모이는 내사시가 생깁니다. 실제로 내사시 진단을 받은 청소년들의 스마트폰 사용을 중단시키자 두달 만에 사시 증상이 풀렸습니다
식약처, 식중독균 오염 삼성제약 항생제 회수조치	http://news.naver.com/main/read.nhn?mode=LSD&mid=shm&sid1=102&oid=001&aid=0008344720	TV 제공     전명훈 기자  국내 제약사가 생산하는 항생제에서 식중독균이 발견돼 식품의약품안전처가 해당 제품을 회수하고 조사에 나섰다.    식약처는 삼성제약이 제조한 박시린주 1.5그램박시린주 750밀리그램 대웅제약의 위탁을 받아 삼성제약이 제조한 설바실린주 750밀리그램설바실린주 1.5그램 등 4개 제품에서 바실루스 세레우스균이 검출됐다고 19일 밝혔다.    바실루스 세레우스균은 일반적으로 비병원성이지만 일부 균은 설사구토 등 세균성 식중독을 일으킨다.     이들 제품은 삼성제약 화성공장의 공조시설을 변경한 올 1월 11일 이후 생산된 페니실린 주사제 총 7종 가운데 4개 종류다.    삼성제약은 수출 물량에 대한 자체 무균시험을 실시하는 과정에서 오염을 발견해 자진 신고했다고 식약처는 설명했다.    식약처는 삼성제약 화성 공장의 공조시설을 변경하는 과정에서 어떤 형태든 오염이 발생했을 가능성이 있다고 보고 오염이 확인되지 않은 나머지 3개 제품도 잠정 판매금지사용중지 조치했다.    식약처는 추가 조사 결과에 따라 이들 제품도 추가로 회수할지 등을 결정할 방침이라고 덧붙였다.    19일 식약처는 이 공장에서 생산된 페니실린계 주사제의 생산출하를 중지하고 공장의 제조품질관리 전반에 대해 조사를 벌이고 있다고 밝혔다.    또 의약사 등 전문가에게 해당 제품을 다른 대체치료제로 전환하고 제품을 적절하게 회수할 수 있도록 협조해 달라고 당부했다.    식약처는 세균을 죽이는 항생제에 식중독균이 오염되는 일은 일반적인 상황은 아니다라며 어디서 오염돼서 이런 일이 발생했는지 정확하게 조사할 것이라고 밝혔다
강진 발생 후 230차례 여진…에콰도르 '애끓는 기도'	http://news.naver.com/main/read.nhn?mode=LSD&mid=shm&sid1=104&oid=437&aid=0000115822	최근 잇따르는 지진이 화산활동을 자극해서 더 큰 규모의 지진을 일으킬 거란 전망이 나오고 있습니다. 이런 우려의 중심엔 지구의 거대한 땅 덩어리 즉 판들이 맞닿은 경계인 환태평양 조산대 이른바 불의 고리가 있습니다. 현지시간 18일 불의 고리에 연결된 멕시코의 포포카테 페틀 화산이 폭발하면서 화산재가 3000미터까지 치솟았습니다. 이 화산이 분화한 건 지난 2000년 이후 잠잠하다 이달에만 두 번째입니다. 불의 고리에서 일어나는 심상치 않은 움직임으로 받아들여지고 있습니다. 멕시코 아래에 위치한 에콰도르는 규모 7.8의 강진이 발생한 지 사흘째 사망자 수가 400명 이상으로 늘어난 가운 여진이 계속되고 있습니다. 산더미처럼 쌓인 건물 잔해 속에서 기적처럼 구조된 생존자도 있지만 시신이 잇따라 수습됩니다.구조작업이 본격화할수록 사상자 수가 크게 늘고 있습니다. 현재까지 사망자는 400명을 넘어섰고 부상자는 2600여 명에 달합니다.최소 230여 명이 실종상태인 가운데 현지 언론들은 최대 피해 지역인 페데르날레스에서만 400명 이상이 더 숨진 것으로 추정된다고 보도했습니다.넬슨 로페즈에콰도르 페데르날레스 주민  그야말로 페데르날레스에 사는 사람들 모두가 지진에 무너진 겁니다.여진도 230차례 이상으로 약해진 지반을 더 위협하고 있는 상황.임시 대피소에도 들어가지 못한 주민들은 무너진 집이나 길거리에서 구호물품에 의존하고 있습니다.마릴린 세데노에콰도르 포르토비에호 주민  자주 여진을 느껴요. 그럴 때마다 밖으로 나와서 기도를 하죠. 신이시여 우리에게 평온함과 힘을 주소서 라고요.한편 멕시코와 스페인 등이 구조대를 파견한 가운데 유럽연합이 100만 유로의 구호자금을 전달하는 등 국제사회의 지원 손길도 이어졌습니다.최규진 JTBC 뉴스 공식 SNS 트위터 페이스북 카카오스토리 유튜브 JTBC 뉴스는 여러분의 생생한 제보를 기다립니다
