北 주민 3명 서해상 귀순…北 최초로 판문점 지뢰 매설까지	http://news.naver.com/main/read.nhn?oid=448&sid1=100&aid=0000177035&mid=shm&mode=LSD&nh=20160823222723	북한의 김정은이 집권이후 가장 역점을 둔 것이 탈북 방지입니다. 그런데 혹독한 공포정치가 계속되면서 탈북행렬은 끊이지 않고 있습니다. 이달 초에는 북한 주민 3명이 서해를 통해 귀순한 것으로 확인됐습니다. 북한은 군인들의 탈북을 막기 위해 정전협정을 위반하면서 판문점 북측 지역에 지뢰를 매설하고 있습니다.리포트지난 7일 오전 평택해경 516함이 인천 해상에서 작은 어선에 탄 3명의 북한 주민을 발견했습니다. 주민들은 곧바로 귀순 의사를 밝혔습니다.평택해경 관계자저희 쪽도 바로 인계해가지고요 북한 선박 발견했을 때 메뉴얼이 있거든요 거기에 따라서 이제. 정보 당국은 이들이 중국을 통하거나 평안북도에서 들어왔을 가능성이 높다고 보고 귀순 동기를 조사 중입니다.정베드로 목사  북한정의연대 대표 서해는 섬이 많고 그래서 주변에 깔려 있는 감시도 많고 좌초될 위험도. 중국 쪽으로 갔다가 한반도 쪽으로 오는 전략을 취했을 수도 있어요. 탈북과 귀순이 잇따르자 북한은 판문점의 돌아오지 않는 다리 북측 지역에 수천발에 이르는 대인 지뢰들을 매설했습니다. 우리 군의 확성기 방송에 동요한 최전방 군인들이 탈북하는 것을 막기 위한 조치입니다. 판문점대표부 대변인 담화 18일 오랜 정전기구들을 동원한 확성기 통보와 행사 초청놀음 등을 빈번히 벌려놓으며 소란을 피워대는 판문점 지역은 정전협정에 따라 지뢰를 매설할 수 없고 경비병의 무장도 금지돼 있습니다
국군병원 또 성희롱…'부랴부랴' 조사	http://news.naver.com/main/read.nhn?oid=055&sid1=100&aid=0000444641&mid=shm&mode=LSD&nh=20160823220515	한 국군병원 원장이 부하 여군 대위를 성희롱한 사건을 지난주에 보도해 드렸는데 같은 병원에서 역시 중령인 간부가 여군과 군무원들을 성추행한 사실이 또 드러났습니다.기자경기도의 한 국군병원 간부인 윤모 중령이 성추행 혐의로 최근 군 검찰에 기소됐습니다.윤 중령은 지난 1월부터 5월까지 회식 2차 장소인 노래방에서 부하 여군과 여성 군무원들을 껴안거나 몸을 만져 추행한 혐의를 받고 있습니다.다섯 달 동안 피해자가 6명이나 됩니다.부하 여군들에게 성희롱 발언도 여러 차례 한 것으로 조사됐습니다.국군의무사령부는 지난 6월 윤 중령을 보직 해임했고 성추행이 사실로 확인돼 중징계할 예정이라고 밝혔습니다.그런데 이 병원의 병원장 김모 중령도 지난달 초 여군 대위를 성희롱한 사실이 드러나 징계위원회에 회부됐습니다.시기를 따져보면 윤 중령의 성추행이 드러나 조직이 발칵 뒤집힌 상황에서 기강을 엄정히 세워야 할 병원장이 부하 여군을 성희롱한 겁니다.임태훈군인권센터 소장  성범죄를 예방해야 할 간부들이 오히려 성범죄를 저지르면서 일선 지휘관들이 군내 성범죄 문제에 경각심을 느끼지 않고 있다는 사실을 보여줍니다. 전국 14개 국군병원은 다른 군 조직과 달리여성 비율이 40나 돼서 성폭력 예방을 위한 엄정한 군 기강이 강조됩니다.의무사령부는 부랴부랴 2차로 이어지는 야간 회식을 자제시키고 모든 국군병원에 대한 실태 조사에 나서겠다고 밝혔습니다
35년 화재 현장 누빈 소방관… 혈액암은 국가 책임	http://news.naver.com/main/read.nhn?oid=081&sid1=102&aid=0002750084&mid=shm&viewType=pc&mode=LSD&nh=20160823210837	서울신문35년간 화재재난 현장을 누비다 희귀병인 혈액암을 앓게 된 소방관에 대해 국가의 책임을 인정하는 법원 판결이 나왔다. 최근 5년20112015년간 암에 걸린 소방관의 공무상 부상공상을 인정한 두 번째 판결이다.서울행정법원 송방아 판사는 전 부산소방본부 소방관 신영재63씨가 공무상 요양 불승인 처분을 취소해 달라며 공무원연금공단을 상대로 제기한 소송에서 원고 승소 판결을 했다고 23일 밝혔다. 최근 5년간 공무원연금공단이 소방관의 암에 대해 공상을 인정한 경우는 18건 중 1건이며 공단의 결정에 불복해 판결로 공상을 인정받은 사례도 2013년 단 1건뿐이었다.신씨는 소방관으로 일한 지 35년이 되던 2012년 8월 급성백혈병혈액암 전 단계인 골수이형성증후군 진단을 받았다. 신씨는 화재 현장에서는 벤젠 벤조피렌 등 유해물질이 발생하기 때문에 업무를 하다 병에 걸린 것이라며 2014년 7월 공단에 공상 신청을 했다. 하지만 공단은 3개월 뒤 소방 업무와 질병 사이에 연관성이 없다며 불승인 통보했다.신씨는 공단의 처분에 불복해 소송을 제기했다. 1년 넘게 이어진 법정 공방 끝에 법원은 신씨의 손을 들었다. 송 판사는 35년이라는 근무 기간 연평균 100차례가 넘는 화재 출동 횟수 등을 고려할 때 공무 집행과 질병 발생의 연관성을 배제하기 어렵다며 공단의 불승인 처분은 위법하므로 취소해야 한다고 밝혔다.또 암과 공상 간의 연관성에 대해서는 공무 집행 중 발생한 질병은 반드시 의학적 자연과학적으로 입증해야 하는 것이 아니라 취업 당시 건강 상태 질병의 원인 발병 원인이 있는 작업장에서의 근무 기간 등을 고려해야 한다며 신씨가 이전에 유사한 질병을 앓은 적이 없고 화재 진압 후 1시간 정도 공기호흡기를 벗은 채 잔불 정리를 하는 소방 업무 특성상 유해물질 노출 가능성이 높다고 설명했다.그러나 여전히 암에 걸린 소방관들은 업무와 암의 상관관계를 스스로 입증해야 재판 전에 공단에서 공상을 인정받을 수 있다. 이에 정치권에서 소방관이 아니라 공단 측이 암과 업무의 상관관계가 없음을 증명하도록 관련 법안을 개정하는 작업을 진행 중이다
北 노동자, 16시간 중노동·연락도 차단…"현대판 노예"	http://news.naver.com/main/read.nhn?oid=056&sid1=100&aid=0010354207&mid=shm&mode=LSD&nh=20160823214856	멘트 외화벌이에 내몰려 몽골에 파견된 북한 노동자들의 실태를 KBS 취재팀이 현지 취재했습니다.  오늘23일은 첫순서로 충성자금 송금 압박에 중노동에 시달리면서 최하층의 비참한 생활을 하는 해외파견 북한 건설 노동자들의 실상을 전합니다.   김학재 기자의 보도입니다. 리포트 몽골의 수도 울란바토르. 북한 노동자들이 일하는 아파트 건설 현장입니다. 나무판 위에 허름한 이불이 깔려 있습니다. 한 켠에는 가재도구들이 어지럽게 놓여 있습니다. 북한 노동자 10여명이 먹고 자는 곳입니다.녹취 북한 건설 노동자음성변조  김치는 여기서 배추랑 사다가. 시멘트 벽면은 그대로 드러나 있고 공사장 먼지가 날립니다. 이들에게는 컨테이너 숙소조차도 사치입니다.녹취 북한 건설 노동자음성변조  돈 못벌지 음식 값이랑 뭐 물건 값은 비싸지. 이런 곳에서 1년 365일 하루도 쉬지 못하며 중노동을 견뎌야합니다. 노동시간은 매일 16시간이 넘습니다.녹취 북한 건설 노동자음성변조  아침 6시부터 저녁은 10시 11시.  쉬엄쉬엄하면 돈 못 벌어요. 이런 환경에서는 병이 안 나는 게 이상할 지경입니다.녹취 북한 건설 노동자음성변조  쉬는 날이 없어요.완전히 아픈 사람은 북한으로 가죠. 외부와의 접촉은 철저히 차단됩니다. 북한 가족들과도 연락도 금지됐습니다. 녹취 북한 건설 노동자음성변조  전화 이거 차단한단 말이야. 전화 못하게 만들었단 말이야. 하지만 이들에게 가장 큰 고통은 충성자금 압박입니다. 아프거나 일감이 없어 돈을 못벌어도 충성자금은 반드시 채워 내야 합니다. 녹취 북한 건설 노동자음성변조  1월달부터 돈을 못냈어요.4월달에 123월 꺼 못냈던 걸 다 내고. 특히 올해는 강력한 대북제재로 인한 외화난으로 10월 당창건 기념일을 앞둔  북한 당국의 상납 독촉은 더욱 거세졌습니다. 하지만  현지에서는 이런 북한 노동자들을 선호하고 있습니다. 아무리 열악한 조건에서도 군말 없이 노예처럼 일하고 임금도 싸기 때문입니다.  녹취 몽골 건설회사 관계자  우리가 직접 고용하는 것도 아니고 북한 사람들을 몽골에 입국시켜주는 45군데 회사가 있는데 거기서만 고용한다는 말이죠. 일할 때도 안전장비 하나 제대로 주어지지 않고 사고 나면 자기 책임입니다. 더구나 노동자들은 월급 대부분을 충성자금으로 떼이지만 한달 중노동 끝에 손에 쥐는 100달러도 많다고 생각합니다. 녹취 북한 건설 노동자음성변조  고향에서는 돈벌기 힘들어요. 여기서 일하면 700달러를 바치고 100달러는 내가 가질수 있지. 내가 800달러 정도 번다고. 현재 몽골에서 일하는 북한 건설 노동자는 1500여명. 이들은 오늘도 중노동과 안전사고 병에 시달리며  노예처럼  김정은 사금고를 채우느라 신음하고 있습니다
과속 '꼼짝 마'…'속도제한장치 해제' 집중 단속	http://news.naver.com/main/read.nhn?oid=056&sid1=103&aid=0010354215&mid=shm&mode=LSD&nh=20160823221546	멘트 대형 화물차와 버스에는 과속을 막기 위해 최고 속도를 제한하는 장치를 의무적으로 달아야 하는데요  이 시간에도 몇 번에 걸쳐 보도했습니다만 이를 무단으로 해제한  차량이 적지 않습니다.   정부가 집중  단속에 나서기로 했습니다. 리포트 대형 트레일러가  제한 속도를 넘기며 다른 화물차를 추월합니다. 승용차보다 빠른 속도로 옆 화물차들을 따라잡습니다. 최고 속도 제한장치를 해제한 것으로 의심되는 차량들입니다.녹취 버스 관계자   앞차가 느리게 가는 데 잠깐 추월하기 위해서 속도를 풀었으면 좋겠다는 분들이 사실 대부분이에요.  승합차는 시속 110 Km 3.5톤 초과 화물차량은 시속 90Km로 최고속도를 제한하는 장치가 있는데 이를 무단 해제한 차량이 상당숩니다. 봉평터널 추돌사고를 냈던 버스회사도 일부 차량의 속도 제한장치를 무단해제한 것으로 드러났습니다.녹취 화물차 관계자   시속 8090 정도가 원래인데 조작하면 140으로 제한속도가 수정되는 거예요. 정부가 다음 달부터 이런 최고속도 제한장치 무단 해제를 집중 단속합니다. 과속에 따른  대형 교통사고를 줄이자는 것입니다. 적발되면  즉시 시정 명령을 내리고 필요하면 수사기관에 고발도 할 계획입니다. 인터뷰 이승호국토교통부 교통물류실장  등록된 전세버스일반화물업체 약 9000개 사에 대하여 모두 특별교통안전점검을 실시토록 하겠습니다
"북, 올 핵무기 2∼4개 플루토늄 확보"	http://news.naver.com/main/read.nhn?oid=022&sid1=100&aid=0003089481&mid=shm&mode=LSD&nh=20160823225048	미 ISIS 핵연료 재처리해 확보총 1321개 제조 핵물질 보유북한이 올해 영변 원자로의 사용후 핵연료를 재처리해 핵무기 24개 분량의 플루토늄을 확보했을 것으로 추정됐다.미국의 정책연구기관인 과학국제안보연구소ISIS는 21일현지시간 북한이 재처리를 통해 추출한 플루토늄의 양이 5. 핵무기 1개를 만드는 데 24의 플루토늄이 필요하다고 ISIS가 밝혔다. ISIS는 북한이 현재 핵무기 1321개를 제조할 핵물질을 보유하고 있을 것으로 분석했다.국제원자력기구IAEA는 지난 19일 보고서에서 올해 영변 핵 단지 재처리 시설로 화학약품 탱크가 반입되거나 재처리 관련 설비를 가동하는 활동이 있었다면서 이는 북한이 올해 상반기에 영변 재처리시설을 재가동했음을 시사한다고 밝혔다. 북한 원자력연구원은 지난 17일 일본 교도통신과의 서면 인터뷰에서 흑연감속로에서 꺼낸 사용후 핵연료를 재처리했다면서 처음으로 플루토늄 추출 사실을 공개적으로 밝혔다.ISIS는 북한이 2014년 말까지 핵무기 1016개를 만들 핵물질을 보유했고 그 이후에 주로 우라늄 농축을 통해 핵물질을 늘렸다고 밝혔다
中 지옥철에 '요금 3배' 비즈니스석 등장, 찬반 논란	http://news.naver.com/main/read.nhn?oid=214&sid1=104&aid=0000662219&mid=shm&mode=LSD&nh=20160823211055	쾌적하고 넓은 비즈니스석 하면 비행기를 떠올리실 텐데요.중국 지하철에 일반 요금보다 3배나 비싼 비즈니스석이 등장해 논란이 뜨겁습니다. 리포트 중국 남부의 신흥 산업도시인 선전시의 지하철역입니다.일반 승차권보다 3배가 비싼 30위안 우리 돈 5천 원을 낸 승객들이 비즈니스석 전용 객차에 오릅니다.전체 8칸 가운데 2칸이 비즈니스석인데 넉넉하고 푹신한 의자가 두 줄씩 총 네 줄로 배열돼 있는 실내는 쾌적한 분위기입니다.바로 옆 칸의 일반 객차가 지옥철로 불릴 만큼 발 디딜 틈 없이 혼잡한 것과는 대조적입니다.하루 평균 20여만 명이 이용하는 이 지하철 노선의 사정이 이렇다 보니 서민 교통수단마저 사람 차별한다는 볼멘소리가 나옵니다.비즈니스석 반대 승객출퇴근하는 사람들이 많이 이용하는데 비즈니스석 만들어서 일반실이 더 붐비는 것 아닙니까.하지만 승용차를 운전하는 것에 비하면 훨씬 경제적이라는 반론도 만만치 않습니다.비즈니스석 찬성 승객운전하면 힘들고 비즈니스석은 자리가 있으니까 쉬면서 갈 수 있어요
