담뱃갑 경고 그림 규개위 제동에 거세지는 반발	http://news.naver.com/main/read.nhn?mode=LSD&mid=shm&sid1=102&oid=469&aid=0000141953&cid=428288	상단 배치 제동에 반발 거세학계의료계 등 효과 훼손 결정 잘 보이는 곳 배치 추세와도 역행 담배회사 사외이사 위원 참여 논란 비판 높아져 13일 재심에 관심 집중 담뱃갑 경고그림 시안. 담뱃갑이 진열대에 놓여있을 때 가장 잘 보일 수 있도록 담뱃갑 상단에 경고그림이 부착돼 있다. 보건복지부 제공 최근 대통령 직속 대통령 직속 규제개혁위원회규개위가 담뱃갑 경고그림 상단배치 철회를 권고하면서 학계의료계시민단체 등의 반발이 거세지고 있다. 담배회사 사외이사를 역임했던 민간위원이 이 결정에 관여한 사실도 드러나면서 전문가들이 국민의 건강보다 기업의 이윤 추구를 우선시한 것 아니냐는 비판의 목소리도 높아지고 있다.  규개위는 지난달 22일 규제심사 회의를 열고 담뱃갑 경고그림의 표시 방법 등을 규정한 국민건강증진법 시행령 개정안 중 경고그림의 담뱃갑 상단 표시 조항을 삭제하라고 권고했다. 주무부처인 보건복지부는 이 권고안에 불복해 재심의를 요청 13일 회의에서 다시 이 안건이 논의된다. 해당 조항은 담배 회사들이 가장 강력하게 반발해 온 것으로 삭제될 경우 담배 담배 제조수입 회사들은 자율적으로 경고그림 위치를 결정할 수 있게 된다. 이에 학계와 의료계 시민단체는 일제히 반발하고 있다. 대한금연학회는 담배사용장애니코틴 의존는 세계적으로 매년 600만명 우리나라에서는 매년 6만여명을 사망에 이르게 하는 치명적인 질환이라며 그럼에도 규개위가 경고그림의 효과를 훼손하는 결정을 했다고 비판했다. 대한의사협회 대한가정의학회 보건의료단체연합 등 보건의료계도 경고그림을 담뱃갑 하단에 배치하면 진열장 및 가격표에 가려져 보이지 않게 돼 경고그림 효과를 떨어뜨린다며 잇따라 비판성명을 냈다. 경고그림 하단 배치는 해외 추세에도 역행한다. 우리 정부가 2005년 비준한 담배규제기본협약FCTC은 경고그림과 문구를 잘 보이는 상단에 배치하도록 하고 있다. 경고그림 도입 101개국 중 71개국이 상단에 두고 있으며 하단에 뒀던 국가들도 상단으로 옮기는 추세다. 5월부터 경고그림을 도입한 유럽연합EU 역시 각국이 경고그림문구를 상단에 넣는 것을 법제화하도록 의무화했다. 특히 우리나라는 담뱃갑 경고그림의 크기가 전체 담배 포장 면적의 30밖에 안 돼 하단에 둘 경우 그림이 아예 보이지 않을 가능성이 높다.   규개위 민간위원들의 이력도 논란이다. 회의에 참석한 민간위원 12명 중 한 명인 손원익 안진회계법인 RD센터 원장은 20122013년 KTG 사외이사를 지냈고 지난해에는 KTG 사장직 공모에도 지원했었다. 이날 회의에 참석하지는 않았지만 서동원 규개위 민간위원장은 건강보험공단과 담배소송 중인 필립모리스코리아를 대리하는 김앤장법률사무소 상임고문이다. 회의록에 따르면 민간위원들은 주류가 담배보다 사회적 비용이 적지 않은데 담배만 강력히 규제하는 이유는 무엇이냐 경고그림이담배 판매업소에 근무하는 종업원들에게 심한 혐오감과 정신적 스트레스를 줄 수 있다는 등 담배회사의 입장을 대변하기도 했다. 이런 반발 때문에 13일 열리는 재심의에서는 철회 결정이 번복될 것이라는 관측도 나온다. 이성규 한국보건의료연구원 부연구위원은 최근 옥시 가습기 살균제 사건에서 전문가와 기업의 연결고리가 드러나 사회적으로 공분을 사고 있는 만큼 규개위 민간위원들도 국민건강보다 담배회사 이윤을 중시하는 발언을 하기는 어려울 것이라고 예상했다. 규개위의 권고는 강제력을 가지기 때문에 재심의에서도 상단 부착 조항 삭제 권고가 나오면 올해 12월23일부터 담뱃갑에 부착되는 경고그림의 위치는 기업들이 자율적으로 선택하게 된다
"귀농, 이렇게 하면 실패해요"	http://news.naver.com/main/read.nhn?mode=LSD&mid=shm&sid1=102&oid=214&aid=0000616860&cid=428288	도시생활이 고달플 때면 시골 가서 농사를 지어볼까 하는 생각들 하실 겁니다.실제 요즘 농촌으로 향하는 사람들이 늘고 있는데요.하지만 막연하게 귀농했다가 낭패를 보는 사람들이 적지 않습니다.낭만과 또 성공신화 등에 가려진 실패담을 신정연 기자가 직접 들어봤습니다. 리포트 김영명 씨는 거의 고시생처럼 농사 공부에 빠져 있습니다.강의를 듣고 혼자서 연구하고 텃밭의 실습으로 최종 확인합니다.2006년 제주도로 귀농해 감귤농사에 나섰다가 수억 원만 날린 채 2년 전 도시로 돌아왔습니다.김영명재귀농 준비 중나무를 알아야 되고 식물을 알아야 되고 토지를 알아야 한다는 걸 전혀 몰랐던 거예요. 이런 교육이 있었으면 제가 실패를 안 하지 않았을까.이용석 씨도 의지만 갖고 귀농해 토마토 농사를 벌였지만 매번 실패.스스로 알아야 한다는 걸 뒤늦게 깨닫고 비교적 재배가 쉬운 상추부터 다시 시작하고 있습니다.이용석귀농 7년 차어떤 공부든 다 해야 해요. 농촌에 오는 순간 이제 CEO가 되는 거예요. 아무도 도와주는 사람이 없어요. 농기계도 만져야 되고 농사도 지어야 하고.귀농 4년차 이 부부는 수시로 이웃들을 만나는 게 일과입니다.아내는 마을 행사 때마다 사회자로 나서 이제 이 지역에서는 유명인사.이현주귀농 4년 차농사를 어떻게 짓는지 몰라서 바둥바둥 거릴 때는 뒤에서 보시다가 이제야 좀 친해지니까 그때 그렇게 하니까 망하지 내가 잘 가르쳐 줄게 이제 해봐요.수박과 배추에 딸기까지 농사 성적도 신통치 않았고 기대와 달리 일상마저 힘들었습니다.지역민과의 소통에 미숙했었기 때문이라고 부부는 회고합니다.김영철귀농 4년 차형 동생을 튼 게 3년이 걸렸어요. 근데 지금도 진짜 속은 안 준 것 같다.넓은 땅에 비싼 농기계부터 덜컥 사는 무리한 투자도 금물입니다.귀농 첫해와 둘째 해 연이어 성공한 시래기농사.자신감이 붙자 6천6백 제곱미터이던 재배 면적을 지난해 4배 넘게 늘렸는데 판로가 막히면서 재고는 쌓이고 기상이변에 수확량마저 반 토막이 났습니다. 김현욱귀농 4년 차욕심은 화를 부르는 거구나. 그래서 알뜰하게 농사를 짓고 내가 할 수 있는 만큼 농사를 짓고.도시생활을 접고 귀농귀촌을 선택한 가구는 4만 4천여 세대 9년 새 36배로 급증했습니다.하지만 열 가구 중 네 곳은 월수입이 50만 원도 안 되고 특히 귀농포기 가구 중 절반은 월평균 수입이 0원이었던 것으로 나타났습니다
'경영권 분쟁이어 면세점 로비 의혹, 검찰 수사까지..'	http://news.naver.com/main/read.nhn?mode=LSD&mid=shm&sid1=101&oid=366&aid=0000326400	롯데그룹이 대주주 리스크에 휘청이고 있다. 경영권 분쟁이 다소 잠잠해지는가 싶더니 이번엔 면세점 입점 로비 의혹이 터졌다. 경영권 분쟁이 본격화된 2014년 12월 이후 1년 5개월간 신격호94사진 롯데그룹 총괄회장 일가를 둘러싼 구설이 계속되고 있다.재계 관계자들 사이에선 경영권 분쟁 때문에 작년 말 롯데면세점이 잠실점 특허를 뺏겼다는 관측이 나왔다. 롯데의 주요 사업분야가 소비재서비스업이기 때문에 타격이 컸다는 분석이다. 최근 불거진 면세점 입점 로비 의혹으로 기업 이미지가 더 추락할 것이란 전망도 나온다.롯데그룹은 올해 2월 공정거래위원회 발표 기준으로 한국과 일본에 각각 86개 36개의 계열사를 보유하고 있다. 한국 롯데의 연간 매출액은 80조원 직원수는 10만명에 이르는 5대 그룹이다. 부자 형제간 경영권 다툼으로 이미지 추락중국 부진까지신동주 전 일본 롯데홀딩스 부회장SDJ코퍼레이션 회장과 신동빈 롯데그룹 회장의 경영권 다툼이 본격화된 것은 2014년 12월 말부터다. 12월 26일부터 2015년 1월 9일까지 2주 사이에 신 전 부회장이 롯데홀딩스 이사직과 일본 롯데그룹의 주요 임원직에서 해임됐다.신동주 전 일본 롯데홀딩스 부회장왼쪽 신동빈 롯데그룹 회장.  조선DB장남신동주은 일본을 담당하고 차남신동빈은 한국을 맡는다는 신격호 총괄회장의 후계 구도가 무너진 것이다. 형제간 갈등은 계속 증폭됐다. 신동빈 회장은 2015년 6월 30일 일본 L투자회사 12곳112의 대표이사로 취임했고 7월 15일엔 한국 롯데를 지배하고 있는 일본 롯데홀딩스 대표이사에 올랐다.7월 27일 신격호 총괄회장이 일본으로 건너가 신동빈 회장 등 일본 롯데홀딩스 이사 6명을 모두 해임하려 하자 갈등이 폭발했다. 일본 롯데홀딩스는 다음날인 28일 즉시 긴급 이사회를 열고 신 총괄회장을 롯데홀딩스 대표이사 회장직에서 해임했다. 신동주 전 부회장은 이틀 뒤 인터뷰를 통해 신 총괄회장이 자신을 한국 롯데그룹 회장으로 임명했다는 내용의 임명장과 신 총괄회장의 육성을 공개했지만 전세는 한쪽으로 기운 뒤였다.신동빈 회장은 8월 17일 열린 일본 롯데홀딩스 주주총회에서 승리했고 올해 3월 6일 신동주 전 부회장의 요구로 열린 주주총회에서도 이겼다. 롯데그룹은 주총 직후 신동빈 회장에 대한 일본 롯데홀딩스 주주들의 확고한 지지를 재확인했다. 자신의 해임에 대한 신 전 부회장의 반발로 촉발됐던 롯데그룹의 경영권 분쟁은 사실상 마무리가 됐다고 밝혔다.떠들썩했던 경영권 분쟁은 깊은 상처를 남겼다. 한일 양국에서 다툼이 진행되면서 롯데의 국적 논란이 불거졌고 폐쇄적인 지배구조와 신 총괄회장의 황제경영이 도마에 올랐다. 롯데의 기업 이미지는 땅에 떨어졌다.  롯데 제공분쟁이 극단으로 치닫던 작년 말 롯데면세점은 월드타워점 특허권을 잃었다. 신동빈 회장은 상상하지 못한 일이 일어났지만 어쩔 수 없이 받아들일 수밖에 없다. 99는 제 책임이라고 생각한다고 말했다. 백화점 대형마트는 이커머스 업체의 부상으로 어려움을 겪고 있다. 중국 연쇄경영협회CCFA가 지난 3일 발표한 2015년 중국 프랜차이즈 100강을 보면 롯데마트는 지난해 중국 매출이 5.6 줄었고 중국 점포수도 120개로 3개 감소했다. 신 총괄회장 조카는 한진해운 관련 검찰 수사 받을 위기 형제간 경영권 분쟁은 아직 끝나지 않았다. 쟁점이 된 신격호 총괄회장의 정신건강 이상 여부가 법정에서 가려지게 됐다.신격호 총괄회장의 넷째 여동생인 신정숙씨가 작년 12월 법원에 신격호 회장에 대한 성년후견을 신청했다. 최현열 CY그룹 명예회장과 결혼해 별다른 대외 활동 없이 지내던 정숙씨가 돌연 전면에 나섰다.  조선DB신격호 총괄회장은 이 소식을 듣고 걔정숙씨는 바보 아이가라고 말하기도 했다. 신 총괄회장은 내가 예전에 최현열을 롯데에 데리고 있다가 파면시킨 적이 있다. 그래서 성년후견인 신청을 한 게 아닐까라고 말하기도 한 것으로 알려졌다.정숙씨는 후견인으로 신 총괄회장의 부인 시게미쓰 하쓰코 여사와 장녀인 신영자 롯데장학재단 이사장 신동주 전 부회장 신동빈 회장 신유미 롯데호텔 고문 등을 지목했다.성년후견인제는 정신적 제약으로 사무를 처리할 능력이 충분하지 않은 사람의 후견인을 지정하는 제도다. 신 총괄회장은 성년후견인 심판청구 사건으로 4월까지 입원할 예정이었으나 현재 입원 감정을 2주 가량 연기한 상태다. 신 총괄회장은 재판부에 5월 16일 입원을 희망했다.신격호 총괄회장이 2015년 10월 19일 건강검진을 받기 위해 신동주 전 일본 롯데홀딩스 부회장과 외출하고 있다.  SDJ코퍼레이션 제공신 총괄회장의 조카이자 정숙씨의 딸인 최은영 전 한진해운 회장은 최근 도적적 해이 비판에 휩싸이면서 검찰 수사를 받을 위기에 처해 있다.최 회장은 한진해운이 자율협약채권단 공동관리  신청 전 2주818일에 걸쳐 보유 주식 37만569주를 6차례 분산 매도했다. 최 회장의 두 딸인 조유경조유홍씨도 각각 보유한 주식29만8679주을 4월15일부터 22일까지 6차례에 걸쳐 전량 매도했다.금융당국은 최 회장 등이 한진해운이 자율협약에 들어갈 것이라는 내부 정보를 알고 손실을 회피하기 위해 보유 주식을 전량을 매각했다는 혐의를 잡고 조사중이다. 혐의가 사실로 입증되면 최대 100억원 안팎의 벌금형이나 10년 이하의 징역형에 처해질 수 있다고 법조계 관계자들은 보고 있다. 맏딸 신영자 이사장과 아들 정운호 게이트 연루 의혹  신가의 수난은 현재진행형이다. 정운호 네이처리퍼블릭 대표의 로비 대상으로 신영자 이사장이 지목됐다. 신 이사장은 신격호 롯데그룹 총괄회장의 장녀로 신동주동빈 형제의 이복 누이다.2014년 9월 2일 오후 베트남 하노이에 위치한 롯데센터 하노이 오픈식에서 베트남 응우엔 티도안 부대통령과 신동빈 롯데그룹 회장 신영자 롯데장학재단 이사장이 식수 행사를 마치고 박수를 치고 있다.  조선DB서울중앙지검 방위사업수사부부장 박찬호는 5일 정 대표로부터 돈을 받은 혐의로 브로커 한모씨를 구속했다. 한씨는 2012년 신영자 이사장과의 친분을 내세워 정 대표와 계약을 체결 10억원 이상을 챙겼다는 혐의를 받고 있다. 네이처리퍼블릭이 롯데면세점 좋은 자리를 배정받도록 해주고 각 점포 매출액의 3를 수수료로 받는다는 계약이다.그러나 정 대표가 2014년 7월 신 이사장의 아들 장모씨가 운영하는 회사와 비슷한 계약을 맺고 자신과의 계약을 해지하자 같은 해 10월 네이처리퍼블릭을 상대로 일방적 계약해지로 입은 피해 6억4500만원을 지급하라며 소송을 제기했다.신 이사장 측은 신 이사장이 브로커 한모씨와 안면은 있지만 면세점 입점을 대가로 금품을 수수한 사실은 없다며 부인했다. 롯데그룹 고위 관계자 역시 한씨는 면세점의 정상적인 거래와 무관한 사람이고 롯데와 특별한 관계가 있는 사람도 아니다. 돈을 받은 사실이 없는 것으로 파악하고 있다고 말했다.서울중앙지검 특수1부부장검사 이원석는 3일 오후 서울 강남구 대치동 네이처리퍼블릭 본사를 압수수색했다고 밝혔다.  조선DB서울 시내 면세점 신규 특허권 심사를 앞두고 특허권 부활월드타워점을 노리던 롯데면세점엔 대형 악재다. 입점 로비 이슈로 면세점 운영의 투명성 공정성이 떨어진다는 평가를 받을 수 있기 때문이다. 관세청은 오는 5월 말에서 6월 초 신규 시내면세점 특허신청 공고를 게시하고 특허심사위원회의 심사 절차를 거쳐 연말까지 사업자를 선정할 계획이다.관련기사롯데 정운호 사건 불똥에 전전긍긍 신영자 장녀 처음 듣는 얘기 2016. 5정운호 구명 로비 의혹 대형 게이트로 번지나. 3서울지법 정운호 브로커와 저녁 식사 부장판사 사표 제출 2016. 2네이처리퍼블릭 오너 리스크로 추락. 1정운호 브로커 수사 특수부가 맡는다 2016. 29판검사 로비 폭로전 번진 변호사 50억 막장 드라마 2016. 28전관예우 백약무효31 해외 원정도박 정운호 구명 로비 의혹 법조계 시끌시끌 2016
편의점·마트서 만나요…쉽게 맛보는 '지역 맛집'	http://news.naver.com/main/read.nhn?mode=LSD&mid=shm&sid1=101&oid=055&aid=0000406176	이번 황금연휴에 여행 다니시면서 지역 맛집도 많이 찾으셨죠. 경북 안동에 가신 분들은 아마 찜닭 한 끼 드셨을 겁니다. 이런 지역의 유명 맛집들과 간편식 업계가 최근 손을 맞잡고 있습니다.기자감자와 부추 손질된 닭고기까지 찜닭 재료가 준비됐습니다.심마니 출신 주인이 개발한 비법 한약재 육수에 넣고 팔팔 끓이다 부추까지 솔솔 뿌려주면 푸짐한 안동 찜닭 완성입니다.쌉쌀하면서도 달콤한 맛에 반해멀리 안동까지 일부러 찾아오는 손님들이 적지 않습니다.이규철서울 서초구  먹어보니까 닭고기하고 재료가 굉장히 신선한 것 같고 무엇보다 소스가 다른데 보다 특별한 것 같습니다.그런데 맛집의 비법을 그대로 전수받은 대형마트가 간편식 찜닭을 만들었습니다.서울에서 안동까지 굳이 차를 타고 서너 시간 내려갈 필요가 없습니다.김익호서울 용산구  먹어보니까 구태여 갈 필요 없겠어요. 집에서 얼마든지 가끔 소주도 한잔 하면서.안동 찜닭뿐 아니라 전북 부안의 명물 바지락죽도 간편식으로 나왔고 강릉 교동의 짬뽕은 편의점 컵라면으로 만날 수 있습니다.이런 협업을 지역 사회도 매우 반기고 있습니다.정훈용안동 구시장 상인회장  이렇게 널리 알려지면 관광객들도 많이 오시고 우리 시장에도 많은 도움이 될 것 같습니다.유통업체들은 앞으로도 인천 서해5도 간장게장 등 팔도의 숨은 맛집을 찾아내 지속적으로 상품화할 계획입니다
한국, 전력소비 증가율 OECD 1위… 싼 '산업용 전력' 탓	http://news.naver.com/main/read.nhn?mode=LSD&mid=shm&sid1=101&oid=032&aid=0002697376	우리나라의 전력 소비 증가율이 경제협력개발기구OECD 회원국 중 가장 높은 것으로 나타났다.8일 국제에너지기구IEA에 따르면 1990년부터 2013년 사이 한국의 전력 생산량은 105테라와트시TWh에서 538TWh로 410.같은 기간 OECD 전체 회원국의 전력 생산량은 7629TWh에서 1만796TWh로 41. 한국의 전력 생산량 증가는 OECD 회원국 전체 증가율의 10배에 달한다.한 번 생산하면 저장이 어려운 전력의 특성상 전력은 생산량은 소비량과 거의 비슷하다. 한국은 전력 생산이 크게 증가한만큼 전력 소비도 빠르게 증가한 셈이다.개별 회원국으로 살펴봐도 한국은 전력 생산량이 가장 많이 증가했다. 한국 이외에 세 자릿수 증가율을 기록한 국가로는 터키317.1 등은 전력소비가 소폭 증가하는데 그쳤다.8 등은 20여년 동안 전력 생산량이 한 자리 수로 증가했다.한국의 전력 소비가 20여년간 크게 늘어난 데는 산업구조도 영향을 미쳤다. 한국은 철강 석유화학 반도체 등 에너지다소비 산업을 주력 산업으로 하고 있다. 게다가 산업용 전력이 원가 이하로 낮게 유지돼 기업의 자발을 에너지 절약을 유도하는데 실패했다.에너지경제연구원 자료를 보면 2012년 기준 한국의 1인당 가정용 전력 소비량은 OECD 34개 회원국 중 26위다. 하지만 산업용과 공공상업용 전력 소비까지 합하면 1인당 전력 소비량이 OECD 내 8위로 크게 높아진다. 산업용 전력에는 요금 혜택을 주고 가정용에는 누진제를 적용하는 한국 전력 정책의 특성 탓에 한국의 전력 소비구조도 기형적인 모습을 보인다. 한국은 산업용 전력 소비 비율이 52 달하는 반면 가정용은 13에 불과하다. 산업용 가정용 공공상업용 전력 소비 비율이 303030 수준으로 거의 비슷한 OECD 다른 국가들과 대조적이다.그럼에도 불구하고 산업용 전력 요금 인하 요구는 거세다. 전국경제인연합회는 지난달 1일 주요국들이 전기요금을 인하하고 있음을 들어 산업용 전력 판매 단가를 낮춰야한다고 주장했다
38명 중 1명 자폐아…부모들 "나 죽으면 누가 돌보나"	http://news.naver.com/main/read.nhn?mode=LSD&mid=shm&sid1=102&oid=448&aid=0000164067&cid=428288	자폐성을 가진 장애아동이 급증하고 있습니다. 우리나라의 경우 38명당 1명 꼴입니다. 그런데 정부는 이들이 성인기에 접어들면 모든 책임을 가족에게만 떠맡겨놓고 있습니다. 리포트16살 승환이는 세 살 때 자폐증 판정을 받았습니다. 의사 소통은 물론 옷을 입고 양말을 신는 것도 혼자서는 어렵습니다. 엄마는 하던 일까지 그만두고 온종일 승환이를 돌봅니다. 강소연  승환이 엄마대변 실수를 했다던지 이런 일이 있기 때문에 항상 마음을 놓지 못하고 집에 와 있어도 안절부절인거예요. 국내에서 자폐를 앓는 아동은 38명 중 1명까지 보고됩니다. 68명 가운데 1명 꼴인 미국보다 두배 가까이 많습니다. 국내 자폐아 10명 중 9명은 가족이 돌봅니다. 남들과 다른 돌발 행동 탓에 한시도 눈을 뗄 수 없습니다. 주변의 시선은 부모를 더 힘들게 합니다. 김혜경  자폐아동 부모아이가 굉장히 위험한 사람인가 이상한 사람인가 하시고.이 친구만의 자기 표현인데 그걸 이상하게 보는 편견적 시선들이 가끔은 마음이 아프고 성인이 되면 취업은 커녕 교육 기관도 마땅치 않습니다. 정부가 지원하는 재활치료와 교육비도 19살부터 끊겨 가족의 부담을 가중시킵니다. 견디다 못한 부모들은 1인 시위를 벌이며 자폐 자녀를 키우는 부모의 심정을 호소합니다. 강소연  자폐아동 부모내가 다른 아이보다 하루만 더 살고 싶다. 내 앞에서 보내고 내가 그 다음에 장례치르고 죽겠다는 말을 할 정도로 절박. 자폐아를 둔 부모들은 오늘도 힘겨운 싸움을 이어가고 있습니다
경쟁 사라진 통신시장…"통신비 인하 추진"	http://news.naver.com/main/read.nhn?mode=LSD&mid=shm&sid1=105&oid=055&aid=0000406172	최근 이동통신사들 간에 경쟁이 줄어들면서 최신형 스마트폰값이 너무 비싸졌다는 분들 많습니다. 이런 상황에서 SK텔레콤과 CJ헬로비전이 합병할 경우 독점이 더 강화될 것이라는 목소리가 나오고 있습니다.기자126만 원이 넘는 최신형 스마트폰입니다.저가 요금제에서 통신사 단말기 보조금은 불과 3만 원대.10만 원이 넘는 최고가 요금제를 써도 보조금은 1112만 원에 불과합니다.보조금 상한선인 33만 원에 턱없이 못 미칠뿐더러 이동통신사들이 담합이나 한 것처럼 별 차이가 없습니다.휴대전화 판매점 관계자  통신사들끼리 경쟁해봐야 어차피 우리 수익 없어지는 것 아니냐뭐하러 경쟁 하냐 이대로 가야 영업이익이 더 늘어나고.단말기유통법 시행 뒤 통신 3사의 보조금 경쟁이 축소되면서 마케팅비는 크게 준 대신 영업이익이 1조 6천억 원 넘게 늘었습니다.여야 정치권이 비싼 통신비를 손볼 뜻을 내비쳤습니다.더불어민주당 우상호 원내대표는 매달 1만 원인 기본료 폐지를 포함해 통신비 인하를 중점 추진하겠다고 밝혔습니다.통신방송시장 독과점 강화 논란이 뜨거운 SK텔레콤의 CJ헬로비전 인수합병에 대해서도 우려를 나타냈습니다.우상호더불어민주당 원내대표  통신 대기업의 독점이 더 강화되는 방식이 아니도록 새로운 투자들을 유도해야 되는게 아닌가.새누리당에선 배덕광 의원이 반값 기본료 법안을 재추진하겠다고 밝혔습니다.국민의당도 단말기유통법의 문제점을 뜯어보겠다는 자세여서 통신비 인하와 시장 경쟁 강화 논의가 속도를 낼 전망입니다
