옥시 본사 개입 조사 착수한 검찰…수사 향방은	http://news.naver.com/main/hotissue/read.nhn?mid=hot&sid1=102&iid=25173980&oid=022&aid=0003051942&ptype=021&cid=1041396	옥시 외국인 전 대표 2명 소환 임박검찰이 가습기 살균제 사건의 최대 가해업체인 옥시레킷벤키저옥시의 주요 외국인 임원들을 조만간 소환조사할 계획이다. 검찰은 앞서 불러 조사한 옥시 전직 임원들에게 재소환을 통보해 구속영장 청구가 임박했다는 관측이 나온다.서울중앙지검 특별수사팀팀장 이철희 부장검사은 이번 주 중 존 리48 옥시 전 대표와 거라브 제인47 전 대표를 포함한 2000년대 중후반의 옥시 외국인 경영진을 소환할 것으로 8일 전해졌다.검찰에 따르면 이들은 사내이사나 대표이사로 재직했던 주요 임직원들로 한국 법인에서 만든 가습기 살균제의 제조와 판매 영국 본사와의 연락을 담당했다.영국서 촛불 추모 가습기 살균제 제조판매와 관련해 옥시레킷벤키저 본사 차원의 책임을 묻기 위해 영국으로 떠난 피해자 유족 김덕종씨앞줄 가운데가 6일현지시간 런던 교외의 뉴몰든에서 교민들과 함께 가습기 살균제로 숨진 사망자 239명을 추모하는 촛불 집회를 갖고 있다.런던검찰은 이들 외국인 임원진에 대해서도 신 전 대표와 같이 제품의 개발에서 제조 판매에 이르기까지 책임 여부와 귀책사유 등을 들여다볼 계획이다. 검찰은 특히 미국 국적의 존 리 전 대표와 인도 출신의 거라브 제인 전 대표에 주목하고 있다. 존 리 전 대표는 2005년 6월부터 2010년 5월까지 옥시 최고경영자CEO로 재직하며 살균제 판매를 사실상 진두지휘했다. 옥시의 가습기 살균제 판매량은 존 리 전 대표 시절 가장 많았다. 거라브 제인 전 대표는 존 리 대표에 이어 2010년 5월부터 2년간 경영을 책임졌다.검찰은 앞서 한 차례 소환조사한 옥시 신현우68 전 대표를 9일 다시 불러 조사한다. 전 옥시 연구소장 김모씨와 또 다른 가습기 살균제 세퓨의 제조사인 버터플라이이펙트 전 대표 오모씨도 재소환 대상에 포함됐다. 검찰은 이들 3명에 대해 업무상 과실치사 등 혐의로 구속영장을 청구할 방침인 것으로 알려졌다.검찰에 따르면 이들은 호흡곤란가슴통증 등 부작용을 호소하는 민원을 접수하고도 판매를 강행하거나 2011년 중순 사태가 불거진 뒤 증거 은폐를 시도한 혐의를 받고 있다. 세퓨의 경우 상대적으로 적은 판매량에도 사망자 14명 등 많은 피해자를 발생시켰다.클릭하면 큰 그림을 볼 수 있습니다.검찰은 전날 옥시로부터 뒷돈을 받고 유리한 보고서를 써준 혐의로 서울대 수의대 조모57 교수를 구속했다. 가습기 살균제 사망사건의 첫 구속사례가 된 조 교수는 옥시로부터 뇌물을 받고 가습기 살균제와 폐손상 간 인과관계가 명확하지 않다는 내용의 보고서를 써준 혐의 등을 받고 있다.하지만 조 교수 변호를 맡고 있는 김종민 변호사는 이날 기자들과 만나 조 교수가 지난 4일 검찰에 체포되기 직전 변호인이 진실을 밝혀 달라는 유서를 썼다며 죽음으로라도 결백을 입증하겠다는 것이 조 교수의 입장이라고 주장했다.한편 피해자들에 대한 직접 사과를 요구하며 옥시 본사를 항의 방문한 피해자 측이 영국 법원에 손해배상 소송을 제기하기로 했다. 옥시 제품을 사용하다 아들을 잃은 김덕종40씨는 6일현지시간 영국 로펌 KGIA 솔리시터스와 수임 계약을 맺고 소송을 제기하기로 했다.김씨는 옥시 CEO가 한국에 와서 피해자들 앞에서 진심 어린 사과를 해야 한다는 요구를 거부했다면서 소송 배경을 밝혔다. 이번 소송은 가습기 살균제 피해 사태와 관련해 옥시를 상대로 영국에서 다뤄지는 첫 민사소송이 될 전망이다
"망치 미리 준비" 계획살인이었나…프로파일러 투입	http://news.naver.com/main/read.nhn?mode=LSD&mid=shm&sid1=102&oid=001&aid=0008385256	영장실질심사 마친 대부도 토막살인 피의자     홍기원 기자  살인 및 사체유기 등 혐의로 구속영장이 청구된 대부도 토막시신 사건 피의자 조모씨가 7일 오후 영장실질심사를 받은 후 경기도 안산시 안산단원경찰서로 들어서고 있다. 경찰은 조씨의 범행 수법이 잔인하고 사망이라는 중대한 결과를 가져온 점으로 볼 때 공개대상에 해당한다고 판단해 얼굴과 신상정보를 공개하기로 했다.7    xanaduyna.kr믿기 어려운 진술 집중 추궁거짓말탐지기 조사도 검토계획 살인 입증시 형량 가중처벌 줄이려 거짓말 여부 조사     최해민 이영주 기자  경기 안산 대부도 토막살인 사건의 피의자 조성호30씨가 살해도구로 사용한 망치를 미리 준비한 사실이 추가로 드러났다.    조씨는 살해할 생각을 하고 있었다는 사실도 털어놨다.   경찰은 이에 따라 이번 사건을 계획된 살인으로 보고 프로파일러를 투입 진위를 조사하고 있다.    또 그동안 조씨가 진술한 내용에 상식적으로 이해할 수 없는 부분이 많다는 판단에서 폴리그래프거짓말탐지기 검사도 검토하고 있다.    이 사건을 수사 중인 안산단원경찰서 수사본부는 8일 경찰청 프로파일러를 투입 조성호씨의 진술에 대한 진위여부를 본격적으로 조사한다.    조씨는 경찰조사에서 지난달 12일 저녁 피해자 최모40씨로부터 너같은 를 낳아준 부모는 너보다 더 심한 다. 청소도 안해놓고 말도 안듣고 너가 이러고 사는거 보니 니 부모는 어떨지 뻔하다는 막말을 들었다고 밝혔다.    조씨는 이에 다음날인 13일 오전 1시께 술에 취해 잠든 최씨의 머리를 둔기로 내리쳐 살해했다고 진술했다.안산 대부도 토막살인 사건 피의자 페이스북 사진     안산 대부도 토막살인 사건 피의자인 조모30씨의 얼굴이 7일 오후 공개됐다. 이 사건을 수사 중인 경기 안산단원경찰서는 살인사체훼손사체유기 혐의로 구속영장을 신청한 조씨에 대한 영장실질심사에 참석하기 위해 7일 오후 조씨를 데리고 안산단원서를 나왔다. 경찰은 마스크나 모자 등으로 얼굴을 가리는 조치를 하지 않은 채 조씨를 언론에 공개했다. 조씨가 자신의 페이스북에 올린 사진.7    kyhyna.kr    이 과정에서 망치는 12일 오후 퇴근하면서 회사에서 가져와 미리 준비해놨고 다음날 오전 0시 30분께 술에 취해 집에 들어온 최씨가 또 욕설을 하며 행패를 부리자 살해할 생각을 한 채 최씨가 잠들때까지 30여분간 기다렸다가 범행했다고 자백했다.    그간 조씨는 어리다고 무시해 말다툼을 하다가 우발적으로 살해했다고 진술해왔다.    경찰은 조씨가 처음엔 우발적 살인으로 진술한 것이 추후 형량에도 영향을 미친다는 사실을 고려한 것으로 의심하고 있다.    우발적 살인보다 계획적인 살인이라는 사실이 입증되면 살인죄 양형기준에 따라 가중 처벌받기 때문에 조씨가 이를 염두에 두고 거짓 진술을 했을 가능성도 배제할 수 없기 때문이다.    대법원 양형기준에는 보통 동기살인죄 기본 양형은 징역 1016년이지만 중대범죄 결합 살인은 최소 징역 1722년 최대 25년 이상 혹은 무기 이상이며 극단적 인명경시 살인은 최소 징역 2025년 혹은 최대 무기이상으로 돼 있다.    여기서 최대 형량을 선고할 가중사유에는 계획적 살인 범행이 명시돼 있어 계획적인 살인이었다는 사실이 드러날 경우 형량은 훨씬 무거워진다.    조씨가 살인을 계획한 사실을 털어놓음에 따라 경찰은 프로파일러를 투입 이 진술에 대한 진위를 조사하고 있다.    아울러 경찰은 부모를 욕한 것에 분노가 쌓였다는 살해동기에 비해 수법이 잔인했던 점이나 SNS 활동을 활발히 하면서도 정작 시신 유기 후 영화채널을 보느라 뉴스를 보지 못해 시신발견 사실을 몰라 도주하지 않았다는 진술이 진실인지에 대해서도 조사할 예정이다.    사소한 말다툼에서 빚어진 사건으로 보기엔 살해 방법이 잔혹하다고 보여지기 때문이다.    1차 부검 결과 최씨 사인으로는 외력에 의한 머리손상이 지목됐고 얼굴뼈에는 복합골절이 갈비뼈에는 골절이 각각 관찰됐다.경찰서 나오는 토막살인 피의자     홍기원 기자  살인 및 사체유기 등 혐의로 구속영장이 청구된 대부도 토막시신 사건 피의자 조모씨가 7일 오후 영장실질심사를 받기 위해 경기도 안산시 안산단원경찰서에서 나오고 있다. 경찰은 조씨의 범행 수법이 잔인하고 사망이라는 중대한 결과를 가져온 점으로 볼 때 공개대상에 해당한다고 판단해 얼굴과 신상정보를 공개하기로 했다.7    xanaduyna.kr    시신 상반신에서는 오른팔과 오른쪽 폐 등에 56차례 하반신에서는 깊이 56의 흉기 상흔이 각각 발견됐다.    또한 경찰은 범행 전후 SNS 활동을 활발히 한 조씨가 시신을 유기한 뒤에도 정상적으로 회사생활을 하고 피해자와 함께 살던 집에서 도주하지 않은 점에 대한 진술의 진위에 대해서도 조사할 방침이다.    앞서 조씨는 마땅히 갈 곳이 없어서. 영화채널을 주로 시청해서 뉴스를 보지 않아 시신이 발견된 사실을 몰랐다고 진술했다.    경찰 관계자는 이달 1일부터 5일 사이 페이스북에 들어가면 시신이 발견됐다는 뉴스를 올려놓은 사람이 많아 뉴스를 접하지 못했다는 것은 이해하기 어렵다며 조씨는 페이스북에 친구로 맺어져 있는 사람만 200여명에 달했고 여러 유저들과 게시글 공유 등의 형식으로 소통해왔다고 전했다.    이에 따라 경찰은 조씨의 선불 휴대전화스마트폰와 PC를 분석해 진술이 맞는지 확인할 예정이다.    또 조씨를 상대로 거짓말탐지기 조사를 진행할지에 대해서도 검토하고 있다.    조씨는 지난 14일 오전 1시께 인천시 연수구 자택에서 최씨를 둔기로 내리쳐 살해한 뒤 시신을 10여일간 화장실에 방치한 채 훼손해 같은달 26일 밤 대부도 일대 2곳에 유기한 혐의로 7일 구속했다
'클린턴 대통령·샌더스 부통령' 조합 이뤄질까	http://news.naver.com/main/read.nhn?mode=LSD&mid=shm&sid1=104&oid=022&aid=0003051965&cid=428288	샌더스 러닝메이트 수용 긍정적클린턴측 진보색채 득실 저울질올해 미국 대선에서 클린턴 대통령샌더스 부통령 후보 팀이 출전할 가능성이 제기되고 있다. 민주당 대선 주자인 버니 샌더스 상원의원이 힐러리 클린턴 대선 후보의 부통령 러닝메이트로 출마하는 것에 대해 긍정적인 반응을 보였다.샌더스 의원은 6일현지시간 CNN방송에 출연해 클린턴 전 장관이 자신을 러닝메이트로 지목하면 수용할 것인지를 묻는 질문에 경선 일정을 마치면 클린턴 전 국무장관과 어디로 함께 갈 수 있을지에 대해 이야기를 나눌 수 있다며 러닝메이트 출마 가능성을 부인하지 않았다. 샌더스 의원은 그동안 러닝메이트 문제와 관련해 대선 경선에 집중할 때라며 언급 자체를 회피해 왔다.샌더스 의원이 러닝메이트 가능성을 열어둠에 따라 클린턴 전 장관 측은 샌더스 의원을 부통령 후보 리스트에 올려놓고 내부 논의에 착수한 것으로 알려졌다. 샌더스 부통령 후보 카드는 그가 경선 과정에서 진보적 의제를 던지며 젊은 층과 무당파 유권자의 폭발적 지지를 이끌어 냈다는 점에서 클린턴 전 장관의 지지세를 확장할 수 있다는 분석이다. 하지만 샌더스 의원의 진보적 색채가 중도층 유권자의 이탈을 부를 수 있다는 반론도 나오고 있다.한편 클린턴 전 장관이 환태평양경제동반자협정TPP의 비준에 반대한다는 입장을 밝혔다. 클린턴 전 장관은 오는 17일 오리건주 경선을 앞두고 이 주의 노조와 환경단체의 공동 질의에 대해 오는 11월 대선 전후로 TPP 비준에 반대한다고 답변했다.클린턴 전 장관은 국무장관 시절 TPP를 골드 스탠더드라면서 지지했으나 지난해 10월 PBS와의 인터뷰에서는 그 협정에 관해 아는 내용에는 찬성하지 않는다며 부정적 입장을 밝혔다
외국인 남녀, 옥상서 입맞추다 추락해 숨져	http://news.naver.com/main/read.nhn?mode=LSD&mid=shm&sid1=102&oid=421&aid=0002042137	서울 류보람 기자  주택 옥상에서 애정행각을 벌이던 외국인 남녀가 난간 너머로 추락해 숨졌다.8일 서울 용산경찰서에 따르면 이날 오전 2시쯤 용산구 이태원동의 3층짜리 주택 옥상에서 미국인 남성 A씨31와 남아프리카공화국인 여성 L씨26가 추락해 숨졌다.경찰은 목격자 증언에 따라 두 사람이 난간 근처에서 키스를 하다가 L씨가 먼저 떨어졌고 L씨를 붙잡으려던 A씨가 같이 떨어진 것으로 보고 있다. A씨는 이 건물의 세입자였다.두 사람은 인근 병원으로 옮겨졌지만 머리를 크게 다쳐 숨졌다.경찰은 타살 가능성은 적다고 보고 정확한 사고 경위를 조사하고 있다
월세 수요에 급등…소형 아파트 10억 넘었다	http://news.naver.com/main/read.nhn?mode=LSD&mid=shm&sid1=101&oid=055&aid=0000406171	서민 아파트라는 소형 아파트의 가격 상승세가 심상치 않습니다.실수요에다 투자수요까지 겹치면서 서울 강남권에서는59 소형 아파트 가격이 10억 원을 넘는 곳도 있습니다손승욱 기자의 보도입니다.기자서울 서초구의 대단지 아파트 2곳.이 중 한 곳의 59의 평균 시세는 각각 11억1500만 원 또 다른 곳은 10억 2500만 원으로 모두 10억 원을 넘겼습니다.서울 지역 전체 소형아파트의 경우 지난해 연간 11.82 올랐는데 올 들어서도 2.중대형 아파트값 상승률보다 훨씬 높습니다.소형아파트의 강세는 강남권 재건축 아파트에서 시작됐습니다.건설업체 관계자  재건축 단지들이 대부분 좋은 위치에 있거든요. 재건축 단지들이 분양가를 올리면서 상승작용 효과로 기존 아파트들의 가격도 끌어올린다고.여기에 저금리 시대에 월세를 받으려는 투자수요까지 가세했습니다.기존 대형아파트를소형 아파트 2채로 바꿔 한 채에선 자신들이 살고 다른 한 채는 월세를 주는 경우도 있습니다.박원갑KB국민은행 부동산전문위원  저금리가 장기화 되면서 은퇴자를 중심으로 아예 주택을 임대 목적으로 구입하는 사례도 늘 것으로.또 강남권 실수요자들이 가격 부담이 적은 소형 평수를 선호하는 것도 가격 상승 요인입니다.심교언교수 건국대 부동산학과  투자할 곳이 별로 없기 때문에 몰리는 게 가장 큰 것 같고요. 지금 현재는 너무 고가에 형성됐습니다
여야, 20대 국회 원구성 협상…예상밖 순항 vs 가시밭길	http://news.naver.com/main/read.nhn?mode=LSD&mid=shm&sid1=100&oid=018&aid=0003537952	여야 3당 원내대표 선출 마무리원구성 협상 주판알 튕기기 국회의장 제1당 더민주 유력 속 국민의당 의중이 변수 작용 상임위 의석수 비율 따라  8더민주 8국민의당 2곳 유력이데일리 김성곤 기자 여야 3당이 최근 원내대표 선출을 모두 마무리하면서 20대 국회 전반기 원구성 협상이 본격화할 전망이다. 특히 16년 만에 여소야대 지형의 3당 체제가 만들어지면서 20대 국회 원구성을 둘러싼 새누리당122석 더민주123석 국민의당38석의 샅바싸움은 더욱 치열해질 것으로 전망된다. 우선 국회의장단의 경우 재적 의원은 상대로 무기명 투표를 통해 선출하지만 여야간 사전조율이 관례다. 의석수에 따라 국회의장은 원내 제1당인 더민주 국회부의장은 각각 새누리당과 국민의당 몫으로 결정될 가능성이 높다. 다만 국회의장은 국민의당 선택에 따라 새누리당으로 넘어갈 가능성도 없지 않다. 아울러 상임위원장 배분 문제는 더 풀기 힘든 고차방정식이다. 20대 국회에서 국민의당이 교섭단체가 되면서 3당간 상임위 배분이 더욱 어려워졌기 때문. 5월 30일 개원 전 원구성 마무리 속전속결 원구성 협상19대 국회 원구성 협상은 임기 개시일인 2012년 5월 30일에서 한 달여가 지난 6월 29일에야 마무리됐다. 17대와 18대 국회 역시 한 달을 끌었다. 20대 국회가 원구성 협상을 놓고 개점휴업 상태가 되면 거센 국민적 비판여론에 직면할 수 있다. 총선 민심에 화들짝 놀란 여야가 법정시한내 원구성 협상 종료를 강조하면서 속전속결을 시사하는 것도 이 때문이다. 여야의 협치가 시험대에 오른 것이다.  실제 여야의 태도는 과거보다 유연하다. 안철수 국민의당 대표는 20대 국회가 임기 시작일인 5월 30일까지 원 구성이 안되면 원이 구성될 때까지 세비를 받지 말아야 한다고 말했다. 일하지 않는 국회에 대해 여론이 따가운 만큼 안 대표의 발언은 여야 모두에 압박으로 작용할 수 있다. 우상호 더민주 원내대표 역시 원구성 협상과 관련 각 당이 서로 얻고자 하는 계산이 서로 있겠지만 그것을 떠나서 시작부터 법을 지키는 20대 국회가 되자며 5월 중 원구성 협상을 마무리하고 6월 원구성이 정상적으로 되도록 하자고 밝혔다. 새누리당 역시 유연한 태도다. 정진석 신임 원내대표는 원구성 협상과 관련한 상임위원장 배분과 관련해 야당이라고 외교 안보 국방 문제의 중요성을 못 느끼겠느냐며 여당몫인 국방위와 외통위를 양보할 수 있다는 입장을 내비쳐왔다. 여야 3당 모두 법사위에 눈독상임위 분할도 변수여야의 희망섞인 공언과 달리 20대 국회 원구성 협상은 한마디로 가시밭길이다. 알짜배기로 여겨지는 이른바 핵심 상임위 확보를 위한 여야의 눈치작전이 치열하기 때문.국회 상임위는 법사위 정무위 기재위 등 총 18개다. 19대 국회에서 새누리당이 10개 더민주가 8개 상임위를 확보했다. 의석수에 따라 상임위를 배분한다는 원칙에 따라 20대 국회에서는 새누리당 8개 더민주 8개 국민의당 2개로 배분할 가능성이 높다. 다만 새누리당이 원내 제1당 지위를 회복한 뒤 국회의장을 요구할 경우 상황은 다소 복잡해질 수 있다. 국민의당 역시 캐스팅보트로서의 영향력을 발휘할 경우 최대 34개 상임위 확보가 가능하다는 시나리오도 나온다.  여야 줄다리기의 핵심은 법안처리의 마지막 관문인 법사위다. 새누리당은 국회의장을 더민주에 내줄 경우 법사위는 반드시 사수한다는 입장이다. 더민주 역시 제1야당 몫이었던 법사위원장을 포기할 수 없다는 입장이다. 관건은 청와대를 담당하는 운영위를 누가 갖느냐에 따라 엇갈릴 수 있다. 국민의당 역시 제3당으로서의 영향력 유지를 위해 법사위 확보에 열을 올리고 있다. 국회운영의 핵심인 국회의장과 운영위원장을 새누리당과 더민주가 나눠가질 경우 국민의당에 법사위를 배분해야 한다는 논리다. 이어 19대 국회에서 새누리당 몫이었던 정무위와 기재위는 차기 대선을 앞둔 전략적 중요성 때문에 그리고 더민주 몫이었던 국토교통위 농해수위 산업위는 지역현안 해결에 유리하다는 점 때문에 각각 상대 정다에서 배분을 벼르고 있다.   이밖에 상임위 분할을 통한 증설도 변수다. 소관 부처의 성격이 전혀 다르거나 덩치가 큰 상임위를 재조정해서 효율성을 높여야 한다는 논리 때문. 우상호 원내대표는 교육문화체육관광위를 교육위와 문화위로 박지원 원내대표가 환경노동위원회를 환경위와 노동위로 분리하자는 주장을 내놨다. 미래창조과학방송통신위 역시 분리 가능성이 제기된다
'님을 위한 행진곡'은 '5·18 공식노래'가 될 수 있을까	http://news.naver.com/main/read.nhn?mode=LSD&mid=shm&sid1=100&oid=001&aid=0008385706	정관계 시민사회 등 11일 기념곡 지정 촉구 담화문 발표국회 촉구에도 머뭇거리는 보훈처 화답할지 미지수    광주 손상원 기자  제36주년 518 민주화운동 기념일이 열흘 앞으로 다가오면서 올해 기념식에서 님을 위한 행진곡이 마음껏 불릴지 관심이 쏠린다.    지역 정관계 시민사회는 한목소리로 님을 위한 행진곡의 518 기념곡 지정 기념식 제창을 요구하고 있지만 국가보훈처가 화답할지는 미지수다.     8일 지역 정관계에 따르면 국민의당 당선인들은 님을 위한 행진곡 등과 관련한 518 현안 논의를 위해 국무총리 면담을 추진했으나 무산된 것으로 알려졌다.    국민의당과 더민주 호남 다수 의원은 기념곡 지정을 재촉구하는 결의안을 발의했지만 오는 18일 이전 처리는 어려울 것으로 보인다.    국민의당 장병완 의원은 다음 본회의가 19일로 예정된 점을 고려해 18일 이전 결의안 처리를 위한 원포인트 본회의를 제안하기도 했으나 실현 가능성은 크지 않은 상황이다.     설사 결의안이 통과된다 해도 보훈처가 태도를 바꿀지 불투명하다.     보훈처는 2013년 국회에서 기념곡 지정 촉구를 결의했지만 국민통합을 저해할 우려가 있다는 등 이유로 후속 조치를 하지 않고 있다.    지역 사회의 요구는 크다. 국회의원 당선인 등 정치권 인사와 광주시 시의회 시교육청 등은 제36주년 518 기념행사위원회와 함께 오는 11일 오전 11시 이와 관련한 담화문을 발표할 예정이다.    518 역사왜곡대책위 역사교과서 국정화저지 광주시민대책위 시민사회 대표 등도 참여할 계획이다.    518 행사위 관계자는 님을 위한 행진곡의 518 공식 기념곡 지정을 위해 광주 공동체의 힘과 지혜를 모아 최선의 노력을 다할 것을 다짐하고 이번 총선에서 나타난 민심을 수용해 민주화운동 유산인 노래를 기념곡으로 지정하도록 정부에 요구할 것이라고 밝혔다.     한편 광복회 등 10여개 보훈단체들로 구성된 중앙보훈단체안보협의회는 지난 4일 518 기념곡 지정을 강행한다면 가능한 방법을 모두 동원해 적극 저지할 것이라고 반대 입장을 담은 자료를 내고 새누리당 더민주 국민의당에 전달했다.    님을 위한 행진곡은 518이 정부 기념일로 제정된 1997년부터 이명박 정부 첫해인 2008년까지 공식 기념식에서 참석자 전원이 함께 부르는 제창 방식으로 불렸다.    하지만 2009년부터 제창 대신 공연단의 합창으로 바뀌었으며 이후 공식 식순에서도 빠져 식전공연으로 대체되기도 했다.    518 단체와 시민사회가 제창 요구가 받아들여지지 않는데 반발해 불참하면서 기념식은 최근 3년간 반쪽행사로 전락했다
