학생부 많이 고친 학교, 현장 점검한다	http://news.naver.com/main/read.nhn?oid=001&sid1=102&aid=0008678079&mid=shm&mode=LSD&nh=20160909214332	TV제공교육부 정기 모니터링하기로10월까지 전체 고등학교 학생부 실태조사     세종 황희경 기자  광주 모 고교에서 학교생활기록부학생부 조작이 적발된 것과 관련 교육부가 학생부 수정횟수가 지나치게 많은 학교 등을 현장 점검하기로 했다.    광주의 한 사립학교는 교장과 교사가 나이스NEIS교육행정정보시스템에 수백 회 무단 접속해 학생 25명의 학생부에서 세부능력 및 특기사항을 36회 조작한 것으로 조사됐다.    교육부는 나이스 검증을 통해 학생부 수정이 과도하게 여러 차례 이뤄졌거나 권한 부여에 이상한 점이 있는 학교를 발견하면 현장 점검을 하는 방식으로 모니터링 시스템을 갖출 계획이다.    학기마다 모니터링할 계획으로 우선 다음 달 말까지 이 같은 방식으로 학생부 기재 실태를 조사할 것을 시도 교육청에 지시했다.    교육부 관계자는 9일 이미 일부 시도 교육청에서는 이 같은 방식으로 점검하고 있다며 이를 전체적으로 확대하는 것이라고 설명했다
복싱 꿈나무 10대 고교생…경기 뒤 쓰러져 의식불명	http://news.naver.com/main/read.nhn?oid=052&sid1=102&aid=0000901345&mid=shm&viewType=pc&mode=LSD&nh=20160909234720	복싱 국가대표가 꿈인 고등학생이 복싱 대회에 참가해 경기를 마친 뒤 뇌출혈로 쓰러졌습니다. 병원으로 옮겨졌지만 의식을 찾지 못하고 있어 주위를 안타깝게 하고 있습니다. 기자 지난 7일 충남 청양에서 진행된 복싱대회입니다. 남자 고등부 64kg급에 출전한 김 모 군은 아쉽게도 8강 전에서 판정패를 당했습니다. 경기를 마친 김 군은 관중석으로 향했고 얼마 안 돼 의식을 잃고 쓰러졌습니다. 김재한  전국복싱우승권대회 감독관  대등한 경기를 펼쳤고요. 이 학생이 관중석에 올라가서 아버지와 이야기하다가 쓰러진 거로 알고 있습니다. 현장에 있던 의료진이 김 군의 상태를 확인했을 때는 동공이 풀려 뇌출혈이 의심되는 상황이었습니다. 김 군은 경기장 밖에서 대기 중이던 구급차에 실려 의식이 없는 채 인근 의료원으로 이송됐습니다. 의료원은 더 큰 병원으로 옮겨야 한다는 판단 아래 닥터헬기를 요청해 천안의 한 대학병원으로 김 군을 옮겼습니다. 안타깝게도 김 군은 중환자실에서 깨어나지 못하고 있습니다. 김 군은 복싱 국가대표를 꿈꾸는 복싱 꿈나무로 학교에서도 성실하고 모범적인 학생으로 알려져 주위를 더욱 안타깝게 하고 있습니다. 김유현  서울 아시안게임 복싱 헤비급 금메달리스트  성금을 좀 걷어서 부상 당한 선수 부모님께 전해주자는 이야기도 하고 있고 그 선수 꿈이 국가대표라는데 빨리 깨어나서 다시 운동하는 모습을 보고 싶습니다
저소득층, 공공요금에 소득 11% 쓴다	http://news.naver.com/main/read.nhn?oid=032&sid1=101&aid=0002728297&mid=shm&viewType=pc&mode=LSD&nh=20160909212844	국회 공공기관 요금체계 보고서여기를 누르면 크게 보실 수 있습니다한국의 가구는 한 달에 11만원가량을 상하수도전기가스도로철도요금 등 5대 공공요금으로 지출하는 것으로 나타났다. 가처분소득 대비 공공요금 부담은 저소득층일수록 높아져 소득 하위 20 계층인 소득 1분위는 소득의 10 이상을 공공요금으로 지출하고 있다. 공공요금 체계가 저소득층에 불리하게 짜여져 있는 것이다. 9일 국회예산정책처의 공공기관 요금체계 평가 보고서를 보면 2014년 기준 국내 가구의 가구당 5대 공공요금 지출액은 월 11만3592원으로 평균 가처분소득월 299만6497원의 3. 5대 공공요금 중 규모가 가장 큰 것은 가스요금도시가스와 LPG으로 가구당 월평균 4만5901원을 썼다. 이어 전기요금4만3643원 상하수도요금1만7656원 철도요금3205원 도로요금3187원 등의 순이다.소득이 낮은 가구일수록 공공요금 지출액은 낮아지지만 가처분소득 대비 공공요금이 차지하는 비중은 크게 높아졌다. 소득이 가장 많은 소득 5분위상위 20는 공공요금으로 월 14만9158원을 써 지출이 가장 크다. 하지만 가처분소득월 615만8617원 대비로는 2. 반면 소득이 가장 적은 소득 1분위하위 20는 공공요금 지출액이 6만8151원으로 가장 적지만 가처분소득61만2758원 대비로는 11. 특히 1분위는 가족 구성원이 많을수록 지출액이 눈덩이처럼 불어났다. 가족수가 늘어날 경우 그만큼 전기 가스 물 소비량이 많아지지만 정부 보조는 한정돼 있기 때문이다. 1분위 4인 가구의 5대 공공요금 지출은 월 13만4510원으로 월 평균 가처분소득70만4965원의 19. 국회예산정책처는 전체적으로 저소득 가구일수록 공공요금에 대한 부담이 상당하다고 밝혔다.필수재 성격이 강한 전기가스상하수도요금 등은 저소득층에 상대적으로 더 큰 부담을 주고 있다. 소득이 적다고 해서 쉽게 줄일 수 있는 성격의 지출이 아니기 때문이다. 가처분소득 대비 전기가스상하수도요금의 부담 정도를 보면 소득 1분위는 소득 5분위에 비해 45배가량 높았다. 반면 도로요금과 철도요금은 가처분소득 대비 부담이 소득 분위별로 큰 차이가 없다. 도로요금은 자가용을 많이 보유한 소득 5분위의 가처분소득 대비 부담 비중이 소득 1분위보다 높다.국회예산정책처는 주택용 전기요금 누진제는 가족이 많은 저소득층에 큰 부담을 주는 만큼 누진제를 완화하되 에너지 복지를 지원할 수 있는 별도의 방안을 마련해야 한다고 밝혔다
전염성 피부병 '옴' 확산세, 대형병원서도 감염	http://news.naver.com/main/read.nhn?oid=214&sid1=102&aid=0000669325&mid=shm&mode=LSD&nh=20160909210814	옴 아십니까옴 진드기 때문에 생기는 전염성 강하고 극도로 가려운 피부병이죠.서울의 한 대학병원 대형병원 세탁실에서 옴이 번졌습니다.요즘 곳곳에서 이 옴 때문에 난리라고 합니다. 리포트 지난 6일 서울아산병원 세탁실에서 일하는 한 남성직원이 극심한 가려움을 호소했습니다. 세탁실 직원 80명을 정밀검진하자 환자 2명이 추가로 나왔습니다. 병원 관계자환자들이 증상이 있는지 전수조사해서 파악했는데 신고가 없어 병원 내 감염은 아닌 걸로.병원 측은 이들 직원 3명을 한 달간 격리하고 세탁실 소독과 병원 내 모든 의복과 침구류에 대해 멸균 세탁을 실시했습니다. 옴은 옴 진드기에 의해 감염이 되는데 가족이나 간병인처럼 가까운 사람 사이에서 옷이나 이불을 통해 옮깁니다.세탁실 직원 가운데 누군가 옮아왔거나 병원을 다녀간 환자가 옮겼을 가능성이 높습니다.한동안 자취를 감췄던 옴 환자는 10여 년 전부터 다시 늘어 지난해 4만 명이 치료를 받았습니다.고령화로 노인들이 요양원을 이용하는 경우가 늘었는데 시설의 감염 관리는 소홀하다 보니 말도 못하는 중증환자들 사이로 퍼지는 겁니다.대형 병원들은 가려움 증세가 있는 환자가 나타나면 옴 검사부터 할 정도입니다. 이은정순천향대병원 감염내과 교수옴이 많이 늘고 있다고 체감하고 있고요. 침상에 누워있는 환자들이 많아지고 의사표현을 못하면서 진단이 늦어져 전파도 많이 되고
 법원 '북한식당종업원' 인신보호청구 각하	http://news.naver.com/main/read.nhn?oid=421&sid1=102&aid=0002273735&mid=shm&viewType=pc&mode=LSD&nh=20160909220032	구제청구자들에게 청구자격 인정 어려워이미 보호센터에서 퇴소 청구이익 없어서울 안대용 기자  민주사회를 위한 변호사모임민변이 중국 내 북한식당을 집단 탈출한 여성종업원 12명에 대해 청구한 인신보호 재판에서 법원이 각하 결정을 내렸다.서울중앙지법 형사32단독 이영제 판사는 9일 민변이 이들 12명에 대해 국가정보원을 상대로 낸 인신보호 사건에서 각하 결정했다.북한주민인 이들 12명은 중국 저장성 닝보의 한 식당에서 일하다 지난 4월7일 국내로 입국했다.당시 정부는 이들의 집단탈북 사실을 이례적으로 브리핑을 통해 공개적으로 밝혔다.사회적 관심이 높아지자 정부는 그동안 이들을 북한이탈주민정착지원사무소하나원에 보내지 않고 북한이탈주민보호센터옛 합동신문센터에서 보호하며 남한 정착교육 등을 진행했다. 민변은 지난 5월 서울 서초구 내곡동에 있는 국가정보원 민원실을 방문해 이들에 대한 접견신청서를 제출했다.하지만 정부는 이들은 현재 우리사회 정착을 위한 초기단계에 있고 안정을 찾아가고 있기 때문에 이들에 대한 외부인 접견은 적절치 않다며 민변의 접견 신청을 거부했다.그러자 민변은 이들의 부모 등 북한에 있는 가족들로부터 위임장을 받았다며 지난 5월24일 북한이탈주민보호센터에서 이들의 수용을 해제해달라며 법원에 인신보호 구제청구를 했다.사건을 맡은 이 판사는 민변 측에 구제를 청구하는 가족들과 이들 12명의 관계 및 구제청구자들의 변호인에 대한 위임사실을 뒷받침하는 자료를 제출해달라고 요청했다. 민변 측은 이 판사의 요청에 대해 지난 6월10일 위임장 사본 구제청구자들이 위임장을 들고 있는 사진 공민증 구제청구자들이 이들과 함께 찍은 것이라 주장하는 사진 등을 제출했다.이 판사는 구제청구의 적법성을 확인하기 위해 6월21일 비공개로 1회 심문기일을 열었다. 그런데 민면 측은 피수용자인 종업원들이 나오지 않은 상황에서 재판을 끝내는 건 문제라며 재판부에 대한 기피신청을 했다. 이 기피신청에 대해 법원은 이 판사가 불공정했거나 불공정할 우려가 없다며 기각 결정을 내렸고 그대로 확정됐다.이후 이 판사는 민변 측에 구제청구자들과 이들 12명의 관계 및 변호인 위임사실에 대한 자료를 추가로 제출해달라 요구했고 민변 측은 위임장 원본 구제청구자들이 위임장을 작성하는 과정이 담긴 동영상 CD 북한 적십자회 명의의 가족관계증명서 등을 제출했다.하지만 이에 대해 이 판사는 구제청구자들에게 청구자격을 인정하기 부족하다고 판단했다.이 판사는 공민증에는 성명 주소 배우자 관계 등이 기재돼 있을 뿐 자녀관계와 관련된 내용은 기재돼 있지 않다며 제출된 사진 속 인물이 동일인이라고 단정하기 어려워 함께 있는 사진만으로 부모자식 관계에 있다고 볼 수 없다면서 구체청구자가 아닌 사람이 구제청구를 한 경우에 해당한다고 봤다.이 판사는 또 이들 12명은 지난 8월8일부터 11일까지 북한이탈주민보호센터를 순차적으로 퇴소한 후 각자 주거지에서 거주하고 있다며 향후 같은 사유로 보호센터에서 체류할 가능성이 있다고 볼 자료가 없다면서 북한이탈주민보호센터에서의 수용 해제를 구하는 구제청구의 이익이 더 이상 없다고 판단했다
백남기씨 쏜 물대포 시연…3초도 못 버틴 표적	http://news.naver.com/main/read.nhn?oid=437&sid1=102&aid=0000130971&mid=shm&mode=LSD&nh=20160909213927	지난해 11월이죠 도심 집회에 참가했던 농민 백남기씨가 경찰 물대포에 맞고 혼수상태에 빠진지 어제로 꼭 300일이 됐습니다. 경찰이 표적을 세워놓고 지난해 사고 당시와 같은 수준으로 최근 물대포의 위력을 시연했습니다. 국회의 요구에 따른 것이었는데요. 3초가 채 안 돼 표적이 쓰러졌습니다. 이호진 기자의 단독 보도입니다.5m 높이에서 굵은 물줄기를 뿜어 냅니다.물대포를 맞은 표적은 3초를 버티지 못하고 쓰러집니다.경찰청은 지난 2일 국회 안전행정위원회 소속 의원들 앞에서 비공개로 물대포 위력을 시연했습니다.시연은 지난해 11월 집회에서 경찰이 농민 백남기 씨에게 물대포를 쏠 때와 같은 강도 같은 조건으로 이뤄졌습니다.표적을 세워 물대포 위력을 시연한 것은 이번이 처음입니다.앞서 경찰은 지난해 비난 여론이 거세지자 표적도 없이 땅바닥에 물대포를 쐈고 생색내기 시연이라는 비판을 받았습니다.경찰은 안전을 위한 물대포 개선 작업을 진행 중이라고 밝혔지만 논란은 여전합니다.백남기씨가 쓰러진 지 300일이 지난 가운데 국가인권위원회는 최근 피해자 가족들의 고통을 덜고 비슷한 사고를 막기 위한 검찰의 조속한 수사를 촉구했습니다.백남기씨 사건의 진상 규명을 위한 국회 청문회는 오는 12일 열립니다.이호진 JTBC 뉴스 공식 SNS 트위터 페이스북 유튜브Copyright by JTBChttpjtbc
삼성전자, 프린터 사업 美 HP에 매각추진	http://news.naver.com/main/read.nhn?oid=008&sid1=101&aid=0003740260&mid=shm&mode=LSD&nh=20160909213848	임동욱 기자 삼성전자 확인해 줄 수 없다.중국브라질에 생산법인 관련인력 2000여명삼성전자는 프린터 설치에서부터 토너 등의 소모품 관리 최적의 출력 품질을 유지하기 위한 서비스까지 제공하는 프린팅 렌탈 서비스를 실시한다. 프린터복합기의 운영 효율성을 중시하는 기업 고객에 최적화 되었다. 삼성전자삼성전자가 프린터 사업을 미국 휴렛팩커드HP에 매각하는 방안을 추진 중인 것으로 알려졌다. HP는 세계 1위 프린터 사업자다. 9일 업계에 따르면 삼성전자는 선택과 집중 전략에 따라 프린터 사업을 비주력 부문으로 분류하고 정리하는 쪽으로 방향을 잡은 것으로 알려졌다. 이에 따라 삼성전자는 과거 프린터 사업 등과 관련해 협력 관계에 있었던 HP에 프린터 사업을 넘기는 방안을 검토 중인 것으로 알려졌다. 매각 추진 여부에 대해 삼성전자 관계자는 확인해 줄 수 없다며 함구했다. 매각 추진 시 삼성전자가 국내외 프린터 사업부 인력 2000여 명과 중국 브라질 생산법인을 모두 넘길 가능성도 있지만 현재로서는 정확한 매각 방향은 알 수 없다. 매각 규모는 2조원 대라는 관측도 있지만 구체적으로 확인된 내용은 없다. 업계 관계자는 B2B기업간거래 사업을 강화하고 있는 삼성전자가 기업용 솔루션 사업군은 남기고 일반 소비자 대상의 프린터 사업을 떼어내 정리할 가능성이 있다고 말했다
'표지갈이' 교수들 항소심서 저작권법 유죄…벌금 1천500..	http://news.naver.com/main/read.nhn?oid=001&sid1=102&aid=0008678127&mid=shm&viewType=pc&mode=LSD&nh=20160909234755	벌금 1천만원 원심 파기재판부 원심 법리오해 검사 주장 인정    의정부 김도윤 기자  남의 책 표지만 바꿔 자신의 저서인 것처럼 출간하거나 이를 묵인한 이른바 표지갈이 사건으로 기소된 대학교수들에 대한 항소심에서 저작권법 위반 혐의가 유죄로 인정됐다.     원심은 저작권법 보호 대상을 최초 발행된 책만으로 한정했으나 했으나 항소심은 달리 봤다.    의정부지법 형사1부성지호 부장판사는 저작권법 위반 업무방해 위계공무집행방해 혐의 등으로 기소된 김모60 교수 등 5명에 대한 항소심에서 원심을 깨고 벌금 1천500만원을 선고했다고 9일 밝혔다.    원심은 이들의 혐의 가운데 저작권법 위반 혐의를 무죄로 판단 벌금 1천만원을 선고했다.    현행 저작권법은 남의 저작물에 이름을 바꿔 공표한 자를 처벌하고 있다.    이에 원심은 공표를 최초 발행의 의미로 해석했다. 그렇지 않으면 저작물 보호 기간이 무한히 연장된다고 봤기 때문이다.    또 원심은 저작권법이 발행 행위를 처벌하는 것이 아니라 공표 행위를 처벌하려고 제정됐다고 판단했다.    이번 표지갈이 교수들의 경우 이미 공표된 책에서 일부 오탈자만 수정했을 뿐 내용은 바꾸지 않고 자신들의 이름만 넣어 다시 발행한 것이지 공표한 것이 아니므로 저작권법 적용 대상에 포함되지 않는다는 해석이었다.     아직 발행되지 않은 저작물을 가로채 저자 이름만 바꿔 공표하거나 이미 발행된 책이라도 내용을 일부 수정한 뒤 자신의 이름을 넣어 새로운 책 형태로 공표해야 처벌 대상이 된다는 얘기다.    그러나 항소심은 저작권법 적용 범위를 공표로 한정하지 않았다.    항소심 재판부는 판결문에서 현행 저작권법은 공표가 발행을 포함하는 개념임을 분명히 하고 있을 뿐 적용 범위를 최초 발행 즉 공표에 한정한다는 취지의 규정을 두고 있지 않다고 판시했다.    이어 저작권법은 저작물의 유형이 다양해져 부정한 발행을 처벌하는 것만으로는 저작자 이름에 대한 대중의 신뢰를 보호할 수 없게 됐기 때문에 부정한 발행을 비롯한 부정한 공표 행위 일체를 처벌하는 것이라고 덧붙였다.    그러면서 재판부는 피고인들은 최고의 지성인이자 교육자로서 모범적인 모습을 보여야 할 대학교수의 지위에 있음에도 부정한 사익을 추구하려는 탐욕에 빠져 자신이 쓰지도 않은 책을 마치 자신이 쓴 것처럼 공저자로 표시해 엄벌해야 마땅하지만 동일한 유형의 사건과 형평성을 고려해 벌금형을 선택했다고 양형 이유를 설명했다.    앞선 원심 재판부의 논리대로라면 이미 발행된 책의 내용은 그대로 두고 저자 이름만 바꿔 발행하더라도 저작권법에 저촉되지 않는다는 해석이 가능하다. 또 한번 공연된 연극을 다른 극단이 그대로 공연해도 저작권법으로 처벌할 수 없다는 의미로도 받아들여질 수 있다는 점에서 논란이 됐다
거제 바다 콜레라균 검출…"한 달은 조심해야"	http://news.naver.com/main/read.nhn?oid=057&sid1=102&aid=0001018813&mid=shm&mode=LSD&nh=20160909210440	거제에서 수산물을 먹은 사람들이 잇달아 콜레라에 감염됐었는데 실제로 거제 바다에서 콜레라균이 검출됐습니다.  거제 바다 일부가 콜레라균에 오염됐을 가능성이 큰데 한 달가량은 날것 섭취를 피하시는 게 좋을 것 같습니다. 기자   15년 만에 국내에서 발생한 네 명의 콜레라 환자.  필리핀에서 감염된 것으로 추정되는 네 번째 환자를 제외하고는 모두 거제에서 수산물을 섭취했다는 공통분모를 갖고 있습니다.  때문에 거제 바닷물이 콜레라균에 오염됐을 가능성이 제기돼 왔는데 실제로 거제 장목면 대계항 인근 바다에서 콜레라균이 검출됐습니다. 인터뷰  조은희  질병관리본부 감염병관리과장 두 번째 환자가 섭취한 삼치를 잡은 해안에서 콜레라균이 발견됐기 때문에 바다를 근원지로 추정하고 있습니다.  보건당국은 거제 일부 해역에서만 콜레라균이 검출됐다고 밝혔지만 소비자들은 불안합니다. 인터뷰  장민경  부산 재송동 수산물 먹는 게 조심스러운 부분인데 여기는 되고 거기는 안 된다는 건 상식적으로 납득이 안 됩니다.  거제 인근 바닷물이 콜레라균에 오염된 이유로는 해류에 떠밀려오거나 외국선박에 의해 옮겨진 뒤 높은 해수 온도로 증식했을 가능성이 거론됩니다.  평년보다 올해 기온이 높았던 점을 감안할 때 10월 정도까지는 콜레라균이 살아있을 가능성이 커 가급적 수산물은 익혀 먹는 게 좋습니다. 인터뷰  이재갑  한림대 강남성심병원 감염내과 교수 10월에서 11월 넘어가면 수온 자체가 떨어지다 보니까 콜레라균이 자라기 힘들어져 문제가 안 될 겁니다.  보건당국은 이번에 검출된 콜레라균이 앞서 발생한 콜레라 환자들과 같은 균인지 추가 조사결과를 내놓을 예정입니다 
