세 살배기 목 조르고 팽개치고…또 어린이집 학대	http://news.naver.com/main/read.nhn?mode=LSD&mid=shm&sid1=102&oid=055&aid=0000411009	세 살배기 어린 아이의 목을 조르는 등 원생들을 상습적으로 폭행한 혐의로 인천의 한 어린이집 원장이 구속됐습니다. 피해 학부모들은 아직도 근절되지 않은 아동학대에 대해 사회의 경각심을 일깨워 달라며 CCTV를 공개했습니다.기자어린이집 원장이 세 살배기 아이를 가로로 뉘어 무릎에 앉힙니다.허리가 꺾인 아이는 버둥거리며 고통스러워 합니다.아이의 목을 졸라 바닥에 내팽개치기도 하고 엉덩이를 세차게 후려치기도 합니다.지난달에 녹화된인천의 한 어린이집 CCTV 화면입니다.참담한 광경을 목격한 학부모들의 입에서 외마디 안타까운 탄식이 흘러나옵니다.30대 직장인 여성은 지난달 27일 아이를 씻기면서 몸 여기저기에 난 멍 자국을 발견했습니다.피해 학부모  말 못하는 아이를 이런 지옥 같은 곳에 보냈다는 게 아이한테 미안한 마음이 더 커요.문제의 어린이집 원장은 아동 학대 혐의로 구속됐습니다.경찰 수사 과정에서 아이 4명이 학대를 당한 것으로 드러났고 해당 어린이집은 문을 닫았습니다.이 지역 주민들이 주로 활동하는 인터넷 카페에서는 어린이집 원장을 상대로 한 민형사 소송 비용을 모금하는 운동이 벌어지고 있습니다.잊을 만하면 터져 나오는 어린이집 아동 학대를 더는 두고 보지 않겠다는 공감대 속에 지역민들도 모금에 적극 참여하고 있습니다
조선업체 '물량팀' 둘 중 한명은 잘려도 실업급여 '0원'	http://news.naver.com/main/read.nhn?mode=LSD&mid=shm&sid1=101&oid=028&aid=0002319104&cid=428288	6는 고용보험 가입안돼특별고용지원업종 지정해도실업급여 아무런 혜택 못받아이민선가명53씨는 2010년 자신이 사무직으로 평생 몸담았던 회사가 부도가 났다. 법정관리 절차에 들어간 회사는 퇴직을 권고했다. 50살 가까운 사람을 사무직으로 써줄 회사는 없었다. 2013년 우연히 조선업 생산직 노동자를 구한다는 지하철 광고를 봤다. 이씨는 건강진단을 받고 거제 대우조선해양 옥포조선소로 내려갔다. 생산직으로만 알고 일을 시작했는데 나중에 알고 보니 물량팀하청업체에서 다시 재하청을 받는 계약직 노동자이었다. 근로계약서를 작성했는지도 가물가물하지만 고용보험에 들지 않은 것은 확실하다. 당시 물량팀장은 세금 다 내다가는 남는 게 없다고 딱 잘라 거절했다. 정 원하면 회사 보험료까지 저보고 내라고 하더라고요. 이는 이씨가 실직을 해도 실업급여구직급여를 전혀 받을 수 없다는 의미다.  조선업 구조조정이 급물살을 타면서 현대중공업이 생산직 노동자들에 대해 사상 처음으로 희망퇴직을 실시하는 등 인력 감축 움직임도 본격화하고 있다. 특히 하청업체의 비정규직 노동자들은 구조조정 1순위로 꼽힌다. 하지만 이들 중 상당수는 고용보험에 가입조차 돼 있지 않아 실업급여조차 탈 수가 없다. 중국의 추격 빠른 기술 변화 저성장 등으로 일자리 구조조정에 대한 불안은 점점 커져가고 있지만 고용안전망은 여전히 허술하고 사각지대가 많아 노동자에 대한 기본적 보호 역할도 못하고 있다는 지적이 나온다.  재하청 노동자 가장 먼저 잘리지만 안전망은 전무 원청과는 구두로 도급계약을 맺는다. 업무 내용 기간 설정은 따로 없고 블록 단가만 책정해서 일을 시작한다. 단가가 안 맞거나 공정을 못 맞출 때는 떠나야 한다.물량팀 노동자44 구조조정이 어마어마하게 일어난다. 급해서 썼던 사람들이라 자기 맘에 안 들면 잘라낸다. 근로계약서를 작성하지 않았기 때문에 그냥 그만두는 거다. 고용안정이 어디 있느냐 낭떠러지 위에서 밧줄 위에 서 있는 거다.물량팀 노동자42 조선업 물량팀 노동자들이 전하는 고용 불안이다. 밧줄 위에 서 있지만 떨어질 경우 받쳐줄 그물은 없다. 이민선씨는 물량팀에 있고 싶지 않다고 했다. 4대 사회보험도 내고 실업급여도 퇴직금도 받을 수 있는 1차 하청업체의 정규직 노동자로 정년 때까지 일하고 싶다고 했다. 2015년 고용형태별 근로실태조사를 보면 정규직의 고용보험 가입률은 95. 특히 단기간 노동자65와 일일 노동자46는 더욱 낮은 편이다. 조선업종의 특수한 비정규직 형태인 물량팀의 하청노동자가 여기 속한다.항상 불안낭떠러지에서 밧줄 잡고 서 있어근로계약서 없고 구두계약물량팀에 있고 싶지 않다고용보험 가입해도 6개월 후 혜택  조선업 노동인력은 원청 정규직으로부터 시작해 1차 하청업체 상용직기간제단기계약직을 거쳐 23차 하청업체인 물량팀으로 이어진다. 물량팀은 1020명씩 팀을 짜는데 계약 기간은 보통 3개월이다. 재계약이 없으면 그냥 퇴출이다. 실제로 현대중공업에서만 지난 16개월간 하청노동자 8490명이 일자리를 잃었다. 더 큰 문제는 물량팀 하청노동자 절반 가까이가 고용보험에 가입돼 있지 않다는 사실이다. 민주노총 금속노조가 물량팀 하청노동자 489명을 설문조사해 펴낸 2015년 조선업종 물량팀 노동조건실태 연구를 보면 4대 사회보험고용보험 건강보험 국민연금 산재보험에 가입돼 있다고 응답한 노동자는 61. 2014년 민주노총 경남지부가 발표한 거제통영고성 중소 조선소 비정규직 노동자 실태조사에서도 고용보험에 가입한 물량팀 노동자는 54. 정부는 현재 조선업을 특별고용지원업종으로 지정해 지원하는 방안을 검토하고 있지만 이 대책 또한 하청노동자들은 비켜갈 가능성이 크다. 특별고용지원업종으로 지정되면 정부는 고용유지지원금 특별연장급여 전직재취업 등을 확대 지원한다. 90240일 지급되는 실업급여는 120270일로 늘어나고 지급 수준도 실직 전 평균 임금의 50에서 60로 올린다. 지원 기간은 1년 이내로 결정되지만 그 후에도 상황이 나아지지 않으면 기간 연장을 신청할 수 있다. 그러나 고용보험 가입 노동자라는 단서 조항이 붙어 있다. 조선업이 특별고용지원업종으로 지정되더라도 물량팀 노동자 2명 중 1명은 아무런 혜택을 받지 못한다는 것이다. 일자리를 잃을 위험이 가장 높고 생계 지원이 가장 절실한 계층이 오히려 정부의 특별지원에서 빠지는 것이다.  넓은 고용보험 사각지대  1995년 고용보험이 처음 도입되면서 실업급여 제도 등 고용안전망의 제도적 틀은 갖춘 상태다. 하지만 문제는 법적실질적 사각지대가 너무 넓어 실제 실직 뒤 고용보험 혜택을 못 받는 노동자가 너무 많다는 것이다. 가장 큰 법적 사각지대는 자영업자다. 2015년 3월 현재 취업자 2550만명 가운데 자영업자는 670만명. 이들은 고용보험의 혜택을 받지 못한다. 고용보험은 기본적으로 임금노동자1880만명를 적용 대상으로 하기 때문이다. 임금노동자 중에서도 고용보험 가입 비율은 641204만명에 그친다. 공무원 등 비적용 직종140만명과 특수형태 근로자55만명 65살 이상93만명 1개월 근로시간이 60시간주간 15시간 미만인 노동자117만명는 법적으로 적용 대상에서 제외된다. 나머지 280만명은 사업주나 노동자가 보험료가 부담스러워 고용보험 가입을 하지 않은 경우다. 결국 고용보험 가입자는 전체 취업자의 47. 특히 고용보험 가입률은 임시일용직일수록 소득이 낮을수록 낮은데 이들은 고용 상태마저 불안정하다. 상용직의 실직 경험률은 4.3로 낮지만 임시직은 16 일용직은 31.  자발적 이직자는 못 받아  고용보험에 가입했더라도 실업급여를 받으려면 지난 18개월 적용 대상 기간 중 180일 이상 피보험자로 고용보험료를 납부한 실적이 있어야 한다. 대우조선해양 노조가 최근 하청노동자의 고용보험 가입을 독려하고 있지만 이들이 특별고용지원업종 지정의 혜택을 받을 수 있을지는 미지수인 이유다. 피보험기간을 충족하더라도 회사를 자발적으로 떠났다면 또 실업급여를 받지 못한다. 이 기준에 따르면 삼성중공업 사내하청업체인 성우기업에서 일하다가 지난 11일 목숨을 끊은 정현우가명38씨도 실업급여 대상이 될 수 없다. 회사의 인사명령에 불만을 나타내며 스스로 사표를 냈기 때문이다. 정씨는 지난 9일 회사 조직 개편으로 물량팀으로 옮기라는 통보를 받았다. 병역특례로 조선소 하청업체에 입사해 25살에 반장이 됐을 정도로 실력을 인정받은 정씨는 모욕감을 느꼈다. 정씨는 사표를 내고 20년간 일해온 일터를 떠났고 다음날 숨진 채 발견됐다. 까다로운 수급자격 요건 탓에 고용보험 가입자였다가 실업자가 돼도 실업급여를 받는 비율은 20에 그친다.  노동시장 외부자 보호해야  거제통영고성 조선소 하청노동자 살리기 대책위원회 이김춘택 정책홍보팀장은 기존의 고용보험제도를 고집해서는 조선업 대량 해고 사태를 해결할 수 없을 것이라고 말했다. 방하남 한국노동연구원 원장은 남재욱 연세대 박사과정과 함께 발표한 고용보험의 사각지대와 정책과제에 관한 연구에서 제도 외부에 존재하는 구직자를 보호할 실업부조 제도 도입을 심각하게 고려할 필요가 있다고 지적했다. 이병희 한국노동연구원 선임연구위원은 저소득 노동자에 대해 사회보험료를 지원하는 두루누리사업이 있지만 방대한 사각지대 규모에 비해 그 해소 효과는 제한적이라며 신규 가입자를 우대하는 방향으로 사업을 재설계하고 지원금을 높여야 한다고 제언했다
미세먼지 걱정에 산소캔 등 공기 상품 판매 '쑥쑥'	http://news.naver.com/main/read.nhn?mode=LSD&mid=shm&sid1=101&oid=214&aid=0000620885&cid=428288	최근 미세먼지 오염 때문에 공기와 관련된 상품들의 매출이 크게 늘었습니다.공기청정기는 말할 것도 없고 심지어 휴대용 산소캔까지 불티나게 팔리고 있습니다. 리포트 백화점에 진열된 스프레이 모양의 제품들.이렇게 가지고 다니면서 산소를 직접 들이마실 수 있는 휴대용 산소캔 제품의 판매량이 올해 들어 두 배 가까이 늘었습니다. 과거에는 주로 시험을 앞둔 수험생들이 많이 찾았지만 최근엔 연령대를 불문하고 맑은 공기를 마시려는 소비자들에게 인기입니다. 산소캔 제조업체 관계자환경이 더 나빠지니까 황사나 미세먼지로 고생하시는 분들이 가장 먼저 찾으시고요.하지만 산소가 21인 공기와 달리 산소 농도가 90가 넘기 때문에 너무 자주 들이마시면 산소 중독이나 과산소증 같은 부작용이 생길 수도 있습니다. 때문에 2초 이내로 하루 서너 차례만 사용하는 게 좋고 인화성 물질과 온도가 높은 곳은 피하는 게 좋습니다. 공기청정기 판매는 황사철 이후에도 계속 늘어 5월 판매량이 작년의 두 배를 넘어섰습니다.최지원환기를 안 시키고 그냥 공기청정기 돌리는 게 오히려 더 낫겠다는 생각도 많이 들고요.50여 개 국내 업체와 15개 수입 브랜드가 경쟁하고 있는데 기능별로 인증 마크가 다른 점은 주의해야 합니다
성형외과 '특허 시술' 홍보… 알고 보니 대부분 눈속임	http://news.naver.com/main/read.nhn?mode=LSD&mid=shm&sid1=102&oid=022&aid=0003057061	밀착취재 서울강남 등 25곳 조사  상표권서비스권 특허 둔갑 특허 인정받은 곳 5곳 불과특허받은 XX성형외과만의 눈성형 OO에서만 만나볼 수 있는 특허받은 수술 볼륨과 탄력 긴 지속기간으로 특허받은 필러주름 부위에 넣는 의료기기.서울 강남을 중심으로 성형외과 간 경쟁이 치열해지면서 특허 시술법을 앞세워 고객을 유인하려는 병원이 늘고 있다.특허를 내세워 선전 중인 성형외과 홍보물 중 일부. 인터넷화면 캡처그러나 해당 병원 중 실제 특허권을 보유한 곳은 드물었다. 상당수가 단순히 명칭에 대한 권리인 상표권서비스권을 시술법에 대한 특허로 과대 포장하거나 특허 인정조차 못 받고 있는 것으로 파악됐다. 불법 특허 성형 홍보가 판치고 있는 셈이다.22일 세계일보가 최근 인터넷 홈페이지 등을 통해 특허 홍보를 하고 있는 서울지역 성형외과 25곳을 골라 확인한 결과에 따르면 홍보 내용처럼 특허를 인정받고 있는 병원은 5곳20에 그쳤다. 나머지 20곳 가운데 17곳은 특허가 없는 병원이었다. 또 3곳은 특허 출원 번호를 공개하지 않거나 확인 요청을 거부해 특허보유 여부를 알 수 없었다.특허가 없는 병원 중 10곳은 상표권상품 명칭에 대한 권리을 4곳은 서비스권상호 명칭에 대한 권리을 특허권으로 둔갑시켜 홍보했다.일례로 OOO아이eye XXXXX 인중축소술 등의 이름으로 상표권을 등록한 뒤 OOO아이 특허완료 XXXXX 인중축소술 특허등록이라고 알리는 식이다. 나머지 3곳은 특허 출원을 했다가 등록이 거부되거나 등록비를 내지 않아 소멸됐음에도 특허를 보유 중인 것처럼 소개했다.강남구 A성형외과는 2년 전에 특허 출원이 거절된 필러를 특허받은 필러라고 버젓이 선전했다.인근의 B성형외과도 2003년 출원한 입 부위 관련 시술 특허권이 현재 등록료 불납으로 소멸처리됐지만 해당 특허증을 내걸고 영업 중이다. 이 같은 홍보는 모두 불법이다.특허법 224 228조는 특허 허위표시를 금지하고 위반한 경우 3년 이하의 징역 또는 2000만원 이하의 벌금에 처한다고 규정하고 있다. 특허청은 지난해 12월 지식재산권 허위표시 신고센터를 설치해 관련 신고를 받고 있다
"내 선물되돌려준데 앙심"…女아이돌 피습에 일본사회 충격	http://news.naver.com/main/read.nhn?mode=LSD&mid=shm&sid1=104&oid=001&aid=0008419815	도미타 씨 피습 사건 현장의 21일 모습교도     도쿄 조준형 특파원  여성 아이돌 가수가 행사장 앞에서 남성팬의 무차별적인 흉기 공격을 받아 중태에 빠진 사건이 일본사회에 충격을 주고 있다.       대학생으로서 학업과 가수 및 연기자 활동을 병행해온 도미타 마유20 씨는 21일 오후 5시께 도쿄 고가네이 시의 한 라이브 공연장이 있는 건물 부지 안에서 27세 남성이 휘두른 흉기에 목 가슴 등 20곳 이상을 찔렸다.      현장에서 체포된 용의자 I 씨는 경찰에서 도미타 씨에게 선물을 보냈으나 되돌아왔다. 사건 현장에서 이에 대해 물었으나 애매한 답변을 해 화가 나서 몇 번이고 찔렀다며 죽일 생각이었다고 진술했다고 교도통신이 22일 보도했다.     피해자 도미타 씨는 유명 스타는 아니지만 시크릿 걸스라는 그룹에서 활동하며 라이브 콘서트 뮤지컬 공연 등을 몇 년간 해왔다. 최근에는 싱어송라이터로 활동하려는 꿈을 키워온 것으로 전해졌다.      이번 사건 이전에 도미타 씨는 블로그나 트위터에 집요하게 글을 올리고 있다며 경찰서에 용의자의 이름을 알리고 상담까지 했던 것으로 파악돼 안타까움을 더하고 있다. 용의자는 도미타의 SNS에 선물을 받아주지 않은데 대한 분노를 담은 글을 올렸던 것으로 나타났다.     사건 당일 도미타가 참석하는 이벤트에 대해 전해 들은 경찰 당국은 관할 고가네이 경찰서에 도미타 씨로부터 신고 전화가 있으면 대응해달라고 의뢰했다. 그러나 도미타의 전화가 없었기에 고가네이 경찰서는 현장에 신변 보호를 맡을 경찰관을 파견하지 않았던 것으로 파악됐다. 피해자 도미타 마유 씨교도 .자료사진     일본 경시청은 이 같은 대응의 적절성에 대해서도 조사할 예정이다.     NHK의 취재에 응한 스토커 피해 상담 비영리기구 이사장 고바야카와 아키코 씨는 이전에 비해 팬과 아이돌 사이의 거리가 가까워진 상황에서 불특정 다수의 사람과 접할 기회가 있는 행사장은 표적이 되기 가장 쉬운 곳이기에 특히 위험하다며 이번처럼 인터넷 등에서 전조가 있는 경우에는 주위에서 협력하여 막을 필요가 있다고 지적했다.     앞서 2014년에는 이와테현에서 열린 일본 최고 인기 아이돌 그룹 AKB48 멤버들의 악수회 때 멤버 2명과 스태프 1명이 톱을 가진 남성에게 공격당해 부상한 사건이 있었다
브렉시트 국민투표 한 달 앞…'문제는 경제'	http://news.naver.com/main/read.nhn?mode=LSD&mid=shm&sid1=104&oid=032&aid=0002700884	유럽연합EU을 떠났다가는 집값이 폭락할 수 있다.브렉시트가 영국 경제에 재앙을 불러온다는 건 거짓말이다.영국에서 때 아닌 피노키오 논란이 벌어졌다. 조지 오스본 재무장관이 21일현지시간 BBC 인터뷰에서 영국이 EU를 떠나면 집값이 최고 18 폭락할 수 있다고 한 것이 발단이었다. 오스본은 주택담보대출 금리가 오르고 대출받기가 어려워지면 생애 처음으로 집을 사려는 이들이 타격을 받을 것이라고 했다. 그러자 브렉시트 찬성파인 이언 던컨 스미스 전 내각장관은 오스본은 피노키오라며 영국 경제가 브렉시트 쇼크에 빠진다는 주장은 거짓말이라고 맞섰다.EU에서 탈퇴할지를 묻는 영국 브렉시트 국민투표가 한 달 앞으로 다가왔다. 최근 여론조사에서는 EU에 남아야 한다는 의견이 탈퇴 의견보다 조금 높았지만 최종 결과를 확신할 수는 없다. 다음달 23일 국민투표를 앞두고 양측은 열띤 캠페인을 벌이고 있다. 가장 중요한 쟁점은 역시 경제다.오스본의 발언에서 보듯 EU에 남아야 한다는 쪽에서는 EU 탈퇴가 영국 경제에 큰 타격을 줄 것이라고 경고한다. 국제기구들과 금융기관도 일제히 브렉시트 충격을 거론한다. 국제통화기금IMF은 최근 내놓은 영국 경제 전망 보고서에서 브렉시트로 집값이 급락할 것이라 진단했다. 영란은행BOE도 불확실성이 지속되면 파운드화와 금융자산 가치 하락에 이어 부동산 등 실물자산 가치도 하락할 수 있다고 분석했다. 잔류론자들은 영국에서 금융기관들이 빠져나가고 무역도 위축될 것이라 겁을 준다. 실제로 영국은 각국과 자유무역협정FTA을 새로 맺어야 하며 그로 인한 혼란과 비용을 감수해야 한다. 독일 싱크탱크 베텔스만은 브렉시트가 현실화할 경우 2030년까지 영국이 국내총생산GDP의 14인 3130억유로약 417조원의 손해를 볼 것으로 예상했다. 브렉시트 찬성파는 이민자 정책을 걸고넘어진다. 이민자들이 영국인 일자리를 빼앗는데 이를 EU가 합법적으로 보장해 주고 있다는 것이다. 탈퇴에 투표를Vote Leave 캠페인을 이끄는 매튜 엘리엇은 집값이 오르는 것은 이민자들이 늘어 집이 모자란 탓이라며 EU를 떠난다고 해서 대출이 영향을 받지는 않을 것 같다고 주장했다. 안드레아 리드섬 에너지장관도 가장 큰 경제 위협은 불안정한 유로화라며 탈퇴 의견에 힘을 실었다. 국제신용평가사 무디스도 이민자를 억제하면 집값과 월세 상승 속도가 낮아질 것으로 내다봤다. 탈퇴론자인 마이클 고브 법무장관은 2030년까지 이민자가 200만500만명 들어올 것이라고 주장했다. 지난 19일 파이낸셜타임스는 7개 기관이 실시한 여론조사를 종합해 잔류 의견47이 탈퇴 의견40보다 7포인트 앞선다고 보도했다. 지난 1719일 여론조사업체 오피니엄 조사에서는 잔류44가 탈퇴40보다 조금 높았으나 아직 모르겠다는 응답이 16에 달했다. 베네딕트 컴버배치도 브렉시트 반대영국 문화계 유력 인사 280여명이 브렉시트에 반대하고 나섰다. 20일현지시간 영국 배우 베네딕트 컴버배치가운데 사진 헬레나 본햄 카터 키라 나이틀리오른쪽 주드 로왼쪽 싱어송라이터 팔로마 페이스 영화 슬럼독 밀리어네어의 감독 대니 보일 등 282명은 일간지 가디언을 통해 영국이 유럽연합EU에 남아야 한다는 내용의 공개 서한을 발표했다. 배우 영화감독 가수 연극인과 보석공예가 등 영국의 문화예술계 인사들이 대거 서한에 이름을 올렸다.키라 나이틀리 베네딕트 컴버배치 주드 로왼쪽부터. BBC이들은 서한에서 작은 갤러리부터 블록버스터 영화까지 EU의 재정 지원이나 국경 없는 협업이 없었다면 불가능했을 작업에 참여해 왔다며 영국이 EU를 탈퇴한다면 세계에서 이룬 창의적인 성공이 약화될 것이라고 주장했다. 이들은 셰익스피어 데이비드 보위 등 영국의 창조성은 세계에 영향을 끼쳐 왔다며 영국이 유럽에 속해 있어야만 세계 무대를 주도할 수 있을 것이라고 덧붙였다. 이번 서한은 브렉시트에 반대하는 유럽 안에서 더 강한 영국 캠페인 측이 함께 기획했다
"야근수당 달라" 요구했더니…해고에 협박까지	http://news.naver.com/main/read.nhn?mode=LSD&mid=shm&sid1=102&oid=055&aid=0000411011	정부가 얼마 전 열정 페이 즉 열정을 빌미로 한 저임금 노동을 뿌리 뽑겠다고 공언했는데 일부 고용주들의 태도는 여전히 안하무인입니다.한 유명 커피숍에서는 아르바이트생이 야근수당을 요구하자 해고에 협박까지 서슴지 않았습니다.기자강남 한복판에 있는 대형 프랜차이즈 커피숍.24시간 영업인데 근로기준법대로라면 밤에 일하는 근무자들은 분명히 시급을 주간보다 더 받아야 합니다.지금 시간이 밤 9시 59분 그리고 이제 밤 10시가 됐습니다.밤 10시부터는 일을 하고 있는 근로자들의 수당을 평소보다 1.5배 이상 더 줘야 합니다.그런데 이 커피숍에서 일했던 이 아르바이트생은 밤에 일하고도 야근수당을 한 푼도 받지 못했습니다.이 모 씨유명 프랜차이즈 커피숍 아르바이트생  오후 5시부터 11시 반까지 했어요. 밤 10시부터가 야근이니까 1시간 반 동안 야간 근무를 한 거죠. 그런데 실제 월급은 그냥 주간 시급으로 6100원 받았어요.일 한 지 4개월이 지나서야 사장에게 야근수당을 요구해봤지만 돌아온 건 해고 통지였습니다.커피숍 사장 실제 통화 내용 야근수당 미지급건에 대해서는 알아서 고소하실 건 고소하시고요. 저희 쪽에선 CCTV 다 돌려서 혹시라도 음료를 드셨거나 이런 거는 월급에서 다 제해가지고 처리 하겠습니다. 그리고 이번 주부터는 나오지 마십쇼.며칠 뒤 다시 걸려온 사장의 전화.커피숍 사장 실제 통화 내용 저희 쪽에서 지금 CCTV 다 체크를 했는데 이XX 씨가 음료 마시고 이런 절도 부분이 있어요. 이런 부분 알아서 저희가 소송을 넣겠습니다.저는 진짜 빨대 한 개 가져온 게 없거든요 정말로. CCTV 얘기를 하면 아르바이트 생들이 되게 압박을 받는다고 생각을 하나 봐요.이 씨는 노동청에 진정을 넣었고 사장은 그제서야 밀린 야근수당을 지급했습니다.사장이 떼먹으려 했던 야근수당은 겨우 13만 원.제가 재수 없었다 생각하고 안 받으면 되는 돈이지만 아르바이트생으로서 권리를 찾아야 할 거 같아서 진정을 넣었습니다. 아르바이트라고 너무 무시 받았던 것 같아요.청년단체인 알바 노조가 지난달 서울과 경기도의 아르바이트생 야근수당 실태를 조사한 결과 제대로 지급하는 업소는 절반밖에 되지 않았습니다.최기원알바노조 대변인  임금을 체납해도 처벌받지 않는다는 게 중요한 것 같아요. 국가가 아르바이트생을 보호해 주지 않기 때문에 체납 업주들은 이 정도 금액을 주어도 특별한 문제 제기를 받은 적이 없었던 것이죠.정부가 열정페이를 근절하겠다고 발표했지만 아직 갈 길은 멀어보입니다
