'열풍'에 갇힌 한반도, 8월 중순까지 폭염 이어질 듯	http://news.naver.com/main/read.nhn?oid=437&sid1=103&aid=0000127766&mid=shm&mode=LSD&nh=20160806210923	올 여름처럼 더웠던 기억이 별로 없다 요즘 이런 얘기 많이들 하시죠. 특히 올 여름은 서울 경기 지역이 유난히 더운데요.구혜진 기자가 지금부터 그 이유를 설명해드리겠습니다.기자올해 폭염이 계속되는 이유는 한반도 주변 곳곳에서 불어오는 뜨거운 공기 때문입니다.먼저 북쪽에서는 이상고온 현상이 벌어지고 있는 중국 북부의 뜨거운 공기가 우리나라 쪽으로 내려오고 있습니다.남쪽에서는 북태평양 고기압이 확장되며 덥고 습한 열기가 밀려오고 있습니다.이 뜨거운 두 공기가 한반도에 머물면서 각각 대기의 상층과 하층을 이루고 있는 겁니다.또 이처럼 대기가 안정되면서 햇볕을 가려주는 구름이 줄어 땡볕 더위가 이어지고 있습니다.여기에 동해안에서 밀려오는 동풍이 태백산맥을 지나며 데워지는 푄 현상까지 가세하면서 서울 등 중부지방이 대구 못지 않은 폭염을 겪고 있는 겁니다.이런 상황은 8월 중순까지 해소되지 않을 것으로 보입니다.비슷한 기압 배치가 계속되겠고 이를 뒤흔들 강력한 태풍도 없기 때문입니다.지난 3일 태평양 중심에서 발생한 제5호 태풍 오마이스는 일본 동쪽으로 지나가 우리나라에 거의 영향을 미치지 못할 것으로 보입니다.구혜진 JTBC 뉴스 공식 SNS 트위터 페이스북 유튜브Copyright by JTBChttpjtbc
이동통신 유료서비스, 고객 몰래 가입해 요금 '꿀꺽'	http://news.naver.com/main/read.nhn?oid=437&sid1=105&aid=0000127788&mid=shm&mode=LSD&nh=20160806212847	휴대전화 사용 요금서 평소에 꼼꼼하게 확인하고 계신가요 소비자들 몰래 유료 부가서비스에 가입시켜 이용 요금을 뜯어가는 일이 있다니까 조심하셔야겠습니다.기자지난해 휴대전화기를 바꾼 박모 씨는 3가지 유료 부가서비스에 가입돼 요금을 내왔다는 사실을 지난달에야 알았습니다.이동통신사는 많게는 한 달에 4500원씩 9개월 동안 모두 2만 3500원을 박 씨 계좌에서 빼갔습니다.박모 씨  부가서비스 안 한다고 하고 가입을 했는데 1000원짜리도 아니고 패키지가 들어가 있으니까 어이가 없죠.휴대전화 가입 시에 박 씨처럼 계약 내용을 제대로 설명받지 못했다는 신고는 지난해에만 100건을 넘었습니다.특히 부가서비스 가입의 경우엔 서비스당 요금이 1000원 안팎의 소액이다보니 소비자들이 끝내 모른 채 넘어가는 일도 많습니다.이동통신사는 이런 소비자 피해는 판매점의 문제라고 말합니다.통신사 관계자  단말기유통구조개선법 이전 같은 경우는 부가서비스 가입 유치건당 인센티브 형태로 성과급 지급을 했던 걸로 알고 있어요. 하지만 단통법 이후에는 아예 없고.하지만 일선 판매점 얘기는 다릅니다.판매점 관계자  통신사에서 부가서비스 가입을 하라고 시키는 건가요 예 그렇죠. 통신사에서 저희 쪽 실적이나 이런 것 때문에 들어가는 것 같아요.방송통신위원회는 원하지 않는 서비스 가입으로 손해를 입었다면 피해금액의 3배 이상을 보상받을 수 있다고 밝혔습니다.문현경 JTBC 뉴스 공식 SNS 트위터 페이스북 유튜브Copyright by JTBChttpjtbc
전력수요 급증에도 개문냉방… 정부는 '뒷짐'	http://news.naver.com/main/read.nhn?oid=422&sid1=102&aid=0000207352&mid=shm&mode=LSD&nh=20160806203754	전력수요 급증에도 개문냉방 정부는 뒷짐20앵커 최악의 폭염이 이어지면서 전력 수요가 급증하고 있습니다. 그럴수록 에너지 절약이 필요할텐데 문을 열어 놓은 채 냉방기를 가동하는 개문 냉방이 여전합니다. 정부는 전력 예비율이 넉넉하다며 태연한 모습입니다.기자상가가 밀집해 있는 서울 명동 거리입니다.문을 열어놓은 채 에어컨을 켜놓은 이른바 개문냉방을 하는 점포가 곳곳에서 눈에 띕니다.화장품 가게 스무 곳 가량이 한자리에 몰려 있지만 문을 닫아놓은 곳은 거의 없습니다.상점들이 개문냉방을 하는 이유는 매출 때문입니다. 명동 상인 아무래도 사람이 문을 열어 놨을 때는 더 자유롭잖아요. 문을 열고 들어가려면 조금사면 덜 미안한데 안 사거나 그러면개문냉방은 실외의 뜨거운 공기가 계속해서 실내로 유입되기 때문에 문을 닫았을 때보다 최고 4배나 더 많은 전력이 소요돼 전력 낭비의 대표적 사례입니다.과거 지방자치단체들이 단속을 벌여 점차 개문냉방이 사라지는 추세였지만 올해는 사정이 다릅니다.법적으로 산업통상자원부가 에너지 사용 제한 공고를 내려야 지자체가 단속할 수 있는데 올해는 전력 예비율이 높다며 아무런 공고를 하지 않아 단속이 이뤄지지 않고 있는 것입니다.앞으로 에너지 예비율이 한자리수로 떨어진다고 해도 예비발전소 가동 등 에너지 수급에 지장이 없다는 것이 정부의 입장입니다. 경제 활성화도 단속 대신 계도를 택한 이유 중 하나입니다
밤낮 가리지 않는 매미 울음소리, 그 이유는 도시화?	http://news.naver.com/main/read.nhn?oid=214&sid1=102&aid=0000655976&mid=shm&mode=LSD&nh=20160806205018	한여름의 정취를 더하기도 하지만 떼로 울어대기 시작하면 이런 소음도 없습니다.그런데 이렇게 생김새가 조금씩 다른 것처럼 울음소리도 이렇게 좀 다른데요.밤까지 울어대는 그 이유도 제각각이라고 합니다. 리포트 서울의 한 아파트단지.해가 지고 나서도 짝을 찾는 매미 소리가 좀처럼 줄지 않습니다.주택가 소음기준을 넘어 지하철을 탔을 때 듣는 소음만큼 시끄럽습니다.한밤중에도 울어대는 통에 수면을 방해하는 골칫덩이 취급도 받습니다. 황희윤 한 12시에 자는데 그때에도 시끄러워서 잠이 잘 안 와요.이렇게 도심 매미가 밤에도 울어대는 건 종류마다 이유가 다르다는 조사결과가 나왔습니다.먼저 리듬 있는 울음소리가 정겨운 참매미.도심과 산속 참매미 우는 시간을 비교한 결과 조명이 환한 도심 참매미는 새벽까지 우는 반면 산 속 참매미는 저녁 7시 깜깜해지면 울음을 뚝 그쳤습니다.결국 도심 참매미가 한밤에도 우는 건 도시의 빛 공해에 노출됐기 때문이었던 겁니다.이번엔 참매미 소리보다 시끄럽고 드센 말매미.아열대 외래종답게 기온에 민감했는데 밤에도 24도에서 30도 사이면 크게 울었습니다. 열섬현상까지 가중돼 열대야가 잦은 대도시에선 밤새도록 운다는 얘깁니다기경석상지대 원예조경학과 교수온도가 높았을 때 근육이 활성화되기 때문에 열대야 경보가 울렸을 때 야간에 말매미가 울 가능성이 높은 거죠
美 신의 가호보다 총의 보호? 교회도 '무장경호'	http://news.naver.com/main/read.nhn?oid=214&sid1=104&aid=0000655979&mid=shm&mode=LSD&nh=20160806212006	미국의 한 교회에서 총기 공격에 대비해 교인들에게 총 쏘는 법을 가르쳐서 예배시간에 경호원으로 배치하고 있습니다. 과연 이렇게까지 하는 게 옳은지 의견이 분분하지만 확산되는 분위기입니다.  리포트 주일예배가 한창인 미국의 한 교회. 두 손을 높이 들고 평화를 간구합니다.  배지와 총을 찬 채 예배를 지켜보고 있는 이 남자는 이 교회 교인입니다. 이 교회는 만약에 있을지 모를 총기 공격에 대비해 일부 교인들에게 총격술과 무술을 가르치고 있습니다.  교관으로는 네이비 실 전직 특수부대원이 고용돼 적을 제압하는 법을 집중적으로 가르칩니다. 훈련을 마친 교인들은 장전한 채 예배시간에 배치됩니다. 교인총 든 사람이 지켜주니 훨씬 안전하게 느껴지네요.지난해 사우스캐롤라이나의 한 유서깊은 교회에서 총기 난사로 성경공부 중이던 9명이 숨지는 등 교회 총기사고가 잇따른 데 대한 교회 차원의 대책입니다. 교회에서까지 총 쏘는 법을 가르쳐야 하는가에 대해서는 의견이 엇갈립니다. 샌디 필립총기 희생자 어머니모든 사람이 총을 들고 다니게 할 건가요 혼돈에 빠지는 건 순간입니다.빈스 헨맨교회 경호팀아무 일도 없다면 좋죠
단속 비웃는 무허가 수상레저업체 '기승'	http://news.naver.com/main/read.nhn?oid=448&sid1=102&aid=0000174760&mid=shm&mode=LSD&nh=20160806200431	요즘같은 무더위에는 시원하게 물살을 가르는 수상레저 스포츠가 제격인데요 하지만 한 철 장사를 노린 무허가 업체들이 기승을 부리고 있습니다. 술까지 몰래 팔면서 불법 영업을 하고 있지만 단속기관은 손을 놓고 있습니다. 이건 디스코 팡팡 7인까지 탈 수 있는.  피서철 반짝 대목을 노린 무허가 수상레저 업체입니다. 통로에는 폭발과 화재 위험이 높은 기름통이 널려 있고 아이스박스 속에 술까지 숨겨 몰래 팔고 있습니다. 초보자는 6만원이고요 그 다음엔 2만원씩 무허가 업체 옆에는 불법 행위 금지를 알리는 경고 문구도 설치됐지만 무용지물입니다. 낙동강 하구를 따라 들어선 무허가 수상레저업체들이 불법으로 영업을 하고 있습니다. 이런 무허가 업체는 낙동강 하구에만 20여 곳. 단속해야할 자치단체는 인력과 장비 부족을 탓하며 손을 놓고 있습니다. 자치단체 관계자수상레저 면허 관리도 해 경이 가지고 있으니까 합동해야 제대로 단속할 수 있어서. 해경은 단속 관할권만 따집니다. 해경 관계자통상적으로 저희가 기관별로 관할을 나누잖아요. 바다쪽은 저희가 하고 내수면쪽은 지자체가 하죠. 무허가 업체에서 수상레저를 하다 사고가 나면 보험 처리가 안되며 119 구조대가 정확한 위치를 파악하기도 어려워 인명피해도 우려됩니다
