미세먼지 황사철 수준까지 치솟아도… 예보는 줄곧 '보통'	http://news.naver.com/main/read.nhn?oid=022&sid1=103&aid=0003085294&mid=shm&mode=LSD&nh=20160810191737	환경당국 예경보 체계 또 허점10일 오전 서울 광진구의 미세먼지PM10 농도가 222까지 치솟았다. 습한 여름에 미세먼지 농도가 황사철 수준으로 올라가는 것은 극히 이례적인 일이다.하지만 이날 미세먼지 예보는 줄곧 보통에 머물러 또다시 예보 체계의 허점을 드러냈다. 무방비 상태에서 미세먼지를 들이마시며 출근길에 나선 시민들은 새벽부터 미세먼지 농도가 100를 넘어갔는데 정부나 지자체는 일언반구도 없다며 분통을 터뜨렸다.환경부의 대기오염 정보 사이트인 에어코리아에 따르면 이날 광진구의 미세먼지 농도가 오전 1시12시 시간평균 144를 시작으로 계속 올라 6시에는 222를 찍었다. 미세먼지 연평균 기준치50 이하를 네 배 넘는 수치다. 미세먼지는 오전 내내 나쁨 이상시간당 81150면 나쁨 151 이상이면 매우 나쁨 단계를 유지하다 낮 12시가 지나서야 보통으로 떨어졌다. 클릭하면 큰 그림으로 볼 수 있습니다.이날 오전 미세먼지가 나쁨 수준을 보인 곳은 광진구만이 아니다. 서울 25개 자치구 가운데 24곳이 시간당 80를 넘겼다. 인천208 전남204 경기166도 오전 한때 미세먼지 농도가 치솟았다.국립환경과학원 측은 전날 동풍이 불어 먼지가 서해상으로 빠져나갔다가 다시 편서풍을 타고 수도권 등 한반도 서쪽으로 유입된 데다 오늘 새벽 대기가 정체돼 순간적으로 농도가 올라간 것으로 보인다고 분석했다. 여름에는 대기순환이 빠르고 비가 자주 와 평균 미세먼지 농도가 3040로 일년 중 가장 낮다. 이날 미세먼지 농도가 비정상적으로 치솟는 동안 예보와 경보는 깜깜이였다. 환경과학원은 9일 오후 5시와 11시 10일 오전 5시와 11시 네 차례 모두 10일 미세먼지 상태를 보통 혹은 좋음으로 예보했다. 대기 확산이 원활하여 대체로 청정한 대기상태를 나타낼 것으로 예상된다는 분석문도 함께 실렸다. 환경과학원 관계자는 미세먼지는 일 단위 예보를 하기 때문에 하루 평균치를 두고 예보 등급을 매긴다며 한두 시간 높다고 나쁨으로 예보하지는 않는다고 전했다. 현실과 동떨어진 예보 탓에 시민들은 미세먼지를 그대로 뒤집어쓸 수밖에 없었다.직장인 이은혁39가명씨는 출근길에 공기가 너무 탁해서 포털사이트로 실시간 농도를 보니 152라고 빨갛게 떠 깜짝 놀랐다며 어젯밤 텔레비전 일기예보에서는 오늘 미세먼지가 보통이라고 했는데 황당했다고 말했다. 지난 4월에는 기상청의 황사 예보가 엇나가 환경과학원의 미세먼지 예보까지 오보로 이어지면서 칸막이 행정 논란이 일었다. 올 초에는 환경부 자체조사 결과 미세먼지 예보 10건 중 4건은 틀린 것으로 나타나기도 했다. 이날 경보 시스템도 침묵했다. 광진관악마포양천용산구는 미세먼지 시간평균 농도가 150 이상인 상태가 2시간 지속돼 주의보 기준에 도달했지만 실제 발령되지는 않았다. 미세먼지 경보는 권역별로 발표되는데 서울은 1개 권역으로 묶여 시 전체 평균 농도가 기준치를 넘어야 하기 때문이다
벌써 "고장·불편철"…인천지하철 2호선 타보니	http://news.naver.com/main/read.nhn?oid=437&sid1=103&aid=0000128185&mid=shm&mode=LSD&nh=20160810223634	기관사 없이 자동으로 움직이는 최첨단 지하철 인천지하철 2호선이 지난 달 개통했습니다. 하지만 개통 이후 벌써 9건의 사고가 발생하면서 시민들은 걱정입니다. 게다가 시설 중에서 이용이 불편한 것도 한두가지가 아니라고 하는데요 밀착카메라가 직접 타봤습니다.기자제가 서있는 곳은 인천지하철 2호선 검암역입니다. 지난달 30일 개통 이후 각종 사고가 끊이지 않고 있는데 개통 2주째로 접어든 지금의 상황은 어떤지 직접 타보겠습니다. 1분이 아까운 시민들에게 지하철 개통 자체는 도움이 됩니다.  강영일인천 만수동  어디까지 가세요 운서역까지요. 2호선이 괜찮은 것 같아요. 교통 시간이 단축된 것 같고.전동차의 맨 앞인데 창밖으로 외부 모습을 볼 수 있습니다. 무인 시스템이어서 앞에 기관실이 따로 없습니다. 또한 일반 열차에 비해 가로폭이 좁습니다. 객실 수도 2량밖에 되지 않아 맨 앞에서 맨 끝까지 한눈에 보입니다.무인 운전 방식으로 운영되는 인천지하철 2호선은 열차가 승강장에 도착하면 문도 자동으로 열립니다.하지만 전자동 시스템이 자칫 사고로 이어질 수 있습니다. 실제로 오늘 오전 11시 반쯤 독정역에서 유모차 바퀴가 전동차와 승강장 사이에 끼여 운행이 12분 동안 중단됐습니다.인천교통공사 관계자  끼이면 열렸다 닫혔다 세 번은 하거든요. 불안하니까 승객들이 문을 당기고 수동 강제 개방을 하고. 무인이라고 해서 그러셨던 것 같아요.일부 출입구도 논란이 되고 있습니다. 석남역 2번 출구 시민들이 까마득한 계단에 놀라 뒤돌아섭니다.박은경인천 부평동  이거 너무 심한데 여기 어떻게 올라가.직접 대합실에서 출구까지 계단을 이용해 올라가 봤습니다.2번 출구로 나오는데 1분 30초가 걸렸습니다. 올라오면서 세보니까 계단 개수가 130개가 넘습니다. 계단을 오르는 게 건강에 좋다고는 하는데 이 무더운 날씨에 이렇게 숨이 가쁠 수밖에 없습니다.인근 주민들은 당연히 불편을 호소합니다. 김용태인천 석남동  숨이 차서. 급했을 때 내려갔다가 헛디뎠을 때 답이 안 나온다고 봐요.이런 가파른 출입구는 서부여성회관역과 인천가좌역도 마찬가지입니다.가좌역 계단 높이는 무려 22m로 아파트 7층과 맞먹습니다. 출입구 폭이 좁고 경인고속도로 바로 옆에 있다 보니 에스컬레이터를 설치하지 못한 게 시민들의 불편을 초래한 겁니다.이런데도 지하철 개통에 맞춰 전격적으로 진행된 버스 노선 개편도 시민들의 혼란을 가중시키고 있습니다. 인천의 한 고등학교 앞에 있는 버스정류장입니다. 인천지하철 2호선이 개통하면서 버스 4개 노선은 이곳을 더이상 지나지 않습니다. 게다가 버스를 기다리는 시간도 늘어 지금 전광판을 보시면 도착예정시간이 나와 있는데 보통 10분 이상을 기다려야 다음 버스를 탈 수 있습니다.함미선인천 심곡동  버스가 1 2분마다 있었는데 10분 20분마다 있어서 너무 불편해. 전철 타려면 한참 걸어가야 해. 내려도 걸어가야 하고무엇보다 시민들을 불안하게 하는 건 인천 지하철 2호선의 잦은 사고입니다.  지난달 30일 개통 이후 열흘 남짓 동안 벌써 9건의 사고가 발생했습니다.시민 불안이 확산되자 인천시는 2호선에 대해 특별 점검을 벌이고 안전대책을 내놓겠다고 밝혔습니다.하지만 개통과 동시에 자라난 시민 불신을 말끔히 씻어낼 수 있을지는 미지수입니다.인천지하철 2호선은 사업비만 2조3000억원을 투입해 모두의 관심과 기대를 안고 출발했습니다. 개통 2주 째인 지금 사고에 대한 불안과 시설 이용에 대한 불편은 여전히 해결해야 할 과제입니다.박소연 JTBC 뉴스 공식 SNS 트위터 페이스북 유튜브Copyright by JTBChttpjtbc
"시간당 4500원 줄게" 솜방망이 처벌에 최저임금 비웃는..	http://news.naver.com/main/read.nhn?oid=018&sid1=102&aid=0003606622&mid=shm&mode=LSD&nh=20160810194016	작년 최저임금 미지급 919건 적발사법처리 19건 그쳐 적발시 미지급금 지급으로 해결 처벌강화로 법준수 유인 높여야 정부 처벌강화 추진 최저임금 미지급시 최대 2000만원 과태료 부과이데일리 이승현 기자 대학생 최모21여씨는 올해 편의점 아르바이트를 구하다 황당한 경험을 했다. 편의점 점주들이 홈페이지에 최저임금 준수를 명시해놓고 막상 면접에선 말이 달라졌기 때문이다. 한 곳은 면접에서 올해 최저임금인 시간당 6030원에 한참 못 미치는 시간당 4500원을 또다른 곳은 5200원을 제시했다.최 씨는 수습기간이라며 시간당 5200원을 주다가 일을 잘 한다며 보름만에 5500원으로 올려줬다며 마땅히 받아야 할 돈에 못 미치는 돈을 주고선 점주가 고마워하라고 생색내는 것도 어이없었다고 말했다. 심지어 대학에서조차 대놓고 최저임금법을 위반한다. C대 학생인 김모23여씨는 올해 겨울방학 근로장학생에 지원해 시급 5800원을 받고 일했다. 학교 측은 모집공고에 시급은 5800원이며 3월 1일부터 2016년 최저시급 기준 반영해 인상하겠다고 밝혔다. 김씨는  12월 두달 동안은 최저시급 미만의 급여를 받았지만 행정보조인 근로장학생은 업무가 수월한 점을 감안해 참고 일했다고 말했다. 최저임금은 국가가 근로자의 생활안정을 위해 최저 임금수준을 정하고 사용자에게 이를 지키도록 법최저임금법으로 강제하는 제도다. 전체 임금 노동자의 17. 주로 아르바이트 학생이나 영세자영업소 종업원들이다. 그러나 이마저도 못받는 최저임금 미만 근로자도 222만여명2015년 8월기준에 달한다최저임금 준수 확산을 위해선 사용자에 대한 처벌을 강화해 사용자로 하여금 법 준수 필요성을 각인시켜야 한다는 지적이 나온다. 최저임금 미준수 사법처리 100건중 2건 뿐 10일 참여연대가 발표한 최저임금법 보고서2015년 근로감독 결과를 보면 지난해 고용노동부는 근로감독을 통해 최저임금 미만액 지급사례최저임금법 6조 위반 919건을 적발했다. 위반 업체수는 899개이며 피해 근로자는 6318명이다. 참여연대가 추정한 최저임금 미만액 수급자인 222만 여명의 0. 현행 최저임금법에 따르면 사용자가 6조를 어기면 근로감독관은 시정기간 없는 즉시 시정미지급금 지급 지시를 내린다. 사용자가 만약이를 따르지 않으면 범죄로 보고 사법처리검찰송치를 한다. 재판결과에 따라 3년 이하 징역 또는 2000만 원 이하 벌금법정형에 처해질 수 있다.그러나 최저임금을 지키지 않아 형사처벌까지 받는 경우는 극히 드물다. 고용부는 지난해 적발한 919건 가운데 900건에 시정지시를 내렸다.최저임금법 6조 적발사례에 대한 사법처리 비율은 2012년 0.  적발건수 44 신고건수는 165고용부의 근로감독이 적절하게 이뤄지고 있는 지도 의문스럽다. 고용부가 적발한 최저임금 미만액 지급사례는 2012년 1649건에서 2015년 919건으로 44730건 감소했지만 같은 기간 이 항목에 대한 피해자 신고건수는 754건에서 2000건으로 1651246건늘었다. 지난해의 경우 신고건수가 당국 적발건수의 2배를 넘는다.최저임금 미준수 관행이 지속되는 것에는 사실상 사후 시정조치에만 그치는 현행 제도가 한몫한다는 분석이 제기된다. 사용자의 경우 최저임금법 위반으로 적발돼도 시정만 하면 될뿐 추가적인 다른 제제가 없기 때문에 굳이 법을 준수할 필요성을 크게 느끼지 못한다는 것이다. 최재혁 참여연대 간사는 최저임금을 지급하지 않으면 바로 강력한 처벌을 가하는 등 예방적 규제를 하고 사용자의 인식전환 등 홍보활동도 필요하다며 주로 알바생인 피해자들이 현실적으로 사업자에게 시정을 요구하기 어렵다. 정부가 나서서 도와야 한다고 말했다. 고용부는 최저임금 미지급 사업자에게 바로 최대 2000만원의 과태료를 부과하는 내용의 최저임금법 개정안을 지난 6월 국회에 제출했다.고용부 관계자는 피해자들이 가장 원하는 것은 미지급금 지급이어서 지금까지는 이러한 시정조치에 초점을 맞춰왔다면서 과태료 부담이 생기면 사용자들이 처음부터 법을 지킬 유인이 커질 것이라고 말했다
'여고생 성관계 경찰관' 2명 파면·소속 서장은 정직 처분	http://news.naver.com/main/read.nhn?oid=003&sid1=102&aid=0007401542&mid=shm&mode=LSD&nh=20160810211634	경찰청 부산 SPO 사건 관련자 징계위원회 회부임종명 기자  경찰이 담당학교 여고생과 부적절한 성관계를 맺은 부산 학교전담경찰관SPO 2명을 파면처리하고 소속 경찰서장 2명에 정직 처분을 하는 등 징계를 내렸다. 경찰청은 10일 오후 2시 징계위원회를 열어 부산 SPO 2명과 이들이 소속된 부산 사하경찰서장 및 연제서장 등 총 11명에 대한 징계처분을 의결했다고 밝혔다. 징계위는 사안의 중대성을 감안해 독립성과 공정성이 보장된 특별조사단을 구성 조사한 결과를 바탕으로 국민적 시각을 반영하고자 시민감찰위원회의 사전 심의를 거쳤다며 5명의 징계위원 중 변호사와 교사 등 외부위원 2명을 참여시켜 징계의결에 있어 객관성과 공정성을 보장하려 했다고 말했다. 우선 아동청소년의 성보호에 관한 법률아청법을 위반한 부산 SPO 2명에는 최고 수위의 징계인 파면 처분을 내렸다. 또 이들의 의원면직 절차를 부당하게 처리한 직접 책임이 있는 해당 경찰서장 2명에는 중징계정직을 의결했다. 이와 함께 관련 경찰서 경정급 해당과장 5명은 SPO가 여고생과 성관계를 한 사실을 보고 받았음에도 강제성이 없고 사회적 파장이 우려된다는 이유로 의원면직 처리한 과정에 관여한 책임을 물어 감봉 처분을 받았다. 또 부산경찰청 감찰계장과 아동청소년계장 2명도 SPO의 성비위 사실과 경찰서 은폐 사실을 알고도 조치 없이 묵인하며 부산청 지휘부와 경찰청에 허위보고한 사실이 확인돼 역시 감봉 처분이 내려졌다. 이상식 부산청장과 2부장경무관청문감사담당관총경여성청소년과장총경 등 4명은 이번 사건과 관련된 별도의 행위책임이 확인되지 않아 총괄적인 지휘감독 책임을 묻는 차원에서 서면경고를 한 것이라고 설명했다
한국선 그래도 된다?…성접대·뇌물이면 수입차 인증 'OK'	http://news.naver.com/main/read.nhn?oid=437&sid1=103&aid=0000128188&mid=shm&mode=LSD&nh=20160810223607	저희 회사는 프랑스 회사고 점장도 프랑스인인데 왜 노조를 거부하는 걸까요여기서는 그래도 되니까지난해 말 방영한 JTBC 드라마 송곳에 나온 대사입니다. 한국이라서 부당 대우와 불법이 가능하다는 이 대사가 최근 많은 사람들 입에 다시 오르내렸습니다. 옥시가 제대로 된 검사 없이 세계에서 유일하게 한국에서 가습기 살균제를 만들어 판매했다는 사실이 알려졌기 때문이지요. 환경부는 지난 2일 신차의 시험 성적서를 위조한 폭스바겐과 아우디 차량  8만여 대에 대해 인증 취소 처분을 내렸습니다. 그런데 배출가스 조작이 아닌 인증 서류 조작은 역시 폭스바겐이 진출한 세계 시장에서 오직 한국에서만 벌어졌습니다.오늘10일 탐사플러스에선 허술한 국내 법규와 이를 악용하는 공무원 그리고 그 틈을 비집고 비리에 가담하는 글로벌 기업의 실태와 대안을 들여다봤습니다.기자환경부 국립환경과학원 산하에 있는 교통환경연구소입니다.국내 판매를 위해 인증을 기다리는 겁니다.배출가스와 소음 발생이 국내 기준에 맞는지 측정한 시험 성적서를 이곳에 제출해 검증받아야 합니다.지난 2일 환경부가 인증을 취소한 폭스바겐과 아우디의 32개 모델 8만3000여대의 위조된 성적서도 모두 이곳을 거쳐갔습니다.홍동곤 과장환경부 교통환경과  서류 조작은 명백한 위법이기 때문에 인증 자체를 뒤흔드는 사안으로서 인증 취소가 당연하다는 지적을 했습니다.폭스바겐이 해당 차종들의 성적서를 위조한 이유는 뭘까. 지난 2013년 신차 인증을 받고 국내에 들여온 아우디 A7의 소음 시험성적서입니다.당초 2011년 독일에서 A6 차량으로 인증받은 성적서를 위조해 A7으로 차종 이름만 바꾼 겁니다.교통환경연구소 측은 폭스바겐이 신차를 출시할 때 걸리는 검사 기간을 줄이기 위해 서류를 위조했다고 말합니다.교통환경연구소 관계자  정말 비상식적인 행동을 한 건데 최저 늦어도 검사가 한 달인데 그걸 빨리하기 위해서 불법을 저지른 것이거든요.수입체 업체들은 인증 기간이 짧아져야 더 많은 수익을 올릴 수 있습니다.이호근 교수대덕대 자동차학과  수익이 워낙 크니까 차량 출시 시기와 그 시기에 맞물려서 타이밍이 있거든 다른 회사보다 훨씬 일찍 차를 출시해서 고객을 끌어모은다든지그렇다면 이렇게 위조된 서류들이 당국 감시망을 대거 통과할 수 있었던 이유는 뭘까. 국내의 허술한 인증 시스템 때문입니다.업체들이 자율적 시험을 통해 작성한 성적서를 제출하면 교통환경연구소는 이 중에서 3만 직접 검증에 나섭니다.수입차 인증 관계자  형식적으로 서류를 보면서 제출을 하고 테스트해서 합격되는 차를 형식적으로 검사하죠. 그렇게 하니까 당연히 합격할 수밖에 없는 거죠.연구소에서 수입차의 배출가스와 소음 성적서 인증을 담당하는 연구원도 고작 한 명 뿐입니다.검사 체계가 구조적으로 허술하다는 지적이 나올 수밖에 없습니다.교통환경연구소 관계자  제가 전체를 담당하니까요. 업체가 자체 성적서 제출하면 적절한지 보고 인증을 내주는 시스템이지. 그것 자체를 조작해버리면 알 수가 없죠.나아가 폭스바겐이 2013년 연구소에 제출한 위조 시험성적서를 보면 차량 이름은 바꿨지만 시험 날짜는 원본에 기록된 2011년으로 기록돼 있습니다.연구소에선 2년 전 작성된 성적서라는 것도 알지 못한 겁니다.이런 허술한 검사 제도는 수입차 업체들과 담당 공무원의 은밀한 유착으로 이어집니다.지난해 6월 수입차 인증을 담당한 교통환경연구소 6급 연구원 황모씨가 업체 직원의 차를 타고 연구소를 나섭니다.이들이 향한 곳은 서울 강남의 한 유흥주점.황씨는 이곳에서 술과 함께 성접대까지 받다가 결국 경찰에 적발됐습니다.재판에 넘겨진 황씨는 2009년부터 연구소에서 수입차 인증 업무를 맡으며 수십차례에 걸쳐 10여곳의 업체들로부터 각종 뇌물과 향응을 받은 것으로 드러났습니다.그리고 올 초 징역 1년 6월 집행유예 2년을 선고받았습니다.황씨는 향응을 받는 날까지 업체의 인증서 발급을 미루는가 하면 3200만 원대 수입차를 1000만 원이나 싸게 구입하기도 했습니다.특히 최근엔 황씨가 재직하던 기간에 폭스바겐의 위조 성적서가 대거 인증된 사실이 확인돼 검찰이 참고인 조사를 벌이기도 했습니다.이런 상황에서 인증 서류 조작이 비단 폭스바겐 만의 문제가 아니라는 지적도 나옵니다.구멍 뚫린 제도와 이를 악용하는 글로벌 기업들의 불법적인 사업 관행에 대한 전면적 조사가 필요해 보입니다.윤샘이나 JTBC 뉴스 공식 SNS 트위터 페이스북 유튜브Copyright by JTBChttpjtbc
9대 국가전략 프로젝트 2조 원 투입, 미래 한국 먹여 살린다	http://news.naver.com/main/read.nhn?oid=214&sid1=101&aid=0000657843&mid=shm&viewType=pc&mode=LSD&nh=20160810211033	정부가 대한민국의 미래를 책임질 9대 국가 전략 프로젝트를 선정했습니다.이세돌 9단을 누른 알파고 같은 인공지능 그리고 자율주행차 등 성장동력 관련 5개 분야와 신약개발과 미세먼지 등 삶의 질과 관련된 4개 분야인데요.앞으로 10년 동안 정부예산과 민간분야에서 모두 2조 원 넘게 투입됩니다.김지경 조국현 두 기자가 차례로 보도합니다.  리포트 지난 3월 진행된 이세돌 9단과 알파고의 대국.세계 최정상 바둑 고수를 꺾는 인공지능의 실력은 온 국민을 충격에 빠뜨렸습니다.이세돌9단사실 진다고 생각을 안 했는데 너무 놀랐고. 인공지능은 이미 바둑을 넘어 투자자문가와 예술가 영역까지 진출할 정도로 시시각각 발전을 거듭하고 있습니다.여기에 최근 불고 있는 포켓몬 고 열풍은 증강 현실 기술 하나가 세상을 얼마나 뒤흔들 수 있는지를 보여 준 또 하나의 충격파입니다.이런 첨단 과학기술을 정부가 전략적으로 육성하겠다고 발표했습니다.박근혜 대통령과학기술로부터 이 위기를 극복할 새로운 동력을 얻고 우리 경제의 재도약을 위한 모멘텀을 만들어야겠습니다.성장동력 확보를 위해서 먼저 인공지능과 가상증강 현실 자율주행차 기술을 포함한 5개 분야가 선정됐습니다.10년 뒤엔 선진국의 인공지능 기술을 따라잡을 수 있도록 전문기업을 천 개로 늘리고 3천여 명의 인력도 양성하기로 했습니다.또 가상증강 현실 기술을 의료와 교육 사업에도 활용하고 2024년까지는 완전 자율주행차를 선보인다는 목표도 세웠습니다.정부는 앞으로 10년간 국가 전략프로젝트에 예산 1조 6천억 원을 투입하겠다고 밝혔습니다. 리포트 서울의 한 대형병원 연구실입니다.암 환자의 조직에서 떼낸 유전자를 분석하고 있습니다.개인의 유전자적 특수성을 분석해 낸 뒤 환자에게 딱 맞는 치료법과 의약품을 처방하기 위한 겁니다.남도현삼성서울병원 신경외과 교수개인에게 맞는 약을 선별해줄 수 있다면 질병을 극복할 가능성이 훨씬 많아지는 겁니다.9대 국가 전략 프로젝트 가운데 국민 삶의 질과 관련된 분야는 이런 정밀의료를 비롯해 미세먼지와 탄소자원화 바이오신약 등 4개 분야입니다.특히 정부는 정밀의료 기술을 활용하면 건강수명은 2025년 76세로 연장되고 폐암과 위암 대장암 등 3대 암의 5년 생존율 역시 8.4로 높아질 것으로 보고 있습니다.박근혜 대통령2022년 약 104조 원 달할 것으로 예상이 되는 정밀의료 세계시장 선점도 가능할 것입니다. 차세대 성장동력으로 각광받고 있는 바이오신약 분야에서는 4대 중증질환 치료제 개발을 지원해 신약 후보를 100개 이상 확보할 계획입니다
난민 캠프에 수용된 中 관광객…황당한 사연	http://news.naver.com/main/read.nhn?oid=055&sid1=104&aid=0000440025&mid=shm&mode=LSD&nh=20160810221014	독일에 갔던중국 관광객이 엉뚱하게 난민 캠프에 수용되는 황당한 일이 벌어졌습니다.무려 12일간이나 갇혀 있었다고 하는데 밀려드는 난민에 행정력이 미치지 못하다 보니까 이런일까지 일어나고 있습니다.기자중국인 관광객 리우준량 씨는 지난 4일 독일 슈투트가르트에 도착한 뒤 지갑을 도난당했습니다.경찰서인 줄 알고 도움을 요청하러 갔지만 그곳은 난민센터였습니다.중국어밖에 할 줄 몰랐던 리우 씨는 독일 공무원들에게 이끌려 하이델베르크 외곽의 다른 난민센터로 이동했습니다.그리고 뭔지도 모르는 채 시키는 대로 난민 신청서에 서명했습니다.졸지에 난민 신세가 된 겁니다.마르쿠스 로트푸스난민등록 관서장  우리는 이곳이 난민센터라고 그에게 말했고 그는 중국어로 번역된 난민 신청서에 직접 서명했습니 다.리우 씨는 360 떨어진 뒬멘의 한 난민캠프에 수용됐습니다.식량과 생활비까지 받으며 12일이나 머물렀습니다.하지만 자신이 난민 취급을 받고 있다고는 꿈에도 생각지 못했습니다.말쑥한 옷차림에 난민들에게 중국어로 여행담을 늘어놓는 리우 씨를 난민센터도 이상하게 여기기 시작했습니다.결국 중국 음식점에서 통역을 부르고 스마트폰 통역 앱까지 써서 대화한 끝에 잘못됐다는 걸 비로소 알아챘습니다.크리스토프 슐레터만적십자사 직원  독일어를 하지도 읽지도 못해서 의사소통이 안 됐어요. 번역 앱을 쓰고 나서야 여권을 돌려달라고 하는 걸 분명히 이해하게 됐죠
