한국 경제 위기인가 아닌가…오락가락 전망, 왜?	http://news.naver.com/main/read.nhn?mode=LSD&mid=shm&sid1=101&oid=437&aid=0000111013&cid=428288	 어제7일 이 장면 보고 많은 분들이 궁금하다고 의견을 보내주셨는데 먼저 잠깐 보시죠. 박근혜 대통령청와대 수석비서관회의 7일  최근 경제 상황을 자세히 들여다보면 긍정적인 측면도 많습니다. 당초 소비절벽이나 고용절벽을 걱정했던 것만큼 나쁘지는 않은 수준입니다.그런데 같은 날 한국개발연구원KDI에서는 주요 지표가 계속 나빠 우리 경제의 성장세가 둔화되고 있다는 부정적인 전망을 내놨습니다. 사실 그동안 정부 여당에서도 나온 이야기들이 대개 비슷한 맥락이었는데 최근 어떤 큰 변화라도 있었던 것인가 그렇다면 우리 경제가 과연 지금 위기인 건지 아닌지 오늘 팩트체크에서 짚어보겠습니다. 김필규 기자 어제는 어떤 것이 근거였나요 우리 경제가 나쁘지 않다라는 것의기자일단 수출과 소비 고용 크게 3가지 면에서 분석했던 건데요.우선 수출은 지난 1월에 전년 같은 기간대비 많이 준 게 사실인데 2월이 되니 그보다는 덜 줄었더라 그래서 상황이 나아졌다는 거고요. 소비도 증가세를 유지한 한편 고용도 청년층 취업자가 늘면서 전체 취업자수도 증가세다. 그러니 긍정적인 면이 있다 이런 분석이었습니다. 앵커하지만 얼마 전까지 언론 등에서 나왔던 이야기하고는 차이가 많이 나고 있기 때문에 그래서 좀 낯설게 느끼는 분들이 많이 있으셨던 것 같습니다.기자여러 전문가들에게 그래서 물었더니 대부분 이런 분석에 의문을 제기했습니다. 성태윤 교수연세대 경제학과  현재 수출 지표가 물론 이제 나빠진 것에서 약간 개선될 순 있지만 작년 대비해서 너무 나빠져 있어요. 소비 역시 사실 작년에 조금 개선된 부분이 약간 있었습니다 하반기에. 그런데 지금 그게 다시 가라앉고 있다. 지금 한국 경제 상황은 상당히 어려운 것이 사실이고 어떤 의미에선 사실 위기국면이라고 볼 정도거든요.좀 더 자세히 보면 수출의 경우 1월에 전년대비 18나 줄었던 게 2월에 12로 대통령 이야기대로 좀 나아진 것은 맞습니다. 하지만 장기적으로 보면 14개월째 감소세가 이어지고 있고 전반적으로 보면 그 감소폭도 점점 커지고 있습니다. 지난달 잠깐 나아졌다고 해서 긍정적이라 보긴 힘든 거죠. 청년고용률 그러니까 정규직 비정규직 포함해 얼마나 일자리를 가졌냐는 몇 달째 41.8 비슷비슷한 수준인데 더 중요한 청년실업률 그러니까 일을 하고 싶은데도 못 하고 있는 이들은 지난해 하반기 이후 계속 증가세여서 9.원래 1월은 연말연초 공채 입사가 많아 실업률이 낮은 달인데 9.5나 된 것은 16년 만에 가장 나쁜 수치입니다.앵커16년 전이라면 2000년이고 그 당시엔 IMF 외환위기 직후였는데 그때만큼 안 좋다 이런 얘기가 되는 거군요 기자그렇습니다.7라는 숫자도 괜찮은 거냐 따져볼 필요가 있는데요.지난해 말 새누리당 경제상황점검TF 단장을 맡은 강석훈 의원은 청년 고용이 증가세라 하더라도 OECD 평균인 50에 비해 매우 낮은 수준이다. 청년의 3분의 1이 첫 일자리를 비정규직으로 시작하는 것도 문제라고 지적한 바 있습니다.그래서 최근 나온 경제연구소의 전망을 보면 모두 부정적인데 현대경제연구원은 지금은 수출 불황이 내수 불황으로 전염되는 단계로 방치할 경우 장기간 경기 회복이 늦어질 수 있다고 경고했고요.또 한달 전만 해도 한국 경제의 성장세가 둔화될 가능성이 있다 정도로 봤던 KDI도 어제 보고서에선 둔화되고 있는 것으로 판단된다고 아예 공식 인정을 했습니다.앵커대통령과 같은 날 이렇게 반대 의견을 내놓는 바람에 좀 헷갈린다 이런 얘기들이 많이 나오지 않습니까 그래서 오늘 팩트체크하게 된 것이기도 한데. 사실 최근 다른 정치권에서도 경제 전망을 굉장히 비관적으로 보는 얘기들이 많이 나왔었잖아요기자김무성 새누리당 대표는 1월 기자회견에서 국내 경제에 빨간불이 들어왔다. 진짜 위기라는 생각을 떨칠 수 없다라고 했고 원유철 원내대표는 지난 3일 야당이 필리버스터로 눈과 귀를 가리는 동안 경제 곳곳에서 들려오는 경고음을 무시하고 있다고 했습니다. 그런데 어디보다 경고의 목소리가 많았던 곳이 바로 이곳인데 직접 들어보시죠.1월 13일 대국민담화  경제의 불씨를 살릴 수 있는 골든타임이1월 18일 정부부처 업무보고  또다시 IMF 위기와 같은 고통의 시간을 갖지 않도록2월 22일 청와대 수석비서관회의  대외경제가 어려워진 상황이다3월 3일 국가조찬기도회  우리 경제도 어려운 상황을 맞고 있습니다.앵커그러니까 박근혜 대통령도 연초부터 바로 얼마 전까지 계속 경제를 우려하는 목소리는 냈었다 이런 얘기잖아요기자그렇습니다. 그러다 어제 긍정적인 측면도 있다. 걱정했던 것만큼 나쁘지 않다는 전망이 나온 거죠.청와대 정연국 대변인은 경제라는 게 심리인데 투자나 소비심리가 위축되면 경제에 악영향을 줄 수 있는 만큼 자신감 갖자는 차원에서 나온 이야기라는 설명인데요.과연 그동안 심리를 위축시킨 곳이 어디였나 생각해보게 되는 대목입니다. 앵커그런데 제가 박근혜 대통령 편을 드는 게 아니라 사실 경제는 심리라는 것은 경제학자들도 인정하는 바이고. 그것에 따라 상당 부분 경제 결과가 달리 나오는 것은 우리가 경험을 통해서도 봤단 말이죠. 그리고 아까 저희가 잠깐 인용한 내용 중에 박근혜 대통령이 한 말을 좀 뜯어보면 최근 경제 상황을 자세히 들여다보면 긍정적인 측면도 많습니다 긍정적인 측면도 많다라는 것은 부정적인 측면이 있다라는 것을 인정하면서 심리 개선을 위해 긍정적인 측면을 내놓은 것이 아닌가. 대통령으로서는 그만큼 고심 끝에 내놓은 말일 수도 있다는 것이죠. 그렇다면 무조건 다 이렇게 얘기하는 것은 인정할 수 없는 사람들도 꽤 있을 것 같은데 그건 어떻게 봅니까기자그 발언이 나온 시점을 가지고 생각해볼 수가 있겠는데요.또 많은 경제학자들이 이야기하는 것이 낙관론이나 위기론보다 더 경제에 좋지 않은 것이 오락가락하는 전망이란 이야기입니다.노벨경제학상 수상자인 미국 카네기멜론대 핀 쉬들란 교수는 정부가 수시로 정책을 바꾸면 경제 주체들이 정부를 신뢰하지 못해 경제가 비효율적으로 운영될 수 있다고 경고했는데요.지금이 위기이든 아니든 가장 필요한 건 어느 입장에 따라 오락가락하지 않는 정확한 신호등이라는 지적입니다. 앵커일관된 신호가 필요하다는 입장도 있다 이렇게 이해하면 되겠군요.김필규 JTBC 뉴스 공식 SNS 트위터 페이스북 카카오스토리 유튜브 JTBC 뉴스는 여러분의 생생한 제보를 기다립니다
논산 의심신고 구제역 확진…충남 돼지 타시도 '반출금지'	http://news.naver.com/main/read.nhn?mode=LSD&mid=shm&sid1=102&oid=421&aid=0001930152	구제역 예방접종 8일부터 14일까지 충남 돼지 반출 제한방역상황 봐가며 연장 검토세종 이은지 기자  지난 7일 충남 논산에서 발생한 구제역 의심 신고가 8일 구제역으로 확진돼 방역당국이 긴급 조치에 들어갔다. 농림축산식품부는 8일 0시부터 14일 24시까지 충남 논산지역 내 돼지를 타 시도로 반출하는 것을 금지한다고 이날 밝혔다. 방역이 충분하지 않다고 판단되면 반출 금지 기간을 연장할 방침이다. 논산을 제외한 충남도 나머지 시군에서 타 시도로 도축 출하 또는 돼지를 이동할 경우 해당농장에 대한 사전검사를 통해 안전하다고 판단되는 돼지에 한해 이동을 허용한다. 돼지 반출제한 기간 중에는 충남 도내 7개 도축장에 소독차량 14대를 전담 배치해 집중 소독한다
"결혼한다" 알리자 "그만둬라"…여직원 압박	http://news.naver.com/main/read.nhn?mode=LSD&mid=shm&sid1=102&oid=055&aid=0000385493	소주로 유명한 한 지방의 주류업체 임원들이 결혼한 여직원에게 회사를 그만두라고 압박해왔다는 의혹이 제기됐습니다. 창사 이래 결혼한 여직원이 사무직에서는 일한 적이 없다며 퇴사하라고 했다는 겁니다. 이 여직원은 부당한 요구를 받아들일 수 없다며 계속 근무하고 있는데 회사 측은 집요하게 퇴사를 압박하고 있습니다.기자2011년 홍보팀 디자이너로 입사해 여사원 최초로 주임으로 승진할 때만 해도 A 씨와 회사 사이에는 아무런 문제가 없었습니다.A 씨  4월에 상 받았고 6월에 진급을 했으니까결혼 이야기 전까지는 아무 문제 없었어요.하지만 지난해 10월 두 달 뒤에 결혼한다는 사실을 알리면서 퇴사 압박이 시작됐습니다.부사장  우리 회사에는 결혼하고 근무한 선례가 아직 없을 뿐만 아니라.기획팀장  네가 일 못 해서 나가는 게 아니잖아. 결혼하고 난 뒤에 다니는 여직원이 없었다는 얘기.결혼한 사무직 여직원은 회사를 그만둔다는 관례를 근거로 들었습니다.부사장  규정이나 뭐 이런 거 아무것도 없어요. 없었지만 관습상 그렇게 내려왔을 뿐이고.기획팀장  결혼해서 애만 하나 낳는 순간에 화장실 가서 눈물 짜고 있다고. 유축기 수축기 들고 들어가서 화장실에서 짜고 앉았고.퇴사를 계속 거부하자 은근히 협박하기도 했습니다.부사장  조직하고 개인하고 어떤 대항에 대한 부분은 결코 조직을 능가할 수가 없어A 씨만 이런 일을 당한 게 아니라고 퇴사한 여직원들은 말합니다.퇴사한 여직원  다 결혼할 때 그만두고 언니들이 그랬을 거고요. 여기는 결혼하고 계속 못 다니니까 그만둔다고 했어요.하지만 회사 측은 결혼을 이유로 퇴사를 종용한 적이 없다고 주장했습니다.회사  다른 분들도 자의적으로 나가신 거지 우리가 뭐 내보냈다거나 그런 부분 아닙니다.A 씨를 결혼 직전 판촉팀으로 발령냈지만 결혼 후에는 원래 부서로 복귀시켰다고도 말했습니다.A 씨는 회장과 대표이사를 남녀 고용평등법 위반 등의 혐의로 노동청에 고소하며 대화 내용이 녹음된 파일도 제출했습니다.이 회사 창업주는 기업에서는 사람이 가장 중요하다고 강조해 왔습니다.하지만 결혼한 사무직 여직원은 예외였다고 A 씨는 목소리를 높였습니다.선례를 남기면 안 되고 너를 해주면 다른 여직원이 다 해달라고 하기 때문에 절대 할 수 없다고영상편집  윤미라 VJ  김종갑박수진 기자startsbs
유커 '쇼핑보다 테마'… 씀씀이 줄이고 중저가 제품 선호	http://news.naver.com/main/read.nhn?mode=LSD&mid=shm&sid1=103&oid=021&aid=0002268177	7일 유커중국인관광객들이 서울 중구 명동에서 거리와 노점을 둘러보고 있다. 한국을 방문하는 유커들이 젊은 층의 비중이 늘어나면서 고가 브랜드에서 화장품 등 생활용품으로 소비패턴이 달라지고 여행도 쇼핑보다 문화체험 등을 중시하는 쪽으로 바뀌고 있다. 신창섭 기자 bluesky  큰손들 달라진 소비패턴1월 사상최대 52만명 방문  면세점 매출은 되레 9   젊은 세대가 주류 떠오르며  제품 대부분 해외직구   소비 U턴정책도 한몫   여행사들 쇼핑 마진급감세 체험숙박음식 등으로 유인  저가 고가 맞춤형 전략 필요외국인 관광객 2000만 명 시대는 이제 꿈이 아니다. 메르스중동호흡기증후군 사태로 급감했던 외국인 관광객이 올 들어 다시 가파른 증가세로 돌아서면서 이른바 관광대국에 대한 기대가 높아지고 있다. 외국인 관광객 2000만 명이란 목표는 단순히 숫자 달성만을 의미하지 않는다. 최근 해외여행을 떠나는 내국인들의 숫자가 급격하게 늘고 있지만 관광업계에서는 해외여행 포화 숫자를 2000만 명 내외로 보고 있다. 가처분소득이 더 늘어나더라도 내국인들의 해외여행이 2000만 명 선에서 더 이상 크게 증가하지 않을 것이란 얘기다. 따라서 외국인 관광객 2000만 명 유치는 곧 구조적으로 한국이 여행수지 흑자의 탄탄한 반열에 들어서게 된다는 것을 의미한다. 2000만 명 시대를 앞두고 격변하는 세계 관광시장의 움직임과 이에 대응하는 정부와 민간의 노력 등을 3회에 걸쳐 짚어 본다.한국을 찾는 전체 외국인 관광객의 절반을 차지하고 있는 유커중국인관광객의 여행패턴 변화가 심상치 않다. 여전히 숫자는 늘고 있지만 예전만큼 주머니를 열지 않고 있다. 중화권 관광객은 우리 관광시장을 좌지우지하는 큰손 중의 큰손이다. 8일 한국관광공사에 따르면 지난해 한국을 찾은 외국인 관광객은 모두 1323만1651명. 국적별로는 중국인 관광객이 45. 중국과 홍콩 대만을 합치면 절반 이상이 중화권 관광객이다. 이들이 한국에서 가장 많은 돈을 쓰는 분야는 쇼핑이다. 전체 지출의 절반 이상이 쇼핑에서 나온다. 그러니 중화권 관광객의 쇼핑은 우리 관광의 부가가치를 지탱하는 대들보나 다름없다. 고가 브랜드보다는 중저가 화장품지난 2월 28일 오후 서울 명동의 화장품 로드숍에서 만난 유커 류웨이34 씨는 아내와 함께 마스크팩을 쇼핑 바구니에 담고 있었다. 류 씨는 물건을 구매하기 전에 스마트폰으로 열심히 제품 사진을 찍었다. 중국의 친구들에게 실시간으로 사진을 전송해 구매 의향을 물어 물건을 산다는 설명이었다. 중국인들 사이에서 유행하고 있다는 이른바 다이거우대리구매다. 류 씨는 이렇게 사간 것을 귀국해 친구들에게 되파는데 일면식도 없는 사람들끼리 SNS로 제품을 거래하는 경우도 많다고 했다. 류 씨는 고가의 명품이나 가전제품 등에는 별 관심이 없다고 잘라 말했다. 류 씨는 이른바 1980년대 이후에 태어난 80허우세대다. 중국 대상 관광시장의 주축으로 떠오르고 있는 이들은 전체 중국인 해외여행객의 3분 1을 차지한다. 중국 궈신증권의 분석에 따르면 지난 춘제2월 513일에 해외여행을 떠난 중국인 가운데 1970년대 1980년대 이후 태어난 이들이 79였다. 사회초년병이면서도 해외여행을 다닐 정도로 경제력을 갖춘 이들은 중국 내에서 소비 트렌드를 선도하는 부류다.돈 안 쓰는 유커들젊은 유커들이 늘면서 씀씀이는 눈에 띄게 줄어들고 있다. 8일 한국문화관광연구원에 따르면 지난해 외국인의 신용카드 총지출액은 전년 대비 4.8 감소한 10조4400여 억 원이었다. 지출 감소는 유커에게서 특히 두드러졌다. 일본인과 미국인은 메르스 사태의 여파에도 지출이 각각 9. 이 같은 소비 감소는 메르스 사태의 영향이 컸지만 문제는 외국인 관광객 숫자가 다시 증가세로 돌아선 지난해 10월 이후에도 여전히 소비가 감소세를 보이고 있다는 점이다. 지출 감소 현상은 올해 들어서도 이어지고 있다. 지난 1월 한 달 한국을 찾은 유커 숫자는 월간 단위로 사상 최다인 52만1981명이었다. 그러나 출국장 면세점 매출액은 1억9087만 달러로 전년 동기에 비해 9. 시내 면세점도 1인당 구매금액이 전년 동기의 728달러보다 24. 외국인 관광객이 늘었음에도 면세점의 1인당 구매금액이 줄어들고 있다는 건 관광객들의 씀씀이가 그만큼 줄어들고 있다는 불길한 신호다. 일본에서도 사라지는 싹쓸이 쇼핑유커의 소비가 줄어들고 있는 것은 일본에서도 마찬가지다. 일본에서는 최근 중국인들의 싹쓸이 쇼핑을 의미하는 신조어 바쿠가이 대신 나라비가이 줄을 서서 삼란 말이 등장했다. 면세점의 초고가 상품을 찾던 유커들이 약국을 뒤지고 한 끼에 1000엔을 밑도는 음식점 앞에 일본인들과 함께 길게 줄을 서고 있는 현상을 지칭하는 신조어다. 유커들이 면세점의 고가 브랜드나 값비싼 가전제품 대신 생활용품이나 저렴한 미식 등에 관심을 보이고 있는 것이다. 최근 아사히신문은 중국의 SNS에서 일본에서 꼭 사야 할 것의 목록에 안약 소염진통제 두통약 변비약 등을 꼽은 정보들이 돌아다니고 있다고 보도했다. 중국 정부 소비 유턴 정책이 직격탄이처럼 유커의 씀씀이가 줄어들고 있는 것은 중국 정부의 소비 유턴 정책이 직격탄이 됐다. 지난해 말부터 중국 정부는 자국민의 해외소비를 국내로 돌리기 위해 안간힘을 쓰고 있다. 우선 출국자의 면세 규모 한도5000위안를 엄격하게 규제하고 외국에서 사들여오는 물품에 대한 세관검사도 강화했다. 여기다가 지난달 22일 중국 정부는 광저우 시안 충칭 쿤밍 등 13개 국제공항과 사터우자오 등 6개 내륙항에 입국장면세점 설립을 공식 승인했다. 이 밖에도 온라인 쇼핑이 보편화되면서 굳이 해외여행을 가지 않고 이른바 해외직구를 통해 일상적으로 외제 물건을 구입하고 있는 것도 유커의 씀씀이를 줄이는 요인으로 지적되고 있다. 유커의 여행패턴 변화도 한몫쇼핑 목적 일색이던 유커의 여행패턴도 급격하게 변화하고 있다. 해외여행의 주축으로 등장하고 있는 80허우세대는 쇼핑보다는 어린 자녀들을 동반하는 이른바 친쯔유 테마여행을 선호하고 있다. 중국 CCTV에 따르면 지난해 친쯔유 시장 규모는 114억7000만 위안으로 전년 대비 76. 인터넷에 친숙한 이들 세대로 인해 중국의 온라인 여행시장 교역 규모는 급성장세를 보이고 있다. 특히 2018년에는 중국 온라인 여행시장 규모가 1558억 달러에 달할 것으로 추산된다. 그 중심에 중국 최대 전자상거래 업체인 알리바바 그룹이 있다. 알리바바 그룹이 지난 2014년 10월 내놓은 원스톱 온오프라인 여행서비스 플랫폼인 알리트립을 이용한 중국인이 지난해 1억 명을 돌파하기도 했다. 유커 유치 새로운 전략을 짜야여행업계에서는 외국인 관광객 여행 소비의 절반 이상이 쇼핑으로 지출되는 상황에 대해 문제를 제기하고 있다. 여행상품의 매력이 아니라 쇼핑이 관광객 지출의 주가 되는 상태에서는 관광시장의 발전이 요원하다는 것이다. 실제 유커의 쇼핑 지출로 수익을 보전하는 여행사의 구조는 이미 벽에 부닥쳤다. 롯데관광의 강준홍 이사는 유커들의 소비가 줄어들고 고가 상품 대신 저가 화장품이나 의약품 등을 사들여 쇼핑 마진으로 얻는 여행사 수입이 크게 감소했다며 줄고 있는 소비도 문제지만 그보다 심각한 것은 쇼핑 감소를 상쇄할 만한 수입 수단이 없다는 점이라고 말했다.김재호 인하공전 관광경영학과 교수는 유커의 여행패턴과 소비행태가 달라짐에 따라 여행소비를 체험관광이나 숙박 음식 등으로 유인할 수 있는 다양한 맞춤형 전략이 요구되고 있다며 수요가 있는 저가 상품을 막무가내로 몰아내는 식이 아니라 고가의 만족도 높은 상품을 만드는 방식으로 저가에서 고가 상품까지 관광메뉴판을 다양화해야 한다고 제안했다
국방부 이미 해킹당했다…"북한 소행 유력"	http://news.naver.com/main/read.nhn?mode=LSD&mid=shm&sid1=100&oid=448&aid=0000157098	한미 두나라가 오늘부터 사상 최대 규모의 연합 훈련을 시작하면서 북한은 각종 도발 위협을 높이고 있습니다. 그런데 이미 지난 1월말에 국방부가 북한으로 추정되는 해킹 세력에게 해킹을 당한 것으로 확인됐습니다. 안형영 기자의 단독 보도입니다. 리포트지난 1월말에서 2월초에 걸쳐 국방부 주요 부서의 컴퓨터가 악성코드에 감염됐습니다. 기획조정실 등 6개 부서의 컴퓨터 7대가 해킹을 당한 겁니다. 국방부가 지난달 15일 북한의 사이버 도발 가능성이 높다고 보고 정보작전 방호태세 인포콘을 격상하기 직전입니다. 군 정보당국은 국방 관련 민간연구소 홈페지이에 악성 코드가 심어져 있었고 이 홈페이지에 접속한 국방부 PC가 전염된 것으로 파악했습니다. 군 당국자들이 문서를 저장하지 않고 곧바로 지워야하는데 규정을 지키지 않아  미처 지우지 않은 문서들이 유출된 정황까지 드러났습니다. 군 정보당국은 북한이 우회 경로를 통해 국방부를 해킹했을 가능성이 높다고 보고 악성코드와 경유 서버를 분석하고 있습니다. 손영동  고려대 정보보호대학원 초빙교수국방이나 안보관련 사이트를 공격했다는 것은 북한일 개연성이 상당히 높다고 보아집니다. 일반해커라면 금전적인 탈취가 목적인데.  국방부는 지난해에도 북한이 배후인 원전반대그룹에 해킹을 당해 민감한 자료가 유출된 적이 있습니다. 국방부는 뒤늦게 이번달부터 24시간이 지나면 저장된 문서를 자동삭제하는 프로그램을 설치했다고 밝혔습니다.  안형영 기자 truestorychosun
'결핵환자 속출', 서울대 신입생 결핵검진 의무화	http://news.naver.com/main/read.nhn?mode=LSD&mid=shm&sid1=102&oid=214&aid=0000597026	지난해 결핵 환자가 잇따른 서울대가 올해 신입생부터는 결핵 검진을 의무화할 정도로 우리나라는 젊은 결핵환자가 많습니다.전후 세대와 젊은 세대의 결핵 발병 원인이 다르다고 하는데요. 리포트 지난해 11월 군 입대 신체검사를 받던 서울대 공대 대학원생 2명이 결핵 양성판정을 받았습니다.곧이어 로스쿨 학생이 추가로 확인되자 전체 공대생과 로스쿨 학생 2천 4백 명이 결핵 검진을 받았습니다.학교 안에서 결핵 환자가 잇따르자 서울대는 올해 신입생부터 흉부촬영을 포함한 결핵 검진을 받도록 했습니다.임춘수서울대 보건진료소장학생들이 같이 모여서 생활하는 시간들이 많기 때문에 한 학생이 결핵에 걸린 경우라면 많은 학우들에게 전파를 시킬 위험도가 있습니다.우리나라의 결핵 환자는 4만 3천여 명으로 발병률과 사망률 모두 OECD 34개국 중 1위입니다.특히 2030대가 전체 결핵환자의 20를 넘습니다.학업취업으로 인한 과로와 스트레스로 면역력이 떨어지는 것이 주된 원인으로 꼽히는데 무리한 다이어트에 따른 영양 결핍도 문제입니다.이승룡고대 구로병원 호흡기내과 전문의단백질 섭취가 안 되니까 면역시스템을 구성하고 있는 세포들이 제대로 형성이 안 되고 결핵이라든지 다른 감염들이 잘 생기게 되죠.625 전쟁 전후 세대의 절반은 영양 부실 탓에 잠복 결핵감염자입니다
中 인구, 2050년 전에 14억5000만 명 정점 찍고..	http://news.naver.com/main/read.nhn?mode=LSD&mid=shm&sid1=104&oid=003&aid=0007085141	베이징신화중국의 리빈 국가보건가족계획위원회 위원장이 인구 전망 및 두 자녀 정책에 관한 기자회견을 마치고 일어나면서 답변하고 있다.베이징신화김재영 기자  한 자녀 원칙을 포기한 중국은 2050년 께 노동력 인구가 지금보다 3000만 명 증가할 전망이라고 8일 중국 보건인구 책임자가 말했다. 2015년부터 전 가정에 두 자녀를 가질 수 있도록 하면서 해당 기간에 약 9000만 쌍의 부부가 두 자녀를 가질 것으로 본다고 보건가족계획위원회의 리빈 위원장이 이날 전인대 참석 중 기자회견에서 밝혔다. 중국 인구는 2015년 말 현재 13억7500만 명에 달했다. 세계 최대 인구국인 중국은 2050년 이전 어느 시점에 14억5000만 명의 인구 정점을 찍은 뒤 감소세로 돌 것이라고 리 위원장은 설명했다. 결국 13억8000만 명으로 하향 안정된다는 것이다. 보다 중요한 사안인 전체 인구 중 노령 인구가 차지하는 비율에 대해서 위원장은 구체적 설명 없이 2050년 전에 상승세가 반전될 것이라고 말했다. 중국은 1978년 개혁 노선 채택과 동시에 강제적인 한 자녀 정책을 실시했다. 2013년에야 부부 중 한쪽이 외동이면 두 자녀를 가질 수 있도록 완화했다
