폭염 주말 지나면 끝…다음 주엔 열대야도 안녕	http://news.naver.com/main/read.nhn?oid=422&sid1=103&aid=0000209594&mid=shm&viewType=pc&mode=LSD&nh=20160818233714	폭염 주말 지나면 끝다음 주엔 열대야도 안녕앵커 역대 가장 뜨거웠다는 1994년과 비교를 할 정도로 대단했던 올여름 폭염이 이제야 끝을 향하고 있습니다. 한달 가량 내려졌던 폭염특보는 주말을 기점으로 점차 해제될 전망입니다. 또 다음 주에는 그동안 잠못들게 만들었던 열대야 현상도 사라질 것으로 보입니다.곳곳에서 낮 수은주가 35도를 웃돌아 극심한 폭염이 이어졌습니다.서울은 지난 3일부터 13일까지 11일 연속 낮 수은주가 33도를 웃돌아 역대 6번째로 긴 폭염이 발생했습니다.역대급 폭염이 기승을 부리면서 오존주의보도 연일 내려지고 있습니다.서울과 경기 전남 울산 등 곳곳에서 여름철 오존주의보 발령 횟수가 작년과 비교해 크게 늘었습니다.특히 지난해 단 한 번도 내려지지 않았던 충남에서는 올해 21번이나 발령되기도 했습니다.폭염의 기세는 전국에서 주말까지 이어진 뒤 점차 수그러들겠습니다.기상청은 주말인 20일 서울의 낮 최고기온이 폭염주의보 기준인 33도를 보인 후 다음 날부터 점차 떨어지겠다고 예측했습니다.서울의 낮 최고기온은 일요일인 21일에 31도를 기록한 뒤 잠시 올랐다가 이후 주 후반까지 30도 내외가 예상됩니다.7월 초부터 나타났던 열대야 현상도 주말 이후 조금씩 누그러지겠고 주 후반에는 완전히 사라질 전망입니다
심상치 않은 터키동부…연쇄 폭탄공격에 13명 사망	http://news.naver.com/main/read.nhn?oid=001&sid1=104&aid=0008625006&mid=shm&viewType=pc&mode=LSD&nh=20160818230206	이달 10일 터키 마르딘주에서 발생한 차량공격 현장. AP쿠르드 소행 추정쿠르드 지역까지 공격 확장 의심    이스탄불 하채림 특파원  터키 동부에서 군경을 노린 폭탄공격이 또 연쇄 발생 사상자가 속출했다.     18일 터키 동부의 비틀리스주 히잔 구역에서 군용 차량이 지나가는 순간 근처에서 폭탄이 터져 군인 5명과 민간인 경비원 1명이 숨지고 군인 6명이 다쳤다고 터키 도안 통신사가 전했다.     또 동부 엘라즈주 엘라즈시 경찰본부 근처에 있던 차량에 설치된 폭탄이 터져 3명이 사망했다.     140여명 가량이 다쳐 병원으로 옮겨졌다.     앞서 17일 밤 늦게 반주의 한 경찰서에서 차량 폭탄이 터져 민간인 2명과 경찰관 1명이 숨지고 70여 명이 부상했다.     터키 군경 시설 또는 차량을 겨냥한 폭탄공격은 이달 10일 이후 벌써 6건이다.    아직 배후를 주장하는 단체는 없으나 터키정부는 쿠르드계 분리주의 무장조직 쿠르드노동자당PKK 소행으로 추정했다.     비날리 이을드름 총리는 엘라지를 찾아 어떤 테러조직도 터키를 굴복시킬 수 없다고 말했다.     지난달 쿠데타 시도 후 한동안 PKK 공격이 거의 없었으나 이달 중순 이후 다시 급증했다.     특히 이날 폭탄공격 현장 가운데 엘라즈는 터키 동부에 있긴 해도 쿠르드계 지역이 아니며 그간 PKK 공격도 일어나지 않았다.    최근 PKK는 쿠르드계 지역이 아닌 곳에서도 군경을 상대로 공격을 벌이겠다고 경고했다
620억 들인 '통관 자동화', 오류에 맨손작업	http://news.naver.com/main/read.nhn?oid=056&sid1=101&aid=0010352561&mid=shm&viewType=pc&mode=LSD&nh=20160818221028	멘트 관세청이 한 달 전 화물 통관 속도를 획기적으로 높이겠다며 600여 억원의 예산을 들여 특송 물류센터를  만들었는데요 그런데 첨단장비라는 자동화시스템이 걸핏하면 문제를 일으켜 직원들이 맨손으로 작업을 하는 형편입니다.   우한울 기자가 현장을 취재했습니다.  리포트  관세청이 최근 문을 연 특송물류센터. 녹취 통관절차가 아주 간단해졌기 때문인데요. 자동화 시스템으로 통관속도가 10배 빨라진다고 설명합니다. 한 달여 뒤 다시 가봤습니다. 쉴 새 없이 움직이는 한 여성. 손에 바코드 인식기를 들고  일일이 화물에 갖다  댑니다. 새 자동 시스템은 아예 멈춰서 있습니다.녹취 물류센터 관계자음성변조   자동라인에 태울 수 있는 것들은 제한이 있어요. 바코드가 제대로 안 붙으면 방법이 없어요. 바코드가 손상되거나 모양이 고르지 못한 화물들을 자동 시스템이 화물 배출구로 원위치 시키기 때문. 작업 속도가 오히려 느려져 기존 수작업  기기가 추가로 동원됐습니다.  특송물류센터 바깥에는 배송지로 출발하지 못한 화물들이 잔뜩 쌓여있습니다. 조금 전 비행기에서 막 나온 항공 컨테이너입니다.  원래는 건너편 반입구로 들어가야 하는데어찌 된 게 반출구에 놓여있습니다. 특송 화물 반입은 공항에서 물류센터로 바로 들어오는 길과 우회로 2가지로 나눠져 있습니다.  그런데 준비부족으로 우회로를 이용해서는 반입구로 갈 수 없게  됐습니다. 그래서 우회로를 통한 화물은 반출구로 다시 들어가야하는 상황. 복도 곳곳엔  항공 컨테이너는 물론  화물까지 쌓이며 통관을  더디게 하고 있습니다. 물류센터 개통 한 달여 이용자들은 배송 속도가 한나절 이상 느려졌다고 말합니다.녹취  수출업체 관계자  지금은 하루를 그냥 버리는 거예요. 수출 업체들 발목을 잡는 제도로 돼 버리니까. 물류센터 설립에 들어간 예산만 620억 원
주말부터 폭염 꺾인다?…깊은 불신에 시민들 시큰둥	http://news.naver.com/main/read.nhn?oid=437&sid1=103&aid=0000128919&mid=shm&viewType=pc&mode=LSD&nh=20160818210917	이번 주말부터 폭염특보 수준의 더위는 이제는 없을 거란 기상청 예보가 나왔습니다. 반가운 소식이긴 한데 시민들은 못 믿겠단 반응입니다. 지난 주 예보에 따르면 지금쯤 이미 더위가 한풀 꺾였어야 하는데 현실은 그렇지 않기 때문입니다.기자오늘18일 한 언론사 날씨 예보 기사에 달린 인터넷 댓글입니다.이번 주말부터 더위가 꺾일 거란 내용의 기사인데 온통 믿지 못하겠단 반응들입니다.배준형서울 수유동  더위가 누그러든다고 해서 에어컨 설치 안 하고 있었는데 더위가 계속 안 풀렸어요.지난 장마 때부터 거푸 틀린 기상청 예보가 폭염 전망도 계속 어긋나면서 불신이 폭발한 겁니다.기상청은 지난 11일에는 15일 광복절부터 서울에서 33도를 넘는 폭염이 없어질 것이라고 예보했습니다.하지만 이후 18일 21일로 폭염 종료날짜를 슬금슬금 미뤘습니다.또 지난주 태풍이 일본 동쪽 해상으로 북상하면 무더위가 누그러질 거라고 예보했지만 이번 주엔 태풍도 별다른 영향을 주지 못했다고 수정했습니다.기상청은 올해 북태평양 고기압이 유난히 강해 기상예측이 어렵다고 호소합니다.하지만 앞으론 폭염 등 기상이변이 더 늘어날 것으로 예상돼 독자적인 예보모델 개발과 예보 능력 향상 대책이 시급해졌습니다.이태윤 JTBC 뉴스 공식 SNS 트위터 페이스북 유튜브Copyright by JTBChttpjtbc
고액 자산가·고소득층 보험료 지원 막는다	http://news.naver.com/main/read.nhn?oid=214&sid1=101&aid=0000660432&mid=shm&viewType=pc&mode=LSD&nh=20160818212140	저소득 근로자들에게 국민연금 보험료의 절반을 지원해주는 제도가 있는데요.수십 수백억 원대를 가진 자산가들까지 혜택을 누려 논란이 많았죠.이런 경우들을 걸러내기 위해서 정부가 제도 개선에 나섭니다. 리포트 서울 강남의 40대 남성은 130억 원대 땅을 가진 100억 원대 자산가지만 매달 국민 연금 보험료를 지원받고 있습니다.경기도 성남의 또 다른 남성도 170억 원대 땅과 18억 원대 건물을 보유한 200억 원대 부자이면서 역시 정부 지원 대상입니다.이렇게 수십억 원대 자산을 가지고도 저소득층으로 분류돼 꼬박꼬박 정부 지원을 받은 사람은 2012년 기준 20명을 넘었습니다.정부는 저소득층 지원을 위한 제도가 부자들의 곳간만 더해준다는 비판에 따라오는 11월부터 관련법을 개정 시행하기로 했습니다.우선 저축과 건물 토지 등 보유 재산이 6억 원 이상이거나 임대나 저축이자 등 종합소득이 연 1680만 원 이상일 경우에는 보험료 지원 대상에서 제외하기로 했습니다.이 같은 개정안이 시행되면 많게는 3만여 명이 지급 대상에서 제외됩니다.정호원보건복지부 국민연금정책과장고액 재산가나 다른 소득이 많은 사람을 지원하는 것은 일반 가입자와의 형평성에 맞지 않다는
주일 대사가 후쿠시마 홍보? "한국 국민 직접 보면…"	http://news.naver.com/main/read.nhn?oid=437&sid1=100&aid=0000128925&mid=shm&mode=LSD&nh=20160818220418	후쿠시마 원전 사고 5년이 지났지만 방사능 오염이 우려되는 일본산 수산물에 대한 불안감은 여전합니다. 그런데 이준규 주일 대사가 한국 국민이 후쿠시마를 직접 보면 서서히 개선될 것이라고 일본 언론에 밝혔습니다. 일본인들조차 후쿠시마산 식품에 대해 아직 꺼려한다는데 자국의 이익을 추구해야 할 주일 한국대사가 이런 말을 해도 되는 거냐는 지적입니다.기자후쿠시마를 찾은 이준규 대사가 일본 기자들 앞에 섰습니다.후쿠시마산 식품에 대한 한국의 부정적인 평가에 대해 이런 상황이 하루에 개선되는 것은 어렵다며 한국 국민이 직접 보면 서서히 개선될 것이라는 의견을 밝혔다고 교도통신이 보도했습니다.과학적 수치를 포함한 후쿠시마현의 정확한 상황을 본국 국민에게 전하는 것이 나의 일이라는 말도 했습니다.한국인들의 불안감을 잘못된 소문쯤으로 치부하는 일본의 주장에 상당 부분 동조하는 듯한 발언입니다.논란이 일자 주일 한국대사관은 후쿠시마 원전 관련 정보가 제대로 전달되고 있음을 우회적으로 강조한 것이라며 진화에 나섰습니다.후쿠시마 주변 8개현의 수산물 수입이 전면 금지된 건 지난 2013년 9월.일본은 수입금지가 과학적 근거가 없다며 지난해 WTO에 제소까지 하며 수입 재개를 압박하고 있는데요.이같은 상황에서 한국을 대표하는 이 대사의 발언이 적절치 못했다는 비판이 나옵니다.이정헌 JTBC 뉴스 공식 SNS 트위터 페이스북 유튜브Copyright by JTBChttpjtbc
기업·학교 오가는 '도제학교' 대폭 확대	http://news.naver.com/main/read.nhn?oid=056&sid1=102&aid=0010352574&mid=shm&mode=LSD&nh=20160818224346	멘트 학생이 학교와 기업을 오가며 전문 기술을 익히는 도제식 현장 교육이 일부 특성화고등학교에서 이뤄지는데요  정부는 청년 취업과 산업 기술인력 양성을 위해 이 도제 학교를  대폭 확대하기로 했습니다.   이경진 기자의  보도입니다. 리포트 고3 학생들이 대형 기계를 이용한 금형 작업에 한창입니다. 이 학교 학생들은 2학년 때 부터  일주일에 23일 씩 나눠  학교 기초 교육과 기업 실무 교육을 함께 받습니다. 2년 동안 2천5백 시간 정도 전문 기술을 익히면  해당 기업 취업으로까지 이어집니다.인터뷰 김 진고등학교 3학년   2학년 때부터 나가니까 사회생활에 먼저 적응이 되더라고요. 2학년 때 부터 취업의 길이 이미 열려 있으니까 되게 좋아요. 박근혜 대통령이 학교와 기업의 실습 현장을 찾았습니다. 학생은 꼭 대학에 가지 않아도 취업할 수 있고  기업은 필요한 인재를 얻을 수 있는 만큼 정부가 적극 지원하겠다고 약속했습니다. 녹취  박근혜 대통령  아주 일찍부터 자신들이 원하는 일자리를 찾아서 준비를 할 수 있고. 교육 개혁에 있어서 큰 방향이 돼야 하지 않겠나. 정부는 현재 60개인  이 산학일체형 도제학교를 200개로 늘리기로 했습니다. 분야도 공업에서 정보통신 서비스업 등으로 확대됩니다. 인터뷰  김진동인천기계공고 교감  재학생 단계에서 취업이 이뤄져야 하는 형태입니다. 따라서  좋은 기업을 선정하는 게 중요합니다
'의사 탈북자' 미화원 일하다…유리창 청소 중 추락사	http://news.naver.com/main/read.nhn?oid=437&sid1=102&aid=0000128926&mid=shm&mode=LSD&nh=20160818212358	40대 탈북자가 건물 안에서 유리벽을 닦다 아래로 떨어져 숨졌습니다. 북한에선 산부인과 의사였지만 국내에선 자격을 인정받을 수 없었다고 하는데요. 결국 공사장을 전전하고 미화원 일을 하다 변을 당했습니다. 북한고위급 인사의 망명 소식 한켠에서 전해진 탈북자의 현주소이기도 합니다.기자많이 울었으니 올해는 기쁜 눈물을 흘렸으면 좋겠다48살 탈북자 김모씨가 남긴 일기입니다.김씨는 지난 13일 인천 송도동의 건물 안에서 유리창을 닦고 있었습니다.그런데 에스컬레이터와 유리창 사이 틈에 발을 헛디뎌 13m 아래로 추락해 숨졌습니다.김씨는 함경북도 청진에서 산부인과 의사였습니다.북한에선 상류층이었지만 아내의 병을 치료하기 위해 2006년 탈북했습니다.하지만 남한 정착 이후 의사 자격을 인정받지 못하면서 공사장 일용직 생활을 했습니다.2010년부턴 고층 건물 주차관리와 청소를 하는 업체에서 일해왔습니다.유족  괜히 한국에 와서 살면서 후회하지 않나 싶어서 조심스럽게 물어봤는데 가족과 함께 있어서 행복하다고 얘길 하시고김씨는 사고 당시 안전모나 생명줄은 착용하지 않은 상태였습니다.김씨 동료들은 안전 교육이 형식적이었다고 주장했습니다.김씨 동료  겨울철이니까 눈 조심하고 미끄럼 조심하고. 그걸안전 교육 내용을 그냥 돌아가면서 읽는 거예요.업체 관계자는 김씨가 원래 주어진 업무를 하다 사고를 당한 게 아니라고 해명했습니다.그러나 경찰은 업체 책임자를 대상으로 안전 관리 준수 여부 등을 조사하고 있습니다.서효정 JTBC 뉴스 공식 SNS 트위터 페이스북 유튜브Copyright by JTBChttpjtbc
서울시 청년수당 법정으로…복지부와 협의 여부 공방 예고	http://news.naver.com/main/read.nhn?oid=018&sid1=102&aid=0003612358&mid=shm&mode=LSD&nh=20160818195331	서울시 오는 19일 복지부 이행명령 정지 가처분 신청 사회보장기본법 협의조정 대상 여부인지 판가름 기지급한 15억 활동지원금 환수 결정 놓고 갑론을박이데일리 김기덕 기자 서울시 청년활동지원사업청년수당이 결국 법정에서 시시비비를 가리게 됐다. 보건복지부와 서울시는 사회보장기본법상 해석과 청년수당 활동지원금 환수 조치 고용노동부의 취업성공패키지 개편안을 놓고 서로 엇갈린 해석을 내놓으며 한치의 양보없이 맞서고 있다. 특히 지난 3일 서울시가 1차로 지급한 청년수당 활동지원금14억 5500만원이 논란이 되고 있다. 복지부는 직권취소 결정으로 청년수당 사업이 이미 무효가 됐으므로 즉각 이를 환수 조치해야 한다고 주장한다. 반면 서울시는 활동지원금을 받은 청년들의 귀책사유가 없는 한 이를 환수할 법적인 근거는 없다고 반박하고 있다. 서울시 19일 청년수당 직권취소 대법원 제소 서울시 청년정책담당과 관계자는 18일 정부가 청년수당 면담 요청을 사실상 거부하는 등 협의가 이뤄지고 있지 않기 때문에 복지부의 직권취소 처분과 관련해 대법원 제소는 피할 수 없게 됐다면서 19일께 복지부 직권취소에 대한 이행명령 가처분 신청과 취소 소송을 제기할 예정이라고 말했다. 복지부는 사회보장기본법 제26조 3항에 따라 사회보장제도를 신설하거나 변경할 때 서울시가 복지부와 협의해 조정절차를 이행해야 했지만 이를 어기고 청년수당을 사업을 강행한 것은 위법하다는 논리를 펼치고 있다. 청년활동지원 사업을 시행하기에 앞서 복지부 장관과 사전협의를 이행하지 않았다는 것이다. 이에 따라 복지부는 지방자치법 제169조 제1항에 따라 청년수당 사업을 직권 취소하고 이를 서울시에 통보했다. 서울시는 복지부의 취소 처분에 대해 이의가 있으면 처분을 통보받은 날부터 15일 이내19일까지에 대법원에 복지부 처분에 대한 취소와 이행정지 가처분을 구하는 소송을 제기해야 한다. 결국 서울시와 복지부의 법정 싸움은 피할 수 없게 됐다. 전날 청와대에서 열린 시도지사 오찬 간담회에 참석한 박원순 서울시장은 서울시 청년수당 사업은 중앙정부와 충돌하는 것이 아니라 보완적인 정책이라며 재차 협의를 제안했지만 청와대측은 정부에서 이미 취업성공패키지 개편안을 추진하고 있어 그것을 활용하면 된다며 기존의 입장을 되풀이했다. 정진엽 보건복지부 장관은 지난 9일 정부세종청사에서 열린 브리핑에서 박원순 서울시장이 박근혜 대통령에게 청년수당 관련해 대화를 제의한 것은 진정성이 없는 제스처라고 지적했다.사진 고용부 취업성공패키지 청년수당 베끼기 논란 고용노동부가 지난 12일 청년수당과 유사한 성격의 취업성공패키지 개편안을 내놓으면서 논란이 확산되고 있다. 고용부는 취업 구직활동에 적극적으로 참여중인 자에게 1인당 최대 60만 원까지 취업 활동에 필요한 실비를 지급하겠다는 계획안을 내놨다.복지부는 취업성공패키지 사업은 정부나 지자체 재원이 아닌 민간에서 마련한 청년희망재단에서 지원하기 때문에 사회보장기본법상 사회보장제도에 해당하는 협의 대상이 아니라고 설명한다. 청년희망재단 지금 1430억원 중 74억원을 취업성공패키지 사업에 지원할 예정이다. 서울시는 청년수당 사업 예산으로 약 90억원을 책정했다.  서울시 관계자는 청년들 취업 지원금의 성격에 따라 협의 대상이 되고 안된다는 것은 사회보장기본법을 이해하지 못한 부당한 처사라며 서울시도 다양한 사회참여 활동에 일정기간 참여하고 6개월간의 활동계획서를 제출한 취업 의지가 있는 청년들을 공정히 선발했다며 고용부 사업과 내용상 동일한 사업이라고 강조했다. 서울시가 이미 지급한 청년수당에 대한 환수 조치도 논란거리다. 복지부 사회보장조정과 관계자는 서울시가 이미 2831명에게 지급한 활동지원금은 직권취소에 따라 이미 무효가 된 사항이라며 부당이득에 해당하므로 서울시는 이에 대한 책임을 전적으로 지고 이를 모두 환수해야 한다고 지적했다
