1등급 대 나머지…일반고교도 '흙수저' 차별	http://news.naver.com/main/read.nhn?mode=LSD&mid=shm&sid1=102&oid=028&aid=0002311882&cid=428288	학생부의 배신ㅣ불평등 입시 보고서 일반고의 1등급 몰아주기올해 수도권 지역 일반고를 졸업한 주수희가명19양은 꿈이 작가다. 어려운 가정 형편 때문에 부모의 지원을 충분히 받기 힘든 흙수저 주양이 대학 지원 과정에서 의지할 곳은 학교뿐이었지만 그는 작가라는 꿈을 키우는 데 학교에서 받은 지원은 없는 것 같다고 말했다.  수시모집 학생부종합전형에 중요한 비교과 스펙에서 내신 4등급인 주양은 늘 뒷전이었다. 백일장이나 맞춤법 대회처럼 국문학과나 문예창작과에 가는 데 도움이 될 만한 교내경시대회에 나가고 싶었지만 12학년 때는 담임교사의 추천이 없어서 기회를 얻을 수가 없었다. 담임교사 추천은 늘 1등급 친구들의 몫이었다. 소논문 쓰기 대회RE 출전 기회는 전교 30등까지를 모아 별도로 만든 심화반 친구들에게만 주어졌다. 선생님은 학교생활기록부학생부도 1등급 아이들만 써주셨어요. 사회 수업 시간에 토론에 참여하면 세부능력 및 특기사항세특에 관련 내용을 써준다고 했던 교사는 학생부 기재가 이뤄지는 학기 말 주양에게 시간이 없어 다 써줄 수가 없어서 1등급까지만 써주기로 했다. 세특은 과목 수업 시간에 보인 학생의 태도나 특성 등을 기록하는 학생부의 한 항목으로 학생부종합전형에서 중시된다고 여겨진다. 학생부종합전형학종의 주요한 평가요소인 비교과 활동이 금수저 학교 출신이나 고소득 계층 학생들에게 더 유리하다는 지적이 나오는 가운데 일반고 안에서도 기회가 고르게 주어지지 않는 불평등과 차별 문제가 나타나고 있다는 비판이 나온다. 소위 명문대 입시에서 우수한 실적을 내기 위해 학교 쪽에서 동아리 경시대회 봉사활동 등 비교과활동의 기회를 1등급상위 4 정도의 소수 상위권 학생들에게 몰아주고 있기 때문이다. 우등생에 지원 쏠림비교과 스펙 기회 몰아줘학생부 20장 넘게 써주기도다른 아이들은 소외내신 안좋아 주요대 못 간다고경시대회 추천서도 못 받아스스로 써낸 학생부를 가지고 지원한 수시모집 4곳에서 모두 탈락한 주양은 정시모집으로 경기도의 한 대학 야간과정에 합격했다. 주양은 가정 형편 때문에 근로장학생을 해도 좀더 오래 일할 수 있는 야간과정에 지원했다며 작가의 꿈은 나중에라도 꼭 이루고 싶다고 말했다. ㄱ고는 서울대 수시모집에 4명의 합격자를 내 지역 내 72개 일반고 가운데 1등을 했다. 하지만 이런 모교의 성공은 주양과는 관계없는 일이다.학생부 종합 전형학종 준비한 일반고 학생들의 차별 경험 클릭하면 확대됩니다.  상위권에 스펙 몰아주기 수시모집 확대로 비교과 활동이 중시되고 있지만 과거 수능 성적 등으로 한줄 세우기 교육을 할 때 있었던 우열반 체제는 심화반 특별반 정독반 등으로 변형돼 여전히 건재하다. 서울의 한 일반고 교사는 스펙 쌓아주려고 프로그램들도 많이 생기는데 자격을 성적으로 제한한다. 결국 서울 시내 대학에 갈 만한 4050명 학생에게 집중된다고 말했다. 그는 똑같은 학생들이 여러 가지 프로그램에 집중적으로 참여하고 스펙을 쌓아서 학생부종합전형에 합격하는 것이라고 말했다. 심화반 안에서도 서울대에 지원하는 최상위권 학생들이 누리는 특권은 남다르다. 자녀가 고등학생인 울산의 한 학부모는 정독반 안에서도 전교 1등 하는 아이가 영어 말하기 대회에서 썩 잘하지 못했는데도 1등을 한 적이 있다며 그 아이는 1학년 때부터 학교가 서울대 밀어주는 아이로 특별관리하고 있다는 것을 아이들이 다 안다고 말했다. 그는 울산에는 정독반 안에 최상위권 학생들을 위한 밀레니엄 정독반을 운영하는 곳도 있다고 전했다. 지방자치단체 차원에서 학교에 지원해주는 예산이 이런 심화반을 위해 쓰이기도 한다. 서울의 한 일반고는 기초자치단체가 지원한 3억원에 가까운 예산을 전교생300여명의 10도 안 되는 20여명 정원의 심화반에 쓴다. 이 학교 교사는 다른 학생들은 방과후학교나 보충수업비를 내는데 심화반 학생들은 지자체 예산으로 수업비가 모두 면제된다고 말했다. 임성호 하늘교육 대표는 현행 학종은 기본적으로 내신 성적을 중시하기 때문에 내신 등급이 좋아야 비교과 스펙도 의미가 있다며 학교 입장에서는 내신 최상위 학생들에게 스펙을 몰아줄 수밖에 없다고 말했다. 임 대표는 상담을 해보면 1등급 수상 실적은 50회 안팎이지만 34등급 이하 학생들은 10회 안팎에 그친다. 3등급 이하는 내신 성적도 밀리는데 비교과까지 밀려서 수시모집으로 가기가 어려운 경우가 많다고 말했다.내신 등급별 학생들의 수상실적 격차 사례고교들 내신등급 높은 학생에게경시대회봉사활동 기회 몰아줘학생부 종합전형서 상대적 유리학생부도 상위권만 교사가 써줘심화반정독반 이름으로 특별관리정독반 안엔 또 밀레니엄 정독반독서실마저 성적따라 지상지하고교마다 학종 대비반 우후죽순소논문쓰기 등 대학 교양 수준일반 학생들은 접근하기 어려워  학생부 기록도 상위권만 심화반 학생들의 수시모집 대비를 해주는 과정에서 교사가 학생에게 학생부 작성을 맡기거나 학생부 기록을 과도하게 수정하는 일도 벌어진다. 지방의 한 일반고를 졸업한 고도연가명19양은 내 학생부는 내가 다 썼다고 했다. 선생님이 학생들한테 학생부를 써오라고 하는데 심화반 애들은 싹 손을 봐 주지만 나머지 애들은 저희가 써온 그대로 학생부에 올라가요. 선생님이 써준 학생부를 보면 20장이 훌쩍 넘어가는데 문체 단어가 달라요. 그런 학생부에 비하면 내 학생부는 진짜 초라하죠. 3년 동안 열심히 살았는데 이렇게 아무것도 남지 않을 수가 있나 싶었어요. 비수도권 비평준화 지역의 한 교사는 서류만 갖고 1차 평가가 이뤄지기 때문에 학기가 끝나면 학생부 기록을 전담팀을 꾸려서 점검을 한다. 조작은 아니지만 몇몇 교사가 성적 상위자들의 학생부를 집중 관리하는 것이라며 학생이 중심이 되고 주도를 해서 자기 진로와 적성을 고려한 대학 진학을 하는 게 아니라 학교가 주도해서 진로를 정하고 이에 맞춰 동아리나 봉사 자치활동을 다 몰아 쓴다고 말했다. 학생인권조례가 시행되는 진보 교육감 지역에서도 인권 침해 수준의 차별이 버젓이 이뤄진다. 한해 평균 45명의 서울대 수시모집 합격생을 내는 서울 강남구의 한 일반고는 심화반 학생의 독서실을 지상에 배치한 반면 다른 학생들이 사용하는 독서실은 지하실에 있다. 한 학부모는 아이가 지하에 가보니 냄새도 나고 친구들이 기침을 하면서 공부를 한다는 거다. 의자와 조명도 다르다며 심화반 학부모들만 따로 입시설명회를 열어 독서활동 기록을 학부모가 대신 적어주라는 식의 안내도 한다고 말했다. 송화원 사교육걱정없는세상 줄세우기 방지 캠페인 팀장은 성적 우수자에게만 자원이 집중되면서 대다수 아이들이 받아야 할 교육적 혜택이나 자원이 형평성 있게 분배되지 못하고 왜곡되고 있다고 말했다.  대학 눈높이 맞추느라 흙수저들 뒷전  학종에 대비하기 위해 학교가 개설하는 프로그램이 고등학교 수준을 뛰어넘고 있는 것도 중하위권 학생들의 기회를 간접적으로 박탈하는 행태로 지적된다. 서울의 한 일반고 교사는 상위권 대학에 초점을 두다 보니 모든 아이들이 성장할 수 있는 프로그램이 아니라 소수 학생만 따라갈 수 있는 대학 교양 수준의 프로그램을 만들고 있다고 말했다. 최근 서울 일반고들 사이에 영재학급 개설이 유행하고 있는 것 역시 수시모집 대비 전략 가운데 하나다. 영재교육종합데이터베이스를 보면 영재학급 개설 일반고가 2013년 72곳에서 2015년 91곳으로 크게 늘었다. 영재학급이 개설돼 있는 강남구의 한 일반고 학부모는 영재반에서 엄마들끼리 팀을 만들어서 토론대회나 논문 쓰는 비교과 활동을 하는데 가정통신문을 통해서 영재반 애들이 상을 받은 연구 주제들을 보면 고등학생 수준에서 말도 안 되는 것들이 있다며 1년에 오는 가정통신문 200여장 가운데 중위권 대상 프로그램 안내는 12건뿐이었다고 말했다. 김동춘 전 전국진학지도교사협의회 공동대표대성여중 교사는 교육부가 고교 교육을 정상화한다며 대학들한테 고교 정상화 지원 사업 예산을 지원해 학생부종합전형을 장려하는데 실제 고등학교 현장에서는 고등학교 교육과정이 입시에 종속되는 부작용이 나타나고 있다고 말했다. 김 대표는 학종이 교내활동을 다양하게 만드는 등 학교 현장에 미치는 긍정적인 영향이 있긴 하지만 소논문 쓰기 등 고등학교에서는 가능하지도 않고 필요치도 않은 형식적인 스펙쌓기가 일어나는 것은 보완해야 할 점이라고 말했다.  진명선 기자 toranihani
"게임 그만해" 꾸짖자…흉기로 아버지 살해 '끔찍'	http://news.naver.com/main/read.nhn?mode=LSD&mid=shm&sid1=102&oid=055&aid=0000390885&cid=428288	요즘 게임 때문에 부모 자녀 간에 갈등을 빚는 경우가 많습니다만있어서는 안될 끔찍한 일이 일어났습니다. 게임을 그만하라고 나무라는 아버지를 20대 아들이 흉기로 살해했습니다.기자오늘23일 새벽 6시 10분쯤 경기 성남시 한 연립주택단지에서 비명이 터져 나왔습니다.21살 장 모 씨가 집 안에 있던 흉기로 아버지를 여러 차례 찌른 겁니다.아버지는 병원으로 옮겨졌지만 곧바로 숨졌습니다.주민  아들이 아버지랑 같이 살았다는데. 식구들이 놀라서 다 깼지.장 씨는 게임을 그만하라는 아버지의 꾸중을 듣고 흉기를 휘두른 것으로 파악됐습니다.김주호성남수정경찰서 형사과장  아버지가 게임 그만하고 일찍 자라 이런 식으로 이야기하니까 감정을 못 이겨 우발적으로 일을 저질렀다고.장 씨는 특별한 직업 없이 하루 7시간 넘게 온라인 게임을 해온 것으로 조사됐습니다.주민  1층에 그냥 파자마 바람으로 담배 피우고 있는 거 봤거든요. 그냥 백수인가 그런 느낌.숨진 아버지는 아내와 8년 전에 헤어진 뒤 아들 장 씨와 둘이 살아온 것으로 알려졌습니다.장 씨는 마침 집에 와 있던 삼촌의 신고로 붙잡혔습니다.장 씨가 평소 우울증을 앓고 있어서 오늘 장 씨를 데리고 병원에 갈 계획이었다고 삼촌은 경찰에 진술했습니다.경찰은 장 씨에 대해 존속살해 혐의로 구속영장을 신청할 예정입니다
영문도 모른 채 보험 가입 거부…'낡은 차라서?'	http://news.naver.com/main/read.nhn?mode=LSD&mid=shm&sid1=101&oid=055&aid=0000390881	보험사들의 자동차 보험 가입 거부가 도를 넘고 있습니다. 차가 오래돼서 사고가 빈발하는 지역에 살아서 처럼 거부하는 이유도 여러 가지인데요 속내를 살펴보면 이른바 돈이 되는 고객만 골라서 받겠다는 겁니다.기자25년 운전 경력의 강 모 씨는 지난해 접촉사고를 낸 뒤로 자동차 종합보험에 가입하지 못하고 있습니다.예전 같으면 할증료를 물면 됐지만 지금은 상황이 다릅니다.강 모 씨  두 건의 경미한 사고가 있었어요. 다른 보험사들도 전부 가입을 안 받는다는 거예요.60살 이 모 씨는 사고를 낸 적도 없지만 12년이나 몰던 트럭 때문에 보험가입을 거절당했습니다.이 모 씨  특별하게 사고도 없었고. 고위험 차량이기 때문에 재가입 안 된다.보험사들이 이러는 건 적자 때문 손해보험사들의 지난해 적자 규모는 1조 1천억 원으로 해마다 증가 추세입니다.문제는 상습 사고유발자 등 불량고객을 가려내기보다는 차종이나 연령대 심지어 사는 지역까지 인수거절 기준에 넣어 가입을 거부하고 있다는 겁니다.보험사 직원  사고가 많이 나는 지역 운전자들은 보험사가 아예 안 받으려고 해요.이러다 보니 영문도 모른 채 거절당하는 경우도 많습니다.보험사 상담원  사고가 있었거나 그런 경력도 없거든요. 이해가 가세요 저도 사실 이해가 안 가는데요.남근아한국소비자연맹 상담실장  아무 사고도 안 내고 꼬박꼬박 보험료만 내는 운전자들만 가입을 시킨다는 얘기밖에 안 되거든요.최근 자동차 보험을 판매하는 11개 보험사 가운데 9개사가 보험료를 인상했습니다
"옆 사람 바꿔줄래요?"…'여론조사' 허점투성이	http://news.naver.com/main/read.nhn?mode=LSD&mid=shm&sid1=100&oid=055&aid=0000390875	이번 총선 공천 과정이 과거와 가장 크게 달라진 점은 결정 과정에 여론조사가 많이 이용됐다는 걸 겁니다. 유권자의 뜻에 따르겠다는 취지는 좋았습니다만 결과적으로는 실패작이었다는 평가가 나오고 있습니다.최고운 기자가 그 이유를 설명하겠습니다.기자경선 여론조사가 치러진 강원 속초고성양양 유권자의 휴대전화 화면입니다.같은 조사 기관에서 전화를 두 세 번씩 받았습니다.정문헌새누리당 의원 지난 18일  지역 유권자들에게 1인 2표의 길을 의도적으로 열어준 것입니다.한 사람 답변을 받고 옆에 있는 사람을 바꿔달라고 해서 또 응답을 받았다는 증언도 나왔습니다.유권자  남자는 지금 다 여론조사가 끝났고 그 주위에 여자가 없느냐고 물어서 있다 그랬더니 바꿔달라 그래서 바꿔줬다.실제 여론조사 녹취  안녕하세요. 현재 어느 정당을 지지하는 편이십니까지지정당을 묻기는 하지만 솔직한 대답인지 확인할 방법도 없습니다.오영훈더불어민주당 후보자  새누리당을 지지하는 분들도 오영훈을 선택할 수 있습니다. 그때는 지지 정당이 없다고 말씀해 주셔야여론조사로만 뽑다 보니 이름이 알려진 현역이 상대적으로 유리해 경쟁이 불공정했습니다.장성호건국대 행정대학원 교수  국민의 여론을 수렴해서 이것을 참고 자료로 사용하는 것이지 이것을 결정적으로 사용하는 것은 정당 민주주의 자체를 부정하는 겁니다.새누리당에서만 여론조사 경선에 대한 문제 제기가 90건이나 나왔습니다.실수로 350명을 중복 조사한 경남 사천남해하동은 여론조사를 다시 하기도 했습니다.지지율 격차가 오차 범위 안에 들면 승부를 가릴 수 없다는 여론조사의 기본도 무시됐습니다.여야의 여론조사 경선은 민의를 반영한다는 취지보다는 문제점이 더 두드러진 실패작에 가까웠습니다
"매출 늘려주겠다" 영세 음식점들 등친 사기단	http://news.naver.com/main/read.nhn?mode=LSD&mid=shm&sid1=102&oid=214&aid=0000601150&cid=428288	앞으로 단골이 돼서 단체음식을 자주 주문하겠다 인터넷에서 유명한 맛집으로 만들어주겠다영세한 식당들에 이런 귀 솔깃한 말로 접근해서 사기를 친 일당이 잇따라 붙잡혔습니다. 리포트 경찰이 한 남성의 집에 들이닥칩니다.중국 위안화 뭉치와 휴대전화 여러 대가 발견됩니다.영세 음식점들만 골라 사기를 쳐온 중국 교포 최 모 씨가 머물던 곳입니다.최 씨는 일단 식당을 정한 뒤 근처 사무실로 이사를 왔는데 매일 저녁 단체 식사를 주문하겠다며 접근했습니다.피해 식당 주인배달도 시키겠다 하루 35만 원 저녁 식사해서 몇 개월 동안 유지하겠다 하니까.그리고는 일당과 짜고 1개에 1백만 원이 넘는 전자 부품을 거래하는 모습을 연출하며 잠시만 구입자금을 빌려달라고 꼬드겼습니다.단골 한 명이 아쉬운데다 돈도 벌 기회라는 생각에 식당 주인은 급하게 1천만 원을 넘겨줬습니다.피해 식당 주인돈 가방도 보여주고 살짝 열었는데 돈다발도 보여서 진짜 사업하는 사람이구나.하지만 이 부품은 실제로 7백 원짜리였습니다.최 씨 일당은 이런 수법으로 7년 동안 식당 23군데에서 4억여 원을 가로챘습니다.이번엔 부산의 한 콜센터 사무실 지도를 띄워놓고 음식점에 전화를 걸고 있습니다.유명 포털사이트에서 맛집으로 검색되도록 작업을 해주겠다는 겁니다.피해 식당 주인포털 첫 페이지에 띄워야 사람들이 많이 보잖아요. 한 달에 1만 6천 원이라니까.7백여 곳의 식당이 넘어갔지만 실제로는 거의 홍보가 이뤄지지 않았습니다
'환급 거부' 외제차 업체 6곳 수사	http://news.naver.com/main/read.nhn?mode=LSD&mid=shm&sid1=103&oid=449&aid=0000091319&cid=428288	BWM와 벤츠 등 고급 외제차 판매업체 6곳에 대한 검찰 수사가 시작됐습니다.이런 차를 산 사람들에게 개별 소비세가 내린 만큼 현금을 돌려주지 않아 고발됐기 때문입니다. 리포트정부가 지난해 말 중단했던 개별소비세 인하 연장을 결정한 것은 올 2월.인하 혜택이 중단됐던 지난 1월 구매자에 대해서도 인하 분 만큼의 환급을 결정했습니다.국내 차량 업체는 200억 원이 넘는 돈을 차를 산 사람들에게 돌려줬지만 외제 차 업체들은 환급을 거부했습니다.1월 당시 차량 가격을 올리지 않았기 때문에 인하 분이 이미 반영됐다는 게 외제 차 업체들의 주장.한 외제 차 업체의 수입 신고 필증을 분석한 결과 환급 거부로 6000만 원 가량인 차량 한 대 당 30만 원에 육박하는 개별소비세 차익을 챙겼습니다.업계에서는 외제 차 업체들이 남긴 차익이 총 10억 원이 넘을 것이라는 분석이 나옵니다.인터뷰  이정주  한국자동차소비자연맹회장 환급을 수십만 원 씩 적게 해줬다면 1월 판매량 1만6000여대 에 비교해 봤을 때 적어도 수십억 원의 부당 이익이 있었을 것으로소비자단체는 아우디 포드 인피니티 랜드로버 등 6개 외제 차 업체를 사기 혐의로 검찰에 고발했습니다.고발인 조사를 마친 검찰은 외제 차 업체들이 고의적으로 거짓된 정보를 소비자에게 전달한 사실이 있는지 확인할 방침입니다
함바집 '밥그릇'까지 탐내는 대기업들	http://news.naver.com/main/read.nhn?mode=LSD&mid=shm&sid1=101&oid=032&aid=0002686032	시장 포화에 새 영토로온산공단 식당 운영권엔  6개사 몰려큰 사업장으로 문제 안돼생계형 사업사회 통념에 어긋나대기업들이 이른바 함바일본어로 식당집이라고 불리는 건설 급식 시장에 진출하고 있다. 국내 단체급식 시장이 포화상태에 이르자 새로운 시장을 개척하기 위한 차원이지만 건설 급식을 주로 운영해온 중소업체들은 향후 생계를 위협받을 것이라며 우려하고 있다.23일 업계에 따르면 대림산업이 올해 1월 실시한 울산 온산공단 내 에쓰오일 정유석유화학 복합시설RUC의 근로자 식당 입찰에서 아워홈과 LSC푸드가 운영사로 선정됐다. LSC푸드는 중소 급식업체이지만 아워홈은 국내 단체급식 업계 2위다. 두 업체는 오는 5월부터 2018년 3월까지 전체 4개 구역 중 2개 구역씩 맡아 현장 식당을 운영한다. 한 끼 식대는 4682원으로 책정됐다. 매점 운영권까지 합치면 RUC 공사 기간에 두 업체는 각각 55억원 36억원의 매출을 기록할 것으로 예상된다. 이번 입찰에는 아워홈 외에도 동원홈푸드와 프레시웨이 등 대기업 계열 급식업체를 비롯해 GS건설과 대우건설이 각각 자회사로 운영하는 상락푸드와 푸드림 SK그룹 계열사의 위탁 급식을 맡고 있는 후니드 등이 참여했다.당시 입찰에는 최근 3년 내 건설현장 근로자 식당 1일 기준 1000명 이상의 실적을 가진 업체라는 참여 조건이 있었다. 입찰에 참여한 기업 모두 이미 건설 급식 사업을 벌인 경험이 있는 것이다. 중소 급식업체 관계자는 함바집은 가족 생계형 자영업자나 중소 규모 업체들이 하던 사업 영역이라며 과거에는 대기업들이 쳐다보지도 않았는데 몇 년 전부터 하나둘 참여하더니 이번에는 여러 대기업이 대거 참여했다고 말했다.대기업이 함바집 입찰에 참여하는 것은 국내 단체급식 시장 경쟁이 치열해졌기 때문으로 분석된다. 단체급식은 1995년 이후 연평균 13 이상 성장해왔지만 최근 상황은 녹록지 않다는 게 업계 중론이다. 2010년부터 학교급식 직영이 의무화된 데다 2012년에는 대기업 급식업체의 공공기관 구내식당 입찰 참여가 제한됐다. 대기업 급식업체들은 새로운 영토 확장을 위해 최근 해외 시장을 두드리고 병원이나 군대로도 눈을 돌리고 있다.업계는 국내 단체급식 시장 규모를 19조원가량으로 추산하고 있다. 산업체 5조9000억원 사무실 2조5000억원 중고등학교 2조3000억원 병원 2조2000억원 등이다. 건설 현장은 약 1조2000억원으로 예상된다.다른 중소 급식업체 관계자는 정부가 3년 전 공공기관 구내식당 입찰에 대기업 참여를 제한한 것은 중소기업 영역으로 판단했기 때문이라며 건설 급식은 대개 공공기관 구내식당보다 규모가 작아서 이 시장에 대한 대기업 진출은 사회적 통념상 맞지 않는 행태라고 말했다.대기업은 문제가 될 게 없다는 입장이다. 아워홈 관계자는 대림산업 입찰 건은 일반적인 함바집이 아니라 식수 인원이 많은 대규모 사업장이라 참여한 것이라며 앞으로 건설 급식 입찰에 또 참여할지 여부는 정해진 바 없다고 말했다.com 인기만화 웹툰 전권 무료만화 보기 모바일 경향 경향 뉴스진  경향신문 앱  모바일웹  공식 SNS 계정 경향 트위터 페이스북 세상과 경향의 소통 커뮤니티  경향신문www
