 "서로 아는 체도 안 해"…송전탑 건설에 무너진 밀양 공동체 	http://news.naver.com/main/read.nhn?oid=028&sid1=102&aid=0002347765&mid=shm&viewType=pc&mode=LSD&nh=20161229220316	르포 반대 투쟁 주민들 주민 갈등이 투쟁보다 힘들다 한전 보상금에 서로 갈라져이웃조차 믿을 수 없게 돼마을공동체 파괴 원인 찾기 위해 진상조사단도 꾸릴 예정경남 밀양시 부북면 평밭마을 주민들이 지난 28일 마을 진입로 인근 129번 송전탑 앞에 모여 송전탑 건설 반대투쟁은 끝나지 않았다고 외치고 있다.  길을 가다 마주쳐도 찬성반대 주민끼리는 서로 아는 체도 하지 않아요. 폐회로텔레비전CCTV을 설치하는 집도 계속 늘어나고 있고요. 이웃조차 믿을 수 없게 된 것이죠. 한전과 싸우던 송전탑 건설 반대투쟁 때보다 주민들끼리 싸우는 지금이 훨씬 괴롭습니다.  자신의 삶터에 초고압 송전탑이 건설되는 것을 막기 위해 10년 넘게 피눈물을 흘린 경남 밀양 할매들이 최근 마을공동체 파괴라는 심각한 후유증에 시달리고 있다. 주민들은 송전탑 건설을 막기 위해 밤낮으로 싸울 때는 희망이라도 있었는데 지금은 무엇을 위해 이 고통을 견디는지 모르겠다고 호소한다.  을씨년스런 찬바람이 휘날린 지난 28일.  기자와 만난 이남우73 평밭마을 송전탑 반대 주민 대표는 찬반 주민들 간 갈등에 따른 피해가 송전선로에서 발생하는 전자파 피해보다 심각하다. 싫으나 좋으나 서로 얼굴을 보며 살아야 하는 것이 너무 힘들다. 한 해를 넘기는 연말이 돼도 주민들끼리 모여 덕담 한마디 나누지 않는 이게 무슨 마을이냐며 목소리를 높였다.  밀양시 부북면 대항리 화악산 기슭에 자리 잡은 평밭마을은 송전탑 건설 반대투쟁의 중심에 섰던 마을 중 한 곳이다. 마을을 사이에 두고 129번 송전탑과 130번 송전탑이 세워져 있다. 송전탑 건설에 반대하는 주민 10여명은 이날 낮 마을 어귀 사랑방에 모여 과일과 김밥을 나눠 먹으며 이야기를 나누고 있었다. 송전탑 건설 반대투쟁을 벌였던 밀양 평밭마을 주민들은 마을 어귀에 사랑방을 마련해 서로를 위로하며 투쟁을 이어가고 있다.   김길곤85 평밭마을 자치회장은 생명과 우리라는 가치는 돈보다 훨씬 소중한 것인데 정부와 한전은 돈으로 주민들을 갈가리 찢어놓고 짓밟았다. 하루라도 빨리 새 대통령과 정부가 들어서서 모든 잘못을 바로잡아 줬으면 좋겠다고 말했다. 박순희79씨도 정부 정책에 찬성하지 않는 주민을 모두 나쁜 사람으로 모는 것은 잘못됐다. 사람이 할 짓이 아니다. 국민을 죽이는 나라가 무슨 나라냐며 정부를 비판했다.  평밭마을 주민 가운데 송전탑에서 가장 가까운 곳에 사는 구화자75씨는 날씨가 궂은 날이면 송전탑과 송전선로에서 나는 삐삐 쿵쿵 피웅피웅 등등 온갖 소리 때문에 귀가 따가울 지경이다. 또 밤마다 송전탑에서 불빛이 번쩍인다. 멀쩡하던 사람도 미쳐버릴 것 같다고 고통을 호소했다. 이금자85씨는 한전은 송전탑에서 나오는 전자파는 우리가 매일 보는 텔레비전에서 나오는 것보다 적다고 거짓말을 했다. 그리곤 돈으로 주민들 입을 막아버렸다. 아무것도 모르는 늙은이라지만 그래도 옳고 그른 것을 구분할 줄은 안다. 선량한 국민을 속이고 벌인 일이 언제까지고 숨겨질 것이라 생각한다면 큰 잘못이라고 말했다.  한옥순69씨는 살기 좋던 우리 마을을 한전이 돈으로 버려놓았다. 수천명 경찰이 몰려와도 버티던 주민들이 돈 앞에 맥없이 무너졌다. 매일 송전탑 근처를 지나갈 때마다 송전탑에 올라가 뛰어내려 죽고 싶은 생각이 든다고 말했다. 김사례88씨는 예전엔 데모하는 사람을 보면 모두 빨갱이인 줄 알았다. 그런데 내가 데모를 해보고 나서야 얼마나 한이 맺혔으면 데모를 하는지 알게 됐다. 지금이라도 철탑만 뽑아낸다면 춤이라도 덩실덩실 추겠다고 말했다. 밀양 평밭마을 주민 구화자씨가 자신의 집 근처에 세워진 129번 송전탑과 송전선로 때문에 겪는 고통을 호소하고 있다.   한국전력은 울산 울주군 신고리원전 34호기에서 생산할 전기를 전국에 공급하기 위해 원전에서 경남 창녕군 북경남변전소까지 울산 울주군 부산 기장군 경남 양산밀양시와 창녕군 등 5개 시군 90.5 구간에 밀양 69개 등 송전탑 161개를 세우고 송전선로를 설치하는 765 신고리북경남 송전선로 건설사업을 2008년 8월 착공했다. 원자력발전소 확대 에너지 정책을 펴는 우리 정부의 국책사업이었다.  하지만 전기 고속도로라고 불릴 만큼 초고압 송전선로가 마을과 논밭축사 인근을 통과할 것을 알게 된 밀양주민들은 2005년 12월부터 송전탑 건설 반대투쟁을 시작했다. 주민들은 밀양시 부북면 평밭마을과 위양마을 상동면 고답마을 단장면 용회마을 등 송전탑 건설 예정지에 움막을 짓고 번갈아 기거하며 밤낮으로 감시했다.  주민들은 마을에서 멀리 떨어진 곳으로 송전선 노선을 바꾸거나 전압을 낮춰 지하에 설치할 것을 요구했다. 또 전문가들을 동원해 스스로 대안을 찾는 노력도 했다.  하지만 한전은 시간이 너무 오래 걸리거나 현실성이 없다며 주민 요구를 거부하고 보상만을 강조했다. 돈으로 설득되지 않는 주민에겐 국책사업이라며 공권력을 동원했다. 한전은 송전탑 건설 반대투쟁에 소극적이던 주민들부터 집중적으로 공략했다. 밀양지역 보상 대상은 단장산외상동부북청도 등 5개면 30개 마을 2206가구였다. 정부와 한전은 송변전설비 주변지역의 보상 및 지원에 관한 법률송주법 등 보상 관련 법률과 한전 내규까지 바꿔 마을발전기금이라는 이름의 마을별 공동보상금 가운데 40를 가구별 개별지원금으로 전환했다. 지금껏 진행된 국책사업에서 전례를 찾을 수 없는 보상 방식이다.  가구별 개별지원금을 받으려면 송전탑 건설에 반대하지 않으며 이후 발생하는 문제에 이의를 제기하지 않겠다는 각서에 도장을 찍어야 했다. 개별지원금은 오손도손 살아가던 마을공동체를 갈기갈기 찢어놨다. 송주법에 따라 765 송전탑에서 반지름 1 안에 사는 주민은 전기휴대전화 사용료를 지원받을 수 있지만 한전은 지원을 신청하지 않았다는 이유로 송전탑 건설 반대 주민에게는 이를 지원하지 않고 있다. 송전탑 건설 반대에서 찬성으로 돌아서는 주민이 늘어나면서 마을발전기금까지 가구별로 나눠 가지는 마을도 생겼다.  결국 한전은 2014년 말 공사를 완료하고 시험운전을 거쳐 지난해 6월부터 원전에서 생산한 전기를 송전선로로 보내고 있다. 이 과정에서 지난 11년 동안 주민 2명이 목숨을 끊고 383명이 입건됐다. 주민들을 지원하기 위해 전국에서 밀양을 찾은 시민사회단체 회원 중에도 69명이 입건됐다. 23명은 아직도 법정투쟁을 벌이고 있다. 그래서 주민들은 전기는 눈물을 타고 흐른다고 말한다.  행정대집행이라는 이름으로 공권력에 의해 농성장이 모두 강제철거되자 주민들은 마을별로 사랑방을 만들었다. 현재 부북면 평밭마을과 위양마을 상동면 고정마을 단장면 용회마을과 동화전마을 등 5개 마을이 사랑방을 운영하고 있다. 평소에도 주민들은 이곳에 모여 음식을 만들어 먹으며 서로를 위로하고 투쟁을 이어간다.  밀양시 부북면 위양리 위양마을의 송전탑 반대 주민들은 지난 28일 추운 날씨 때문에 사랑방 대신 윤여림78씨 집에 모여 송년회를 열었다. 송전탑 건설을 막기위해 한겨울 눈을 맞으면서도 농성하던 밀양 주민들 모습. 밀양 765 송전탑 반대 대책위원회 제공   윤씨는 주민 반대를 막기 위해 정부와 한전은 주민들에게 공짜 돈을 안겨줬다. 하지만 공짜 돈은 사약과도 같다. 결국 정부도 죽이고 주민도 죽일 것이다. 우리 밀양의 송전탑 문제도 국회가 청문회를 열어 진실을 밝혀주면 좋겠다고 말했다.  손희경81씨는 돈을 받고 데모한다 데모에 나가지 않으려면 받았던 돈을 모두 돌려줘야 한다 등등 온갖 헛소문이 퍼졌다. 이젠 그게 사실이냐고 물어보는 사람에게 아니다고 말하기도 지쳤다. 그 사람들 꼴 보기 싫어 노인회관도 더이상 나가지 않는다고 말했다. 서종범58씨는 정부는 밀양 송전탑 건설 문제를 두고 찬반 논리로 갈등을 조장해 주민들을 이간질했다. 정부는 세월호 참사나 사드 배치 등 중요한 문제가 발생할 때마다 마치 공식이라도 있는 것처럼 똑같은 방식으로 대응하더라. 정부가 국민공동체지역공동체마을공동체 파괴의 주범이라는 것이 말이 되느냐며 안타까워 했다.  밀양 765송전탑 반대 대책위원회는 마을공동체 파괴 문제의 근본원인을 찾아 해결하기 위해 김경수 국회의원더민주김해을과 공동으로 마을공동체 파괴 진상조사단을 꾸릴 계획이다.  김준한 대책위 공동대표는 진상조사를 통해 주민들이 12년째 겪고 있는 고통의 근원을 밝혀냄으로써 정부와 한전에 민형사상 책임을 묻고 제도 개선까지 이끌어내고자 한다. 마을공동체 회복과 재산건강 피해 회복을 해야만 주민들이 예전처럼 일상생활로 되돌아갈 수 있을 것이라고 말했다. 김경수 의원은 송전탑 건설 과정에서 마을공동체가 파괴됐고 시간이 흐르면서 파괴 정도가 더욱 심해지고 있다는 것을 주민간담회를 통해 파악할 수 있었다. 이에 국회 산업통상자원위원회 차원의 조사를 벌여 내년 3월께 그 결과를 보고서로 낼 계획이라고 말했다
文 "대청산에 5년도 짧다"…'차기 임기단축론' 일축	http://news.naver.com/main/read.nhn?oid=001&sid1=100&aid=0008924346&mid=shm&mode=LSD&nh=20161229223143	추도사하는 문재인    남양주 임병식 기자  문재인 전 민주당 대표가 29일 경기도 남양주시 모란공원에서 열린 고 김근태 전 민주통합당 상임고문 5주기 추모행사에서 추도사하고 있다.kr과도정부 성격이 된다면 개혁 못해차기 정부 첫 과제 세월호대선전 개헌 불가능다음 정부 초반에 개헌하는 게 순리방위비 분담금 협상 미국에 끌려다녀선 안돼서울남양주 송수경 임형섭 서혜림 기자  더불어민주당 문재인 전 대표는 29일 개헌을 위해 차기 대통령이 임기를 단축해야 한다는 주장에 대해 대청산과 개혁을 해내려면 5년의 임기도 짧다며 촛불민심에 부합하는 주장인지 의문이라고 말했다.    문 전 대표는 이날 오후 경기 남양주시 마석 모란공원에서 거행된 고 김근태 전 민주당 상임고문 5주기 추모식에서 기자들과 만나 지금 3년 임기단축을 말한다면 다음 정부는 개헌을 위한 과도정부라는 의미밖에 되지 않는다며 구시대의 적폐를 청산하려면 다음 정부는 과도정부가 돼서는 안된다며 이같이 주장했다.    문 전 대표는 임기단축은 앞으로 개헌이 내각제 또는 이원집정부제로 결정됐을 때에 생각할 수 있는 문제라며 그러나 개헌은 일부 정치인들간 정치적인 계산으로 논의돼서는 안된다고 비판했다.     그러면서 벌써 개헌의 방향과 내용을 특정해 임기단축을 말하는 건 촛불민심과도 맞지 않고 다분히 정치공학적 이야기라고 지적했다.    문 전 대표는 이날 SBS 인터뷰에서도 임기를 단축하면 촛불민심이 바라는 개혁을 할 수 있겠는가라며 촛불민심을 배반하는 것이라고 말했다.    그는 개헌의 필요성에 대해 반대하는 사람은 없다. 다만 대선 전 개헌이 현실적으로 불가능하다는 것이라며 다음 정부 초반에 개헌하는 것이 순리라고 했다.    이에 대해 국민의당 손금주 대변인은 논평을 내고 문 전 대표는 5년이 짧다고 투정부리기 전에 본인이 개혁에 대한 비전을 갖고 있는지 곰곰이 생각해 봐야 한다며 이미 대통령이 다 된 것으로 생각하고 제왕적 대통령제를 놓기 아까운 것인가라고 비판한다.    문 전 대표는 대권 경쟁자인 반기문 유엔 사무총장에 대해서는 우리 쪽으로 왔어야 하는데 상대진영에서 출마한다면 섭섭하고 서글픈 일이라며 구시대구체제 속에서 늘 누렸던 분이어서 대청산대개혁 의지가 있을지 의문이라고 평가했다.     문 전 대표는 이날 오후 서강대 메리홀에서 열린 김 전 상임고문 추모문화에도 참석해 2017년을 제대로 점령해 새시대 새역사를 만들겠다고 거듭 강조했다.     그러면서 다음 대선 이후 들어설 민주정부는 세월호를 인양하고 아직 찾지못한 아이들을 찾아내겠다. 세월호의 진실을 낱낱이 규명하고 책임져야 할 사람들에게 책임을 묻고 안전한 한국을 만드는 것을 첫째가는 과제로 삼겠다는 약속을 드린다고 말했다.    외교안보 분야에 대한 의견개진도 이어졌다.    미국 외교안보 전문지 포린폴리시에 문 전 대표가 대통령이 되면 주한미군 방위비 분담금을 두고 도널드 트럼프 미국 대통령과 충돌하리라는 예측이 실린 것에는 트럼프 정부도 무리한 요구는 하지 않을 것이라고 말했다
환노위 '가습기살균제법' 통과…옥시에 분담금 500억 이상	http://news.naver.com/main/read.nhn?oid=001&sid1=100&aid=0008924263&mid=shm&mode=LSD&nh=20161229224757	원료물질 판매 SK케미칼도 250억원 분담금 서혜림 기자  국회 환경노동위원회가 29일 가습기살균제 피해자들의 지원 방안 등을 담은 가습기 살균제 피해 구제법을 통과시켰다.    가장 많은 제품을 판매한 옥시 레킷벤키저에는 500억원 이상의 분담금이 배정될 전망이다.    환노위는 이날 전체회의를 열고 국정조사에서 밝혀진 진상을 토대로 가습기 피해자들에 대한 구제방법과 지원대책을 규정하는 내용의 법안을 의결했다.    법안에는 피해자들에게 요양급여와 요양생활수당 장의비 간병비 특별유족조위금 및 특별장의비 등의 구제급여를 지급하는 내용을 규정하고 있다.     아울러 환경부에 급여 지급과 관련된 사항을 심의의결하기 위한 가습기살균제피해구제위원회를 두고 위원회 산하에는 폐질환조사판정 전문위원회와 폐이외질환조사판정 전문위원회를 두도록 했다.    또한 구제급여 대상 기준에 미치지 못하지만 지원이 필요하다고 인정되는 피해자를 위해 한국환경산업기술원에 특별구제계정을 설치해 운영하도록 규정했다.    특히 특별구제계정의 재원에 대해선 가습기살균제 사업자와 원료물질 사업자의 분담금으로 충당하기로 했다.     우선 제조업체의 전체 분담금은 1천억원으로 정했으며 각 업체의 생산량과 판매량 등에 비례해 분담률을 정하기로 했다.    환노위 관계자는 옥시의 경우 생산량판매량이 전체의 50를 초과하는 것으로 안다며 500억원 이상을 분담하게 될 것이라고 말했다.     원료물질 사업자인 SK케미칼에는 250억원의 분담금을 배당하기로 했다.    아울러 피해자 지원을 담당하는 가습기살균제종합지원센터와 건강피해의 조사연구 등을 위해 가습기살균제보건센터를 설치운영하도록 했다.    앞서 가습기살균제피해 국정조사 특위 위원장을 맡았던 더불어민주당 우원식 의원과 같은 당 홍영표 이언주 한정애 의원 국민의당 김삼화 의원 정의당 이정미 의원 무소속 서영교 의원 등이 구제법안을 개별적으로 제출했으나 환노위는 여야 논의를 통해 이들 내용을 병합조정해 단일안을 도출했다
푸틴 "시리아 전면휴전 합의"…30일 0시 발효	http://news.naver.com/main/read.nhn?oid=001&sid1=104&aid=0008924372&mid=shm&mode=LSD&nh=20161229225103	러터키이란 감시보증국 역할러 시리아 주둔 병력 감축 계획모스크바카이로 유철종 한상용 특파원  시리아 내 전면적 휴전에 관한 협정이 맺어져 30일 0시현지시간 발효한다고 러시아가 밝혔다.     인테르팍스 통신 등에 따르면 블라디미르 푸틴 러시아 대통령은 29일 낮 자국 외무국방장관 면담에서 몇 시간 전에 시리아 사태 해결과 관련한 3개의 문서가 서명됐다는 보고를 막 받았다며 이런 사실을 공표했다.    푸틴 대통령은 첫번째는 시리아 휴전에 관한 정부와 야권 간 합의 문서 두번째는 휴전 준수 감독을 위한 일련의 조치에 관한 문서 세번째는 시리아 평화협상 개시 준비 선언 등이라고 문서에 관해 부연했다.      그는 시리아 휴전 합의는 러시아 터키 이란 등의 공동 노력의 결과라고 평가하면서 지난 20일 모스크바에서 열린 3국 외무국방장관 회담에서 세 나라는 휴전 준수 감독은 물론 평화협상 보증국 역할을 맡겠다는 의무를 자임했다고 설명했다.     이어 3국 공동 노력의 결과인 휴전 합의는 아주 깨지기 쉬운 것이라며 각별한 주의와 인내가 필요하다고 덧붙였다.     세르게이 쇼이구 국방장관은 푸틴 대통령에게 휴전 합의가 30일 0시부터 발효할 것이라며 휴전 협정에 모두 6만 명 이상의 병력을 보유한 무장조직들이 서명했다고 보고했다.     이와 함께 푸틴 대통령은 시리아 주둔 러시아군 병력을 줄이자는 국방부의 제안에도 동의했다. 그는 그러나 국제테러리즘과의 전쟁과 테러리즘과 싸우는 시리아 정부에 대한 지원은 계속할 것이라고 강조했다.     시리아 국방부도 푸틴 대통령의 발표에 뒤이어 내놓은 성명에서 30일 0시부터 시리아 전역에서 전투행위를 중단한다고 밝혔다고 타스 통신이 전했다.      다만 수니파 극단주의 무장조직 이슬람국가IS와 자바트 알누스라자바트 파테알샴 등의 테러 조직에는 휴전이 해당하지 않는다고 성명은 덧붙였다.     이에 앞서 터키 정부도 이날 새해가 오기 전에 시리아에서 휴전을 이행할 계획이라고 밝혔다고 APAFP 통신 등이 전했다.    메블뤼트 차우쇼을루 터키 외교장관은 터키의 한 뉴스채널과 한 인터뷰에서 터키와 러시아 양국은 새해가 시작되기 전 시리아 전역에서 휴전이 이행될 수 있도록 계획하고 있다고 말했다.    차우쇼을루 장관은 또 이번 휴전이 성공적이라면 시리아 정부와 반군 간 정치적 협상이 카자흐스탄 수도 아스타나에서 이뤄질 것이라고 설명했다.    그러면서 시리아 휴전 이행을 위해서는 레바논 무장 정파 헤즈볼라를 포함해 모든 외국 무장 세력이 시리아에서 철수할 필요가 있다고 주장했다.     현재 헤즈볼라는 바샤르 알아사드 시리아 대통령 정권을 지원하기 위해 시리아에 수천 명의 대원을 파견한 상태다.     다만 차우쇼을루 장관은 터키와 러시아 중재로 다음 달 중순 열릴 예정인 아스타나 회담이 유엔이 추진하는 시리아 평화협상과 경쟁 관계에 있는 것은 아니라고 강조했다.    터키 관영 아나돌루 통신은 전날 터키 당국의 한 익명 관계자 말을 인용해 터키와 러시아가 28일 자정을 기해 시리아에서의 포괄적 휴전 계획에 합의했다고 전한 바 있다
지방의원 구속돼도 의정활동비는 '꼬박꼬박'	http://news.naver.com/main/read.nhn?oid=056&sid1=100&aid=0010401722&mid=shm&mode=LSD&nh=20161229215218	앵커 멘트지방의회 의원들은 비리혐의로 구속이 돼도 의정 활동비는 꼬박꼬박 챙겨온 것으로 드러났습니다. 정부는 구속된 지방의원에게는 의정활동비를 지급하지 않도록 조례 개정을 촉구하고 있지만 상당수 지방의회가 따르지 않고 있습니다. 리포트 의장이 되기 위해 동료 의원에게 돈을 건넨 혐의 등으로 지난 8월 구속된 김명식 전 경남 김해시의장. 김 전 의장은 사퇴하기 전까지 54일 동안 구금 상태였지만 두 달 치 의정활동비 220만 원을 받았습니다.녹취 경남 김해시의회 관계자음성변조  우리가 월별로 의정활동비가 나가거든요.  매달 월급날에 의정활동비가 110만 원씩  나갔고요. 지난 7월 구속된 경남 창녕군의회 의장도  사퇴하기까지 42일 동안  의정활동비를 받았습니다. 현재 구속된 전국의 지방의원은 8명. 아무 일도 않으면서 매달 110만 원씩 의정활동비를 받고 있습니다. 정부는 지난 9월 구속된 지방의원에게  의정활동비를 주지 못하도록 조례 개정을 촉구했습니다. 하지만 조례를 바꾼 곳은 22곳 곧 바꿀 곳도 56곳에 불과하고 나머지 165곳은  아직 발의조차 하지 않고 있습니다
독감 환자 '사상 최대', 실내 생활 유의해야	http://news.naver.com/main/read.nhn?oid=214&sid1=102&aid=0000716753&mid=shm&mode=LSD&nh=20161229211330	지난주 병원을 찾은 독감환자가 사상 최대치를 기록했습니다. 다행히 학생들이 방학에 들어가면서 독감유행은 한풀 꺾일 전망이지만 당분간은 계속 조심 하셔야겠습니다. 리포트 이번 독감의 특징은 고열이 나면서 근육통이 심하고 구토와 같은 소화기 증상이 나타나는 겁니다.이준희독감 환자기침을 계속 하다 보니까 구토도 나오고 몸이 죽을 것 같이 아팠어요.지난 한 주 독감 증상으로 병원을 찾은 사람만 외래 환자 1천 명당 86.2명 독감 유행이 시작된 11월 마지막 주에 비해 6.5배 급증해 사상 최대치를 기록했습니다.환자 상당수가 초 중 고등학교 학생으로 빨리 찾아온 추위와 늦게 시작된 방학이 독감 유행에 영향을 미친 것으로 보입니다.중 고등학생의 독감 백신 접종률이 10대로 부모 세대 접종률의 절반에도 미치지 못한 점도 또 하나의 이유입니다.민택기순천향대병원 소아청소년과 교수중고등학생들은 학교생활에 바쁘고 하다 보니 부모님과 같이 의료기관을 방문해서 예방접종 받을 시간이 적습니다.보건당국은 이번 주에 들어서면서 환자 수가 조금씩 줄어드는 추세이기는 하지만 유행 정점이 지났는지에 대해서는 좀 더 분석이 필요하다고 밝혔습니다.A형 독감 유행은 초 중 고등학교 방학을 맞아 점차 누그러들 것으로 전망됩니다
