허술한 규정 탓… 여전히 자욱한 담배연기	http://news.naver.com/main/read.nhn?mode=LSD&mid=shm&sid1=102&oid=022&aid=0003029040	금연 사각 스크린골프장당구장등 흡연 단속 제대로 못해 비흡연자 민원 빗발2년째 금연 중인 회사원 윤모36씨는 동료들과 회식 뒤 스크린골프장을 종종 찾는다. 직장 상사들도 즐기는 데다 술만 먹는 회식보다 낫다고 생각해 스크린골프장을 자주 가는 편이다. 하지만 참기 힘든 게 하나 있다. 골프장이 입주한 건물 복도마다 금연 표시가 돼 있는데도 골프 치러 온 사람의 절반 이상이 담배를 물고 있기 일쑤다. 윤씨는 과거 담배를 피울 때에도 남의 담배 연기를 맡는 게 싫었다며 정부가 금연 단속을 강화한다더니 이곳은 예외인 것 같다고 말했다.윤씨의 고충을 이해 못 할 바 아니나 허술한 규정 탓에 스크린골프장은 금연구역에서 빠졌다. 1000명 이상 관객을 수용하는 곳만 금연구역으로 지정되는 체육시설로 분류되기 때문이다. 즉 스크린골프장 입구 밖은 금연이지만 문을 열고 안으로 들어가는 순간 흡연이 가능하다는 얘기다. 이는 당구장도 마찬가지여서 재떨이 대용으로 종이컵을 제공하는 풍경이 낯설지 않다. 담뱃값 인상과 금연광고 강화 금연구역 확대 등 정부와 지방자치단체 주도의 금연 분위기가 확산하고 있지만 단속 사각지대가 많아 비흡연자들의 원성을 사고 있다. 흡연 단속 규정이 현실과 동떨어지거나 애매한 게 가장 큰 문제라는 지적이 나온다. 8일 서울시에 따르면 흡연 단속 실적이 자치구에 따라 천차만별이다. 서초구는 지난해 1만4664건의 흡연 사례를 단속한 반면 은평구는 54건에 그쳤다. 영등포4066건송파2739건강남1948건구 등도 단속 건수가 많은 데 비해 동대문99건성동128건구 등은 적발 사례가 34일에 한 건꼴로 나타났다. 이는 단속 규정 특성상 다중이용시설과 대형복합건물 등 유동인구가 많은 도심권은 조례로 금연구역을 지정해 적발이 용이하지만 그렇지 못한 지역은 단속이 여의치 않기 때문이다.지난해 금연구역으로 전면 지정된 음식점과 PC방도 흡연 당사자에게만 벌금을 물리다 보니 제대로 단속하기가 힘든 상황이다.한 단속 공무원은 업주 입장에서는 아무 불이익을 받지 않기 때문에 손님과 얼굴 붉혀가면서 실내 흡연을 만류할 이유가 없다며 미성년자에게 술을 파는 곳에 제재를 가하는 것처럼 금연구역인 영업점에서 흡연자가 적발되면 업주에게도 일정 부분 페널티를 주는 방안이 필요할 것 같다고 말했다.관련 지침이 애매해 단속이 어렵다는 목소리도 있다. 오피스텔은 건축법상 업무시설이고 전면 금연구역에 해당하지만 주거용이면 이야기가 달라진다. 보건복지부는 2016년 금연구역 지정관리 업무지침을 통해 주거용 공간은 사적공간으로 법률 적용이 미칠 수 없다며 복도나 계단 등에 대해서만 금연구역으로 지정관리하도록 했다. 흡연 민원이 발생해 단속 공무원이 출동해도 상가가 있는 층이 아닌 이상 단속이 쉽지 않은 것이다. 다른 단속 공무원은 복도나 계단에서 담배를 피우고 집안으로 들어가 버리면 방법이 없다고 지적했다.한국금연운동협의회장을 맡고 있는 국립암센터 서홍관 교수는 정부가 흡연은 질병이다는 식으로 금연 홍보만 밀어붙일 게 아니라 지역과 연령 성별 등에 따라 흡연이 인체에 어떤 해악을 끼치는지 꼼꼼하게 알리는 맞춤형 홍보가 돼야 한다고 조언했다
ISA 판촉 경쟁 '과열'…"불매운동" 움직임	http://news.naver.com/main/read.nhn?mode=LSD&mid=shm&sid1=101&oid=056&aid=0010293970	멘트 목돈을 굴릴 때 가장 신경 쓰이는 게 세금이죠. 그런데 한 통장에다 예금이든 펀드든 골라 담으면 2백만 원까지는 수익이 나도 세금을 안 물리는 개인종합자산관리계좌 ISA가 나왔습니다. 5년간 3천만 원을 투자해서  300만 원의 수익이 났다면 보통은 전체의 15.4 46만 원을 세금으로 내야 합니다. 반면 ISA는 2백만 원까지는 비과세 이 이상 수익도 세율이 낮은 9.9로 세금 9만 9천 원만 내면 됩니다. 만능 통장으로 불리며 투자자들의 관심이 뜨거운 이유입니다. 그런데 한쪽에서는 불매 운동 움직임까지 보인다는데 ISA 무슨 문제가 있는 걸까요. 리포트  다음 주 월요일 출시를 앞두고 은행과 증권사에는 ISA에 대한 문의가 빗발치고 있습니다. 녹취 최민지회사원  ISA가 세제 혜택이 많다고 하던데 어떤 게 있나요 2백만 원까지는 비과세이시고. 세제 혜택에다  투자의 편의성까지 더해졌습니다. 인터뷰 윤영준NH투자증권 상품기획부 이사  예금하려면 은행에 가고 ELS를 하려면 증권사에서 계좌를 만들었는데 ISA는 한 계좌에서 예금 펀드 ELS를 모두 분산 투자할 수 있습니다. 그러나 ISA는 투자에 실패하면 원금 손실을 볼 수 있는 상품입니다. 녹취 개인 투자자  ISA가 보편화 되면 모를까 지금은 뭔지 잘 모르니까 그냥 이대로가 제일 편한 거 같아요. 또 수수료율이 기존 상품보다 높을 것으로 예상되지만 이런 수수료율이나 최소 3년 이상인  의무 가입 기간에 대한 자세한 설명 없이 은행의 판촉 경쟁이 가열되고 있습니다. 인터뷰 조남희금융소비자원 대표  무차별 판매로 인한 소비자의 향후 피해가 우려된다는 측면에서 이러한 부분은 보완되어야 할 것으로 보입니다
윤상현 '김무성 욕설' 녹취록 파문…공천갈등 폭발	http://news.naver.com/main/hotissue/read.nhn?mid=hot&sid1=100&iid=1074992&oid=003&aid=0007085208&ptype=021&cid=1036749	김동현 정윤아 기자  대통령 정무특보 출신이자 새누리당 친박계 핵심인 윤상현 의원이 김무성 대표에게 욕설과 함께 컷오프를 해야 한다고 주장한 녹취록이 등장해 파문이 일고있다.김 대표측은 즉각 윤 의원의 공천 배제를 사실상 요구하는 등 새누리당의 공천갈등은 이제 폭발된 양상으로 양측간 노골적인 전면전이 불가피할 전망이다. 8일 채널A는 윤 의원이 누군가와의 전화통화에서 김무성 대표를 원색 비난하는 내용을 담은 녹취록을 입수해 공개했다. 녹취록에 따르면 윤 의원은 김무성이 죽여버리게. 그래서 전화했어라고 김 대표를 향한 극언을 퍼부었다. 윤 의원은 더 나아가 내가 당에서 가장 먼저 그런 XX부터 솎아내라고. 솎아내서 공천에서 떨어트려버려 한 거여라고 김 대표를 컷오프 시켜야 한다고 주장했다.윤 의원이 이같이 흥분한 이유는 지난 달 27일 김 대표가 친박에서 살생부를 만들고 있다고 발언한 사실이 언론에 보도됐기 때문이다. 윤 의원은 파문이 일자 출입기자들에게 문자메시지를 보내 2월 27일은 아침 신문을 통해 김무성 대표께서 친박 핵심으로부터 현역의원 40여 명의 물갈이 명단을 전달받았다는 말을 김 대표가 직접 했다는 뉴스를 접한 상태였다며 절대 그런 일이 없고 있지도 않은 일이 마치 사실인 것처럼 알려져 격분할 수밖에 없는 상황이었다고 자신의 욕설 사실을 인정했다.그는 그리고 그날 저녁 취중에 흥분한 상태에서 그러한 억울함을 토로하던 중 잘못된 말을 한 것 같다며 이유여하를 막론하고 그 같은 실언으로 마음을 아프게 해 드린 점 진심으로 사과드린다고 사과했다. 하지만 김 대표의 핵심 측근인 김학용 비서실장은 언론에 문자메시지를 통해 언론보도를 접하고 내 귀를 의심할 지경이라며 먼저 당대표에 대한 증오서린 욕설과 폭언을 서슴없이 하는 것에 대해 충격을 금할 수 없다고 격분했다.김 실장은 그간 총선을 앞두고 김무성 대표는 당의 단합과 새누리당의 총선 승리를 위해 헌신하며 인내해오고 있다며 그럼에도 불구하고 일부 의원은 매사 끊임없이 당대표를 흔들고 당의 분열을 조장해왔다고 친박계를 비난했다.그는 총선 승리를 위해 당이 뭉쳐도 모자를 판에 당대표를 흔드는 것을 넘어 욕설에 폭언 공천 탈락까지 운운하는 것은 도의적으로도 용납할 수 없는 망동이자 총선을 앞두고 당을 분열시키고 당의 힘을 약화시키는 도저히 용납해서는 안 되는 해당행위라고 규정했다. 그는 특히 이러한 발언을 한 의원이 당내에서 공천을 받고 이번 총선에 나간다면 국민들은 우리 새누리당을 어떻게 평가할 것인지 정말 너무나 걱정이 된다며 사실상 윤 의원의 공천 배제를 요구했다.그는 이번에 발언을 한 윤상현 의원은 누구와 통화했는지 철저히 진상을 밝히고 당윤리위원회에서 그에 상응하는 엄중한 징계를 내려 다시는 이러한 해당행위가 용납되지 않고 우리 새누리당이 추구하는 정당민주주의가 훼손되는 일이 없도록 일벌백계의 의지와 실천에 나서야 할 것이라고 당 차원의 진상조사를 요구했다.한편 이한구 공천관리위원장은 이날 저녁 여의도 당사 퇴근길에 기자들과 만나 자기들끼리 개인적으로 그런 얘기를 했는지 안했는지 모르잖나라며 술한잔 먹고 그런소리 한 것 아냐라고 영문을 알 수 없다는 반응을 보였다.이 위원장은 또 윤 의원의 해당 발언이 공천심사에 영향을 미칠 것으로 보나 라는 질문에 공천심사에는 너무 많은 요소를 넣으면 심사를 할 수가 없다고 답했다
젊은층 가구 소득 첫 마이너스 성장…왜 그런가 보니	http://news.naver.com/main/read.nhn?mode=LSD&mid=shm&sid1=101&oid=437&aid=0000111006	막 사회생활을 시작한 2030대 가구의 소득과 지출이 지난해 사상 처음으로 마이너스 성장을 기록한 것으로 나타났습니다. 다른 연령대는 조금씩이나마 늘었는데 사회의 미래를 책임질 젊은층의 소득은 줄어든 겁니다. 취업이 제대로 안 되고 비정규직이 넘쳐나니 소득이 줄고 전세 월세난에 시달리다 보니 지출도 줄었다는 해석입니다.기자가구주가 39살 이하인 2인 이상 가구의 지난해 월평균 소득은 1년 전보다 2만 3000원이 줄어든 431만 6000원입니다.2030대 가구의 소득이 감소한 것은 통계청의 가계동향 조사가 시작된 2003년 이후 처음입니다.8 늘어나는 등 다른 연령층은 모두 소득이 늘었기 때문에 단순히 경기 불황 탓도 아닙니다.전문가들은 취업이 잘 안되는 데다 비정규직 비율이 높기 때문으로 풀이합니다.신채호서울 청파동  임금은 사실 그대로인데 저희 회사 같은 경우는 변한 게 없거든요. 그런데 저축액이 준 거 보니까 물가가 올라서 그런 게 아닌가 싶습니다.박유섭서울 방화동  소득이 줄었다고 느끼죠. 알바비는 오르긴 올랐는데 다른 데 쓸데가 많아져서 그런 것 때문에 어렵기도 한 것 같아요.소득 감소는 지출에도 영향을 줬습니다.2030대 가구의 지난해 월평균 가계지출은 335만 9000원으로 2014년보다 0.정원석 JTBC 뉴스 공식 SNS 트위터 페이스북 카카오스토리 유튜브 JTBC 뉴스는 여러분의 생생한 제보를 기다립니다
30대 계모, 7살 아들 길에 버려…아동학대 부부 영장	http://news.naver.com/main/read.nhn?mode=LSD&mid=shm&sid1=102&oid=001&aid=0008240025	30대 계모 7살 아들 길에 버려아동학대 부부 영장    평택 경기 평택경찰서는 8일 아동복지법 위반 혐의로 신모38씨와 부인 김모38여씨에 대해 구속영장을 신청했다. 김씨는 지난달 20일 평택시 모처로 아들 A7군을 데려간 뒤 길에 버리고 홀로 귀가한 혐의를 받고 있다. 또 신씨와 함께 A군을 수시로 때리는 등 학대한 혐의도 받고 있다. 아이의 소재는 아직 확인되지 않고 있는 가운데 이들은 A군을 살해했는지에 대해선 부인하고 있다. 사진은 A군에 대한 실종전단.8 평택경찰서 제공    zorbayna.kr밥 안주고 1주일에 34차례 때려길에 버렸다 진술장기결석취학유예 심의 매뉴얼 적용 이상징후 포착    평택 최해민 류수현 기자  경기 평택에서 30대 계모가 남편과 전부인이 낳은 7살 아들을 길에 버려 경찰이 수사에 나섰다.    아이의 소재는 아직 확인되지 않고 있다.    경기 평택경찰서는 8일 아동복지법 위반 혐의로 신모38씨와 그의 부인 김모38여씨에 대해 구속영장을 신청했다.    김씨는 지난달 20일 평택시 모처로 아들 A7군을 데려간 뒤 길에 버리고 홀로 귀가한 혐의를 받고 있다.    또 신씨와 함께 A군을 수시로 때리는 등 학대한 혐의도 받고 있다.    경찰은 지난 4일 초등학교 입학 대상인 A군이 학교에 출석하지 않은 것을 이상히 여긴 학교측의 신고를 받고 조사에 나섰다가 할머니집에서 생활하는 큰딸10로부터 계모의 학대 행위가 있었다는 진술을 받아 정식 수사에 착수했다.    2013년 6월부터 신씨 가족과 함께 살아온 김씨는 아이들에게 밥을 주지 않고 자택 빌라 베란다에 가두는가 하면 1주일에 34차례씩 아이들을 때렸다고 범행을 시인했다.    지난달 20일 A군을 버리고 돌아온 뒤엔 남편에게 강원도에 있는 친정어머니 지인 집에 맡겼다고 거짓말한 것으로 조사됐다.    A군을 살해했는지에 대해선 부인하고 있다.    김씨는 범행동기에 대해 A군 때문에 부부싸움이 계속돼 남편이 없을 때 길에 버렸다고 진술했다.    신씨는 부인의 학대행위를 알고도 방임한 혐의를 받고 있다.    경찰은 신씨 부부에 대해 수사를 벌이던 중 7일 오후 이들이 자택 인근 호텔에 투숙한 점을 감안 신변을 비관한 극단적인 선택을 할 수 있다고 판단해 객실을 급습 둘에 대한 체포영장을 집행했다.    호텔 객실에서는 소주 4병과 수면제 90알이 발견됐다.    앞서 올 1월 7일 A군은 초등학교 신입생 예비소집일에 불참했으며 신씨는 같은달 14일 학교에 입학유예신청서를 제출한 것으로 드러났다.    당시 학교측의무교육학생관리위원회은 신씨에게 보호자와 학생이 참석한 자리에서 심의를 거쳐 학교장이 취학유예 결정을 할 수 있다고 설명했다.    하지만 입학식인 이달 2일 A군은 학교에 나오지 않았고 연이은 출석 독려에 김씨가 열흘 전 아이를 혼냈는데 애가 가출했다고 말하자 4일 경찰에 신고했다.    경찰조사에서 취학유예신청 이유에 대해 신씨는 아들이 아직 소변을 못가리는 등 성장이 늦고 올해 안에 다른 곳으로 이사할 예정이어서 학교를 1년 늦게 보내려 한 것이라고 주장했다.    경찰 관계자는 연이은 아동학대 사건 이후 교육당국은 취학유예신청또는 장기결석에 대해 의무교육학생관리위원회를 소집 부모에게 아이를 참석시켜 심의를 받도록 하는 새로운 매뉴얼을 만들었다며 이번 사건도 해당 초교에서 신씨 부부에게 A군을 데리고 위원회에 나오도록 독려하는 과정에서 이상 징후를 포착 적극적으로 경찰에 신고해 학대 사실을 밝혀내게 된 것이라고 말했다.    이어 하지만 아직 A군의 소재가 확인되지 않은만큼 아이의 안전상태를 확인하는데 최선을 다하고 있다고 덧붙였다.    경찰은 신씨 부부에 대해 추가 조사를 벌이는 한편 평택지역에 실종전단을 배포해 A군의 소재를 찾는데 수사력을 모으고 있다
'1여 다야' 수도권 선거구…'야권연대' 가능성은?	http://news.naver.com/main/read.nhn?mode=LSD&mid=shm&sid1=100&oid=055&aid=0000385504	야권에서는 통합과 연대가 최대 화두로 떠오르고 있습니다. 더민주의 통합 제안을 국민의당이 일단 거절했지만 내부적으로는 통합 또는 연대의 필요성에 대한 논란이 뜨겁습니다.기자국민의당 안철수 대표가 노원병 출마를 공식 선언했습니다.안철수국민의당 공동대표  허락해주신다면 노원구민 여러분과 함께 하겠습니다. 이곳 상계동에서 다시 시작하겠습니다.노원병에는 새누리당에서 이준석 후보의 출마가 유력하고 더민주에선 이동학황창화 후보가 준비하고 있습니다.수도권 122개 선거구 가운데 여당 후보 한 명에 더민주와 국민의당이 각축할 것으로 예상되는 지역구는 86곳입니다.서울에서만도 노원병을 필두로 관악 갑과 을 강동 을과 은평을 그리고 국민의당 김한길 상임선대위원장의 광진갑에서 1여 다야 구도가 확실시되고 있습니다.김한길국민의당 상임선대위원장  더불어 민주당과 우리 국민의당이 서로를 적대시하는 것은 결과적으로 박근혜 새누리 정권 도와주는 일이기 때문에 연대해야 합니다.다급하기는 더민주도 다를 게 없습니다.이종걸더불어민주당 원내대표  야권이 분열되면 여당이 개헌 의석을 차지할지도 모른다는 재앙과 같은 상황이 연출될 수 있다는야권연대가 성사된 지난 2012년 총선에서 여야 후보가 득표율 5p 이내 박빙 승부를 벌인 수도권 선거구는 모두 32곳입니다.연대가 안 되면 이 지역 상당수를 여당이 차지할 수 있는데다 수도권 선거구가 10곳 늘었기 때문에 분열의 파장은 더 클 거라는 게 대체적인 분석입니다.선거가 다가올수록 야권연대 압박도 그만큼 커질 수밖에 없단 얘기입니다
관광지에서 벌어지는 추태, 갑이 된 유커	http://news.naver.com/main/read.nhn?mode=LSD&mid=shm&sid1=104&oid=214&aid=0000597030	중국 관광객들 어느 나라에서나 큰손님이지만 종종 매너없는 행동 때문에 문제가 되곤 하죠.그런데 태국의 한 유명사찰이 유커들이 화장실을 지저분하게 쓴다는 이유로 출입을 금지했다가 관광이 주업인 현지 여론에 밀려서 공개 사과를 했습니다. 리포트 태국 북부 치앙라이의 관광명소인 백색 사찰.찰럼차이백색사찰 설립자 작년유커들이 화장실을 엉망으로 만들어요. 남자용 소변기에 대변을 보는 사람도 있어요.중국인 전용 화장실을 따로 짓겠다는 강경 발언도 서슴지 않았습니다.그랬던 사찰 측이 갑자기 인터넷에 동영상을 올려 중국인들에게 공개 사과했습니다.찰럼차이백색사찰 설립자유커들이 변기를 더럽히면 내가 닦으면 되고 기물을 부수면 내가 고치면 됩니다.주수입원인 유커들이 발길을 뚝 끊자 더 이상 버티지 못한 겁니다.동물원에서 새끼 호랑이에게 겁을 주려는 듯 우리를 발로 걷어차는 남성.태국인들이 신성시하는 아난타 사마콤 궁전 통로에서 버젓이 소변을 누는 여자 아이 방콕 돈무앙 공항 화장실에서 웃통을 벗고 돌아다니는 여성.유커들의 추태는 여전하지만 얼마 전부터 비판 여론은 고개를 숙였습니다. 가끔 이상한 분들도 있지만 중요한 손님이죠.지난해 태국을 찾은 유커는 8백30만 명으로 전체 외국인 관광객의 40 가까이 차지했습니다
한국, 가계부채 비율 신흥국 1위…13년째 '불명예'	http://news.naver.com/main/read.nhn?mode=LSD&mid=shm&sid1=101&oid=032&aid=0002682015	빚 권하는 정부부동산으로 경기 띄우려 대출 문턱 낮춘 탓저금리 그늘 속 소득은 제자리소비 꽁꽁 묶고 내수 짓눌러한국의 경제규모 대비 가계부채 비율이 주요 신흥국 가운데 가장 높은 것으로 나타났다. 부동산 등 자산가격 상승을 통한 경기 부양을 꾀하기 위해 저금리 기조를 유지하며 대출 문턱을 낮춰온 결과다. 하지만 빛의 속도로 늘어나는 빚에 비해 가계가 버는 돈은 제자리 수준을 맴돌면서 가계부채는 소비를 억제하고 내수를 짓누르는 요인이 되고 있다.8일 국제결제은행BIS 분기 보고서에 따르면 지난해 3분기 한국의 국내총생산GDP 대비 가계부채 비율은 87.2로 조사 대상인 17개 신흥국 중 가장 높았다. 한국은 2002년 2분기 GDP 대비 가계부채 비율이 홍콩을 앞지른 이후 13년째 신흥국 가운데 가장 높다. 미국일본영국 등 주요국에서는 2008년 글로벌 금융위기를 계기로 GDP 대비 가계부채 비율이 꾸준히 감소하고 있다. 반면 한국은 이 비율이 2009년 이후 10.6포인트나 높아지며 거꾸로 가고 있다. 오랜 기간의 제로 금리 정책으로 가계부채 문제가 심각한 일본만 해도 65. 한국의 가계부채 비율은 세계경제포럼이 임계치로 보는 75를 크게 넘는 수준이다.주요 선진국을 포함한 41개국 중에선 한국이 8번째로 높았다. 한국의 가계부채 비율이 높은 것은 거시금융정책이 빚을 늘리는 쪽으로 가고 있기 때문이다. 주택담보인정비율LTV 등 부동산 대출규제 완화 한국은행의 기준금리 인하 등이 부채를 증가시키는 요인으로 작용했다. 정부와 한은은 금리를 내리면 가계와 기업의 이자부담을 낮춰 소비와 투자가 증가하고 부동산과 주식시장의 가격을 높여 자산을 불릴 수 있을 것으로 봤다. 하지만 실제로는 금리를 내려도 소비와 투자를 자극하는 효과는 거의 없었다. 지난해 GDP 성장률은 2.6로 3년 만에 가장 낮은 수준으로 떨어졌고 가계의 소비심리를 보여주는 평균소비성향도 71.9로 통계 집계 이래 최저치다. 부동산 가격이 상승하는 효과가 나타나긴 했으나 이는 1200조원이 넘는 가계부채 문제를 남겼다. GDP 대비 가계부채 비율이 높은 스위스 덴마크 네덜란드 등은 모두 중앙은행이 마이너스 정책금리를 채택한 나라다. 이들 국가는 마이너스 금리 도입 이후 가계부채 증가 은행 수익성 악화 등 부작용을 겪고 있다. 지난해 7월 한국개발연구원KDI이 주최한 가계부채 관련 국제콘퍼런스에 참석했던 에스거 라우 엔더슨 덴마크 코펜하겐대 교수는 많은 가계가 금융위기 이후 늘어난 채무부담을 해소하기 위해 소비를 크게 줄였고 이는 덴마크 경제의 장기불황을 초래했다고 말한 바 있다. 특히 한국은 소득이 안정적인 주요 선진국과 달리 실질임금이 2000년 이후 정체 상태에 돌입하며 가계소득이 거의 늘어나지 않고 있다. 지난해 GDP 성장률은 2.7을 감안하면 실질소득 증가율은 0. 윤창현 서울시립대 교수는 낮은 금리의 효과가 그대로 나타난 것이라며 경제가 안 좋으니 금리를 더 내리자는 의견이 나오는 상황인 만큼 취약가구의 리스크가 커지지 않도록 선별적 지원책을 마련하는 등 가계부채 증가의 속도조절이 필요하다고 말했다.com 인기만화 웹툰 전권 무료만화 보기 모바일 경향 경향 뉴스진  경향신문 앱  모바일웹  공식 SNS 계정 경향 트위터 페이스북 세상과 경향의 소통 커뮤니티  경향신문www
