"설렌다, 7년 만의 출근…아프다, 아직 끝난 게 아니기에"	http://news.naver.com/main/read.nhn?mode=LSD&mid=shm&sid1=102&oid=032&aid=0002672443&cid=428288	2월1일 정규직으로 복귀하는 쌍용차 비정규직 서맹섭유제선씨7년 싸움 끝에 공장으로 돌아갈 수 있게 돼 기쁘다. 하지만 다른 한편으로 정규직 해고자들은 아직 못 돌아가고 있으니 마음이 불편하다.다음달 1일 정규직으로 복직하는 쌍용차 해고노동자 유제선씨왼쪽와 서맹섭씨가 지난 28일 경기 평택시 와락센터에서 7년간 벌여온 복직 투쟁에 대한 소회를 밝히고 있다.  평택  이준헌 기자 ifwedontkyunghyang.com지난 28일 경기 평택역 인근에 있는 와락센터쌍용차 해고노동자와 가족들을 위한 심리치유공간에서 만난 금속노조 쌍용차지부 비정규직지회장인 서맹섭씨40는 세월호 추모 리본이 달린 노조 조끼를 입고 있었다. 서씨는 쌍용차 협력업체에서 일하다 2009년 정규직에 대한 대규모 정리해고 이전에 일자리를 잃은 비정규직사내하청 노동자다. 서씨는 다음달이면 노조 조끼를 벗고 회사로부터 지급받은 작업복을 입는다. 쌍용차 노사가 지난달 말 사내하청 노동자 6명을 우선 복직시키는 데 합의했기 때문이다.7년간 거리에서 복직 투쟁을 벌이다 공장으로 돌아갈 수 있게 된 만큼 기쁜 마음이 들지 않는다면 거짓말일 것이다. 하지만 서씨는 1시간30분가량 진행된 경향신문과의 인터뷰에서 불편한 마음이 더 크다는 이야기를 자주 했다. 서씨와 함께 인터뷰에 응한 부지회장 유제선씨36 역시 마음이 아프다고 했다. 회사는 2017년 상반기까지 복직을 위해 노력한다는 구속력이 약한 합의서를 손에 쥐고 기약 없는 기다림의 시간을 보내야 할 정규직 해고자들에 대한 부채감 때문이다.사람들은 한국 사회에 해고는 살인이다라는 메시지를 각인시킨 쌍용차 사태를 정규직 정리해고 문제로 기억한다. 하지만 2009년 6월 976명에 대한 정리해고 이전에 먼저 잘려나가기 시작한 이들이 있다. 바로 서씨를 비롯한 사내하청 노동자들이다. 2008년 10월부터 협력업체 강제휴업 하청업체 폐업 등이 진행됐고 희망퇴직이라는 이름으로 포장된 해고가 이뤄졌다. 서씨는 위기감을 느낀 사내하청 노동자들은 비정규직지회를 세우고 대응에 나섰지만 수백명이 희망퇴직하는 흐름을 막아낼 순 없었다고 회상했다.한때 150여명에 이르던 비정규직지회 조합원은 2009년 5월 정리해고에 맞서 쌍용차 평택공장을 점거하는 등 77일간 진행된 파업 당시엔 20명이 채 남지 않았다. 서씨 등 사내하청 노동자 4명은 정규직 해고자들로 구성된 쌍용차지부와 7년간 함께 복직 투쟁을 벌인 끝에 공장으로 돌아가게 됐다. 정규직과 비정규직 간 이질감은 7년간의 세월 속에 희미해졌고 쌍용차지부는 비정규직을 제외한 복직 합의는 없다는 원칙을 지켜냈다. 비정규직지회도 비정규직 문제가 해고자 복직 교섭의 걸림돌이 되지 않도록 수억원의 임금을 포기하는 결단을 내렸다. 다시 공장으로 돌아가는 심경이 어떤가.서맹섭이하 서  2월1일부터 출근한다. 쌍용차 평택공장에서 회사 통근버스를 타고 안성에 있는 인재개발원으로 간다고 한다. 3주간 교육을 받고 공장으로 돌아가 현장실습을 한 뒤 작업에 배치된다. 한편으로는 비정규직에서 정규직으로 전환돼 공장으로 돌아가니 좋다. 하지만 150여명의 정규직 복직 희망자들은 아직 공장으로 돌아갈 수 없는 상황이라 불편한 마음이 더 크다.유제선이하 유  많이 착잡하다. 나 혼자 정규직 되려고 시작한 싸움이 아니었기 때문에 어떤 면에선 다소 갑작스러운 복직이기도 하다. 합의서에 나머지 해고자들은 2017년 상반기까지 회사가 복직을 위해 노력한다는 내용이 있다. 노력을 해도 안되면 어쩔 수 없다고 해석할 수 있는 내용이기에 아직 공장으로 돌아가지 못하는 해고자들은 불안할 수밖에 없다.이번에 복직하는 사내하청 노동자들은 협력업체 입사일 2년 경과 시부터 합의에 따른 채용일까지의 기간을 근무경력으로 인정받았다. 근속을 온전히 인정받은 완성차 업계 최초의 노사 합의로 회사가 사실상 불법파견을 인정한 것이다.현대차 불법파견 특별교섭의 잠정 합의 내용은 협력업체 23년 근무 시 1년 35년은 2년 57년은 3년 등으로 근속을 제한적으로 인정하는 방식이었다. 이 방식이 경력 일부 인정 신규 채용이라면 쌍용차의 합의 방식은 사내하청의 정규직 전환인 셈이다. 근속을 온전히 인정받은 것은 다행이지만 해고 기간의 임금은 포기했다. 4억원가량이라고 들었는데 쉽지 않은 선택이었을 것 같다.서  쉽지 않았지만 우리비정규직만 생각할 수 없는 상황이었다. 지난해 1월 5년5개월 만에 교섭이 재개됐는데 비정규직 복직 문제로 교섭이 중단될 위기까지 있었다. 정규직 해고자들과 7년을 같이 싸워 왔는데 우리 문제로 교섭이 중단돼선 안된다고 생각했다. 또 나를 포함한 사내하청 노동자 4명은 2013년 11월 근로자지위확인소송에서 승소를 했지만 나머지 2명은 아직 1심이 진행 중인 상황이었다. 나머지 2명을 남겨두고 4명만 돌아갈 순 없다고 생각했다. 그래서 어려운 결정이었지만 해고되지 않았다면 받을 수 있었던 임금을 포기했다. 처음부터 돈에 욕심이 있었다면 포기하지 못했을 텐데 그런 건 아니었기 때문에 가능했던 것 같다. 쓴웃음을 지으며 다만 가족들을 설득하는 게 쉽지는 않았다.유  내부적으로 의견이 많이 갈렸다. 우리가 10년을 다녀도 4억원의 반도 못 받는다는 현실적 이야기까지 나왔다. 밀린 임금은 당연히 받아야 하는 것이고 욕심부리고 말고의 문제는 아니었다. 나는 아직 미혼이라 다른 조합원들보다 조금 자유로울 수 있었던 건 사실이다. 그런데 우리 쪽팔리지 말자고 했다. 우리가 돈 포기 안 해서 일이 꼬였다는 이야기가 나오는 상황이 싫었다. 하지만 나중에는 다른 조합원들에게 미안하더라. 다시 그때로 돌아간다면 설득하지 못할 것 같다. 항소심 대법원까지 가도 쌍용차 노동자 지위를 확인받을 수 있는 가능성이 높았기 때문이다. 나 같은 경우는 월세방에 사는데 7년간 싸우면서 파산 면책도 겪었다. 이런 상황에서 언제 가정을 이룰 수 있겠느냐는 자괴감이 드는 것도 사실이다.김승섭 고려대 보건과학대학 교수가 지난해 5월 해고자 142명을 상대로 설문조사를 한 결과 4명 중 3명에게 지난 1년간 우울불안 증세가 있었고 10명 중 4명은 건강이 좋지 않다고 인식하고 있었다. 해고자 10명 중 9명은 해고 때문에 세상으로부터 소외감을 느끼고 있었다. 해고자 신분으로 지낸 7년의 시간은 겪어보지 않은 사람은 미루어 짐작하기도 어려운 것 같다.서  나는 아이가 4명이어서 쉽지 않았는데 마음을 비웠다고 해야 할까. 그만두라는 압력도 많이 받았지만 집사람이 이해를 많이 해줬다. 내가 선택한 길을 후회하지 않겠다고 했고 이 뜻을 지지해줬다. 사실 7년간 집 밖에서 보낸 시간이 대부분이다. 평택역에서 2년6개월 농성하고 지역구 새누리당 원유철 원내대표평택갑 사무실 앞에서도 6개월간 농성을 했다. 주변에선 그런 상황에서 아이들을 어떻게 키웠을까 궁금해하는데 주변의 도움을 많이 받았다. 비정규직으로 일할 때 임금이 최저임금 수준이었다. 애초부터 풍족한 삶 자체를 누리지 못했기 때문에 오히려 이런 상황에서도 버틸 수 있었던 것 같다. 공백기가 길었는데 업무 적응에 대한 걱정은 없나.서  해고 전까지 단종된 차종인 로디우스 차체 공정에서 일했는데 돌아가면 어디서 일하게 될지는 모르겠다. 어차피 가서 새로 다 배워야 한다. 새로운 회사 들어가서 일하는 것이라고 생각하면 큰 문제가 안될 것 같다.유  비정규직으로 일할 때 정규직에 비해 노동 강도가 엄청 강했다. 예전 경험이 있는 만큼 정규직으로 복귀하면 적응하는 데 무리는 없을 것 같다. 다만 나이를 7살 더 먹은 게 문제라면 문제일 수 있겠다웃음. 마지막으로 하고 싶은 말이 있다면.서  7년간 가족을 제대로 챙기지 못했는데 이젠 가족과 함께하는 시간을 늘리고 싶다. 그리고 밖에서 아직 싸우고 있는 수많은 비정규직 노동자를 잊지 않겠다. 비정규직은 비정규직이 제일 잘 안다. 함께 투쟁할 수는 없는 상황이지만 할 수 있는 연대를 하고 싶다.유  이번에 복직하지 못하는 동료들이 있기 때문에 아직 끝난 게 아니다. 많이 마음이 아플 것 같다. 이 아픔이 가실 때까지 지금까지 걸어온 길을 잊지 않겠다.    정규직 해고자 12명도일터로 우선 복귀이창근 금속노조 쌍용차지부 전 정책기획실장 등 정규직 해고자 12명도 서맹섭씨 등 비정규직사내하청 노동자 6명과 함께 다음달 1일부터 공장으로 돌아간다.쌍용차 노사가 지난달 말 조인한 합의서를 보면 향후 회사는 인력 충원 시 해고자 2009년 정리해고 당시 희망퇴직자 신규채용자의 비율을 각각 30 30 40로 하기로 했다.합의서에는 없었던 정규직 해고자 12명이 복귀하게 된 것은 교섭 과정에서 회사가 이달 중 채용공고를 내고 40명을 새로 뽑는다고 노사 간 의견을 모았기 때문이다. 합의서에 사내하청 노동자 6명을 채용키로 한 내용이 있었던 만큼 이들을 뽑을 때 일부 인원을 더 충원하자는 쌍용차지부 의견이 반영된 것이다. 이에 따라 회사는 최근 채용공고를 냈고 40명의 30에 해당하는 12명정규직 해고자이 합격했다.일단 정규직 해고자 중에서 복직을 희망하는 150여명 가운데 12명이 공장으로 돌아가게 됐지만 나머지 해고자들이 언제 돌아갈 수 있을지는 미지수다. 노사 합의서에 2017년 상반기까지 이들이 복직될 수 있도록 회사가 노력한다는 조항이 있지만 강제력은 없기 때문이다.김득중 쌍용차지부장은 우선 복직을 하는 비정규직 노동자들이 부채감을 가지지 않았으면 좋겠다고 했다. 김 지부장은 29일 경향신문과의 통화에서 비정규직 노동자들이 우선적으로 복귀하는 것이고 나머지 공장 밖에 있는 해고자들도 그런 날을 맞이하게 될 것이라며 많은 분들이 아직 대기 중이라 마음이 불편하겠지만 그 불편함을 털어버리고 마음껏 기뻐했으면 좋겠다고 말했다.com 인기만화 웹툰 전권 무료만화 보기 모바일 경향 경향 뉴스진  경향신문 앱  모바일웹  공식 SNS 계정 경향 트위터 페이스북 세상과 경향의 소통 커뮤니티  경향신문www
 범죄 시한폭탄 '사회적 외톨이'	http://news.naver.com/main/read.nhn?mode=LSD&mid=shm&sid1=102&oid=022&aid=0003006034&cid=428288	흉기난동 등 묻지마 범죄 빈발외부와 단절 분노 통제력 약해사회적 관심제도적 지원 시급최근 서울 도심과 출근길 지하철 안에서 흉기를 이용한 묻지마 범죄가 잇따라 충격을 준 가운데 이번에는 20대 탈북자가 이웃을 상대로 한 흉기 난동 사건이 발생했다. 서울 마포경찰서는 29일 김모22씨를 특수폭행 혐의로 구속했다고 밝혔다. 경찰에 따르면 마포구의 한 아파트에 사는 김씨는 지난 25일 오후 6시50분쯤 시끄럽다며 흉기를 들고 아래층 박모42씨의 집으로 내려가 10여분간 난동을 부린 혐의를 받고 있다. 박씨는 누군가가 현관 문을 마구 걷어차는 소리에 문을 열었다가 달려드는 김씨와 몸싸움을 벌였고 김씨는 신고를 받고 출동한 경찰에 체포됐다.탈북자 출신인 김씨는 평소에도 아파트 주민들과 마찰을 일으켰다고 한다. 주민 A씨는 김씨가 다른 집 문을 차고 다니며 소리를 지르거나 다른 주민과 시비를 붙는 등 소란을 많이 일으켜 경찰에 신경 좀 써달라고 당부한 게 여러 차례라고 말했다. 경비원 B씨도 한 번은 김씨가 위층 할머니를 폭행하고 있다는 신고를 받고 저지하러 간 적도 있다고 전했다.그러나 피해자 박씨는 김씨가 남한사회에 적응을 못한 채 은둔형 외톨이로 지내는 것 같았다며 한창 일할 나이에 하루 종일 집안에만 틀어박혀 있다 보니 답답한 마음이 쌓여 그런 것이 아니겠느냐고 안타까워했다. 전문가들은 김씨와 같이 외부와 단절된 채 살아가는 이들은 스스로 분노를 통제하지 못하고 공격성을 띠는 만큼 사회적 관심이 필요하다고 지적한다. 앞서 지난 25일 서울 금천구에서 50대 남성이 식당가를 배회하며 흉기를 휘두르고 지하철 1호선에서 50대 노숙인이 사람이 많아 짜증난다며 흉기로 위협하다 검거된 바 있다
위안부 피해 할머니들, 日정부 상대 정식 손배소	http://news.naver.com/main/hotissue/read.nhn?mid=hot&sid1=102&iid=925818&oid=014&aid=0003591568&ptype=021&cid=1021451	일본 정부를 상대로 한 위안부 피해 할머니들의 손해배상 청구가 조정 절차로 해결되지 않아 정식 소송절차로 넘어갔다.서울중앙지법은 위안부 피해 할머니들의 조정 신청 사건을 민사합의34부김성수 부장판사가 심리하는 손해배상 청구 소송으로 이관하는 절차를 마무리했다고 29일 밝혔다.앞서 서울중앙지법 민사92단독 문광섭 부장판사는 지난달 30일 신청된 조정 사건에 조정을 하지 않는 결정을 내리고 정식 소송으로 넘기는 절차를 밟았다.이 조정 신청은 경기도 광주 나눔의 집에 거주하는 이옥선 할머니87 등 위안부 피해자 12명이 2013년 8월 일본 정부를 상대로 낸 손해배상 청구 조정 신청이다. 손해배상 청구액은 1인당 1억원씩 총 12억원이었다.그러나 일본 정부가 2년여간 한국 법원이 보낸 사건 서류 등을 거듭 반송하고 지난해 법원이 통지한 두 차례 조정기일에도 응하지 않자 할머니들은 정식 소송을 시작해달라는 신청서를 법원에 제출했다. 법원은 할머니들의 요구와 일본 정부의 태도 등을 고려해 이 사건을 정식 소송으로 다루기로 했다. 법원은 일단 일본 정부 측에 소장을 송달하고 사건 쟁점을 정리하는 절차를 밟은 뒤 첫 변론기일을 잡을 예정이다
폭스바겐 '과징금 차량' 허위 기재…환경부 '깜깜'	http://news.naver.com/main/read.nhn?mode=LSD&mid=shm&sid1=103&oid=056&aid=0010279922&cid=428288	멘트저가의 배출가스 촉매장치를 부착해 팔았던 아우디폭스바겐 코리아가 정부로부터 리콜 명령과 함께 과징금을 부과받았는데요.과징금 대상 차량들을 허위로 기재해 과징금 17억 원을 덜 낸 것이 KBS 취재 결과 드러났습니다. 환경부는  속았다고 주장하고 있습니다. 리포트 5년 전 출시된 아우디 A4입니다. 아우디폭스바겐 측은 이 차를 포함해 9800여 대의 차량에 싸구려 배출가스 촉매 장치를 달았다가 지난 2014년 환경부에 적발됐습니다. 리콜에 과징금 부과가 결정됐습니다. 녹취 환경부 관계자음성변조  우리한테 아예 안 맞는 차였죠. 유럽에서 안되고 쓰지도 못하고 중국이나 뭐 그런 데 들어가는 차들 부품을 한국에서 판 거죠. 환경부는 과징금 부과를 위해 아우디폭스바겐 측에 인증번호 제출을 명령했습니다. 문제의 차량은 모두 9813대.아우디코리아는 해당 차량들에 부여된 인증번호로 8MY로 시작하는 번호 단 한 개만을 신고했습니다. 인증번호란 배출가스 검사에 통과하면 부여되는 고유 번호로 인증번호 하나에 최대 과징금 10억 원이 부과됩니다. 환경부는 문제가 된 차량의 인증번호가 하나뿐이라는 신고를 토대로 10억 원의 과징금을 부과했습니다. 그러나 취재진이 확인한 결과 싸구려 촉매를 달아 마찬가지로 리콜을 받았던 다른 아우디 차량의 인증번호는  AMY로 시작하는 또 다른 번호였습니다. 환경부에 제출한 것과 다른 제 2의 인증 번호가 발견된 겁니다.녹취 아우디폭스바겐 측 관계자음성변조  분명한 거는 AMY는 리콜 대상이 아니다. 확인했는데요 8MY만 리콜 대상입니다. 문제가 된 아우디 차량에 부과된 제 3의 인증번호도 확인됐습니다.결국 리콜 대상 차량 9800여 대에 부여됐던 인증번호는 모두 3개. 냈어야 할 과징금은 27억 원으로 허위 기재로 17억 원을 내지 않은 겁니다. KBS 취재가 시작되자 아우디폭스바겐 측은 실수였다면서 환경부에 자발적으로 보고했다는 내용의 보도자료를 급히 배포했습니다. 환경부는  문제의 차량 9800여 대의 인증번호가 몇 개인지 모르고 있었습니다.녹취 환경부 관계자음성변조  아.  그럼 인증번호가 세 개인 거잖아요  네 네 취재진이 말씀하신 뒤에 알게 됐습니다.인터뷰 최영석법안전연구소 차량안전부  지금까지 이런 방식으로 부과돼 온 여러 사례에 대해 재조사가 필요하다고 생각합니다
공소시효 끝난 줄 알고… 입국장서 딱 걸린 사기범	http://news.naver.com/main/read.nhn?mode=LSD&mid=shm&sid1=102&oid=022&aid=0003006032&cid=428288	지난 21일 상공에서 고국 땅을 내려다본 김모54여씨는 가슴이 설다. 아프리카 최남단에서 지긋지긋한 도피생활을 한 지 7년 만의 귀국이었다. 인천국제공항의 입국심사대만 통과하면 유학을 마친 아들과 함께 다시 새출발을 할 수 있을 거란 꿈에 부풀었다.김씨는 아들의 손을 꼭 붙잡고 입국심사대 앞에 서서 여권을 내밀었다. 하지만 신원 확인 모니터를 바라보던 심사대 직원은 잠깐 기다려 보라고 했다. 김씨는 잠시 후 나타난 경찰에 붙들렸다. 자신이 저지른 사기죄 공소시효가 완료된 줄 착각한 결과다. 김씨는 2007년 4월 재개발 지역도 아니고 애초 자기 소유도 아닌 서울 동대문구의 한 주택을 재개발할 예정이라고 속여 강모39씨에게 팔았다. 김씨는 이 과정에서 강씨가 준 계약금과 중도금 5000만원으로 해당 집을 산 뒤 바로 강씨에게 잔금 1억3000만원을 받고 넘겼다.뒤늦게 속은 것을 안 강씨의 고소로 김씨는 2009년 9월 경찰에 사기 혐의로 입건됐다. 이어 경찰 조사가 시작된 지 닷새 후 아들이 유학 중인 남아프리카공화국으로 출국했다. 사기죄의 공소시효가 7년2010년부터 10년으로 변경이란 것을 알고 2014년 상반기까지만 해외에서 버티면 처벌을 피할 수 있을 것이란 판단에서다. 피의자가 해외로 도주할 경우 수배가 내려지고 공소시효가 정지된다는 사실은 알지 못한 채다
애플 전원 어댑터 '감전 위험'…리콜 대상 제품은?	http://news.naver.com/main/read.nhn?mode=LSD&mid=shm&sid1=105&oid=055&aid=0000372755	애플이 아이폰과 아이패드를 충전할 때 사용하는 전원 어댑터를 리콜하기로 했습니다. 철심이 노출되면서 감전 될 수 있기 때문인데 우리나라에서 팔린 제품도 리콜 대상입니다.기자애플 미국 홈페이지에 올라온 사진입니다.플러그 앞부분이 분리돼 전원 콘센트에 꽂혀 있습니다.이 사진을 올린 사람은 철심이 그대로 노출돼 감전될 뻔한 위험한 상황이었다고 설명했습니다.이와 관련해 애플은 드문 경우 플러그 어댑터가 파손돼 감전 위험이 있으며 전 세계적으로 12건의 사례가 파악됐다면서 리콜을 발표했습니다.리콜 대상은 한국과 유럽 호주 등에서 2003년부터 2015년까지 맥북과 아이폰 아이패드와 함께 제공된 플러그 어댑터입니다.문제의 플러그 어댑터에는 이처럼 내부에 45자리 글자가 표시돼 있거나 아무 글자도 적혀 있지 않습니다.알파벳 세 글자로 지역 코드가 표시된 제품과 납작한 육각기둥 모양의 USB 전원 어댑터는 리콜 대상이 아닙니다.애플코리아 측은 오늘29일부터 리콜에 착수했습니다.애플 AS 직원  다 교체를 새로 해 드리라고 내려왔어요. 사람들 많이 왔었나요네 많이 왔어요.애플은 지난 2008년과 2014년에도 미국과 유럽 등에서 전원 어댑터 문제로 리콜을 실시한 바 있습니다
