글로벌 노동시장 미스터리…실업률 급락에도 임금은 게걸음	http://news.naver.com/main/read.nhn?mode=LSD&mid=shm&sid1=101&oid=009&aid=0003705121&cid=428288	Indepth Plus  임시직 중심 긱 이코노미 확산    실업률이 완전고용 수준으로 뚝 떨어지는 등 노동시장이 상당 폭 개선됐는데도 임금 상승 신호가 약해 놀랐다.지난 16일 미국 연방공개시장위원회FOMC 정례회의 후 열린 기자회견에서 재닛 옐런 미 연방준비제도이사회 의장이 한 발언이다. 필립스 곡선 신봉자인 옐런 의장에게 실업률이 완전고용 수준인 4대로 확 떨어졌는데도 7년째 임금이 게걸음을 하고 있는 상황이 당혹스러울 수밖에 없다. 영국 경제학자 필립스가 1958년 발표한 필립스 곡선은 실업률과 임금상승률은 역의 상관관계에 있다는 고전적 경제이론이다. 실업률이 하락하면 그만큼 가용할 수 있는 노동력이 귀해지고 이는 임금 인상과 물가 상승으로 이어진다는 게 필립스 곡선의 골자다. 일본 실업률이 3 초반까지 떨어졌고 영국은 10년 만에 최저 실업률을 기록했지만 임금 상승세는 실망스럽다. 미 샌프란시스코 연방준비은행은 필립스 곡선이 먹혀들지 않는 최근 상황을 임금 상승 수수께끼wage growth conundrum라고 표현했다. 과연 전 세계 노동시장에 무슨 일이 일어나고 있는 걸까. 2009년 10월 10까지 치솟았던 실업률이 연준의 대대적인 양적완화 정책 덕분에 4. 수치로만 보면 거의 완전고용 수준이다. 반면 미국의 시간당 평균 임금상승률전년 동월 대비은 2009년 10월 2. 고용시장 여건은 20052007년 글로벌 금융위기 이전 수준으로 회복됐지만 시간당 평균 임금상승률은 금융위기 이전 수준33.5에 크게 못 미치고 있다. 이 때문에 임금 인상 등 비용 상승 때문에 물가가 오르는 비용인플레이션costpush inflation을 통해 물가상승률을 연준이 목표로 하는 2대로 올리려는 전략도 먹혀들지 않고 있다. 월가 이코노미스트들은 실업률 급락에도 좀처럼 임금이 강하게 상승하지 않는 가장 큰 이유로 저임금 일자리 급증을 꼽고 있다. 바로 긱gig임시직 이코노미의 급부상이다. 긱 이코노미는 필요할 때마다 임시로 인력을 고용해 일을 맡기는 경제 시스템으로 정규직보다는 임시직이 중심이다. 차량 공유 서비스 우버 택시기사 숙박 공유업체 에어비앤비 숙박 제공 호스트 등이 긱경제 핵심이다. 월스트리트저널은 미 경제를 뒤흔드는 임시대체직 긱 근로자가 우버 등 공유경제는 물론 전통산업군에 속한 기업과 정부에서도 가파르게 늘고 있다고 전했다. 앨런 크루거 프린스턴대 교수와 로런스 카츠 하버드대 교수 연구 결과에 따르면 2005년 10였던 미국 대체근로자 비중이 지난해 16로 올라섰다. 스티브 블리츠 ITG인베스트먼트 수석이코노미스트는 마켓워치와 인터뷰하면서 지난 2월 노동시장 지표를 보면 일자리 증가의 66를 소매업 헬스케어 외식업이 차지했다며 이들 직종은 모두 저임금 직업이라고 설명했다. 반면 비교적 높은 임금을 주는 제조업에너지전문직 일자리는 줄어든 것으로 나타났다. 정규직 감소분이 저임금시간제근로자로 대체되는 긱 이코노미가 확산되면서 고용의 질이 악화되고 있다는 분석이다.샌프란시스코 연방은행도 미국 임금 상승 왜 더딘가 보고서를 통해 고임금에 익숙한 미국 베이비붐 세대가 속속 은퇴하는 대신 저임금 근로자 위주로 고용이 일어나면서 임금 상승세를 제약하고 있다고 진단했다. 샌프란시스코 연은은 필립스 곡선이 먹혀들지 않는 또 다른 이유로 미국 내 강한 임금 하방 경직성을 꼽았다. 2008년 글로벌 금융위기 직후 실업률이 급등한 반면 임금 상승 둔화 폭은 상당히 완만했다. 이 같은 현상이 역으로 이제는 미 경제가 회복기를 맞았음에도 임금 상승은 더딘 원인으로 작용하고 있다. 일부 전문가들은 미 노동시장 내 눈에 보이지 않는 적지 않은 유휴인력이 임금 상승 발목을 잡고 있다고 보고 있다. 장기 실업으로 일자리 찾기를 포기한 구직 포기자와 비자발적 시간제근로자까지 포함하는 광의의 실업률U6이 10에 육박해 여전히 2008년 금융위기 이전8대보다 크게 높은 상황이다.일본의 경우 2012년 말 아베 신조 2차 정권이 들어서면서 아베노믹스가 본격 가동됐고 2012년 4.3였던 실업률은 올해 1월 3. 하지만 아베 정권 들어 물가를 감안한 실질임금은 오히려 마이너스 성장세를 보였다. 지난해에도 실질임금상승률은 전년 대비 0. 실업률이 감소했지만 임금 인상률이 하락하는 현상은 일본 인구 구조에서 비롯된다. 일본 전후 베이비붐 세대로 은퇴를 앞두거나 은퇴를 준비 중인 6064세 인구는 849만명이다. 반면 대학 졸업 후 취업에 나선 2024세 인구는 623만명이다. 은퇴 대상자가 취업 대기생보다 많기 때문에 일본 대졸 취업률은 96. 그런데 기업들이 인건비를 줄이기 위해 은퇴자 자리를 정규직 대신 비정규직으로 채우면서 저임금이 심화되고 있다.8였던 정규직 비율은 지난해 62. 게다가 임금 수준과 상승률이 상대적으로 높은 대기업 제조업체보다는 유통 등 서비스업 신규 채용이 늘고 있는데 이들 업종은 임금 수준이 높지 않다. 유럽이나 미국 등 선진국과 달리 저출산고령화에도 불구하고 일본 편의점이나 패스트푸드점 점원이 일본 젊은이들로 채워져 있는 점은 선진국 노동시장에서 보기 힘든 특이한 구조다.실업률은 최저 수준인데 임금은 오르지 않는 추세는 유럽에서도 일반적인 현상이 되고 있다. 유럽연합EU 경제 우등생인 영국 실업률은 1월 말 현재 5. 하지만 지난해 4분기 현재 전년 동기 대비 임금상승률은 1. 고용은 금융위기 이전 수준을 회복했지만 임금상승률은 위기 이전 수준의 절반에 불과하다. 물가상승률이 제로에 가깝다 보니 임금인상률이 2만 되더라도 근로자들은 감지덕지다. 또 영국으로 건너온 이민 노동자들이 늘어나면서 고용주들은 값싼 노동력을 선별해 채용할 수 있는 유리한 입장이 됐다. 파이낸셜타임스FT에 따르면 영국에서 일하는 EU 회원국 이민자는 2012년 이후 40 폭증해 지난해 사상 처음으로 200만명을 넘어섰다. 또 영국 기업들이 비용을 절감하기 위해 상대적으로 인건비가 낮은 해외로 거점을 옮기면서 임금 상승이 정체되는 구조가 만들어졌다. 생계를 꾸리기 위해 일터로 내몰리는 고령자 인구가 더 많아지고 있는 점도 있다. 영란은행BOE은 임금인상률이 금융위기 이전으로 회복되려면 2018년은 돼야 할 것으로 전망했다.용어긱 이코노미  1920년대 미국 재즈공연장 주변에서 연주자를 필요에 따라 섭외해 단기 공연을 진행했던 긱gig에서 유래한 용어로 그때그때 임시직을 섭외해 일을 맡기는 경제 형태를 말한다. 새로운 일자리를 창출해 실업률을 낮추는 데 도움이 된다는 견해와 주로 비정규직임시직을 늘려 고용의 질을 떨어뜨린다는 염려가 동시에 제기되고 있다
감염돼도 10명 중 8명 증상없어…지카바이러스..	http://news.naver.com/main/read.nhn?mode=LSD&mid=shm&sid1=102&oid=469&aid=0000135061	메르스 학습효과로 막연한 공포심 확산감염내과 교수들 공기로 전파 안돼 메르스처럼 대규모 감염사태는 없을 것 지난 22일 국내에서 첫 확진 환자가 발생한 지카바이러스에 대해 국내 대다수 감염내과 전문의들은 공기를 통해 전파되지 않으므로 지난해 메르스처럼 대규모 감염사태는 재연되지 않을 것으로 보고 있다. 사진은 서울 용산구 일대에서 용산구 보건소 관계자가 하수구에 모기 유충 구제작업을 하고 있는 모습. 한국일보 자료사진 지난 22일 국내에서 처음으로 지카바이러스 확진 환자가 발생하자 지난해 메르스중동호흡기증후군사태처럼 국가적 재앙을 우려하는 목소리가 커지고 있다. 최근 사회관계망서비스SNS에서 지카바이러스에 감염되면 최대 2년까지 전파될 수 있다 지카에 감염되면 무조건 소두증 아이를 출산한다 감염자는 격리시켜야 한다 등 근거 없는 루머들이 돌고 있는 것은 이런 공포감의 반영으로 보인다. 하지만 국내외 감염내과 전문의 등의 진단을 종합하면 지카바이러스는 우리가 차분하게 대응을 잘 한다면 얼마든지 관리와 통제가 가능한 감염병이다. 공기를 통한 급속한 전파 가능성 낮다 무엇보다 지카바이러스가 메르스처럼 공기를 통해 전파되지 않는다는 게 국내 전문가들의 낙관의 배경이다. 지난해 메르스는 확진 환자가 기침과 재채기를 하거나 말을 할 때 나오는 침에 바이러스가 묻어 나와 공기 중으로 전파되면서 급속히 번졌다. 하지만 지카바이러스는 모기에 물리거나 수혈로 인한 혈액 매개 또는 성관계를 통해 감염되므로 대규모 전파 가능성이 낮다는 것이다. 이재갑 한림대 강남성심병원 감염내과 교수는 메르스는 바이러스에 감염된 환자를 통해 감염되지만 지카바이러스는 모기가 매개체인데 국내에는 지카바이러스를 전파하는 이집트숲모기가 서식하고 있지 않아 대규모 감염사태가 일어날 가능성이 적다고 설명했다. 질병관리본부도 지카바이러스에 감염돼도 사람 간 일상적인 접촉으로는 감염되지 않으므로 급속하게 바이러스가 확산될 가능성이 없다고 강조하고 있다. 감염되더라도 증상이 가볍다설사 지카바이러스에 감염됐다 하더라도 감염자의 10명 중 8명은 증상 없이 그냥 지나간다. 증상이 나타나는 20에서도 발열 두통 관절통 발진 결막염 등으로 경미해 크게 걱정할 필요가 없다. 김남중 서울대병원 감염내과 교수는 메르스 때를 생각해 확진 환자 발생 시 격리입원시켜 치료해야 한다고 생각하는 사람들이 많은데 사실 지카바이러스는 입원 안 해도 치료가 가능하다고 말했다. 첫 확진 환자 환자였던 L43남씨를 격리치료한 이유는 혈청 바이러스 등 확보가 목적이었다. L씨는 확진 받은 다음날 완치 판정을 받고 이내 퇴원했다. 엄중식 한림대강동성심병원 감염내과 교수는 지카바이러스 치사율은 1 정도로 알려져 있으므로 과도한 공포심을 가질 필요가 없다고 했다. 지카바이러스는 뎅기열과 흡사한 모기 매개 감염병이다. 염준석 강북삼성병원 감염내과 교수는 일반적으로 뎅기열보다 증상이 덜 해 과도하게 공포심을 가질 필요가 없다고 강조했다. 질병관리본부도 감염이 돼도 충분한 휴식과 수분섭취로 회복되고 증상이 지속되면 의료기관을 방문해 해열제 진통제 등 처방을 받으면 치료가 가능하다고 밝혔다. 매개 가능 흰줄숲모기 국내 개체수 적다첫 확진 환자가 발생하자 일각에서는 국내에서 서식하는 흰줄숲모기가 이집트숲모기처럼 지카바이러스를 전파할 수 있다는 우려가 확산되고 있다. 이에 대해 감염내과 전문의들은 제주도 등에서 흰줄숲모기가 서식하고 있는 것으로 알려져 있지만 개체수가 적고 남미처럼 모기가 왕성하게 활동하는 시기가 아니라 환자가 발생해도 바이러스 전파 확률이 희박하다고 했다. 질병관리본부는 아직까지 국내 흰줄숲모기에서 바이러스가 검출된 적이 없는데다 국내에서 서식하고 있는 흰줄숲모기가 전체 모기의 23에 불과해 급속하게 바이러스를 전파할 가능성이 낮다고 판단하고 있다.성관계를 통한 전파도 가능성이 낮다는 것이 감염내과 전문의들 의견이다. 염 교수는 지카바이러스가 성관계를 통해 전파된 사례가 발표됐지만 성관계가 지카바이러스를 전파하는 효과적 수단이 아니라는 것이 중론이라고 했다. 엄 교수는 현재까지 성관계를 통해 지카바이러스가 감염된 사례는 단 2건에 불과하다면서 위험지역을 방문하고 귀국한 뒤 콘돔을 사용하는 등 보건당국의 예방권고를 따르는 것이 중요하다고 했다. 세계보건기구WHO와 질병관리본부 가이드라인에 따르면 위험지역을 방문한 가임 여성의 경우 귀국 후 최소 2개월 간 임신을 연기해야 하고 남성은 아내가 임신 중일 경우 성관계를 하지 않거나 콘돔 등 안전한 피임기구를 이용해야 한다. 김 교수는 이와 관련 확진자의 경우 회복 후 최소 6개월 동안 금욕생활을 하거나 콘돔을 사용해야 한다고 설명했다. 공포의 소두증 확률 낮고 확산 가능성 적다 지카바이러스가 대중에게 공포의 감염병으로 각인된 것은 소두증 때문이다. 브라질 보건당국이 소두증이 나타난 5000명의 신생아 가운데 500명을 역학조사 한 결과 230명 정도에서 지카와 연관성이 포착됐다. 현재까지 의학적으로 소두증과 지카바이러스 간 인과관계는 뚜렷이 밝혀지진 않았지만 혐의는 아주 짙은 상태다. 하지만 지카바이러스에 감염된 모든 임신부가 소두증 아이를 출산하는 것은 아니다. 소두증이 브라질에서처럼 확산될 가능성은 적다는 데 국내 대다수 전문의들은 동의한다. 소두증을 유발할 수 있는 원인과 뚜렷한 발병 경로 등이 규명되지 않고 있는 것이 공포심을 키우고 있다. 질병관리본부는 이와 관련 임신 중의 감염 알코올 섭취 유해물질 등 노출 심한 영양실조 및 염색체 이상 등과 같은 원인에 노출된 경우 선천성 소두증을 유발할 가능성이 있다고 추정하고 있다
'쇼핑 대신 저축하는 미국인'‥美 물가상승률 주춤	http://news.naver.com/main/read.nhn?mode=LSD&mid=shm&sid1=101&oid=018&aid=0003510039&cid=428288	뉴욕이데일리 안승찬 특파원 미국의 중앙은행인 연방준비제도Fed가 미국의 물가상승 수준을 판단하기 위해 가장 열심히 챙겨보는 지표는 바로 근원 개인소비지출PrivatePersonal Consumption Expenditure PCE이다. 근원 PCE는 가격 변동성이 너무 큰 식료품과 유가 등을 제외한 일반 개인들의 소비 물품의 평균 가격을 보여준다. 개인의 소비 증가에 따른 실제 물가상승폭을 가늠할 수 있는 지표다.지난 2월 근원 PCE가 주춤한 것으로 나타났다. 28일현지시간 미국 상무부는 2월 근원 PCE가 한달 전보다 0.1 상승하는 데 그쳤다고 밝혔다.3로 잠시 올랐다가 다시 내려온 셈이다. 지난해 같은 기간과 비교해서는 1. 소득 역시 생각만큼 늘지 않았다. 2월 개인소득은 전달보다 0. 지난해 9월 이후 가장 낮은 수준이다. 지난 1월 개인소득이 0.5 증가했다가 다시 기대감이 꺼졌다. 미국인들은 저축을 더 늘렸다. 1년만에 가장 높은 수준이다
잇단 패러글라이딩 추락 사고…원인은 '봄철 돌풍'	http://news.naver.com/main/read.nhn?mode=LSD&mid=shm&sid1=102&oid=056&aid=0010301057	멘트   지난주부터  패러글라이더를 타다  추락해 숨지는 사고가 잇따르고 있는데요     봄철에 자주 부는 갑작스런 돌풍이 원인입니다.  봄철 돌풍이  얼마나 위험한지 성용희 기자가 직접 패러글라이더를 타고 체험해 봤습니다. 리포트 패러글라이더가 해발 5백m 이상 상공으로 떠오릅니다. 봄이 되면서  패러글라이더를 타는 동호인들이 크게 늘었습니다. 전문가와 함께 패러글라이더를 타봤습니다. 이륙하자마자  갑작스러운 돌풍에  패러글라이더가 휘청입니다. 수십m 높이를 순식간에  치솟았다가 내려가기를 수차례 조종사의 손도 바빠집니다.갑자기 불어오는 돌풍 때문에 몸의 중심을 잡기가 어렵습니다. 이 같은 불안정한 기류 때문에 추락사고가 잇따르고 있습니다. 지난 21일 경남 하동군에서  패러글라이더를 타던  50대 남성이 추락해 숨졌고  어제 낮에는 충남 보령시에서  패러글라이딩 전문자격증까지 있는  40대 남자가 추락해 숨졌습니다.녹취 경찰 관계자음성변조  그분이 내릴 때 그때 잠깐 그 지점에서 그런 바람이 있었던 모양이에요. 봄에 그런 현상이 많다고 하네요.인터뷰 차우성패러글라이딩 업체 대표  동호인들 사이에서 봄철 기류가 무섭다고 이야기들 하거든요. 그 이유는 아침과 한낮의 온도 차가 크고 강한 일사 때문에 국지적으로 돌풍 같은 것들이 불어서 그렇습니다
이슬람 극단주의자 낳는 벨기에 교도소..딜레마 빠진..	http://news.naver.com/main/read.nhn?mode=LSD&mid=shm&sid1=104&oid=469&aid=0000135039	벨기에 브뤼셀 테러 용의자들이 대부분 교도소에서 만나 네트워크를 형성한 것으로 드러나 벨기에 교도소는 테러의 또 다른 온상이 되고 있다. 이슬람 극단주의자들이 다른 수감자들을 감염시키면서 교도소가 종교 범죄자의 양성소로 전락했다는 지적이다. 27일현지시간 워싱턴포스트WP에 따르면 최근 벨기에 교도소 내 이슬람 극단주의가 확산되면서 당국에 비상등이 켜졌다. 벨기에의 이슬람 극단주의자들이 강도 테러 모의 등을 저지르고 교도소로 들어가 비이슬람 수감자들을 극단주의에 물들게 하는 정도가 심각해지고 있다는 것이다. 파리 테러를 이끌었던 압델하미드 아바우드와 최근 체포된 살라 압데슬람도 벨기에 교도소에서 만난 사실이 드러나면서 우려는 점차 커지고 있다. 압데슬람의 동생이자 파리 테러 당시 자폭한 브라힘 압데슬람도 벨기에에서 복역한 바 있다. 1만1000여명에 이르는 벨기에 수감자의 2030를 차지하는 무슬림은 이슬람 음악을 틀어놓거나 기도 시간에 동참을 강요하는 방법으로 이슬람교 확산에 힘쓰고 있다고 신문은 전했다. 은행 강도를 벌이다 10년 간 벨기에 교도소에서 복역한 스테판 메도37는 교도소는 무슬림의 규칙이 지배하는 곳이라고 말했다. 그는 이슬람 극단주의 전파를 작정한 일부 악성 수감자들이 운동시간을 이용해 주로 감수성이 예민한 청년들에 접근한다며  이들은 점점 감화돼 미국의 이라크 침공 등에 대해 극단주의자들의 생각대로정의롭지 못하다는 생각을 갖게 된다고 덧붙였다.벨기에 정부는 상황의 심각성을 인지하면서도 강력한 조치를 취하기는 어렵다는 입장이다. 벨기에 법무부는 두 곳의 교도소에 격리 구역을 만들어 극단적인 무슬림 범죄자 40명을 집단 수감하겠다는 계획을 밝힌 바 있다. 하지만 시길드 라쿠르 법무부 대변인에 따르면 첫 격리가 시작되는 4월 11일 해당 수감자는 5명뿐이다. 라쿠르는 수감자들을 덜 극단화할 전문가를 고용할 계획이라면서도 표현과 사상의 자유를 중시하는 벨기에 분위기 상 극단주의자들에 대한 교화 방법을드러내놓고 얘기할 수 없다고 어려움을 토로했다
부장·차장·팀장 호칭과 함께…4050 자리 없어질까..	http://news.naver.com/main/read.nhn?mode=LSD&mid=shm&sid1=102&oid=028&aid=0002312466	기업 수평적 조직문화 확산 그림자삼성전자 호칭 변경 추진엘지전자 과장도 부서장 될수있게중장년 퇴사 구조로 안팎 반응이미 구조조정 가능 상황 반론도 사오정45살 정년이니 오륙도56살까지 직장에 있으면 도둑니 하는 자조 섞인 표현으로 상징되는 중장년 직장인들이 최근 기업에 불어닥친 수평적 조직문화 확산에 떨고 있다. 중장년층의 이른 퇴직이 일반화된 상황에서 기존 업무와 호칭 직급 체계의 변화 등으로 인해 퇴직이 더 앞당겨질 수 있다는 우려 탓이다. 28일 삼성전자와 엘지LG전자 등의 설명을 종합하면 삼성전자는 수평적 조직문화를 위해 기존 부장차장과장 등의 호칭을 프로나 님 매니저 등 수평적 호칭으로 통일할 계획이다. 불필요한 회의나 보고도 줄여 스타트업신생 벤처기업처럼 빠른 실행과 열린 소통으로 혁신을 꾀하겠다는 것이다. 엘지전자도 호칭은 유지하지만 능력에 따라 과장이나 차장도 기존 부장이 맡던 팀장이나 부서장을 맡을 수 있도록 할 계획이다. 사장부터 사원에 이르기까지 수직적 조직문화를 바꿔 상급자가 아니라 부서와 회사를 위해 일하는 문화를 만들겠다는 것이다. 국내 대표 기업들의 이런 움직임은 인공지능AI이나 가상현실VR 등 속속 등장하는 신기술에 재빠르게 대처하기 위해서다. 하지만 4050대 직장인들은 불안감을 토로한다. 특히 삼성전자가 지난해부터 부서장 면담 부서 전환 등으로 중장년층 직원을 구조조정하고 있는 상황에서 퇴사 압박이 더 심해질 수 있다는 것이다. 삼성전자의 50대 차장은 이미 퇴사 압박이 이뤄지고 있는데 호칭 통일을 비롯해 새 인사 체제가 만들어지면 중장년층이 일하기 더욱 어려워질 것 같다고 내다봤다. 엘지전자의 40대 부장도 과거 방식에 익숙한 간부들의 사고를 바꿀 필요가 있지만 바꾸는 것이 쉽지 않다. 결국 인사 개편은 젊은층의 승진과 선배 세대들의 퇴사로 귀결될 수밖에 없다고 전망했다. 실제로 호칭 통일 등 수평적 조직문화를 꾀하려던 케이티KT에서는 이를 악용해 퇴사 종용 카드로 쓰였다는 얘기도 나온다. 40대 후반의 한 차장은 당시 호칭뿐만 아니라 업무도 수평적으로 한다고 강제했다. 일부 차장이나 부장이 맨홀에서 광케이블 작업을 하기도 했는데 이를 못 견디고 퇴사한 사람도 있다고 말했다. 반면 케이티 쪽은 원활한 소통을 위한 것이었지 퇴사 종용은 아니었다고 설명했다. 더욱이 고용노동부가 올해 1월 공정인사 지침이라는 명목으로 저성과자 해고를 과거보다 쉽게 해 불안감을 키운다. 이름을 밝히지 말아달라는 한 증권사의 분석가는 삼성전자와 에스디아이SDI전기 등이 계속 구조조정을 해오고 있다. 6월 발표될 내용을 봐야겠지만 새 인사 체계가 중장년층이 스스로 퇴사하는 구조나 저성과자 비중을 늘려 이들을 해고하는 등으로 진행될 것으로 보인다고 말했다. 반면 이런 우려가 불필요한 걱정이라는 반론도 있다. 이미 매니저라는 호칭을 쓰는 에스케이SK의 한 임원은 수직적 조직문화에서도 명예퇴직을 통해 구조조정이 가능한 상황인데 수평적 조직문화로 바뀐다고 퇴사 압박이 더 높아진다고 보기는 어렵다고 말했다
20년 새 봄철 꽃가루 5배 증가, 알레르기 환자 급증  	http://news.naver.com/main/read.nhn?mode=LSD&mid=shm&sid1=102&oid=214&aid=0000602409	꽃이 피는 춘삼월입니다마는 계절이 고통스러운 분들도 많죠.지난 20년간 봄철 꽃가루 농도가 5배 이상 진해졌고 알레르기 환자도 덩달아 늘고 있다고 합니다. 리포트 서울의 한 주택가 길바닥이 자작나무 꽃으로 뒤덮였습니다.바닥을 쓸기 무섭게 또 떨어지고 주변에 꽃가루가 진동합니다. 그러니까 마스크도 먼지 나서 하고 안 그러면 기침도 나고 간지럽고요.나무 아래에 차를 세워놨다가는 금세 꽃가루를 뒤집어쓰기 십상입니다.봄의 불청객 꽃가루는 매년 2월 말 측백나무와 노간주나무를 시작으로 이맘때면 자작나무와 오리나무 참나무까지 날립니다.온난화로 개화 기간이 길어지면서 1세제곱미터당 꽃가루 농도는 20년 사이 5배 이상 진해졌습니다.공해에 강한 잡초류를 비롯해 거리의 수종이 다양해진데다 황사 미세먼지 영향도 있는 것으로 보입니다.오재원 교수  한양대 의대1997년 참나무 꽃가루는 1m당 150개 많을 때 450개까지 올라갔지만 지금은 2천 개 가까이 올라갈 정도로 꽃가루가 늘었습니다.꽃가루가 늘면서 해마다 3월이면 알레르기성 비염 환자 수가 전달보다 배 이상 늘고 국민 10명 중 1명이 꽃가루 알레르기로 불편을 겪고 있습니다.이 때문에 환자 맞춤형 꽃가루 알레르기 예보제나 꽃가루 달력 등을 만들어 꽃가루 질환에 대응할 필요성도 제기되고 있습니다
