與, 한밤의 '탈당 러시'…유승민 이재오 등 5명 줄탈당	http://news.naver.com/main/read.nhn?mode=LSD&mid=shm&sid1=100&oid=003&aid=0007117705	유승민계 이종훈 김희국은 자정까지 고민 비박 이재오 주호영 친박 핵심 윤상현 탈당 공천 파동 겪으며 총 11명 탈당김동현 이현주 기자  새누리당이 자정이 가까워지던 23일 밤 유승민 이재오 의원 등 거물급 인사들을 포함한 현역의원 5명이 무더기 줄탈당하는 사태가 벌어졌다. 공직선거법상 탈당 후 무소속 출마를 위한 당적 변경 시한은 공식후보등록일2425일 직전인 23일 자정까지이기 때문이다.  유승민 의원은 이날 밤 11시 자신의 대구 선거사무소에서 기자회견을 열고 탈당을 선언했다.  유승민계로 분류되는 류성걸 의원도 대구시당에 탈당계를 제출했다. 또 대구 유일의 친이계 주호영 의원과 옛 친이계 좌장 이재오 의원도 탈당계를 제출하며 탈당 대오에  가세했다. 이에 앞서 이날 오전에는 김무성 욕설 녹취록 파문으로 공천 배제된 친박 핵심 윤상현 의원이 탈당계를 인천시당에 제출하고 24일 오전 무소속 출마를 선언할 예정이다.  이밖에 유승민계 이종훈 김희국 의원도 자정 전까지 탈당 여부에 대해 끝가지 고심한 뒤 거취를 결정할 것으로 전해졌다.  이로써 공천에 반발해 새누리당을 떠난 인사는 김태환 조해진 권은희 안상수 진영 강길부 유승민 류성걸 이재오 주호영 윤상현 의원 등 총 11명이다.  새누리당 전체 의석수는 157석에서 146석으로 쪼그라들었다.   1호 탈당자는 공교롭게도 친박계 중진 김태환 의원이었다.  조해진 의원은 유승민계에서는 첫 탈당자로 기록됐고 이어 같은 유승민계 권은희 의원도 대구 비박계에서는 처음으로 탈당 후 무소속 출마를 선언했다
일상에 잠복한 '괴물' IS… 번지는 테러 공포	http://news.naver.com/main/hotissue/read.nhn?mid=hot&sid1=104&iid=29797836&oid=022&aid=0003035350&ptype=021&cid=1038934	개방된 유럽에 무장조직 뿌리 IS 추가테러 공포 확산22일현지시간 벨기에 브뤼셀에서 연쇄 폭탄테러를 감행한 수니파 무장조직 이슬람국가IS가 추가 테러를 암시하면서 테러 공포가 전 세계로 확산하고 있다.특히 일부 용의자가 지난해 11월 프랑스 파리 테러에 가담한 사실이 드러나고 비밀 테러조직이 유럽 곳곳에서 비밀리에 활동하는 것으로 파악되면서 테러 공포가 유럽을 비롯한 전 세계에 충격을 주고 있다. 22일현지시간 벨기에 경찰이 공개한 브뤼셀 자벤텀 국제공항 폭탄 테러 용의자 3명의 모습. 자살 폭탄 테러를 감행한 용의자 두 명과 브뤼셀 공항 테러 후 도피한 또다른 용의자왼쪽부터가 테러 직전 공항에서 입국 수속을 밟고 있다.브뤼셀AP23일 AP통신 등에 따르면 IS는 이번 테러가 자신들의 소행이라고 주장하면서 IS에 반대하는 나라는 언제든 추가 테러 대상이 될 수 있다고 위협했다. IS는 반IS에 가담한 다른 국가들에도 암흑의 날dark days이 올 수 있다고 주장했다. IS는 테러 직후 우리 형제들이 자살폭탄 벨트와 폭탄을 품고 자벤텀 공항과 브뤼셀 지하철역에서 최대한의 죽음을 가져오려 했다며 이는 시작에 불과하고 알라의 허락 아래 결과는 참혹하고 끔찍할 것이라고 위협했다. 지난해 11월 파리 테러 직후 IS 성명에서도 이번 테러는 폭풍의 시작에 불과하다는 구절이 포함됐다. 22일현지시간 수니파 무장단체 이슬람국가IS의 소행으로 추정되는 연쇄폭탄 테러가 발생한 벨기에 브뤼셀 시내에서 경찰이 무장한 채 경계를 서고 있다. 브뤼셀UPI벨기에 경찰은 브뤼셀 자벤텀 국제공항 건물 안 CCTV에 찍힌 용의자 3명 중 도피한 용의자를 추적중이다. 벨기에 경찰은 이브라힘 엘 바크라위30와 칼리드 엘 바크라위27 형제가 각각 브뤼셀 공항과 지하철 역에서 자폭 테러를 자행했다고 밝혔다. 엘 바크라위 형제는 파리 테러 주범인 살라 압데슬람의 은신처를 제공한 것으로 알려졌다. 브뤼셀 테러에는 파리 테러 당시와 같은 TATP트라이아세톤 트라이페록사이드 폭탄이 쓰인 것으로 전해졌다.세계 각국은 브뤼셀 연쇄 폭탄테러 직후 주요 공항 등 공공시설의 경계를 강화하고 있다. 특히 유럽연합EU 장관들은 24일 긴급회의를 열고 테러 대응책 등을 논의하기로 했다.외신들은 이번 테러로 개방된 유럽의 취약성이 드러난 것은 물론 새로운 테러 양상에 직면하게 됐다고 우려했다. 미국 뉴욕타임스NYT는 유럽에서의 정치적사회적 실패로 비밀 무장조직들이 깊숙이 뿌리내리고 있다고 지적했다. 벨기에와 국경을 맞댄 독일 노르트라인베스트팔렌주의 랄프 재거 내무장관은 이번 공격은 이미 비밀 테러 조직이 유럽 곳곳에 암약하고 있음을 보여준다며 오싹한 점은 이런 조직은 적발될 가능성이 낮다는 것이라고 NYT에 밝혔다.22일현지시간 벨기에인들이 자국 국기와 꽃다발 촛불 등이 놓인 브뤼셀 부르스 광장에서 나는 브뤼셀이다라고 적힌 플래카드를 들고 브뤼셀 폭탄테러 희생자들을 추모하고 있다. 브뤼셀APAFP통신도 파리 테러 직후 은신처에서 사살된 압델하미드 아바우드가 자신을 90명으로 구성된 가미카제2차대전 당시 일본의 자살특공대 특공대의 사령관으로 지칭했다는 증언을 소개하면서 이는 이미 유럽 곳곳에 테러 조직이 잠복하고 있음을 시사한다고 지적했다. 이 통신은 과거 이슬람 테러단체는 테러 조직이 적발되면 또 다른 테러를 저지르지 못했다며 그러나 이제는 테러범들이 유럽 주요 도시에서 대규모 공격을 감행할 만큼 견고한 조직을 갖췄다고 강조했다. 노르웨이 국방연구센터의 대테러전문가 토마스 헬그함메르는 이번 테러가 새로운 테러 양상을 보여주는 분수령이 될 것으로 봤다.폭발 직후 공항 내부 브뤼셀 AP 22일현지시각 벨기에 브뤼셀의 브뤼셀공항 대합실에 연기가 가득 차 있고 한 여행객이 일어서려고 애를 쓰고 있다.미국 국무부는 이날 자국민을 상대로 유럽 지역에 대한 여행 자제 경보를 발령했다
軍 "'방탄복 로비' 감사원 결과 존중…후속조치 충실"	http://news.naver.com/main/read.nhn?mode=LSD&mid=shm&sid1=100&oid=421&aid=0001958845	23일 서울 종로구 감사원에서 감사원 관계자가 철갑탄 방탄성능 시험으로 전면이 관통된 방탄복에 대해 설명을 하고 있다. 감사원은 2015년 6월 8일 부터 9월 4일까지 국방부 방위사업청 등 5개 기관을 대상으로 방탄복 등 전력지원물자 획득비리 기동점검을 실시해 비리를 밝혀냈다.23   김명섭 기자부정당업자로 제재업체투자 연구개발확인서 발급 취소 고려철갑탄 방호 가능한 방탄복 개발 위해 연구용역 진행 중서울 권혜정 기자  국방부는 철갑탄을 막아내는 방탄복 기술 개발에 성공하고도 방산업체의 로비를 받아 보통 방탄복을 도입했다는 감사원의 발표와 관련 감사원 결과를 존중하며 이에 따라 후속조치를 충실히 이행하겠다고 밝혔다.  국방부는 23일 언론에 배포한 자료를 통해 전력지원물자 및 승용차에 대한 감사원 감사결과를 존중한다며 감사처분 결과를 면밀하게 검토한 후 충실하게 후속조치 하겠다고 전했다. 국방부는 이어 감사원이 처분을 요구한 관련업체에 대해서는 방위사업 관리 규정에 따라 부정당업자로 제재하는 방안을 검토하고 업체투자 연구개발확인서 발급을 취소하는 방안도 동시에 고려하겠다고 덧붙였다. 국방부는 또 올해 도입예정 물량인 4만6000여착의 조달방법 또한 다각적으로 검토하겠다고 밝혔다. 국방부는 그러면서 감사처분 결과 중 다목적 방탄복 소요결정 부당처리와 관련해 신형 방탄복 자체는 군 요구성능북한소총 AK74 보통탄 방호을 충족하고 있다고 전했다. 이어 철갑탄 방호가 가능한 액체 방탄복은 민군협력사업 일환으로 국방과학연구소에서 연구개발을 진행했던 것으로 높은 가격과 전투효율성 저하로 군 도입이 제한됐다며 현재 철갑탄 방호가 가능한 방탄복을 개발하기 위해 국방기술품질원에서 기술수준조사 연구용역을 진행하고 있다고 해명했다. 앞서 감사원은 이날 군이 철갑탄을 막아내는 방탄복 기술 개발에 성공하고도 방산업체의 로비를 받아 이같은 고성능 방탄복 조달계획을 철회하고 이 업체로부터 보통 방탄복을 독점 구매했다는 감사 결과를 밝혔다
걸그룹 데뷔 미끼 수억 뜯어낸 유명 대학강사	http://news.naver.com/main/read.nhn?mode=LSD&mid=shm&sid1=102&oid=448&aid=0000159223&cid=428288	아이돌 가수로 데뷔 시켜주겠다면서 학부모로부터 수억원을 받아챙긴 대학 강사가 구속됐습니다. 인기 가수들의 보컬트레이너로도 유명해 철썩 같이 믿었던 겁니다. 그런데 과거에도 비슷한 수법으로 돈을 가로채다가 적발된 적이 있었습니다. 정운섭 기자가 단독 보도합니다.리포트서울 강남의 한 예술대학 실용음악과 강사이자 보컬 트레이너였던 37살 송모씨는 여고생인 17살 A양의 어머니 김모씨를 학교로 불렀습니다. 데뷔 예정인 걸그룹에 A양을 넣어주겠다며 기획사에게 줄 돈을 달라고 요구했습니다.이후에도 오디션 비용 등을 명목으로 4차례에 걸쳐 2억원을 받아 챙겼습니다. A양의 부모는 유명 대학에 출강하고 인기 가수들을 지도했던 송씨의 화려한 이력을 믿었습니다. 기획사 관계자 저희 회사와 계약 관계에 있던 분이시고. 실제로 그렇게 큰 영향력을 끼치기엔 무리가 있지 않나 있지도 않은 오디션을 핑계로 돈을 받아 사업자금과 사치품 구입에 써버린 겁니다. 송씨는 피해 학부모의 고소로 경찰 조사를 받았는데같은 수법으로 이미 다른 가수 지망생들에게 4억원 가까이 받아 고소를 당하고 징역형을 받은 전력까지 드러났습니다. 수차례 적발된 적이 있었지만 버젓이 대학강사로 일하며 끊임없이 가수 지망생들을 속여 온 겁니다. 피해 학생 그 돈을 안 주면 일반 연습생 밖에 못하는데 주면 데뷔를 가능하게 해준다. 자기한테 와서 데뷔한 애 많다고. 검찰은 송씨를 구속하고 다른 피해자가 있는지 조사하고 있습니다
대우조선 2조원 손실 미반영한 과거 재무제표 수정키로	http://news.naver.com/main/read.nhn?mode=LSD&mid=shm&sid1=101&oid=001&aid=0008276532	자료사진적정 의견 냈던 딜로이트안진 정정 요구책임 떠넘기기 지적대우조선 28일 재무제표 정정공시 예정투자자 집단소송 등 후폭풍 우려     김연정 차대운 기자  대우조선해양이 20132014년 2년간 2조원 규모의 손실을 재무제표에 반영하지 않다가 지난해 영업손실에 반영한 것으로 나타났다.    23일 회계업계 등에 따르면 대우조선해양 외부감사인인 딜로이트안진회계법인은 최근 감사 과정에서 지난해 추정 영업손실 5조5천억원 가운데 약 2조원을 2013년과 2014년의 재무제표에 반영했어야 한다는 결론을 내리고 회사 측에 정정을 요구했다.    딜로이트안진 측에서는 대우조선해양의 2013년 2014년 재무제표에 장기매출채권 충당금과 노르웨이 송가프로젝트 손실 등이 제대로 반영되지 않았다고 지적한 것으로 알려졌다.    딜로이트안진은 대우조선해양의 2015 회계연도 감사를 수행하던 과정에서 과거 회계연도 재무제표상의 오류를 발견함에 따라 대우조선해양 측에 과거 재무제표의 재작성을 권고했다며 회사는 그 권고를 받아들여 재무제표를 재작성하게 됐다고 설명했다.    대우조선이 과거 공시한 2013년과 2014년의 영업이익은 각각 4천242억원 4천543억원이었으나 이번에 발견된 누락 비용과 손실 충당금을 반영하면 흑자가 아닌 적자가 된다.    현재 검찰은 전임 경영진의 대규모 분식회계 의혹에 대해 수사 중이며 금융당국도 올해 초 고의적인 분식 여부를 의심해 회사와 회계법인에 대한 회계 감리에 착수했다.    또 투자자 100여명은 대우조선해양과 딜로이트안진을 상대로 손해배상 청구 소송을 제기해 1심 재판이 진행 중이다.    이번 일을 놓고 업계에서는 회계법인이 오류를 범해 놓고 금융당국 감리에서 적발될 가능성이 제기되자 뒤늦게 스스로 이 사실을 밝힌 게 아니냐는 지적도 나온다.     회계감리에서는 회계법인이 스스로 오류 사실을 발견해 바로잡을 경우 향후 분식 회계로 결론이 나더라도 제재 수위를 일부 감경받을 수 있다.    따라서 업계에서는 과거 대우조선해양의 재무제표를 적정하다고 판단내렸던 딜로이트안진이 뒤늦게 책임을 덜 지려고 외부감사를 맡긴 고객인 대우조선해양에 책임을 떠넘기는 꼼수를 쓴 것이 아니냐는 비판도 나온다.    대우조선은 앞으로 명확한 원가개념을 정립하고 정밀한 상황예측 등 관리역량을 강화해 전기 손익 수정 같은 일이 재발하지 않도록 노력하겠다고 말했다.    대우조선은 최근 공시를 통해 22일까지 끝냈어야 하는 감사보고서의 작성이 지연되고 있다는 사실을 알렸으며 안진 측 지적을 받아들여 28일께 과거 재무제표를 정정 공시할 계획이다.      또 오는 30일 열리는 정기 주주총회에서 재무제표 승인 건을 의결할 계획이다.    업계에서는 이번 재무제표 정정으로 인해 과거 흑자 재무제표를 보고 투자한 개인투자자들이 집단 소송에 나설 가능성도 거론된다. 또 향후 수주에도 영향을 미치는 등 후폭풍이 있을 것이란 관측이 나온다
교육부, '납 범벅' 우레탄 트랙 전수 검사	http://news.naver.com/main/read.nhn?mode=LSD&mid=shm&sid1=102&oid=001&aid=0008276487&cid=428288	환경부가 지난해 5월부터 12월까지 서울과 수도권 초등학교 30곳의 운동장 인조잔디와 우레탄 트랙의 중금속 실태를 조사한 결과 트랙 25개 중 13개에서 한국산업표준KS 기준치 90mgkg을 넘는 납이 검출됐다. 연구원이 운동장에서 우레탄 시료를 채취하는 모습.22 환경부 제공초중고 2천800여곳 대상하반기 중 개보수 계획    세종 황희경 기자  일부 초등학교 우레탄 트랙에서 기준치를 넘는 납 성분이 검출된 것과 관련해 교육부가 초중고등학교에 설치된 우레탄 트랙전체를 대상으로 유해성 검사를 하기로 했다.    교육부는 23일 시도교육청 담당 장학관 회의에서 6월30일까지 초중고등학교와 특수학교 등 전국 2천811개 학교에 설치된 우레탄 트랙 전체에 대해 유해성 검사를 하기로 했다고 밝혔다.    검사는 각 학교에서 전문 기관에 의뢰해 우레탄 트랙 샘플을 검사하는 방식으로 이뤄진다. 검사에는 학교당 55만원 정도가 소요된다.    교육부는 검사 결과가 나오면 하반기 중 개보수에 나설 계획이다. 일단 그 전에는 학생들이 우레탄 트랙에 앉거나 접촉하는 일을 피하도록 하고 트랙 위에서 활동한 뒤에는 반드시 손을 씻도록 지도할 방침이다.    또 다음주 중에는 환경부 문화체육관광부 등 관계부처와 함께 우레탄 트랙 개보수 지원방안과 관리 방안 등을 협의할 계획이다.     현재 학교 운동장의 인조잔디에 대해서는 관리 매뉴얼이 있지만 우레탄 트랙에 대해서는 별다른 관리 매뉴얼이 없다.     교육부 관계자는 시급성을 고려해 최대한 조사를 빨리 끝내도록 할 것이라고 말했다.     앞서 환경부는 지난해 512월 서울과 수도권 초등학교 30곳의 운동장 인조잔디와 우레탄 트랙의 중금속 실태를 조사한 결과 트랙 25곳 중 13곳에서 한국산업표준KS 기준치를 넘는 납이 검출됐다고 22일 발표했다
