세월호 승무원 "청해진해운이 '대기하라'고 지시했다"	http://news.naver.com/main/read.nhn?mode=LSD&mid=shm&sid1=102&oid=001&aid=0008287920	유가족 앞에선 이준석      박동주 기자  28일 서울시청 다목적홀에서 열린 416 세월호 참사 특별조사위원회 2차 청문회 제2세션에서 이준석 선장이 자리로 향하고 있다. 2차 청문회서 생존자 강혜성씨 폭로     이효석 기자  세월호 참사 당시 선사 청해진해운 측에서 선내에 대기하라는 지시를 하달했다는 증언이 나왔다.    세월호 여객영업부 직원이자 참사 생존자인 강혜성씨는 416 세월호 참사 특별조사위원회가 28일 서울시청 다목적홀에서 개최한 제2차 세월호 청문회에서 이같이 진술했다.    강씨는 사고 당일 오전 9시26분께 양대홍 여객부 사무장사망이 무전을 통해 10분 후에 해경 올거야. 선사 쪽에서 대기 지시가 왔어. 추가 지시 있을 때까지 구명조끼 입히고 기다려라고 말했다고 털어놓았다.    그는 양 사무장이 지시에 앞서 무전기 채널을 바꾸라고 CC채널 체인지라는 은어로 말했고 남들은 쓰지 않는 5번 채널로 바꿔 이같은 대화를 나눴다고 전했다.     강씨는 사고 직후 청해진해운 해무팀 홍모 대리와 직접 통화하기도 했다면서 사고가 나 배가 기울었다고 말하자 홍 대리가 장난치지 말라고 했다고 진술했다.고개 숙인 이준석      박동주 기자  28일 서울시청 다목적홀에서 열린 416 세월호 참사 특별조사위원회 제2차 청문회에서 증인으로 출석한 이준석 선장이 고개를 숙인 채 앉아 있다.     권영빈 특조위원이 선사 측에서 대기 지시가 내려왔다는 사실을 약 2년 동안 수많은 조사를 받으면서 한 번도 말하지 않은 이유는 무엇이냐고 묻자 강씨는 영업부 직원들의 희생에 누가 될까 봐 말하지 않았다며 말끝을 흐렸다.    권 위원이 선사로부터 불이익을 입을까 봐 말 안 한 것은 아니냐고 캐묻자 그런 생각은 안 했고 개인적인 양심의 문제였다고 답했다.    강씨는 자발적으로 유가족들에게 사죄 발언을 신청한 후 유가족에게 진심으로 죄송하다. 하루빨리 사고 원인 등 진실이 밝혀졌으면 좋겠다면서 눈시울을 붉히기도 했다.    권 위원은 강씨 발언에 대해 진술 하나만으로 무엇을 확정하기는 어렵지만 선사가 대기 지시를 내렸다는 사실이 확인됐으니 세월호 침몰 자체에 누가 어떤 책임이 있는지 조금 더 깊이 조사하겠다고 말했다
북 4차 핵실험 후 미·중 정상 첫 만남 주목	http://news.naver.com/main/read.nhn?mode=LSD&mid=shm&sid1=100&oid=032&aid=0002687175&cid=428288	대북제재 진행 속 북한 문제 심도있게 논의될 가능성박 대통령 30일 출국대북 압박외교 가속화할 계획미국 워싱턴에서 31일현지시간부터 이틀간 열리는 핵안보정상회의는 핵테러와 핵물질 불법거래 방지 핵시설 방호 등 고유 의제 외에도 다양한 조합의 다자양자 정상회담이 열려 각국 현안이 논의될 예정이다. 특히 북한의 4차 핵실험과 장거리 로켓 발사 후 처음으로 각국 정상들이 모이는 자리라는 점에서 한반도 정세에 상당한 영향을 줄 수 있다. 박근혜 대통령은 30일 오후 정상회의 참석을 위해 출국 다자양자 회담 및 환영리셉션과 업무만찬 등에서 북한 비핵화를 위한 국제사회 협조 요청 등 대북 압박외교를 가속화할 계획이다.가장 눈길을 끄는 것은 미중 정상회담이다. 유엔 안전보장이사회의 대북 제재 결의 이후 미중 정상이 만나는 것은 처음이어서 미중 간 글로벌 이슈 외에 북한 문제가 심도 있게 논의될 것으로 보인다.2014년 기조연설하는 박 대통령 박근혜 대통령이 2014년 3월24일현지시간 네덜란드 헤이그에서 열린 제3차 핵안보정상회의 개회식에서 기조연설을 하고 있다.    경향신문 자료사진이번 미중 정상회담은 버락 오바마 행정부의 나머지 임기 1년 동안의 대북정책을 결정하는 데 중요한 전기가 될 수 있다. 미국은 강경 대북 기조를 이어갈지 아니면 긴장고조 행위를 방지하기 위해 중국 협조를 얻어 새로운 돌파구를 모색하려 할지 이번 미중 정상회담을 계기로 결정할 것으로 보인다.또 한미일 정상이 참여하는 양자다자 회의도 관심을 끈다. 외신들은 이번 핵안보정상회의를 계기로 한일 정상회담과 한미일 정상회의가 열릴 것으로 전망하고 있다. 지난해 12월28일 위안부 피해자 문제에 대한 한일 합의 이후 첫 한일 정상회담이 열리면 후속조치가 논의될 것으로 예상되지만 정부는 합의 이행 가속화와 국내 여론 사이에서 중심을 잡기 쉽지 않다.특히 아베 신조 일본 총리는 31일쯤 열릴 한미일 정상회의에서 위안부 문제가 완전하고 불가역적으로 해결돼 3국 안보협력에 장애물이 제거됐다는 점 일본의 집단적 자위권 행사를 가능하게 하는 안보법이 29일 자정을 기해 시행됨으로써 일본이 미국의 진정한 안보 파트너로서 역할을 할 수 있게 됐다는 점 등을 국내외적 성과로 내세울 것으로 보인다. 이번 한미일 정상회의를 계기로 한일 군사정보보호협정GSOMIA 체결 문제가 급물살을 탈 것이라는 관측이 나오는 배경이다.정부는 이 같은 일본 행보가 꺼림칙하지만 남북관계가 단절되고 북한 위협이 커지고 있는 상황에서 한미일 안보협력과 결속을 지지하지 않을 수 없는 입장이기 때문에 달리 대응할 방도가 마땅치 않다.com바로가기  경향신문 총선 특집 지금은 2016년이잖아요  인기만화 웹툰 전권 무료만화 보기 모바일 경향 경향 뉴스진  경향신문 앱  모바일웹  공식 SNS 계정 경향 트위터 페이스북 세상과 경향의 소통 커뮤니티  경향신문www
대구 지하철역 에스컬레이터서 불…승객 50여명 대피	http://news.naver.com/main/read.nhn?mode=LSD&mid=shm&sid1=102&oid=001&aid=0008287873&cid=428288	에스컬레이터     대구 김준범 기자  28일 오후 2시 49분께 대구 지하철 반월당역 승강장 내부 에스컬레이터에서 불이났다.    이 불로 다친 사람은 없었지만 출동한 소방관들은 만약의 사태에 대비해 승객 50여명을 역사 밖으로 긴급 대피시켰다.    경찰과 소방당국은 지하 2층에서 1층으로 향하는 에스컬레이터 전원공급장치에서 화재가 발생한 것으로 보고 정확한 화재 원인을 조사하고 있다
'월세 시대' 직격탄 맞은 전통 인테리어 시장	http://news.naver.com/main/read.nhn?mode=LSD&mid=shm&sid1=101&oid=015&aid=0003570831&cid=428288	현장 리포트내 집도 아닌데 도배 왜 하나방산시장 이사철 대목 사라져반전세월세 비중 50 육박벽지장판 수요 쪼그라들어하루에 손님 12명 불과 셀프 인테리어 열풍도 악재소형가구소품 시장은 활황 이수빈 기자   집수리 수요가 늘어나는 봄 이사철이지만 인테리어 시공업체들이 모여 있는 서울 방산시장은 28일 한산한 모습을 보였다.com국내 인테리어산업의 메카로 불리는 서울 주교동 방산시장. 1976년 방산초등학교 터에 조성된 이래 벽지 바닥재 타일 등 인테리어 자재 관련 업체가 밀집해 있어 업계 풍향계 역할을 한다.이곳에서 35년째 인테리어업을 하는 덕유상사는 올 들어 직원 3명을 모두 내보냈다. 작년부터 손님이 줄어 일감이 뚝 끊겨서다. 호황기에는 아르바이트생까지 포함해 직원이 10여명에 달했지만 이젠 가족끼리 운영하고 있다. 덕유상사 인근에서 삼화페인트 대리점을 운영 중인 김모 사장도 직원 2명을 정리하고 이젠 아들과 둘이 일을 하고 있다고 전했다.방산시장 불황은 반전세가 늘어나면서 부동산시장 질서가 변하고 있는 점이 큰 영향을 미쳤다는 게 상인들의 설명이다. 반전세집이나 월세집에선 도배와 장판을 교체하려는 수요가 크게 줄어들 수밖에 없다. 국토교통부에 따르면 지난 2월 전국 전월세 거래량 중 반전세를 포함한 월세 비중이 46.4로 전년 평균41에 비해 5. 이길재 한올인테리어 실장은 순수 전셋집에선 보통 2년 이상 살기 때문에 입주할 때 벽지와 장판을 바꾸지만 반전세나 월세로 전환하면 내 집도 아닌데 도배를 왜 하느냐는 사람이 많다고 말했다.이에 따라 대목에 속하는 봄 이사철이지만 체감경기는 비수기인 겨울철보다 못하다는 게 방산시장 상인들의 한결같은 얘기다. 최창훈 종로벽지 과장은 하루에 손님이 한두 명밖에 안 온다고 한숨지었다.문희용 덕유상사 사장은 부동산 경기가 정점을 찍은 2000년대 중반에는 하도 사람이 몰려 청계천5가에서 종로5가까지 차로 30분이 넘게 걸렸다며 불황에도 봄가을 이사철만큼은 손님들로 문전성시를 이뤘다고 회상했다.집방집꾸미기 방송 열풍도 악재로 작용했다. 본인이 직접 집을 꾸미는 셀프인테리어족이 늘면서 전문 시공업체를 쓰는 인테리어 자재보다 소형 가구나 소품 등만 구입하고 있어서다. 김 사장은 예전엔 주택 외벽이나 지붕 등에 칠하기 위해 페인트를 한꺼번에 사서 인부까지 썼지만 요즘은 페인트를 조금만 사서 직접 문에 칠하는 정도라고 설명했다.부동산시장 침체 속에 재건축과 재개발 인허가가 늘고 있는 것도 인테리어 시장 부진의 주요 원인으로 꼽힌다. 재건축 기대감에 소비자들이 인테리어 공사를 계속 미룬다는 얘기다. 정부 통계에 따르면 1월 전체 인허가 물량 중 재건축재개발 관련 주택은 1만4000가구로 작년 1월 대비 600 늘었다. 반면 분양 실적1만116가구은 작년에 비해 31.3 줄었고 주택매매 거래량6만2365건도 전년 동월 대비 21 감소했다. 권정선 롯데벽지인테리어 실장은 전월세보다 주택 매매량이 늘어나야 인테리어업체들의 일감이 증가할 것이라고 말했다.인테리어 시장이 불경기에 신음하는 것과 달리 소형 가구 시장은 활황이다. 이마트의 생활용품 전문매장인 더라이프는 작년 6월 킨텍스점을 연 뒤 6개월 만에 매출 20억원을 돌파했다
'악몽이 된 신혼여행' 허니문 사기 기승, 대책은?	http://news.naver.com/main/read.nhn?mode=LSD&mid=shm&sid1=102&oid=214&aid=0000602404	요즘 신혼여행 가서 낭패를 보는 신혼부부들이 적지 않다고 합니다.대부분 엉터리 여행사들의 사기 때문인데 피해를 예방하는 방법을 이재민 기자가 알아봤습니다. 리포트 지난 연말 몰디브로 신혼여행을 간 송 모 씨.현지에 도착했더니 호텔이 예약돼 있지 않았습니다.송 모 씨피해자그냥 모래밭에 있을 수밖에 없는 거죠. 저희는 예약이 안 돼 있었던 거예요.수십만 원 싸게 해준다는 말에 현금으로 1천만 원 가까운 돈을 냈는데 여행사가 돈만 챙기고 준비를 하지 않은 겁니다.아예 항공편 예약이 안 돼 출발조차 못 한 신혼부부도 있었습니다.이 모 씨피해자현금을 한꺼번에 다 입금해야 된다고 해서 송금을 해줬거든요.40쌍 넘는 신혼부부가 이 여행사에 낸 돈만 약 2억 원.신혼부부들의 항의가 빗발치자 업체 대표는 여행사를 폐업하고 넉 달째 잠적 중입니다.현행법상 패키지여행 영업을 하는 경우 보상한도가 높은 기획보증보험을 들어야 하지만 전국 여행사 1만 5천여 곳 중 가입한 회사는 1.여행사들이 한 해 6070만 원씩 드는 보험료가 아까워 가입을 꺼리기 때문입니다.여행사기획보증보험이 필요한지는 연구를 안 해 봤거든요. 솔직히 부담스러운 비용도 그렇고.신혼여행을 계획할 때는 여행사가 보증보험에 가입돼 있는지 확인하고 되도록 카드로 할부 결제하는 게 좋습니다.김동엽서울시관광협회 회원전략팀장부도가 나는 여행사들이 금액을 싸게 하고 현금을 유도하는 경우가 많거든요.여행사가 정상 영업을 하고 있는지 관광협회나 구청에 확인하는 것도 피해를 예방하는 방법입니다
與 '저소득층 구제' 野 '고소득층 인상'…건보료 전쟁도 재점화	http://news.naver.com/main/hotissue/read.nhn?mid=hot&sid1=100&iid=49140762&oid=011&aid=0002811735&ptype=021&cid=1037593	부과체계 개편 총선공약 나란히 발표 여야가 총선을 앞두고 건강보험료 부과체계 개편에 대한 공약을 간판 공약으로 내걸었다. 더불어민주당이 김종대 전 국민건강보험공단 이사장을 영입하며 건보료 개편에 나서자 새누리당이 반격하는 모양새다. 여야 모두 저소득 지역가입자에 대해 소득 중심의 부과체계로 개편하자는 점에서 총론은 같다. 하지만 새누리당은 저소득층 구제 방안을 더민주는 고소득층 보험료 인상 방안에 방점을 두고 있다.   새누리당은 당정이 추진을 주저하고 있는 건보료 개편 문제를 20대 총선 공약으로 발표했다. 새누리당의 건보료 개편 공약에 따르면 저소득 지역가입자는 소득에만 보험료를 부과하게 하고 자동차나 재산 등에 대한 평가소득은 제외하기로 했다. 직장에서 은퇴하고 소득이 없는 경우 보험료를 낮게 책정하겠다는 것이다. 특히 지역가입자의 부과체계 기준으로 활용되던 자동차에 대해 소득에 상관없이 보험료를 부과하지 않도록 했다. 단 3000 이상 고가 자동차에는 부과한다. 이럴 경우 세대당 1만1000원 정도의 보험료 인하 효과가 있다는 것이 새누리당의 설명이다. 그러나 새누리당은 지역가입자 중 중산층 이상에 대한 보험료 부과체계는 중장기 로드맵을 마련하기로 하는 등 중산층 이상의 반발을 우려해 전체적인 개편에는 소극적인 모습이다. 더민주는 김종대 전 국민건강보험공단 이사장을 영입하면서 건보료 개편에 공격적으로 나서고 있다. 더민주는 지역가입자 전체에 대해 소득 중심의 부과체계로 전환하기로 했다. 새누리당이 저소득층에 한해서만 소득 중심의 부과체계 개편을 주장한 것에 비해 더욱 확대 적용한 셈이다. 단 더민주는 건보료 상한제를 폐지하는 등 직장가입자 중 고소득층에게 건보료를 더 부과해 건보료 재정의 내실을 꾀하기로 했다. 현행 제도에서는 직장가입자의 경우 사업소득이 있거나 금융소득이 있어도 월급에만 보험료를 부과하지만 월급 외에 다른 기타소득에도 보험료를 부과하겠다는 것이 더민주의 계획이다. 아울러 소득이 있는 피부양자에 대해서도 엄격한 기준을 적용해 무임승차를 막기로 했다
국내 정유4사, 궁합 맞는 산유국 '따로 따로'	http://news.naver.com/main/read.nhn?mode=LSD&mid=shm&sid1=101&oid=028&aid=0002312509&cid=428288	에스케이 쿠웨이트산 가장 많아쿠웨이트투자청서 백기사 역할도GS칼텍스는 이라크UAE가 절반에쓰오일은 사우디서 전량 공급오일뱅크 이란 제재 후 쿠웨이트로경제성국제정치 따라 변화1980년대까진 사우디 압도적원유 도입처 다변화 정책 이후중동 국가간 점유율 크게 변화정유회사마다 궁합 맞는 산유국은 따로 있다 산유국이라고 하면 대개 사우디아라비아를 떠올리지만 실제 국내 정유 4사의 주된 원유 도입국은 제각각인 것으로 나타났다. 원가 절감을 위해 원유 도입처 다변화를 꾸준히 추진해온 결과 회사별로 서로 다른 산유국들과 특수관계를 맺은 결과다. 이런 실태는 가 입수한 한국석유공사의 원유수입 세부 현황2015년 1월2016년 2월 자료에서 확인됐다.  SK이노베이션 오랜 친구 쿠웨이트  정유업계 1위인 에스케이SK이노베이션이 지난해 도입한 원유 3억3776만배럴 가운데 쿠웨이트산이 24로 가장 많았고 카타르14 사우디14 이라크9 이란8이 뒤를 이었다. 쿠웨이트산 비중이 높은 이유는 그룹 차원에서 맺은 특수관계가 영향을 끼친 것으로 보인다. 2005년 에스케이그룹이 소버린과 경영권 분쟁을 벌일 때 쿠웨이트 국부펀드인 쿠웨이트투자청은 에스케이 지분 4를 인수해 최태원 회장 쪽을 지원하는 백기사 역할을 했다. 2010년에는 에스케이씨앤씨SK CC 지분 4. 현재도 에스케이와 에스케이씨앤씨가 합병돼 탄생한 그룹 지주회사 에스케이의 지분 3. 에스케이이노베이션은 적도기니가봉앙골라 등 아프리카 국가들과 영국에서도 각각 5와 4를 도입한 것으로 나타났다. 회사 쪽은 중동 외 지역으로도 원유 도입선 다변화를 적극 추진한 결과라고 설명한다. 올해 들어서는 경제제재가 풀린 이란산 비중을 늘리고 있다.  GS칼텍스 이라크UAE가 양대 공급원  지에스칼텍스GS는 지난해 도입한 2억6818만배럴 가운데 절반 이상을 이라크29와 아랍에미리트연합UAE28에서 공급받았다. 사우디16와 카타르러시아각각 6가 그 뒤를 이었다. 1980년대까지만 해도 사우디산이 주류였지만 1990년대 이후 아랍에미리트산이 그 자리를 차지했다고 한다. 지에스칼텍스의 지분 50를 가진 모회사인 지에스에너지가 지난해 7400억원을 들여 아랍에미리트 국영 석유회사로부터 아부다비 육상생산광구 지분 3를 매입하는 등 아랍에미리트와 전략적 제휴관계를 강화해나가고 있다. 이라크산은 비교적 최근 급격히 늘었다. 2007년 탈황시설을 갖춘 중질유 분해시설을 갖춘 뒤 값이 싼 대신 황 함량이 높은 이라크산 원유를 본격적으로 도입하기 시작했다는 게 회사 쪽 설명이다. 지에스칼텍스는 1990년대 중반까지 이란 도입 물량이 10 가까이를 차지했는데 1995년 이후 거래가 끊겼다. 지분 50를 미국 석유회사인 셰브론이 소유하고 있는데 당시 미국 정부가 이란 원유천연가스 분야에 자국민의 투자거래를 금지했기 때문이다. 회사 쪽은 경제제재가 해제된 만큼 도입선 다변화 차원에서 이란산 원유 도입을 재개할지 검토 중이라고 전했다.   에쓰오일 대주주인 사우디가 전량 공급   에쓰오일SOil의 원유 공급 구조는 간단하다. 대주주인 사우디 국영 석유회사 아람코로부터 전량을 공급받기 때문이다. 지난해 도입한 2억1338만배럴 가운데 사우디산은 93인 1억9834만배럴을 차지했고 나머지는 카타르산이었다. 회사 쪽은 일반 원유는 아람코로부터 100 들여오고 석유화학제품 원료인 나프타를 생산하는 데 필요한 초경질원유콘덴세이트는 사우디 쪽 공급이 모자라 카타르에서 도입하고 있다고 설명했다.  현대오일뱅크 이란쿠웨이트다시 이란   현대오일뱅크는 지난해 도입한 원유 1억2418만배럴 가운데 쿠웨이트산 비중이 36로 압도적으로 높았다. 이라크14이란12에서도 10 이상을 도입했지만 사우디나 19992013년 회사의 대주주아랍에미리트 국영 석유회사IPIC였던 아랍에미리트산 비중은 각각 6 수준에 불과했다. 회사 쪽은 2011년까지만 해도 이란산을 가장 많이 도입했는데 경제제재 뒤 월평균 350만배럴에서 135만배럴 수준으로 줄였다. 대신 성분이 비슷한 쿠웨이트산 중질유 비중을 늘렸다. 이제 경제제재가 해제됐으니 다시 이란산 도입량을 늘릴지 검토 중이라고 밝혔다.  경제성설비국제정치 등이 궁합의 요소  이렇듯 정유사별로 주거래처가 다른 이유는 각자 경제성에 바탕한 셈법이 다르고 국제정치나 대주주와의 특수관계 등이 복합적으로 작용하기 때문이다. 1980년대까지만 해도 사우디산 비중이 압도적으로 높았는데 정부 독려를 받아 정유사들이 도입처 다변화에 나선 것이다. 그 결과 아프리카와 남미 등 비중동 지역으로의 다변화는 별 진척이 없었지만 쿠웨이트아랍에미리트이라크이란 등 중동 내부에서의 다변화는 활발하게 이뤄졌다. 1990년께 사우디산 점유율은 10대로 떨어졌고 아람코는 에쓰오일옛 쌍용정유 지분 35를 투자하고 자사 원유를 공급하면서 한국 시장을 사수했다. 사우디산 점유율은 30 수준을 유지하고 있다. 2000년대 후반 정유사들은 벙커시유를 다시 한번 정제해 휘발유경유를 뽑아내는 고도화시설을 대대적으로 확충한 뒤 값싼 중질유를 주로 들여오는 전략을 취했다. 석유제품의 판매값은 어차피 정해져 있고 비슷한 만큼 최대한 싸게 원료원유를 공급받는 게 이익을 극대화할 수 있는 방법이기 때문이다. 만약 휘발유보다 경유 국제시세가 좋다면 같은 값이지만 휘발유보다 경유가 더 많이 정제돼 나오는 원유를 찾아내 사오는 등 디테일한 운영 노하우도 이익 극대화에 중요하다. 물론 모든 거래가 그렇듯이 에누리도 있다고 한다. 업계 한 관계자는 신뢰가 쌓이고 장기계약을 체결하면 산유국 국영 석유회사가 물량 규모에 따라 할인해주기도 한다. 하지만 이는 서로 지켜줘야 하는 영업비밀이어서 절대 공개할 수 없다고 말했다
