北 잇단 대화 공세…국방부 "비핵화 최우선"	http://news.naver.com/main/read.nhn?mode=LSD&mid=shm&sid1=100&oid=056&aid=0010319866&cid=428288	멘트 북한이  인민무력부 통지문을 통해 남북군사회담 실무접촉을  제안해 왔습니다.녹취 북한 인민무력부 통지문어제  북남 군사당국회담 개최를 위한 실무접촉을 5월 말 또는 6월 초에 편리한 날짜와 장소에서 가지자는 것을 제의한다. 북한은  군사적 긴장 완화와 신뢰 분위기 조성을 회담 명분으로 내세웠는데요. 김정은이 7차 당대회에서 군사회담 개최 필요성을 언급한 이후 국방위원회가 공개서한을 발표하고 김기남이 담화를 발표하는 등 잇달아 대화 공세를 펴고 있습니다. 북한의 노림수가 뭔지 궁금해 지는데요 유광석 기자가 보도합니다. 리포트 북한의 대화 공세에 대한 우리 군당국의 입장은 확고합니다.  북한과의 군사 대화는  비핵화 조치가 선행돼야 가능하다는 겁니다. 국방부는 이틀 전  북한 국방위원회의 군사회담 개최 제안도  선전 공세에 불과하다며 일축했습니다. 북한의 대화 제의에 진정성이 없다고 판단하기 때문입니다. 문제의 근원인 비핵화에 대한 언급은 전혀 없이 맹목적으로 대화만 외치고 있고 통지문 발송 2시간 만에  내용을 공개하는 등  신뢰구축과 거리가 먼  행동을 하고 있다는 겁니다. 북한의 대화 공세에는 노림수도 깔려 있다는 지적입니다. 대북 제재안을 담은  유엔결의 2270호에 대한 유엔 회원국들의 이행보고서 제출 시한이 임박하면서 중립국인 스위스에 이어 러시아까지  북한과의 금융거래를 차단하는 상황이 되자 국면 전환에 나섰다는 겁니다.인터뷰 김용현동국대 북한학과 교수  국제 공조의 균열과 남남갈등 유발 더불어서 한반도의 군사적 긴장 책임이 남측에 있다는 것을 전술적으로 보이는 행동이라고 볼 수 있겠습니다
'해상 실크로드 쟁탈전' 오바마 순방으로 더 격렬	http://news.naver.com/main/read.nhn?mode=LSD&mid=shm&sid1=104&oid=022&aid=0003057114	중국 vs 반중국 세력 남중국해 갈등남중국해 등 도서 영유권 문제를 놓고 중국과 미국일본 진영의 외교력 실력 대결이 갈수록 치열해지고 있다. 중국은 남중국해 해역 대부분을 자국 관할이라고 주장하면서 필리핀 베트남 말레이시아 브루나이 대만과 영유권 다툼을 벌이고 있다. 전 세계 무역량의 절반 이상이 거쳐가는 남중국해 해상 패권은 중국의 일대일로 육해상 실크로드 구상과 아시아 순방길에 오른 버락 오바마 미국 대통령의 아시아 재균형 전략이 충돌하는 대결의 장이다. 중국은 동중국해에서는 일본이 국유화한 센카쿠제도중국명 댜오위다오에 대한 주권을 주장하고 있다.지난 18일현지시간 미국 국방부는 중국 전투기 J11 2대가 정상 임무를 수행하던 미 해군 정찰기 EP3에 50피트15.24m까지 근접해 위험한unsafe 비행으로 진로를 방해했다고 밝혔다. 사진은 남중국해 상공을 비행 중인 미 해군 정찰기 EP3.중국 남중국해 분쟁 우군 확보 총력전2013년 필리핀이 제기한 네덜란드 헤이그 상설중재재판소PCA 남중국해 분쟁 중재 결정이 6월이나 7월 나올 것으로 전망되는 가운데 중국은 우군을 확보하기 위해 총력전에 나섰다.22일 중국 외교부에 따르면 현재 러시아 인도 아세안동남아국가연합 국가 아랍연맹AL 회원국 등 약 40개국이 중국의 남중국해 중재안을 지지하고 있다. 중국은 태국과의 군사 협력도 강화하고 있다. 양국은 지난 21일부터 양측 해병대와 해군 1000명이 참여하는 블루 스트라이크Blue Strike 2016 연합 훈련에 돌입했다.중국은 2012년 스카버러 암초중국명 황옌다오 영유권을 놓고 필리핀과 대치하다가 힘으로 실효지배를 굳혔다. 필리핀은 이듬해 중국의 도서 점령이 유엔해양법협약상 무효라며 PCA에 제소했다. 클릭하면 큰 그림을 볼 수 있습니다.중국은 오바마 대통령의 베트남 방문에 앞서 미국에 대한 견제 목소리를 높이는 동시에 베트남에 대해선 비판을 자제하고 있다. 왕이 중국 외교부장은 지난 20일 알자지라와의 인터뷰를 통해 미국이 남중국해서 긴장을 고조시키고 있다고 비판했다. 신화통신은 훙샤오융 주베트남 중국 대사가 19일 응오 쑤언 릭 베트남 국방장관을 만난 사실을 거론하며 군사협력 강화의 물꼬를 텄다고 전했다.중국은 이미 남중국해 곳곳에 인공섬을 건설하고 각종 첨단무기를 배치하며 영유권 강화 행보에 속도를 내고 있다. 영국 군사전문지 IHS 제인스디펜스위클리JDW는 중국 최신형 전략폭격기 훙6K가 남중국해 인공섬 기지에 배치됐을 가능성을 제기하기도 했다. 중국 남부 하이난성 하이커우시는 지난 16일부터 파라셀제도베트남명 호앙사 군도 중국명 시사군도 해역을 포함한 주변 해상에서 조업을 금지했다. 오바마 아시아 순방 반중국 세력 결집미국과 일본은 중국과 영유권 분쟁을 벌이는 국가에 힘을 실으며 대중 견제와 압박을 강화하고 있다. 명분은 항행의 자유 수호다. 지난해 10월 구축함 라슨함이 중국 인공섬에 12해리 이내로 접근하는 항행의 자유 작전을 개시한 미국은 지난 10일 세 번째 작전을 실시하며 중국을 압박했다. 이로 인해 지난 17일 중국 전투기 J11 2대가 미국 해군 정찰기 EP3에 50피트15.24m까지 근접 비행해 충돌할 뻔한 상황이 벌어졌다. 아시아 재균형 전략에 박차를 가하는 오바마 대통령은 2325일 중국과 영유권 분쟁국인 베트남을 방문해 무기금수조치를 전면해제할 가능성이 점쳐진다. 베트남 정부는 무기금수조치 전면해제 대가로 미군이 베트남 중남부 군사적 요충지인 깜라인만을 이용할 수 있도록 허용할 것이란 관측이 나온다. 미군이 베트남전 당시 핵심 전략기지인 깜라인만을 다시 이용할 수 있게 되면 필리핀에 이어 베트남에도 중국 견제 기지를 마련하는 셈이 된다.동중국해 센카쿠제도를 둘러싸고 중국과 갈등 중인 일본도 필리핀 등 동남아 국가를 대상으로 영향력을 확대하며 남중국해 반중국 연대에 주력하고 있다. 2627일 미에현 이세시마에서 열리는 G7주요 7개국 정상회의에 앞서 정상회담을 하는 오바마 대통령과 아베 신조 일본 총리가 남중국해 당사국에 대한 군사경제 지원에 대한 입장을 밝힐지도 관심사다. 일본은 해상자위대 잠수함이 지난달 호위함 2척과 함께 15년 만에 처음으로 필리핀에 입항한 것을 비롯해 군사적 요충지 베트남 깜라인만에 기항했다.미중 남중국해 우발 충돌 위기 상존PCA의 남중국해 분쟁 중재 결정은 다소 미뤄질 것으로 알려졌다. 대만 중앙통신에 따르면 남중국해 스프래틀리 제도중국명 난사군도 베트남명 쯔엉사군도 필리핀명 칼라얀 군도의 타이핑다오이투 아바에 대한 대만의 증거 제출 절차로 중재 결정 시점이 6월 또는 7월로 늦춰질 가능성이 있다. 중국은 이미 재판에 응하지 않겠다고 선언했다. 서로 접점이 없는 셈이다. 2009년 3월 중국 해군 함정이 미국 해군 음향관측함인 임페커블호의 진로를 막고 대치한 사건 이후 최근 항행의 자유 작전까지 미중은 남중국해에서 여러 차례 군사충돌의 위기를 맞았다. 지금까지는 양국이 무력 충돌을 극도록 자제하면서 상황 악화를 경계하고 있다
보훈처 간부, 5·18 유가족에 성희롱 발언	http://news.naver.com/main/read.nhn?mode=LSD&mid=shm&sid1=102&oid=032&aid=0002700866	기념식서 자리 배정 요청하자 내 무릎에 앉든가국가보훈처가 주관한 518민주화운동 정부 기념식에서 보훈처 간부가 518 유가족을 성희롱했다는 주장이 나왔다. 22일 오월어머니집과 광주시에 따르면 지난 18일 광주 북구 운정동 국립518민주묘지에서 열린 제36주년 518민주화운동 기념식에서 보훈처 간부가 유가족에게 성희롱 발언을 했다. 오월어머니집 노영숙 관장62은 기념식이 열리기 직전 어머니집 관장과 제주에서 초청한 43항쟁 유가족의 자리가 마련돼 있지 않아 자리 배정을 요청하고 있었다면서 그런데 보훈처 직원이 대뜸 그럼 내 무릎에라도 앉으면 되겠네라는 식으로 말해 너무 놀랐다고 상황을 설명했다. 현장에 함께 있던 광주시 김수아 인권평화협력관도 비슷한 말을 했다. 김 협력관은 굉장히 무례한 발언과 행동으로 느껴져 그 자리에서 인권협력관 앞에서 부적절하다고 했더니 보훈처 간부가 서둘러 자리를 떴다면서 나중에 주위 분들이 그 직원은 보훈처 과장이라고 했다고 전했다.노 관장은 당시에는 기념식이 시작돼 더 못 따졌지만 너무나 황당하고 수치스러웠다면서 보훈처의 518 홀대가 유가족을 대하는 직원들의 태도에 그대로 반영된 것으로 생각한다고 말했다. 오월어머니집은 23일 기자회견을 갖고 이 문제를 정식으로 따지기로 했다
하루 주차 요금이 43만 원?…공영주차장 '400%' 연체료	http://news.naver.com/main/read.nhn?mode=LSD&mid=shm&sid1=103&oid=437&aid=0000119384	공영 주차장에 주차한 뒤 제때 주차 요금을 내지 않으면 최대 4배의 연체료를 물 수도 있다고 합니다. 몇만 원이던 요금이 자신도 모르는 사이 수십만원으로 늘어나는 경우도 있습니다. 기자직장인 류모 씨는 지난해 7월 서울 강남의 한 공영주차장에 아침 8시에 차를 세웠습니다. 밤 10시에 돌아왔지만 직원들은 퇴근한 뒤였습니다. 하루 요금이 8만 6천 4백원이라는 고지서만 창문에 꽂혀 있었습니다. 이후 류 씨는 고지서를 잊고 있었고 한 달이 넘도록 돈을 내지 않았습니다.그러자 4배 가산금이 붙어 43만 2천원을 내라는 통지가 왔습니다. 류모 씨  구청에서 말하길 조례에 의하면 400라고 돼있고 강남구는 그렇게 받기로 했다. 안 내면 차량 압류 들어가겠다.주차장법에 따르면 주차 요금 미납시 원금의 4배 범위까지 가산금이 붙을 수 있습니다.하지만 실제 부과율은 자치구마다 다릅니다. 서울 강남구와 영등포구는 보름 간격으로 두 차례 고지한 뒤 4배의 연체료를 부과하지만 반면 경기 성남시는 최대 2배까지만 부과하고 서울 중구와 경기 수원시 용인시 등은 연체료를 매기지 않습니다.중구청 관계자  저희는 그런 경우는 없어요 현실적으로. 4배까지라고 조례로는 돼있는데 실질적으로는 사문화됐어요.각 지자체 주차관리 담당자들은 이용자들이 적어도 보름 안에는 미납 요금을 납부해야 연체료 폭탄을 피할 수 있다고 말합니다.박현주 JTBC 뉴스 공식 SNS 트위터 페이스북 카카오스토리 유튜브 JTBC 뉴스는 여러분의 생생한 제보를 기다립니다
브로커 이민희 구속영장 청구…'홍만표 소개비' 추가	http://news.naver.com/main/read.nhn?mode=LSD&mid=shm&sid1=102&oid=001&aid=0008419839	변호사법 위반사기로비 명목 등 9억1천만원 수수 및 지인 돈 3억원 챙겨 23일 오후 영장심사로 구속 여부 결정     최송아 기자  정운호 네이처리퍼블릭 대표의 전방위 로비 의혹을 수사하는 서울중앙지검 특수1부이원석 부장검사는 정 대표 측 브로커 이민희56씨의 구속영장을 22일 청구했다.    검찰에 따르면 이씨는 서울메트로 관계자 등에게 로비해 네이처리퍼블릭의 지하철 역내 매장을 늘려주겠다며 정 대표로부터 2009년부터 2011년 사이 수차례에 걸쳐 9억원을 챙긴 혐의변호사법 위반를 받는다.    이씨는 유명 트로트 가수의 동생 조모씨로부터 3억원을 빌리고도 갚지 않은 혐의사기도 있다.    아울러 이씨는 정 대표와 무관한 다른 형사사건에 연루된 의뢰인에게 홍 변호사를 소개해 주고 소개비 명목으로 1천만원을 챙긴 혐의변호사법 위반도 적발됐다.    올해 1월부터 지명수배 상태였던 이씨는 20일 새벽 체포됐다.    이씨는 검찰 조사에서 혐의 사실을 일부 시인했다. 정 대표 등에게서 돈은 받았지만 구체적인 청탁 등 로비로 나아간 사실은 없다는 취지다.        그는 실제로 로비 명목의 돈을 서울메트로 관계자 등에게 뿌리지 않았으며 본인의 생활비와 유흥비 등으로 썼다고 주장했다.    이씨는 지인 등에게 청와대 수석 판검사 등과의 친분을 과시한 것에 대해선 허언에 불과하다. 그런 사람들에게 영향력을 미쳐서 인허가를 받거나 사건을 처리할 만한 입장이 아니었다고 로비 의혹을 부인한 것으로 알려졌다.    이씨는 정운호 대표가 상습도박 혐의로 수사받을 때 고교 선배인 홍만표 변호사를 소개한 인물로 알려져 있다.     이씨는 홍 변호사가 정 대표 사건을 수임하는 데 관여하거나 어떤 역할을 한 게 없다고 진술하는 것으로 전해졌다.    검찰은 이씨가 로비 의혹을 부인하는 만큼 꼬리 자르기 시도는 아닌지 로비를 한 정황이 드러날 경우 본인이나 주변 인물들이 더 큰 처벌을 받을 것을 염려해 의도적으로 진술을 축소하는 건 없는지 등을 추궁할 방침이다.    검찰은 부당 수임료 수수 및 탈세 의혹을 받는 홍 변호사도 조만간 불러 관련 의혹을 조사할 계획이다.    이씨의 구속 여부는 23일 오후 3시 서울중앙지법에서 한정석 영장전담 판사 심리로 열리는 구속 전 피의자 심문영장실질심사을 통해 결정된다
조선 빅3, 6조대 '몸집 줄이기' … 구조조정 2R 돌입	http://news.naver.com/main/hotissue/read.nhn?mid=hot&sid1=101&iid=1095089&oid=022&aid=0003057116&ptype=021&cid=1042899	자산 매각인력 감축 등 초긴축 노사갈등실업문제 난관 예상생존 위기에 처한 대형 조선 3사가 고강도 구조조정안을 마련했다. 이 안에는 자산매각과 인력감축 인건비 삭감 등이 담겨 있으며 규모가 총 6조여원에 이를 것으로 추산된다. 조선업계 관계자는 국내 제조업 구조조정 사상 최대 액수라며 이제 자구안을 실행에 옮기는 구조조정 2라운드가 시작되는 것이라고 말했다. 노사 갈등과 실업 문제도 격화할 전망이다. 해운사들도 생사를 가를 운명의 시간을 맞았다. 이번주가 현대상선 용선료 협상의 마지막 기회가 될 전망이다.조선3사 6조원대 자구안 마련22일 업계에 따르면 현대중공업삼성중공업대우조선해양 조선 3사는 최근 경영 정상화를 위한 고강도 자구안을 마련했다. 현대중공업은 2조여원 삼성중공업은 1조5000억원가량의 자구안을 최근 주채권은행에 제출했다. 삼성중공업의 경우 주채권은행인 KDB산업은행이 부족한 것으로 보고 있어 더 늘 가능성이 있다. 추가 자구안을 정식 제출하기에 앞서 구두로 전한 것으로 알려진 대우조선은 지난해 마련한 1조8500억원 규모의 자구안에 7000여억원을 더한 것으로 알려졌다. 총 2조5000여억원으로 3사 중 규모가 가장 크다. 대우조선 관계자는 초안은 이미 보냈으며 추가적으로 자산 감축을 할 부분이 더 있는지 파악하기 위해 제출 날짜를 미뤘다고 말했다. 조선 3사는 자구안 실행에 속도를 내고 있다. 대우조선은 서울 사옥중구 다동 소재 매각 우선협상대상자를 이르면 다음주에 선정할 계획이다. 이미 서너개 업체가 관심을 보이고 있으며 매각 가격은 1800여억원 수준으로 알려졌다. 대우조선 측은 일부 업체가 관심을 보여 서울 사옥을 둘러보고 갔으며 조만간 우선협상대상자를 선정할 것으로 보인다며 그러나 실제 매각이 완료되려면 시일이 걸릴 것이라고 말했다.현대중공업은 지난해에 이어 추가 인력감축에 본격 돌입했다. 현대중공업은 자구책의 일환으로 사무직 과장급 이상을 대상으로 희망퇴직 신청을 받았으며 1000명 이상 신청한 것으로 추산됐다. 이는 전체 사무직 인원의 10에 육박하는 수치다. 여기에는 계열사인 현대미포조선 현대삼호중공업 힘스 현대ET 등이 포함돼 있다. 현대중공업은 지난해에도 긴축 경영을 선언하고 과장급 이상 사무직과 여직원 1300여명을 줄였기 때문에 사무직 인원은 핵심 필수 인력만 남게 됐다. 현대중공업은 계열사와 함께 다음주부터 2주 동안 생산직 희망퇴직을 시작한다. 생산직 희망퇴직은 현대중공업 사상 처음이며 기장과장급 이상 3000여명이 대상이다. 이중 500여명이 짐을 쌀 것으로 전망된다. 조선업계는 해상선박건조대인 플로팅 독floating dock을 매각하는 방안도 모색하고 있다. 조선 3사가 보유하고 있는 독은 총 25개이며 이 중 9개삼성중공업 5개 대우조선 4개가 바다에서 선박을 건조할 수 있는 설비인 플로팅 독이다. 삼성중공업과 대우조선은 수주난으로 일감이 줄어든 데 따른 조치로 이들 플로팅 독 중 일부를 팔아 재무구조 개선 등에 사용한다는 계획을 자구안에 담은 것으로 알려졌다.용선료 협상 운명의 일주일현대상선은 해외 선주들과 개별 협상에 집중하고 있다. 지난 18일 컨테이너선 용선주 4개사와 단체 협상을 했으나 합의점을 찾지 못했고 이튿날 전체 선주를 대상으로 한 콘퍼런스콜화상회의을 취소한 뒤 선주들을 일대일로 설득하고 있는 것으로 알려졌다. 애초 협상 데드라인이었던 지난 20일 금융위원회가 물리적인 시간에 구애받지 않고 협상을 진행하겠다고 밝히면서 시간을 벌었지만 오는 31일 열리는 사채권자 집회 전까지는 결론을 내야 하는 상황이다. 협상 타결 가능성은 여전히 반반이다.9인 그리스계 선주 나비오스는 용선료 인하 얘기가 나오면서 국제신용평가사 무디스가 신용등급을 B2에서 B3로 낮췄다. 용선료를 깎아주면 재무위험이 커질 것이라고 본 것이다. 이는 협상에 부정적 요인이다. 그러나 용선료 협상이 실패해 현대상선이 법정관리에 들어갈 경우 용선료를 아예 받지 못하게 된다. 또 해운업 불황으로 배를 빌려 줄 다른 선사를 찾기도 어려운 상황이라 선주들의 손해가 더 커질 수 있다는 점은 협상에 긍정적 요인이다
그 많던 '꼬꼬면'은 다 어디로 갔을까	http://news.naver.com/main/read.nhn?mode=LSD&mid=shm&sid1=101&oid=005&aid=0000900992&cid=428288	최근 식품업계는 냄비 열풍에 휩쓸리고 있다. 금방 식어 사그라지고 또 다른 게 뜨는 트렌드를 말하는데 업체들은 매출은 상승하고 소비자들의 호응도 좋아 히트상품에 목을 매는 지경이다. 일각에서는 급격히 팽창한 신규 시장이 트렌드의 변화로 해당 시장과 관련시장을 위축 시킨다는 염려의 시각도 있다. 그 중심에는 팔도 꼬꼬면을 빼놓을 수 없다. 꼬꼬면은 지난 2011년 출시 이후 하얀국물라면 전성시대를 열었다. 당시 대단한 인기를 구가하며 3개월 만에 20가 넘는 점유율을 차지했다. 또 전체 라면 시장 매출 2위를 기록하면서 라면업계의 지형도를 바꿔놓기도 했다. 일부 대형마트에서는 절대강자 신라면의 매출을 뛰어넘는 기염을 토했다. 오래갈 줄 알았던 꼬꼬면의 인기는 고작 1년을 가지 못했다. 출시 8개월이 지나기도 전인 2013년 초 점유율은 1대로 곤두박질쳤다. 소비자들은 익숙한 빨간국물라면으로 돌아갔다. 팔도는 빨간국물 앵그리 꼬꼬면을 출시했지만 반등에는 실패했다.   업계에서는 입맛 회귀를 원인으로 꼽는다. 복수의 업계 관계자들은 소비자들이 어렸을 때부터 먹어오던 맛에 길들여진 것이 이유라면서 새로운 제품을 소비하다가도 결국 원래 먹던 맛으로 돌아오게 되는 편이라고 말했다. 신라면이나 안성탕면 등 스테디셀러들이 오랜 기간 자리를 굳게 지킬 수 있는 이유라는 것이다. 해태제과 허니버터칩도 열풍의 주역 중 하나다. 지난 2014년 출시 이후 말 그대로 허니열풍이 몰아쳤다. 없어서 못팔 지경에 이른 허니버터칩은 100억원 매출을 올리기까지 채 3개월도 걸리지 않았다. 순식간에 소비자들의 입맛을 사로잡았다. 인기를 끌자 당시 동종업체들은 앞다퉈 비슷한 단 맛 감자칩 제품을 시중에 출시했다. 그야말로 허니 열풍으로 제과업계가 제2의 전성기를 맞은 계기가 되기도 했다. 중고거래사이트에서는 10배가 넘는 1만5000원에 거래가 성사되기도 했다. 식품업계의 허니 열풍은 과자에서 그치지 않고 화장품 등 다른 영역에서도 나타났다. 물 들어올 때 노 젓는다고 이 열풍에 가세해서 조금이나마 매출을 올려보려던 업계의 안간힘이기도 하다. 때문에 어디에서도 허니라는 이름을 쉽게 찾아볼 수 있었다. 해태제과는 지난해 180억원을 투자한 생산공장 증설이 지난 5월 완공되면서 허니버터칩 생산량을 2배로 늘렸다. 지난해 3분기 허니버터칩은 생산량의 101.7로 떨어졌지만 14분기 평균 99에 가까운 판매율을 보였다. 오뚜기 역시 허니 열풍과 맞먹는 인기를 누리고 있다. 뜨거운 국물보다는 냉면국물이 더 잘 팔리는 여름이 도래했음에도 불구하고 여전히 인기다. 진짬뽕은 출시 이후 150여일 만에 1억개 판매고를 올리며 지난해 말부터 이어진 짬뽕춘추전국시대를 종결했다. 1초에 7개가 팔린 셈이다. 신라면의 아성에는 다다르지 못했지만 익숙한 빨간국물라면이라는 점을 앞세워 지속적인 판매고를 올리고 있다. 오뚜기는 진짬뽕 매출에 힘입어 2012년 3분기 이후 처음으로 매출성장률이 10를 웃돌기도 했다. 또 하나의 열풍은 바나나다. 올해 들어 출시된 바나나 관련 제품만 10여개에 이르고 더욱 늘어나는 추세다. 오리온은 지난 3월 초코파이 정 바나나를 출시했다. 출시와 함께 바나나 트렌드를 업은 초코파이 바나나는 4월 한 달간 2000만개가 팔렸다. 수요를 감당하기 위해 오리온은 출시 한 달만에 생산라인을 늘리기도 했다. 초코파이 바나나 열풍에 오리지널 초코파이도 매출이 상승곡선을 그렸다. 전년 동월대비 매출이 67P 상승한 오리지널 초코파이는 4월 매출 150억원을 넘기며 최대 매출을 기록했다.롯데제과 역시 몽쉘 초코바나나를 출시한 후 1500만개 판매고를 올렸다. 자매제품 인기에 힘입어 몽쉘 시리즈 전체 매출도 전년 동기대비 30P 상승했다. 롯데제과는 몽쉘 바나나의 생산량을 150 이상 증설했다. 문제는 너무 빠른 트렌드의 소비다. 열풍의 주역이었던 제품들을 살펴보면 단맛 감자칩 시장에서는 허니버터칩만이 살아남았다. 하얀국물라면 시장은 짬뽕라면의 득세와 맞물려 거의 사라지다시피 했다.  업계에서는 주요 소비자인 밀레니얼 세대의 소비문화를 트렌드 소비의 이유로 꼽는다. 밀레니얼 세대는 1980년대에서 2000년 사이에 태어난 세대로 목돈을 쓰지는 않지만 식음료나 간식 등 기호식품 소비에 적극적인 2030대를 말한다.  제과업체 관계자는 2030세대의 경우 SNS를 통한 소통이 활발하면서 간접적인 이미지 소비가 빠르게 일어난다면서 이러한 트렌드에 맞추기 위해 지속적으로 신제품을 선보일 수밖에 없다고 말했다. 빨리 끓고 빨리 식는 문화를 냄비라고 표현하기도 한다. 이러한 소비문화를 소비자의 탓으로만 돌리기는 어렵다. 소비자의 니즈를 반영한 제품을 출시한다고 하더라도 기본적인 선택권은 업체에 있다
