공천 마무리한 여야, 선거체제로…'경제활성화' vs..	http://news.naver.com/main/read.nhn?mode=LSD&mid=shm&sid1=100&oid=001&aid=0008273387	새누리 경제살리기 초점 맞춰 표심공략과반 이상 기대더민주 경제민주화정권심판 내세우며 107석 최저 목표국민의당 차별화로 30석 안정적 교섭단체 구성 지향     안용수 김동현 박수윤 기자  여야는 413 총선 공천 작업이 사실상 끝나감에 따라 중앙당 선거대책위 출범을 준비하는 등  본격적인 선거전 체제로 전환을 서두르고 있다.    새누리당 더불어민주당 국민의당 모두 유승민 공천 여부 비례대표 선정 파동 등을 겪으면서 공천 마무리 국면에서 진통을 겪고 있지만 내부적으로는 2425일 후보등록일을 전후해 선거 체제로 바꿔 국면 전환을 꾀할 조짐이다.    제20대 총선은 선거구 획정 지연으로 공천이 늦어진 데다 16대 총선 이후 처음으로 3자구도로 전개되면서 새누리당 더불어민주당 국민의당은 유권자의 시선을 사로잡을 프레임을 짜는 데 전념하고 있다.     새누리당  무엇보다 경제활성화에 초점을 맞췄다. 대표 공약 1 2번을 내수산업 활성화를 통한 일자리 창출과 미래성장동력 육성으로 잡은 것도 이 때문이다.    외부 공동 선대위원장 역시 대표적 경제 관료 출신인 강봉균 전 재정경제부 장관을 삼고초려 끝에 영입했다.     사전에 약속이나 한 듯 당의 투톱인 김무성 대표와 원유철 원내대표가 거의 동시에 강 전 장관을 접촉하는 등 심혈을 기울여 수락을 받아냈던 것으로 전해졌다.    강 전 장관은 와의 통화에서 역대 큰 선거에서 가장 큰 문제는 표가 된다고 해서 포퓰리즘 공약을 남발한 것이라면서 경제활성화 청년실업 해결 소득재분배 등을 위해 새롭게 공약을 만들겠다고 말했다.    최고위원회의 회의장 백보드에도 뛰어라 국회야 잠자는 국회에서 일하는 국회로를 새로 걸고 분위기 전환을 시도했다.    선대위 발대식은 공식선거운동 기간3월31일4월12일 직전인 오는 28일 개최할 예정이다. 공천자 대회도 겸해 선대위 체제로의 전환을 알리는 대대적인 행사로 계획 중이다.    통상 공천자 대회는 중앙선관위 후보 등록일3월2425일에 맞춰 개최했지만 이번에는 공천이 늦어지면서 뒤로 미뤘다.     김 대표와 강 전 장관의 공동 위원장 체제에 최고위원들이 경기 영호남 충청 강원 등 권역을 나눠 책임을 분담하는 형식을 계획 중인 것으로 알려졌다.    과반 의석 확보를 마지노선으로 설정하고 일각에서는 노동개혁법을 비롯한 각종 개혁 과제의 구현을 앞세우는 동시에 야권 분열을 계기로 국회 선진화법에 구애받지 않고 입법이 가능한 180석도 바라보고 있다.     더불어민주당  이번 선거를 현정부의 경제 실정을 심판하는 선거로 규정하고  그 대안으로 경제민주화를 부각시키는 데 주력하고 있다.     더민주는 정부의 경제정책이 지나치게 대기업 등 기득권 경제세력 중심으로 돌아가면서 현재의 경제위기를 초래했다고 주장함으로써 유능한 경제정당으로의 면모를 호소한다는 전략을 세웠다.    김종인 비상대책위 대표도 총선 공약으로 포용적 성장을 내세우는 등 꾸준히 경제민주화를 강조해왔다.     반면 지난 19대 때 수도권 선거에서 위력을 발휘했던 야권 연대는 국민의당 안철수 공동대표가 반대하고 현실적으로 당 차원의 연대가 가능한 시점을 넘기면서 이번 총선에선  전략의 중요한 축이 되기는 어려울 전망이다.    지역별로 후보간 단일화의 길은 열려 있지만 당 차원의 논의 없이 광범위한 연대는 쉽지 않아 보인다. 김 대표도 중도층 표심을 의식한 듯 정의당과의 연대에 적극 나서지  않는 모습이다. TV제공    목표의석은 최근 정밀심사에서 탈락한 의원들이 탈당하기 직전 의석수인 107석으로 설정했다.    김 대표는 지난 16일 관훈클럽 토론회에서 야권이 분열된 상황에 놓여 있어 쓸데없이 지나치게 낙관해서는 안 되는 것 같다며 현재 가진 의석수 정도만 확보하면 선전했다고 판단한다고 밝힌 바 있다.    더민주는 공천이 거의 마무리 단계인 만큼 조만간 중앙선대위 출범식을 하고 본격적인 선거체제로 들어갈 방침이다.    이미 지난 1월 22일 김종인 선대위원장을 포함한 16명의 선대위원 인선을 마무리했지만 공동선대위원장과 권역별 선대본부장 등 일부 구성을 남겨두고 있다.     국민의당  선거 프레임을 과거와 미래의 대결 미래 먹거리 창출 경제적 불평등과 소득격차 해소로 잡았다.    오는 25일 후보 등록이 마무리되면 현재 최고위선대위 연석회의로 진행 중인 회의체제를 선대위로 전환 본격적인 선거운동 지원에 나서기로 했다.    당 지도부가 지역별로 출격해 선거 지원에 나설 예정이다.  TV제공    김영환 인재영입위원장은 안 대표 지역구인 노원구부터 정호준 의원의 중구 자신의 지역구인 경기 안산을 잇는 지하철 4호선 지역을 당의 상징인 연두색으로 묶는 4호선 그린벨트에 당력을 집중할 방침이다.     또한 인천 부평갑의 문병호 인천 계양을의 최원식 의원의 지역구를 통과하는 지하철 1호선을 이른바 인천 녹색 클러스터로 명명하고 집중 공략할 계획이다.     목표 의석수는 최소 30석이다. 현재 의석수는 21석이지만 거대 양당에 실망한 유권자들과 부동층의 숨은 지지율을 흡수함으로써  30석 이상을 얻어 20대 국회에서 원내교섭단체로 안착하겠다는 전략이다.    다만 당내 일각에선 최근 안철수천정배김한길 지도부의 불화로 당 지지율이 추락한 뒤 제자리걸음을 걷는 만큼 2223석 정도만 획득해도 선방한 것 아니겠느냐는 전망도 나온다
진화하는 북한 방사포… 마땅한 대응전력 없어	http://news.naver.com/main/read.nhn?mode=LSD&mid=shm&sid1=100&oid=022&aid=0003034771	북 신형 300 최종 시험사격곧 실전배치 위협강도 높아져정밀도기동력도 향상 분석 우리군 마땅한 대응전력 없어북한이 핵실험과 장거리미사일 발사에 이어 신형 300 방사포를 실전배치할 전망이어서 우리 군의 고민이 깊어지고 있다.북한 조선중앙통신은 22일 전날 방사포 발사소식을 전하며 신형 대구경 방사포의 실전배치를 앞둔 최종 시험사격이라고 보도했다. 또 김정은 국방위원회 제1위원장이 최종 시험사격을 현지지도했다고 전했다. 300 방사포는 북한이 보유 중인 122 240 방사포의 업그레이드 버전이다. 전방에서 육해공군본부가 있는 계룡대를 직접 타격할 수 있어 북한의 장사정포 위협 강도가 한층 높아졌다고 할 수 있다.북한은 그동안 핵무기 개발과 병행해 남한 수도권 지역의 조기 무력화를 위해 포병견인포자주포과 로켓 포병방사포지대지 미사일 및 로켓을 집중 육성해 왔다. 수량면에서는 러시아와 중국 다음으로 많은 포병전력을 보유하고 있다. 북한의 방사포는 북한 포병전력의 핵심이다.300 신형 방사포 김정은 북한 국방위원회 제1위원장이 신형 대구경 방사포 시험 사격을 현지지도했다고 노동당 기관지 노동신문이 22일 보도했다. 사진은 300 신형 방사포가 이동식발사차량TEL에서 발사돼 붉은색 조준 표시 지점으로 날아간 뒤  바위 위의 표적을 정확히 타격하는 모습. 북한군의 주력인 122 방사포는 연평도 포격사건의 주범 중 하나다. BM21 M1977 M1985 세 가지 장비가 운용된다. 전방군단 및 포병사단이 운용 중인 이 방사포는 사거리 20에 3040개의 발사관을 갖고 있다. 재장전에 10분 이상이 소요되며 화학탄 사용이 가능하다.240 방사포는 M1985 M1991 두 종류가 있다. 유효 사거리는 M1985가 43 M1991이 65다. 12개 발사관에 재장전 시간은 34분 정도다. 화학탄 및 기화폭탄 그리고 열압력탄 등을 운용할 수 있어 수도권에 심각한 위협이 된다.300 방사포의 사거리는 200로 240최대 90보다 갑절 이상 늘었다. 인명살상용 고폭탄과 건물파괴용 이중목적탄DPICM 장착도 가능한 것으로 알려졌다.300 방사포는 중국의 WS1B 방사포의 기술을 활용한 것으로 추정된다. WS1B는 사거리 80180로 150 중량의 고폭탄 등을 탑재할 수 있다. 자세제어장치와 유도장치 등을 추가해 정밀도까지 높였다는 분석이다. 특히 북한군이 보유한 포병화기와 달리 중국제 신형 6륜 트럭을 차체로 사용 기동력이 크게 향상된 것으로 전해졌다. 우리 군의 300 방사포 대응전력은 어떨까. 지난해 8월 실전배치하기 시작한 차기다연장로켓MLRS 천무가 있지만 사거리가 80여에 불과하다. 사거리 300인 단거리 탄도미사일 에이태킴스ATACMS는 명중률에 한계가 있다. 군 관계자는 현재로선 마땅한 대응전력을 찾기 힘들다며 2020년대 중반 북한 미사일을 파괴하는 킬 체인이 전력화되더라도 차량을 이용해 움직이는 방사포를 발사 전에 요격하기는 쉽지 않다고 말했다
中, 일본 역사교과서 검정 결과 '엄중 항의'	http://news.naver.com/main/read.nhn?mode=LSD&mid=shm&sid1=104&oid=421&aid=0001956547&cid=428288	화춘잉 중국 외교부 대변인 난징대학살 사실 축소센카쿠 영유 주장 심각히 우려서울 배상은 기자  중국 정부가 센카쿠 열도중국명 댜오위다오를 일본 영토로 표기하고 난징대학살 관련 내용을 축소한 일본의 새 역사교과서에 대해 공개적으로 비판했다. AFP통신에 따르면 화춘잉 중국 외교부 대변인은 22일 일본의 새 고교 교과서 검정 결과와 관련 중국은 일본의 이같은 현상에 심각히 우려하고 있다며 일본에 이에대한 엄중한 항의의 뜻을 표시한다고 밝혔다. 화 대변인은 댜오위다오와 그 부속섬들은 고대 이후 중국에 속한 중국의 영토라는 사실을 재차 강조하는 바라며 일본이 어떤 수단을 쓴다 하더라도 댜오위다오가 중국의 영토라는 기본적 사실은 절대 바뀌지 않을 것이라고 말했다. 화 대변인은 일본의 새 역사교과서가 난징대학살을 축소해 기술한 것에 대해서도 난징대학살은 일본 군국주의에 의한 잔혹한 범죄행위라며 역사를 미화하기 위한 이번 교과서 검정 결과는 역사를 직시하려하지 않는 일본의 태도가 또 한번 드러난 것으로 매우 위험하다고 비판했다
"한일, 군위안부 지원재단 조기 설립 협력"	http://news.naver.com/main/read.nhn?mode=LSD&mid=shm&sid1=100&oid=001&aid=0008273393&cid=428288	정병원 외교부 동북아국장이 22일 도쿄 일본 외무성 청사에서 개최된 이시카네 기미히로 외무성 아시아대양주국장의 협의 후 기자들과 만나 협의 결과를 설명하고 있다. 도쿄서 국장간 협의북한 핵미사일 위협 대응 방안도 논의    도쿄 조준형 특파원  한국과 일본은 작년 12월 28일 도출된 군위안부 합의의 조기 이행을 위해 협력키로 했다.     정병원 외교부 동북아국장과 이시카네 기미히로 일본 외무성 아시아대양주국장은 22일 도쿄 일본 외무성 청사에서 3시간여 개최된 협의에서 군위안부 지원 재단 설립 및 일본 정부의 10억 엔약 103억 원 출연 등 한일 합의의 조기 이행을 위해 노력하기로 했다.       정 국장은 협의후 기자들과 만난 자리에서 재단 설립은 내부적으로 여러가지 를 검토중이라고 일본 측에 설명했고 가능한 조기에 양국이 합의한 피해자들의 명예 회복 및 상처 치유 사업을 실시한다는데 의견을 같이했다며 충실한 합의 이행이 필요하며 그것을 위해 긴밀히 협력하기로 했다고 덧붙였다.      양국 국장간 협의는 작년 12월 28일 한일 군위안부 합의 이후 처음 열렸다.     두 국장은 또 북한의 핵실험 및 미사일 발사 등 도발에 대한 대응 방안도 논의했다.     최근 이상덕 전임 국장으로부터 바통을 이어받은 정 국장은 국장간 협의후 사이키 아키타카 일본 외무성 사무차관을 예방한 뒤 이시카네 국장과 만찬을 했다
수지 여사, 외무장관으로 미얀마 내각 입각	http://news.naver.com/main/read.nhn?mode=LSD&mid=shm&sid1=104&oid=421&aid=0001956577&cid=428288	미얀마 민주화의 상징 아웅산 수지 여사.  AFP서울 배상은 기자  미얀마 민주화의 상징 아웅산 수지 여사가 틴쩌 대통령 당선인이 이끄는 내각의 초대 외무장관에 임명된다.  AFP통신에 따르면 수지 여사가 대표로 있는 민주주의민족동맹NLD은 22일현지시간 수지 여사가 외무장관으로 내각에 참여할 것이라고 밝혔다. NLD 대변인은 수지 여사는 주로 외무부를 맡으면서 본인이 원한다면 다른 부서의 업무들을 공유할 수도 있다며 수지 여사가 외무장관 외에 다른 직도 겸임할 수 있음을 시사했다. 그는 수지 여사는 다른 부서의 장관들을 임명할 권한도 갖고 있다고 덧붙였다. 수지 여사가 외무장관에 임명되면서 현재 맡고 있는 NLD 대표에서도 곧 물러날 것으로 보인다. 미얀마 법은 내각 각료는 정당활동을 할 수 없다고 규정하고 있다. 앞서 틴쩌 대통령 당선인이 미얀마 상하원합동회의에 제출한 각료 인선안에서 수지 여사는 맨 첫번째에 기재돼 있는 것으로 확인됐으나 구체적으로 어느 장관직을 맡을 것인지는 알려지지 않았다
'멀쩡한 눈 수술' 건보재정 축내는 실손보험	http://news.naver.com/main/read.nhn?mode=LSD&mid=shm&sid1=102&oid=056&aid=0010298985	멘트 최근 실손 보험 가입자들을 상대로  멀쩡한 눈까지  수술을 하는 병원이 급증하고 있습니다.    병원은 거액의 수술비를 벌고 환자는 보험금으로 공짜 수술을 받는다는 건데요.하지만 이런 과잉 의료에는   민간보험 뿐 아니라 국민 건강보험 재정까지 축나게 만드는 독소가 숨어 있습니다.   김준범 기자가 심층 취재했습니다. 리포트 건강검진에서  눈에 특별한 이상이 없는 50대 주부가 시력 교정을 상담하러  여러 안과를 찾았습니다. 한 병원에서  시력 교정 수술인 라식이나 라섹 대신 백내장 수술을 하자고 합니다.녹취 A병원  멀리도 보이게 하면서 가까이도 보이게 하는 유일한 방법이 백내장 수술이거든요. 한 6백만 원 정도 나와요. 비싸다는 반응을 보이자 실손보험 얘기를 꺼냅니다.녹취 A 병원  이게 보험이 되거든요. 백내장은 질환이고 그 질환으로 수술을 하게 되고 수술하게 되면 실비처리 하게 되는 거죠. 다른 병원에서는 발견되지 않았던 백내장을 수술하면서 시력 교정을 하고 보험 처리하라는 겁니다. 노골적인 은어까지 있을 정도로 의료계에서는 공공연한 비밀입니다.  일부 안과는 수사선상에 올랐습니다. 관절 질환 병원들도 실손보험 가입 여부를 묻고 비싼 치료를 받으라고 권합니다.녹취 C 병원  실비가 있으신가요녹취 D 병원  고주파를 하고 재활치료하는게 나아요.녹취 D 병원  100에요. 공짜니까 안할 이유가 없잖아요.인터뷰 구본기전직 보험설계사  병원 같은 경우는 최대한 병원비를 벌어들여야 될 거 아니에요. 그래서 소비자들에게 이런저런 검사들을 권해서 그 병원비의 파이를 계속 키운다는 말이에요. 문제는 한 번 갈 병원을 여러 차례 가도록 유도하게 되면 국민건강보험까지 지출이 급증한다는 겁니다.인터뷰 신현웅보건사회연구원 박사  외래의 경우에는 1인당 8천 7백 원이 낭비가 되고 있고 입원의 경우에는 3만 7천 원 정도가 과잉의료로 인한 낭비요소가 있습니다. 환산해보면 1년에 7천7백40억 정도의 낭비 요소가 있기 때문에 문제가 되는 것입니다
