"남북 민간교류 유연하게 검토"…통일부 발표 의미는?	http://news.naver.com/main/read.nhn?oid=055&sid1=100&aid=0000532842&mid=shm&mode=LSD&nh=20170522214250	북한의 도발이 계속되는 상황에서 통일부가 오늘 남북관계의 단절은 바람직하지 않다며 민간교류에 유연하게 대응하겠다는 입장을 내놨습니다. 오늘 정부 발표의 의미를 안정식 북한 전문기자와 자세히 알아보겠습니다.이 시점에서 남북 민간교류를 검토하겠다는 발표를 어떻게 해석해야 할까요기자통일부 대변인이 오늘22일 브리핑에서 한 말 한번 들어보시겠습니다.이덕행통일부 대변인  민간교류 등 남북관계 주요 사안들에 대해서는 국제사회의 대북제재 틀을 훼손하지 않는 범위 내에서 유연하게 검토해 나갈 생각입니다.통일부 대변인이 오늘 브리핑 중에 이 말을 4번이나 반복했습니다. 이 말은 결국 민간교류를 정부가 풀어주겠다는 뜻으로 봐야 할 것 같습니다.앵커오늘 정의용 국가안보실장도 비슷한 취지의 말을 했죠기자정의용 실장도 국회에서 기자들을 만나 인적교류를 신중히 검토하겠다고 했고요 또 군 통신망이나 판문점 연락 채널은 빨리 재개해야 하고 실무급 차원에서 대화를 한번 시도해봐야 할 것이라고 이야기했습니다.앵커지난 10년간 보수 정권 때와는 확연히 달라진 모습인데 아무래도 민간단체들이 기대 하겠군요기자대북지원단체 얘기를 들어보시죠.강영식우리민족서로돕기운동 사무총장  남북공동이 같이 할 수 있는 사업들이 몇 개 있습니다. 예를 들면 접경지역에 말라리아 공동 방역이라든지 또는 산림 병해충 방제 사업 같은 서로가 이익이 되는 사업들을 우선 추진해보려고 합니다.15 공동선언 17주년 행사를 남북이 같이 할 것이냐도 관심사인데요 여기에 대해서는 정부가 다소 신중한 입장입니다.앵커북한의 도발은 계속되고 있지만 정부가 유연한 입장을 내놨는데 이걸 계기로 얼어붙었던 남북관계가 풀릴 수 있다는 전망을 해봐도 될까요기자그렇게 쉽지는 않습니다. 북한이 핵 미사일 개발을 계속하고 있고 국제사회의 대북제재가 행해지는 국면 이 기본 구도는 바뀌지 않았기 때문입니다.때문에 개성공단이나 금강산 관광 남북 경협처럼 큰 규모의 교류는 북핵 문제에 진전이 있지 않은 한 쉽게 재개되지 않으리라는 전망이 많은데요 지금 정부의 조치는 남북관계가 그동안 워낙 막혀있었기 때문에 최소한의 물꼬를 트는 차원이라고 이해하는 게 좋을 것 같습니다
청, 전담팀 두고 방산비리도 손봐…지난 정부 '사정권'	http://news.naver.com/main/read.nhn?oid=437&sid1=100&aid=0000154729&mid=shm&mode=LSD&nh=20170522213104	이런 가운데 문재인 정부가 4대강 사업에 이어 지난 정부들의 방산 즉 방위산업비리까지 정조준할 거라는 전망도 나옵니다. 청와대가 국가안보실 내에 국방개혁 전담팀을 두고 방산비리를 척결해나가겠다고 밝힌 건데 이 과정에서 이명박 박근혜 정부 때 불거졌던 방산비리 문제도 다시 들여다 볼 가능성이 제기됩니다. 기자오늘22일 국회를 찾은 정의용 국가안보실장은 청와대가 직접 방산비리를 척결하겠다는 뜻을 내비쳤습니다.주호영 바른정당 원내대표와 만나 국가안보실에 국방개혁팀을 만들어서 방산비리를 주로 보도록 하는 계획을 가지고 있다고 말한 겁니다. 그러면서 지난 정부에서 비리를 감사할 가능성도 있느냐는 기자들의 질문에 구체적으로 생각한 건 아니다라면서도 방산 비리는 방위력 증가에 하나의 걸림돌이 되기 때문에 확실히 짚고 넘어갈 것은 짚고 넘어가고 방지 차원에서 검토하겠다고 가능성을 남겼습니다.앞서 문 대통령도 후보시절부터 방산비리를 재감사하겠다는 구상을 밝혀왔습니다.지난달 30일  이명박 정부 4대강 비리 방산 비리 자원외교 비리도 다시 조사해 부정축재 재산 있으면 환수하겠습니다.이에 따라 민주당이 야당시절부터 문제점을 지적해온 이른바 사자방 즉 이명박박근혜 정부에서 이어진 4대강자원외교방산비리 문제 전체로 현 정부의 감사 범위가 확대될 가능성이 제기됩니다.이희정 JTBC 뉴스 공식 SNS 트위터 페이스북 유튜브Copyright by JTBChttpjtbc
 '택시기사 폭행' 공포의 13분, 보호벽은 왜 없을까?	http://news.naver.com/main/read.nhn?oid=448&sid1=102&aid=0000211031&mid=shm&mode=LSD&nh=20170522211434	강변북로에서 시속 100로 달리고 있는 한 택시의 블랙박스 영상입니다. 그런데 갑자기 방향을 틀더니 가드레일을 들이 받습니다. 만취한 승객이 난동을 부린 건데요 이렇게 운행 중 기사들이 폭행 당하는 일이 매년 3천 건 넘습니다. 아차하면 대형 사고로 이어질 수도 있는데 막을 방법은 없는지 판 포커스에서 짚어봤습니다.리포트황금연휴의 홍대앞 먹자 골목 한 남성이 택시에 탑니다. 어디 가시는데 구리시요 구리 타요 따블 승객은 앉자마자 욕을 뱉기 시작. 조모씨  택시승객XX XX들 때문에 X될 뻔 했어요. 중국애들이 조작했거든요 그것 때문에강변북로에서 갑자기 안전띠를 풀더니 잠시뒤이모씨  택시기사털컥 안 돼 안 돼 안 돼 시속 100로 달리는 차의 문을 열어 버립니다. 문 닫어 빨리 죽여버릴 거야. 이 개XX들택시안 공포의 13분 조모씨  택시승객화나는 건 주체 못하잖아요.조모씨  택시승객거짓말 치는 XX들 XX 죽여야돼 끼이익 쾅  달리는 차의 운전대를 잡아돌린 승객. 결국 차가 길옆 풀숲에 쳐박힙니다. 뚫려버린 가드레일 쓰러진 가로수 하마터면 낭떠러지를 넘어 한강으로 추락할 수도 있었습니다. 택시 기사가 속도를 늦추고 있던 상태라 다행히 인명 피해가 없었습니다. 석동수  성동경찰서 교통범죄 수사팀장사고가 날 것 같아서 하위차로로 택시를 운전하던 중에 그런 일이 발생한 겁니다.3 차로에서 이런 일이 발생했으면 대형 큰 참사가 일어날 수도 있을 거라는.조 씨는 조수석에서 나와 3.5m 난간 아래로 뛰어내린 뒤 도주했습니다.  운전자 폭행은 2차 3차 사고로 이어질 수 있는 중범죄입니다. 택시기사어 내가 죽었나 이런 생각도 솔직히 했어요. 그리고 이렇게 보니깐 걔도 움직이고 있고 피도 안나고. 정신 차리고 경찰서에 112에 신고를 먼저 했죠. 이런 폭행으로부터 택시 기사를 보호하는 방법은 없을까. 미국 일본 등은 택시에 의무적으로 보호벽을 설치해야 합니다. 우리나라도 시내버스엔 2006년 보호벽 설치가 의무화됐지만 택시는 시범사업 단계에서 무산됐습니다. 3년전 시범적으로 가림막을 설치했던 한 택시업체입니다. 1대를 제외하고 모두 해체했고 그 한 대도 이렇게 작은 가림막만 남았습니다.  서울시가 택시 기사를 상대로 조사를 해봤더니 밀폐된 공간이 답답하다 승객과 소통하기 불편하다는 등 설치에 거부감을 표시한 의견이 절반에 달했던 겁니다.박대범  택시기사안전운전에 저해가 되고 특히 후진시에는 아주 문제가 많습니다. 그리고 8시간 이상 근무를 하다보니 매일 스트레스를 받아요. 대당 3040만원에 달하는 비용도 부담이었습니다. 송양섭  택시운수업체 노조위원장서울 시내 택시가 전부 해주고 또 전국 규모로 되면 좋은데 그것이 안되니까 이걸 우리 회사만 설치하고 다니다 떼는 중이에요. 택시 기사를 승객 폭행으로부터 보호하는 게 우선일지 택시 기사의 편안한 운전을 보장해주는 게 우선일지 깊은 고민이 필요해 보입니다.com윤수영 기자  뉴스제보  이메일tvchosunchosun
'보이지 않는 공포' 오존, 온난화와 '최악의 조합'	http://news.naver.com/main/read.nhn?oid=448&sid1=103&aid=0000211033&mid=shm&mode=LSD&nh=20170522212151	미세먼지가 주춤하자 이번에 오존이 기승입니다. 오존 오염 실태가 심각한 수준이라고 합니다.미세먼지보다 인체에 더 치명적일 수 있는 게 오존인데 윤슬기 기자가 실태와 문제점을 알아봤습니다. 리포트수도권과 영남 일부 지역 등의 오존 농도가 연이틀 나쁨입니다. 초여름 날씨가 평년보다 일찍 찾아오면서 오존 비상입니다. 최용석  서울시 대리관리과95년부터 측정을 했는데 오존 농도가 계속적으로 나빠지고요. 지난해엔 33회로 오존주의보가 가장 많이 발령됐습니다. 전국 256곳 대기측정소에서 8시간 오존농도 기준치인 0.06ppm 이하를 충족시킨 곳은 딱 한 군데였습니다. 미세먼지가 10곳중 1곳 꼴로 합격 판정인 것에 비하면전국 대부분이 오존 위험에 노출됐다는 얘기입니다. 자동차 배기가스가 햇볕과 화학반응으로 만들어지는 오존은 배기 가스가 많고 햇볕이 따뜻할수록 양이 증가합니다. 그래서 지구온난화와 자동차의 증가가 오존의 원인으로 지목됩니다. 국내자동차는 10년새 42가 늘어 2200만대에 육박하고 있고 인접한 중국도 5배나 급증했습니다. 오존은 피부염 만성폐질환 유발 등 호흡기와 심혈관계에 치명적입니다. 강재헌  서울백병원 가정의학과 교수오존은 가스의 일종이기 때문에 사실 마스크로도 방어가 안돼서. 오존은 미세먼지처럼 눈에 보이지 않아 신속한 오존 주의보 발령 등 환경 당국의 발빠른 대처가 요구됩니다.  윤슬기 기자 cupidmomchosun
돈 때문에 몸싸움·고소 잇따라…친박단체 내분 '격화'	http://news.naver.com/main/read.nhn?oid=437&sid1=102&aid=0000154738&mid=shm&viewType=pc&mode=LSD&nh=20170522220511	정광용 박사모 회장 등의 구속영장 신청과 별개로 친박 관련 단체들은 내분 조짐을 보이고 있습니다. 지난 겨울 이후 친박 단체 집회를 열고 친박 정당을 만들면서 모으고 사용한 자금이 갈등의 중심에 있습니다. 서로 비방과 몸싸움은 물론 고소 고발까지 잇따르고 있습니다.기자집회 참가자지난 13일  정광용이 물러가라 내려와 XXX야.대통령 선거 이후 처음 열린 친박 단체 집회는 참가자들 사이의 욕설과 몸싸움으로 끝이 났습니다. 집행부에 대한 불신으로 사분오열됐다는 지적이 나옵니다.친박 집회에 나가던 한 시민단체의 대표는 자금 사용처가 분명하지 않다며 정광용 박사모 회장을 기부금품법 위반으로 경찰에 고발하기도 했습니다.  정영모정의로운 시민행동 대표  주머니 쌈짓돈처럼 자기네 맘대로 집행할 수 있는 돈 갖고 신문 광고비로 십몇억 문자 발송 2억씩일각에선 집회에 동원한 전세 버스 비용이나 각종 행사비 회계가 투명하지 않다는 의혹도 제기했습니다.   새누리당이라는 이름으로 친박 정당을 창당하면서 들어간 자금에 대해서도 논란과 다툼은 계속됐습니다.주모 씨친박단체 회원  직책 당비 특별 당비 해서 많이 낸 사람은 몇십만원씩 내게 했는데 얼마 들어왔는지 전혀 공개 안 하고 있고경찰은 관련자들의 기부금품법 위반 여부와 자금 횡령 등에 대한 수사에도 속도를 낼 예정입니다.최하은 JTBC 뉴스 공식 SNS 트위터 페이스북 유튜브Copyright by JTBChttpjtbc
中, 극비 핵 기지 '지하 만리장성' 공개…무력 시위?	http://news.naver.com/main/read.nhn?oid=214&sid1=104&aid=0000767921&mid=shm&mode=LSD&nh=20170522213433	중국이 극비리에 운영해온 지하 핵미사일 기지 이른바 지하 만리장성을 공개했습니다.핵 공격을 받으면 10분 만에 반격할 수 있는 걸로 알려졌는데요.돌연 공개를 한 배경에 관심이 모아지고 있습니다. 리포트 중국군 전략 미사일 부대가 산악지대에서 신속히 이동합니다.가상 적국의 핵 공격 상황을 가정한 훈련입니다.중국 미사일부대 지휘관해당 부대는 밤 10시까지 8번 지역에 가서 대기하라.집결지는 지하 핵 미사일 기지.사이렌 소리와 함께 육중한 철문들이 연이어 닫히고 반격 훈련이 시작됩니다.대륙간 탄도미사일과 궤도 차량을 갖춘 이곳은 그물망 같은 지하도로 진짜와 가짜가 뒤섞인 수백 개의 지하 발사구가 있어 첨단 첩보 위성도 정확한 목표 특정이 어렵습니다. 홍콩 매체들은 지하 기지의 연장 거리가 수천km에 이르며 내부에서 신속하게 이동하면서 10분 안에 핵 공격에 대한 반격이 가능하다고 전했습니다.중국군이 비밀에 싸여있던 이른바 지하 만리장성의 내부를 공개한 건 극히 이례적입니다.왕시민중국군 ICBM 여단장훈련을 통해 장병들은 악화된 작전 환경에서 적응 능력을 향상시킬 수 있습니다.미국 본토를 사거리에 두는 ICBM 둥펑5B의 시험 발사 장면도 공개됐습니다
덜 마시고 덜 써도 '여행은 간다'…흥미로운 분석 결과	http://news.naver.com/main/read.nhn?oid=055&sid1=101&aid=0000532853&mid=shm&mode=LSD&nh=20170522222705	한 신용카드 회사가 지난 3년 동안 고객들의 결재 내역 24억 건을 분석한 결과 흥미로운 변화가 포착됐습니다. 최근 들어 술을 덜 마시고 또 예전보다 영화나 스포츠 보는 것도 줄인 반면에 여행엔 아낌없이 돈을 쓴 것으로 나타났습니다.기자박정빈서울 강동구  맥주보다는 소주가 싼값에 더 빨리 취해서 저는 소주를 더 많이 마셔요.술로 스트레스를 풀려다가 술이 깬 다음 날 카드 값 때문에 더 큰 스트레스를 받기도 하죠.3년 전에 비해 술을 비롯한 유흥에 쓰는 돈은 11나 줄었습니다. 스포츠와 영화 관람 책에도 돈을 덜 썼습니다. 오랜 경기 침체 속에 한국인이 가장 먼저 지갑을 닫은 분야로 분석됩니다. 20대와 30대는 소득이 늘지 않아도 해외여행에 들이는 돈을 늘렸고 50대 이상도 가까운 곳으로 싸게 자주 다닙니다.이재형삼성카드 빅데이터 분석 담당  여가를 즐기는데도 선택과 집중 현상이 뚜렷하게 나타납니다. 개인의 경험이나 내적 만족을 중시하는 가치소비가 자리를 잡고 있는 것으로 보입니다.이런 세태를 반영한 듯 피부미용 건강 관리 인테리어에 들어간 돈도 크게 늘었습니다.미래를 위해서는 어떻게 돈을 썼을까요 이 그래프 그릇 모양이죠. 먹고 살 기술을 배우는 기능학원의 수강료 증가 폭이 20대에서 가장 높았고 점점 줄어들다가 50대 60대부터 다시 늘어나는 추세입니다.이를 반영하듯 패션 학원의 강의실엔 청년층과 중장년층이 섞여 있습니다. 세대별로 목표는 다르지만 배워야 산다는 것은 같습니다.정세왕52세 홍선영22세  100세 시대잖아요. 그래서 평생 나만이 가질 수 있는 자격 기술을 연마하고 싶어서. 젊은이들이 주 고객층이었던 편의점의 고객 증가 속도도 최근 3년간에는 50대와 60대가 가장 빨랐습니다.김대성서울시 용산구  대가족이 아니고 부부 둘이 있다 보니까 편의점이 가깝고 여러가지 물건을 내가 필요한 만큼 선택해서 골라서 살 수 있고요.백세 시대 한 번뿐인 인생. 젊고 폼 나게 살아볼 수 없을까
보험료 싸진다더니 '지지부진', 말 뿐인 '착한 보험'	http://news.naver.com/main/read.nhn?oid=214&sid1=101&aid=0000767925&mid=shm&mode=LSD&nh=20170522224253	금융당국이 실손보험 개편안을 내놓은 지 한 달이 지났습니다.과잉진료를 막아서 손해율을 낮추고 보험금 비싸지는 것도 막자 이런 취지였는데 어쩐지 효과가 지지부진합니다. 리포트 보험료가 최대 35 싸졌다는 새로운 실손보험 가입을 문의해봤습니다.다른 보장보험에 함께 가입하라며 끼워팔기를 시도합니다.보험사 상담원실손에서 안 되는 건 진단자금에서 충당을 하셔야 하기 때문에 제 생각에 꼭 굳이. 실손보험만 가입하려면 건강검진 결과를 요구하거나 아예 가입 자체를 거부하는 곳까지 있습니다.보험사 상담원단독실비는 저희가 상담원들이 취급 못 하게 회사에서 막아놔서 저희가 그걸 못해드려요.금융당국은 지난달 과잉진료를 막겠다며 기본형과 특약으로 나눈 실손보험을 내놨지만 한 달 동안 신규 가입건수는 9만 건에 그쳐 기대보다 저조했습니다. 또 기존 가입자가 새 상품으로 갈아탄 경우도 200건 정도였습니다.기본형 실손보험은 남는 게 없다는 이유로 보험사들이 가입을 꺼린데다소비자 입장에서 기본형은 보장범위가 작고 특약을 할 경우 자기부담금이 늘어나 별다른 매력이 없는 겁니다.조남희금융소비자원 대표지금처럼 기존의 상품을 리모델링하고 분할시켜서 가입시키는 이러한 방법으로는 실손보험 개선에 한계가 왔다고 보입니다
그린벨트 내 '배짱 영업', 솜방망이 처벌 때문?	http://news.naver.com/main/read.nhn?oid=214&sid1=102&aid=0000767920&mid=shm&viewType=pc&mode=LSD&nh=20170522211339	개발제한구역 그린벨트 안에서의 불법 영업.무허가 식당에서부터 골재공장 불법 주차장까지 업종도 다양한데요.수시로 단속을 하고 조치를 해도 이렇게 근절되지 않는 데는 이유가 있었습니다. 리포트 경기도 고양시 화전동 한강으로 이어지는 하천 옆이라 개발제한지역으로 묶여 있습니다.그런데 안에서 골재 파쇄 작업이 한창입니다. 찍지 말라고인근에 이런 공장이 4곳이나 됩니다.그린벨트 안에 설치가 가능한 야적장이나 목장 등으로 허가를 받아놓고 다른 작업을 하고 있는 겁니다.공장 관계자이런 땅에 안 쓰면 뭐 하겠어요. 전부 다 황무지 아닙니까. 그렇죠 그런 부분까지 검토가 돼야 하지 않나. 그게 참 정부죠고양시 강매동의 한 사설 주차장.역시 그린벨트 안에 있는 무허가 시설입니다.돈을 받고 영업을 할 수 없는데도 별문제 없다고 주장합니다.불법 주차장 관리인그린벨트는 그린벨트라도 잡종지니까. 자동차 대는 데는 문제가 없거든요. 주차는 한 달에 한 10만 원꼴.이렇게 불법 운영을 하다 적발되면 원상복구를 할 때까지 1년에 최대 두 번 이행강제금이 부과됩니다.3 최대 5천만 원을 내야 하지만 한 달에 수천만 원씩 버는 업자들에겐 미미한 수준입니다.골재업계 관계자하면 안 된다는 걸 알아요. 벌금 받아봤자 돈 5백만 원 천만 원이면 돼요. 하루에 2천만 원 넘게 버는데 하죠 그냥이행강제금을 안 내더라도 지자체가 돈을 강제로 받아낼 수 있는 방법도 마땅치 않아 실효성이 떨어집니다.경기도청이행강제금을 안 내면 저희가 가산금 제도가 별도로 없어서 예를 들어 5천만 원 했는데 부과를 안 해서 6천만 원 7천만 원 늘어나는 상황은 별도로 아니기 때문에지난해 경기도에서만 1천 4백여 건의 그린벨트 내 불법 행위가 적발돼 3백억 원 가까운 이행강제금이 부과됐습니다
