서울 성동·중랑·금천구 '산사태 주의보' 발령	http://news.naver.com/main/read.nhn?oid=421&sid1=103&aid=0002831900&mid=shm&viewType=pc&mode=LSD&nh=20170710234914	김용하 산림청 차장  서울 김다혜 기자  최근 쏟아진 강우로 지반이 약해진 데다 10일 하루 동안에만 서울경기 지역에 100160의 많은 비가 쏟아지면서 곳곳에 산사태 주의보가 내려졌다.산림청 산사태 예방지원본부에 따르면 오후 11시 현재 산사태 주의보가 내려진 지역은 서울 성동구 중랑구 금천구와 경기 가평군남양주시 강원 춘천시 등 6곳이다. 이에 산림청은 산사태 발생에 대해 재난관리자원 보유 및 가동여부 현황 파악하고 있으며 산사태 위험이 있는 곳에는 긴급재난문자 발송과 마을방송 등의 상황 전파를 통해 신속히 주민을 대피시킬 계획이라고 밝혔다
文대통령, 7말8초 여름휴가 계획…장소는 양산 사저될 듯	http://news.naver.com/main/read.nhn?oid=001&sid1=100&aid=0009397322&mid=shm&mode=LSD&nh=20170710215300	김승욱 기자  문재인 대통령이 이달 말 또는 8월 초 여름휴가를 떠날 예정인 것으로 알려졌다.집에서 입던 옷 그대로 나온 대통령양산 최병길 기자  문재인 대통령이 21일 오후 경남 양산시 매곡동 사저에 도착해 마을을 찾아온 방문객들을 만나려고 집에서 입던 편한 옷차림으로 주영훈 경호실장과 함께 밖을 나서고 있다. 구김이 많이 간 남방 편한 바지 등산화 차림으로 나선 문 대통령 모습이 눈길을 끈다.kr끝 청와대 관계자는 10일 기자들과 만나 대통령 휴가는 7월 말이나 8월 초가 될 것 같다. 장소는 양산 사저가 가장 유력할 것으로 보인다고 말했다.    문 대통령은 취임 12일 만인 5월22일 신변정리 차원에서 하루짜리 연차를 내고 양산 사저에서 첫 휴가를 보냈다.    문 대통령은 참여정부에서 대통령 비서실장과 민정수석 시민사회수석 등을 역임한 덕에 연간 21일까지 연차를 사용할 수 있다
극단으로 내몰린 집배노동자…'살인 노동 멈추라'	http://news.naver.com/main/read.nhn?oid=032&sid1=102&aid=0002801728&mid=shm&mode=LSD&nh=20170710225525	분신 안양 집배원 못다 한 절규전국집배노조 조합원과 시민사회단체 회원들이 안양우체국 소속 집배원의 분신과 관련해 10일 오전 서울 종로구 청운효자동주민센터 앞에서 기자회견을 열고 진상규명을 위한 조사위원회 구성을 요구하고 있다.  강윤중 기자 yajakyunghyang.경기 안양시 안양우체국 소속 21년차 집배원 원모씨47는 지난 4일 퇴근길에 힘들지 않으냐는 동료 집배원 ㄱ씨의 물음에 이렇게 답했다. 이 말은 ㄱ씨가 원씨에게 들은 마지막 말이 됐다.이틀 뒤인 지난 6일 아침 원씨는 평소 택배 물품을 나르던 아파트의 경비원들과 지역 주민들을 일일이 찾아다니며 인사를 나눴다. 원씨는 그날 우체국에 전화를 걸어 오늘은 일을 못 나가겠다며 연가를 낸 상태였다. 주변인들에게 인사를 마친 그는 자신이 일하던 우체국으로 향했다. 안양우체국 앞에 도착한 원씨는 500들이 음료수병에 든 인화성물질을 자신의 몸에 붓고 라이터로 불을 붙였다. 원씨는 전신에 2 3도 화상을 입고 병원으로 옮겨져 치료를 받았으나 안타깝게도 이틀 만인 지난 8일 숨을 거뒀다. 동료 ㄱ씨는 경향신문과의 통화에서 나 역시 너무 힘들었던 탓에 그가 자살할 거란 낌새를 느끼지 못했다고 밝혔다. 경찰은 원씨가 분신을 하게 된 이유 등 정확한 사건 경위를 수사 중이다. 그러나 주변 사람들은 원씨의 극단적인 선택은 평소 시달리던 과로 때문이라고 얘기한다. 동료들에 따르면 원씨가 일하는 안양 지역은 최근 신도시 개발 등으로 배달물량이 급증해 안양우체국은 대표적인 집배원 인력부족 우체국으로 꼽혀왔다. 과다한 배달물량에 허덕이는 상황에서 최근 원씨는 담당 구역까지 통째로 바뀌면서 업무 스트레스가 더욱 심해졌다고 한다. 권삼현 집배노조 쟁의국장은 유족들의 말에 의하면 고인은 새벽 4시 반에 일하러 나가면 밤 10시 반이 돼서야 퇴근했다면서 담당 구역이 바뀐 후에는 지역이 낯설다 보니 더욱 일찍 출근하고 늦게 퇴근했다고 말했다.집배노조는 10일 오전 청와대 인근인 서울 종로구 청운효자동주민센터 앞에서 기자회견을 열고 안양우체국은 전국에서 가장 바쁜 경인지역 중에서도 살인적인 업무량을 갖고 있다며 재개발 신도시 건설 등으로 가구수가 대거 늘고 있음에도 불구하고 인력 충원이 이뤄지지 않고 있다고 밝혔다. 또 안양우체국 분신자살 사건은 명백하게 업무와 연관성이 있다며 잇따른 집배원 사망사건을 조사할 위원회를 구성해달라고 촉구했다. 문재인 대통령은 지난 3일 열린 제50회 산업안전보건의날 기념식 영상 메시지를 통해 대형 인명사고의 경우 국민들의 참여가 보장되는 조사위원회를 구성하겠다고 밝힌 바 있다. 집배원 사망사고는 지난 5년간 75건으로 올해만 12건이 발생했다. 이 중 올해 집배원 자살은 원씨가 다섯번째다. 지난 3월 충남지역 우체국에서 근무하던 한 집배원이 업무가 힘들다는 말을 일기장에 남기고 자살했으며 같은 달 전남지역 우체국에서 근무하던 또 다른 집배원은 근무지 내 폐가에서 목을 맸다. 나머지 집배원들은 심근경색 뇌출혈 교통사고 등으로 숨졌다. 사망사고 빈발의 주된 원인은 과로다. 지난해 7월 사회진보연대 노동자운동연구소가 발표한 전국 집배원 초과근로 실태조사 결과를 보면 집배원의 주당 평균 노동시간은 55. 2015년 경제활동인구조사 기준으로 일반 노동자보다 1년에 621시간1주에 12시간 더 길다.이와 관련해 우정사업본부는 지난 2월 일손이 남는 일부 우체국의 집배원을 업무부담이 과중한 우체국으로 전보하는 조치를 취했으나 연고지와 먼 곳으로 전보가 이뤄져 장거리 출퇴근을 해야 하는 상황에 놓인 집배원들이 많다는 현장 반발에 부딪혔다.새 정부가 들어서자 우정사업본부는 지난 6월 노동 여건 개선책을 내놨다. 주 52시간 초과 노동이 일상적으로 이뤄지는 일부 관서에 2018년까지 인력 100명을 충원하기로 했다. 안양우체국에도 위탁 집배원 2명을 증원한다는 계획을 내놓았다. 하지만 구인에 차질을 빚으며 현재까지도 증원은 이뤄지지 않았다. 최영준 노동자연대 운영위원은 정부가 추진하는 집배원 100명 증원은 생색내기일 뿐 근본적 해결책이 아니다라고 지적했다. 집배노조 측은 현재의 초과노동 현실을 개선하기 위해서는 수천명의 증원이 필요하다는 입장이다.우정사업본부는 이달 내로 충원 작업을 완료한다는 입장이다. 또 전 우체국을 대상으로 부족한 인력을 산출해 내년까지 인력을 충원해 나가기로 했다. 우정사업본부 관계자는 이번 사건에 대해 안타깝게 생각한다며 고인은 최근 집배 구역이 바뀌면서 익숙지 않은 환경에 처하자 어려움을 겪은 것으로 보인다고 말했다
보험료 8% 깎아주는 '서민 할인'…보험사 수익 줄까 '쉬쉬'	http://news.naver.com/main/read.nhn?oid=055&sid1=101&aid=0000547438&mid=shm&mode=LSD&nh=20170710224717	서민 생활 지원을 위해 일정 조건을 갖춘 서민들에게 자동차 보험료를 할인해 주는 제도가 있습니다. 하지만 보험사들이 수입이 줄까 봐 쉬쉬하는 바람에 이 할인 혜택을 보는 가입자가 3년 새 절반으로 줄었습니다.기자시장 상인 박 모 씨는 최근 자동차 보험 관련해 새로운 사실을 알고 분통을 터뜨렸습니다.자신이 서민 할인 대상으로 보험료를 절약할 수 있었는데 보험사가 아무 얘기도 안 해줬기 때문입니다.박모 씨시장상인  서민 할인에 대해 들어본 적 전혀 없어요. 자동차 보험 갱신 전화 왔는데 그런 내용 전혀 고지받은 게 없어요. 보험사가 괘씸하다는 생각 들죠.연 소득이 4천만 원이 안 되고 5년 이상 소형차를 몰고 있으며 20세 이하의 자녀가 있을 경우 자동차보험 서민 할인을 받을 수 있습니다.서민의 경제적 부담을 줄이기 위해 2011년 도입된 제도인데 보험료를 최고 8까지 깎아줍니다.금융당국은 적극적인 홍보를 하라고 독려하고 있지만 보험사들은 수익이 줄어든다며 오히려 쉬쉬하는 분위기입니다.김모 씨보험설계사  소형화물차나 5년 이상 된 중고차만 가입이 되니까 손해율도 올라갈 수 있고 보험사 입장에서는 굳이 이거를 해야 될 이유는 없죠. 정부에서 하라고 하니까 하는 거죠 사실.이렇다 보니 이 혜택을 보는 가입자가 지난 2013년 8만7천 명에서 3년 만에 절반 이상 줄었습니다.금융당국은 보험사들의 제도 운용에 문제가 없는지 보험사들을 상대로 실태 조사에 나설 방침입니다
조희팔 은닉자금 첫 환수…"피해자 반환 추진"	http://news.naver.com/main/read.nhn?oid=056&sid1=102&aid=0010479163&mid=shm&mode=LSD&nh=20170710220118	앵커 멘트   조희팔 이라는 이름 기억하실 겁니다.   5조 원대의 다단계 판매 사기 행각을 벌이면서 피해자 7만 여명으로부터 2900억 원을 빼돌린 인물인데요   수사 시작 9년 만에  해외 은닉재산의 환수가 시작됐습니다.   단독 보도 장혁진 기자입니다. 리포트 지난 2011년 중국 산둥성에서 치러진 조희팔 씨 장례식입니다. 3년 전 함께 도피한  최측근 강태용 씨 등과 함께 터를 잡았던 곳입니다. 조 씨 일당의  은닉자금을 추적해 온 검찰이 이 산둥성에서 실마리를 찾았습니다. 검찰이 주목한 돈은 2014년 칭따오의 한 대형은행에 예치된 2억 8천여만 원입니다. 그 이듬해인 2015년 장쑤성에서 체포한 강태용 씨로부터 범죄수익금이라는 것도 확인됐습니다. 검찰은 중국 공안부와 범죄수익금 환수에 대한  세부 조율을 모두 끝내고 오는 9월 최종 합의 만을 남겨두고 있습니다. 조희팔 일당의 첫 해외 은닉자금 환수이자 중국으로부터  국내 범죄 수익을 돌려받는 첫 사례입니다. 검찰이 현재 은닉재산 추적에 집중하고 있는 대상은 조희팔 사기 사건의 피고인으로 재판에 넘겨진 70여 명과  그들의 친인척입니다. 주로 중국에 집중돼 있는데 중국 공안부에는 이들 명의의 계좌 개설 여부와 거래 내역 계좌 추적 등을  요청한 상탭니다. 검찰은 이번에 환수하는 범죄수익금은  피해자들에게 나눠 줄 계획입니다
40년 부산 해녀촌 '철거'…진짜 이유는?	http://news.naver.com/main/read.nhn?oid=437&sid1=102&aid=0000158223&mid=shm&mode=LSD&nh=20170710224339	부산 송도 암남해변에는 40년 전부터 해산물을 파는 해녀촌이 형성돼 있습니다. 그런데 구청이 그 자리에 주차장을 만들겠다면서 갑작스레 철거를 통보했습니다. 그 배경을 놓고 이런저런 뒷말이 나오고 있습니다.무거운 납덩어리를 허리춤에 차고 해녀들의 상비약 뇌선도 입속에 털어 넣습니다.김선화암남해변 해녀  이거뇌선 안 먹으면 한 발짝도귀가 먹먹해서 못 들어가. 해녀들은 일단 누구나 다 먹어.어구를 메고 바위 아래 바다로 들어가 숨을 헐떡이면서도 바위틈의 성게를 줍고 돌 멍게를 땁니다.뭍에 다시 오르는 해녀들의 망태기가 두둑합니다. 바다에서 방금 나온 해녀 분들의 망태기 안을 좀 살펴보겠습니다. 이렇게 자연산 돌 멍게도 있고요. 그 귀하다는 빨간 해삼도 있습니다. 이렇게 싱싱한 해산물에 힘입어 이곳 해녀촌 포장마차는 상당히 인기가 많은 곳인데요.지난해 9월 부산 서구청은 갑작스레 포장마차의 철거를 통보해왔습니다.꽃다운 젊은 시절부터 이곳에서 40년 넘는 세월을 보낸 해녀들은 당황스럽습니다.강순덕암남해변 해녀  아무것도 할 것도 없고 그러니까이거 철거하라 할 적에는 아무것도 안 보이더라고요.김정자암남해변 해녀  다른 데로 가라면 갈 데가 없지. 해녀가 산으로 갈 겁니까해녀들은 이곳이 다른 불법 포장마차들과는 다르다고 주장합니다.강명순암남해변 해녀  세금도 우리가 내고요. 우리가 보건증도 전부 내고 다 합니다. 보건소에 가서 전부 다 찍어오는 것도 하고 다 하거든요.구청은 2000년 영업을 하면서 받은 각서를 근거로 내세웠습니다. 공공의 필요에 따라 철거할 경우 30일 내 자진철거 한다는 조항이 있어 법적으로 문제가 없다는 겁니다.철거될 위기에 처한 해녀촌 자리에는 주차장이 들어선다고 합니다.이곳 서구 공영주차장에는 이미 341대의 차량을 세울 수 있습니다. 저쪽 해녀촌 포장마차를 철거한다 해도 고작 20대가량의 차량만을 더 세울 수 있을 뿐입니다.구청은 케이블카 개장에 맞춰 인근의 테니스장 2개와 게이트볼장도 없애고 주차장을 만들었습니다.해녀촌 철거가 케이블카 회사를 위한 것이란 의혹이 불거진 것도 이 때문입니다.케이블카 업체가 서구청에 해녀촌이 있는 암남공원 주차장의 정비와 사용을 요구하는 공문을 보냈고 서구청이 적극 협조를 약속했기 때문입니다.송도 케이블카의 허가과정을 담당했던 황모 도시안전국장이 퇴직 후 케이블카 회사의 대표이사로 가면서 석연치 않다는 지적이 나오고 있습니다.이정향부산서구의원  케이블카 회사에 필요한 주차장 확보를 위해서 우리 주민들의 생활이나 공간들을 다 지금 케이블카 회사에 내주고 있다는 거죠.구청 관계자는 이번 철거 방침이 케이블카 회사에 대한 특혜가 아니라 암남해변을 관광 자원화하기 위한 사전 준비라고 해명했습니다. 하지만 사정이 비슷한 부산 영도구 태종대의 해녀촌은 지난해 구청이 관광자원으로 삼겠다며 오히려 주차장 부지를 내주는 정반대의 행보를 보이고 있습니다. 날이 저물고 밤이 깊어가자 암남해변 해녀촌에는 손님들이 몰려듭니다. 최용우부산 문현동  주차공간이 더 필요하다는 뜻인데. 그것은 사람을 유입시킨 원인이 분명 이게해녀촌 한몫을 하고 있을 텐데요.구청은 40년 동안 이 자리를 지켜온 해녀촌을 철거하는 이유로 지역 관광산업의 활성화를 내세우고 있습니다. 하지만 스무 대의 주차 공간과 해녀촌 중 무엇이 관광산업에 도움이 되는지 현장의 목소리에 좀 더 귀 기울일 필요가 있어 보입니다.kr JTBC 뉴스 공식 SNS 트위터 페이스북 유튜브Copyright by JTBChttpjtbc
'서울 1호 경전철' 우이∼신설선 개통 9월 초로 연기	http://news.naver.com/main/read.nhn?oid=001&sid1=103&aid=0009397340&mid=shm&viewType=pc&mode=LSD&nh=20170710222703	출퇴근 시간 열차 간격 2분30초3분으로 변경 우이신설선을 점검하는 모습 이정훈 기자  지난달 21일 오후 서울 강북구 우이동 우이신설선 종합관리동 검수고에서 직원들이 열차를 점검하고 있다.21    uwg806yna.kr     박초롱 기자  서울 1호 경전철인 우이신설선 개통 시기가 7월 말에서 9월 초로 미뤄졌다.    서울시와 민간 사업자 우이신설경전철은 열차의 출퇴근 시간 운행 간격을 조정하면서 추가 시운전이 필요해졌다면서 개통 시기를 9월 초로 늦추겠다고 10일 밝혔다.     우이신설선은 서울 강북구 우이동에서 동대문구 신설동 총 11.4를 잇는 서울 최초의 지하 경전철이다.     모두 13개 역이며 성신여대입구4호선 보문6호선 신설동12호선역에서 환승할 수 있다. 우이동에서 신설동까지 통행 시간을 50분에서 20분대로 단축할 것으로 기대를 모았다.     우이신설선은 이달 29일 개통을 목표로 도시철도 안정성 검증의 마지막 관문인 영업 시운전을 하고 있었다.    우이신설경전철 측은 출퇴근 시간 운영 간격을 당초 2분 30초로 계획했지만 시운전 과정에서 어린이 등 교통약자의 승하차에 충분한 시간이 확보되지 않을 수 있다는 사실을 발견했다며 열차 운행 간격을 3분으로 늘리기로 했다고 밝혔다.    열차 운행 간격 조정 이후 시스템 안정화를 위해 추가 시운전이 필요해졌다는 설명이다.     우이신설선은 한 열차당 객실이 2칸이고 기관사 없이 무인으로 운행되는 게 특징이다. 승강장 길이와 폭이 기존 지하철보다 짧고 좁다.    개통 초기에는 안전사고에 대비해 역무원을 임시로 두고 3년째부터 역사를 무인화한다.     우이신설경전철은 무인 운전에 익숙하지 않은 시민들의 정서와 맞물려 안전사고가 일어날 가능성이 우려됐다며 초기 개통 때는 교통약자를 포함한 모든 시민이 안전하게 승차할 수 있는 시간을 확보하는 것이 중요하다고 판단했다고 설명했다.    회사 측은 미비점을 보완해 늦어도 올해 9월 2일까지 운행을 시작하기로 했다
 뛰는 집값·대출금리에…서민 '내집 마련' 먼 꿈	http://news.naver.com/main/read.nhn?oid=022&sid1=101&aid=0003190453&mid=shm&mode=LSD&nh=20170710211539	주택구입부담 4년여 만에 최고2017년 1분기 부담지수 평균 59.6으로 전국 최고619대책 후 주춤하던 집값 20일도 안돼 슬금슬금 올라 올봄 결혼 10년 만에 아파트를 구입한 40대 직장인 A씨. 결혼 후 전세를 전전하다 그동안 아껴서 모은 자금과 은행 대출 부모님의 도움을 받아 서울에 겨우 내집을 장만할 수 있었다. A씨는 결혼할 때만 해도 금방 집을 살 수 있을 것이라 생각했지만 집값이 많이 올라 쉽지 않았다며 그나마도 부모님이 지원해주지 않았다면 시기는 더 늦어졌을 것이라고 말했다.최근 수년간 집값이 크게 오르면서 서민들의 내집마련이 점점 더 어려워지고 있다.10일 한국주택금융공사에 따르면 올 1분기 주택구입부담지수KHAI는 전국 평균 59.4포인트 상승한 것으로 2012년 4분기 59.9 이후 4년 3개월 만에 가장 높은 수치다.주택구입부담지수는 중간소득 가구가 표준대출을 받아 중간가격 주택을 구입하는 경우의 상환부담을 보여주는 지표다. 지수가 100이라면 소득의 100를 주택구입담보대출 원리금 상환으로 부담한다는 뜻으로 숫자가 클수록 소득 중 주택구입을 위해 쓰는 돈이 많다는 의미다.3까지 올랐던 지수는 이후 주택가격 하락과 저금리 기조로 점차 떨어져 2015년 1분기 50. 하지만 이후 주택 가격이 오르면서 2015년 4분기 56.감당하기 어려울 정도로 오르는 집값이 부담을 키우는 주요인이다. 수도권 아파트 중위매매가격은 2015년 1분기 3억2545만원에서 올 1분기 3억5918만원으로 10. 같은 기간 서울 지역 아파트 중위매매가격은 4억7185만원에서 5억2458만원으로 11.2 뛰었고 이중 강남구8억450만원10억250만원만 보면 상승률이 24. 서울의 1분기 주택구입부담지수는 103.국토연구원이 이날 내놓은 지역별 주택수급 진단과 정책과제 보고서를 보면 지난 6월 기준 세종1.38의 전월 대비 주택매매 가격상승률이 전국 평균 상승률0.21보다 높아 이들 지역의 주택 부담은 계속 가중될 전망이다. 지난해 말부터는 미국 금리인상으로 시중 대출금리도 들썩이면서 상환부담마저 커지는 상황이다.서민주거안정을 기치로 내걸고 출범한 문재인정부는 서민 주거비 부담을 줄이기 위한 정책을 잇따라 내놓고 있다. 실수요자를 제외한 주택구입자의 대출을 조이는 규제를 골자로 한 619 부동산 대책이 발표됐고 부동산 중개업소 단속도 했다. 김현미 신임 국토교통부 장관은 취임 후 첫 외부 일정으로 임대주택을 방문해 공공임대주택 공급 확대를 약속했다. 그렇지만 619 대책 발표 이후 주춤하던 서울 집값은 벌써 상승세를 회복할 기미를 보이고 있다. 부동산114 집계 결과 지난 7일 기준 서울 아파트값은 전주 대비 0. 대책 발표 20일도 채 안 돼 상승률이 반등하기 시작한 것이다. 정부는 619 대책의 효과 유무를 판단하기엔 아직 때가 이르다면서도 추후 주택시장 과열 현상이 심화할 경우엔 추가 조치를 검토할 수 있다는 입장이다
'588 비리' 3천 개 계좌 뒤진다	http://news.naver.com/main/read.nhn?oid=449&sid1=101&aid=0000133538&mid=shm&mode=LSD&nh=20170710203010	집창촌으로 유명했던 청량리 588지역은 초고층 주상복합단지로 탈바꿈하기 위한 사업이 진행중입니다.   그동안 채널A는 이 사업의 비리 의혹을 집중 보도해드렸는데요.   검찰이 사업장을 전격 압수수색 했습니다.   변종국 기자가 단독 보도합니다.   리포트  비가 오는 가운데 검찰 수사관들이 부지런이 오갑니다.   들고 나오는 상자마다 압수물이 가득합니다.   현장음  오늘 어떤 것 압수하셨어요   검찰이 들이닥친 곳은 집장촌으로 유명했던 청량리 588 재개발 사업장.   1조 5천억 원이 투입될 예정인 이곳은 초고층 주상복합단지로 탈바꿈하기 위한 재개발 사업이 진행 중입니다.   검찰은 재개발 사업 업체 선정 과정에서 검은 돈이 오간 정황 등을 포착했습니다.    이에 따라 재개발 시행사와 협력업체 등 10여 곳을 압수수색 했습니다.   앞서 검찰은 재개발 사업과 연관된 계좌 3000여 개를 살펴본 것으로 알려졌습니다.    세입자 수를 부풀려 보상비를 높게 책정한 뒤 돈을 빼돌린 정황도 수사 대상입니다.    청량리 재개발 사업은 전직 포주들과 청량리파 출신 조폭들이 관여하고 있는 상황.   지역 주민  뒷돈들 많이 챙겨 놓느니 뭐니. 다 여기 조직폭력배로 있었고 포주 생활을 2030년 했던 사람들이    오늘 압수수색에는 청량리파 두목이자 재개발 추진위원회 전 감사였던 김모 씨의 자택도 포함됐습니다.    검찰은 김 씨가 재개발 사업을 좌우하고 있는 것으로 보고 조만간 소환할 예정입니다.   압수수색이 진행된 청량리 588재개발 현장입니다.   검찰은 압수물 분석 결과를 토대로 비리에 연루된 관계자들을 엄정처리한다는 방침입니다.   채널 A 뉴스 변종국입니다.   변종국 기자 bjkdonga
