후보들의 마지막 유세지 살펴보니…장소 속 숨은 의미는?	http://news.naver.com/main/read.nhn?oid=214&sid1=100&aid=0000764873&mid=shm&mode=LSD&nh=20170508210533	이제 오늘 밤 12시면 공식 선거운동이 모두 끝납니다.22일간의 대장정을 끝낼 마지막 유세 장소도 관심을 모으고 있는데요.문재인 후보는 서울 광화문 홍준표 후보는 덕수궁 대한문 안철수 후보는 대전에서 대미를 장식하고요.유승민 심상정 후보는 각각 서울 명동과 신촌을 선택했습니다.마지막 유세 장소에 담긴 전략과 의미 김성현 기자 취재했습니다.  리포트 집권하면 집무실을 정부청사로 옮기겠다고 약속한 더불어민주당 문재인 후보는 마지막 유세 장소를 서울 광화문으로 정했습니다.조기 대선을 이끌어낸 촛불 집회의 의미를 거듭 강조하며 정의롭고 공정한 3기 민주 정부의 꿈이란 메시지를 밝힙니다.문재인더불어민주당 대선 후보사상 최초로 영호남에서 지지받는 동서화합 대통령 누구입니까자유한국당 홍준표 후보는 마지막 유세 장소로 박근혜 전 대통령 탄핵반대 태극기 집회가 열렸던 서울 대한문을 택했습니다.영남권 보수층에서 시작된 동남풍의 북상을 통한 보수 결집을 호소했습니다.자유민주주의 체제를 수호하기 위해 한 표를 행사해 줄 것을 호소할 계획입니다.홍준표자유한국당 대선 후보내일은 친북좌파 세력들 심판하는 날입니다.지난 4일부터 시작된 걸어서 국민 속으로 120시간 유세를 마무리할 국민의당 안철수 후보의 마지막 유세 장소는 대전입니다.중도의 상징성을 강조하면서 벤처창업인인 자신과 과학기술도시 대전을 연계시키며 미래 이미지를 부각시킬 계획입니다.안철수국민의당 대선 후보뚜벅이 유세를 제2의 안풍이라고 생각합니다. 진심이 있었기에 국민께서 그것을 알아봐 주셨다고 생각합니다.바른정당 유승민 후보는 대학가와 서울 중심가를 마지막 유세지로 골라 젊은 층에게 다가서려는 노력을 보여줄 예정입니다.유승민바른정당 대선 후보젊은 학생들 젊은 가장엄마아빠들 그분들 지지를 제일 많이 받고 있다고 생각합니다.정의당 심상정 후보도 마지막 날 서울과 수도권에 집중하며 젊은이들과 호흡할 수 있는 감각 있는 후보임을 강조할 방침입니다
中 기술력 턱밑까지…5년 뒤엔 한국 추월?	http://news.naver.com/main/read.nhn?oid=056&sid1=101&aid=0010453489&mid=shm&mode=LSD&nh=20170508232302	앵커 멘트 우리나라 제품이  품질과 기술 경쟁력 만큼은 중국보다 앞선다는 생각 많이들 하시는데요.     가전 통신 등 우리 주력 제품이 5년 뒤엔 품질에서도 중국에 추월당할 것이라는 분석이 나왔습니다.    보도에 김병용 기자입니다. 리포트중국 업체가 지난달 내놓은 65인치 초슬림 올레드 TV. 석 달 앞서 출시된 국내 업체 TV와 두께 디자인은 물론 화질까지 거의 같습니다. 드럼통 2개가 아이디어인 세탁기는 오히려 원조를 자처하고 나섰고 우리 기업의 독창적인 의류 관리기도 5년 만에 유사한 중국산이 출시됐습니다. 녹취 국내 가전업체 관계자음성변조  시장에서 처음 선보이는 모델을 출시하면 중국에서 빠르면 23개월 안에 비슷한 콘셉트와 디자인의 제품을 곧바로 출시하는 것을 확인했습니다. 하지만 5년 뒤엔 베끼는 수준이 아니라 품질기술력까지 추월당할 것이란 분석입니다. 가전은 거의 비슷해지고 통신과 반도체는 격차가  1년으로 좁혀졌습니다. 품질만 놓고 보면 철강과 석유화학 가전 등은 중국과 격차가 아예 없어지지만  가격 경쟁력은 중국 제품이 더 높습니다. 인터뷰 조철산업연구원 선임연구위원   우리가 세 걸음 간다고 하면 중국은 다섯 걸음 가는거죠. 우리도 사실 일본이나 선진국들을 그런 식으로 쫓아왔고 비슷한 형태로 중국이 우리를 쫓아오고 있는 그런 상황입니다
수술복 입고 '뻐끔'…환자 건강 위협하는 병원	http://news.naver.com/main/read.nhn?oid=057&sid1=102&aid=0001120426&mid=shm&viewType=pc&mode=LSD&nh=20170508212606	병원에 다녀오면 보통 손을 깨끗이 씻게 되죠.  환자가 많이 모여있는 병원은 각종 병원균에 감염될 수 있는 만큼 위생관리가 철저해야하는데요.  그런데 메르스 사태의 교훈을 잊었는지 병원들의 위생관리 실태는 여전히 엉망입니다.  이병주 기자가 취재했습니다. 기자   지난 2015년 메르스 전담병원이었던 국립중앙의료원.  병원 곳곳에 금연스티커가 붙어있습니다.  그런데 건물 옥상에 올라가보니 의사 가운을 입은 의료진이 담배를 피우고 수술복 차림의 흡연자들도 어렵지 않게 볼 수 있습니다.  면역력이 떨어진 환자들에게 간접흡연은 치명적이지만 의료진들은 아랑곳하지 않는 모습입니다.   병원 측은 실정도 모르는 답변만 늘어놓습니다. 인터뷰  병원 관계자 저희가 금연을 하고 있어서 지금까지 다니면서 봐도 건물 내에서 담배피우시는 분을 본 적이 없어서. 스탠딩  이병주  기자 피부과와 성형외과 등 각종 의료기관이 몰려있는 강남의 병원가 위생상태도 크게 다르지 않습니다.  공중화장실 안 세면대에서 의료기구를 세척하거나  치료 중 환자 얼굴을 덮는 안면포를 걸레 빠는 곳 옆에서 말리기도 합니다.  지역 보건소에서 수시로 위생점검에 나서긴 하지만 법적 근거가 있는 단속 항목은 1회용 의료기기 재사용 여부 뿐.  그나마도 지난 3년간 서울시에서 적발된 건 단 10건에 불과합니다. 인터뷰  정지연  한국소비자연맹 사무총장 종사자들의 안전과 위생이라는 부분에 대한 의식도 중요하고 시스템적으로 처리될 수 있는 부분이 강화돼야 할 것으로 보여집니다.  메르스와 C형 간염 같은 각종 감염병이 병원을 통해 전파됐지만 병원들의 구멍뚫린 위생실태는 좀처럼 개선되지 않고 있습니다
퇴직금 안 주려고…'11개월 계약' 이제 그만	http://news.naver.com/main/read.nhn?oid=449&sid1=102&aid=0000129627&mid=shm&viewType=pc&mode=LSD&nh=20170508203933	   만 1년을 근무하면 퇴직금을 줘야 하기 때문에 1년을 채우기 직전 직원을 해고하는 일을 두고 나온 말입니다.   특히 비정규직으로 일하는 청년들이 많이 당합니다.   박건영 기자가 보도합니다.  리포트 학원에서 수학강사로 일하는 36살 정 모 씨.   근무한 지 1년이 되기 한 달 전 학원 원장에게 그만 둬 달라는 통보를 받았습니다.   정모 씨  학원 강사  1년이 되는 31일전이었어요. 날짜를 계산해 보니까 퇴직금이 발생할 수 없는 타이밍에 말씀을 하신 거죠.   26살 황모 씨는 1년 4개월 동안 일했던 회사를 퇴직했지만 퇴직금은 한 푼도 받지 못했습니다.   일한 1년 4개월 가운데 6개월은 수습 기간이었다며 만 1년을 근무기간으로 인정해주지 않았기 때문입니다.   황모 씨  회사원  회사에서 같이 동고동락하면서 왜 똑같이 일을 했는데 대우를 못 받는 걸까 회의감도 들었습니다.   근로기준법상 고용주는 근무기간 만 1년이된 직원에게 한 달치 월급 정도의 퇴직금을 지급해야 하는데 이를 주지 않기 위해 1년을 채우기 직전 해고하는 등 이른바 퇴직금 꺾기가 공공연하게 이뤄지고 있는 겁니다.   특히 아르바이트 계약직 등 비정규직으로 일하는 청년들이 대부분 피해를 보고 있습니다.   지난해 조사에 따르면 비정규직 근로자는 10명 중 6명꼴로 퇴직금을 받지 못했는데 이는 정규직의 4배를 훌쩍 넘는 수치입니다.   이병훈  중앙대학교 사회학과 교수  1년을 꼭 채우지 않는다 하더라도 일한 개월 수만큼 근무기간 동안에 퇴직금에 준하는 퇴직 수당을 지급하는 방식으로 제도 정비하는 게.   사업주들이 퇴직금을 주지 않는 꼼수를 막기 위해선 제도적 보완이 시급하다는 지적입니다.   채널A 뉴스 박건영입니다.   박건영 기자 changedonga
상속 다툼 '기여분 결정 청구' 늘었다	http://news.naver.com/main/read.nhn?oid=056&sid1=101&aid=0010453496&mid=shm&mode=LSD&nh=20170508232159	앵커 멘트 한 민간금융연구소에서 추산한 지난해 상속 자산 규모는  89조 원에 이릅니다. 2020년엔 108조 원까지  늘어날 것으로 전망되는데 상속을 둘러싼 가족 간 법정 다툼도 늘고 있습니다. 지난해 전국 법원에 접수된 상속재산 분할 처분 사건은 1220여 건. 5년 전 520여 건이었던 것에 비해 2배 이상 늘었습니다. 희생이나 양보를 중시하던 전통적 가족 가치의 붕괴가 분쟁이 급증한 원인의 하나로 꼽힙니다. 특히 상속 다툼 중에 배우자나 자녀가 재산 형성에 기여한 부분을 인정해달라며 소송을 제기하는 이른바 기여분 결정 청구 소송이 크게 늘고 있는데요 법원은 어떤 판단을 내리고 있을까요 장혁진 기자가 보도합니다. 리포트 육남매를 둔 강 모 씨는 2년 전  유언장 없이 숨졌습니다. 강 씨의 상속 재산을 나누는 과정에서 자녀 간 갈등이 생겼고 동생들은 누나들을 상대로 법원에 기여분 결정 청구 소송을 냈습니다. 생전에 강 씨에게  수천만원의 생활 자금과 용돈을 드렸던 점을 인정해 달라는 것이었는데 법원은 재산을 6분의 1로 똑같이 나누라고 판결했습니다.녹취   이미정부산가정법원 공보판사   형편이 나아서 용돈을 좀 더 드렸더라도 누가 더 재산 형성에 기여를 했다고 보기 어렵다고 본 거거든요. 재판부는  자녀들이 돌아가신 어머니를  생각하는 마음은 경중을 따질 수 없다고 설명했습니다. 법원은 2011년  부모를 50년 가까이 봉양한 양아들에게  유산의 50를 기여분으로 인정한다는 판결을 내리기도 했습니다. 법원 관계자는 한 자녀가 오랫 동안 홀로 부모를 부양한 경우 등을  제외하면 기여분이 인정되는 경우는 드물다고 말했습니다. 지난해 전국 법원에 접수된 기여분 결정 청구 소송은 230여 건 6년 만에 2
입학하자 '리트 올인'…사시보다 더한 '로스쿨 광풍'	http://news.naver.com/main/read.nhn?oid=015&sid1=102&aid=0003765775&mid=shm&viewType=pc&mode=LSD&nh=20170508194331	학점 관리위해 꿀수업만 수강중간고사 망치면 휴학도로스쿨 전초기지 전락한 대학취업난에 인문계열 대거 몰려올 사시 폐지땐 응시자 급증 예상교수들 학문탐구 외면 세태 씁쓸 성수영 기자   연세대 경영학과 3학년 A씨24는 학점 리셋을 위해 이달 초 휴학원을 냈다. 이번 학기 수강 6개 과목 중 한 과목의 중간고사를 망쳐서다. 그는 입학 직후부터 법학전문대학원로스쿨을 준비 중이다. 학점을 철저히 관리한 덕에 지금까지는 거의 모든 과목이 A 학점이다. 그는 중간고사 결과 A학점이 힘들 것 같아 등록금이 아깝지만 휴학을 결심했다고 말했다.대학 입학 직후부터 로스쿨 올인만성적인 취업난 탓에 로스쿨 입시 준비에 올인하는 대학생이 급증하고 있다. 그나마 취업이 잘된다는 상경계열조차 예외가 아니다. 입학 두 달된 신입생들도 대거 로스쿨로 달려가고 있다. 올해 고려대 경영대학에 입학한 B씨21는 과 행사에 한 번도 참여하지 않고 법학적성시험리트LEET 스터디에 몰두 중이다. 로스쿨 진학에 유리할 것 같아 대학도 재수를 해서 고대 경영대학에 입학했다는 그는 고등학교 시절부터 로스쿨로 진로를 결정했다고 전했다.그는 수업 내용과 관계없이 강의 평가를 보고 학점을 잘 준다는 수업만 듣고 있다고도 했다. 로스쿨 입시에서 학점 영향이 절대적이라 학점 잘 주기로 유명한 소위 꿀수업만 골라 수강한다는 설명이다.서울대 로스쿨의 서류전형격인 1단계 평가는 학부 성적 반영 비율이 50에 달한다. 서울 소재 상위권 대학 로스쿨 입학생들의 학점 평점은 A0 수준이라는 게 대학가의 추정이다.좁아진 취업문에로스쿨이 유일 대안사법시험이 올해를 마지막으로 폐지될 예정이라 로스쿨 준비생은 더 늘어날 전망이다. 작년 리트 응시자 수도 8110명으로 한 해 전 7579명에 비해 늘었다. 로스쿨 입시학원 관계자는 사법시험을 오래 준비한 수험생의 상당수가 내년부터는 로스쿨로 방향을 돌릴 수밖에 없다며 리트 응시자 수가 크게 늘어날 것이라고 내다봤다.좁아지는 인문계생의 취업문이 로스쿨 열풍의 원인으로 꼽힌다. 전문 기술이 없는 인문사회계열 학생이 안정적인 직장을 찾아 로스쿨로 몰리고 있다는 분석이다. 취업포털 인크루트가 지난 2월 918개 상장사를 대상으로 조사한 2017 채용동향에 따르면 자연이공계 학생을 뽑겠다고 밝힌 기업은 34.6에 달했지만 인문사회계 학생을 뽑겠다는 기업은 6.지성과 학문 연마의 터전이어야 할 대학이 로스쿨 전초기지로 전락 중이라는 우려가 크다. 서강대 경제학과의 한 교수는 얼마 전 아끼는 학생에게 대학원 진학을 권유했는데 로스쿨을 가야 한다며 거절하더라고 전했다.연세대 경영학과의 한 교수도 내 수업을 듣는 학생 태반이 학점 따기 쉽다는 생각에 수강 신청한 로스쿨 준비생이라며 창업을 하거나 학문의 길을 걷기보다 학점 잘 따서 로스쿨에 가려는 학생들을 가르치는 자괴감이 크다고 말했다
수면제 처방 한번만 받아도 보험사 'F코드' 낙인	http://news.naver.com/main/read.nhn?oid=022&sid1=102&aid=0003171417&mid=shm&mode=LSD&nh=20170508211400	보험사 5년간 가입 거부  위험요율 산정 근거 자료없어 경증질환 인수기준 확보 절실실손의료보험에 가입하려던 김모31여씨는 향후 5년 동안 가입자체가 불가능하다는 K보험사 설계사의 말을 듣고 좌절했다.얼마 전에 잠이 오지 않아서 신경정신과를 찾아 수면제 처방을 받은 기록이 문제였다. 정신과 질환F코드 약물 처방 기록에 한해선 단 한 번의 기록만 있어도 5년간 보험가입을 제약하는 사유가 될 수 있다는 것이다. 설계사는 업계에서는 관련 질병은 낫기 힘들고 잠재성이 조금만 있어도 다른 질병까지 유발할 위험이 크다고 간주하기 때문에 어쩔 수 없다고 말했다.8일 보험연구원과 업계의 조사결과에 따르면 정신과 질환치료를 목적으로 병원에 들러 상담을 받았거나 약물 처방을 1회 이상 받으면 최소 1년간 실손보험에 가입할 수 없는 것으로 나타났다. 실제로 7개 주요 대형보험사들에 직접 문의한 결과 적게는 12년 길게는 병원 방문 후 5년이 지나야 실손보험 가입이 가능하다는 대답이 돌아왔다. 심지어 B사 소속 보험 설계사는 정신과 치료를 받을 경우 반드시 현금으로 결제를 하고 비보험으로 처리를 해 F코드를 부여받지 않도록 지인들에게 당부하고 있다고 전했다.보험사에서 정신과 치료 환자들의 실손보험 가입을 제한하는 가장 큰 이유는 국내 보험사에 정신질환 위험요율 산정 근거가 될 만한 통계자료가 아예 없기 때문이다. 이정택 보험연구원 연구위원은 중증 정신질환의 경우 손해율이 높을 수 있는 것은 사실이지만 단순 불면증 같은 경증 질환에 대해서도 일률적인 잣대로 보험인수를 거절하는 것은 문제다며 자체통계가 구축이 돼 있지 않다면 기존 건강보험 의료급여 데이터들을 이용해 실제로 특정 정신질환이 다른 질병에 어떤 영향을 미쳤는지 치료에 걸리는 기간이 얼마나 됐는지 등을 객관적으로 평가해 손해율을 산출할 필요가 있다고 지적했다. 실제로 해외에서는 불면증 등 경증의 정신질환은 보험계약 인수 여부를 판단할 때 고려대상으로 삼지 않는다. 우울증 등도 발병 횟수 등을 근거로 세분화한 인수기준을 적용하고 있는 것으로 조사됐다.정신질환 관련 치료가 보험가입의 장벽으로 작용하다 보니 정신질환 초기관리도 제대로 이뤄지지 못하는 실정이다
커지는 소득격차… 10명 중 4명 年 1000만원도 못벌어	http://news.naver.com/main/read.nhn?oid=022&sid1=102&aid=0003171395&mid=shm&mode=LSD&nh=20170508191331	노동연구원 2015 소득불평등 보고서서울 신도림에 사는 A36씨는 정기적인 소득이 없다. 거주하는 고시원에서 총무 일을 하며 숙박비를 해결하고 과거에 일했던 학원에서 연락이 오면 단기 강의를 하는 게 전부다. A씨가 이렇게 일해 버는 돈은 월 50만원도 되지 않는다. A씨는 여러 해 고시 준비를 하다 보니 취업 때를 놓친 것 같다며 제대로 된 소득이 없어 당장 생활하는 게 빠듯한 데다 더 큰 문제는 앞으로도 나아질 것 같지 않다는 데 있다고 말했다.소득이 있는 국민 10명 중 4명은 연간 1000만원도 벌지 못하는 것으로 나타났다. 혼자 벌어 3인가구 평균 지출을 감당할 수 있는 가구는 20도 되지 않았다. A씨의 경우처럼 노동시장에 제대로 정착하지 못한 사람이 늘고 있기 때문이다.8일 한국노동연구원 홍민기 연구위원이 펴낸 소득불평등 현황과 대책 보고서에 따르면 2015년 기준 전체 소득자2664만명 가운데 연평균 소득이 1000만원 미만인 비율은 38. 1000만원 이상 2000만원 미만인 경우는 21.1로 전체 소득자의 60가량이 1년에 2000만원도 벌지 못했다. 개인소득은 근로소득과 사업소득 재산소득을 합한 것으로 사실상 1년에 벌어들이는 수입 전부를 의미한다.나머지 소득 구간별로는 2000만원 이상3000만원 미만 14.2 3000만원 이상4000만원 미만 6.9 4000만원 이상5000만원 미만 6 5000만원 이상6000만원 미만 3.5 6000만원 이상8000만원 미만 4.9 8000만원 이상1억원 미만 2.저소득자 비율이 절반을 넘다 보니 1년에 6000만원 이상 벌면 소득 상위 10 수준에 해당되는 것으로 집계됐다. 벌어들이는 돈이 턱없이 부족해 혼자 벌어 3인가구 평균 지출4085만원을 충당할 수 있는 가구는 전체의 19에 불과했다. 4인가구의 경우에는 14까지 내려갔다.홍 위원은 결혼이나 출산을 하지 않는 이유도 가구지출을 감당할 만한 소득을 벌기 어렵기 때문이라며 연소득 5000만원이면 4인 가구 지출액4941만원을 간신히 감당할 수준이지만 소득 분포에서는 매우 높은 곳에 위치한다고 분석했다.IMF 외환위기 이후 소득불평등 현상은 갈수록 심화하고 있다. 전체 소득에서 상위 10 집단의 소득이 차지하는 비중은 48.이 같은 비율은 경제협력개발기구OECD 회원국 가운데 미국50
