여야, 7월 국회 잠정 합의…정부조직법 상정해 논의키로	http://news.naver.com/main/read.nhn?oid=001&sid1=100&aid=0009364215&mid=shm&mode=LSD&nh=20170626214056	왼쪽부터국민의당 김동철 더불어민주당 우원식 자유한국당 정우택 바른정당 주호영 원내대표.내일 합의문운영위 업무보고시 조국 출석 가능성 열어놔정개특위 설치 개헌특위평창 특위 연장도추경은 미합의 김동호 이슬기 기자  여야가 7월 임시국회를 여는 것은 물론 정부조직법 개정안을 상정해 논의하기로 26일 합의했다.     우원식더불어민주당정우택자유한국당김동철국민의당주호영바른정당 원내대표는 이날 여의도 한 호텔에서 만나 7월 임시국회를 다음 달 4일부터 18일까지 열고 정부조직법을 국회 각 상임위와 안행위에 상정해 논의한다 등의 합의문을 작성하기로 했다고 복수의 관계자가 전했다.     이들은 정부조직법의 경우 내일 오전 자유한국당이 의총을 열어 의원들의 확인을 통해서 원만한 합의가 도출되면 합의문을 작성하기로 했다고 설명했다.     합의문에는 7월 임시국회에서 상임위 업무보고를 받는다는 내용도 포함된다.     이에 따라 국회 운영위도 청와대로부터 업무보고를 받게 될 것으로 보여 인사검증 논란과 관련해 청와대 조국 민정수석의 출석 가능성이 열렸다.     야권 관계자는 조국 수석의 운영위 출석 문제와 관련해 7월 임시국회 업무보고시 성역없이 부른다는 취지의 문구를 합의문에 넣기로 했다면서도 성역없이란 문구는 바꿀 수 있다고 설명했다.     반면 민주당의 핵심 관계자는 업무보고를 하고 거기에 필요한 인사는 부른다로 알고 있다고 강조했다. 여야 7월 국회 잠정 합의 PG제작 최자윤    인사청문 제도 개선을 위한 국회 운영위 8인 소위원회 가동은 물론 정개특위 설치 개헌특위평창올림픽 특위 연장의 본회의27일 처리도 합의문에 담긴다.     답보 상태인 추가경정예산추경은 합의문에서 빠진다.     민주당 다른 관계자는 다만 오늘 논의 전반은 추경과 관련해 3개당민주당국민의당바른정당이 진행하는 것을 한국당이 문제 삼지 않는다는 걸 전제로 한 것이라고 강조했다.     민주당은 추경에 강하게 반발하는 한국당을 빼고 여야3당 심사 착수를 할 수 있다는 의사를 밝힌 바 있다. 국민의당과 바른정당은 세부 항목에는 반대하지만 추경 심사에는 일단 긍정적인 입장을 내비치고 있다.     여야 4당 원내대표들은 내일 만나 합의문을 작성할 예정이다.     이들 원내대표들은 지난 22일 국회 정상화를 위한 합의문을 채택하려고 했지만 불발됐다
'성추행' 신고에도 교단 선 교사…피해 학생 보호도 無	http://news.naver.com/main/read.nhn?oid=055&sid1=102&aid=0000543112&mid=shm&mode=LSD&nh=20170626211745	넉 달 전 한 재단 소속 여중 여고에서 교사 여러 명이 학생들에게 성희롱과 성추행을 한 사실이 드러나 교육청 감사 끝에 무더기 징계를 받은 적이 있습니다. 같은 학교에서 또 비슷한 일이 일어났는데 학교의 대처는 여전히 미흡했습니다.기자지난 13일 서울 강남에 있는 이 여고는 학생들을 대상으로 설문조사를 벌였습니다.한 교사가 학생들에게 성적으로 불쾌한 행동을 한다는 신고가 접수됐기 때문입니다.학생  선생님이 좀 많이 만지는 데는 있었는데깨울 때 약간 손목을 계속 잡는다든지. 친구들끼리 왜 이렇게 많이 만지냐고 기분 나쁘다 이런 식으로 말하고.학생  학생을 깨우는데 좀 과도하게일어날 때까지 팔 계속 당기고. 그래서 어떤 애는 울었어요.학교는 일단 이런 사실을 교육청에 보고하고 경찰에도 신고했습니다.하지만 제일 중요한 피해 학생 보호조치는 취하지 않았습니다.교육청 지침에는 교사와 학생 간에 성폭력 문제가 발생하면 학교는 해당 교사가 수업에 참여하지 못하게 하고 담임도 맡지 못하게 하는 등 학생들과 분리하게 돼 있습니다.하지만 해당 교사는 피해 학생들이 있는 반에서 계속 수업을 하고 있었습니다.그 선생님 아직도 수업하시나요 네.학교 성희롱심의위원회가 교사 행동에 문제가 있다고 판단하고 징계위원회에 넘기기로 해놓고도 정작 학생 보호 조치는 하지 않은 겁니다.교장  지금 뭐 확인 중이라 학교에서는 드릴 말씀이 없습니다.관할 강남 교육지원청은 취재가 시작된 이후에야 학교가 지침대로 하고 있는지 확인에 나섰습니다
경유보다 미세먼지 심각한 '유연탄' 세금은 경유의 10분의 1	http://news.naver.com/main/read.nhn?oid=032&sid1=101&aid=0002798292&mid=shm&viewType=pc&mode=LSD&nh=20170626224531	청정연료 LNG보다도 공적부담금 낮아 사실상 특혜미세먼지 경감책 경유세보다 유연탄세 먼저 올려야미세먼지 발생 주범으로 알려진 유연탄화력발전 연료에 붙는 공적부담금세금과 준조세를 합친 것이 과도하게 낮다는 지적이 나왔다. 유연탄에 부과되는 공적부담금은 청정연료인 액화천연가스LNG에 붙는 것보다 낮았으며 미세먼지 발생에 영향을 많이 미치는 경유와 비교하면 10분의 1도 안됐다. 미세먼지 발생량을 줄이기 위해서는 경유보다 유연탄의 공적부담금을 먼저 높여야 한다는 지적이 나온다.26일 예산 전문 시민단체인 나라살림연구소가 각 에너지원의 단위 열량kwh당 공적부담금을 산출한 결과 유연탄은 kwh당 4. 연구소 측은 에너지원에 매겨지는 세금과 준조세는 통상 이나  단위로 부과되기 때문에 직접 비교가 어려워 에너지원이 발생시키는 열량을 기준으로 부과액을 재산출했다.발전용 유연탄에 붙는 공적부담금을 구체적으로 보면 kwh당 개별소비세 4. 유연탄은 공적부담금이 너무 낮다는 지적에 따라 올해 4월 개별소비세가 당 24원에서 30원으로 인상됐지만 여전히 주요 에너지원 중에서는 부담금이 가장 낮았다. 교통에너지환경세 교육세 환경세는 물론 수입원재료에 붙는 수입부과금과 판매부과금도 붙지 않기 때문이다.청정연료인 LNG에는 kwh당 개별소비세 4. 청정연료에 미세먼지 발생이 많은 연료보다 세금이 더 많이 부과되고 있는 셈이다.미세먼지 발생량이 많아 세금 인상 압박이 심한 경유에는 kwh당 55.41원이 부과되고 있는 것으로 집계됐다. 경유에 붙는 공적부담금은 휘발유88.유연탄에 대한 세제 특혜는 석탄 화력발전 비중을 상대적으로 높이는 원인이 되고 있다. 2016년 기준 국내 발전소의 종류별 전력거래량 비율은 유연탄이 39로 원전30 LNG22를 앞섰다. 하지만 올해 들어 미세먼지에 대한 경각심이 커지면서 유연탄에 대한 과세를 강화해 미세먼지 발생을 줄이자는 주장이 힘을 얻고 있다. 당 30원인 유연탄에 대한 개별소비세를 LNG와 같은 당 60원으로 올리거나 수입부과금을 신설해 LNG와 같은 당 24원을 부과하자는 것이다. 이 경우 각각 2조4000억원의 개별소비세와 1조9000억원의 수입부과금이 더 걷힐 것으로 추정된다. 이상민 나라살림연구소 책임연구위원은 한전의 과도한 이익을 줄이면 개소세나 수입부과금으로 높아진 전기 생산비용을 어느 정도 상쇄할 수 있어 소비자 부담이 크게 늘어나지는 않을 것이라며 더 걷힌 세수는 저소득층에 대한 에너지복지 지원과 신재생에너지 개발을 위한 재원으로 사용하면 된다고 말했다
검찰지청장의 수상한 '반값 월세'	http://news.naver.com/main/read.nhn?oid=449&sid1=102&aid=0000132671&mid=shm&mode=LSD&nh=20170626211936	월세 10만 원 저렴한 곳 구하려고 발품 파는 사람들이 참 많습니다.   그런데 수도권의 한 검찰지청장은 서울 도심 아파트 월세를 시세의 반값도 안 되게 내고 있습니다.   감찰 조사를 받은 사실이 확인됐는데요. 김남준 기자의 단독 보도입니다.   리포트 서울 도심의 한 아파트입니다.   수도권의 A 지청장이 2015년 6월부터 현재까지 2년 동안 거주하고 있는 곳입니다.   A 지청장은 시세보다 절반 이상 싼 월세로 살고 있다는 특혜 의혹이 제기돼 대검찰청 감찰본부로부터 서면조사를 받은 것으로 확인됐습니다.   실제로 A 지청장은 30개월 분의 월세에 해당하는 6천만원을 입주 당시와 지난해 10월 2차례 나눠 선납했습니다.   A 지청장이 살고 있는 집의 월세는 200만원이지만 해당 아파트의 같은 층 동일 면적의 평균시세는 월 450만원.   절반도 안되는 셈입니다.   A 지청장은 원래 살던 집이 재건축에 들어가 장인과 30년 지기인 시행사 회장의 미분양 아파트에 잠시 들어가 살고 있다며 전체 임대료를 한꺼번에 내야 하는 데다 집주인이 원하면 언제든 나가야 한다는 불리한 조건이 있어 싸게 계약했다고 해명했습니다.  하지만 인근 부동산들은 입주 당시 시세를 감안해도 월세 200만 원은 지나치게 낮다고 말합니다.   A 씨  인근 부동산 관계자  월세 계약 당시 그때는 월세 450만 원 정도 받았죠.   B 씨  인근 부동산 관계자  그때나 지금이나 거의 월세는 비슷했어요. 오히려 그때가 더 비쌌죠. 물량이 없어서   대검 감찰본부는 이 같은 사실을 지난해 12월 인지하고 자체 조사를 벌였지만 6개월이 지난 지금까지 이렇다 할 결론을 내리지 않고 있습니다.   채널A 뉴스 김남준입니다.   김남준 kimgijadogna
감사원 'FX 사업' 기술이전 계약 담당자 조사	http://news.naver.com/main/read.nhn?oid=437&sid1=100&aid=0000157240&mid=shm&viewType=pc&mode=LSD&nh=20170626221654	감사원이 차세대전투기 즉 FX 사업과 관련해서 기술이전 계약 담당자 조사에 들어간 것으로 확인됐습니다. 7조3000억 원을 주고 미국에서 전투기를 사오기로 했는데 처음 약속과는 달리 4가지 핵심기술을 넘겨받지 못한 이유를 본격적으로 들여다보고 있다는 겁니다. 이 부분은 이미 크게 문제가 된 바가 있었죠. 감사원은 수백억 원에 이르는 핵심기술 자체개발 비용도 분석 중입니다. 기자감사원 국방감사국은 지난주 방사청 A중령을 조사했습니다.A중령은 2014년 FX 사업과 관련해 미국 측과 기술이전 계약을 담당했던 인물입니다.감사원은 또 방사청으로부터 기술이전이 무산된 AESA 레이더 등 4가지 핵심기술을 자체개발하는데 필요한 구체적 비용과 수백억 원대 비용을 어떻게 마련할지 대책이 기록된 방대한 양의 자료를 넘겨받아 분석하고 있습니다.감사원은 특히 방사청이 AESA 레이더를 자체개발하면서 이스라엘 등 외국 방산업체와 성능검증 계약을 맺고 지불하게 될 예산에 주목하고 있는 것으로 알려졌습니다.부실계약으로 인해 록히드마틴사 기술이전이 무산됐고 자체개발을 시작하면서 이스라엘 등 제3국에 기술제휴 비용을 지불하게 됐다면 국고 낭비에 대한 책임을 물어야 한다는 겁니다.감사원이 지난 4월 감사를 시작한 뒤 2차례나 기간을 연장해 80일 넘게 감사를 벌인 것도 기술이전 무산으로 인한 실질적인 피해금액과 계약 과정에서의 책임 여부를 확인하기 위한 조치였던 것으로 확인됐습니다.이번 감사를 통해 구체적인 피해 금액과 부실계약 정황이 드러날 경우 기술이전뿐만이 아닌 FX 사업 전반에 대한 감사나 수사 의뢰로 이어질 가능성도 있습니다.kr JTBC 뉴스 공식 SNS 트위터 페이스북 유튜브Copyright by JTBChttpjtbc
'만남 앱'까지 악용…방학철 '다단계 주의보'	http://news.naver.com/main/read.nhn?oid=056&sid1=102&aid=0010473227&mid=shm&mode=LSD&nh=20170626232235	앵커 멘트여름 방학을 맞아  취업과 고수익 알바를 미끼로  대학생들을 끌어들이는 불법 다단계가  또다시 기승을 부리고 있습니다.최근엔 특히 스마트폰 만남 어플을 이용해 회원을 모집하는 사례까지  있다고 하니까 조심하셔야겠습니다. 리포트 서울 강남의 10층짜리 건물. 취재진이 들어가려고 하자 남성 두세 명이 막아섭니다. 녹취 그러니까 왜 찍느냐고요. 불법 다단계 혐의로  검찰 수사를 받고 있지만 사무실을 옮겨가며 영업을 계속하고 있습니다.녹취  다단계 업체 관계자음성변조  현재 수사 중인 거 알고 계시잖아요.  문제가 밝혀진 것도 아니잖아요. 화장품과 커피 등을 팔면 한 달에 많게는 1억 원까지 벌 수 있다며 물건값 명목으로 대출부터 권유했습니다.인터뷰 김다단계 피해자음성변조   일단 기본으로 900만 원부터 대출을  시작을 해야 하고요. 300만 원  400만 원을 더 추가로 받게 해요. 일자리를 찾는 20대 초반 젊은이들과 대학생들이 주 대상입니다. 이곳에서 이성과의 만남을 미끼로  피해자들을 유인하는 경우도  적지 않습니다. 녹취  박다단계 피해자음성변조  첫 만남이다 보니까 서로 이제 둘이서  얘기하다가 이제 다른 직원 둘이 왔죠.  유통회사라고 같이 일하자고. 이런 식의 다단계 피해는 최근 1년간 서울에서만 130여 건이 접수됐습니다.인터뷰 천명철서울시 공정경제과 과장    등록된 업체인지 반드시 확인할 필요가 있고요. 또 물건을 구입했을 때는 반드시 계약서를 작성하고 확인하는 것이 꼭 필요하다고 하겠습니다
"국군 병사는 술 먹고 화풀이할 대상이 아닙니다"	http://news.naver.com/main/read.nhn?oid=079&sid1=100&aid=0002982355&mid=shm&viewType=pc&mode=LSD&nh=20170626205916	
"절대 빈곤에 살인적 인플레가 부른 참변"	http://news.naver.com/main/read.nhn?oid=469&sid1=104&aid=0000212206&mid=shm&mode=LSD&nh=20170626231458	분쟁지역 전문PD가 전하는 파키스탄 유조차 참상양동이물통콜라병까지 들고기름 담는 중에 유조차 화재 폭발주민들 하루 2달러로 생계 유지휘발유 1갤런 가격만도 못해과속했던 유조차 운전수도 가난운행 한번이라도 더 하려다 사고 25일현지시간 파키스탄 동부 펀자브주 바하왈푸르의 고속도로를 달리던 유조차가 전복된 후 폭발하는 사고가 발생했다. 현재까지 사망자는 153명이며 부상자도 160명을 넘어섰다. 전복된 유조차는 휘발유 2만5000를 싣고 남부 카라치에서 파키스탄 제2 도시 라호르로 향하는 도중 과속으로 전복된 것으로 보인다. 사망자 규모가 이처럼 큰 이유는 전복된 유조차에서 흘러나온 휘발유를 공짜로 얻으려는 주민들이 모여들어서다. 비교적 경상을 입은 부상자 압둘라43는 어른이나 아이 할 것 없이 휘발유를 담으려고 양동이부터 물통 심지어는 콜라병까지 들고 나왔다라며 불이 날 수 있었지만 아무도 위험하다고 소리치지 않았고 사람들은 앞다퉈 휘발유를 담으려고만 했다고 말했다. 당시 사고 현장에는 몰려드는 주민들을 통제하기 위해 경찰들이 총출동했지만 이들을 막기에는 역부족이었다. 바하왈푸르 경찰서 소속 임란은 이 고속도로는 평소에도 과속사고가 자주 발생하는 구간이라며 사고 소식을 듣고 바로 출동했으나 이미 주민들이 몰려든 상태라 통제가 불가능했다고 전했다.유조차 전복 직후에는 불이 나지 않았지만 이후 주민들이 휘발유를 담으려고 몰려드는 과정에서 갑자기 불꽃이 일며 화재가 발생했다. 목격자이기도 한 임란은 전복 후 1시간가량 주민들이 휘발유를 담고 있는데 갑자기 폭발이 일어났다고 말했다. 화재 원인은 일단 담뱃불로 인한 실화로 추정된다. 현장에서는 오토바이 75대와 자동차 6대가 불에 탄 채 발견됐다. 대부분 휘발유를 챙기러 온 주민들 것이다. 비싼 자동차보다는 오토바이를 소유한 가난한 사람들이 많다 보니 사고 현장에도 오토바이가 더 많았다. 사고지역 인근 바하왈푸르 도심에 사는 나세르27는 친구가 공짜 휘발유를 얻으러 가자고 다급하게 전화를 해 집에 있는 모든 물통을 챙겨 아버지 오토바이를 타고 현장으로 향했다며 이미 사람들이 개미떼처럼 모여 있었고 나는 간신히 한 통만 채우고 친구랑 빠져나오는 데 등 뒤에서 엄청난 폭발음이 들렸다고 상황을 전했다. 그는 죽은 사람들은 대부분 인근 동네 주민이고 아는 사람들이라 마음이 아프다라면서도 휘발유를 팔아 현금을 손에 쥐게 된 것을 뿌듯해했다. 사망자 대부분은 바하왈푸르의 빈민층으로 이들은 돈이 되는 휘발유를 챙기려다 결국 참사를 당했다. 기름이 쏟아져 언제라도 불이 날 수 있는 위험한 곳으로 이들이 몰려든 이유는 어렵지 않게 짐작된다.지난달 취재를 위해 이슬라마바드에 들어갔다가 필자는 깜짝 놀랄 만큼 현지 물가가 폭등한 현장을 목격했다. 파키스탄의 1인당 국내총생산GDP은 2015년 기준 약 3004달러로 세계 125위의 빈곤 국가이다. 빈곤층 주민들은 하루 평균 2달러 정도로 생계를 유지한다. 하지만 5년 전과 비교해 밀가루 설탕 채소 등 생필품 가격은 거의 두 배 이상 뛰었고 특히 연료 값은 천정부지로 올랐다. 수도 이슬라마바드의 주유소에서는 휘발유가 1당 72. 취재 차량에 연료를 가득 채우고 나니 4000루피4만3000원가량가 들었다. 파키스탄 대학 졸업자의 평균 초임이 한화로 약 15만원인 점을 감안하면 상당히 비싼 수준임을 알 수 있다. 현지 기자들은 파키스탄은 소득대비 세계에서 가장 기름값이 비싼 나라라고 이구동성으로 이야기했다. 블룸버그통신에 따르면 세계 주요 60개국의 유류비 고통 순위를 조사한 결과 조사 대상국 중 기름값 고통이 가장 큰 국가는 파키스탄으로 휘발유 1갤런3.78 가격이 일반인의 하루 수입보다도 높았다. 가난한 주민들에게 전복된 유조차에서 쏟아져 나오는 휘발유는 엄청난 횡재였을 것이다. 펀자브주 아메드퍼 이스트의회 의장 막둠 사이이드 하산 길라니는 비극의 원인은 100 가난이라며 참사로 남성 8명이 모두 사망한 가족도 있다고 안타까워했다. 파키스탄 현지 프리랜서 기자 샤히드는 유조차 운전사도 가난을 벗어나려고 과속을 했을 것이라며 한 번 운행에 1500루피밖에 받지 못하다보니 더 운행을 하려다 과속을 했고 결국 참사의 원인을 제공한 것 같다고 말했다. 부상자 대다수는 전신의 70 이상 화상을 입었기 때문에 희생자들은 더욱 늘어날 것으로 보인다. 바하왈푸르의 빅토리아 병원에는 부상자들과 희생자 시신이 이송되며 아수라장을 방불케하고 있다. 빅토리아 병원의 의사 바카르는 병원이 생긴 이래 이렇게 많은 화상 환자가 몰려든 상황은 처음이라며 3도 이상 화상을 입은 환자들이 대부분이다라고 말했다. 파키스탄 현지 경찰은 신원확인이 불가능할 정도로 불에 탄 희생자들이 많아 인근 마을을 대상으로 실종자 파악에 주력하고 있다. 실제 한 마을에선 주민 절반가량인 40여명이 사라진 경우도 있다. 실종자 파악을 전담한 경찰 파케르는 사고 인근 마을인 아하마드푸르 사르키야 지역을 탐문하며 실종자들을 찾고 있는 중이라며 이후 DNA 분석으로 사망자 신원을 확인할 예정이라고 말했다
상사들의 갑질…"끊이지 않는 직장 '힘희롱' 괴로워요"	http://news.naver.com/main/read.nhn?oid=214&sid1=102&aid=0000772799&mid=shm&mode=LSD&nh=20170626203524	혹시 힘희롱이라는 말 들어보셨습니까직장 상사가 지위를 이용해 아랫사람을 괴롭히는 행동을 성희롱을 빗대 일컫는 말인데요.많은 직장인들이 힘희롱에 고통받고 있지만 아직 회사 차원의 대응 방안이나 법적 보호장치는 찾아보기 힘들다고 합니다. 리포트 장애인 치료사로 근무하는 임 모 씨는 지난달 과호흡 증세로 쓰러져 구급차에 실려갔습니다.직장상사와 10여 분간 면담을 한 직후였습니다.임 모 씨저는 선생님 싫어요 대놓고 그러더라고요. 나한테 이렇게 버릇없이 하면 가만두지 않겠다고. 내가 그만두든지 선생님이 그만두든지 하자고공황장애 진단을 받은 임 씨는 2년 넘게 상사로부터 험담과 이간질 퇴사 종용을 당해왔었다고 털어놓았습니다.전화상담원 김 모 씨는 얼마 전 회사를 그만뒀습니다.동갑인 상사가 이혼을 한 자신의 가정사까지 들춰가며 모욕적인 발언을 지속해 더이상 참을 수 없었다고 합니다.김 모 씨집안에 문제있냐 너가 이래서 집중을 못하는 거 아니냐일방적으로 혼내고 있으면서도 질문에 답을 하면 이게 문제라고.회사차원의 관리와 제재가 이뤄지는 성희롱과 달리 직장 내 상사의 괴롭힘인 힘희롱과 관련한 고충처리 부서를 둔 회사는 아직 전무한 상태입니다.성상현동국대 경영학과 교수구성원들에게 힘희롱에 대한 문제의식을 심어줘야 하고요. 조직의 생산성 상사 본인에게도 부정적이라는 것을 끊임없이 강조하는 게
