먹거리 불안감에 가격 폭등까지…'밥상 이중고' 시대	http://news.naver.com/main/read.nhn?oid=437&sid1=101&aid=0000161828&mid=shm&mode=LSD&nh=20170828213237	요즘 먹거리에 대한 불안이 커지면서 외식보다 집밥 찾는 분들이 늘고 있습니다. 그런데 폭염과 폭우 때문에 식재료 값이 계속 뛰고 있습니다. 불안해서 걱정 비싸서 걱정인 밥상 민심을 전다빈 기자가 전해드립니다.  기자이혜연 씨는 살충제 달걀 파문 이후 외식을 아예 안 하고 있습니다.이혜연서울 안암동  요즘에 달걀 파문도 있고 소시지 파문도 있고 먹거리에 대한 불안감이 생겨서 외식보다도 집에서 밥을 더 먹고 있는 편입니다.이씨처럼 직접 안전한 재료를 골라 집에서 식사를 만들어 먹는 이들이 늘어나고 있습니다.그런데 최근 폭염과 폭우로 식재료 값이 껑충 뛰었습니다.특히 애호박과 양배추 같은 채소 가격이 지난해보다 크게 올랐습니다. 국내산 삼겹살과 오징어처럼 달걀이나 소시지를 대신할 단백질 식품값도 뛰었습니다.김길례서울 황학동  장 보러 나오면 가격표 보고 주춤주춤 할 때가 잦아요. 한 바퀴 돌고서 사던 것을 두 바퀴 세 바퀴 생각하게 됩니다.라면과 참치 통조림 같은 가공식품은 이미 올 초부터 가격이 오른 상태입니다.경미나서울 연건동  참치 통조림 가격이 너무 비싸서 잘 구매하지 않게 돼요.곧 추석 대목까지 닥치면 밥상 물가가 더 오를 수밖에 없어서 소비자들의 걱정은 더욱 커지고 있습니다.kr JTBC 뉴스 공식 SNS 트위터 페이스북 유튜브Copyright by JTBChttpjtbc
노종면 "가능하다면 뉴스앵커로 복귀하고 싶어"	http://news.naver.com/main/read.nhn?oid=079&sid1=102&aid=0003005268&mid=shm&viewType=pc&mode=LSD&nh=20170828220603	
비리·비효율에 '물가 4배' 치솟는 아파트 관리비	http://news.naver.com/main/read.nhn?oid=055&sid1=101&aid=0000563025&mid=shm&mode=LSD&nh=20170828215346	최근 5년 사이 아파트 관리비가 전체 물가의 4배 가까이 오른 것으로 나타났습니다. 유지 관리비가 늘어난 게 큰 요인인데 관리비 부과하고 사용할 때 비리가 연루되는 경우도 있습니다.기자20년 된 아파트에 살고 있는 김창구 씨는 갈수록 늘고 있는 아파트 관리비가 부담입니다.김창구서울 강남구  보통 관리비가 20만 원 선 나옵니다. 크게 많은 액수는 아닙니다만 은퇴한 사람 입장에선 관리비가 계속 오른다면 상당히 부담이 되는 건 사실입니다.실제 통계청 조사 결과 아파트 관리비는 최근 5년 새 24.아파트 관리비가 크게 오른 것은 수선 유지비가 가장 큰 요인인데 김 씨 아파트의 경우 지난 5년 새 무려 8배 가까이 올랐습니다.관리 인력에 대한 인건비 부담도 해마다 늘어나는 추세입니다. 관리비 부과와 사용에 비효율적인 경우가 많다는 지적도 끊임없이 제기됩니다.국토부가 지난 4월 비리가 의심되는 아파트 816곳을 점검했는데 713곳에서 3천여 건의 비위가 적발됐습니다.비리 의혹에 대한 민원이 늘자 지자체가 관리비 절감에 나서기도 합니다.양한성강남구청 공동주택관리팀장  내 아파트에 내는 관리비가 어떻게 쓰이는지 궁금증이 많이 제시가 돼서 전문가를 고용해 같이 더불어서 이렇게 절감할 수 있는 방안을 강구하게 됐습니다.이 아파트의 경우 공용 형광등을 LED로 교체하고 외주를 줬던 유지 보수 업무를 관리사무소가 직접 맡으면서 비용을 줄이는 데 효과가 있었습니다.무엇보다 아파트 관리비 책정과 집행을 투명하게 공개해 비리 개입 여지를 없애는 게 중요하다는 지적입니다
현대차 노사 임단협 최종교섭도 실패…장기전 불가피	http://news.naver.com/main/read.nhn?oid=421&sid1=102&aid=0002913358&mid=shm&viewType=pc&mode=LSD&nh=20170828213905	현대자동차 노사의  올해 임단협 상견례 모습  울산 김기열 기자  현대자동차 노사가 임금 및 단체협상 8월 타결을 위한 마지막 교섭에서도 합의에 실패했다.노사는 28일 오후 3시부터 울산공장 본관 아반떼룸에서 윤갑한 사장과 박유기 노조위원장 등 노사 교섭대표 50여명이 참석한 가운데 열린 28차 임단협 교섭에서 의견 조율에 나섰으나 합의점을 찾지못하고 교섭시작 5시간만에 중단됐다.노조는 29일 쟁의대책위원회를 열고 향후 일정을 논의할 계획이지만 현재로서는 사측과의 재교섭이 불투명한 상태다. 노조는 올해 임단협에서 임금 15만4883원호봉승급분 제외 인상 순이익의 30 성과급 지급 등을 요구하고 있다. 이에 사측은 지난주 호봉 승급분4만2879원 지급을 제외한 기본급 인상 불가 성과금 200  100만원 지급 개인연금 5000원현재 2만원 인상 성과금 50  일시금 40만원  복지포인트 10만회사가 지정하는 곳에서 현금처럼 사용 가능한 포인트 지급 등을 제시했으나 노조는 모두 거부했다.이날 교섭에서도 노사 모두 기존 입장만을 재확인하는 선에서 마무리돼 향후 교섭도 난항이 예상된다
보험사기, 빅데이터는 알고있다	http://news.naver.com/main/read.nhn?oid=022&sid1=101&aid=0003204409&mid=shm&viewType=pc&mode=LSD&nh=20170828210724	가해피해자 공모 조직적 범죄 금감원 자료 분석 132명 적발A씨는 지인 등 3명을 차에 태우고 운전하던 중 사고를 당해 4명이 한꺼번에 병원에 입원했다. 이들은 가해 차량 운전자 B씨가 가입한 손해보험사에서 거액의 합의금과 차량 수리비를 받고 퇴원했다. 손보사는 뭔가 이상하다고 금융감독원에 제보했다. 금감원은 A씨와 B씨 주변인들의 연관 관계 등을 빅데이터로 분석했다. 분석 결과 A씨와 B씨는 한패였음이 드러났다. 둘의 지인들이 겹치고 과거에도 비슷한 형태의 사고로 보험금을 받은 이력이 있었다. A씨는 전직 보험사 자동차 대물보상 담당자 B씨는 자동차사고 현장출동 직원이었다.금감원은 이처럼 가해피해를 공모하는 등의 수법으로 자동차보험 사기를 저지른 혐의자 132명을 적발해 경찰에 통보했다고 28일 밝혔다. 금감원은 빅데이터 분석을 통해 서로 아는 사람들끼리 짜고 조직적으로 벌인 보험사기를 밝혀낼 수 있었다. A씨 일당은 최근 6년간 인천광역시 일대에서 가벼운 접촉사고를 일부러 내고 보험금 총 1억3700만원을 받아 챙겼다.택시운전사 4명은 경기도 일대에서 최근 3년간 지인을 태우고 차선 변경 차량과 일부러 부딪치거나 급정차해 추돌을 유발하는 수법으로 보험금 7700만원을 챙겼다. 부산광역시 일대에서 오토바이로 음식배달을 하는 13명은 최근 4년간 오토바이 사고를 공모해 보험금 6700만원을 타냈다.이렇게 적발된 혐의자 132명이 받아낸 보험금이 49억원에 이른다고 금감원은 밝혔다
"내년 지방선거 참패"…'보수 대통합' 수면 위로	http://news.naver.com/main/read.nhn?oid=022&sid1=100&aid=0003204360&mid=shm&viewType=pc&mode=LSD&nh=20170828203834	한국당 정갑윤 보수 대통합 없인 2018년 지방선거 참패 노력 할 것  국민의당 포함 중도 연대론도 제기  바른정당 시큰둥 실현 어려울 듯  정파간 이해 맞물려 걸림돌로자유한국당 홍준표 대표의 친박친박근혜 청산 공론화를 계기로 한국당과 바른정당 간 보수대통합론이 수면 위로 떠오르고 있다. 안철수 대표 체제를 출범시킨 국민의당까지 포함하는 중도연대론도 제기된다. 하지만 각 정파 간 이해관계가 첨예하게 맞물려 있어 보수대통합과 중도 연대의 성사까지는 쉽지 않을 것으로 관측된다. 한국당 정갑윤 의원은 28일 라디오 인터뷰에서 보수대통합 없이는 내년 지방선거에서 그야말로 참패를 당할 것이라는 것이 정치권에서 나오는 이야기라며 정치생명을 걸고 보수대통합을 위해 노력하고자 한다고 밝혔다. 옛 친박계인 정 의원은 같은 당 정진석 바른정당 김무성 의원과 함께 초당적 모임을 구성한 상태다. 같은 당 나경원 의원도 지난 26일 자신의 페이스북에 바른정당과의 통합 추진을 포함해 우파 가치에 동참하는 모든 이들을 받아들여야 한다며 보수대통합을 주장했다. 국민의당까지 포괄하는 중도연대도 거론된다. 현재 야당 지지율로는 내년 지방선거 패배가 불 보듯 뻔한 만큼 야3당 연대가 불가피하다는 주장이다. 지난 21일부터 24일까지 실시해 이날 발표한 리얼미터의 여론조사중앙선거여론조사심의위원회 홈페이지 참조에서도 야3당은 각각 한국당 14. 3당 지지율을 다 합쳐도 30대에 못 미친다. 반면 더불어민주당 지지율은 과반인 51.한국당 정우택 원내대표는 오후 한 방송 인터뷰에서 바른정당과의 합당 여부에 대한 질문에 합치는 게 좋다며 국민의당도 합당 대상에 포함되는 것이 당연하다고 말했다. 그는 최소한 수도권에서라도 야3당 간 후보단일화가 필요하다고 주장하고 있다. 하지만 이 구상이 실현될 가능성은 낮아 보인다. 보수대통합의 대상인 바른정당이 시큰둥하다. 이혜훈 대표는 지금은 자강에 주력할 때라며 선거를 위한 인위적인 공학적 연대는 어떻게 보면 정치개혁의 대상이 될 수 있다고 비판했다.한국당과 바른정당의 통합엔 현실적인 걸림돌도 있다. 한국당 관계자는 두 당의 원외당협위원장들이 가만히 있겠느냐. 지방선거 전에는 합당이나 통합이 절대 안 될 것이라고 잘라 말했다. 지방선거 공천을 앞둔 상황에서 한국당과 바른정당 당협위원장 간 교통정리가 불가능하다는 지적이다. 실제로 바른정당에서 한국당으로 옮긴 복당파 의원들 절대다수가 당협위원장이 되지 못한 상황이다. 국민의당까지 포괄하는 중도연대의 경우 3당의 지지기반이 모두 다르다는 문제가 있다
공공기관 채용, 같은 날 시험?…취업준비생 '혼란'	http://news.naver.com/main/read.nhn?oid=214&sid1=101&aid=0000786078&mid=shm&viewType=pc&mode=LSD&nh=20170828202600	정부가 공공기관 채용 방식 변경을 검토하고 있습니다.유사한 기관별로 같은 날 채용시험을 치르는 합동채용 방식을 도입하겠다는 건데 수험생들은 혼란스럽다는 반응입니다. 리포트 산업은행과 예금보험공사 같은 금융 공기업은 필기시험을 같은 날 몰아 치르는 합동 채용 방식으로 신입사원을 선발하고 있습니다. 그래서 이날은 취업준비생들에겐 이른바 A매치 데이로 불립니다. 이런 채용 방식을 전체 공공기관으로 확대하는 방안이 유력하게 검토되고 있습니다.기획재정부 관계자기존 A매치라든지 이런 것들이 있었기 때문에 그걸 좀 활용을 해보자라는 취지에서 검토 중이고요.기존에 분산 채용으로 인한 중복 지원 문제를 해소하면서 동시에 실질적 채용기회는 오히려 더 늘어날 수 있다는 취지입니다.아직 확정된 게 아니지만 이미 관련 사이트에는 9월부터 12월까지 유사기관별로 통합된 시험일정까지 올라와 있습니다.공기업 취업준비생필기를 합격하고 면접까지 가도 떨어지는 상황에 필기 볼 기회마저 빼앗기는 것 같고요.한번이라도 더 응시기회가 많은 게 좋다는 건데 합동채용을 하면 결국 취업 선택권이 줄어들고 한 번 불합격하면 1년을 더 기다리게 된다는 불만입니다.공기업 취업준비생선택권이 줄어들어서 취업이 더 힘들어지는 것 같아요. 올 하반기부터 적용한다고 하니까 너무 당황스러워요.일각에서는 합동 채용이 취업준비생들의 고충을 헤아리기보다는 비용을 줄이고 중복합격자 문제를 쉽게 해결하려는 행정 편의주의적 발상에서 나온 게 아니냐는 지적도 제기됩니다.최현선명지대 행정학과 교수오히려 공공기관에서는 편리하거나 기재부 입장에서는 통제의 기능이 더 향상될 수 있어도 실제 취업을 준비하는 사람들에게 다양한 기회성이 뺏김으로써.기획재정부는 이와 관련해 공공기관들의 자발적 참여를 전제로 검토 중이라고 밝혔습니다
中 남부, 이번엔 태풍 '파카'…산사태 등 피해 계속	http://news.naver.com/main/read.nhn?oid=214&sid1=104&aid=0000786087&mid=shm&viewType=pc&mode=LSD&nh=20170828204517	지난주 초강력 태풍 하토가 강타한 중국 남부 지방에 태풍 파카가 또 상륙하면서 피해가 눈덩이처럼 커지고 있습니다.태풍으로 인한 대형 산사태도 잇따라 수십 명의 인명 피해가 발생했습니다. 리포트 굉음과 함께 갑자기 산이 무너져내립니다.엄청난 양의 토사와 돌더미가 마을 뒤편 고지대를 덮칩니다.오늘 오전 구이저우성에서 발생한 산사태로 최소 28가구가 매몰됐습니다.오늘 낮까지 2명이 숨진 채 발견됐고 25명이 실종된 상태입니다.마을 주민살아 있는 사람이 있는지 찾아봐요.현지 언론은 34채의 집이 무너졌으며 80명이 넘는 인명 피해가 발생했다고 보도했습니다.구이저우성과 쓰촨성 등 중국 남부지방은 산사태가 잇따랐습니다.하토와 파카 두 태풍이 잇따라 상륙하면서 폭우가 내려 지반이 약해졌기 때문입니다.리우창현지 교통국장 계속적인 폭우에 암석 지반이 약해져 산사태가 발생했습니다.두 태풍이 잇따라 강타한 홍콩과 마카오는 더욱 피해가 컸습니다.14호 태풍 파카로 인해 빗길 전복사고로 홍콩 주민 한 명이 숨졌고 두 지역에서 70명 이상이 다쳤습니다.항공 7백여 편이 취소되거나 차질을 빚는 등 도시 기능이 마비됐습니다
