서울시내 10곳 중 6곳…바깥보다 나쁜 '학교 실내공기'	http://news.naver.com/main/read.nhn?oid=437&sid1=102&aid=0000164893&mid=shm&mode=LSD&nh=20171010211946	앵커미세먼지가 심할 때면 바깥 활동을 자제하라는 이야기들을 하지요. 학교에서도 체육시간을 실내나 체육관 수업으로 대체합니다. 그런데 서울시 교육청이 조사한 결과 10곳 가운데 6곳 꼴로 실내 공기가 바깥보다 더 나빴습니다. 우리 아이들은 어디로 가야할까요.기자김영준상암중  미세먼지 많은 날엔 교실 안에 들어가 있죠. 운동장에 나가지 말라고 학교에서 권고하니까요. 실내가 안전하다고 생각해요 네.실제로 그럴까 서울시 교육청은 매년 시내 유치원과 초중고등학교 실내외 공기질을 측정해오고 있습니다.취재진이 측정결과를 입수했는데 올해는 417곳에서 운동장 공기보다 교실 등 실내 공기가 더 나쁜 것으로 나타났습니다.중학교가 조사 대상 136곳 중 98곳 72로 가장 비율이 높았습니다.초등학교는 65 유치원도 62가 실내 공기질이 더 나빴습니다.특히 서울 송파구의 한 고등학교는 교실 공기가 운동장보다 다섯 배나 탁했습니다. 관악구의 한 유치원의 경우 지난해 측정한 실외 미세먼지 농도는 세제곱미터당 14인 반면 교실은 98으로 7배나 됐습니다.실내에선 공기 흐름이 정체돼 오염물질이 호흡기에 전달될 확률이 실외보다 1000배나 높다는 분석이 있습니다.김병욱더불어민주당 의원  교실 미세먼지 농도가 높으면 학생들의 두통 천식이 발생해 집중력도 떨어지고 학업 성적에도 많은 영향을 미치게 됩니다.실외 수치 관리에만 치우쳐 있는 정부의 미세먼지 대책이 실내 공기질 관리로 확대돼야 할 것으로 보입니다.취재지원  김서영영상디자인  최수진 영상취재  이주현손지윤 영상편집  김영선조민중sms16jtbc.kr 라이브 시청은 유튜브로 제보는 뉴스룸으로 스토리 라이브 비하인드 JTBC 소셜스토리Copyright by JTBChttpjtbc
100만원 스마트폰, 2년 넘게 쓰는데…품질보증은 '1년'	http://news.naver.com/main/read.nhn?oid=437&sid1=105&aid=0000164894&mid=shm&viewType=pc&mode=LSD&nh=20171010214400	최근에 나온 스마트폰들은 100만 원이 훌쩍 넘습니다. 어지간한 가전제품 값인데 품질 보증기간은 1년밖에 안됩니다. 더 늘려야한다는 목소리가 높습니다.기자삼성전자가 하반기에 출시한 갤럭시노트 8입니다.출고가 100만 원이 훌쩍 넘지만 품질보증기간은 1년입니다. 스마트폰 평균 교체주기는 2년 7개월인데 보증 기간은 절반도 채 안 되는 겁니다. 비슷한 가격대의 무선청소기는 보증 기간이 최대 5년입니다. 김태일서울 가양동  보증기간이 짧다 보니까 보험을 들어야 하는 불필요한 지출을 해야 하는 번거로움이 있는 것 같습니다.유럽과 호주 터키 등지에서는 스마트폰 품질보증 기간이 2년입니다.삼성과 LG는 최신 기종을 내놓으면서 미국 소비자들에게만 2년 보증 혜택을 준 적도 있습니다.스마트폰 제조사들은 공정거래위원회의 권고에 따라 1년 보증을 한다고 강조합니다.고용진더불어민주당 의원  정부가 스마트폰 배터리나 액정을 핵심부품으로 지정해 품질보증기간을 늘려줘야 한다 이렇게 생각합니다.공정위가 무선청소기 배터리를 핵심부품으로 지정하면서 보증 기간이 1년에서 5년으로 늘었습니다.이 사례를 스마트폰 액정이나 배터리에도 적용하자는 겁니다. 첨단 기능을 내세운 고가 스마트폰이 쏟아지는만큼 품질보증 기간도 늘려야한다는 목소리가 높습니다. 영상디자인  이재욱 영상취재  손지윤 영상편집  이화영박영우novemberjtbc.kr JTBC 뉴스 공식 SNS 트위터 페이스북 유튜브Copyright by JTBChttpjtbc
'라니냐' 발생 가능성…더 춥고 미세먼지 심해질 올겨울	http://news.naver.com/main/read.nhn?oid=437&sid1=103&aid=0000164892&mid=shm&mode=LSD&nh=20171010211406	최근 동태평양의 적도 부근 수온이 낮아지고 있습니다. 이런 현상을 라니냐라고 합니다. 태평양 수온이 우리와 무슨 상관인가 싶으실 수도 있는데. 이 때문에 겨울 날씨가 평소보다 더 춥고 메마를 가능성이 크다고 합니다. 미세먼지도 심해질 것이란 우려입니다.기자미국 국립해양기상청은 꾸준히 적도 부근 태평양 수온을 관측해오고 있습니다.동쪽 태평양지역 수온이 평년보다 높은지 낮은지에 따라 엘리뇨나 라니냐 현상이 발생하기 때문입니다.지난달부터는 이 감시구역의 해수면 온도가 평년보다 0.이 상태가 지속되면 상대적으로 북서 태평양 쪽으로 따뜻한 바닷물이 모이고 뜨거운 공기가 상승하는 저기압성 흐름이 생깁니다.이에 따라 중국과 몽골 지역에 위치한 강한 대륙 고기압으로부터 태평양 쪽으로 강한 바람이 불게 됩니다.겨울 한반도 쪽으로 불어오는 북서풍이 더욱 강해지는 겁니다.이 때문에 라니냐가 발생하면 한반도는 겨울에 더 춥고 메마르게 됩니다.실제 라니냐가 발생한 2010년의 경우 기온은 평년보다 0.6도 낮았고 강수량은 60 수준에 그쳤습니다.또 이 바람이 중국의 요동반도와 만주 지역을 거쳐오기 때문에 미세먼지 유입량도 대폭 늘어날 가능성이 큽니다.다만 기상청은 올해 발생하는 라니냐가 약한 수준이어서 우리나라에 미치는 효과가 2010년보다는 적을 것으로 예상하고 있습니다.영상디자인  배장근 영상취재  홍승재 영상편집  이화영이수정lee.kr JTBC 뉴스 공식 SNS 트위터 페이스북 유튜브Copyright by JTBChttpjtbc
트럼프 성희롱 비판하더니…할리우드 남성들, 웨인스타인..	http://news.naver.com/main/read.nhn?oid=025&sid1=104&aid=0002760961&mid=shm&viewType=pc&mode=LSD&nh=20171010205401	영국 가디언 배우감독 20여 명 접촉 벤 애플랙 콜린 퍼스 브래드 피트 등 웨인스타인 성폭력 입장 표명 거부해맷 데이먼 러셀 크로우는 취재 막기도트럼프는 비판하고 성평등 외치더니  연예 비즈니스에 만연한 여혐 반영뉴욕타임스NYT가 할리우드 거물 제작자 하비 웨인스타인이 수십 년간 저질러 온 성폭력을 폭로한 지 나흘만인 9일현지시간 대배우인 메릴 스트립이 이에 대한 입장을 밝혔다.      보도가 나오고 수일이 지났는데도 업계 주요 관계자들의 입장 표명이 없어 침묵으로 웨인스타인을 옹호한다는 비판이 나오던 차였다.       하비 웨인스타인. AP      스트립은 이날 허핑턴포스트에  웨인스타인에 대한 수치스러운 보도에 깜짝 놀랐다며 그의 행동은 용납할 수 없는 권력 남용이라고 강하게 비판했다. 또 폭로를 위해 목소리를 높인 용감한 여성들은 우리의 영웅이라고 극찬했다.     세간의 비판을 의식한 듯 그는 그의 성폭력에 대해 알지 못했다는 사실은 분명히 하고 싶다고 강조했다. 스트립은 2012년 웨인스타인 컴퍼니가 미국 내 배급을 맡은 영화 철의 여인으로 아카데미골든글러브 여우주연상을 받았다. 당시 그는 골든글러브 시상식에서 웨인스타인을 신이라 부르기도 했다.      스트립에 앞서 케이트 윈슬렛 엠마 톰슨 파트리샤 아케트 브리 라슨 제시카 차스테인 등 최고의 여배우들이 웨인스타인을 비판하고 피해 여성들을 지지했다. 윈슬렛은 웨인스타인에 대한 이야기를 인지하고 있었다며 만들어진 루머이기를 바랬던 내가 순진해 빠졌던 것 같다. 그래서 더 화가 난다고 밝혔다.       2012년 미국 영화배우조합상 시상식에 참석한 하비 웨인스타인왼쪽과 메릴 스트립. AFP     영화 철의 여인 포스터. 메릴 스트립은 대처 전 영국 총리를 연기해서 아카데미와 골든글러브 여우주연상을 수상했다. 그는 골든글러브 시상식에서 웨인스타인을 신이라 불렀다. 중앙포토      그러나 남성 배우 중 입장을 밝힌 이는 극소수에 불과하다. 9일까지 마크 러팔로와 세스 로건 등 몇몇에 불과하다.        이에 영국 일간 가디언이 웨인스타인과 작업했던 남성 배우감독과 직접 접촉했다.      10일 가디언은 여성들이 목소리를 내는 것과 달리 영화계 주요 남성 인사들은 침묵하고 있다며 가디언이 20명 넘는 남성들에게 연락했다고 전했다. 그러나 모두가 입장 표명을 거부했다고 가디언은 전했다.        취재에 응하지 않은 배우들은 벤 애플렉 맷 데이먼 콜린 퍼스 브래들리 쿠퍼 브래드 피트 리어나도 디카프리오 다니엘 데이 루이스 러셀 크로우 조지 클루니 이완 맥그리거다.       감독 중엔 마틴 스코세지 펄프픽션의 쿠엔틴 타란티노 화씨 911의 마이클 무어 킹스 스피치의 톰 후퍼 시카고의 롭 마샬 등이 포함됐다. 웨인스타인이 제작배급을 맡은 영화를 촬영해 유수의 영화제에서 수상한 명감독들이다.       굿 윌 헌팅에 출연한 벤 애플랙왼쪽과 맷 데이먼. 두 사람은 웨인스타인 사건에 대한 입장 표명을 요구하는 영국 일간 가디언의 취재를 거부했다. 중앙포토     가디언은 할리우드 남성 배우들의 침묵은 엔터테인먼트 산업에 만연한 미소지니misogyny여성혐오를 반영한다며 이들이 업계에 떠도는 루머를 다른 식으로 해석하고 무시함으로써 웨인스타인의 폭력을 수년 간 공공연한 비밀로 남게 만들었다고 비판했다.      또 이들은 성평등과 사회 정의에 목청 높여 왔음에도 이번 사건에 대해선발언하지 않고 있다며 이들은 웨인스타인과 유사한 트럼프 대통령의 성희롱을 직접적으로 비판하기도 했다고 지적했다       가디언은 데이먼과 크로우의 경우 웨인스타인에 대한 언론 보도를 막으려 애썼다는 사실도 폭로했다. 2004년 사건을 취재 중이던 NYT 기자에게 전화해 보도를 저지하려했다는 것이다.      가디언 보도 뒤 클루니는 뒤늦게나마 웨인스타인은 변호의 여지가 없다. 20년간 그를 알았지만 행동에 대해 전혀 몰랐다는 입장을 발표했다.      홍주희 기자 honghongjoongang.kr    모바일에서 만나는 중앙일보 페이스북 카카오 플러스친구 모바일웹중앙일보httpjoongang
중고차로 둔갑한 '폐차'…못 믿을 보험사	http://news.naver.com/main/read.nhn?oid=214&sid1=102&aid=0000789232&mid=shm&mode=LSD&nh=20171010213944	일부 보험사들이 물에 잠기거나 사고로 크게 부서진 전력이 있는 폐차 직전의 차량을 몰래 공업사에 팔아서 돈벌이를 하고 있습니다.이 차들은 싸구려 부품으로 그럴싸하게 수리된 뒤 다시 중고차 시장에서 팔리고 있는데요. 리포트 형체를 알 수 없을 정도로 부서진 2015년식 고급 수입차입니다.폐차하겠다며 보험사가 차주에게 보험금을 주고 소유권을 넘겨받은 이른바 전손차입니다. OO보험사 관계자전손차는 아예 그냥 폐차시키는 게 우리 입장에서는 더 나아요. 수리를 포기시킬 수밖에 없는 거지 차주를 설득해서하지만 이 차량은 폐차장이 아닌 공업사에서 멀쩡한 중고차로 바뀌고 있습니다.김필수대림대 자동차공학과 교수이 차 못 써요. 이런 차는 지금 완전히 다 밀렸잖아요. 펴더라도 톡 쳐도 쏙 들어가잖아요. 이런 차살리면 안 돼요.복원과 수리에 나흘 걸린 이 전손 차량은 도색 등 마무리 작업이 끝나는 대로 시중 시세보다 저렴하게 판매될 예정입니다.차량가격을 보상해 준 보험사는 경매로 차량을 되팔고 공업사가 수리를 한 뒤 중고차로 둔갑하는 겁니다. 교묘하게 속여가지고어떤 부품이 어떻게 쓰이는지 소비자로선 모르는 거죠 어디서 걔네들이 가져와서 저희한테 주는건지 저희들 또한 몰라요.수리 비용을 최대한 줄여야 하다 보니 성능이 검증 안 된 싸구려 부품이 동원됩니다.안전과 직결돼 유통이 금지된 제동장치와 조향장치 등도 버젓이 재활용되고 있습니다. 폐차장 관계자웬만한 업체들은 다 해요. 워낙 브레이크 값이 비싸다 보니까. 저런 걸 재생해서 유통하는 사람들도 있고이우현자유한국당 의원손해보험사들이 이윤을 챙기기 위해 폐차를 해야 하는 전손 차량을 유통시키고 있고. 내 차에 사용된 중고부품이 어떠한 이력이 있는지 소비자가 알 수 있도록2013년부터 최근까지 전손 처리된 차량은 28만여 대 이중 다섯대 중 한대 꼴인 5만 8천여 대가 폐차되지 않고 중고차로 다시 도로 위를 달리고 있습니다
아베 vs 고이케 vs 反개헌파… 팽팽한 '3파전' 양상	http://news.naver.com/main/read.nhn?oid=022&sid1=104&aid=0003215310&mid=shm&viewType=pc&mode=LSD&nh=20171010210806	중의원 선거 공시 12일간 공식 선거전 막 올라일본 중의원 총선거가 10일 공시되면서 오는 22일 투개표를 향한 12일 동안의 공식 선거전이 시작됐다. 이번 선거는 2012년 12월 출범한 아베 신조 총리의 정권 운영에 대한 심판 성격을 띠고 있다.아베 총리는 집권 자민당과 연립 여당 파트너인 공명당 의석을 합쳐 과반을 차지하지 못하면 자리에서 물러나겠다고 선언하며 배수진을 쳤다. 하지만 안전선을 너무 아래까지 내린 것 아니냐는 지적이 나온다. 이번 총선거의 전체 의석은 소선거구 289석과 비례대표 176석을 합쳐 모두 465석이다. 선거구 조정으로 종전보다 10석이 줄었다. 전체 의석이 475석인 현재 중의원에서 자민당288석과 공명당35석은 323석을 차지하고 있어 현재보다 90석이 감소해도 아베 총리가 자리를 지키겠다는 얘기다. 그만큼 이번 선거가 쉽지 않다고 판단한 것으로 풀이된다.일본 집권 자민당 총재인 아베 신조 총리가 중의원 총선거 공식 선거운동이 시작된 10일 후쿠시마에서 유세를 하고 있다.후쿠시마현재 판세는 아베 보수고이케 보수진보 진영이 팽팽하게 맞서는 삼파전 양상이다. 아베 총리를 중심으로 한 보수 진영의 자민공명당 고이케 유리코 도쿄 지사를 축으로 한 보수 진영의 희망의당일본유신회 진보 진영의 입헌민주당공산당사민당이 각각 세력을 형성하고 있다.자민당은 여론조사에서 가장 앞서고 있지만 아베 내각 지지율이 최근 하락세인 점은 불안 요인이다. 더욱이 사학스캔들은 자민당에 치명타를 안길 수 있다. 아베 총리는 직접 관여를 거듭 부정하지만 주변에서 알아서 편의를 제공했을 것이라는 의심을 떨쳐내지 못하고 있다. 이 문제로 아베 총리 지지율이 지난 7월 20대까지 급락하며 퇴진론이 불거진 적도 있다. 야당들이 사학스캔들을 선거 쟁점으로 부각하려는 이유다.일본 희망의당 대표인 고이케 유리코 도쿄 지사가 10일 도쿄 긴시초역에서 시민들에게 총선 지지를 호소하고 있다. 도쿄최대 변수로 꼽히는 것은 제1야당이던 민진당의 보수중도계 인사들을 대거 흡수하면서 제1야당으로 올라선 희망의당이다. 개혁 보수를 표방하는 희망의당이 자민공명당을 지지하는 보수세력 표를 얼마나 흡수할지 반아베 세력 표를 얼마나 빨아들일지가 선거 결과를 좌우할 것으로 전망된다. 고이케 지사는 최근 정당 대표 토론에서 사학스캔들을 비판하는 등 아베 퇴진을 외치고 있으며 자민공명당의 과반 의석 저지를 목표로 내걸고 있다. 하지만 고이케 태풍은 다소 주춤한 상태다. 요미우리신문의 지난 78일 여론조사에서 비례대표 투표에서 희망의당을 찍겠다는 응답자는 13로 지난달 2829일 조사16 때보다 3포인트 하락했다.진보 진영은 민진당 내 진보계 인사들이 주축이 돼 최근 창당한 입헌민주당을 중심으로 뭉치고 있다. 이들은 3분의 1 이상 의석 확보를 목표로 삼고 있다. 아베 정권이 다른 정당과 손잡더라도 개헌 발의에 필요한 의석3분의 2 이상을 확보하지 못하게 하려는 것이다.정책적으로는 각 당의 입장이 복잡하게 얽혀 있다. 개헌에는 자민당과 희망의당이 찬성하고 입헌민주당은 반대한다. 원전 재가동 정책은 자민당이 찬성하지만 희망의당과 입헌민주당은 반대하는 입장이다
