미인대회 일본 심사위원, 한국 대표에 '위안부 질문'	http://news.naver.com/main/read.nhn?oid=437&sid1=104&aid=0000146643&mid=shm&viewType=pc&mode=LSD&nh=20170203220008	위안부 소녀상에 반발한 일본이 주한 일본대사를 한 달 가까이 돌려 보내지 않고 있죠. 이 위안부 갈등이 세계 미인대회로까지 번지고 있습니다. 일본 심사위원이 우리나라 출전자에게 위안부를 어떻게 생각하느냐고 물었다는 주장이 나왔습니다.기자지난주 필리핀에서 열린 65회 미스유니버스 대회.한국 대표 김제니씨는 뜻밖의 질문을 받았습니다.탄핵 심판을 받고 있는 박근혜 대통령에 대한 질문에 이어 위안부 문제까지 답변을 요구받았습니다.질문을 던진 것으로 지목된 심사위원은 2007년 미스유니버스 우승자인 일본인 리요 모리. 여성인권과 권리증진을 외치는 미인대회에서 첨예한 정치 외교 갈등 이슈가 질문으로 등장한 겁니다.특히 심사위원이 이해당사국 출신이란 점 때문에 위압적인 분위기까지 연출된 것으로 전해졌습니다.대회 관계자는 당황한 김제니씨가 위안부 문제가 잘 해결되길 바란다고 밖에 답변할 수 없었다고 당시 상황을 전했습니다.이에 대해 리요 모리측은 직접적으로 위안부를 거론하지 않았다면서도 순발력을 테스트 했다는 입장입니다.리요 모리 매니저  어떤 인종으로부터 어떤 질문을 받을지 모르는 거니까. 그런 상황에서 얼마나 스마트현명하게 대답할 수 있는가가 심사 포인트이거든요.김씨는 86명에서 13명을 뽑는 준결선 진출에 실패했습니다.강신후 JTBC 뉴스 공식 SNS 트위터 페이스북 유튜브Copyright by JTBChttpjtbc
'신생아 집단 감염' 산후조리원, 폐쇄 권고에도 영업 계속	http://news.naver.com/main/read.nhn?oid=214&sid1=102&aid=0000733158&mid=shm&mode=LSD&nh=20170203214347	경기도의 한 산후조리원에서 신생아들이 RS 바이러스에 집단 감염됐습니다.신생아들에게 호흡기질환을 일으키기 때문에 보건소가 임시폐쇄를 권고했는데도 산후조리원은 이 사실을 숨기고 영업을 계속했습니다. 리포트 수도권의 이름난 산후조리원 신생아실에 갓난아기가 2명만 누워 있습니다.RS바이러스 감염이 발생해 오늘부터 임시폐업조치에 들어간 겁니다.산후조리원 직원지금 다 나갈 거예요.이 산후조리원에서 증세가 나타나 입원치료를 받게 된 신생아는 모두 4명 이 중 1명은 이미 확진판정을 받았습니다.부모들은 일주일 전부터 아기들이 잇따라 증세를 보여 보건소에 신고를 했는데도 조리원이 단순 감기로 취급해 집단 감염으로 번졌다고 주장합니다.조리원은 심지어 보건소가 일시폐쇄를 권고한 뒤에도 신생아 3명을 추가로 받은 것으로 드러났습니다.신생아 아버지우리는 굳이 감염에 노출이 안 돼도 될 뻔했는데도 불구하고 들어가는 바람에 어쨌든 기분이 찝찝하고.전염성이 강한 RS바이러스는 주로 늦가을부터 초봄까지 영유아들에게 발병하는데 심하면 폐렴이나 천식 같은 합병증을 일으킬 수 있습니다.정현주아주대병원 소아청소년과 교수처음에는 감기 증상처럼 콧물 있고 이렇게 시작하다가 하루 이틀 지나가면서 기침 오고 호흡곤란이 오고 혼자서 숨쉬기 어려운
"숨소리도 작게" 공시족의 불안한 하루	http://news.naver.com/main/read.nhn?oid=449&sid1=102&aid=0000122885&mid=shm&mode=LSD&nh=20170203212959	공무원 시험 준비생이 70만 명을 돌파했습니다. 수능 수험생보다 더많은 숫자라고 하는데요.   최악의 실업난 속에서 안정된 직장을 찾기 위한 몸부림이라는 해석이 많습니다.   치열한 경쟁에 숨 소리 작게 내기 책장 조용히 넘기기 같은 불문율까지 등장했다고 합니다.   취업난 속 공시생들의 하루를 정부경 기자가 따라가 봤습니다.  리포트 영화 올레 중 코딱지만한 고시원에서 몽테크리스토 백작처럼 13년을 버텼어   영화 범죄의 여왕 중 나한텐 시험이 목숨같은 거야.    공무원 수험생들이 몰려드는 서울 노량진.    수강생들로 가득찬 강의실에선 숨소리조차 들리지 않습니다.   쉬는 시간이 되자 잠깐이라도 숨을 돌리기 위해 앞 다퉈 내려오는 이들은 공무원 시험 준비생 이른바 공시족입니다.   공무원시험 응시자는 지난해 처음으로 70만 명을 돌파했습니다.   대학수능 응시자60만 명를 훌쩍 웃도는 숫잡니다.   공시족이 급증한 배경엔 높은 청년 실업률도 한몫했습니다.   지난해 청년 실업률은 9. 청년 10명 중 1명은 일자리 없이 불안한 하루 하루를 보내고 있다는 건데요.   그러나 국민들이 실제 느끼는 청년 실업 실태는 훨씬 더 심각합니다.  이승주  대학원생 공부도 많이 하고 있는 것 같은데 그런데도 불구하고 취업에 많이 힘들어 하는 것 같습니다. 날씨처럼 되게 힘든 것 같습니다.    공시족이 늘면서 학원들만 호황을 맞았습니다.   유명 강사의 수업은 전국 곳곳에 생중계돼 동시 수강생이 수천 명에 달할 정도.   장정훈  공무원시험 강사 학생들이 폭발적으로 증가하고 있어요. 엄청나게 학원에 몰려 있는 상태죠.    경쟁이 워낙 치열하다보니 수강생들의 신경은 잔뜩 날카로워져 있습니다.   숨소리 작게 내기 책장 조용히 넘기기 가방 지퍼 밖에서 열기 등 공시족들끼리 공유하는 규칙까지 등장했습니다.   일요일 새벽마다 추위와 싸우며 길게 줄을 서는 진풍경도 벌어집니다.    일요일 아침에 정해지는 자리가 2주 동안 고정석이 되는 규칙에 따라 좋은 자리잡기 전쟁이 펼쳐지는 것.   대기 번호표를 사고 파는 경우도 있습니다.    명절이나 휴일은 공시족들에겐 남 얘기입니다.   이세종  경찰공무원 준비생 부모님이 어쩔 수 없으니 공부하라고 합격하면 고향에 내려갈 수 있겠죠.   안정적 일자리를 꿈꾸며 공무원시험 학원가로 들어와도 합격이라는 꿈을 이루고 나가긴 쉽지 않은데요.   그야말로 낙타가 바늘구멍 통과하기나 마찬가집니다.  지난해 국가직 9급 시험엔 4천 명을 뽑는 데 22만 명이 몰렸습니다.   경쟁률은 54대 1.   인기가 좋은 수도권 일반행정직 경쟁률은 무려 191대 1에 달했습니다.   9급에 비해 어려운 국가직 7급 경쟁률도 76대 1을 기록했습니다.   지난해 국가직과 지방직의 전체 채용 숫자는 2만 5천여 명에 불과했습니다.   강의실에 가득 들어찬 수험생 중 잘해야 서너 명만 가시밭길을 통과하는 셈입니다.   높은 경쟁률과 몇년씩 계속되는 힘든 공부기간을 버티지 못하고 중도 포기하는 수험생도 속출합니다.   인사혁신처 관계자 응시 포기에 다른 요인이 있다고 보기가 굉장히 어려운 게 시험 일정이 딱히 겹치는 것도 없고   날로 높아지는 문턱에도 불구하고 공시족이 늘어나는 이유는 뭘까.   구정우  성균관대 사회학과 교수 신규 채용이 축소된 게 구조적 원인이지만 청년들이 원하는 직업과 사업체 인재 조건이 일치하지 않는 탓이 큽니다.    최악의 실업난.   거기에 직업 안정성만 따지는 풍조가 더해지면서 젊은이들이 공무원시험에만 매달리는 기현상이 벌어지고 있습니다.   채널A 뉴스 정부경입니다
국과수 "5·18 당시 옛 광주은행 유리창 탄흔은 소총탄 추정"	http://news.naver.com/main/read.nhn?oid=001&sid1=102&aid=0009006734&mid=shm&mode=LSD&nh=20170203212206	상하향 사격 모두 가능성 있어헬기 사격 여부는 언급 안 해광주 정회성 기자  518 민주화운동 당시 옛 광주은행 본점 유리창 파손 부위를 분석한 국립과학수사연구원국과수이 소총탄에 의한 탄흔으로 추정된다는 의견을 내놓았다.    분석 대상 3장의 유리창 중 일부에 대해서는 헬기 등 높은 곳에서의 하향 사격 가능성을 배제하지 않았지만 헬기 사격 여부를 직접 언급하지는 않았다.    M60 기관총에 의한 탄흔 가능성은 작게 봤다.518기록관에 소장된 광주은행 옛 본점 유리창. 자료사진국과수는 3일 이러한 내용의 광주은행 옛 본점 유리창 3장에 남겨진 탄흔 4개의 감정 결과를 발표했다.    국과수는 감정서에서 광주은행 옛 본점 사옥 유리창에 남겨진 탄흔에 대해 구경 5.56의 소총탄에 의한 탄흔으로 추정된다고 밝혔다.    유리창의 구멍 형태에 대해서는 분화구상의 파쇄흔 중심에 천공이 생성되고 천공의 가장자리가 불규칙하고 가장자리 주변 유리는 작은 조각으로 파쇄된 형태로 이는 총탄에 의한 손상흔의 형태와 유사하다고 설명했다.    M60 기관총에 의한 탄흔 가능성은 작다고 봤으며 헬기 공중사격 가능성에 대해서는 직접 언급하지 않았다.    국과수는 M60 기관총에서 발사된 탄환이라면 한 유리창에 다수의 탄흔이 동시에 생성될 것이나 제시된 유리창에는 12개의 탄흔 산발적으로 생성됐다며 기관총에 의한 손상 가능성을 낮게 봤다.    헬기 사격 가능성을 추정해 볼 수 있는 발사 위치에 대해서는 유리창 3장 중 1장은 상향 사격에 의한 것이지만 나머지는 상향 하향 모두 가능성 있다며 헬기 공중사격 가능성을 열어뒀다.    하지만 손상흔의 형태로서는 발사 각도의 판단은 불가능하다고 밝히며 헬기 공중사격 자체를 이번 감정서에서 언급하지 않았다.    탄흔이 남겨진 광주은행 옛 본점 사옥 유리창 3장은 518민주화운동기록관이 소장하고 있다. 최근 광주시가 국과수에 분석을 의뢰했다. 자료사진국과수는 지난달 발표한 광주 금남로 전일빌딩 최상층인 10층에서 발견된 탄흔 150개 분석 보고서에서는 헬기사격 가능성이 매우 크다고 인용한 바 있다.    1980년 5월 금남로 3가에 자리했던 광주은행 옛 사옥은 전일빌딩과 직선거리로 300여m 떨어져 있다
국산 헬기 '수리온' 또 부품 결함…운행 전면 중단	http://news.naver.com/main/read.nhn?oid=008&sid1=100&aid=0003816416&mid=shm&mode=LSD&nh=20170203185658	오세중  기자 the300방사청 해당부품 오는 6월까지 개선된 것으로 전량 교체 예정 한국형헬기인 수리온.사진국산 기동헬기 수리온KUH1이 또 부품결함으로 운행이 전면 중단됐다.방위사업청은 3일 지난 1월16일 육군항공학교에서 수리온 14호기에 대한 검사를 실시한 결과 메인로터작동기 연결부분품에 7 가량의 균열이 발생했다고 밝혔다. 현재 운용중인 모든 수리온에 대한 운행을 임시 중단한 상태. 이에 따라 방사청은 지난 1월 16일17일 양일간에 걸쳐 방위사업청 육군 및 업체 등 관련기관이 전항공기를 대상으로 검사를 실시해 추가적으로 1대18호기에서 균열이 발생된 것을 확인했다며 육군은 수리온 운항통제를 실시했고 방위사업청은 한국항공우주산업KAI와 원제작업체이탈리아 MECAER사에 즉각적으로 원인을 규명하도록 했다고 설명했다. 방사청에 따르면 원인분석 결과 연결 부분품 내부에 수분이 유입돼 기온강하에 따른 결빙 후 팽창에 의한 균열로 최종 확인됐다. 이상이 발견된 메인로터작동기MRA는 주회전 날개를 작동시킬 때 필요한 부품으로 헬기의 핵심부품이라 할 수 있다.방사청은 육군 국방과학연구소 국방기술품질원 등 관련기관과의 합동으로 기술검토위원회 및 중앙합동기술위원회 등의 대책회의를 문제 해결 때까지 운용 중인 모든 수리온에 대한 임시 운항 중단을 결정했다.방사청은 해당 결함이 발견된 수리온은 14호기와 18호기 2대지만 후속조치 차원에서 올해 6월까지 해당부품에 대해 수분유입방지 공정개선 부식방지 등 개선된 부품으로 전량 교체할 방침이다. 한편 수리온은 지난해 7월에도 엔진과 로터 시스템날개 회전 담당을 연결하는 기어박스에 결함이 생겨 운항을 중단하고 부품을 교체한 바 있다
청춘 응원한다던 KTX 할인…좌석은 반토막으로 줄여	http://news.naver.com/main/read.nhn?oid=081&sid1=102&aid=0002795558&mid=shm&mode=LSD&nh=20170203191313	코레일은 지난해 말 KTX 할인상품인 힘내라 청춘의 할인율을 기존 1030에서 최대 40로 확대한다고 발표하며 이런 문구를 내걸었습니다. 할인 대상인 만 2533세 청년층은 당연히 두손 들고 발표를 반겼죠. 교통비를 10라도 더 아낄 수 있다는 기대감 때문이었습니다. 특히 취업준비생인 청년층과 박봉의 사회초년생들은 코레일의 응원에 큰 위안을 받았죠. 지난해 힘내라 청춘 이용객이 26만 1000명이니 적어도 수십만명은 환영했을 걸로 보입니다.지난해 정기국회 국정감사를 앞두고 행정자치부 직원들이 국감 준비를 하고 있다. 지난해 코레일이 할인확대 조치 및 조정에 나선 이유가 있습니다. 그해 7월 11일 국회 국토교통위원회 전체회의에서 야당 의원들이 코레일이 할인제도를 변경해 700억원의 이득을 챙겼다며 제도 조정의 필요성을 제기한 것이죠. 당시 회의에 출석했던 홍순만 코레일 사장은 연말에 마일리지 제도를 도입하는 식으로 국민에게 추가 부담이 되지 않도록 조정하겠다. 철도요금 할인제도를 리모델링해 추가적인 할인 정책을 펴나갈 계획이라고 약속했습니다. 강호인 국토교통부 장관이 코레일은 경영 개선이 시급한 기관이라며 홍 사장의 할인정책 확대 발언에 제동을 걸긴 했지만요. 이렇든 저렇든 새로운 할인 제도는 그해 말 확정발표됐습니다.트위터에 터진 불만들코레일은 좋은 일을 했다지만 소셜네트워크서비스SNS에서는 주요시간대에 표가 하나도 없다 맨날 매진이다 등의 불만이 터져나왔고 힘내라 청춘 상품을 이용하던 제 주변 지인들도 고개를 갸웃거렸습니다. 새로운 할인 제도를 발표한 지난해 11월을 기점으로 뭔가 예매가 더 힘들어진 것 같다고 느낌적인 느낌을 토로했죠.서울신문이 3일 국회 국토교통위원회 소속 더불어민주당 황희 의원실을 통해 코레일에서 자료를 받아 본 결과 할인율 확대 발표 전후로 공급 좌석수가 반토막이 난 걸로 드러났습니다. 보통 코레일은 인터넷특가 할인제도를 제외하면 승차율에 따라 공급좌석 수에 제한을 둡니다. 그런데 오비이락격으로 할인 확대 발표를 한 뒤 좌석 수가 급격히 줄어든 거죠. 이용객들은 생색내기식 홍보 뒤에 좌석을 줄인 거 아니냐며 소비자를 우롱하는 처사라고 비판하고 있습니다.할인확대 발표 이전에는 예매가 수월했는데 요즘에는 며칠전에 해도 시간대가 늦거나 10 할인 밖에 안되더라고요. 이상하다고 생각했는데 좌석수가 반토막이 난 줄은 몰랐네요. 오송행 KTX를 자주 이용하는 이모33씨의 말입니다.위 그래픽을 보면 힘내라 청춘 상품의 공급좌석이 910월 15만 9000석에 달했지만 할인율 확대 발표 이후인 1112월에는 8만 3000석으로 급격히 줄어든 것을 볼 수 있습니다. 할인금액도 4억 949만 5000원910월에서 3억 4310만 3000원1112월으로 16. 혜택 발표 이후 소비자에게 돌아가는 금액이 약 7000만원 정도 줄어든 셈입니다.동일한 기간 다른 상품들의 공급좌석과 할인금액도 줄어든 것으로 나타났습니다. 만 1324세 청소년을 대상으로 한 청소년 드림은 공급좌석이 16만 6000석에서 6만 2000석으로 줄어들었습니다. 3분의 1수준이 된 것이죠. 할인금액도 4억 4500만원에서 2억 1200만원으로 반토막이 났습니다. 4명을 한 세트로 판매하는 KTX 가족석의 할인금액 역시 16억 3000만원에서 13억 2000만원으로 낮아졌죠.이창원 한성대 행정학과 교수는 이렇게 지적했습니다.할인율을 확대한다고 약속해놓고 공급 좌석을 줄인다면 소비자를 우롱하는 것인 만큼 비판받아야 합니다. 공기업이라는 이유로 무조건 할인 혜택을 강화하라고 강요할 수는 없지만 눈 가리고 아웅 해서는 안되죠.이에 대해 코레일은 1112월은 승차율이 높아져 할인 대상의 범위를 축소했고 수서발고속철도SRT의 개통으로 열차운행 횟수가 감소한 게 영향을 끼쳤다고 해명했습니다. 또 힘내라 청춘과 인터넷 특가의 할인율이 겹치는 부분은 앞으로 고쳐 나갈 예정이라고 밝혔죠
70대 택시기사 걸러낸다…자격검사 실시	http://news.naver.com/main/read.nhn?oid=449&sid1=103&aid=0000122882&mid=shm&viewType=pc&mode=LSD&nh=20170203203222	고령화시대가 본격적으로 열리면서 65세 이상 고령 운전자 수도 늘고 있습니다.   서울개인택시기사의 경우 세명중 한명이 65세 이상이라고 합니다.   정부는 내년부터 고령 택시 기사에 대한 자격검사 제도를 실시하기로 했습니다. 늘어나는 사고를 줄이기 위한 대책입니다.   박준회 기자입니다.  리포트 지하차도 한가운데 택시가 전복돼 있습니다.   66살 택시 기사 이모 씨가 몰던 차량이 보행자를 피하려다 가드레일을 들이 받고 4미터 아래 지하차도로 떨어진 겁니다.   이 사고로 이 씨가 숨지고 승객인 일본인 A씨도 크게 다쳤습니다.   이 씨 같은 65세 이상 택시 기사는 지난해 10월 말 기준 6만 천여 명.   서울 개인 택시 기사의 경우 세 명 중 한 명이 65세 이상 고령자입니다.   65세 이상 운전자가 모는 택시의 교통사고 역시 늘고 있습니다.   하지만 그동안 택시 기사는 나이와 상관없이 일반 운전자처럼 5년마다 정기 적성검사만 받으면 영업을 할 수 있게 돼 있습니다.   김동현  서울 마포구  뒤에서 보면 나이 많으신 분들 운전하시는 거 불편하신 점도 있고 하니까   이에 국토교통부가 고령 택시 기사에 대한 자격유지검사를 도입하겠다고 입법예고 했습니다.   65세 이상은 3년 마다 70세 이상은 매년 시각 반응속도 등 7가지 항목을 검사 받아야 합니다.   박준회 기자  정부가 고령 택시 운전자의 자격 유지 검사 도입을 발표하자 일부 택시 기사들은 과도한 규제라며 반발하고 있습니다.   개인 택시 기사64세  검사 할 필요가 없어요. 하루에 12시간 13시간씩 운전하는데 젊은 사람들 못지 않게 하죠.   국토부는 고령 택시 기사들의 의견을 듣고 제도 도입 과정에 참고할 계획입니다.   채널A 뉴스 박준회입니다
