靑 "법무부 발표 존중"…'돈봉투 만찬' 감찰결과	http://news.naver.com/main/read.nhn?oid=421&sid1=102&aid=0002774276&mid=shm&viewType=pc&mode=LSD&nh=20170607224224	5   이광호 기자자체 감찰규정과 법리에 따른 법무부 자체 판단서울 조소영 기자  청와대는 7일 일명 돈봉투 만찬 논란에 대한 법무부의 감찰결과 발표에 대해 존중한다고 입장을 밝혔다.윤영찬 청와대 국민소통수석은 이날 기자들에게 보낸 문자메시지를 통해 오늘 법무부의 감찰결과 발표는 자체 감찰규정과 법리에 따른 법무부의 자체 판단이라며 청와대는 이를 존중한다고 전했다.이와 관련 장인종 합동감찰반 총괄팀장법무부 감찰관은 이날 법무부 청사에서 법무부 감찰위원회의 권고 내용을 반영 이영렬 전 서울중앙지검장과 안태근 전 법무부 검찰국장에게 면직 징계를 청구했다고 발표했다.특히 이 전 지검장은 부정청탁 및 금품 등 수수의 금지에 관한 법률청탁금지법일명 김영란법 위반 혐의로 대검의 수사를 받게 됐고 만찬 때 동석한 8명에 대해서는 경고조치가 내려졌다.문재인 대통령은 지난달 17일 만찬 참석자들을 대상으로 돈이 오간 경위 및 출처 등을 감찰하라고 지시한 바 있다
"부상병 부모에 위자료 지급" 첫 판결	http://news.naver.com/main/read.nhn?oid=449&sid1=100&aid=0000131532&mid=shm&mode=LSD&nh=20170607213158	멀쩡한 아들이 군에서 사지 마비가 돼 돌아왔다면 그 부모의 심정은 어떨까요   최근 대법원이 의미 있는 판결을 내렸습니다.   부상 당한 병사의 부모에게도 국가가 위자료를 지급하라고 한 겁니다.   이런 판결은 사상 처음 있는 일입니다.   최선 기자의 단독보도입니다.  리포트 한 청년이 병상에 몸을 누이고 힘겨운 숨을 몰아쉽니다.   입대 전 호텔 조리사를 꿈꿨던 오동은 씨.   팔다리 마비뿐 아니라 자신의 숨조차 기계에 의지하고 있습니다.   정영숙  오동은씨 어머니  공부를 잘하거나 이런 건 아니었는데 아무튼 엄청 착했어요.   7년 전 군 복무 중이던 오 씨는 유해 발굴 작업에 투입된 후 이상 증세를 느꼈습니다.   고통을 호소했지만 3개월 동안 군 병원은 정밀 진단 없이 진통제와 우울증 약만 처방했습니다.   오씨는 결핵성 뇌수막염이 악화돼 결국 팔다리가 마비됐습니다.   군으로부터 어떤 사과도 받지 못한 부모는 기나긴 법정 싸움을 시작했습니다.   정부는 오 씨가 국가유공자가 된 만큼 부모에게 추가 배상할 책임은 없다고 버텼습니다.   정영숙  오동은 씨 어머니  국가를 상대로 한다는 게 계란으로 바위 깨기 격이라는 게 이런 거구나 했죠.   하지만 최근 대법원은 국가가 오 씨 부모에게 위자료를 지급해야 한다는 최종 판결을 내렸습니다.   오 씨 부모는 소송을 진행하면서 사업에 어려움을 겪었고 위자료 절반에 육박하는 비용을 들였습니다.   최선 기자  문재인 대통령은 어제 이곳 보훈병원을 찾아 보훈가족에 대한 예우를 강화하겠다고 약속했습니다.   이번 판결과 맞물려 앞으로 관련 소송이 잇따를 전망입니다.   채널A 뉴스 최선입니다.   최선 기자 bestedonga
'나도 모르는 대부업체'…난데없는 빚 독촉 알고 보니	http://news.naver.com/main/read.nhn?oid=055&sid1=101&aid=0000537556&mid=shm&viewType=pc&mode=LSD&nh=20170607233041	어느 날 갑자기 모르는 대부업체가 무자비한 빚 독촉을 해 온다면 얼마나 당황스러울까요 금융사들이 상환받기 힘든 빚을 헐값에 대부업체에 팔아넘기는 빚 거래가 너무 쉽게 이뤄지고 있는 겁니다.기자3년 전 저축은행 대출을 받고 갚을 여력이 없어 개인회생 절차 중인 김 모 씨.저축은행으로부터 김 씨의 빚을 넘겨받았다는 한 대부업체로부터 최근 빚 독촉 전화를 받았습니다.대부업자  저희는 이런 일만 전문적으로 하는 사람이니까 끝까지 가요. 월요일에 바로 고소 준비해놨고요.회생 과정에 있는 채무자에게 빚 독촉을 하는 것은 불법이지만 대부업체는 막무가내였습니다.김 모 씨불법채권추심 피해자  갑자기 전화가 와서 협박 조로 그렇게 얘기를 하니까 뭐가 잘못되는 게 아닐까 하는 두려움을 느꼈죠.김 씨처럼 소득이나 재산이 거의 없어 빚을 갚기 힘든 경우는 200만 가구로 추산됩니다.빚 상환을 압박하기보다는 탕감 등을 통해 회생을 유도하는 게 절실한 가구들입니다.하지만 받기 힘든 빚을 최소한의 수익이라도 얻기 위해 은행들은 제2금융권으로 또 제2금융권은 다시 대부업체에 돈을 받고 넘기는 경우가 늘고 있습니다.빚을 넘겨받은 대부업체는 돈을 받아 내기 위해 탈법을 일삼는 경우가 많아 이와 관련된 민원도 지난해 70나 늘었습니다.이헌욱변호사  일본은 채권추심회사를 허가제로 하고 있습니다. 반면 우리나라는 채권이 너무 쉽게 사고 팔리고요. 채권추심시장 자체를 정비할 필요가 있습니다.무분별한 빚 거래를 제한하고 무리한 채권추심을 막아야 채무자에 대한 최소한의 권리를 보호할 수 있다는 지적입니다
낙동강 강정고령보 올해 첫 조류경보 발령 	http://news.naver.com/main/read.nhn?oid=421&sid1=102&aid=0002774207&mid=shm&viewType=pc&mode=LSD&nh=20170607194701	4대강 6개보의 수문이 열린지 불과 닷새 만인 지난 6일 대구 달성군 도동나루터 인근 낙동강에 올들어 첫 녹조가 관측됐다. 환경단체는 찔금 방류로는 녹조 문제를 해결할 수 없다며 보 수문의 전면 개방을 촉구했다.7   이종현 기자대구경북 정지훈 기자  최근 수온 상승과 강수량 부족 현상 등이 이어지면서 낙동강 강정고령보 구간에 올해 첫 조류경보가 내려졌다. 대구지방환경청은 7일 낙동강 강정고령보 구간에 조류경보 관심단계를 발령했다고 밝혔다. 대구환경청에 따르면 지난 5일  강정고령보 상류에서 채수해 분석한 결과 강정고령보의 남조류 세포수는 1만1844cell로 나타났다.앞서 강정고령보는 지난달 29일 남조류 세포수 3813cell로 1000 cell을 넘어섰다. 조류경보 관심 단계는 남조류 분석 결과 2주 연속 관심 기준남조류세포 수 1000cells 이상 1만cells 미만을 초과하면 발령된다.남조류세포 수가 1만cellsmL 이상 100만cellsmL 미만일 때는 조류 경계 100만cellsmL이상이면 조류대발생이 발령된다.   4대강 6개보의 수문이 열린지 불과 닷새 만인 지난 6일 대구 달성군 도동나루터 인근 낙동강에 올들어 첫 녹조가 관측됐다. 환경단체는 찔금 방류로는 녹조 문제를 해결할 수 없다며 보 수문의 전면 개방을 촉구했다.7   이종현 기자대구환경청은 이번 조류 발생에 대해 대구와 경북지역이 예년에 비해 폭염특보 등 높은 기온과 낮은 강수량으로 인해 남조류 증식에 유리한 조건이 형성된 것이 주요 원인이라고 분석했다. 대구와 경북지역은 1973년 이후 관측된 5월 기온 중 가장 높았고 올해 평균 강수량23.5 대비 29 수준으로 세번째로 적었다. 대구환경청은 환경기초시설 적정 운영과 오염원 점검에 나서는 한편 취정수장 관리기관에는 수질분석과 정수처리 등을 강화토록 요청했다. 또 매곡고령광역 취정수장 관리기관에는 활성탄과 오존을 이용한 고도정수처리시스템이 완비돼 안전한 수돗물 공급에는 전혀 차질이 없다고 강조했다. 대구환경청 관계자는 보 개방에 따라 녹조저감 효과가 어느 정도 되는지는 모니터링 중에 있다며 관계기관과 협력해 오염원 유입 최소화 취정수장 운영 강화 등 녹조 저감과 안전한 수돗물 공급을 위해 최선을 다하겠다고 말했다
"양심불량 '체납 차' 번호판 뗀다" 단속 시작 '초강수'	http://news.naver.com/main/read.nhn?oid=214&sid1=103&aid=0000769770&mid=shm&viewType=pc&mode=LSD&nh=20170607230310	자동차세나 교통위반 과태료를 안 낸 차량의 번호판을 뜯어내는 단속이 오늘 시작됐습니다.상습 고액 체납자의 차량은 바로 견인조치까지 됐는데요. 리포트  경찰이 달리는 승용차를 갓길로 세웁니다.자동차세 64만 원을 안 낸 차량입니다.김정선서울 서초구청 자동차영치팀장납부를 안 하면 번호판을 탈착해서 영치를 하고 있습니다. 이것이 체납액이에요 선생님 차.세금을 못 낸 이유도 단속을 피하려는 변명도 여러 가지입니다.운전자아니 제가 도망간 것도 아니고 세금을 안 내려고 하는 것도 아니고.카드가 거기 있어서 한 시간 내로 보낼게요.단속반지금 번호판 달고 갈 수가 없어요.밀린 과태료 가운데 일부만 내겠다는 운전자도 있습니다.운전자돈이 한 20만 원 있거든요. 현금 내도 되죠단속반공무원은 현금을 안 받습니다.서울 강남의 한 단속 현장에서만 10분에 1대꼴로 체납 차량이 적발됐습니다.억대의 세금을 안 낸 차량은 단속 현장에서 곧바로 압류됐습니다.전종환서울시 38세금징수과세금 8건에 1억 8500만 원이 체납돼 있는데 납부하지 않아서.자동차세와 차량 과태료 체납액은 8875억 원.전체 등록 차량 10대 중 1대꼴로 자동차세를 내지 않고 있고 부과된 과태료를 내지 않고 버티는 경우도 40가 넘습니다.단속을 통해 압수당한 번호판은 지자체나 금융기관에 체납액을 내야 되찾을 수 있습니다.세금을 계속 내지 않고 번호판을 찾아가지 않는다면 공매 처분 절차에 들어갑니다
120명 탑승 미얀마 군용기 실종…"해상에서 잔해 발견"	http://news.naver.com/main/read.nhn?oid=001&sid1=104&aid=0009321035&mid=shm&viewType=pc&mode=LSD&nh=20170607224717	사고 기종 중국산 Y8 중형 수송기탑승자 대부분 군인 및 가족방콕 김상훈 특파원  미얀마에서 120명의 승객과 승무원을 태운 군용기가 실종됐다고 현지 언론과 외신이 7일이하 현지시간 보도했다.    미얀마군 당국은 페이스북에 게시한 민 아웅 흘라잉 최고사령관 명의의 성명을 통해 이날 오후 1시35분한국시간 오후 4시5분께 군인과 군인가족 등을 태운 군 수송기가 남부 타닌타리구의 다웨이 서쪽 해상에서 교신이 끊겼다고 밝혔다.    당국에 따르면 사고기는 오후 1시6분께 남부 안다만해의 항구도시 메르귀를 출발해 최대 도시 양곤으로 향하던 중이었다.     당국은 애초 사고기에 승객 90명과 14명의 승무원 등 모두 104명이 탑승했다고 밝혔으나 이후 승객 수를 106명으로 정정했다.    사고 직후 군 당국은 항공기와 선박을 투입해 수색에 나섰고 다웨이시 남쪽 218 지점 해상에서 비행기 잔해를 발견했다고 AFP통신이 전했다.    익명을 요구한 미얀마 공군 관계자는 여러개의 잔해가 발견됐다고 확인했다.    메르귀시의 한 관리는 부서진 기체 일부가 다웨이 남쪽 해상에서 발견됐다. 해군이 수색작업을 계속하고 있다고 전했다
이미 4개월 전에도 광운대역서…철도공사 직원 사고	http://news.naver.com/main/read.nhn?oid=437&sid1=102&aid=0000155912&mid=shm&viewType=pc&mode=LSD&nh=20170607220629	구의역 지하철 사고 1년여 만에 최근 철도공사 직원이 업무 중 숨지는 사고가 났는데요. 사고가 일어난 광운대역 앞에 시민 분향소가 차려졌다는 소식을 어제6일 전해드렸습니다. 그런데 이미 넉 달 전에도 해당 역에서 비슷한 사고가 발생했던 것으로 확인됐습니다.기자지난 1월 광운대역에서 업무 중이던 철도공사 직원 양모 씨가 화물차에서 내리다가 다리를 다쳤습니다.다행히 더 큰 사고로 이어지지는 않았지만 양 씨는 인력 부족이라는 근본적인 문제 때문에 사고가 난 거라고 말합니다.양모 씨철도공사 직원  오전에 3명 오후에 3명 번갈아가면서 보통 일을 해요. 그땐 제가 오전에도 하고 오후에도 했었어요.안전 수칙 상 하루 근무 인원은 6명이어야 하는데 사고 당일에는 4명 뿐이어서 정상적으로 이뤄져야 할 교대 근무가 어려웠다는 얘기입니다.노조 측은 사고 이후 인력 부족 문제를 항의했던 다른 동료가 부당 전출됐다는 의혹도 제기했습니다.양 씨와 같은 근무조였던 이모 씨가 과다한 업무에 따른 고충을 관리역장에게 호소했는데 이틀 뒤 다른 역으로 발령이 났다는 겁니다.이모 씨철도공사 직원  사전에 제가 인지도 못했고 발령 난다는 얘기도 못들었고 공문도 없이 구두로다가 통보를 받았습니다.철도공사 측은 이 씨에 대해 때가 돼서 발령이 난 것이라며 절차 상 문제가 없었다고 말했습니다.인력 부족이 사고의 원인이라는 지적에 대해서는 적정 인원을 다시 산정하는 방안을 검토하고 있다고 밝혔습니다.kr JTBC 뉴스 공식 SNS 트위터 페이스북 유튜브Copyright by JTBChttpjtbc
'생태통로가 죽음의 통로로'…4대강 보 방류에 어도 '기능..'	http://news.naver.com/main/read.nhn?oid=448&sid1=102&aid=0000212687&mid=shm&viewType=pc&mode=LSD&nh=20170607220710	정부가 지난 1일부터 4대강에 있는 보 6곳의 수문을 열었습니다. 그런데 가뭄으로 수위가 낮아지면서 물고기의 이동통로인 어도에 물이 끊겼습니다. 물고기 생태통로가 죽음의 길로 변했습니다.리포트낙동강 보 옆의 어도가 바닥을 드러냈습니다. 물고기와 민물새우는 모두 말라 죽었습니다. 물길이 끊긴 어도에는 수초가 썩으면서 악취마저 풍기고 있습니다. 강정고령보에 만든 어도 2곳 모두 물 한 방울 없습니다. 임시몬  대구시 남구하여튼 바닷가 비린내 냄새가 나요. 냄새가 조금 고약하고 물이 마르고 나서 그렇지 않나 생각이. 영산강 죽산보도 수위가 2.5m로 1m 낮아지면서 어도에 물이 끊겼습니다. 허행윤  한국수자원공사 죽산보관리차장수위 2.9m 이상이 돼야 어도가 정상적으로 운영되는 상태입니다. 물고기가 알을 낳기 위해 상류로 올라가는 유일한 통로가 막혔습니다. 환경단체는 보 수문을 완전히 열어달라고 요구합니다.임희자  낙동강살리기네트워크 집행위원장수문이 확 열려 버리면 오히려 수위가 확 낮아지고요. 그걸 통해서 상 하류로 물고기가 오갈 수 있도록. 설계 단계부터 지하 어도를 만들어야 한다는 주장도 나옵니다. 이영재  경북대 토목공학과 교수4월과 5월 겨울에는 10월과 11월 이때 반드시 물이 있어야 하는데 우리나라가 계절적으로 갈수기라고 그래요. 4대강 방류에 가뭄까지 겹치면서 어도가 무용지물이 됐습니다
