1점만 깎여도 '덜덜'…고객 만족도에 떠는 AS기사들	http://news.naver.com/main/read.nhn?oid=056&sid1=102&aid=0010423783&mid=shm&viewType=pc&mode=LSD&nh=20170224222127	앵커 멘트휴대전화를 수리하는 서비스 기사들이 고객 몰래 휴대전화의 설정을 바꿔서 본사의 전화나 문자 메시지를 받지 못하게 하는 사례가 속출하고 있습니다.  고객이 서비스 만족도 평가를 하지 못하게 하려고 그러는 것인데 그 속사정을 들여다 봤습니다. 리포트 휴대전화를 수리하러 서비스센터에 방문했던 김모 군은  수리를 받은 후  서비스센터의 전화 번호가 차단되도록 전화 설정이 바뀌어있다는 사실을 우연히 알게 됐습니다.녹취 김OO휴대전화 설정 변경 피해자음성변조  수리 기사가 친절하셨는데 차단하셨더라고요. 이걸 왜 차단했나 생각이 들더라고요. 인터넷에는 김 씨와 유사한 경험을 했다는 사연이 계속 올라오고 있습니다. 서비스 만족도 평가를 하지 못하도록 본사 전화번호나 특정 문자를  스팸 처리해 놓았다는 겁니다. 수리기사들은 서비스 만족도가 만점에서 단 1점만 깎여도  불이익을 받기 때문이라고 말합니다.녹취 휴대전화 수리 기사음성변조  저도 솔직히 안 했다고 말할 수 없고 진짜 정직하게 하는 엔지니어 아닌 이상은 웬만하면 꼼수를 조금씩은 다 그런식으로 해서. 수리 기사가 촬영한 영상입니다. 다른 직원들이 보는 앞에서 고객 응대법을 큰 소리로 읽게 합니다.녹취 휴대전화 수리 기사음성변조  이제 이 부품은 교체하였으니 오래 사용하실 수 있습니다. 퇴근 후 교육이 이어지기도 합니다.녹취 휴대전화 수리 기사음성변조  자동으로 맞춰놓을 시. 와 이거 잘 안 되네. 심장이 튀어나올 것 같지. 보통 2백만 원 안팎인 월급이  최대 50만 원까지 깎이기도 하고  고용 자체가 불안해질 수도 있습니다.녹취 휴대전화 수리 기사음성변조  고객 만족도 점수가 좋지 않을 경우에 원청 회사와의 계약이 해지되는 경우가 생겨요. 그럼 너 하나 때문에 전체가 그렇게 될 거 아니냐. 휴대전화 업체들은  만족도 조사를 개선하겠다고 밝혔습니다.인터뷰 휴대전화 제조업체 관계자음성변조  향후 이같은 사례가 재발하지 않도록 최선을 다해서 노력하겠습니다
"휴학하면 채용 불이익" 제안…황당한 저출산 대책	http://news.naver.com/main/read.nhn?oid=055&sid1=102&aid=0000507795&mid=shm&mode=LSD&nh=20170224224303	지난해 출생아 수가 역대 최저를 기록할 정도로 저출산 문제는 심각합니다. 어떻게든 아이 하나 더 낳도록 정책 펴는 건 좋은데 국책기관의 연구원이 너무 황당한 출산장려 대책을 내놨습니다.기자보건사회연구원의 한 연구위원은 결혼하지 않거나 늦게 결혼하는 풍조가 출산율을 낮춘다고 지적했습니다.어떻게든 혼인율을 높여야 한다는 겁니다.기업과 공공기관의 협조를 얻어 휴학하거나 연수 다녀오느라 늦게 졸업한 학생들에게 채용 시 불이익을 주자고 제안했습니다.원종욱보건사회연구원 선임연구위원  불필요하게 스펙을 쌓으면서 결혼 시장에 늦게 들어오는 현상을 막을 수 있다고 봅니다.빨리 짝을 찾을 수 있도록 가상현실을 이용해 배우자를 탐색하는 프로그램도 제시했습니다.앵커빨리 결혼해서 애 낳아야 하니까 휴학하면 채용할 때 불이익을 주자. 어떻게 이런 대책을 생각해낼 수가 있는 거죠기자결혼 문제를 경제학적으로 분석해봤다고 합니다.교육에 투자하는 기간을 줄이고 결혼 상대를 찾는 시간을 줄이면 결혼할 확률이 높아진다는 건데요 이 대책의 실현 가능성도 의문이지만 학생들이 휴학하고 스펙 쌓을 수밖에 없는 답답한 현실에 대해 고려를 하지 않은 것 같습니다.앵커저출산 문제를 경제학으로 해결할 수 있습니까기자이번 대책을 내놓은 연구위원은 연금을 오랫동안 연구해온 경제학 박사입니다.어떤 대책도 저출산 관련해 효과가 없다 보니 고육지책으로 경제학적 해석을 해보자 해본 것 같은데요 발상의 전환도 좋지만 결혼을 너무 비용 측면으로만 바라보다 보니 현실과 동떨어진 해결책이 나온 것 같습니다.앵커연구원 한 사람의 의견이긴 하지만 공식적인 자리에서 나온 대책이라서 웃어넘길 수만은 없는 것 같아요. 그리고 특히 보건사회연구원은 보건복지 관련 정책의 틀을 만드는 국책연구기관입니다.연구원 한 명 한 명의 연구 결과가 국가 정책에 영향을 미칠 뿐 아니라 파급효과가 크기 때문에 더 신중해야 하겠습니다
'불소추 특권' 대통령의 무기…'조건부 기소중지' 의미	http://news.naver.com/main/read.nhn?oid=055&sid1=100&aid=0000507784&mid=shm&mode=LSD&nh=20170224224211	특검은 또 박근혜 대통령을 조건부 기소중지할 계획이라고 밝혔습니다.조건부 기소중지라는 게 어떤 의미인지 윤나라 기자가 QA 리포트에서 짚어봤습니다.기자수사종료시점에 그때까지 조사된 혐의에 대해서 조건부 기소중지대통령 수사와 관련해 특검이 밝힌 방침입니다.조건부 기소중지라는 게 뭘까요수사기관이 범죄 피의자를 수사하고 혐의가 인정되면 기소 즉 재판에 넘깁니다.그런데 어떤 상황 때문에 수사나 기소를 할 수 없으면 이 상황이 해소될 때까지 중지했다가 수사와 기소를 다시 하겠다는 게 조건부 기소중지입니다.그럼 대통령에게 조건부 기소중지 조치를 내린 것 왜일까요대통령에겐 내란이나 외환죄가 아닌 이상 기소되지 않는다는 불소추 특권이라는 무기가 있습니다.때문에 현직 대통령이란 조건이 없어질 때까지 기다렸다가 수사와 기소를 다시 하겠다는 의미로 특검이 조건부 기소중지 조치를 내린 겁니다.조건부 기소중지 대통령 측에선 어떻게 받아들일까요박 대통령 측은 기소가 안 되는 대통령에 대해선 기소중지도 내릴 수 없다고 주장했습니다.하지만 특검은 수사를 잠시 중단하는 조치로 법리적 문제가 없다고 반박했습니다.조건부 기소중지는 박 대통령의 혐의에 대한 수사를 계속해야 한다는 정당성을 마련해둔 셈이 되는 만큼 대통령 측에선 압박으로 받아들일 수 있을 겁니다.그렇다면 앞으로 수사는 어떻게 진행될까요대통령이 탄핵 되거나 임기를 마치면 수사가 다시 시작됩니다.그런데 특검 수사는 이달 말로 만료됩니다
 "월 고소득 보장" 일자리 광고 따라 가보니	http://news.naver.com/main/read.nhn?oid=214&sid1=102&aid=0000743340&mid=shm&viewType=pc&mode=LSD&nh=20170224211003	중장년 일자리 누구나 할 수 있다 매달 300만 원 수익 창출일자리 하나가 간절한 요즘 같은 때 별다른 조건도 없이 이렇게 높은 소득을 보장한다는 광고가 적지 않습니다.한 일자리 광고의 실태를 추적해 봤습니다. 리포트 스마트폰만 있으면 누구나 쉽게 배워 돈을 벌 수 있다는 일자리 광고.1주일 뒤엔 문구를 살짝 바꿔 수익 창출 설명회라고 선전하며 선착순이라고 강조합니다.문자로 참가 신청을 한 뒤 안내된 장소로 가 봤습니다. 지금 3번 출구 앞인데요. 출구에서 50미터 앞으로만 나가면 빌딩이 있어요.역시 광고를 보고 왔다는 중장년 구직자들이 모여 있습니다. 잠시 후 미국에서 동영상 사이트를 연구했다는 자칭 정 박사가 등장하고 참가비 1만 원씩을 걷더니 동영상을 많이 찍어 올리면 돈을 벌 수 있다고 설명합니다.구직자 모집인돼지인데 사람처럼 생겼죠  하루에 영상을 1천 개 올린다고 하면 한 달이면 3만 개 한 달에 1억 이상 번다 이거예요.그러면서 제대로 배우려면 추가 비용이 필요하다고 말합니다.회비 30만 원 가지고 배우시지. 등록하면 완전히 배울 때까지 가르쳐주니까.이어서 들고 나온 건 건강보조 식품.다단계업체 사업자 A당뇨 수치가 엄청나게 떨어져요. 누구세요 문을 딱 여니까 사러 온 거야. 그러더니 다단계 판매를 권하기 시작합니다.다단계업체 사업자 B지금은 월 수입이 거의 1500만 원 정도 되거든요. 35만 원부터 제품 한 줄 마케팅이에요. 본사가 바로 건너편에 있습니다.다른 건물로 사람들을 데려가더니 졸지에 다단계 설명회로 바뀐 일자리 설명회.큰돈을 벌었다는 홍보 영상을 틀어주고매달 빠듯하기만 한 월급쟁이들에게는 꿈도 못 꿔볼 얘기죠 쉽고 누구나 할 수 있습니다. 화이팅당장 사업을 시작하라고 부추깁니다.다단계업체 회장신이 내린 최고의 선물이 다단계입니다. 지금도 복 받고 있는 거죠 그죠결국 일자리를 주겠다며 사람들을 모은 뒤 판매를 유도하는 신종 다단계 방식인 셈입니다.다단계업계 관계자회사에서 주도적으로 개입을 하면 문제가 될 수 있을 것 같은데 상식적으로 그렇게 하는 회사는 거의 못 봤거든요
소라넷 폐쇄 8개월…세상은 바뀐 게 없다	http://news.naver.com/main/read.nhn?oid=032&sid1=102&aid=0002767531&mid=shm&viewType=pc&mode=LSD&nh=20170224203254	디지털 성폭력 추방 단체 DSO 하예나 대표포르노사이트 소라넷 전격단속이라는 제목의 경향신문 기사는 강남경찰서가 해외에 서버를 두고 회원수 60만명의 소라넷을 운영한 임모씨에 대해 구속영장을 신청하고 호주에 체류 중인 사이트 대표 박모씨 등 4명을 인터폴과 공조해 추적 중이라고 보도했다. 원천봉쇄 차원에서 일괄 처벌이 불가피하다는 경찰 관계자의 목소리를 담은 이 기사는 무려 2004년 6월18일자다. 이 기사 밑에 달린 2013년 5월31일 지금도 소라넷 잘 돌아가네요라는 댓글은 소라넷의 끈질긴 생명력을 보여준다. 2016년 6월6일 소라넷이 공식 폐쇄를 선언했다. 소라넷의 천적은 경찰도 언론도 아닌 2015년 10월 개설된 소라넷고발프로젝트라는 이름의 작은 단체였다. 초대남공범을 모집해 술 취한 여성을 대상으로 강간 모의를 하는 정보 창구 역할을 했던 소라넷을 실시간 모니터링하고 이를 사법당국에 고발했던 그 단체는 과연 소라넷 폐쇄라는 소기의 목적을 달성한 뒤 예정된 해피엔딩을 맞았을까. 지난 13일 서울 마포구의 한 카페에서 디지털성폭력아웃cafe.netRpo 이하 DSO의 하예나 대표를 만났다. 소라넷이 없어지면 모든 문제가 해결된다는 이들도 있었지만 그렇지 않았어요. 취중 강간에만 집중하다보니 소라넷뿐 아니라 인터넷 전반에 광범위하게 확산된 몰카 성폭력에 힘을 쓰지 못한 것이 아쉬워졌죠. 그래서 이들은 2016년 3월 팀을 재결성했다. DSO의 조사에 따르면 몰카 게시물은 휴대폰 카메라가 상용화된 2001년 온라인에 올라오기 시작해 스마트폰이 보급된 2011년부터 급증했다. 상승세가 잠시 주춤했던 때는 휴대폰 촬영 시 찰칵 하는 신호음이 의무화된 2006년 무렵이 유일했다. 사무실에서 인터넷에 유통되는 성폭력 동영상을 모니터링하고 있는 디지털성범죄 아웃DSO의 하예나 대표.결성 초반에는 하 대표가 아르바이트를 해 활동비를 채웠다. 강연 요청이 늘어나며 수입이 생기고 후원금이 늘고 있지만 여전히 월세 내기도 빠듯하다. 열악한 환경을 지탱하게 하는 힘으로 하 대표는 동료를 꼽았다. 3기까지 이어져오며 많은 대화를 통해 운영방식을 개선해왔다. 20대 초반의 하씨가 대표를 맡은 것이나 서로의 본명을 언급하지 않고 닉네임활동명으로 뭉친 것은 총장 사퇴를 요구하며 본관 점거농성을 할 때 서로를 벗으로 부르면서 수평적인 입장에서 연대했던 이화여대생들을 연상시킨다. 하 대표의 닉네임인 하예나는 모계사회를 이루는 대표적인 동물 하이에나에서 따왔다. 지구력이 강한 면도 닮고 싶다고 했다. 부모님이 아들인 오빠에게는 재수를 허락하면서 저에게는 안된다고 하셨어요. 실제 재수학원에 가보니 남자반은 4개인데 여자반은 한 반밖에 없더라고요. 성장하면서 느껴왔던 의문이 실제 불합리한 차별이었다는 걸 깨닫게 되면서 학업을 미루고 페미니즘 활동을 하다가 이곳에 합류하게 됐죠.  DSO 사무실에는 상주 활동가 4명 외에 고양이 3마리가 있다. 하루 종일 인터넷에서 성범죄 영상을 찾아다녀야 하는 정신적 고통을 정화하기 위해 의지하는 존재들이다. 모니터링팀에서 강간 모의를 포착해 직접 경찰서를 찾은 것이 지난달만 해도 4번이다. 아마추어였던 멤버들은 어느덧 동영상 편집 프로그램과 관련 법률의 달인이 됐다. 하 대표는 무엇보다 고통스러운 것은 강간 모의를 신고해도 장난일 거라며 무대응으로 일관하는 경찰이라고 했다. 내가 피해자가 되더라도 경찰은 도와주지 않겠구나 싶은 생각은 하 대표가 이 일에서 손을 뗄 수 없게 만들었다. 직접 문을 두드리는 피해자에게 대응 절차를 안내하는 것도 무게를 두는 업무 중 하나다. 최근에도 DSO는 남성이 우는 여성에게 폭력을 휘두르며 강간하는 모습이 담긴 영상 한 건을 신고했다. 그 영상은 지금도 인터넷에서 검색이 가능하다고 했다. 야동의 전파력은 바퀴벌레에 비할 수 없을 정도다. 하 대표는  야동이 아니라 성범죄영상으로 불러야 한다고 주장했다. 한 시트콤을 통해 야동 순재 캐릭터가 인기를 끌었을 당시 음란물 관련 검색트렌드가 34배 증가했다. 귀여움을 끼얹은 야동이 익숙한 대중어가 되는 사이 죄의식은 지워졌다는 것이다. 야한 동영상 야릇한 동영상의 주인공은 직업 배우가 아니라 일반인으로 대체된 지 오래다. 한국에서 포르노 유통 및 제작은 엄연히 불법이지만 일반인 여성 대상 성범죄 동영상은 국산 야동이란 애칭까지 얻어 유통되고 있다. 하 대표가 개인 간 파일을 공유하는 P2P사이트에서 국산이란 단어를 검색창에 넣자 1만3800개의 게시물이 쏟아졌다. 그는 음란물이라는 말 자체를 사용하면 안된다. 음란물 자체가 가해자 시점의 단어이기 때문이라고 말했다. 여중생을 집단 강간한 후 유기해 사망에 이르게 한 가해 학생들은 방송 인터뷰에서 포르노를 보고 따라했다고 당당하게 말했습니다. 하지만 과연 그게 포르노였을까요 그들이 본 것은 범죄 영상이었어요. 성범죄를 즐기고 범죄를 성으로 인식한 거죠. 법무부 통계에 따르면 몰래카메라 피해자의 95는 여성이고 그중 절반 이상인 54가 1020대였다.  성범죄 사이트는 반드시 단짝과 함께한다. DSO의 조사에 따르면 해당 사이트의 85.5에서 최음흥분제 같은 불법 약물 광고가 발견됐다. 여성의 성적 대상화도 심각한 수준이다. 일반인 여성 카테고리가 버젓이 존재한다. 교복 입은 여고생의 단체 사진 일반 여성의 얼굴 셀카도 단골 게시물이다. 이제 여성은 존재하는 것만으로도 음란물이 되었다며 한숨을 내쉬던 하 대표는 무서운 건 그 사진을 올리는 이들이 그 사람들의 지인이라는 점이라고 덧붙였다. 스마트폰 보급률 90가 넘는 대한민국에서 누구나 몰카 피해자가 될 수 있다는 말은 이제 진부할 정도지만 가해자에 대한 관련 법률이나 처벌은 여전히 미미하다. 경찰청 카메라이용촬영 범죄 통계에 따르면 2015년 관련 범죄 신고율은 5년 전보다 6배가량 증가했고 검거율은 97. 그러나 실제 처벌로 이어지는 기소율은 31. 피해자들에 대한 사회적 낙인은 더욱 심각한 문제다. 찍힌 사람 잘못 아니야라는 말은 2차 가해와 다를 바 없다. 그러다보니 피해자들은 법의 힘보다 자신의 모습이 찍힌 불법 동영상을 삭제하기 위해 디지털 장의사에게 의지하게 된다. 하 대표는 피해자들이 불법 동영상 삭제를 업체에 맡기면 한 달에 드는 돈만 300만원이라더라. 12개월분을 결제하면 할인해 준다는 얘기도 들었다면서 피해자 보호를 위한 사법적 시스템이 필요하다. 신호등이 있다고 모든 교통사고를 방지할 수 있는 건 아니지만 있고 없고의 차이는 크지 않나라고 말했다. 인터뷰를 진행하면서 하 대표의 얼굴 사진을 촬영했다. 그러나 여러 가지 이유로 게재하지 않기로 결정했다. 얼굴이 노출되면 하예나라는 여성 개인을 지키는 것이 힘들어질 수 있다는 우려가 가장 컸다. DSO는 그동안 남성혐오 조장을 위해 만들어진 단체라는 비난부터 여성가족부 산하 조직이라는 오해까지 받아왔다. 원초적인 욕설은 오히려 공공기관에 디지털 성범죄의 현실을 전하는 데 도움이 됐다고 말할 정도로 단단해졌지만 시위에 나선 이대생들의 얼굴을 가린 마스크처럼 아직 이 땅의 여성들에게는 최소한의 방패가 필요하다. 하 대표는 더 이상 저희가 이런 활동을 하지 않아도 되도록 여성의 기본권을 지킬 수 있는 엄격한 법안이 만들어지길 바란다고 말했다
성추행에 음주사고까지, 엇나간 신입생 환영회 '골머리'	http://news.naver.com/main/read.nhn?oid=214&sid1=102&aid=0000743337&mid=shm&mode=LSD&nh=20170224213408	대학 신입생 환영회가 성추행과 군기 잡기 음주사고 등으로 얼룩지고 있습니다.한두 해 문제가 아닌지라 아예 신입생 환영회를 취소하는 학교도 있습니다.  리포트 지난 17일 저녁 서울 화양동의 한 주점.건국대 2학년 남학생이 여학생을 성추행했습니다.파문이 커지자 대학 측은 신입생 맞이 행사 자체를 취소했습니다.지난 22일 강원도 고성의 콘도에서는 신입생 환영회에 온 학생의 손가락 3개가 절단되는 일이 일어났습니다.술에 취해 엘리베이터 기계실에 들어갔다가 다친 것으로 경찰은 보고 있습니다. 경찰술 마신 상태에서 그렇게 된 것 같은데 엘리베이터에 손이 끼고요같은 날 신입생 환영회에 가던 버스가 언덕 아래로 추락하는 사고도 일어났습니다.일부 대학에서는 신입생에게 얼차려를 주거나 90도 인사를 강요하는 등의 구태도 여전합니다.이 때문에 환영회 자체를 취소하는 대학들도 나오고 있습니다.학생친구 만날 수 있고 좋은데 그런 기회가 없다는 게 아쉽죠
포스코도 전경련 탈퇴…권오준 회장, 전경련 부회장 물러나	http://news.naver.com/main/read.nhn?oid=001&sid1=101&aid=0009063397&mid=shm&viewType=pc&mode=LSD&nh=20170224204859	이달 중순 탈퇴 의사 밝혀 고은지 김연정 기자  포스코도 4대 그룹에 이어 전국경제인연합회 탈퇴 행렬에 동참했다.    24일 재계에 따르면 포스코는 이달 중순께 전경련에 탈퇴 의사를 밝혔다.    포스코 관계자는 일단 탈퇴 의향을 표시한 것이고 아직 전경련으로부터 이에 대한 답변은 듣지 못했다면서 새로운 회장단이 꾸려진 만큼 조만간 응답이 올 것으로 본다고 말했다.    이와 관련 전경련은 포스코가 전경련에서 탈퇴한 것이 맞다고 확인했다.    포스코가 전경련을 탈퇴하기로 한 것은 앞서 전경련을 떠난 4대 그룹과 마찬가지로 사회적 비판 여론 등을 고려한 결정으로 알려졌다
"서당도 학원", 당혹스러운 청학동 "학원 등록 무리"	http://news.naver.com/main/read.nhn?oid=214&sid1=102&aid=0000743347&mid=shm&viewType=pc&mode=LSD&nh=20170224210837	서당을 학원으로 봐야 할지를 두고 법정 다툼에서 대법원이 1 2심의 결과를 뒤집고 서당도 학원이라고 판결했습니다.지리산 청학동 서당촌은 당혹스럽다는 반응입니다. 리포트 학생들이 서당에서 예절과 한자 교육을 받고 있습니다.서당은 그동안 학원이 아니어서 별다른 규제 없이 운영됐습니다. 혼란은 법정 다툼에서 시작됐습니다.지난 2013년 청학동의 한 훈장이 미등록 학원을 운영했다며 기소됐는데 1 2심은 학원이 아니라며 무죄판결을 내렸습니다. 하지만 대법원은 상고심에서 무죄를 선고한 원심 판결을 깨고 사건을 창원지법 항소부에 돌려보냈습니다. 지식이나 기술을 교습하면 학원에 해당된다는 학원법에 따라 방과 후 숙제 지도나 교과 과목을 가르쳤다면 서당도 학원이라는 겁니다.청학동의 서당 상당수는 본래의 취지를 무시한 판결이라며 현재 규모로는 학원 등록이 쉽지 않다고 하소연합니다. 강동의청학동 풍교헌 서당 훈장법리적 해석으로만 접근하면 일리가 있지만 현실적 측면에서 보면 무리가 많아요.대법원 판결로 관리 책임을 떠맡게 된 교육청도 혼란스럽기는 마찬가지입니다.경남 하동교육청 관계자서당이 어느 기관에서 관리나 법적 근거를 갖고 관리하지는 못했었거든요. 서당에 관련된 자료가 확실치는 않은 것 같거든요
'채용 비리' 중진공 전 이사장 등 2명에 징역 2년 구형	http://news.naver.com/main/read.nhn?oid=001&sid1=101&aid=0009063387&mid=shm&mode=LSD&nh=20170224202030	검찰 채용 외압 의혹 최경환 의원 내달 2일 조사 예정안양 강진욱 기자  최경환자유한국당 의원 사무실 인턴사원 채용 비리와 관련해 업무방해 혐의로 기소된 중소기업진흥공단 박철규 전 이사장과 권모 전 운영지원실장에게 각각 징역 2년이 구형됐다.    검찰은 24일 오후 수원지법 안양지원에서 열린 재판에서 이같이 구형했다.수원지검 안양지원 전경검찰은 이전 재판에서 피고인들의 업무방해 혐의가 드러났다며 처벌이 불가피하다고 밝힌 바 있다.    이날 재판에서 두 피고 측 변호인들은 공소 사실 대부분을 인정할 수 없다며 무죄를 주장했다.    이들에 대한 선고는 다음달 24일 이뤄질 예정이다.    한편 최 의원은 이들의 채용 비리 혐의와 관련해 다음달 2일 검찰 출석을 통보받은 상태다.    박 전 이사장은 지난해 9월 재판에서 2013년 8월 1일 최 의원을 국회 원내대표실에서 독대할 때 최 의원으로부터 최 의원실 인턴 직원 황모씨 채용 압력을 받았다고 밝힌 바 있다
