차은택 "김성우 前 청와대 홍보수석도 최순실 인사"	http://news.naver.com/main/read.nhn?oid=001&sid1=100&aid=0008982196&mid=shm&mode=LSD&nh=20170123231028	김수석측 최순실과 일면식 없어정상적으로 추천받아 임명춘추관에 들어서는 홍보수석 백승렬 기자  김성우 홍보수석이 19일 춘추관에서 이석수 특별감찰관이 한 언론사에 감찰내용을 유출했다는 의혹 보도와 관련 청와대 입장을 발표하기 위해 들어서고 있다.kr 끝       방현덕 채새롬 김예나 기자  지난해 10월 교체된 김성우 전 청와대 홍보수석비서관이 비선실세 최순실씨의 추천을 통해 청와대에 입성했다는 증언이 처음으로 나왔다.     최씨의 최측근인 문화계 황태자 차은택씨는 23일 헌법재판소에서 열린 박근혜 대통령 탄핵심판 8차 변론기일에서 김 전 수석의 임명에 최씨의 영향이 미쳤다고 인정했다.    차씨는 2014년 말2015년 초 최씨가 자신에게 김 전 수석의 프로필을 보여주면서 아느냐고 물어봤으며 직접 만나서 정치적 성향이 어떤지 홍보수석을 맡을 의향이 있는지 알아보라고 지시했다고 말했다.    이에 그는 자신과 가까운 송성각 전 한국콘텐츠진흥원장을 김 전 수석과 만나게 했고 의사를 확인한 뒤 최씨에게 전달했으며 이후 김 전 수석이 실제로 임명이 됐다고 진술했다.     차씨는 지금까지 자신이 소개한 여러 명이 산하기관 정부 조직 등에 채용되는 과정에서 최씨가 영향을 끼친 것이 맞느냐는 질문에 그렇다고 답했다.    SBS 전무 출신인 김 전 수석은 2015년 2월 홍보수석에 임명됐으며 비선실세 의혹이 본격화된 지난해 10월 초 차씨와 접촉해 증거 인멸 등을 꾀했다는 의혹을 받았다.    그러나 김 전 수석의 임명 과정을 잘 아는 한 관계자는 와의 통화에서 김 전 수석이 2015년 1월 청와대 사회문화특보로 위촉되고 난 뒤 몇 분으로부터 홍보수석을 천거했다는 이야기를 들었다고 한다며 김 전 수석은 최순실씨와 일면식도 없다고 차씨의 주장을 반박했다
물가 못 따라가는 퇴직연금 수익률… 이러다 '쪽박'	http://news.naver.com/main/read.nhn?oid=022&sid1=101&aid=0003139182&mid=shm&mode=LSD&nh=20170123230827	7년 34 수익 물가 못 따라가입사 1년차에 접어든 이모29씨. 퇴직연금 신규가입 대상자가 되었다는 인사팀 공지를 받고 막막해하던 차에 같은 부서 선배로부터 손해를 보지 않으려면 무조건 원금보장형 상품에 가입하라는 조언을 들었다. 금융 새내기 9명의 동기들도 모두 이씨를 따라 원금보장형 상품에 줄줄이 가입했다. 수익률이 적지만 손해를 봐선 안 된다는 생각에서였다. 하지만 이씨처럼 원금보장형 상품에 퇴직연금을 넣어둔 사람들은 물가상승률을 감안할 경우 사실상 손해를 본 것으로 나타났다.23일 금융감독원에 따르면 퇴직연금 적립금 중 가장 큰 비중을 차지하는 확정급여형DB형 기준으로 지난 7년간 금융사들의 평균 수익률은 원리금보장형의 경우 34 수준에 그쳤다. 금감원에 따르면 현재 대다수 회사들은 총 적립금의 97.3를 손실회피 목적으로 예적금을 비롯한 원리금보장형 상품에만 투자하고 있었다.문제는 장기적으로 봤을 때 이런 원금보장형 상품의 수익률이 비보장형 상품에 비해 현저히 떨어진다는 점이다. 지난해 9월 말 기준으로 7년 수익률이 가장 높은 곳은 하나금융투자로 4. 소비자물가 상승률을 감안하면 사실상 마이너스 수익률인 셈이다. 원금보장형 상품 가입률이 현저히 높은 한국의 현행 DB형 퇴직연금제도는 노후보장이라는 퇴직연금 본연의 취지를 살리지 못하고 있는 셈이다.반면 대다수의 원리금비보장형 상품들의 수익률은 보장형에 비해 평균 23배 높았다. 교보생명의 7년 수익률이 11.89로 가장 높았고 삼성화재 8.연금전문가들은 퇴직연금이 실질적인 노후보장 기능을 갖기 위해서 기금형 제도를 도입할 필요가 있다고 권고한다. 이는 직장별로 자금을 운용했을 때 생길 수 있는 과도한 책임위험부담을 해소하기 위해 다수의 사용자들이 독립된 전문기관수탁법인을 설립해 퇴직연금을 맡기고 대신 운용하게 하는 제도다.퇴직연금 가입률 제고도 시급한 과제다. 고용노동부에 따르면 2016년 2분기 현재 30인 미만 중소영세사업체의 퇴직연금 도입률은 15. 전체 사업체를 대상으로 해도 17. 또한 전체 연금수급자의 98.4가 퇴직급여를 중도해지하거나 연금 납부기간 만료 후 일시금으로 수령해 사실상 연금수급 비율은 1. 퇴직연금이 연금으로서 기능할 수 있도록 제도 개편이 필요한 대목이다
모의탄 규정보다 낮게 발사 훈련병 중상	http://news.naver.com/main/read.nhn?oid=056&sid1=100&aid=0010411135&mid=shm&mode=LSD&nh=20170123214508	앵커 멘트육군 논산훈련소에서 전투 훈련 중이던 병사가 모의탄에 맞아 크게 다친 사실이  KBS 취재 결과 확인됐습니다.인근 주민들의 소음 민원에 공중으로 쏴야 하는 모의탄을 훈련병들이 있는 훈련장으로  낮게 쏜 것으로  확인됐습니다. 리포트 지난해 9월 육군 논산훈련소에서 전투 훈련이 실시됐습니다. 훈련장 중간쯤에 10여 명의 훈련병들이 엎드려 명령을 기다리던 순간. 한 훈련병 다리 사이에서  폭발이 일어났습니다.녹취 목격 훈련병음성변조   옆 쪽에서 펑 소리가 나면서 연기가 올라온 거예요. 급하게 뛰어갔는데 비병을 지르면서 누워있었고 하반신 바지가 다 날아가서. 전장 분위기를 내기 위해 사용하는 공중폭발모의탄이  21살 김 모 훈련병 다리 사이에서 터진 겁니다.녹취 김 모 씨부상 훈련병음성변조  갑자기 눈 앞이 핑하면서 눈을 떠보니까 다리에 피가 많이 나고 되게 까맣더라고요 다리가. 저는 처음에 주머니에 연습용 수류탄이 있는데 그게 터진 줄 알았거든요. 곧바로 병원으로 옮겨졌지만 김 훈련병은 심한 화상을 입고 청력도 손상됐습니다. 육군 교범은  사고를 막기 위해 훈련장 바깥쪽 그것도 공중 45도 각도로 모의탄을 쏘도록 규정하고 있습니다.녹취 육군 교육사령부 관계자음성변조  민원이 들어왔기 때문에 훈련소장이 그날 현장에 있었고 어느 방향으로 격발을 해라 하는 위치까지 다 잡아주고 화재 문제로 인해서 각도를 좀 낮춰서 쏘라고. 인근 주민들의  소음 민원을 줄이기 위해 훈련소장이 모의탄을 낮게 쏘라고 지시했다는 건데 훈련소장의 참모는 모의탄 발사 부사관에게  명령을 전달했습니다. 해당 부사관은 훈련병들이 있으니 사격하지 말자며 시야가 안 보인다는 수신호도 보냈지만 계속된 명령을 따를 수밖에 없었다고  피해 훈련병 부모에게 말했습니다
최유정·홍만표 변호사 5년 금지…우병우 과태료 1천만원	http://news.naver.com/main/read.nhn?oid=421&sid1=102&aid=0002525063&mid=shm&mode=LSD&nh=20170123205238	  변협 법조비리 전관 변호사 제명서울 성도현 기자  지난해 법조계를 떠들썩하게 했던 정운호 네이처리퍼블릭 전 대표52구속기소의 전방위 로비 의혹에 연루됐던 부장판사 출신 최유정 변호사47사법연수원 27기와 검사장 출신 홍만표 변호사5817기가 5년 동안 변호사 활동을 하지 못하는 중징계를 받았다.대한변호사협회협회장 하창우는 23일 오후 징계위원회를 열고 두 전관 변호사에 대한 변호사법 위반 혐의를 인정해 제명 결정을 내렸다고 밝혔다.변협은 또 비선실세 최순실씨61의 국정농단을 묵인방조한 혐의 등으로 박영수 특별검사팀 수사선상에 올라 있는 우병우 전 청와대 민정수석50에게는 과태료 1000만원 징계 결정을 했다. 변호사 시절 빠뜨린 수임신고와 관련한 부분이다.현행법상 변호사 징계는 영구제명 제명 3년 이하의 정직 3000만원 이하의 과태료 견책 등 5가지인데 제명이 확정되면 5년 동안 변호사 활동이 금지된다.변협은 최 변호사에게는 불성실 변론수임료 미반환세금포탈세금 미신고 등 변호사로서의 품위유지 의무 위반 공무원 취급사건 알선청탁목적 금품수수 등 혐의를 인정했다.홍 변호사에게는 세금포탈로 인한 품위유지 의무 위반 수임사건 건수 및 수임액 미보고 공무원 취급사건 알선청탁명목 금품수수 등 혐의를 인정했다.  변협은 이들 전관 변호사보다 다소 혐의가 약한 우 전 수석에 대해서는 수임 사건 건수수임액 미보고 등 혐의만을 인정했다.최 변호사 등이 이번 변협 징계위의 결정에 불복할 경우에는 30일 이내에 이의를 제기할 수 있다.변협은 원래 조사위원회 징계개시 신청에 대해 바로 결론을 내리려 했으나 최 변호사와 홍 변호사의 경우 형사재판에서의 사실관계를 살필 필요가 있다고 보고 1심 선고 이후 징계를 논의했다.최 변호사는 로비대가로 100억대 수임료를 받아 챙긴 혐의 등으로 지난 5일 1심에서 징역 6년을 선고받았다. 홍 변호사는 검찰 고위관계자와의 연고친분 등을 이용해 청탁알선명목으로 5억원을 받은 혐의 등으로 지난달 9일 1심에서 징역 3년을 선고받았다.특히 법원은 홍 변호사가 정 전 대표의 상습도박 사건과 관련해 선임계 없이 수사 책임자와 만나 사건의 진행과정 등 수사정보를 묻거나 파악하는 몰래변론을 했다고 인정했다.우 전 수석은 검찰에서 나와 변호사로 활동하던 20132014년 사건수임 건수와 수임액을 자신이 소속된 서울지방변호사회에 제대로 보고하지 않아 징계개시가 청구됐다
"필리핀 경찰이 다른 한국인 상대 무장강도 짓도 한 정황"	http://news.naver.com/main/read.nhn?oid=001&sid1=104&aid=0008982159&mid=shm&mode=LSD&nh=20170123211913	현지 경찰청장 납치돼 피살된 한인과 별도 사례현재 조사중  자카르타 황철환 특파원  필리핀 현직 경찰관이 한국인을 상대로 무장강도 행각을 벌인 것으로 의심되는 정황이 추가로 파악돼 경찰 당국이 조사에 착수했다고 GMA 뉴스 등 현지 언론이 23일 보도했다.    로널드 델라로사 필리핀 경찰청장은 이날 기자들을 만난 자리에서 중부 루손 지방경찰청장에게 문의한 결과 한국인이 범죄 피해를 본 또 다른 사례가 있었다며 이같이 밝혔다.    델라로사 청장은 한국인 사업가 납치살해 사건처럼 납치된 것이 아니라 무장강도에 가깝다. 피해자는 목숨을 잃지 않았다면서 이 사건은 작년 12월 발생했다고 말했다.    그는 앙헬레스 시나 팜팡가 주 등 중부 루손 지방의 부패한 경찰관이 사건을 저질렀을 가능성을 시사하면서도 경찰관이 정말 관여했는지는 아직 모른다고 덧붙였다.    델라로사 청장은 관련 조사가 진행되고 있다면서 구체적인 사건 경위를 공개하지는 않았다.     그는 사건을 은폐하거나 축소하는 일은 없을 것이라고 강조했다. 중부 루손 지방경찰청은 해당 사건에 대한 언급을 피하고 있다.    해당 사건이 실제로 필리핀 현직 경찰관에 의해 저질러진 것으로 밝혀질 경우 상당한 파장이 예상된다.    루손섬 중부 앙헬레스 지역에선 작년 10월에도 한국인 사업가 지모53 씨가 마약 관련 혐의를 날조한 현지 경찰관들에 의해 납치되는 일이 있었다.    지 씨는 마닐라 케손시의 경찰청 본부로 끌려간 뒤 목이 졸려 살해됐으며 그의 시신은 전직 경찰관이 운영하는 화장장에서 소각돼 화장실에 버려졌다.    그럼에도 범인들은 이를 숨긴 채 지 씨의 가족들로부터 500만 페소1억2천여만 원의 몸값을 뜯어냈다.    필리핀 검찰은 최근 이와 관련해 현직 경찰관 2명 등 7명을 납치와 살인 혐의로 기소했지만 주모자로 지목된 경찰관이 상부의 지시를 따랐을 뿐이라고 주장하면서 논란이 갈수록 커지고 있다.    한편 필리핀에선 상대적으로 부유한 사람들로 인식되는 한국 교민들이 범죄 피해를 보는 사례가 꾸준히 늘어 왔다.    한국 교민의 강도 피해 사례는 2013년 13건 2014년 17건 2015년 19건으로 증가했다.    필리핀에서 살해된 한국인은 2012년 6명 2013년 12명 2014년 10명 2015년 11명으로 집계됐다. 작년에는 최소 9명의 한국인이 피살된 것으로 알려졌다.갈수록 난감하네자카르타 황철환 특파원  로널드 델라로사 필리핀 경찰청장이 23일 마닐라 케손시의 경찰청 본부에서 필리핀 전현직 경찰관의 한국인 사업가 살해 사건과 관련한 언론 브리핑을 하고 있다
달리던 버스 불…알고 보니 폐차 대상	http://news.naver.com/main/read.nhn?oid=056&sid1=102&aid=0010411143&mid=shm&mode=LSD&nh=20170123234900	부산에선 달리던 시내버스에서 불이 나 승객들이 대피하는 사고가 잇따랐는데요.화재가 난 버스 또한 내구연한이 지났거나 거의 다된 노후버스였는데  관리도 정비도  제대로 되지 않고 있습니다.   강성원 기자입니다. 리포트 도로 한 가운데 멈춰선 시내버스. 시커멓게 탄 엔진룸에  소방관이 연신 물을 쏘아댑니다. 지난 20일 밤 9시 반쯤 달리던 시내버스 엔진에서 불이 나 승객 6명이 긴급히 대피했습니다. 불이 난 버스는 내구연한인 9년이 넘은 폐차대상 주행거리는 74만 킬로미터가 넘었지만 버젓이 운행중이었습니다.녹취 버스업체 관계자음성변조  검사소에서 안전검사하지 않습니까. 그때는 이상이 없었어요 네 네. 이 회사의 다른 시내버스 내구연한이 1년 정도 남았지만 다음날 운행도중 화재로 멈춰섰습니다.녹취 버스업체 기사음성변조  저는 배차판에 항상 적어두거든요. 정비하라고 적어두는데도 정비를 제대로 안 합니다. 부산지역 시내버스 2천 511대 가운데 내구연한이 지나 폐차해야하지만  수명을 연장해 운행하는 버스는 57대. 70만 킬로미터 이상 달린 버스도 많습니다. 언제 사고가 날지 모릅니다.인터뷰 송광행부산시 대중교통과장  가급적 앞으로는 9년 이상의 차량 연장을 하지 않도록 할 방침에 있습니다
명절마다 KTX 암표 판치는데 단속은 10년간 '0건'	http://news.naver.com/main/read.nhn?oid=214&sid1=103&aid=0000727004&mid=shm&mode=LSD&nh=20170123203804	매번 명절 직전이면 고향 가는 길 기차표의 암표가 기승을 부리죠.요즘은 SNS를 통해서도 확산되고 있는데.최근 10년간 과태료가 부과된 경우는 단 한 건도 없었다고 합니다. 리포트 유명 중고거래 사이트에 설 귀성길 기차표를 판다는 글이 쉴 새 없이 올라옵니다.그때그때 올라오는 건마다 삭제를 하고 있습니다. 지금 삭제를 하는 순간에도 5분 간격으로 보면 5건씩 올라옵니다.웃돈을 붙여 파는 암표도 흔합니다. 암표 판매자얼마죠 한 장에 6만 원이요.몇 장까지 구할 수 있나요 4장 다 있어요.암표가 활개를 치자 이 사이트는 지난해 설부터 관련 게시글을 삭제하고 자체 단속도 벌이고 있습니다. 그 결과 적발 건수는 20 정도 줄었지만 여전히 관련 글은 하루 수백 건씩 올라오고 암표상들은 소셜미디어 속으로 숨어들고 있습니다.유승훈큐딜리온 중고나라 실장최근에는 트위터나 페이스북같이 SNS 채널들이 많아져서요 그쪽으로 좀 옮겨가고 있는 양상이 있습니다.하지만 이처럼 암표를 유통시키다 적발돼도 판매자에게 별다른 처벌은 없는 상황입니다.암표상에게 천만 원 이하의 과태료를 부과하는 규정이 있긴 하지만 글을 올린 사람을 일일이 추적하는 게 어렵다 보니 최근 10년간 과태료는 단 한 번도 부과된 적 없습니다.개인 간 직거래로 표를 구입할 경우엔 사기를 당할 위험도 높아집니다.윤 명소비자시민모임 사무총장소비자 피해 구제와 관련된 법률은 사업자와 소비자 간의 거래 문제만 다루고 있기 때문에 개인과 개인의 피해를 이 법률로 구제받기는 어렵습니다
 '주먹구구' 간병 도우미 서비스에 보호자만 '속앓이'	http://news.naver.com/main/read.nhn?oid=214&sid1=102&aid=0000727011&mid=shm&mode=LSD&nh=20170123204653	서울의 대형병원들에 비치된 간병 도우미 소개지입니다.24시간에 7만 원 추가요금은 없고요.불편한 점이 있으면 해당 업체로 연락하고도 돼 있죠.하지만 웃돈을 줘야 하는 경우가 적지 않은 데다 불편사항이나 사고가 생겨도 해결이 쉽지 않다고 합니다. 리포트 뇌수술 이후 거동이 어려운 어머니를 돌보기 위해 강 모 씨는 2주 전부터 병원에 살다시피 하고 있습니다.2년간 간병인을 써 봤지만 금방 그만두거나 간병 문제로 다투기도 여러 번 급기야 전염성 피부병까지 옮게 돼 결국 포기했습니다.강 모 씨환자 보호자간병인들이 막 돌고 돌잖아요. 우리는 그 간병인이 누구 환자를 맡았는지 모르잖아요. 보호자 입장에서는 당할 수밖에 없어요. 간병인 비용은 하루에 7만 원 정도지만 환자가 중증이거나 명절 등 수요가 많은 시기엔 웃돈도 예사.   이 모 씨환자 보호자8만 원 8만 5천 원 드렸다가 나중에 재외동포 분들은 9만 원 10만 원까지우리가 아니면 이 사람들이 힘들다 라는 상황을 간병인들이 아니까.따로 밥값 등을 요구하기도 합니다.간병인 A일부 간병인은 즉석밥 있잖아요 그거 하루에 3개 사 주십시오 커피 사주십시오 요구하고. 명절 저쪽고향에 가지 않고 놀 때는 그렇게 많이 달라 해서.일이 고되고 임금은 적은데다 요양보호사와 달리 교육이나 자격도 필요 없다 보니 간병인은 중국동포가 대부분입니다.상당수가 협회라고 부르는 용역회사에 소속돼 있지만 보호자 연결만 해 줄 뿐.00간병인협회병실에서 한 이틀 정도 교육 후에 바로 방 배치를 받아요. 주민등록증만 보내 주시고 직접 제가 병원으로 연결해드릴 수 있어요.간병인과 보호자가 계약하는 식이다 보니 사고가 생겨도 해결이 쉽지 않습니다. 이 모 씨환자 보호자자기가 다쳤다고 환자 때문에안 낫고 있다 다른 병원에 가 봐야겠다 이런 거요. 공공기관에 다 연락을 해서 물어봤어요. 근데 다 본인들 소관 아니다보호자 없이 간호인력이 환자를 돌보는 간호간병 통합서비스가 확대되고 있지만 서비스가 되는 병상은 아직 전체의 5에 불과합니다.일부 병원에선 보호자나 간병인이 간호 업무를 떠맡는가 하면간병인 B석션하는 건 간호사가 해야 되는 거예요. 그건 우리가 하게 되면 불법의료행위예요. 그런데도 간호사들은 바쁘다는 핑계를 대고 안 하려고 해요.간호간병 서비스를 해도 중증 환자는 거부하는 곳도 있습니다.간호간병통합서비스 운영병원중증환자 분들 같은 경우는 이용이 좀 어렵고요. 어느 정도 의사소통은 되고 그러신 분들이 가능하십니다. 당장 환자를 병원에 혼자 둘 수밖에 없는 수십만 명의 보호자가 법과 제도 밖의 간병인 손에 불안한 마음으로 환자를 맡기는 게 현실
