文 "김이수 부정은 국법질서 안 맞는 일"…야 3당 반발	http://news.naver.com/main/read.nhn?oid=055&sid1=100&aid=0000576615&mid=shm&viewType=pc&mode=LSD&nh=20171014211320	문재인 대통령이 김이수 헌법재판소장 권한대행을 부정하는 건 삼권분립에도 국법질서에도 맞지 않는다고 비판했습니다.야권은 삼권분립을 훼손한 건 문 대통령 이라고 반박했습니다.첫 소식 남승모 기자가 보도합니다.기자김진태자유한국당 의원 어제 법사위  헌법재판관 자격도 없는 사람 이런 사람의 업무보고를 받을 수가 없어요.박범계더불어민주당 의원 어제 법사위  박근혜 전 대통령을 80으로 탄핵을 했기 때문에 그에 대한 반격이고 보복이라고 생각합니다.헌법재판소 국감 무산 사태를 부른 김이수 헌재소장 권한대행 자격 논란에 대해 문재인 대통령이 직접 나섰습니다.김 권한대행은 헌재가 법과 규칙에 따라 선출했는데 이를 부정하는 건 국회가 만든 국법질서에 맞지 않는 일이라고 비판했습니다.국감장에서 수모를 당한 김 권한대행에겐 사과한다며 국회의원들도 삼권분립을 존중해달라고 밝혔습니다.대통령에게 헌재소장 후보자를 조속히 지명하라거나 지명이 늦어진다고 탓할 순 있겠지만 권한대행은 마땅히 존중해야 한다고도 했습니다. 자유한국당은 문 대통령의 주장은 궤변으로 사과해야 할 대상은 김 권한 대행이 아니라 국민이라고 반박했습니다.전희경자유한국당 대변인  김이수 권한대행 체제라는 비상식적이고 일그러진 헌법재판소를 만든 당사자가 바로 문재인 대통령입니다.국민의당은 삼권분립을 지켜야 할 사람은 바로 대통령 본인이라고 비판했고 바른정당은 하루빨리 대행체제를 중단하고 새 소장 후보자를 지명하라고 강조했습니다.영상취재  문왕곤이재경 영상편집  박정삼남승모 기자smnamsbs.kr 나도펀딩 병원 어린이 환아복 후원하기 취재파일 스페셜5
심정지 환자 50% ↑…'골든타임 5분' 생사 가른다	http://news.naver.com/main/read.nhn?oid=056&sid1=102&aid=0010511995&mid=shm&mode=LSD&nh=20171014213451	앵커 멘트심정지 환자가 10년 전에 비해 무려 50 퍼센트 이상 늘었습니다. 구조적으로 고령자가 늘고 있는데다 요즘처럼 일교차가 커지면 더 빈번하게 나타날 수 있는데요.특히 갑자기 쓰러진 심정지 환자를 본 사람들이 어떻게 대처하느냐가 생사를 결정할 수 있는 만큼 초기 5분 대응 요령을 숙지해놓을 필요가 있습니다.  리포트 수영강습이 한창이던 아침 시간. 갑자기 쓰러진 50대 남성을 수강생들이 급히 건져 올립니다. 강사가 지체 없이 심폐소생술에 들어갑니다. 옆에 있던 수강생도 힘을 보탭니다.인터뷰 김원진인천강화소방서 구급대원  환자분은 의식이랑 호흡 맥박 다 없는  상태였고요. 안전요원관리자가 CPR심폐  소생술중에 있었고 5분 만에 도착한 소방대원이 본격적인 구급 조치에 나서면서 이 남성은 목숨을 구했습니다.인터뷰 정영남심정지 후 회복  생명의 은인이죠. 저는 다시 태어난 기분  이거든요. 구급대원 여러분 수영장의  응급조치해주신 분. 정말 은혜를  못 잊을 것 같아요. 이런 급성심정지 환자는 해마다 3만 명 가까이 발생합니다. 하루 평균 80명꼴로 10년 전보다 50 이상 급증했습니다.  심정지 상태가 5분 이상 지속되면 사망 가능성이 커지기 때문에 초기 심폐소생술 시행이 가장 중요합니다. 방법을 모를 때는 119에 전화를 걸면 스마트폰 영상 통화로 실시간 지도를 받으며 심폐소생술을 할 수 있습니다.녹취 손바닥에 이렇게 손꿈치만으로 눌러 주세요. 하나 둘 셋 넷. 지난해 심정지 환자의 생존율은 7.6  10년 전보다 3배 이상 높아졌지만 덴마크 21
무전기 갖다 댔더니…제연설비, 전자파에 '속수무책'	http://news.naver.com/main/read.nhn?oid=437&sid1=102&aid=0000165198&mid=shm&mode=LSD&nh=20171014210229	대부분의 고층건물에는 불이 났을 때 유독가스가 퍼지는 것을 막는 제연설비를 갖추도록 법으로 규정돼 있습니다. 그런데 제연설비가 전자파에 취약해 실제로는 사고 위험을 키울 수 있다고 합니다.기자오늘 아침 불이 난 인천의 한 숙박업소입니다.객실마다 투숙객들이 연기를 피하기 위해 고개를 내밀고 있습니다.화재가 발생하면 불 자체보다도 연기에 의한 피해가 적지 않은데 제연설비는 연기가 건물 전체로 퍼지지 않도록 막아주는 역할을 합니다.소방법에 따라 15층 이상 고층건물이나 아파트에 설치해야 합니다.바람을 일으키는 방식으로 기압을 높여 외부에서 연기가 유입되는 것을 막아주는 원리입니다.실제 한 아파트 제연설비에 소방대원들이 사용하는 무전기를 가까이서 작동시켜봤습니다.작동했다 멈췄다 오작동을 반복하더니 갑자기 바람이 세지면서 소방청 기준인 40Pa을 훌쩍 넘어 180Pa까지 기압이 올라갑니다.급격한 기압 차로 비상문이 아예 안 열리는 위험한 상황이 화재 진압 도중에 벌어질 수 있는 겁니다.정석환소방기술자  여러분들 컴퓨터 하다가 컴퓨터가 이상한 동작 하지 않거든요 이런 무전기를 갖다 대도 그런데 이건 한다는 거죠. 그러니까 전자파에 대한 내성이 아주 취약하다.박남춘더불어민주당 의원  근본적인 원인 파악조차 잘 안 되어 있는 상태이기 때문에 대책을 마련해야 한다고 생각합니다.소방청은 뒤늦게 진상 파악에 나섰습니다.영상디자인  배장근 영상취재  박세준공영수김장헌 영상편집  김지훈강희연kang.kr JTBC 뉴스 공식 SNS 트위터 페이스북 유튜브Copyright by JTBChttpjtbc
소금에 절은 논, 죽은 벼들만…풍년가 대신 한숨 '푹푹'	http://news.naver.com/main/read.nhn?oid=055&sid1=102&aid=0000576630&mid=shm&mode=LSD&nh=20171014231545	한창 벼 수확할 때지만 간척지 논의 농민들은 한숨만 짓고 있습니다. 지난 초여름 가뭄으로 염분 농도가 높아진 탓에 성한 벼 수확하기가 거의 불가능하기 때문입니다.지금쯤이면 황금빛으로 물들었어야 할 논이 온통 푸른 초원 모습입니다.논바닥 곳곳이 벼가 죽어 듬성듬성 비어 있습니다.초여름 가뭄으로 소금기 농도가 너무 짙어지는 바람에 6월에 해야 할 모내기를 7월 중순쯤에나 마쳤기 때문입니다.박성옥간척지 농민  이게 뿌리를 못 잡아 가지고 벼가 성장이 안 되죠.조금 일찍 모내기를 한 곳도 사정은 나을 게 없습니다.벼 포기가 작고 키도 크지 못한 채 잎이 누렇게 타들어 갔습니다.성한 게 별로 없을 정도입니다.이렇게 누렇게 말라죽은 벼들은 이삭이 나왔지만 낱알이 영글지 못하고 쭉정이여서 수확이 불가능한 상태입니다.모내기 철 이곳의 염분농도는 모가 살 수 있는 한계치 3천ppm을 초과해 피해는 일찌감치 예견됐습니다.상대적으로 염분 피해가 덜했던 논도 수확이 크게 줄었습니다.김진영농민  전년에 비해서 한 40 이상 감량됐다고 봐야죠. 염해 받으니까 벼가 여물지를 못하죠.천수만 간척지 9천7백ha 가운데 이런 피해를 본 논은 6천4백ha 풍년가가 울려야 할 때에 농가의 한숨만 깊어가고 있습니다.kr 나도펀딩 병원 어린이 환아복 후원하기 취재파일 스페셜5
영화 속 그 소리, 어떻게 만들지?…폴리 아티스트의 세계	http://news.naver.com/main/read.nhn?oid=055&sid1=103&aid=0000576633&mid=shm&mode=LSD&nh=20171014233749	거대한 괴물이 등장하고 화려한 액션도 끊임없이 펼쳐지는 판타지 게임 속 효과음들은 어떻게 만들어질까요SBS소셜 동영상미디어 비디오머그가 세상의 모든 소리를 만들어 내는 현장에 다녀왔습니다.기자미궁의 문이 열린다 거대한 문어 괴물이 등장하고 화려한 와이어 활공이 펼쳐진다.저번 녹음한 것 보다 좋은데세상의 모든 소리 폴리 아티스트.신발 소음기 마른 나무 솔방울 야구방망이 쇠사슬 자동차 문짝 철가방 손도끼 이 모든 것들이 나의 악기.박준오폴리 아티스트  게임사운드에서 폴리 아티스트를 맡고 있는 박준오라고 합니다.박준오 NC소프트 폴리 아티스트효과음 제작 13년 차.폴리 아티스트란 사물이나 신체로 효과음을 만드는 사람.국내에 폴리 아티스트는 10명 정도.영화를 치면 왕의 남자랑 놈놈놈이랑 해운대 쌍화점 등을 했고요.수많은 화제의 영화 속 효과음을 맡았던 소리 장인 또 다른 도전을 위해 게임으로 넘어왔다.게임은 실제로 존재하지 않는 소리도 많이 만들어 내야 하기도 하거든요. 어떤 상상 속의 생물이 낼 법한 소리를 만들어야 하니까 더 희열도 더 크고.폴리 아티스트의 곁을 지키는 또 한 사람.이승기폴리 레코디스트 폴리 레코디스트 이승기라고 합니다. 후반 작업부터 하는 엔지니어입니다. 단짝이네요 그렇죠 두 명이 이제 노부부란 별명이 붙어가지고 두 명이서.이들이 만든 2분 20초짜리 영상 필요한 소리만 720개.그래서 나만의 악기를 구하는 특별한 장소로 간다.쓸 수 있을 거 같은데요이건 못 떼어 가겠죠 하하하. 표정이 되게 좋아지신 거 같아요. 또 이거 어떻게 써먹을지 기대도 되고요.특별한 악기들이 만들어내는 칼소리 와이어 소리 문 열리는 소리 문어 괴물소리.얘는이런 식으로 눈 밟는 듯한 얘는 철가방인데 무거운 쇠 스트레스 소리가 나거든요.스튜디오를 가득 채운 자신만의 악기들 속에서 이들은 오늘도 특별한 인생을 산다.소리를 만드는 영상을 사람들이 보지는 않잖아요. 아무런 그 의심 없이 그냥 자연스럽게 보고 넘어갔을 때 약간 그럴 때 쾌감이 있어요. 되게 독특한 소리인데 와 이걸 어떻게 냈지 SCOPE 세상의 모든 소리 폴리 아티스트엄민재 기자happymjsbs.kr 나도펀딩 병원 어린이 환아복 후원하기 취재파일 스페셜5
횡단보도 보행자 없으면 우회전 가능?…혼란 빚은 까닭	http://news.naver.com/main/read.nhn?oid=055&sid1=103&aid=0000576627&mid=shm&viewType=pc&mode=LSD&nh=20171014212225	교차로에서 우회전할 때 횡단 보도를 건너는 사람이 없다면 보행자 신호가 녹색이더라도 진입할 수 있을까요 이 문제를 놓고 대법원과 경찰의 판단이 다른 상황입니다.보행자 신호가 녹색으로 바뀌자마자 버스 두 대가 그냥 지나갑니다.녹색불이 깜빡여도 그대로 지나가는 차량이 많습니다.이런 경우 교통법규 위반으로 볼 수 있을까황병호경기 고양시  녹색불이 켜 있을 때는 보행자가 건너는 상황을 보고 우회전을 하고요.차 준서울 마포구  보행자 신호가 빨간 불이 들어왔을 경우만 우회전 할 수 있는 거예요.최근 경찰은 경찰청 홈페이지에 해답을 내놓았습니다.경찰청 홈페이지 동영상  보행자가 있으면 일시 정지 보행자가 없으면 통과하면 됩니다. 보행자가 충분히 지나간 다음 통과하면 단속하지 않는다고 합니다.보행자 신호가 녹색이더라도 상황에 따라 차량 진입이 가능하다는 건데 대법원의 판단은 달랐습니다.대법원은 지난 2011년 7월 보행자 신호가 녹색인 경우 차량은 우회전해서는 안 된다고 판단했습니다.김기복시민교통안전협회 대표  횡단보도 녹색 신호 시에 우회전하면 차량 진행 신호가 빨간 불 적색 신호이기 때문에 신호 위반으로 판결한 것이죠.결국 상황에 따라 지나갈 수 있다는 경찰 홍보는 무책임하다는 비판을 피할 수 없게 됐습니다.이런 혼란이 빚어지는 이유는 현행 도로교통법상 교차로 우회전에 대한 명확한 규정이 없기 때문입니다.김영진더불어민주당 의원  교통 신호 체계를 정확히 정비해서 운전자가 책임을 지는 것을 사전에 예방하고 전체 보행자와 운전자의 안전을 보장하는 것이 필요합니다.지난해 보행자 교통사고 사망자는 1천 7백여 명.이 가운데 횡단보도 내에서 발생한 사고가 4분의 1가량을 차지했습니다.영상취재  최준식 영상편집  김준희김정우 기자fact8sbs.kr 나도펀딩 병원 어린이 환아복 후원하기 취재파일 스페셜5
데이터 조작 납품…日 품질제일주의 '휘청'	http://news.naver.com/main/read.nhn?oid=056&sid1=101&aid=0010511997&mid=shm&viewType=pc&mode=LSD&nh=20171014213618	앵커 멘트일본에서는 한 대형 철강업체가 기준에 못미치는 제품들을 납품해오다 들통나 파문이 일파만파로 커지고 있습니다.또 닛산 자동차는 무자격자에게 검사를 맡기다 적발돼 리콜 하기로 하면서 일본의 품질 제일 주의가 휘청이고 있습니다.  리포트 고베 제강의 알루미늄 제품이 부품으로 쓰인 신칸센 차량입니다. 알루미늄 강도가 기준에 미달했지만 고베제강은 데이터를 조작해  납품을 강행했습니다. 조사 결과 2개 철도회사에서  신칸센 등에 사용된 부정 부품이 400군데가 넘는다고 일본 언론은 보도했습니다. 처음엔 최근 1년간 출하된 알루미늄과 구리 제품 4의 품질데이터가 조작된 것으로 알려졌지만 조사가 진행될 수록  조작 대상이 늘고 있습니다. 10년 전부터 이같은 부정이 있었다는  보도도 나오고 있습니다. 도요타 등 자동차 심지어는 항공기  방산업체에 원전까지  500여 개 회사가 기준 미달 재료를 받아 사용했습니다. 안전과 직결되는 회사가 많습니다. 인터뷰 타다일 경제산업성 국장  일본 제조업 전체의 신뢰에도 관련된 것이라는 지적이 나오고 있습니다. 저도 엄중하게 이 사태를 받아들이고 있습니다. 해외 기업 30여 곳도 납품 받은 사실이 드러나고  주력 철강제품에 대해서도 의문이 제기되는 등  파문은 확산 일로에 있습니다.인터뷰 가와사키고베제강 회장  다시 한번 깊은 사과의 말을 전합니다. 최근에는 닛산 자동차가  무자격자에게 완성차 검사를 맡겼다 적발돼 110여 만대를 리콜하기로 하는 등 품질 제일주의 일본 기업의 이미지가 크게 흔들리고 있습니다
