"최순실은 지는 해…박 대통령은 끝났다"	http://news.naver.com/main/read.nhn?oid=449&sid1=100&aid=0000123894&mid=shm&viewType=pc&mode=LSD&nh=20170216212040	고영태 녹음파일을 공개 검증하자는 주장을 헌법재판소가 받아들이지 않자 박 대통령 측이 조금 전 그 녹음파일을 공개했습니다   박 대통령이 인터뷰했던 보수 매체 바로 정규재TV를 통해서입니다.   취재기자 연결해 어떤 내용이 있었는지 알아봅니다.   김의태 기자 네 사회부입니다.   이 녹음파일 중에는 최순실은 지는 해고 박근혜 대통령은 끝났다라고 말하는 대목이 있다고요   리포트 정규재TV는 한 시간 전 2400개 녹음파일 중 일부를 공개하면서 이번 사건은 이른바 최순실 게이트가 아니라 K스포츠재단을 장악하기 위한 고영태 일당의 음모라고 주장했습니다.   최순실 씨의 측근들이 박근혜 대통령을 죽이기로 모의하는 장면이 그대로 담겨있다는 것인데요 최순실 씨의 측근인 류상영 전 더블루케이 과장과 최순실의 페이퍼컴퍼니인 고원기획의 김수현 전 대표의 통화내용 일부를 공개했습니다.   직접 들어보시겠습니다.   김수현  전 고원기획 대표2016년 7월 4일 류상영 전 더블루케이 과장 통화  제가 맞다고 보는 게 왜 그러냐면 소장은 이미 지는 해고 박근혜 대통령도 끝났다고 보는 거예요. 근데 걔한테 받을 게 뭐 있다고 생각하는 거예요 없다니까요. 제가 볼 땐 없다는 거예요. 소장 통해서 박근혜 통해서 받을 수 있다는 것은 없다는 거예요.   여기서 소장은 최순실 씨를 의미하는데요   이미 지난해에 최순실 씨를 지는 해로 박 대통령에 대해서는 끝났다는 표현을 쓰면서 이들을 더 이상 이용할 가치가 없으니 K스포츠재단 장악을 위해 다른 방법을 모색하자는 취지의 대화를 나눴다는 것입니다.   박근혜 대통령 측은 이 녹음파일을 통해 K스포츠재단 비리와 박 대통령이 무관하다는 것이 역설적으로 증명된다는 주장인데요   또 검찰이 2400개의 파일을 확보하고도 고영태 일당이 주장하는 대로 일부 파일만 증거로 삼아 박 대통령을 공범으로 몰아갔다고 주장했습니다.   지금까지 사회부에서 전해드렸습니다
신규 기관장 6명 중 4명…올해도 여전한 '관피아 낙하산'	http://news.naver.com/main/read.nhn?oid=437&sid1=101&aid=0000148258&mid=shm&viewType=pc&mode=LSD&nh=20170216221158	탄핵 정국에 임명된 공공기관장 10명 가운데 6명은 관피아 낙하산이라고 지난해 말에 저희가 단독으로 보도 해드렸지요. 올 들어서도 이런 행태가 여전합니다. 23일에 한 명 꼴로 관료 출신이 공공기관 핵심 임원에 임명됐습니다. 기자황교안 대통령 권한대행은 올 들어 6명의 공공기관장을 임명했습니다.이 가운데 기술보증기금 김규옥 이사장 등 4명은 고위 관료 출신입니다.지난해 10월 24일 JTBC의 태블릿 PC 보도 이후 지난해 말까지 박근혜 대통령과 황 대행이 임명한 16명을 합치면 탄핵 정국에 임명된 관료 출신 기관장은 모두 20명이나 됩니다.신규 기관장 34명 중 60 가량이 관료 출신이라는 얘기입니다.다른 핵심 임원으로 영역을 넓히면 관피아 낙하산 숫자는 훨씬 늘어납니다.탄핵 정국 속 임명된 관료 출신 상임비상임 이사는 23명으로 기관장 20명과 합치면 관료 출신 공공기관 핵심 임원은 총 43명입니다.거의 3일에 한 명꼴로 관피아 낙하산을 내려보낸 겁니다. 전문가들은 관료 출신 낙하산 인사가 계속되면 부작용이 만만히 않다고 입을 모읍니다.공공기관 조직 기강 해이와 직원의 업무 의욕 저하 등이 대표적입니다. 이런 폐해를 막기 위해선 정치권이 앞장서 정부에 낙하산 근절을 요구해야 한다고 지적합니다.이태경 JTBC 뉴스 공식 SNS 트위터 페이스북 유튜브Copyright by JTBChttpjtbc
2월 임시국회 파행 지속…4당 원내수석 협상도 결렬	http://news.naver.com/main/read.nhn?oid=421&sid1=100&aid=0002565707&mid=shm&viewType=pc&mode=LSD&nh=20170216204039	16일 오후 서울 여의도 국회에서 4당 원내수석부대표들이 회동에 앞서 나란히 서 있다. 왼쪽부터 김관영 국민의당 김선동 자유한국당 박완주 더불어민주당 정양석 바른정당 원내수석부대표.16   손형주 기자한국당  청문회 제외해달라 요구 17일 오전 재회동서울 류정민 기자조소영 기자서미선 기자이정호  기자  국회 환경노동위원회의 삼성전자이랜드 청문회 날치기 의결 파장으로 자유한국당이 16일 이틀째 상임위를 보이콧하면서 2월 임시국회가 파행을 거듭하고 있다.이날 열릴 예정이었던 정무위원회 미래창조과학방송통신위원회 미래일자리특별위원회 안전행정위원회 농림축산식품해양수산위원회 산업통상자원위원회 등 6개 상임위 전체회의와 공청회 등은 한국당 의원들이 빠진 채 진행되거나 한국당 의원이 위원장으로 있는 상임위는 아예 열리지 않았다.야당이 위원장인 정무위 농해수위의 전체회의와 산자위 공청회는 개의했지만 한국당 의원들이 불참한 상태에서 진행됐다. 한국당 소속 의원이 위원장인 미방위 전체회의는 일정이 취소됐고 안행위 소위도 열리지 못했다.미래일자리특별위원회만 제도개선 소위원회 구성과 위원회 운영에 관한 건 등의 안건을 원안대로 가결했다.한국당은 환노위의  삼성전자 이랜드 청문회 의결을 날치기로 규정하면서 보이콧 입장을 고수하고 있다. 정우택 한국당 원내대표는 이날 당 비상대책위원회의에서  청문회에 의결에 대해 문재인 전 더불어민주당 대표의 핵심 측근들이 대선 정국에서 문 전 대표에게 유리한 방송 환경을 만들기 위해 충성한 것이라며 전날에 이어 야권 유력 대선 주자인 문재인 전 대표에 대한 공세를 이어갔다.이에 더불어민주당은 한국당이 특검 기한 연장을 저지하기 위한 꼼수를 부리고 있다고 맞받아쳤다. 추미애 민주당 대표는 자유한국당이 환노위의 청문회 안건 통과를 문제삼지만 실상은 개혁입법 논의를 막고 통과를 저지시키기 위한 몸부림에 불과하다며 특검의 기한 연장을 원천봉쇄하겠다는 검은 속내도 들어있다고 주장했다. 국민의당은 자유한국당의 상임위 참여를 촉구하는 한편 홍영표 환노위 위원장 소속 정당인 민주당이 해결해야 한다고 말했다. 주승용 국민의당 원내대표는 이날 원내대책회의에서 자유한국당은 마음에도 없는 반성 투어를 중단하고 빨리 국회로 돌아와 개혁과 민생에 전념해 달라며 촉구했다.이어 민주당도 잘못이 있다고 생각한다. 편파적 청문회라고 지적을 받고 있다며 민주당 소속 홍 위원장이 직접 나서서 결자해지 차원에서 해결해주길 촉구한다고 밝혔다.바른정당은 환노위 청문회 의결에 대해 국회 협치에 역행하는 행위라며 민주당에 비판적인 태도를 취하고 있다.이날 민주당의 제안에 따라 박완주 더불어민주당 김선동 자유한국당 김관영 국민의당 정양석 바른정당 등 4당 원내수석부대표는 이날 국회 정상화를 위한 회동을 가졌지만 결론을 내지 못한 채 내일17일 오전에 다시 모임을 갖기로 했다. 자유한국당이 환노위 청문회에서 를 제외해 줄 것을 요청했지만 민주당은 이를 청문회를 무효화 시킬 수 없다는 입장을 고수하고 있어 2월 임시회가 정상화되기까지에는 난항이 예상된다
'뇌물수수 혐의' 조현오 전 경찰청장 항소심 실형	http://news.naver.com/main/read.nhn?oid=214&sid1=102&aid=0000739510&mid=shm&viewType=pc&mode=LSD&nh=20170216210616	뇌물수수 혐의로 기소돼 1심에서 무죄 판결을 받았던 조현오 전 경찰청장이 항소심 재판에서 실형을 선고받았습니다
"4월·7월 되면 경제 붕괴"…'위기설' 이유와 실체는?	http://news.naver.com/main/read.nhn?oid=055&sid1=101&aid=0000505230&mid=shm&mode=LSD&nh=20170216212550	 경기침체가 계속되면서 이런저런 위기설이 빠르게 번지고 있습니다. 이게 실체가 있는 건지 QA 리포트에서 한번 짚어보겠습니다.기자4월이 되면 대우조선이 회사채 4천 4백억 원을 막지 못해 경제가 붕괴된다. 그리고 미국이 한국을 환율 조작국으로 지정해 금융시장과 수출이 큰 충격을 받는다.이게 시중에 떠도는 4월 위기설입니다.그럴 듯한가요 먼저 대우조선의 대주주이자 채권자는 국영 산업은행입니다.아직 대우조선에 지원하지 않은 3천8백억 원을 산업은행이 갖고 있고 추가 자금지원 여력도 충분합니다.환율조작국 지정 가능성도 높지 않다는 게 정부 판단입니다.흑자를 내려고 일부러 환율을 조작한 적이 없으며 대미흑자 폭을 줄이고 있기 때문이란 설명입니다.7월 위기설은 4월에 불거진 문제에 7월에 5조 원의 부채 만기가 돌아오는 그리스발 금융위기까지 더해져 이른바 퍼펙트 스톰이 된다는 겁니다.이상화KB증권 이사  그리스 문제는 EU 내에서 자체적으로 해결하거나 IMF에서도 일정 부분 조치를 취하면 글로벌 위기로 번질 가능성은 그렇게 높지는 않다고 보고 있습니다.최근엔 10년 간격으로 위기가 온다는 이른바 10년 주기설 까지 등장했습니다.다소 비논리적인 이런 위기설들이 왜 확산하는 걸까요주 원현대경제연구원 경제연구실장  10진법을 좋아하는 사람들이 만들어 낸 이슈이고요. 너무나 많은 불확실성이 작년 말부터 올해 초까지 지속이 되다 보니까 자라 보고 놀란 가슴 솥뚜껑 보고 놀란다. 이런 심리적 요인이 큰 것 같습니다.위기설 확산의 근저엔 국정 공백이 있습니다.장기 불황으로 불확실성이 커진 상황에서 이를 극복할 정치적 리더십이 제대로 작동하지 않는 데 따른 것으로 보입니다.이럴 때일수록 정부는 아무리 작은 위기 징후도 면밀히 살피고 대비해야 합니다
강남보다 비싼 월세…노량진 공시생 '한숨'	http://news.naver.com/main/read.nhn?oid=449&sid1=101&aid=0000123907&mid=shm&mode=LSD&nh=20170216210350	서울 노량진 학원가의 월세 가격이 우리나라에서 집값이 가장 비싸다는 강남보다 높은 것으로 나타났습니다.   가뜩이나 주머니가 가벼운 수험생들은 끼니를 대충 때워가며 버티고 있습니다.   이현용 기자가 보도합니다.  리포트 서울 노량진 학원가. 공무원시험 준비생들이 3천 원 짜리 컵밥으로 점심을 때우고 있습니다.   학원비에 생활비까지 한 푼이 아까운 이른바 공시생들주거비용마저 비싸 부담을 더합니다.   임재민  공무원시험 준비생  고시원 비만 해도 일반 대학 원룸값 정도 되니까 30 40만원 정도 해야 고시원에 들어가고 원룸에 들어가려면 50만원 정도는 있어야    김동우  공무원시험 준비생  생활하는 데 부담이 되는 게 사실이에요. 학원비나 식료품비 다 합치면 한 달에 거의 100만원 기본으로 나가고    노량진 학원가의 월세는 3.3제곱미터 당 13만 7천원 수준. 8만 9천원인 강남 서초 지역보다도 비쌌습니다.   노량진의 비싼 월세는 주거 공간은 제한돼 있는데 공시생들의 수요는 계속 몰리기 때문.   노량진 공인중개사  노량진 경계가 경사 지역이어서 도로와 주택이 많이 뻗지 못하고노량진역 기준으로 반대편으로 가고 싶어도 한강이 가로 막고 있어서    실제로 노량진과 대학가가 있는 동작관악 지역은 중심업무지구인 종로중구 용산구에 이어 서울에서 두번째로 월세가 비쌌습니다.   서울 지역에서 월세가 가장 싼 곳은 성북동대문 지역으로 동작관악 지역의 절반 수준이었습니다.   채널A 뉴스 이현용입니다
