인도 뭄바이서 폭우로 주거건물 붕괴…18명 사망	http://news.naver.com/main/read.nhn?oid=421&sid1=104&aid=0002920662&mid=shm&mode=LSD&nh=20170831233032	뭄바이 건물 붕괴 사고 현장.  AFP굉음내며 무너진 4층 아파트40명 살던곳 추정총 12명 구조돼밤 돼도 구조작업은 계속서울 김진 기자김혜지 기자  인도의 경제수도 뭄바이에서 폭우의 영향으로 주거용 건물이 붕괴돼 최소 18명이 숨졌다.뭄바이의 인구 밀집지역인 벤디 바자르에 있던 4층짜리 건물이 굉음을 내며 무너진 것은 주민들이 막 하루를 시작하던 31일현지시간 오전 8시40분쯤.이후 12명이 잔해 속에서 꺼내 올려졌지만 사망자 소식은 계속해서 들리고 있다. 밤이 된 지금도 구조 작업은 멈추지 않았다.건물에는 당초 40여명이 머물고 있었던 것으로 현지 당국자들은 추측했다. 약 89개 가구가 참변을 당한 것으로 알려졌다.뭄바이시의 재난통제팀 대변인은 대원 43명이 구조 작업을 하고 있으며 소방관 2명이 작업 도중 부상했다고 밝혔다. 붕괴 원인은 구체적으로 알려지지 않았으나 최근 일대에 퍼부은 계절풍몬순 폭우가 건물에 영향을 미쳤을 가능성에 무게가 실린다.또 공사 비용을 아끼려고 법과 원칙을 무시하는 건설업계의 관행과 관료 부패도 원인으로 지목되고 있다.현지 매체 NDTV는 이 건물이 지방정부가 선정한 취약 건물에 포함됐는지 확실치 않다고 보도했다. 하지만 당국자들에 따르면 건물은 세워진 지 117년이나 됐다.붕괴 당시를 목격한 나심 모그라디아는 엄청난 굉음이 들렸고 우리는 모두 달려갔다고 말했다.인근 주민 샤히드 칸은 건물에 살던 자신의 가족 7명이 아직 발견되지 않고 있다는 안타까운 사연을 전했다. 그는 그저 구조 작업을 도우려 하는 것 뿐이다라고 말했다.붕괴된 건물 잔해에서 시신이 옮겨지고 있다.  AFP아시아 국가 가운데 건설 규제가 취약한 편인 인도에서는 6월 말9월 몬순 시즌에 폭우에 따른 건물 붕괴가 종종 발생한다. 타임오브인디아TOI는 이번 사고를 포함해 지난 한 달간 뭄바이에서 3건의 건물 붕괴 사고가 발생했다고 전했다. 지난 26일에는 찬디발리 지역에서 건물이 무너져 7명이 사망했고 지난달 25일에는 가트코파르에서도 붕괴 사고가 발생해 17명이 사망했다.게다가 뭄바이는 인도 내에서도 오래된 도시다. 최근 노후한 인프라를 개선하고자 6억달러약 6765억원 규모의 재개발 공사가 진행됐다.이번 사고로 뭄바이는 엎친 데 덮친 격이 됐다. 앞서 12년 만에 최악의 폭우가 발생해 10명이 사망했기 때문이다
자동차 리콜 사상 최대, 하자 많은 이유는?	http://news.naver.com/main/read.nhn?oid=214&sid1=103&aid=0000786443&mid=shm&mode=LSD&nh=20170831210445	올해 유난히 자동차 리콜 소식이 많습니다. 오늘도 벤츠와 폭스바겐 등 4만 3천여 대가 제작결함으로 리콜됐습니다.올해 8달 동안 138만대 신기록인데요.왜 이렇게 리콜이 많아지는지 김세의 기자가 취재했습니다. 리포트  수입차 판매 1위를 달리고 있는 벤츠 E 클래스 모델들을 비롯해 20개 차종 2만 6천여 대에서 전류 제한기 이상이 발견됐습니다.엔진이 고장 난 상황에서 시동을 계속 걸면 과열로 불이 날 가능성이 있습니다.윤서인벤츠 차량 소유자벤츠라고 그래서 큰돈 주고 산 건데 또 리콜기사 나오고 공장 또 오가라고 그럴 것 같고. 불안한 마음이 자꾸 드는 거예요. 이래 가지고 타겠어요폭스바겐 파사트 모델 1만 4천여 대는 부품보호용 방열판이 작아서 화재가 날 가능성이 제기됐습니다.국토교통부는 벤츠와 폭스바겐 등 4개 업체에서 수입판매한 자동차 등 48개 차종 4만 3천여 대가 제작 결함으로 리콜된다고 밝혔습니다.올해 초부터 지금까지 리콜 결정을 받은 차량은 모두 138만 2천여 대에 이릅니다. 사상최대로 국내 등록된 자동차 16대 가운데 1대꼴로 올해 새로 문제가 발견된 겁니다.이처럼 자동차 리콜이 갈수록 늘어나는 이유로는 업체들이 부품을 함께 쓰는 부품 공용화와 점점 복잡해지는 전자장치를 꼽을 수 있습니다.원가절감 등을 위해 부품을 공유하는데 한 부품을 여러 차종에 쓰면 문제 발생확률이 높아지고 또 전자장치가 많을수록 불량 가능성도 높다는 겁니다.김필수대림대 자동차학과 교수단품으로 볼 때는 정품인데 몇 개가 모이게 되면 불량이 되는 경우도 있어서 품질 제고 측면에서 상당히 고민사항이 많고요. 특히 경쟁이 치열해지면서 이런 부분들을 품질제고를 안하게 되면 불량이 많아질 수밖에 없습니다.앞으로 전기차가 늘면 리콜이 줄 걸로 보입니다.전자장치가 일반차의 절반이고 또 단골 리콜부품인 엔진변속기가 아예 없기 때문입니다. 이민하한국전기차협회 국장전자장비 부품 수가 적기 때문에 그만큼 불량이 발생할 수 있는 확률이 줄어들고 내연기관이 엔진 때문에 불량확률이 많지만 전기자동차는 엔진이 없는 게 장점이라고 할 수 있습니다
팔 걷은 은행들, 대출금리·수수료↓…'메기효과' 입증	http://news.naver.com/main/read.nhn?oid=055&sid1=101&aid=0000564177&mid=shm&viewType=pc&mode=LSD&nh=20170831215214	최근 카카오뱅크를 비롯한 인터넷 전문은행이 돌풍을 일으키면서 기존 은행들이 크게 달라지고 있지요. 대출금리를 낮춰주고 요지부동이던 각종 수수료도 깎아주고 있습니다.기자20대 직장인 오세웅 씨는 카카오뱅크를 사용한 지 한 달 만에 주거래은행을 카카오뱅크로 바꿀 생각을 하고 있습니다.오세웅카카오뱅크 사용자  이체할 때 훨씬 편하고요. 점포 방문 없이 그냥 휴대전화 갖고 바로바로 할 수 있어서 그런 점이 훨씬 편리한 것 같습니다.입소문을 타고 사용자가 늘면서 가입 계좌는 300만 개를 넘겼고 고객이 맡기거나 대출받은 돈은 3조 원을 넘었습니다.가파른 성장세에 기존 은행들은 부랴부랴 고객 지키기에 나섰습니다.우리은행과 국민신한은행은 해외 송금 수수료를 낮췄고 하나은행은 간편 송금 서비스 지역에 중국을 추가하는 등 틈새시장을 공략하고 있습니다.모바일 영업을 강화하고 대출 금리를 낮추고 여기다 예금 이자를 높인 상품도 속속 내놓고 있습니다.이대기한국금융연구원 선임연구위원  기존 은행들도 기술 혁신을 계속 도입하면서 또 가격 측면에서도 경쟁하면서 혁신해 나갈 거거든요 그래서 그냥 쉽게 도태되는 게 아니라 자기 영역을 찾아갈 겁니다.메기 한 마리가 어항 속 물고기를 긴장시켜 더욱 건강하게 만든다는 이른바 메기 효과가 나타나자 정부는 인터넷 전문은행을 한 곳 더 인가하는 방안을 검토 중입니다.영상취재  최호준전경배 영상편집  이승진조성현 기자eyebrowsbs
경찰, 방사청 공무원 '뇌물수수 혐의' 수사	http://news.naver.com/main/read.nhn?oid=448&sid1=102&aid=0000220958&mid=shm&viewType=pc&mode=LSD&nh=20170831233831	군 장병들이 먹는 밥을 놓고 뇌물이 오가면 안 될 일입니다 방위사업청 4급 서기관이  군 급식재료 납품을 도와준다며 뇌물 수천만원을 받았다는  의혹이 불거져습니다.  경찰은  방위사업청을 압수 수색하고 수사에 나섰습니다. 최원희 기자의  단독 보도입니다. 리포트경찰이 방위사업청을 압수수색한 건 이달 초입니다. 3년 전 방사청 계약 관리 부서에 있던 4급 서기관 A씨가 뇌물을 받았다는 의혹이 불거져 수사를 한 겁니다. A씨는 아는 사람으로부터 군 식자재 납품 계약 체결을 도와달라는 청탁을 받고 그 대가로 수천만원을 챙긴 것으로 의심 받고 있습니다.하지만 이후에 실제 납품 계약은 체결되진 않은 것으로 알려졌습니다. 방위사업청 관계자개인적인 사안이라서 방위사업청 차원의 내용이 아니라서 세부내용을 모르고 A씨는 빌려준 돈을 받은 것이라며 혐의를 부인하는 것으로 전해졌습니다.경찰 관계자 본인은 채무다 채권채무다 이렇게 주장을 경찰은 조사를 마무리한 뒤 다음주 쯤 A씨를 기소의견으로 검찰에 넘길 계획입니다
'가짜 장외주식' 700억대 사기행각 이금석 징역 17년	http://news.naver.com/main/read.nhn?oid=001&sid1=101&aid=0009513784&mid=shm&viewType=pc&mode=LSD&nh=20170831221057	서울남부지법  자료사진 안홍석 기자  가짜 주식을 발행해 700억대 사기행각을 벌인 사업가 이금석46씨에게 징역 17년의 중형이 선고됐다.    서울남부지법 형사합의11부심규홍 부장판사는 31일 특정경제범죄 가중처벌 등에 관한 법률상 사기 혐의로 재판에 넘겨진 이씨에게 징역 17년에 벌금 229억원을 선고했다.    재판부는 사건 이후 일부 피해자들이 스스로 목숨을 끊는 등 적잖은 고통에 시달렸고 피해 회복이 거의 이뤄지지 않았는데도 반성하지 않고 있어 중형 선고가 불가피하다고 양형 이유를 설명했다.    이씨는 벤처기업 노드시스템 대표이던 2003년부터 2008년까지 개인 투자자 3천800여명에게 이 회사 가짜 장외주식을 발행해 약 750억원을 가로챈 혐의로 기소됐다.    이씨는 러시아 국민 휴대전화 사업을 따냈다거나 러시아에 와이브로 기술을 독점 공급하게 됐다는 등 거짓 소문을 퍼뜨려 가짜 주식의 주가를 500원대에서 2천원까지 부풀리기도 했다
"너무 평온해" 역대 가장 이상한 독일 총선	http://news.naver.com/main/read.nhn?oid=032&sid1=104&aid=0002815067&mid=shm&mode=LSD&nh=20170831221322	메르켈오는 24일 치러지는 독일 총선을 앞두고 자국 내에서는 역대 가장 이상한 선거 캠페인을 치르고 있다고들 한다. 4연임에 도전하는 앙겔라 메르켈 총리의 기독민주연합CDU의 아성은 견고하다. 메르켈에 맞서는 사회민주당SPD의 마르틴 슐츠는 몇 달째 싸우려 들지 않는 적을 상대로 홀로 선거전을 하고 있다. 메르켈이 자유세계의 마지막 보루 역할을 이어나갈지 세계가 주목하고 있지만 정작 독일에서는 바람이 불지 않는다. 도널드 트럼프를 당선시킨 미국 대선 39살 정치신인 에마뉘엘 마크롱이 양대 정당을 무너뜨린 프랑스 대선과 대조적이다. 슐츠의 외로운 싸움슐츠메르켈은 지금까지 어떤 유세나 언론 인터뷰에서 슐츠의 이름을 한 번도 입에 올리지 않았다. 반면 슐츠는 8월27일 공영방송 ARD인터뷰에서 메르켈이 얼마나 유권자들과 떨어져 있는지 점점 더 많은 사람들이 공감하고 있다고 비판했다. 독일 언론들은 슐츠에게 섀도복서라는 별명을 붙였다. 가상의 상대와 혼자 권투를 하고 있다는 의미다. 사민당은 지난 34월 기민련과 지지율 차이를 23포인트까지 좁혔지만 이후 10포인트 이상 벌어졌다. 여론조사기관 디포숑스그루페뷜렌이 8월24일 발표한 여론조사에서 기민련은 39로 사민당22을 17포인트 앞섰다. 슈피겔에 실린 원더우먼이라는 제목의 칼럼은 메르켈의 여름휴가조차 지지율을 끌어올리는 건 이번 캠페인의 흥미로운 점 중 하나라고 적었다. 휴가지에서 5년째 같은 옷을 입는 메르켈에게 현실적인 독일인들은 더 호감을 느낀다는 것이다.슐츠와 사민당은 3일 베를린에서 열리는 처음이자 마지막 TV토론을 벼르고 있다. 슐츠의 존재감을 각인시킬 사실상 유일한 기회다. 독일인 5명 중 1명이 시청할 것으로 예상된다. 그는 한 달 반 전부터 미디어 전문가를 영입해 손짓 하나까지 교정하면서 예상 시나리오를 수없이 짜고 있다.메르켈 측은 일말의 불확실함도 만들지 않으려 한다. 방송사들은 당초 공영민영을 나눠 2차례 토론을 원했지만 메르켈 측은 1번으로 잘랐다. 청중을 두고 자유로운 분위기에서 토론하자는 제안도 거부했다. 메르켈은 대신 우호적인 온라인 유력인사나 유권자들과 직접 만나는 방식을 택하고 있다. ZDF의 전 보도국장 니콜라우스 브렌더는 모호함의 대가인 메르켈은 선거 기간 내내 자면서 걷는 듯하다고 비판했다. 기민련의 선거포스터는 말 그대로 한가하다. 메르켈이 활짝 웃고 있고 행복하게 잘사는 독일을 위해라는 슬로건이 쓰여 있다. 독일에 트럼프식 이변은 없다싱크탱크 독일마셜펀드GMF의 유럽정치전문가인 티모 로호키는 AFP통신에 독일 선거는 어떤 극단화도 없기 때문에 사민당 혼자서는 선거전에 불을 붙일 수 없다. 기민련이 답하지 않는 사이 캠페인은 죽어가고 있다고 분석했다. 로호키는 이상한 선거전의 배경으로 경제성장과 낮은 실업률이 받쳐주는 비교적 탄탄한 경제 이민 등 민감한 이슈에 대해 메르켈이 좌우 대연정으로 폭넓은 공감대 유지 비주류를 배척하는 주류 정당의 암묵적 합의 등을 꼽았다. 여기에 트럼프의 출현과 브렉시트영국의 유럽연합 탈퇴로 잡음이 끊이지 않는 바깥세상도 현상유지를 원하는 독일인들의 심리를 굳히는 역할을 하는 것으로 보인다.슐츠의 참모들은 TV토론을 준비하면서 공격 수위를 고심하지만 독일의 정치환경은 선동적 캠페인이 나오기 어렵다. 정치 좌표에서도 사민당은 기민련과 그리 거리가 멀지 않아 차별화가 쉽지 않다. 베텔스만재단의 로베르트 베르캄프 연구원은 여기독일서 트럼프식 반기득권 포퓰리즘 캠페인은 전혀 가망이 없다고 말했다. 슈피겔은 독일은 미국과 달리 이상과 정치를 명확히 구분짓는 현실주의가 있고 이는 정치적 현실을 좀 더 신뢰할 수 있고 진지한 것으로 만드는 높은 장벽이 된다고 적었다
"마을에 사드와 같은 X밴드 레이더가"…무안 주민 반발	http://news.naver.com/main/read.nhn?oid=057&sid1=102&aid=0001169579&mid=shm&viewType=pc&mode=LSD&nh=20170831211504	전남의 한 농촌마을에 난데없이 기상관측 레이더가 소리 소문 없이 들어섰습니다.  X밴드 레이더 전자파는 8백분의 1 수준이라지만 사드와 같은 방식 레이더거든요.  알고 보니 서울에서 반대가 심해 이곳에 가져다 놓은 건데 주민들은 이 사실을 전혀 몰랐던 겁니다. 당연히 반발이 크겠죠    정치훈 기자가 보도합니다. 기자   동작 주민 동의 없는 X밴드 레이더 즉각 철회하라  지난해 기상청은 관측 레이더 한 대를 서울 본청 옥상에 설치하려다 주민 반대가 심하자 이를 포기했습니다.  설치가 무산된 줄만 알았던 레이더가 다시 모습을 드러낸 건 전남 무안의 한 농촌마을.  지난 5월 주민 몰래 설치됐습니다. 스탠딩  정치훈  기자 주로 낮은 고도의 기상 관측을 하는데 쓰이는 이 레이더는 사드와 같은 주파수 대역을 사용합니다.  기상청은 X밴드 레이더의 전자파가 사드레이더의 800분의 1 수준이라며 휴대전화 수준이라고 해명합니다. 인터뷰  남경엽  국립기상연구소 연구관 설치 전에 설명회 하지 않은 것은 잘못한 거니까. 기존에 있던 지점이고 거기서 사는데 굳이 설명해야 하나 조금 쉽게 생각했던 것 같아요.  문제가 불거지자 기상청은 뒤늦게 주민설명회를 열기로 했지만 주민들의 불신은 깊어졌습니다. 인터뷰  윤식  전남 무안군 발산마을 이장 지금은 믿을 수가 없습니다. 일방적으로 설치하고 나서 이제 와서 얘기를 하니까.  X밴드 레이더는 전남 무안뿐만 아니라 전북 군산과 강원 평창 등 3곳에 설치돼 시험 가동에 들어간 상황.  주민들은 가동 중단을 촉구하는 한편 집단행동을 예고하고 있어 갈등은 쉽게 사그라들지 않을 전망입니다.  MBN 뉴스 정치훈입니다
경찰서장 갑질?…교통경찰이 '식당 주차관리'	http://news.naver.com/main/read.nhn?oid=057&sid1=102&aid=0001169575&mid=shm&viewType=pc&mode=LSD&nh=20170831205309	교통경찰관이 도로가 아닌 개인 사업장인 식당에서 주차관리를 하고 발레파킹까지 했다면 믿으시겠습니까  실제로 이런 황당한 일이 전북 익산에서 벌어졌습니다.  그것도 경찰관 여러 명이 하루도 아닌 사흘씩이나 말이죠.  강세훈 기자가 단독 보도합니다. 기자   하얀 제복을 입은 교통경찰관들이 바쁘게 움직입니다.  그런데 자세히 보니 도로가 아닙니다.  이번엔 한 운전자가 주차를 못 하자 경찰관이 대리주차까지 해줍니다. 스탠딩  강세훈  기자 화면 속의 장소는 보시는 것처럼 한 식당의 주차장입니다. 경찰관들은 이 주차장에서 하루도 아닌 사흘씩이나 식당을 찾은 손님 차량의 주차관리를 했습니다. 인터뷰  식당 주인 교통경찰관 7명이나 와서 주차관리를 하니까 손님들이 경찰 아르바이트 썼냐고 그러면서 갔어요.  그렇다면 이런 황당한 일이 벌어진 이유는 무엇일까  경찰관들은 경찰서장의 지시 때문에 어쩔 수 없었다고 말합니다. 인터뷰  교통경찰관 식당 주차장 뒤쪽이 서장님 고향 마을인데요. 식당 차량들 때문에 주민들이 통행하는데 불편이 크니까 서장님이 해결하라고 지시한 거죠.  하지만 경찰서장의 말은 다릅니다.  직원들에게 부당한 지시를 한 적이 없다는 겁니다. 인터뷰  경찰서장 서장 고향 동네 사람들이 불편을 겪는다고 하니까 직원들이 서장 입맛에 맞게 뭣 좀 하고 싶으니까 과잉 충성을 했겠죠.  문제가 불거지자 경찰은 해당 경찰서에 대한 감찰 조사에 들어갔습니다
