MB, 증인대 서나…여야, 국감 앞두고 '증인 채택' 공방	http://news.naver.com/main/read.nhn?oid=437&sid1=100&aid=0000163880&mid=shm&mode=LSD&nh=20170924204359	국회는 이번 주 상임위에서 다음 달로 예정된 국정감사 증인 채택을 논의합니다. 이명박 전 대통령도 증인으로 거론되는데 이를 두고 여야 공방이 예상됩니다.기자이명박 전 대통령이 증인으로 거론되는 상임위는 과학기술정보통신위원회와 환경노동위원회입니다.여당과 정의당 일부 의원들은 이 전 대통령과 원세훈 전 국정원장 등을 과기위 국정감사 증인으로 신청했습니다.이명박 정부 언론장악 논란의 진상을 따져 묻겠다는 계획입니다. 최근 국정원 개혁위는 이명박 전 대통령 시절인 2010년 국정원의 공영방송 개입 정황이 담긴 문건을 작성해 청와대에 보고한 사실을 확인했습니다.  정의당 이정미 대표는 4대강 사업과 관련해 이 전 대통령의 환노위 증인 채택을 요구했습니다. 하지만 자유한국당은 정치 보복이라며 증인 채택을 거부한다는 입장입니다.국방위에선 민주당에서는 김관진 전 국방부장관과 군 사이버사령부 댓글공작 관련자들을 반면 자유한국당에서는 정의용 청와대 국가안보실장과 문정인 대통령 통일외교안보특보를 증인으로 부르겠다고 벼르고 있습니다. 이처럼 여야 간의 이견이 뚜렷한 가운데 과기위와 국방위는 내일 증인 명단 확정을 위한 간사 협의를 진행하기로 했습니다.kr JTBC 뉴스 공식 SNS 트위터 페이스북 유튜브Copyright by JTBChttpjtbc
명절 다가오는데 "돈 못 줘"…임금 체불에 근로자 한숨	http://news.naver.com/main/read.nhn?oid=055&sid1=102&aid=0000571388&mid=shm&mode=LSD&nh=20170924225303	추석 명절을 앞두고 차일피일 임금 지급을 미루는 사업주들 때문에 생활고를 겪는 근로자들이 많습니다.다가오는 명절이 오히려 두렵다는 이들을 임태우 기자가 만나봤습니다.기자건설 현장에서 30년 가까이 거푸집을 만드는 목수로 일해온 62살 김 모 씨.한창 일할 시간에 집안에 머물고 있습니다.지난 3월부터 서울 흑석동 건축 공사장에서 일을 해왔지만 석 달 치나 임금을 받지 못하면서 일을 아예 그만둔 것입니다.체불 임금은 자신이 데려온 보조목수 다섯 명의 임금을 포함해 모두 6천 7백여만 원.보조목수 볼 면목도 없지만 어느덧 넉 달째 일곱 식구 생활비도 못 줬습니다.김모 씨임금체불 근로자  뭐 피 말리다 못해 사람이 정말. 죽는 사람들이 왜 죽는지 이 상황이 나니까 죽는 거예요. 가정에서 시달림받고 밖에 나가면 밖에서 시달림받고.컨테이너 화물기사인 이장휴 씨도 일을 주는 물류업체로부터 인건비 6백여만 원을 몇 달째 못 받고 있습니다.한 푼이라도 아끼려고 차 안에서 숙식을 해결하는 이 씨는 다가오는 명절이 두렵습니다.이장휴화물차 기사  명절날 돌아오고 그러면 돈 들어갈 일 있지. 방에서 그냥 코 박고 자는 것 밖에 더 있겠습니까올해 임금 체불액은 지난 달까지 8천 9백억 원 피해 근로자는 21만 9천여 명에 이릅니다.특히 30인 미만 사업장이 전체 70퍼센트 가량을 차지해 영세한 기업일수록 임금체불이 더 심각했습니다.전재희전국건설노동조합 교육선전실장  애초에 공사 금액에서 따로 떼서 발주자가 직접 관리 감독해서 제때 제대로 건설 노동자에게 지급될 수 있게끔 하는 임금지급 시스템이나 확인제도가 필요할 것 같습니다.명절을 앞두고 되풀이되는 당국의 일회성 단속보다는 임금 체불을 사전에 예방할 수 있는 제도 도입이 필요합니다.영상취재  이찬수 영상편집  김준희임태우 기자eightsbs.kr 나도펀딩 병원 어린이 환아복 후원하기 취재파일 스페셜5
정답보다 생각 쓰는 '바칼로레아' 국내 도입될까	http://news.naver.com/main/read.nhn?oid=032&sid1=102&aid=0002820971&mid=shm&mode=LSD&nh=20170924230008	새로운 논서술형 평가에 교육계 찬반 엇갈려창의융합형 미래인재를 육성하는 수업과 학습이 가능하도록 하는 평가혁신 방안을 만들도록 하겠습니다.조희연 서울시교육감이 지난 7월10일 취임 3주년 기자간담회에서 한 말이다. 그 후 조 교육감의 지시로 서울시교육청은 평가혁신 태스크포스TF를 구성해 다양한 방안을 검토하고 있다. 이 가운데는 학생들의 시험을 어떻게 혁신할지도 포함돼 있다. TF는 새로운 시험 방법 중 하나로 인터내셔널 바칼로레아International BaccalaureateIB도 후보로 놓고 들여다보고 있다. 지난 23일 서울시교육청 대강당에서는 현직 교사들을 대상으로 관련 세미나도 열렸다. 일본도 도입한 바칼로레아IB는 스위스에 있는 비영리 공적 교육재단 국제 바칼로레아 기구International Baccalaureate OrganizationIBO가 주관하는 시험이다. 원래는 1968년 외교관 자녀상사 주재원 자녀 등을 위한 시험으로 개발됐지만 현재는 전 세계 146개국 3700여개 학교에서 100만명 이상의 학생들이 이수하고 있다. 이 중 고등과정인 IB 디플로마 프로그램은 한국의 고등학교 23학년 연령대 학생들이 2년간 이수한다.유럽의 독일스위스노르웨이 캐나다와 미국 일부 주정부 등은 IB를 오랫동안 대입시험으로 활용해왔다. 각국의 대입시험이 따로 있기도 하지만 IB를 대입시험에 준하도록 인정해준다. 일본도 2013년 아시아 최초로 IBO와 협정을 체결했다. 한국의 교육부에 해당하는 일본 문부과학성이 2015년 1월 발표한 교육개혁안에는 IB를 공교육에 도입하는 방안이 포함됐다.지난해 기준 일본 내 60개 학교가 IB 디플로마 프로그램을 일본어와 영어로 운영했고 같은 해 11월 일본어로 된 첫 IB 시험이 치러졌다. 일본 정부는 2018년까지 200개 학교에 IB 디플로마 프로그램을 확대 도입할 계획이다. IB시험 어떠하기에시간은 문학 작품의 중요한 주제이다. 시간은 미래를 위한 희망 잃어버림과 슬픔 추억의 중요성 등 인간에게 있어서 아주 중요한 부분이다. 공부했던 작품 중에서 시간의 중요성에 대해서 논하시오.국어한 국가를 예로 들어 산업화가 삶의 수준과 근로 조건에 미친 영향을 분석하시오.역사서로 다른 전통들을 되새기기 위해 시청에서 전통복장을 입고 참여하는 파티를 개최합니다. 당신의 친구에게 당신이 어떤 의상을 택했고 왜 그걸 택했는지 알려주는 e메일을 쓰시오.외국어IBO가 시험문항 예시로 공개한 문제들이다. 5지선다 객관식이나 단답형 주관식 문제에 익숙한 이들에게는 매우 어려워 보이기도 한다. 그러나 교육전문가들은 이제 답이 정해지지 않은 학생들의 힘을 길러주는 시험을 통해 생각하는 교육으로 바꿔야 한다고 말한다.2014년 서울대에서는 누가 A를 받는가란 책을 출간해 화제를 모았던 IB 전문가 이혜정 교육과혁신연구소장은 2017학년도 대학수학능력시험의 국어 영역을 보면 총 45개의 문제 중 다음 중 적절한 것은 유형이 25개 다음 중 적절하지 않은 것은 유형이 19개였다며 수능이 나온 지 20여년이 지났지만 시험문제의 유형성격형태 모두 그때와 별반 차이가 없다고 말했다. 그는 수능보다 학교에서 보는 중간기말고사 같은 내신 시험문제는 더 심각하다며 내신 시험문제는 등급을 나누기 위해 교사들이 어떻게든 틀릴 만한 문제를 출제해야만 한다고 말했다. 한국형 바칼로레아 가능할까IB 도입을 놓고 전문가들의 의견은 제각각이다. 주로 현직 교사들은 공정성 논란 준비 부족 등을 이유로 시기상조라고 주장하는 데 반해 IB 전문가들은 국제적으로 검증이 됐다고 맞서는 모양새다.지난 21일 국회 의원회관에서 열린 정책토론회에서 신성호 전국교직원노동조합 참교육실장은 교육과정이 논서술형 평가 지도가 가능하도록 구성돼 있지 않다며 국어나 사회탐구 과목부터 논서술형을 도입한 뒤 비중을 순차적으로 늘리는 것이 맞다고 말했다. 이어 중고교 6년 동안 충분한 교육이 되지 않은 상태로 수능에서 논서술형을 즉각 도입할 경우 또 다른 사교육이 늘어나고 빈부에 따른 차이가 커질 것이라고 말했다. 논서술형 시험이라 채점에서 공정성 문제가 제기될 수 있고 객관식에 익숙한 한국 학생들이 적응하기 어려울 것이란 지적도 토론회에서 제기됐다.이현숙 건국대 사범대학 교수는 검증된 시험이라고 반박했다. 이 교수는 공정성 문제는 신뢰성을 높일 수 있는 채점 제도를 운영함으로써 충분히 해결할 수 있는 문제이고 일부 방안은 현재 대입 논술 채점에서도 반영하고 있다며 문제는 채점의 전문성을 신뢰하지 않는 사회적 풍토와 1점으로 당락이 결정되는 입시의 경쟁 구조에 있다고 본다고 말했다.국내에도 이미 IB 교육은 들어와 있다. 경기 의왕시 경기외고는 영어에 능통한 일부 학생들을 대상으로 IB 교육을 하고 있다. 한 경기외고 학생은 IB는 역량의 문제가 아니다라며 자기 생각을 말하는 것은 기존에 성적이 낮았던 학생들도 충분히 할 수 있다. 기회가 주어지기만 하면 누구나 할 수 있다고 말했다. 또 다른 학생은 공교육에서 학업에 흥미가 없어 엎드려 자는 아이들에게도 가능할 것이라며 아이들이 자는 것은 교육이 그렇게 만들었기 때문이라고 말했다
멕시코 서부 해상서 규모 5.7 지진	http://news.naver.com/main/read.nhn?oid=001&sid1=104&aid=0009568935&mid=shm&mode=LSD&nh=20170924220326	김아람 기자  24일현지시간 오전 5시 6분께 멕시코 서부 바다에서 규모 5.7의 지진이 발생했다고 미국지질조사국USGS과 유럽지중해지진센터EMSC가 밝혔다.    진앙은 멕시코 치아파스 주 토날라에서 남남서쪽으로 99 떨어진 해상이며 진원 깊이는 약 60다.    지진에 따른 피해는 아직 확인되지 않았다.    멕시코에서는 지난 7일 규모 8.1 강진으로 최소 90명이 숨진 데 이어 지난 19일에도 규모 7.1 강진이 일어나 지금까지 최소 307명이 사망했다.    전날인 지난 23일에도 멕시코 남부에서 규모 6.1의 지진이 발생해 수도 멕시코시티 주민 수만 명이 대피했다
때 아닌 모기 극성…예년의 2배	http://news.naver.com/main/read.nhn?oid=449&sid1=102&aid=0000138322&mid=shm&mode=LSD&nh=20170924215901	요즘 잠자리에 들었다가 귓가를 맴도는 모기 소리에 깜짝 놀랐다는 분들이 많은데요    한여름에도 잠잠하던 모기가 가을이 되면서 오히려 더 기승을 부리고 있습니다.   모기도 입이 삐뚤어진다는 처서가 지난 지 벌써 한달이 넘었는데 말이죠.   그렇다면 왜 모기가 늘어났는지 박지혜 기자가 취재했습니다.  리포트  가을이 깊어가지만 모기와의 전쟁은 끝나지 않았습니다.   조진욱서울 은평구  오히려 여름에는 모기가 없었고 최근에는 날씨가 선선해졌는데 모기가 있는 것 같아요.   김재현경기 부천시  장마가 끝나니까 많이 늘어났어.    지난달 마지막주 서울지역 56곳에서 채집한 모기는 311마리.    그런데 9월 들어 639마리로 늘었습니다.    최근 3년 동안 같은 기간 채집된 모기수 평균보다 2배 가까이 많습니다.   모기 서식지인 유수지와 정화조에서는 모기 유충의 흔적을 쉽게 찾을 수 있습니다.    늦여름에 쏟아진 국지성 호우 때문입니다.   축축한 물 웅덩이는 모기가 번식하기 좋은 조건을 갖췄는데요   최근 내린 비로 물 웅덩이가 늘어나면서 모기 개체 수도 증가했습니다.   이동규  고신대 보건환경학부 교수  여름철이 엄청 가물었어요. 그러다가 8월 후반 되면서 논에 물이 많이 찼고요 그러면서 가을철 모기가 늘었죠.    모기는 최저 기온이 10도 이하로 떨어질 때까지 물이 고인 곳에 알을 낳고 번식합니다.   채널A 뉴스 박지혜입니다
배달원들은 아파트 입구 비번을 알고 있다	http://news.naver.com/main/read.nhn?oid=469&sid1=102&aid=0000237925&mid=shm&mode=LSD&nh=20170924213651	음식 주문했는데 문 앞서 딩동빠른 배달 위해 건물 비번 공유원룸 등 혼자 사는 여성 불안감오피스텔 들어가 택배 절도 등거주지 침입 범죄 해마다 증가종사자 범죄자로 보는 시선 씁쓸 서울 송파구 소재 오피스텔에 혼자 사는 조모29씨는 최근 배달음식을 주문했다가 예상치 못한 노크 소리에 깜짝 놀랐다. 음식 주문 때 알려준 건 건물 이름과 호수뿐인데 배달원이 1층 현관문을 알아서 열고 들어와 곧장 문을 두드렸기 때문. 1층 현관에서 호출하는 게 맞지 않느냐고 따지자 빠른 배달을 위해 웬만한 건물들 비밀번호는 직원끼리 공유한다는 답이 돌아왔다. 조씨는 업무 편의 목적은 이해하지만 같은 건물에 혼자 사는 여성들도 많은데 입주자 동의도 없이 불특정 다수가 집을 드나들고 있다 생각하니 무섭다고 했다.원룸 오피스텔 등 1인가구 밀집지역 상인 또는 배달원이 건물 출입에 필요한 비밀번호를 공유하면서 거주자들 불안이 커지고 있다. 업무상 건물을 수시로 드나들 수밖에 없는 배송업체 직원들은 수월한 업무를 위해 비밀번호 공유가 필요하다는 입장이지만 거주자들은 당연히 주민 동의를 얻고 들어와야 하는 것 아니냐고 맞선다. 외부인 출입을 2중 3중으로 통제하는 아파트나 지문인식 출입문을 도입하는 오피스텔이 등장하는 등 주택 보안기술은 날로 발전하고 있지만 주거침입 범죄는 최근까지 꾸준히 늘고 있다. 경찰청에 따르면 2012년 7593건이던 주거침입죄 발생 건수는 매년 늘어 지난해 1만1638건에 달했다. 5년 새 무려 65 늘어난 셈이다. 실제 지난 3월엔 30대 남성 오모씨가 서울 마포구 한 공인중개사사무소 직원으로 일할 때 적어뒀던 인근 건물 출입문 비밀번호를 이용해 원룸과 오피스텔 복도에 놓여있던 택배 물품을 50여 차례 훔쳐 경찰에 구속됐다. 당시 오씨는 등산복 영양제 등 자신이 직접 쓸 수 있는 물건 외에도 원피스나 레깅스 같은 여성용 의류까지 거둬들였다. 택배운송업자 손모45씨는 누군가가 알려준 번호를 적어놓은 것일 뿐 신분과 목적도 확실한 데 일일이 허락 받고 들어갔다간 그날 맡은 배송을 다 해내기 어렵다면서 우리를 잠재적 범죄자로 보는 시선도 씁쓸하다고 했다. 일부는 오랫동안 비밀번호를 바꾸지 않아 출입문 버튼 특정 번호만 지워져 있거나 아예 출입구 근처에 비밀번호가 적혀있는 경우도 많다면서 되레 건물 관리자 부주의를 꼬집는다.다만 공동주택 거주자들은 신문이나 우유 등 매일 정기적으로 오가는 배달원에 대해선 거부감이 덜하다. 이들이 건물 출입문 비밀번호를 공유하거나 출입카드를 소지한 경우도 있지만 안면이 있다 보니 믿을만하다는 것이다.  경찰은 거주자 안전이 최우선이라는 전제 하에 업자 불편을 최소화할 수 있는 방법을 함께 찾을 것을 권했다. 곽창용 송파경찰서 생활안전과장은 보안 시스템은 철저히 지키되 상시 출입자에겐 출입카드를 제공하는 등 주민 불안과 업자들 불편을 함께 해소하는 방안이 있을 것이라고 조언했다
"학대 예방" vs "인권 침해"…요양시설 CCTV 설치, 당신은?	http://news.naver.com/main/read.nhn?oid=055&sid1=102&aid=0000571385&mid=shm&mode=LSD&nh=20170924210523	24시간 간호가 필요한 어르신들은 노인요양시설을 이용하기도 하지요. 그런데 일부 시설에서 불미스러운 일이 생기자 어린이집처럼 의무적으로 CCTV 설치하자는목소리가 나옵니다.노인요양시설 CCTV 설치에 대한 생각들 박찬근 기자가 열린 마이크로 들어봤습니다.기자지난 14일 암 투병 중이던 노모를 여읜 A 씨.어머니는 요양병원에서 퇴원할 당시 등과 어깨에 멍이 들어 있었습니다.돌아가시기 전 어머니는 간호사들에게 맞았다고 말했지만 병원 측은 침대에서 스스로 떨어졌다고 말했습니다. CCTV도 없고 증거를 할 만한 것도 없고.이런 답답함을 풀기 위해 CCTV를 설치하자는 얘기가 나옵니다.자기 보호와 대처 능력이 부족한 노인 보호를 위한 대안이 될 수 있을까김유진경기 여주시 CCTV 설치 반대  어르신들이 나이가 들면 실수를 많이 하셔요. 환자들이 느끼기에 수치스러울 수도 있는 일들이 일어나기 때문에 CCTV는 개인적으로 반대해요.한설화경기 안양시 CCTV 설치 찬성  저희 엄마가 요양원에 계신데요 제가 마침 면회를 갔는데 제 눈으로 직접 때리는 걸 봤어요. 어느 요양원이든 요양병원이든 CCTV가 설치됐으면 좋겠어요.CCTV 설치를 법제화하자는 움직임도 시작됐습니다.지난해 노인요양시설에도 CCTV 설치를 의무화하자는 법안이 발의돼 현재 국회 계류 중입니다.모든 노인요양시설에 CCTV를 설치하고 기록된 영상은 60일 이상 보존하도록 하자는 내용입니다.엄상수경기 고양시 CCTV 설치 찬성 자율에 맡기다 보면 병원 입장에서는 CCTV 설치를 안 할 게 분명하기 때문에.박상준경기 의정부시 CCTV 설치 반대  유치원 폭행 사건 같은 경우에는 CCTV를 달았는데도 불구하고 사건이 줄어들었다고는 생각을 하지 않습니다.정형선연세대학교 보건행정학과 교수  학대 문제라든지 이런 문제들이 사후적으로 확인이 될 수 있기 때문에 당연히 사전에 예방 효과가 나타나는 거죠.윤정숙형사정책연구원 연구위원  노인에 대한 인권의식이나 노인학대를 예방하기 위한 여러 가지 방책을 교육받는 것이 굉장히 중요하다고 생각합니다.CCTV 논란은 비록 불신 때문에 시작됐지만 논의 과정과 결론은 신뢰와 배려 속에 이뤄져야 할 겁니다.영상취재  최준식 영상편집  장현기박찬근 기자geunsbs.kr 나도펀딩 병원 어린이 환아복 후원하기 취재파일 스페셜5
영국 식당가 "종업원 없어요"…갑작스러운 구인난, 왜?	http://news.naver.com/main/read.nhn?oid=421&sid1=104&aid=0002961883&mid=shm&mode=LSD&nh=20170924225444	브렉시트Brexit영국 유럽연합 탈퇴를 앞두고 이민자들의 고국행이 늘어나는 가운데 영국 레스토랑은 일손 부족으로 곤욕을 치르고 있다.  AFP브렉시트로 EU 이민자 이탈청소건설요식업계 비상서울 박승희 기자  브렉시트Brexit영국의 유럽연합 탈퇴를 앞두고 이민자들의 고국행이 늘어나는 가운데 영국 식당가는 일손 부족으로 곤욕을 치르고 있다. 사실 일손 부족이 벌어지는 업계는 이뿐만이 아니다. 23일현지시간 AFP통신에 따르면 영국이 지난해 6월 국민투표를 거쳐 유럽연합EU 탈퇴를 결정한 이후 영국을 떠난 EU 회원국 국민은 지난 1년간 3만3000명에서 12만2000명으로 크게 늘었다.  이 같은 움직임에 따라 저숙련 이민자들의 노동에 의지해 왔던 청소건설요식업 등 분야 산업은 인력 부족으로 어려움을 겪게 됐다. 이들 산업에는 폴란드리투아니아 등 동유럽 출신 이민자들이 다수 포진해있었다.피자 프랜차이즈 프랑크 만카의 모회사 풀햄쇼어 관계자는 우리 회사는 20만이 영국인이라며 떠나려는 유럽 노동자들을 설득해 발길을 붙잡기 위해 인센티브 제도를 시행하고 있다고 말했다. 우피 이브라힘 영국접객업협회BHA 회장은 이듬해 3월 영국의 EU 탈퇴 이후 이민이 중단되면 연간 5만명의 근로자가 부족해지는 고용 위기에 직면하게 될 것이라며 이민 정책 제한은 접객업 인력 부족의 요인이라고 지적했다.영국 국민이 브렉시트를 지지한 이유 중 하나는 동남부 유럽에서 저숙련 이민자들이 영국으로 들어와 자신들의 일자리를 빼앗는다는 이유 때문이었다. 하지만 업계에서는 이민자들의 일자리를 도맡아 할 영국인들을 당장 구하는 건 하늘의 별 따기라고 한숨짓고 있다.  런던 서부에서 식당을 운영하는 알렉스 레스만은 브렉시트로 인해 파운드화 가치가 하락하면서 이민자들이 떠나고 있다며 영국인들은 장시간 노동에 대한 의지가 희박해서 이민자들과 같이 헌신적 노동을 기대하기 어렵다고 불평했다
신DTI·DSR 적용 될 듯…부동산 시장 벌써 한파주의보	http://news.naver.com/main/read.nhn?oid=005&sid1=101&aid=0001030382&mid=shm&mode=LSD&nh=20170924214012	정부가 부동산 이상과열로 인한 주택담보대출 등 가계부채를 억제하기 위해 조만간 가계부채 종합대책을 발표할 예정이다.  10월 중순 내놓을 가계부채 대책은 부동산 투기수요 억제하고 다주택자의 돈줄을 조인다는 측면에서 8.2 부동산 대책과 상호 보완적이면서도 전국 모든 주택에 적용될 만큼 더욱 광범위해 부동산 시장에 상당한 영향을 미칠 전망이다. 관계부처에 따르면 정부는 10월 추석 이후 가계부채 종합대책을 발표할 예정이다. 당초 8월말 발표에서 9월 중순으로 미뤄진데 이어 두 번째 연기다. 이처럼 가계부채대책 발표가 계속 늦어지는 이유는 시장에 미칠 파장이 그만큼 크기 때문이다.  정부는 이번 대책에 장래소득 증가감소 가능성 등을 반영하는 신 DTI를 도입할 계획이다. 신DTI는 대출 심사 시 해당 주택담보대출의 원리금뿐 아니라 기존에 가지고 있는 주담대의 원리금 상환액까지 반영한다.  또 소득의 지속성이 완전히 입증되지 않을 경우 일부분만 소득으로 인정하고 장기대출의 경우 연령대를 감안해 장래 소득을 산출하는 방식도 적용된다. 정부는 내년부터 신DTI를 도입할 계획인데다 DTI 적용 지역을 수도권으로 전국으로 확대할 방침이다. 이와 함께 DTI보다 강한 여신심사 기준인 총부채원리금상환비율DSR 가이드라인도 포함된다. DSR는 주택담보대출 뿐만 아니라 마이너스통장 등 신용대출까지 포함해 원리금 상환액을 산출하는 방식이다. 만약 DSR이 본격적으로 적용되기 시작하면 대출자의 대출 한도가 큰 폭으로 줄어든다.  문제는 이런 내용이 한꺼번에 발표될 경우 부동산 시장에 큰 충격을 줄 가능성이 높다. 특히 가계부채의 54가 주택관련 대출이기 때문에 수요자들의 내 집 마련이 어려워지는 것은 물론 건설사들도 자금 확보가 어려워 분양시장이 얼어붙을 전망이다. 이어 부동산 시장이 거래 절벽으로 인해 침체기에 접어들면 거시경제에도 악영향을 미칠 것이라는 우려가 나오고 있다
