가격 폭락에…작년 쌀 변동직불금 1조5천억 사상 최대	http://news.naver.com/main/read.nhn?oid=001&sid1=101&aid=0009053934&mid=shm&viewType=pc&mode=LSD&nh=20170221204752	공공비축벼  자료사진WTO 농업보조금 한도 초과정부 쌀 보조금 정책 기로에쌀 변동직불금 지급단가는 3만3천499원으로 확정 정열 기자  급격한 소비 감소와 풍년 등으로 쌀값이 폭락하면서 정부가 농가 소득보전을 위해 지급하는 쌀 변동직불금 예산이 지난해 사상 최대 규모인 1조4천900억 원까지 치솟았다.    이는 2005년 쌀 직불제 시행 이후 최대 규모이며 7천193억 원이었던 전년에 비하면 2배가 넘는 수준이다.    쌀값수확기 산지 80 기준이 1년 사이 15만659원에서 12만9천711원으로 폭락하면서 정부가 보전해줘야 할 차액이 대폭 늘어났기 때문이다.    농림축산식품부는 2016년산 쌀 변동직불금 단가를 80당 3만3천499원으로 결정했다고 21일 밝혔다.     이 단가는 각 시도가 확정 보고한 대상면적이 지난해 지급면적당 72만6천ha보다 2만ha 줄어든 70만6천ha로 최종 집계됨에 따라 총 직불금 예산1조4천900억 원에 대상면적과 표준생산량63가마ha을 적용해 산정한 금액이다.    면적 감소는 직불금 신청농가에 대한 이행점검으로 부적합 농지를 제외한 결과라고 농식품부는 설명했다.    쌀 변동직불금은 쌀값 하락으로 인한 농가소득 감소를 보전해 주는 제도다.     수확기 산지가격작년 10월올 1월 평균 12만9천915원80 기준이 목표가격18만8천 원을 밑돌 경우 둘 사이 차액의 85에서 기본 보조금고정직불금1만5천873원을 제외한 금액을 보전해 준다. 공공비축미  자료사진    하지만 올해 변동직불금은 실제 계산보다 다소 낮게 책정됐다.     실제 계산액이 2005년 직불금 제도 시행 이후 처음으로 세계무역기구WTO의 농업보조금 한도 총액1조4천900억 원을 약 77억 원 초과하자 이 한도에 맞춰서 다시 계산했기 때문이다.     WTO는 도하개발아젠다DDA 협상에 따라 한국의 농업보조금 상한액AMS을 1조4천900억 원으로 설정한 바 있다.    업계에서는 변동직불금 총액이 WTO가 규정한 농업보조금 한도를 넘어선 것을 계기로 정부가 직불금으로 농민 수입을 떠받쳐 주는 정책이 한계에 부딪혔다는 지적이 나온다.    올해는 차액 자체가 크지 않지만 앞으로도 수요감소 등으로 계속 쌀값이 추락하면 농민들이 보조금을 받지 못해 보게 되는 손해도 커질 수밖에 없기 때문이다.    농민 반발 등이 불 보듯 뻔히 예상되는 상황에서 쌀 재배면적 축소 등 근본적 농정혁신이 시급하다는 지적이 그래서 나온다
공공기관도 '쪼개기 계약' 꼼수 비일비재	http://news.naver.com/main/read.nhn?oid=056&sid1=102&aid=0010422291&mid=shm&mode=LSD&nh=20170221220609	앵커 멘트입법기관인 국회가 인턴을 채용하면서 11개월 짜리로 이른바 쪼개기 계약을 해서 퇴직금을 안주고 있다는 소식 어제20일 전해드렸는데요 보도가 나가자 피해를 호소하는 제보가 잇따랐는데요 특히 공공기관에서 만연하고 있다는 하소연입니다. 리포트 기간제 보조 체육 교사인 정동창 씨. 지난달 서울의 한 초등학교와 열 번째 근로 계약을 체결했습니다. 계약 기간은 이번에도 11개월입니다.인터뷰 정동창기간제 보조 체육 교사  11개월 계약이다 보니까 2월에는 실업급여를 받아야 하는 입장이고요. 가르침에 있어서 자괴감을 좀 느끼는 부분이 많습니다. 벌써 9년 넘게 체육 보조교사로 일해왔지만 월급은 여전히 150만 원대에 불과합니다. 11개월짜리 계약만 계속해 신규채용으로 분류되다 보니 인정받을 경력이 없어 그동안 10여만 원 정도만 오른 겁니다.인터뷰 정동창기간제 보조 체육 교사  아르바이트라든지. 편의점이라든가 또는 스키장이라든지 각종 스포츠센터 가면서 전전하면서. 한 공립대학에서  기간제 장비 관리직으로 일했던 이 모 씨 정규직 전환을 꿈꿨지만 이 씨 역시 계약기간인 11개월만 근무한 뒤 일을 그만둬야 했습니다. 근로기간이 1년이 안 돼  퇴직금도 받지 못했습니다.녹취 이00공립대학 기간제 근로자음성변조  11개월이면 어느 정도 할 수 있을 만할 때쯤 다 배워서 이제 손에 익고 알아갈 때쯤 다시 그만두고 다른 회사를 가야 되는 상황이니까. 공립대뿐 아니라  국책 연구기관과 구청 동사무소 등  비일비재하게 이뤄지는  11개월짜리 쪼개기 근로 계약 해당 기관들은 꼼수임을 인정하면서도 예산 때문에 불가피하다고 말합니다.녹취 공공기관 관계자음성변조  특별한 이유가 있다기보다 저희 예산 범위 내에서 하는 거기 때문에 그래서 그렇습니다
"돈이 있어야 취업" 지금은 알바 전쟁	http://news.naver.com/main/read.nhn?oid=449&sid1=102&aid=0000124259&mid=shm&mode=LSD&nh=20170221220454	요새 대학 졸업과 동시에 취업하는 게 하늘의 별따기라고 하죠. 그래서 길게는 3년 이상 생활비와 학원비 각종 시험 응시료를 부담해가며 취업준비생 기간을 거치는 일이 많다고 합니다.   결국 아르바이트를 할 수밖에 없는데요. 별의별 알바 경쟁에 뛰어들어야하는 취업준비생들의 실태를 박지혜 정부경 기자가 취재했습니다.  리포트 주점 서빙 음식 배달 주유소 사무보조 임상실험 건설 일용직 택배 전단지 배포 호텔 설거지 주차요원 콜센터    알바 전쟁 내몰리는 취업준비생   돈을 버는 게 아니라 몸이 더 상하는 것 같은    대학교 4학년 박찬솔 씨는 매일밤 주점에서 음식을 만들고 나릅니다.   졸업 미루고 아르바이트 계속   원래 이번 달이 졸업이지만 학교를 더 다니며 아르바이트를 계속하기로 했습니다.   박찬솔  취업준비생  쓸 돈이 있어야 하니까 알바를 하게 되는 것 같아요. 입사시험보는 것도 돈이 드는데    대학 4년 동안 안 해본 일이 없을 정도.   박찬솔  취업준비생  물류센터 알바 술집 서빙 식당 서빙도 하고 주류 행사도 다니고 행사 보조 진행요원도    이른 아침 집을 나서는 대학교 4학년 정모 씨.    정씨의 아르바이트 장소는 대학병원 실험실입니다.   정모 씨  취업준비생  임상실험 같은 게 시급이 꽤 세거든요. 주사를 맞기도 하고 MRI 촬영해서 실험을 한다든지    금융권 취업이 목표인 정씨 역시 돈이 되는 아르바이트는 거의 다 해봤습니다.   정모 씨  취업준비생  가리지 않고 하는 편이에요. 전단지 배포 호텔에서는 홀서빙 설거지를 한다든지. 택배 상하차 알바    그러나 취업준비생들이 한꺼번에 몰리다보니 아르바이트를 얻는 것도 정규직 취업 못지 않게 어렵습니다.   박찬솔  취업준비생  지원하면 연락이 아예 안 오는 경우도 다반사고요. 보통은 벌써 지원자가 꽉 차서 더 이상 안 받는다고   취재진이 직접 아르바이트를 구해봤습니다.   인력업체 관계자  마감이 돼서. 다른 데는요 다른 데도 다 마감됐거든요.    10여 차례의 시도 끝에 간신히 얻은 일감은 전단지 배포.   박지혜 기자  단기 아르바이트 중 난이도가 가장 낮다는 전단지 알바.   현장음  이것 좀 받아주세요.   정부경 기자  영하 4도의 추위 속에서 두 시간 동안 전단지를 돌리고 받은 돈은 1만5천 원.   교통비를 빼면 실제 수익은 만 원 남짓에 불과하지만   이런 단기 알바에도 매번 수십 명이 몰리는 실정입니다.    아르바이트에 얽매이다보면 막상 진짜 목표인 취업준비를 할 시간이 부족할 정도.    취업을 위해 졸업을 미루거나 휴학한 대학생 4명 중 1명 이상은 2개 이상의 아르바이트를 한다는 설문조사 결과도 있습니다.    그러나 이렇게 열심히 아르바이트를 하다 피해를 당하는 경우도 많습니다.   김도영  취업준비생  2박 3일동안 전단지 아르바이트를 했는데 임금을 주지 않겠다고 한 게 아직도 기억에 남아요.   아르바이트 피해 대책 모임 결성  비슷한 일을 당한 젊은이들이 피해방지 모임을 만들기도 합니다.   김종수  취업준비생  알바 임금 떼인 것 때문에 괜히 신고했다가 일 귀찮아지고 그러면 내가 취업에 문제 생기니까    사상 취악의 실업난.    우리 젊은이들이 제대로 취업해보기도 전부터 아르바이트 전쟁으로 내몰리고 있습니다.   채널A 뉴스 정부경입니다
'꿀벌 개체수 급감' 로봇이 꿀벌 역할 대신하나?	http://news.naver.com/main/read.nhn?oid=214&sid1=105&aid=0000741237&mid=shm&mode=LSD&nh=20170221214401	전 세계 꿀벌 개체수가 크게 줄면서 멸종위기 우려까지 제기되자 과학자들이 꿀벌의 역할을 대신할 로봇 개발에 뛰어들고 있습니다. 리포트 백합꽃 주변으로 소형 비행체가 빠르게 날아다닙니다.일본 연구진이 최근 개발한 4cm 크기의 초미니 드론 꿀벌 로봇입니다.이 로봇은 꿀벌의 솜털처럼 동체에 끈적한 젤을 바른 동물의 털을 장착해 꽃가루를 묻힌 뒤 원하는 위치에 정확히 털어냅니다.폴란드 연구진은 먼지떨이를 사용한 꿀벌 대체 로봇 개발에 집중하고 있습니다.바퀴로 이동하며 먼지떨이로 수분을 돕는 로봇을 개발한 데 이어 최근엔 꽃이 있는 지역을 알려주면 스스로 경로를 계산해 날아가서 먼지떨이로 수분하는 드론 실험도 성공했습니다.라팔 달레우스키바르뱌사 공대 교수야외에 있는 꽃을 찾아서 꽃가루를 벌처럼 다른 꽃으로 옮겨줍니다.미국에선 대학생이 꽃가루를 저장했다 방사할 수 있는 로봇을 개발해 화제가 됐고 하버드 대학에선 장기 프로젝트로 벌을 모방한 0.1g짜리 다목적 로봇 로보비를 개발 중입니다.로버트 우드하버드대 교수농업을 돕는 데도 유용할 것입니다.꿀벌의 도움으로 열매를 맺는 식물은 전 세계 식용작물의 75에 이르는 상황
'도둑이 너무 많다'…영유아 정부보조금 '줄줄'	http://news.naver.com/main/read.nhn?oid=022&sid1=102&aid=0003148176&mid=shm&mode=LSD&nh=20170221203607	부패척결추진단 사립유치원어린이집 점검해보니정부 보조금과 학부모 부담금으로 운영되는 사립유치원과 민간어린이집의 시설 운영비가 줄줄 새고 있는 것으로 나타났다. 운영비로 명품 가방을 사거나 자녀 학비를 내는가 하면 심지어 자동차 보험료와 과태료까지 내는 경우가 비일비재했다. 국무조정실 산하 부패척결추진단은 9개 시도에 있는 규모가 큰 어린이집과 유치원 95곳을 점검한 결과 91곳에서 609건의 위반 사례와 부당사용 금액 205억원을 적발했다고 21일 밝혔다.추진단은 54개 유치원에서 위반사항 398건에 부당사용액 182억원을 37개 어린이집에서 위반사항 211건에 부당사용액 23억원을 적발했다. 추진단은 이 가운데 8곳에 대해 수사의뢰 및 고발조치하고 이들과 거래한 업체 19곳에 대해서는 세금 탈루 의심업체로 세무서에 통보했다.유치원 운영비는 쌈짓돈방과후 수업은 유치원 내에서만 할 수 있게 돼 있지만 A유치원 설립자는 이를 무시했다. 그는 원장 몰래 유치원 시설에 어학원을 등록한 뒤 영어교육비로 유치원 계좌에서 10억원을 뜯어갔다. 이 어학원에서 도예요리교육 수영강습 등을 한다며 교육비와 시설보수비로 10억6000만원을 추가로 이체했다. 본인이 타는 외제차 3대를 유치원 운영에 쓴다며 차량 보험료 1400만원을 냈다. 교직원에게 선물을 준다면서 유치원 운영비로 250만원 상당의 루이뷔통 가방 등을 사기도 했다. 이 설립자는 증빙자료 없이 3개 유치원 회계로 53억원을 중복해 집행했고 이에 대한 조사를 조직적으로 방해하기도 했다.B유치원 원장은 유치원 자금으로 두 아들의 등록금과 연기 아카데미 수업료 3900만원을 지출하는 것도 모자라 모텔비를 내거나 성인용품을 구입하는 데 3000만원을 지출했다. 여기에 교직원의 선물을 사겠다고 기록해 놓고 실제로는 본인의 명품 가방지갑을 5000만원어치 사는 등 도덕적 해이의 극치를 보여줬다. 조사 결과 방과후 활동 교사의 인건비 1억5000만원과 각종 물품 구입비 5억4000만원이 모두 원장 본인 계좌에 입금된 것으로 나타났다.족벌기업 키우기에 열중어린이집 4개를 운영하는 C씨는 부인 명의로 유령회사페이퍼컴퍼니를 설립한 뒤 이 회사를 통해 다른 업체와 어린이집의 교구나 식자재 납품 계약을 체결하도록 했다. 이 유령회사는 2억원 상당의 교구를 납품받으면서 6억5000만원 상당의 계약을 체결한 것처럼 관련 서류를 조작하는 방식으로 총 8억6000만원을 부당거래했다. 또 부인을 어린이집의 취사부로 채용한 뒤 인건비로 5400만원 컨설팅 비용으로 7900만원을 지급했다.D유치원 설립자는 서울경기 지역에 10개의 유치원을 운영하며 가족 회사와 5억1000여만원을 불법적으로 거래한 것이 드러났다. 그는 첫째아들 회사에 보수공사 계약 명목으로 1500만원을 둘째아들 회사에는 구체적인 명세서 없이 1억2000만원을 지급했다.아울러 서울시 소재 사립유치원 679개를 전수조사한 결과 49.2에 달하는 334개 유치원이 운영 자금으로 설립자 등 개인명의 보험료 123억원을 지불한 것으로 드러났다.이에 따라 추진단은 유치원어린이집 운영의 투명성을 높이기 위해 세입세출규모를 세분화하는 내용으로 재무회계 규칙을 개선하기로 했다
고용 불안 여전…거리로 내몰린 미화원들	http://news.naver.com/main/read.nhn?oid=437&sid1=102&aid=0000148609&mid=shm&mode=LSD&nh=20170221222210	얼마 전 국회 미화원들이 정규직으로 전환돼서 화제가 됐던 일이 있지요. 국회가 모범을 보였으니 다른 공공부문도 그래도 시늉이라도 보일테지 했다면 오산이었던 것 같습니다. 파주시 시설공단에선 민간업체로 미화업무를 넘기는 걸 놓고 갈등 중입니다. 새벽에 청소트럭에 위험하게 매달려 가는 것만큼이나 미화원들의 고용불안은 커졌습니다.     기자새해 첫 월요일. 국회 환경미화원들이 국회 정식 직원으로 첫 출근을 했습니다. 큰절을 올리는 우윤근 국회 사무총장과 맞절로 화답합니다. 이 모습은 공공부문 비정규직 문제를 점차 해소해 가는 디딤돌이 될 거라 여겨졌습니다.   경기도 파주시 의회 앞입니다. 이곳에는 파란 천막이 설치돼 있는데 환경미화원 민간 위탁을 중단하고 직접 고용하라는 현수막이 내걸려 있습니다. 이 천막 안쪽으로 들어가 보겠습니다.경기 파주시 금촌동과 월롱면 등 다섯 개 읍면동의 청소 업무를 맡고 있는 환경미화원 47명은 다음 달 12일 자로 해고 통보를 받았습니다. 권성식경기 파주시 환경미화원  민간으로 안 가면 직장을 잃을 수가 있으니 잘 판단해라. 문자도 하나의 해고 통지랑 똑같은 거라고 하더라고요.파주시는 청소 민원이 잇따르고 있다며 파주시설관리공단이 맡고 있던 업무를 민간 업체로 넘기고 있습니다. 오전 6시 미화원이 승강장 앞 휴지통을 서둘러 비우고 새 비닐봉지로 갈아 끼웁니다. 짧은 거리를 이동하며 쓰레기를 차에 싣다 보니 위험한 걸 알면서도 트럭에 매달려 가고 있습니다.  지금 시각은 오전 6시 40분입니다. 작업을 시작한 지 40분 만에 벌써 이렇게 많은 쓰레기가 모였습니다. 이쪽을 보면 음식물 쓰레기도 있고 생활쓰레기도 있고 재활용품도 있습니다. 인원이 부족하다 보니 담당 지역에 다양한 쓰레기를 미화원 1명이 모두 수집하고 있습니다.어느덧 날이 밝고 서둘러 이동해야 하지만 좁은 골목길에 불법 주차한 차량 때문에 애를 먹고 있습니다.  쓰레기를 가득 싣고 다시 집하장으로 돌아왔습니다. 이곳에선 쓰레기를 종류별로 분류하는 작업을 벌이고 있습니다. 이렇게 트럭을 다 비우고 난 후에는 아직 남아있는 쓰레기를 수거하기 위해 다시 담당 구역으로 돌아갑니다.파주시는 미화원들이 민간 업체를 설립해 나갈 수 있도록 기회를 제공하고 있다고 강조했습니다. 경기 파주시 환경시설과  사실 이분들 을이 잖아요. 을한테 기회를 주는 부분에 대해서 나쁘지 않다고 생각했습니다. 고용되는 게 아니라 사용자이면서 고용되는 형태로하지만 미화원들은 민간 업체에 업무를 위탁하면 고용 불안이 계속될 수밖에 없다고 말합니다.   권성식경기 파주시 환경미화원  사회적 기업 협동조합 형태라고 설명했는데 그렇게 해서 나간 데는 한 군데도 없습니다. 고용 불안도 문제지만 노동 강도가 세질 수밖에 없어요.입찰에 참여한 민간 업체 세 곳의 등기를 떼봤습니다. 파주시 설명과 다르게 A업체 대표는 시설공단 소속 주무관입니다. 이 업체의 또다른 임원은 환경미화원의 업무를 관리 감독하는 현직 시설공단 팀장입니다.뿐만 아니라 B 업체 설립에 참여한 시설공단의 한 간부는 뇌물수수 혐의로 검찰에 구속됐습니다. 경기도와 파주시는 지난 20일부터 복무 규정 위반과 민간 위탁 과정에서 불법 사항이 없는지 등에 대해 감사를 벌이고 있습니다.국회를 신호탄으로 다른 간접 고용 근로자들이 겪고 있는 차별이 점차 해소되길 바랐지만 갈길이 멀어보입니다. 여전히 고용 불안에 시달리는 근로자들은 거리에서 추운 겨울을 보내고 있습니다.박소연 JTBC 뉴스 공식 SNS 트위터 페이스북 유튜브Copyright by JTBChttpjtbc
