국내조폭 연계 北 해커 10여 명 집단 탈북	http://news.naver.com/main/read.nhn?oid=214&sid1=100&aid=0000723487&mid=shm&mode=LSD&nh=20170113205951	중국에서 활동하던 북한 해커 10여 명이 이틀 전 집단 탈북한 사실이 확인됐습니다.이들은 국내 폭력조직에 도박사이트 해킹 프로그램을 만들어 공급해 온 걸로 알려졌는데요.어느 조직 어떤 수법이었는지 등 김세진 기자의 단독 보도입니다. 리포트 중국 지린성 창춘시에서 지난 11일 밤 9시쯤 북한 IT 관련 외화벌이 일꾼과 해커 10여 명이 탈북했습니다. 이들을 감시하던 북한 보위부 요원이 우리 국정원에 해당하는 중국 안전부에 실종 신고했지만 아직 신병을 확보하지 못한 것으로 전해졌습니다.탈북 해커 대부분은 김책공대 출신으로 알려졌습니다.이들은 연수생 신분으로 중국에서 머물면서 겉으론 유럽 기업의 프로그램 제작 하청을 받아 외화벌이를 하는 척하면서 실제로는 불법 해킹프로그램을 만들어 국내 조폭 조직에 공급한 것으로 알려졌습니다. 이들의 거래에 관여했던 현지 소식통은 범서방파 계열 조직이 조선족 폭력조직을 통해 북한 해커들에게 하청주는 형태로 일을 해왔다고 전했습니다.꼬꼬게임바둑이 등 국내 인터넷 포커류 게임 사이트를 해킹한 뒤 상대 패를 볼 수 있는 악성코드를 만들어 조폭에게 공급하는 한편 한국 조폭자금으로 캄보디아에 만들어진 도박사이트의 서버 운영도 도왔다는 겁니다.유동열자유민주연구원장북한 사이버 외화벌이 중 최근엔 가장 규모가 큰 것이 사이버 도박장을 직접 또는 간접 운영하는 것인 데 무려 67천억 원 정도로 가장 비중을 차지하고 있고.북한 해커들은 지난 2014년에도 캄보디아에서 불법 도박사이트를 운영하다 체포된 바 있습니다
'양안 긴장 촉발' 中 랴오닝호 항모전단, 칭다오 모항 귀환	http://news.naver.com/main/read.nhn?oid=001&sid1=104&aid=0008958430&mid=shm&mode=LSD&nh=20170113231616	홍콩 최현석 특파원  지난 11일 대만해협에 진입해 양안중국과 대만 긴장을 고조시켰던 중국 항공모함 랴오닝호 전단이 13일 산둥성 칭다오의 모항에 귀환했다.    중국 해군은 랴오닝호와 젠J15 함재기 헬리콥터 구축함 등으로 구성된 항모 전단이 훈련과 시험임무를 성공적으로 완수하고 이날 오후 칭다오 내 모항에 귀환했다고 밝혔다고 중국 신화통신 등이 13일 보도했다.     해군은 랴오닝호 전단이 보하이해와 동중국해 남중국해를 항행했으며 미야코해협 바시해협 대만해협을 통과했다고 설명했다.     젠15 전투기가 다양한 기상과 해상 조건에서 랴오닝호에 이착륙하는 훈련과 공중전 기술 공중 급여 등 훈련도 시행했다.     천웨치 랴오닝호 전단 사령관은 훈련이 최대한 실전에 가깝게 진행됐다며 기대했던 결과를 달성했다고 말했다.     랴오닝호 전단은 구랍 15일께 서해 해상에서 실탄 훈련을 벌이다가 25일께 동중국해와 미야코해협을 거쳐 서태평양에 진입한 다음 남중국해로 내려온 뒤 대만해협을 거쳐 귀환했다.    항모 전단이 차이잉원 대만 총통이 미국을 경유해 중남미 순방을 떠난 시점에 대만 주변을 한 바퀴 순환하는 형태로 항해해 하나의 중국 원칙을 중시하지 않는 도널드 트럼프 미국 대통령 당선인과 차이 총통에 대한 경고성으로 해석됐다.     전단이 11일 대만해협에 진입 대만과 불과 100 거리를 두고 항행하자 위협을 느낀 대만이 F16 IDF 등 전투기와 함정 등 육해공을 총동원한 비상 경계태세에 들어가면서 긴장이 고조되기도 했다. 랴오닝호 항모전단     타이베이 AFP 지난달 24일 태평양상에서 군사훈련을 하는 랴오닝호의 모습
서울에만 '5만 마리' 비둘기, AI 전파할까?	http://news.naver.com/main/read.nhn?oid=214&sid1=102&aid=0000723486&mid=shm&mode=LSD&nh=20170113205337	안 그래도 천덕꾸러기였는데 요즘 조류인플루엔자 AI를 옮길지 모른다는 쌀쌀한 눈총까지 받고 있습니다.서울에만 5만 마리가 넘는다고 하는데요.정말 조심해야 할지 비둘기만 억울한 누명인지 윤성철 기자가 확인했습니다. 리포트 서울의 한 다세대주택.옥상으로 통하는 문을 열자 비둘기 수백 마리가 푸드덕 날아갑니다.하루 한 번씩 모이를 주는 이른바 피전맘을 기다렸던 겁니다.모이를 준 지 10년은 넘은 것 같아요. 내가 오면 여기로 다 오죠.이 비둘기들에 대한 주민들의 불만은 큽니다.비둘기가 앉지 못하게 설치한 뾰족한 돌기도 무용지물입니다.배설물 탓에 처마 밑에 피한 사람들. 지나가는 사람들이 놀라서 피해 다녀요.국보 2호 원각사지 10층 석탑은 유리탑이 둘러싸여 있습니다.산성이 강한 비둘기 배설물에 표면이 녹아내리는 걸 막기 위해서입니다.이런 불만이 늘면서 비둘기를 쫓아내는 업체는 호황입니다.김석훈비둘기 퇴치 업체하루에 서너 건씩 일 처리를 하고 있고요. 이 아파트만 해도 벌써 열 번째 오고 있는 상황이고.보신대로 도심의 불청객이 된 비둘기는 이미 8년 전 유해 야생동물로 지정됐습니다.최근 조류 인플루엔자 AI가 전국에 확산되면서 비둘기가 AI를 전파하는 매개체일 거란 불안감도 커지고 있습니다.비둘기 사체의 AI 감염 여부를 확인해달라는 의뢰가 최근 빗발치고 있습니다.국립환경과학원 관계자하루에 5마리에서 10마리 정도 들어오거든요. 1월 이후에 많이 늘었어요.도심 속 비둘기를 직접 포획해 위생 상태를 확인해 보겠습니다.서울의 한 공원 근처에서 잡은 비둘기의 가검물을 분석했더니 AI 바이러스는 검출되지 않았습니다.AI가 처음 발견된 지난해 11월 이후 국립환경과학원의 비둘기 72마리에 대한 검사 결과도 마찬가지였습니다.비둘기가 도심에 머무는 텃새여서 철새와 접촉이 적은 데다 닭 같은 가금류에 비해 면역력도 강해 감염되지 않은 것으로 분석됐습니다.정원화국립환경과학원 바이오안전팀 팀장가금류와 다르게 AI 바이러스에 감염돼도 저항성이 굉장히 크기 때문에 체내에서 증식 없이 무증상인 상태로 그냥 지나치고 배설물로도 거의 배출되지 않습니다
 1년에 무려 8만 장…서울대 '스캔 노예' 파문	http://news.naver.com/main/read.nhn?oid=055&sid1=102&aid=0000494483&mid=shm&mode=LSD&nh=20170113211440	서울대학교의 한 교수가 대학원생들에게 8만 장에 달하는 논문과 책을 스캔시켰다는 증언이 나왔습니다. PDF 파일로는 4천 개에 달합니다. 워낙 분량이 많아서 학생들은 이 일을 팔만대장경 사업이라고 부르기까지 했습니다. 갑질 논란이 불거졌는데 학교 측 대응은 부실합니다.기자서울대 대학원에 다녔던 한 학생이 교육부에 제출한 고발장입니다.교수의 부당한 지시로 대학원생 4명이 돌아가며 수만 장의 논문과 서적들을 스캔해야 했다는 내용입니다.학생들이 1년에 걸쳐 스캔한 분량은 PDF 파일로만 4천여 개.쪽수로는 무려 8만 장이 넘는 엄청난 양입니다.대학원생 A  다른 교수들은 자기 교수 연구실에 있는 모든 책들을 대학원생들이 디지털화해서 가지고 있다며 자신의 개인 연구자료들이 있는데 그것들을 다 스캔해달라고 했어요.각종 논문과 서적을 빌린 뒤 해당 페이지를 스캔하기 위해 학생들은 휴일과 밤낮을 가리지 않고 일해야 했다고 말합니다.대학원생 B  대학원 생활은 퇴근 시간이 따로 있는 게 아니니까 밤에도 당연히 했고 주말에도 나온 학생들이 있었어요. 은 사실 몸이 두 개라는 얘기도 돌았어요.이 학과 대학원생들은 이 일을 대장경 사업이라고 빗대서 불렀습니다.대학원생B  계속 찍어내니까 학생들은 대장경 사업한다고 얘기했어요.한 학생은 교수의 과도한 업무 지시에 항의하다 결국 학교를 그만뒀고 한국을 떠난 뒤에야 용기를 내 교육부에 고발장을 제출했습니다.서울대 대학원 총학생회 관계자  국가인권위에서도 사적 노동 문제라고 지적하고 있습니다. 대학원생은 교수의 사적인 심부름을 하려고 들어온 것이 아닙니다.하지만 서울대 인권센터는 교육부의 진상 조사 요구를 거부하고 있습니다.해당 교수를 음해하기 위한 고발일 수 있다며 떳떳하면 직접 고발하라는 입장입니다.취재에 나서자 해당 교수는 스캔 업무를 시킨 것은 맞지만 학생들이 그렇게 느끼는 줄은 몰랐다고 주장했습니다.영상취재  김남성 영상편집  박선수 VJ  이준영앵커원종진 기자 8만 장 스캔. 좀 더 느낌이 확 오게 설명해줄 수 있나요기자제가 들고나온 게 2천 페이지짜리 법률 대사전인데요 이 책 40권을 한장 한장 다 스캔할 정도의 노동력이 들었다고 보시면 될 것 같습니다.또 복수의 학생들은 오래된 전문서적들도 많아서 품이 굉장히 많이 들었다고 고서적 같은 것들은 찢어지면 안 되니까요. 네 그래야 했다고 복수의 학생들이 증언하는데요 해당 교수는 자세한 것은 인권 센터에서 이야기하겠다고 취재진에게 밝혔지만 복수의 학생들이 저녁 늦게 주말까지도 동원됐다고 증언했습니다.앵커교수의 해명을 아까 리포트에서도 들어봤지만 그렇게 납득이 잘 되진 않는 것 같아요.기자대학교수는 대학원생들의 논문 심사권 또 유학 추천서를 써주는 등 절대적인 권한을 행사할 수 있는데요 이런 상황에서 해당 대학원생 여럿이 저희에게 증언하고 자료를 보여줬다는 것은 이들에겐 어찌 보면 마지막 절규일 수 있다는 생각이 듭니다.또 해당 교수는 부탁이었다 그리고 논문 공유 차원이었다고 이야기했는데요 과연 이렇게 막강한 권한을 누리는 교수의 부탁을 거절할 수 있는 학생이 과연 몇이나 될까 라는 생각이 듭니다.또 단지 공유가 목적이었으면 논문 제목이나 책 제목을 알려주면 되지 이 많은 양을 굳이 스캔시킬 필요가 있었을까 라는 생각이 듭니다.앵커그런데 학교 인권 센터 측이 교육부에서 조사하라고 했는데 안 움직이고 있다는 거잖아요기자인권센터의 대응도 취재해보니 조금 이상했는데요 고발인이 자신의 실명과 연락처까지 교육부에 고발할 때 제공했고 교육부에서도 조사를 여러 차례 요청했는데 아직 직권조사에 나서지 않고 있는 상황입니다.그래서 서울대 인권센터는 몇 년 전에 자체 조사를 통해 학내 교수들의 대학원생 노동력 착취 문제가 심각하다는 조사 결과를 내놓은 적이 있었는데 그냥 발표만을 위한 조사를 한 건지 되묻고 싶습니다
늘어나는 생계형 범죄, '한국형 장발장' 구제	http://news.naver.com/main/read.nhn?oid=214&sid1=102&aid=0000723483&mid=shm&mode=LSD&nh=20170113205412	먹고살기 힘들다는 이유로 소액을 훔쳐 달아나는 생활범죄 이른바 생계형 범죄가 최근 늘고 있습니다.장기화된 경기침체가 원인으로 꼽히는데 피해를 보는 영세상인은 울상입니다. 리포트 한 남자가 식당 창문으로 몸을 내밀더니 곧이어 가게 안으로 들어옵니다.이곳저곳을 뒤지더니 30만 원을 훔쳐 달아납니다.이번엔 식당 현관 유리문 앞에 또 다른 남자가 나타납니다.돌로 현관 유리창을 깨더니 가게 안에 손을 넣어 금고를 들고 달아납니다.금고 안엔 현금 5만 원이 전부였는데 그것도 전부 동전이었습니다. 경찰에 붙잡힌 이들은 모두 먹고살기 힘들어서 범죄를 저질렀다고 말했습니다.김정선서울 서대문경찰서 강력계장경기가 어려워지면서 구직에 계속 실패를 하고 그게 이제 반복이 되다 보니까 범행했다고.최근 5년 사이 전체 강도와 절도 사건은 줄어들었습니다.반면 100만 원 이하 소액 강절도 사건은 두 배 가까이 늘었습니다.이윤호동국대 경찰행정학과 교수경제 사정의 악화는 근본적인 원인이라면 요근래 들어 사회 전체가 법과 질서가 잘 지켜지지 않는다고 많은 사람이 생각하게 되고 너도나도 작은 일탈을 더 쉽게 하게 되지 않나.작은 범죄가 급증하자 경찰도 경미범죄심사위원회를 열어 형사입건해 기소하기보다 즉결심판으로 감경하거나 훈방조치를 하고 있습니다.불경기에 전과자를 양산하지 않기 위해서인데 범죄의 주된 표적이 되는 영세업주들 사정도 녹록하지만은 않습니다.이오남피해식당 주인그날 오전에 장사를 못했어요. 그게 조그만 가게인데 얼마나 저기 했으면 왔겠느냐 싶은 생각도 들면서
성폭행과 폭행으로 얼룩진 보육원…은폐 '급급'	http://news.naver.com/main/read.nhn?oid=055&sid1=102&aid=0000494476&mid=shm&mode=LSD&nh=20170113205717	서울의 한 보육원에서 원생들 간 성폭력과 폭행이 지속돼 온 사실이 뒤늦게 드러났습니다. 원장과 직원들은 끔찍한 일을 쉬쉬해가며 5년이나 감춰왔고 방치됐던 그 시간 동안 몇 명의 피해자는 가해자가 되기도 했습니다.기자언뜻 보기엔 평화롭게 보이는 서울의 한 보육원.영유아부터 고등학생까지 50여 명이 지내고 있습니다. 몇 살이에요 나는 6살이에요.하지만 이곳에 있었던 17명의 아이들은 지난 5년간 지옥 같은 시간을 보냈습니다.이르면 7살 때부터 같이 지내는 형들에게 성폭력을 당했습니다.또 불을 붙인 휴지를 발가락 사이에 끼우게 강요당했고 달궈진 젓가락에 화상을 입기도 했습니다.1년 이상 지속적으로 성폭행을 당한 아이들도 56명에 달합니다.5년이나 이런 일이 반복되면서 아이들은 보육원 측에 방이라도 바꿔 달라며 읍소했지만 원장은 시설 폐쇄 처분을 우려해 은폐에만 급급했습니다.아동양육일지에 폭행이나 싸움 등의 용어를 적지 못하도록 하거나 이미 작성된 일지는 새로 쓰도록 지시했습니다.그사이 피해 아이들 가운데 일부는 가해자가 돼 또 다른 동생들에게 폭력을 휘둘렀습니다.한 피해 학생은 경찰 조사에서 보육원에 사는 동안 살인 자살 가출 3가지만 생각했다고 진술했습니다.보육원 관계자  죄송하구나 이런 말씀밖에는 못 드리겠구나 그런 생각을 했습니다.사건을 은폐했던 원장 정 모 씨 등 3명은 구속됐지만 해당 보육원에는 폭행을 묵인했던 다른 직원들이 아직 남아 있는 상태입니다
