5월 연휴 특수에…여행사, '조기예약 취소' 꼼수	http://news.naver.com/main/read.nhn?oid=437&sid1=103&aid=0000152376&mid=shm&mode=LSD&nh=20170417215847	다음 달 초에 있을 연휴 많이들 기다리시지요. 해외 여행 계획하는 분들도 계실 텐데 이렇게 수요가 몰리자 여행사들이 더 비싼 값에 상품을 팔려고 사전 예약을 일방적으로 취소한 정황이 드러났습니다.  전다빈 기자의 단독보도입니다.  기자직장인 A씨는 5월 연휴 때 유럽 여행을 가려고 지난 연말 일찌감치 예약을 마쳤습니다. 그런데 지난달 중순 갑자기 여행사에서 신청 인원이 적어서 여행을 취소한다고 통보했습니다.  하지만 바로 그날 해당 여행사에선 똑같은 상품을 홈페이지에 올렸습니다. 가격만 190만원에서 380만원으로 두 배로 뛰었습니다.    여행 취소 통보 당한 고객  항의했더니 예약금 돌려주면 법적으로는 아무 문제가 없다또다른 여행사에 5월 연휴 서유럽 여행을 예약했던 B씨의 경우도 마찬가지입니다.  조기 대선이 확정되고 여행 상품 값이 치솟자 갑자기 여행사에서 항공권이 없다면서 취소 통보를 했습니다. 하지만 업계에서도 이유를 납득하기 어렵다고 합니다. 여행업계 관계자  항공권이 없는데 애초에 어떻게 판매를 하죠 이해가 안 가는 부분인데요.소비자단체에서는 여행 7일 전에만 취소 통보를 하면 계약금만 돌려주면 된다는 점을 여행사가 악용한다고 지적합니다. 정지연한국소비자연맹 사무총장  여행사가 일방적으로 여행사의 이익을 극대화 시키기 위해서법적으론 문제가 안 된다고 하더라도 앞으로 개선이 필요할 것으로 보입니다.전다빈 JTBC 뉴스 공식 SNS 트위터 페이스북 유튜브Copyright by JTBChttpjtbc
'염전노예' 구하기…지적장애 실종자 수색해보니	http://news.naver.com/main/read.nhn?oid=214&sid1=102&aid=0000759194&mid=shm&mode=LSD&nh=20170417204420	3년 전 지적장애인이 섬에 갇힌 채 수년간 노예처럼 일하다 구출된 이른바 염전노예 사건이 있었죠.경찰이 이 같은 사건을 막기 위해 최근 한 달간 지적장애 실종자 등에 대해 일제 수색을 벌였습니다. 리포트 뱃길로 두 시간 서해의 한 낙도입니다.계십니까 계세요실종된 사람을 찾는 겁니다.섬 외곽의 염전은 필수 수색 대상.섬 주민이 아닌 낯선 남성이 일을 하고 있습니다.실종자 수색 경찰관오오 팔팔 일일 오오 팔팔 네 이상한데.가족들과 연락은 오래전 끊겼고 지금은 염전과 양식장을 전전하고 있습니다.통장도 휴대전화도 없이 돈을 빼앗기기 일쑤.지적 장애가 의심돼 지문과 DNA를 채취합니다.따로 면담을 시작하자 부모를 찾고 싶다고 말합니다.문용석텔레비전 보고 그래도 가족들 모이는 거 보면 슬프기도 하고 엄마 생각도 더 나고 그래서.지문 조회 끝에 어렵게 신분을 되찾았지만 기다리던 어머니는 이미 세상을 떠난 뒤였습니다.며칠 전 인근의 한 요양원에서 경찰이 찾아낸 60대 남성.경찰 도움으로 수십 년 만에 생존 가족인 조카와 연락이 닿습니다.기분이 어떠신지 지금 찾게 됐으니까어휴 말을 못해요.주변의 관심이 집중되는 18세 미만 아동의 실종 신고는 계속 줄어 지난해 2만 건 아래로 떨어졌습니다.반면 지적 장애인과 치매 환자의 실종 신고는 꾸준히 늘고 있습니다.인적사항을 기억하지 못해 장기 실종자로 남기 쉽습니다.박송희전남지방경찰청 아동청소년 계장의사표현 능력이 없기 때문에 누구한테 본인이 직접 나서서 먼저 도움을 요청하기가 쉽지 않습니다. 그래서 경찰관들이 일일이 찾아다니면서 묻고 면담합니다.실종자가 있을 것으로 추정되는 염전과 양식장 등 취약 시설은 전국에 1만 5천여 곳
명문대 교수가 제자 성폭행…검찰은 수사 중지	http://news.naver.com/main/read.nhn?oid=055&sid1=102&aid=0000522687&mid=shm&mode=LSD&nh=20170417212112	지난해 여름 서울의 한 명문 사립대 교수가 학교 안에서 제자를 성폭행했습니다. 그런데 신고도 했고 증거도 있는데 어찌 된 일인지 수사가 차일피일 미뤄지면서 피해자 고통이 지금까지 이어지고 있습니다.기자지난해 6월 대학원생이던 피해 여성은 지도교수의 회식자리에 불려 나갔습니다.새벽 3시쯤 만취한 여성이 정신을 차린 곳은 바로 교수의 연구실이었습니다.성폭행 피해자당시 대학원생  교수가 어깨를 눌러서 아팠으니까요. 중간에 정신이 살짝 들었다 나갔다가 그러다가 깼어요.피해 여성의 지도교수였던 문 모 교수는 다른 곳도 아닌 학교 안 자신의 연구실에서 술에 취한 제자를 성폭행했습니다.피해 여성은 이 순간 다급하게 친구에게 전화를 걸었습니다.피해여성  아아아아앙 흐흐흑 흐흑울음소리가해 교수  울지마. 누가 전화해 응 뚝피해 여성은 그대로 달아나 곧바로 경찰서로 가 신고를 했지만 문 교수는 모든사실을 부인했습니다.하지만 피해자의 속옷에서 자신의 DNA가 검출되자 합의 하에 이뤄진 것이라고 말을 바꾸고는 사과를 하기 시작했습니다.경찰은 문 교수를 성폭행 혐의로 검찰에 넘겼고 해당 대학은 문 교수를 파면했습니다.그런데 사건을 넘겨받은 검찰은 지난해 말 돌연 이 사건을 기소중지 처리했습니다.가해자에게 거짓말 탐지기 검사를 해봐야 한다는 게 이유였습니다.서원일검사 출신 변호사 이 사건은조사할 거리 자료증거가 많은 사건이 아닌가 생각이 돼요. 거짓말 탐지기 검사만을 위해서 시한부 기소 중지를 해놨다면은 다른 성폭행 사건들에 비해 조금 이례적으로 보입니다.이때부터 피해자 가족에게는 더 큰 악몽이 시작됐습니다.수사가 중단된 틈을 타 가해자 문 씨는 수시로 피해 여성의 가족을 찾아와 합의를 요구했습니다.피해 여성 엄마  이건 어제 온 거고요. 자꾸 찾아오니까 심장이 벌렁벌렁 무서워요. 우리 가족 인생은 이제 죽은 목숨이에요.재판에 가면 치부가 드러날 거라는 등의 말도 서슴지 않았습니다.피해자 가족이 검찰에 아무리 고통을 호소해도 검찰은 사건 발생 10달이 다 된 지금까지 수사를 재개하지 않고 있습니다.앵커김종원 기자 갑자기 기소중지가 된 것도 그렇고 피해자가 이렇게 2차 피해까지 겪고 있는데 검찰이 수사를 미루는 이유가 뭘까요기자네 뭔가 특별한 이유가 있다면 그건 검찰만 알고 있겠죠.다만 추정해 볼 수는 있는데요 이 사건 취재하면서 검사들 그리고 검사출신 변호사들을 여러 명 만나서 사건을 얘기했습니다. 그러자 전문가들이 주목한 부분이 공통적으로 기소 중지 시점이었습니다.기소 중지라는 것은 검사가 수사하던 사건을 재판으로 넘기지 않고 중단을 해놓는 것을 얘기하는데 이게 지난해 6월에 발생한 사건인데 기소 중지가 지난해 12월 30일 한 해가끝나기 직전이 된다는 말이죠. 연말이 된건데 이맘때 검찰에서 무슨 일이 벌어지느냐 인사고과 평가를 한다고 해요.그래서 검사 실적에 영향을 미치는 게 얼마나 많은 사건을 해결했느냐 또는 하지 못했느냐 이게 영향을 미치는데 수사가 이때까지 계속 진행이 되고 있는 사건은 미제 사건으로 넘어가서 실적을 깎아 먹는다는 거죠.그래서 이맘때면 검사들이 여전히 수사를 하고 있는 사건들을 무더기로 기소 중지하는 꼼수를 많이쓴다고 합니다.그러니까 어떻게 보면 피해자의 고통을 외면한 채 검사가 실적을 위해서 사건을 기소 중지했다 이런 분석을 전문가들은 내놨습니다.하지만 이걸 감안해도 이 사건이 조금 이례적인 것은 지금 이미 4월이 되지 않았습니까그런데 이 사건 같은 경우는 리포트에서도 보셨듯이 CCTV도 있고 녹취도 있고 무엇보다 피해자가 곧바로 신고를 했고 여러 가지 증거가 있음에도 불구하고 사실 그렇게 중요하다고 볼 수 없는 거짓말 탐지기 때문에아직까지 사건을 재개하지 않고 있다는 말이죠.이러다 보니 피해자 측에서는 공정한 수사가 아니지 않느냐 뭔가 보이지 않는 힘이 검찰에 작용을 하는 게 아니냐 이런 의심까지 하는 상황이 된 겁니다.앵커충분히 합리적인 의심 같은데 앞으로 수사는 어떻게 될까요기자취재진이 취재를 시작하자 검찰은 곧바로 수사를 시작하겠다고 답변을 했습니다.그동안 피해자 가족이 너무 스트레스를 많이 받다보니 도대체 거짓말 탐지기 어떻게 됐느냐 언제 개시되느냐 이렇게 탄원서도 내고 했는데 계속해서 기다려라 기다려라 하다가 정말 공교롭게도 저희가 전화를 하니 마침 거짓말 탐지기 결과가 어제 나왔다고 하더라고요.사실인지는 모르겠지만 수사를 재개하겠다고 하니까 공정한 수사가 될 수 있을지 계속 지켜봐야 할 것 같습니다
 갤럭시S8 개통 앞두고 '붉은 액정' 품질 논란 	http://news.naver.com/main/read.nhn?oid=028&sid1=105&aid=0002361264&mid=shm&mode=LSD&nh=20170417230339	먼저 받은 소비자들 스마트폰 커뮤니티에 문제 제기삼성전자 각도 따라 달리 보일 수 있고 보정도 가능 사진 출처루리 웹 삼성전자 갤럭시S8과 갤럭시S8 플러스가 개통을 하루 앞두고 액정 품질 논란이 일고 있다. 예약구매로 기기를 먼저 받아본 소비자들 가운데 일부가 액정에서 붉은 색이 너무 강하게 표현돼 불편하다는 불만이다. 하지만 삼성전자는 품질 문제가 아니라는 입장이다.   17일 삼성전자 스마트폰 관련 커뮤니티에는 갤럭시S8의 붉은 액정 문제를 지적하는 글이 잇따라 오르고 있다. 붉은 액정 현상 문제로 유지보수센터를 찾았다가 수리를 받지 못하고 교환하게 됐다는 내용의 글도 보인다. 일부 사용자들은 붉은 액정 현상이 화면 전체에 고르게 나타나는 게 아니라 특정 부위에선 심한 것 같다고 말했다. 화면 상하단 끝부분과 양 옆의 엣지 주위에만 유독 붉은 기가 많이 돈다는 것이다. 붉은 액정 현상 상태로는 카메라로 꽃 등을 찍었을 때 실제와 다른 색감이 나올 수 있다는 전문가 지적도 달린다. 붉은 액정이란 디스플레이가 붉은 색상을 더 강하게 표현하는 현상으로 원본 사진이나 영상보다 색감이 붉어 보기에 다소 거슬릴 수 있다.   비슷한 문제제기가 계속되면서 삼성전자가 프리미엄 스마트폰에 채택한 유기발광다이오드AMOLED 디스플레이 문제 아니냐는 의혹까지 나온다. 업계 관계자는 삼성전자는 갤럭시S8의 색 밸런스를 맞추기 위해 딥 레드란 기술을 채택한 것으로 알려졌는데 색 밸런스를 제대로 맞추지 못한 것 같다. 대량 생산을 서두르다보니 생긴 문제가 아닌지 짐작된다고 말했다.  이에 대해 삼성전자는 품질 문제가 아니고 휴대전화 자체 기능으로 조정할 수 있다는 입장이다. 삼성전자는 사용자에 따라 호감을 갖는 색깔이 다른데다 보는 각도나 환경에 따라 색깔이 달리 보일 수도 있다. 일정 수준의 색상 치우침 현상은 색상 최적화 설정 기능을 통해 보정할 수 있다고 설명했다.  한편 삼성전자는 17일까지 갤럭시S8 예약구매 신청을 받은 데 이어 18일부터 개통을 시작한다.kr Weconomy 홈페이지 바로가기 httpwww
잊혀진 가정 폭력 '노인 학대'…체계적 대책 시급	http://news.naver.com/main/read.nhn?oid=056&sid1=102&aid=0010445143&mid=shm&mode=LSD&nh=20170417220353	앵커 멘트아동 학대가 사회적 관심사로 떠오르면서 아직 미흡하기는 해도 대책이 쏟아지고 있는데요 노인 학대는 아직 경찰 통계조차 없을 정도로 관심을 받지 못하고 있습니다.찾아내기도 어렵지만 가해자 처벌만으로는 문제가 해결되지 않기 때문에 더욱 체계적인 접근과 관심이 시급한데요  가정 폭력의 사각지대 노인학대 문제를  김용덕 기자가 심층 보도합니다. 리포트 지난 1월 80대 할머니가 집에서 폭행을 당했다는 신고에 경찰이 출동했습니다.녹취 남상인당시 출동 경찰관   할머니 안면 부위에 피가 좀 많이 나서 속으로는 돌아가실 수도 있겠다 라고까지 생각했습니다. 어머니가 신세를 한탄한다는 이유로 술에 취해 때린 겁니다.인터뷰 변정윤당시 출동 119구급대원  아들이 자주 신고하셨던 분이라서 그냥 병원 단순 이송인 줄 알고 갔는데. 아들은 그냥 옆에서 술을 먹고 있는 상황이었고요. 할머니는 목숨을 건졌지만 아들은 구속됐습니다.녹취 동네 주민음성변조  술 먹고 자주 할머니를 때린다더라고.녹취 동네 주민음성변조  술 안 먹으면 또 안 그래. 자기 엄마는 자기 아들 효자라고 얼마나 두둔하는데요. 노인 학대 신고 건수는 2005년 이후 10년 사이 2배 가까이 증가했습니다. 가정 내 학대 비중이 약간 줄었다지만 여전히 압도적인 수준입니다. 가해자나 피해자 모두 신고를 꺼리는 경우가 많고 사건을 전담할 인력도 부족합니다.녹취 박영훈경기서부노인보호전문기관   작년 경기 서부에 200여 건 좀 넘는 학대 건수가 있었는데 작년에는 저희가 한 명이 적은 7명으로 운영되다보니까 한 명당 못해도 4550건에 대한 상담을 개입하다보니 어려움이 많았습니다.더 큰 문제는 가해자 처벌만으로 문제가 근본적으로 해결되는 경우가 별로 없다는 겁니다. 경제적인 어려움이나 가족 간 갈등 등 문제가 남아있는 한 학대는 되풀이될 수 있습니다. 한 40대 아들이 70대 부친을 때리고 괴롭혔습니다. 이유는 용돈을 둘러싼 갈등 때문이었습니다. 아들이 일을 전혀 하지 않아 벌금 등이 나온다면 부친이 떠안아야 하는 상황. 부친은 처벌을 원하지 않았고 경찰도 아들의 취업을 돕기로 했습니다.녹취 박찬희경기 안산단원경찰서 여성청소년과  처벌보다는 부자지간의 관계개선이 필요하다고 생각을 해서 가정보호사건으로 송치하게 됐습니다. 전문가들은 학대 노인 보호를 위한 지원과 함께 가해자 관리도 중요하다고 지적합니다.녹취 정미영한국노인상담연구소 선임연구원  여러 기관들이 연계를 해서 지역 사회 기관들이 연계를 해서 학대를 예방하는데 힘을 써야되지 않을까 생각이 됩니다
8시간 감금 살해 협박…헌병대 끌려간 육군 소령 '헬리건'	http://news.naver.com/main/read.nhn?oid=057&sid1=102&aid=0001112753&mid=shm&mode=LSD&nh=20170417214541	한때 만났던 전 여자친구를 감금 폭행하고 흉기로 살해 협박한 사람 현역 육군 소령이라면 믿으시겠습니까   전투 헬기 조종사로도 이름난 이른바 우수 헬리건인데 이런 사람이 전 여자친구는 물론 심지어 여성의 주변 가족들까지 위협했습니다.   박상호 기자가 단독 보도합니다.  기자   이른 아침 경남 진주의 한 주택가.   현역 육군 소령인 43살 이 모 씨가 원룸 건물로 들어갑니다.   전 여자친구 김 모 씨가 살던 건물의 현관 비밀번호를 기억했다가 몰래 들어가는 장면입니다.   김 씨를 방에 가둔 이 소령은 줄넘기로 팔을 묶고 스카프로 눈을 가리고는 무차별 폭행하기 시작했습니다.   무려 8시간 동안 감금하며 살해 협박까지 했습니다. 인터뷰  김 모 씨  피해자 제발 살려달라고 해도 안 되고 자꾸 말하면 흉기로 목을 긋는다면서.   김 씨는 전치 3주 진단을 받았고 심지어 김 씨의 가족들까지 위협받았습니다.   인터뷰  김 모 씨  피해자 가만히 안 두겠다. 내 주위의 가족들이 죽으면 어떻게 해요 스탠딩  박상호  기자 대구의 모 부대에 근무 중인 이 씨는 헤어지자는 말을 듣고 6개월 동안 쫓아다니다 더는 참지 못하고 범행을 저질렀습니다.  이 소령은 전투헬기 사격대회에서 국방부장관상을 받을 정도로 이름이 알려진 조종사   범행 다음 날 경찰에 붙잡힌 이 소령은 헌병대로 끌려가 조사를 받고 있습니다.   MBN뉴스 박상호입니다
'재혼 어려울까 봐' 두 살 아이 버린 엄마 집행유예	http://news.naver.com/main/read.nhn?oid=001&sid1=102&aid=0009196407&mid=shm&mode=LSD&nh=20170417221703	현혜란 김예나 기자  재혼에 방해될까 봐 두 살 아이를 버스 터미널에 버리고 달아난 엄마가 재판에서 집행유예를 선고받았다.    서울동부지법 형사3단독 김진환 판사는 아동복지법 위반아동 유기방임 혐의로 기소된 안모27여씨에게 징역 1년과 집행유예 2년을 선고했다고 17일 밝혔다.    또 보호관찰을 받을 것과 40시간의 아동학대 치료 강의를 수강할 것을 명했다.    법원에 따르면 두 아이의 엄마였던 안씨는 지난해 8월부터 군인 박모씨와 내연 관계를 맺었다. 이 사실이 들통나자 안씨는 남편과 이혼하기로 합의하고 박씨와 동거를 시작했다.    그러나 안씨의 자녀가 2명이란 게 박씨의 부모에게 알려지면 결혼 승낙을 받지 못하게 될까봐 우려한 이들은 본가에 결혼 승낙을 받으러 가면서 두 살배기 아들을 유기하기로 공모했다.     이들은 설날 연휴인 1월29일 서울의 한 버스 터미널에서 아이 손을 놓고 버리려 했으나 실패하자 미아 보호실이 어디 있냐며 아이를 다른 이에게 맡긴 채 떠났다.    예약해 둔 지방행 고속버스에는 첫째 아이만 태운 채였다. 이내 곧 범행은 발각됐고 다음 날인 30일 박씨는 관할 헌병대로 이송되었다.    김 판사는 피고인의 보호감독을 받는 아동을 유기했다면서 보호 대상인 피해자를 버스 터미널에 유기한 죄질이 무겁다고 판시했다.    다만 김 판사는 피고인은 범행을 자백하며 반성하고 있다면서 피해 아동의 아버지와 피고인 사이에 자녀 양육에 관한 진지한 합의가 이뤄진 것으로 보인다고 판단했다
교육부, 업무추진비 사적으로 쓴 서남대 총장 해임 요구	http://news.naver.com/main/read.nhn?oid=001&sid1=102&aid=0009196279&mid=shm&mode=LSD&nh=20170417221401	임상교원 부당임용사문서위조 등 주요 보직자도 징계 요구수사의뢰서남대 소소한 실수에 해임 요구는 과도재심 청구하겠다 반발세종남원 고유선 백도인 기자  교육부가 업무추진비를 사적 목적으로 쓴 혐의로 폐교 위기에 놓인 서남대 총장에 대한 해임을 학교 측에 요구했다.    교육부는 2월 27일3월 10일 학교법인 서남학원과 서남대학교에 대한 특별조사를 벌여 31건의 불법부당 행위를 적발하고 김경안 총장을 비롯한 8명의 징계를 학교 측에 요구했다고 17일 밝혔다.교육부  자료사진앞서 서남대는 교육부의 1주기 대학 구조개혁 평가에서 최하위 등급인 E등급을 받았다. 교육부는 학생의 학습권 보호를 위해 학교 운영상황에 대한 특별감사가 필요하다는 컨설팅 권고에 따라 조사를 벌였다.    조사 결과 김 총장은 서울의 한 호텔에서 업무와 무관하게 식비를 쓰거나 종친회 행사에 화환을 보내는 등 사적 목적으로 업무추진비 약 2천367만원을 사용한 것으로 나타났다.    서남대는 또 올해 2월 기준으로 임금 156억원과 시설관리 용역비 등 13억원을 지급하지 않았고 세금체납액 등도 18억원에 이르는 것으로 조사됐다.    인사관리 분야에서는 교원 신규채용과 임상교원 보수 지급과 관련된 문제점이 드러났다.    다른 대학에서 해임돼 교원으로 임용할 수 없는 이들 20명을 전임교원으로 채용했고 2015년 6월에는 만 65세 정년을 넘어선 지원자당시 만 69세를 협력병원장으로 특별채용하기도 했다.서남대 정상화 촉구 시위  자료사진이사회 의결 없이 교원 97명에게 43억원의 보수를 과다 지급하고 교육부의 특별조사 과정에서 교원 급여 증빙자료를 위조해 제출했다.    입시학사관리 분야에서는 52명의 교원이 책임 시간을 준수하지 않은 점 학과명칭이 바뀌거나 학과가 신설됐는데 전공이 같지 않은 교원이 해당 학과 소속으로 수업을 운영한 점 등이 적발됐다.    교육부는 김 총장을 비롯한 주요 보직자 8명에 대한 징계를 요구하고 일부는 업무상 횡령배임 사문서위조행사 등의 혐의로 고발 또는 수사 의뢰하기로 했다.    서남대는 2011년 이후 잇따라 부실대학에 지정되고 설립자가 교비 330억원을 횡령한 혐의로 실형을 선고받으면서 재정상황이 악화해 폐교 위기에 놓였다.    신입생 대부분은 의대를 중심으로 한 보건계열 학생인데 최근 의대가 한국의학교육평가원 평가에서 불인증 판정을 받기도 했다. 불인증 판정을 받으면 학생들이 국가시험에 응시할 수 없다.    의료법인 정선의료재단 온종합병원과 삼육대 등이 서남대 인수 의향을 밝혔지만 아직 새 주인이 정해지지 않은 상태다.서남대 교정  자료사진    이에 대해 서남대는 소소한 실수나 규정 위반 사례인데 과도한 처분을 했다며 재심을 청구하겠다고 반발했다.    서남대는 김 총장의 업무 추진비와 관련해 규정을 잘 몰라서 빚어진 일로 부적정하게 쓰인 것은 교비로 환수할 예정이라면서 교비를 횡령한 것도 아닌데 해임까지 요구한 것은 지나치다고 밝혔다.    교원 채용 등의 문제에 대해서도 의과대학 인증평가에 대비하기 위한 목적 등 학교의 필요에 의한 것이라고 해명했다
"저도 청년이에요"…서러운 고졸의 호소	http://news.naver.com/main/read.nhn?oid=449&sid1=102&aid=0000128353&mid=shm&mode=LSD&nh=20170417203958	하루가 멀다하고 청년공약이 쏟아지지만 이런 공약 때문에 더 서러운 청년들이 있습니다.   바로 고졸 취업자들인데요 청년 10명 중 3명이 고졸청년인데도 이들에 대한 관심은 턱없이 부족합니다.   이민형 기자가 이들을 만나봤습니다.  리포트 올해 초 특성화고를 졸업하고 구직시장에 뛰어든 19살 이은희 씨.   높은 내신등급에 자격증도 12개나 됩니다.   이은희경영정보고 졸업  공고같은거 보면 학력무관이라고 하시거든요. 근데 막상 최종적으로 선발되는거 보면 대졸자들이 대부분인 거 같아요   어렵게 취직해도 고졸이라는 이유로 남모를 서러움을 겪기도 합니다.   지난해 한 지방 공기업에 취직한 스무살 권모 씨.   권모 씨 지방 공기업 직원  고졸이고 어리다는 이유로 초면에 반말하고. 아니면 같이 들어온 동기인데도 동기취급을 안한다든가.   대선을 앞두고 하루가 멀다하고 청년 공약이 발표되지만 남의 나라 이야기 같다는 반응입니다.   권모 씨 지방 공기업 직원  청년이란 말을 들었을 때 제가 포함돼 있다고 생각을 잘 안 했던 것 같아요.   지난해 대학 진학률은 16년만에 70 밑으로 떨어졌습니다. 청년 10명 중 3명이 고졸자인 셈입니다.   하지만 대선주자들의 청년 공약은 대학 등록금 인하 대졸자 창업 등 대학생과 대졸자 위주입니다.   전문가들은 이중의 서러움을 겪는 고졸 청년를 위해 맞춤형 정책이 필요하다고 지적합니다.   이병훈  중앙대 사회학과 교수  대학나온 사람과 차별없이 생활을 할 수 있도록 하는 보장할 수 있는 그런 것이 대책으로 요구되고.   자신들의 목소리에도 귀기울여 달라는 고졸청년들의 호소는 절박합니다.   이은희경영정보고 졸업  저희 고졸자들도 힘드니까 저희한테 맞는 정책같은 것 만들어주셨으면 좋겠어요.   채널A 뉴스 이민형입니다.   이민형 기자 peoplesbrodonga
