北 어선 3척 잇따라 우리 해역으로…선원 조사 중	http://news.naver.com/main/read.nhn?oid=055&sid1=100&aid=0000534316&mid=shm&mode=LSD&nh=20170527213925	오늘27일 동해안에서 북한 어선 세 척이 잇따라 우리 해역으로 넘어왔습니다. 군 당국은 북한 어선을 예인하고 선원들을 조사하고 있습니다.G1 강원 민방 조기현 기자의 단독 보도입니다.기자양양군 남애항 동방 3해리 해상에서 북한 목선이 우리 육군 레이더망에 포착된 건 오늘 낮 12시 20분쯤.당시 북한 어선에는 선원 3명이 탑승 중이었고 시속 4. 군의 통보를 받은 해경은 즉각 북한 선박을 확인했고 선원 3명의 신병을 확보했습니다.하지만 북한 목선이 우리 군에 의해 확인된 건 이미 고성과 속초를 거쳐 양양 앞바다까지 항해한 뒤였습니다.앞서 오전 11시쯤에는 울릉도 북방 30해리 해상에서 2톤급 북한 목선 한 척이 전복됐습니다. 이 사고로 북한 어민 2명이 실종됐고 3명은 우리 해군이 구조했습니다.군과 국정원 합동심문조는 선박 2척에 타고 있던 북한 선원 6명을 상대로 대공 혐의가 있는지 여부를 조사하고 있습니다.단순 항해 실수나 표류로 판명되고 귀순 의사가 없을 경우 북측으로 송환할 계획인 것으로 알려졌습니다.이 밖에도 오늘 오후 1시 35분쯤에는 울릉도 북방 60해리 공해 상에서 북한 목선 한 척이 해군에 발견됐지만 자력으로 월북했습니다
축제 끝난 대학, 쓰레기는 얼마나 나왔을까	http://news.naver.com/main/read.nhn?oid=047&sid1=102&aid=0002151685&mid=shm&viewType=pc&mode=LSD&nh=20170527230800	체험기 새벽 4시부터 술병 1만 개쓰레기봉투 1500개를 치우는 캠퍼스 청소노동자들 글영상이성훈 편집김지현봄 햇살이 따스한 요즘 대학 캠퍼스는 축제가 한창입니다. 1주일 내내 얼큰한 웃음과 환호성에 캠퍼스가 들썩들썩하고 자정이 넘으면 또 언제 그랬냐는 듯 조용해지죠. 그리고 학생들이 썰물처럼 떠나간 그 자리엔 빈병 음식물 바람 빠진 풍선 등 온갖 쓰레기가 가득합니다. 그 양이 어마어마한데요 기자의 숙소 인근인고려대학교의 축제 기간 하루치 쓰레기 배출량은 이렇습니다.소주맥주 1만 병 100리터쓰레기봉투 1500봉지화물차로 따져보면 술병은 2.5톤 트럭 2대 쓰레기봉투는 트럭 10대를 채울만큼의 분량입니다. 웬만한 초등학교 운동장을 가득 메울 만큼의 쓰레기가 매일 산처럼 쌓이죠.하지만 다음날 아침 학교는 거짓말처럼 깨끗합니다. 누가 마법이라도 쓴 걸까요 도대체 그 많던 쓰레기는 누가 언제 치웠을까요 보이지 않는 땀방울이 있었음이 틀림없습니다. 숨겨진 그림자노동의 주인공을 찾으러 새벽 5시 고려대학교의 중앙광장을 찾아갔습니다.   빗자루 아저씨는 직접 개조한 싸리빗자루로 광장을 쓸어 담았다.  쑈사이어티오전 5시 청소 시작어르신 몇 시에 출근하셨어요새벽 4시요. 새벽 3시에 일어나서 첫차 타고 왔어요.빗자루 아저씨모두가 잠든 새벽 청소노동자들은 일을 시작합니다. 학생들이 등교하는 9시 전까지 청소를 끝내려면 적어도 새벽 4시에는 작업을 시작해야 하죠. 빗자루 아저씨는 평소에는 새벽5시까지 출근해도 되는데 대학교 축제기간에는 쓰레기가 많아서 우리청소부끼리 얘기해서 1시간 일찍 일을 시작한다고 하네요. 물론 그런다고 해서 돈을 더 받지는 않지만요. 체감상 축제기간에는 일거리가 10배는 더 많다면서 허허 웃으시네요. 저 엄청난 쓰레기더미 앞에서도 미소짓는 아저씨의 표정에서 청소 내공의 깊이를 짐작할 수 있었습니다.빗자루 아저씨는 혼자서 축구장 넓이를 담당합니다. 그는 평범한 빗자루보다 2배는 넓은 특수 빗자루를 사용하죠. 직접 개조했다는 그 빗자루는 보통의 것을 분해해서 부채처럼 넓게 펼친 것입니다. 바닥에는 먹다 남긴 술병 토사물 행사 때 흩뿌린 색종이가 가득해서 빗질이 쉽지 않았는데요 그래도 특수 빗자루 덕분에 빗질은 2시간 만에 마무리할 수 있었습니다.   축제 하룻밤에 나온 술병 1만여 개를 수거하는 청소노동자들의 모습.  이성훈오전 7시  빈병 수거어휴 술냄새 이거 빈병 합하면 몇 병이죠트럭 꽉 채우면 5000병 정도 돼요 병수거 아줌마 아저씨대학축제하면 주점을 빼놓을 수 없죠. 학과나 동아리단위로 모인 학생들이 계란말이소세지볶음파전을 직접 요리해서 내놓는 주점은 발 디딜 틈 없이 붐비죠. 200개 넘는 행사용 천막 아래에서 하룻밤에 비워지는 소주맥줏병만도 약 1만병이나 됩니다. 이 많은 술병을 누군가는 수거해가야 하죠.개인적으로 병 수거작업이 제일 힘들었습니다. 일단 맥주소줏병을분리하고 상자나 포대에 담는데 품이 많이 듭니다. 빈병을 담은 박스와 포대는 꽤나 무거워서 트럭에 나르느라 허리가 무척 아팠습니다. 더 무서운 것은 깨진 병입니다. 아무리 조심해도 숨어있는 깨진 유리병에 손을 베이기 십상이거든요목장갑을 끼었지만 뚫고 들어온 소주병 조각에 손가락을 베었습니다. 같이 작업하던 아저씨도 2년 전에 깨진 소주병에 다쳐서 13바늘을 꿰맸다고 하시네요. 그래서 학생들에게 이 한마디만 전해달라고 하시네요.학생 여러분 공부하느라 힘들죠 재밌게 노시고요. 깨진 병만 잘 분리해줘요.  분리수거반 청소노동자들이 뒤섞인 쓰레기들을 정리하고 있다.  이성훈오전9시  쓰레기 분리수거 아이고 아저씨 허리가 너무 아파요.크하핫 젊은 사람이 겨우 고거 했다고 아퍼 이것도 해본 놈이나 하는 거여.분리수거반 아저씨 5명오늘따라 하루가 무척 길게 느껴집니다. 오전 9시 작업한 지 4시간이 지나도 쓰레기더미는 줄어들 줄을 모릅니다. 다음 작업은 쓰레기 분리수거인데 마구 섞여 있는 쓰레기를 유리병캔가스통음식물쓰레기 별로 분리해서 비닐봉지에 담는 작업입니다. 막걸리 냄새와 음식물 썩은 냄새가 섞여서 코를 찌르네요. 각오는 했지만 옷과 얼굴에 국물이 튈 때면 헛구역질이 나오려고 합니다. 분리수거 아저씨들은 바짝 긴장해서 일을 합니다. 어제 부탄가스통이 몇 개 폭발하는 바람에 큰일 날 뻔 했다고 하네요. 곳곳에 숨어있는 깨진 유리병도 조심해야 하고요. 분리수거반 아저씨들도 역시나 분리수거를 당부하네요. 학생 여러분이 조금만 신경 써주시면 우리가 안전하게 일할 수 있다고 하시네요. 그렇게 100리터짜리 큰 쓰레기봉투를 뜯고 분리하고 다시 담고 반복하기를 약 2시간 마침내 쓰레기 산을 해체하는 데 성공했습니다. 미션 성공   쓰레기 하치장의 모습. 대학교 시설 중 가장 외진 곳에 있는 하치장에는 하루에도 수천 봉지의 쓰레기가 오간다.  이성훈오전 11시 30분  마지막 쓰레기 하치장에 도착여 학생고생했는데 같이 한잔 하러 가. 그치만 쓰레기산까지 가봐야 해서요. 청소부 분들은 국밥에 소주 한잔 하러 간다는데 쇠주 한잔 하러가자는 아저씨 아줌마들을 정말 따라가고 싶었습니다. 하지만 기왕 작정하고 떠난 체험기 그 끝을 전해야겠죠. 아쉬움을 뒤로 하고 쓰레기들의 무덤 하치장을 찾아 떠났습니다.어느 대학교든 고약한 냄새를 풍기는 쓰레기 하치장이 꼭 하나씩 있습니다. 하지만 워낙 외진 곳에 박혀 있어서 청소부가 아니고서는 그 존재조차 모르죠. 고려대학교의 쓰레기 하치장은 뒷산 언덕 꼭대기에 있습니다. 버스를 타고 여섯정거장 가파른 언덕을 넘어야 합니다. 쓰레기장에 도착하자 아까 열심히 분리하고 포장했던 낯익은 쓰레기들이 저를 반겨주네요. 시큼한 쓰레기 냄새가 훅 풍겨옵니다. 바닥은 흘러나온 국물로 흥건하고 비둘기들이 열심히 봉지를 쪼아댑니다. 이따금 쓰레기를 수북히 쌓은 2.5톤 수거용 트럭이 오갈 뿐 지나가는 사람 하나 없는 외진 곳입니다. 쓰레기 수거반은 학교 전역을 돌아다니며 모아놓은 쓰레기를 거둬갑니다. 이동 횟수를 줄이려고 가능한 많은 쓰레기봉지를 한 번에 싣습니다.5톤 트럭 한 대에 100리터짜리 쓰레기봉지를 140160개 싣고 대략 10번 정도 왕복하니까 하루에 1500봉지를 운반하는 셈입니다. 자꾸만 제게 축제 언제 끝나냐고 묻는 걸 보니 학내 청소부들에게 축제기간이 퍽 힘든 것 같습니다.  미소가 멋진 청소 소장 아저씨. 부임한 지 1년도 되지 않았지만 직접 일손을 거들어서 청소부 사이에서 인기가 많다. 그는 분리수거 푯말을 세웠더니 고대학생들이 많이 도와줘서 일손 걱정을 덜었다며 웃었다.  이성훈 마치며  캠퍼스의 낭만을 지켜주는 사람들이렇게 해서 오전 5시12시 30분까지 축제 청소 체험이 끝났습니다. 햇빛은 아직도 쨍쨍한데 하루일과가 다 끝났다는 사실이 실감나지 않습니다. 이제야 하루 첫 끼를 먹고 더러운 몸을 씻고 쉴 수 있겠군요. 캠퍼스의 아름다움과 낭만 뒤에는 보이지 않는 땀방울이 있음을 구석구석 체감했습니다. 즐거운 축제가 누군가에게는 아무런 보상 없이 새벽4시까지 출근해서 평소의 몇 배는 힘든 일을 해야 하는 시간이라는 사실이 새롭습니다. 그들의 수고로움에 감사하고 그 고마움을 표현할 수 있는 방법은 없을까요 캠퍼스 청소부들은 대부분 비정규직입니다. 관심을 기울이지 않는다면 그들의 존재조차 인식하기 어렵죠. 이러한 소외된 구성원들도 웃을 수 있을 때 대학축제가 비로소 대학 구성원 모두의 축제로 거듭나지 않을까 생각해봅니다.  깨진 유리에 베어 13바늘을 꼬맸다는 아저씨의 손목. 그는 깨진 유리만 잘 분리해줘도 학생들에게 더 부탁할 것이 없다고 말했다.  이성훈 청소노동자들은조금만 더 체계적인 분리수거를 부탁했습니다. 학생회 등 행사진행 측에서  깨진 유리병  휴대용 가스통  음식물쓰레기 를 별도로 분리수거하도록 학생들을 독려하고 분리수거를 위한 별도의 공간을 마련해준다면 캠퍼스청소가 훨씬 수월해질 것이라고 한 목소리로 말했습니다
대책 마련 2년 지났는데도…잠자는 돈 1조 4천 억	http://news.naver.com/main/read.nhn?oid=056&sid1=101&aid=0010461071&mid=shm&mode=LSD&nh=20170527215856	앵커 멘트 보험금이나 증권 등 주인이 찾아가지 않아 잠자고 있는 돈이 1조 4천억 원에 육박하고 있습니다. 휴면예금 찾아주기 등 정부 차원의 대책이 나온지도 2년 가까이 지났는데 그래도 찾아간 돈이 절반도 안된다고 합니다. 리포트 유용범 씨는 올해초 보험통장에서 잠자던 150만 원을 찾았습니다. 4년 전 대출금을 못갚아 보험통장을 차압당한 뒤 잊고 있었는데 빚을 다 갚고도 일부가 남아있었습니다. 우연히 휴면예금을 찾아주는 인터넷 사이트에 접속했다 생각지도 못했던 횡재를 한 겁니다. 인터뷰  유용범부산시 엄궁동   사이트에서 찾아 보니 한 건에 있는 금액이 150만 원이라고 적혀있더라고요. 2015년 6월부터 시작된 휴면예금 찾기 서비스를 통해 642만 명이 1조2천억 원 이상을 찾았습니다.  하지만 아직도 1조4천억 원이 주인을 못찾고 있습니다. 보험금이 8천억 원에 가까워 가장 많습니다. 보험사들이 보험상품을 팔 때와는 달리 막상 보험금을 찾아가라는 연락은 만기 직전 우편으로만 알릴뿐 별 신경을 쓰지 않기때문입니다. 보험사들의 이런 관행에 금융당국이 시정을 요구하고 나섰습니다. 인터뷰  이준호금융감독원 금융혁신국장    이메일이나 문자 등으로 통보하도록 다양화하고 만기 전에 통보하던 것을 만기 이후에도 지속적으로 통보하도록
박 전 대통령도, 총리실도 안 썼다는 '35억 특수활동비'	http://news.naver.com/main/read.nhn?oid=437&sid1=100&aid=0000155130&mid=shm&mode=LSD&nh=20170527210447	박근혜 전 대통령이 탄핵안 가결로 직무 정지된 상태에서도 청와대가 특수활동비를 올해만 35억 원 썼다는 소식 어제26일 전해드렸습니다. 그런데 예산을 관리하는 박근혜 정부 총무비서관이 이 돈을 박 전 대통령이 쓴 게 아니다. 황교안 권한대행과 비서실장 이하 직원들이 썼다고 밝혔습니다. 총리실 측은 황 대행이 쓴 일은 없다고 주장했는데요. 돈은 수십억 원이 나갔는데 썼다는 사람은 없는 상황입니다.기자박근혜 정부 청와대의 이관직 전 총무비서관은 박 전 대통령이 돈을 쓴 게 아니라고 주장했습니다. 이 전 비서관은 JTBC 취재진에 탄핵 기간 박 전 대통령이 사용한 특수활동비는 없다면서 황교안 전 권한대행과 한광옥 전 비서실장 이하 직원들이 사용한 금액이라고 설명했습니다.  이 전 비서관은 지난해 말부터 청와대 살림을 챙겼기 때문에 특수활동비를 누가 얼마나 썼는지 정확히 알 수 있는 인물입니다. 그는 청와대가 지출한 금액 35억 원 안에는 특수활동비뿐 아니라 특정업무 경비도 포함돼 있는데 이 금액은 비서관 이하 직원에게 30만 원씩 정액 지급되고 증빙도 있다고 설명했습니다. 그런데 총리실은 이 주장이 사실이 아니라고 반박했습니다. 임충연 총리실 총무기획관은 청와대 특수활동비를 황 전 대행이 무슨 수로 집행하고 썼겠냐며 있을 수 없는 일이라고 말했습니다.결국 대통령 직무가 정지된 상태에서 35억 원이 현금으로 지출됐지만 대부분의 돈을 썼다는 사람이 없는 상황이어서 감사나 수사가 불가피하다는 지적이 나옵니다.안지현 JTBC 뉴스 공식 SNS 트위터 페이스북 유튜브Copyright by JTBChttpjtbc
공급 느는데도 오징어는 금값…정부 사재기 주시 	http://news.naver.com/main/read.nhn?oid=448&sid1=101&aid=0000211566&mid=shm&mode=LSD&nh=20170527195356	요즘 가격이 폭등하는게 한두가지 아니라는 이야기 많이 합니다. 이번에는 오징어 가격이 금값입니다. 그런데 사실 오징어 어획량은 늘고 있는데도 가격이 급등하고 있는 상황입니다. 정부는 사재기 여부를 주시하고 있습니다 황민지 기자입니다.리포트찬거리를 준비하려는 주부들로 분주한 마트. 오징어를 잡았던 손이 들었다 놓았다를 반복할 뿐 장바구니에 담지 못합니다. 박정자  서울 옥인동애들이 좋아하니까 자주 먹는데 오징어같은 경우는 싼 반찬인데도 1000원 이상 오르면 부담스럽거던요.  생물 오징어 가격은 가파르게 상승해 1년전보다 70넘게 올랐습니다. 오징어를 파는 식당에도 비상이 걸렸습니다. 구승모  오징어전문식당 직원아무래도 오징어 값은 오르는데 저희가 손님한테 제공되는 값은 올리기가 쉽지는 않으니까. 수온 상승과 중국 어선 등의 영향으로 지난해 어획량이 준 것이 가격 상승의 1차 원인입니다. 얼마 전 오징어 6천 톤을 싣고 오던 운반선이 토클랜드 수역에서 침몰한 것도 악재였습니다. 문제는 올들어 원양 어획량이 확연히 늘고 있는데도 가격이 요지부동이란 점 사재기가 의심됩니다. 그래서 정부는 며칠 안에 사흘치 물량인 3천 3백 톤을 시장에 풀어 가격 동향을 보기로 했습니다. 시장 반응이 비정상적이라고 판단되면 사재기 조사에 들어갑니다. 규모가 큰 유통업체가 우선 조사 대상이라고 정부 관계자는 밝혔습니다.  황민지 기자 smingchosun
만원행동 "최저임금 만원-비정규직 철폐 '지금 당장'"	http://news.naver.com/main/read.nhn?oid=421&sid1=102&aid=0002755425&mid=shm&viewType=pc&mode=LSD&nh=20170527195803	최저임금만원비정규직철폐공동행동만원행동 회원들이 27일 오후 서울 청계광장에서 열린 지금 당장 촛불행동 집회에서 손팻말을 들고 구호를 외치고 있다. 이날 회원들은 최저임금 1만원 비정규직철폐 노조할 권리를 요구하고 오는 6월 30일 총파업을 예고했다.27   황기선 기자청계광장에 6000여명 모여6월 30일 총파업 전개서울 이후민 기자  노동계 시민사회단체 등이 주말 도심에서 집회를 열고 정부를 향해 즉각적인 최저임금 1만원 인상과 비정규직 철폐 노조할 권리 보장 등을 촉구했다.시민사회단체로 구성된 최저임금 1만원비정규직 철폐 만원행동만원행동은 27일 오후 5시30분쯤 서울 종로구 청계광장에서 최저임금 1만원 비정규직 철폐 노조할 권리 지금당장 촛불행동을 열었다.최종진 민주노총 위원장 직무대행은 문재인 정부는 촛불항쟁의 결과물로 탄생한 정부이기에 과감하게 적폐를 청산하고 나라를 나라답게 만들라는 요구를 실천해야 할 책무를 지고 있다며 그러나 세상은 대통령 한 명에 의해 바뀌지 않고 또 그렇게 될 수도 없다. 우리가 가만히 있으면 또다시 아무것도 변하지 않기 때문에 이렇게 모였다고 밝혔다.이어 최저임금 1만원은 되면 좋고 안 되면 할 수 없는 그런 문제가 아니다며 적폐청산과 개혁과제를 추진하는데 90에 가까운 국민들이 지지를 보일 때 국민과 노동자 청년을 믿고 최저임금 만원을 추진해야 한다. 소득주도 경제성장을 이야기하는 정부라면 지금당장 최저임금 만원 과감하게 추진해야 한다고 촉구했다.또 비정규직 문제와 관련해 비정상적인 고용구조를 정상으로 되돌리는 것이고 나라를 나라답게 만들기 위해 더 이상 늦출 수 없는 요구라며 자유롭게 노동조합 가입하고 노동조합 해도 걱정없는 그런 세상 만들어야 한다고 강조했다.발언자로 나선 박태현 전교조 경기지부 조합원은 문재인 대통령은 후보 시절 교원과 공무원의 정치적 자유를 약속했다며 전교조 뿐만 아니라 공무원이나 공공운수 노동자들도 노동권과 정치적 자유에 제약을 받고 있다. 노동자들은 노동3권과 정치적 자유를 누려야 한다고 목소리를 높였다.안명자 공공운수노조 전국교육공무직본부 본부장은 우리는 정규직이라는 이름의 무기계약직을 원하는 것이 아니라 실질적으로 처우개선이 된 정규직을 원하는 것이라며 문 대통령의 행보를 보면 조금 더 기다려야 하는 것 아니냐고들 하지만 그보다 우리의 실상을 더 잘 알수 있도록 목소리를 높이는 것이 우선이 되어야 한다고 본다고 말했다.세종대왕 복장에 1만원권 지폐모양의 탈을 쓰고 발언에 나선 김재근 청년전태일 운영위원은 최저임금 1만원 주장이 처음 나온 것이 2014년인데 지금부터 3년 뒤에 하겠다는 것은 저임금 청년 노동자의 현실을 방치하겠다는 것이라며 즉각실현을 이야기하는 것은 지금같은 삶을 이어갈 수 없기 때문이다고 강조했다.이날 집회에 참가한 참가자 약 6000명주최측 추산은 본집회를 마친 뒤 오후 7시쯤 청계광장을 출발해 을지로를 지나 종로1가로 향하는 도심 행진을 벌였다.민주노총은 이날 집회에 이어 최저임금 1만원 인상과 비정규직 철폐 노조할 권리 보장 등을 촉구하는 총파업을 다음달 30일 전개할 계획이라고 밝혔다.이날 집회는 지난 26일 경찰청이 집회시위의 자유를 최대한 보장하기 위해 집회현장에 경력은 최소한 배치하고 차벽살수차를 원칙적으로 배치하지 않겠다고 밝힌 뒤 열린 첫 대형 집회였다.서울 종로경찰서 관계자는 집회 장소 일대에 교통만 따로 관리하고 경비 인력은 없다고 설명했다. 이날 경찰은 도심 혼잡 등에 대비해 집회가 열리는 청계광장과 행진이 이어지는 을지로 종로1가 등 주변 일대에 교통경찰 5개 중대 약 400명을 배치했다고 밝혔다.최저임금만원비정규직철폐공동행동만원행동 회원들이 27일 오후 서울 청계광장에서 열린 지금 당장 촛불행동 집회에서 최저임금 1만원 퍼포먼스를 하고 있다. 이날 회원들은 최저임금 1만원 비정규직철폐 노조할 권리를 요구하고 오는 6월 30일 총파업을 예고했다
