올해 세금 최초 340조 원 육박…OECD 평균보다 낮아	http://news.naver.com/main/read.nhn?oid=214&sid1=101&aid=0000779407&mid=shm&viewType=pc&mode=LSD&nh=20170726202327	올해 걷히는 세금이 사상 처음으로 340조 원에 육박할 것으로 전망됐습니다.담뱃세 인상과 부동산 호황 경기  회복세가 이어진 영향인데요.조세부담률 역시 역대 최대가 될 거란 예측입니다. 리포트 올해 5월까지 정부가 거둔 국세수입은 123조 8천억 원.1년 전과 비교해 11조 원 늘어난 것으로 올해 목표치 절반을 넘어섰습니다.기업실적이 좋아지면서 법인세가 전년보다 4조 원 늘었고 수입과 수출이 증가하면서 부가가치세 증가 폭이 커졌기 때문입니다. 담뱃세 인상과 부동산 호황으로 지방세 역시 급증할 것으로 예상되면서 올해 국세와 지방세를 합친 총 조세수입이 337조 원에 달할 수 있다는 전망이 나옵니다.국내총생산에서 세금이 차지하는 비율인 조세부담률 전망치는 19.7로 역대 최고치를 기록할 것으로 추정됩니다.6까지 올랐던 조세부담률은 이후 하락했다가 2014년 다시 반등해 지난해에는 19.OECD 35개국가 평균인 25 대와 비교하면 아직도 낮은 수준입니다.주원현대경제연구원 경제연구실장선진국일수록 취약계층 어려운 사람에 대한 배려 정도가 커지고 그래서 정부가 할 일이 많아지거든요. 우리나라 조세부담률이 높아지는 것도 그런 쪽으로 집중될 것 같습니다
밥은 5분 만에, 화장실은 0번… 간호사는 힘들다	http://news.naver.com/main/read.nhn?oid=047&sid1=102&aid=0002157351&mid=shm&mode=LSD&nh=20170726203635	너무나도 피곤한 노동자들   간호사 열악한 노동 환경. 화장실은 꿈 물 한 모금 못 마신다 글고동완 편집김지현긴장이 느슨해질 밤 8시 긴장에 흠뻑 젖은누군가는 하염없이 돌아가는 톱니바퀴가 된다.밥 좀 드셨나요3명이 약속이라도 한 듯 고개를 절레절레 흔든다.지난 19일 서울의 한 사립대 병원 정형외과 병동. 이곳의 사령부인스테이션에서 세 간호사가 모니터를뚫어져라 주시한다. 오후 6시에 저녁 식사가 병동에 올라왔지만 2시간이 지나버렸다. 밥의 온기는 온데간데 없이 사라지고 딱딱하게 굳었다. 정적을 깨고 전화벨이 따르릉 울린다. 다급한 보호자가 신호를 보낸 것. 이 병원 3년 차 간호사 A씨는몸을 움직여 환자에게 간다. 환자는 열이 높은 상황.보호자가 환자의 다리를 매만지며 왜 이리 뜨끈뜨끈해걱정한다. 환자의 팔을 들어 혈압계로 혈압을 재본다. 서둘러 스테이션 약품 창고에서 주사를 준비한다. 1분의 여유조차 없다  환자의 이상 유무를 수시로 체크해야 하는 간호사들. 하지만 정작 자신의 상태를 체크할 여유는 없다. 사진은 기사 속 언급된 병원과 무관함을 알려드립니다.  보건의료노조 제공왜 이렇게 혈압이 높아불안에 찬 보호자가 묻는다. A간호사는 설명을 하더니 이거 맞으시면 혈압이 떨어질 거예요라면서주사를 놓는다. 키보드를 오가는 손놀림이 바쁘다. 병실을 돌며 환자의 상태를 본다. 수술을 마친 환자가 병실로 들어간다. 이 환자 몸에 달린 관의 피를 빼내 주사기로 양을 재고 기록한다. 도구 준비해서 갈게요라고 답한다.이 모든 것이8시 32분에서 40분 8분 만에 일어난 일들이다.스테이션을 서성이던 한 보호자가 간호사가 바빠 보여 말도 못 붙이겠네라면서병실로 돌아간다. 분주함의 끈은 강고하기만 하다. 50분 환자에게 약 줄 시간이다. 약이 담긴 카트를 끈다. 병실을 종횡무진하며 약을 나눠준다. 다음날금식할 환자의 침대에는금식을 붙인다.9시 정각A간호사와 교대를 해줄 나이트 근무조가 출근했다. 출근 시각은 밤 10시이지만 1시간 일찍 왔다. 그 시각 A간호사는 차트를 뒤적이다 기록하지 못한 걸 정리한다. 생각을 정리할 여유는 없다. 환자들의 혈압과 맥박 체온을 입력한다. 나이트 근무 간호사들은 부족한 물품을 채우고 밤 11시에 처방할 약을 준비한다. 출근 전 퇴근 후에 화장실 가요일에 치인다는 게 딱 이런 상황이다. 9시 18분 A간호사는 맡은 환자를 돌보려 병실을 순회한다. 9시 29분 검사 때문에 아침 식사 못하실 거예요라며 환자들에게 주의사항을 당부한다. 9시 32분 혈압이 떨어져 상태가 안 좋아진 환자를 확인한다. A간호사의 발걸음이 멈추지 않는다.9시 37분 의사에게 전화를 건다. 의사는 전화를 안 받는다. 간호사 판단으로 처방을 내릴 수 없다. 다행히 의사의 처방 전화가 왔다. 비치가 안 된 약품을 건너편 병동의 스테이션에서 빌린다. 약을 주사에 담는 데 시간이 걸린다. 9시 50분 혈압이 떨어진 그 금식 환자에게 포도당을 투여한다. 9시 55분 수술 환자가 병실에 왔다. 환자는 회복실에서 오물이 묻어있는 청색 도포로 몸이 덮여있다. 이 동안 수술 부위와 욕창 유무를 확인한다. 스테이션으로 돌아와 급박하게 기록을남기는 A간호사에게 두 가지만 간략하게 물어봤다이질의응답은1분 내에 이뤄졌다.  2시간 지켜보는 내내 물 한 모금은커녕 화장실 한 번 못 가던데.화장실은 출근 전 퇴근 후에만 간다한 교대당 근무 시간이 통상 8시간 이상이란 걸 감안하면 공백이 큰 셈이다. 혹 관두거나 다른 데로 이직하고픈 생각이 있는지.병동 상황을 지켜보던 8년 차 간호사 B씨는 정형외과가 업무 강도로는5점 만점에 1점에 불과하다라면서내과에 근무하던 시절엔 밤 10시 30분에 퇴근할 걸 새벽 12시에 마친 적도 있다라고 귀띔했다. 간호하는 데도 벅차다업무가 편한 축에 속한다는 병동에서도 화장실 한 번 가기 어려운 상황. 간호사들의 노동 강도는 여유란 걸 망각하게 할 정도로 셌다.앞서 전날인 18일 한양대병원에서 간호사로 25년간 재직하고 있는 한미정 전국보건의료노조 사무처장을 만났다. 한 사무처장은 간호사로 재직할 동안 고달픈 날들을 떠올리며 속에 담긴 것들을 쏟아냈다. 그는 기본적인 생리 욕구를 해소하려는 것도 이기적인 게 돼버린다라면서간호 업무의 열악한 실태를 털어놨다. 또 일에 치이다 보니 간호사들에겐인격이란 게 허락되지 않는다라면서 일을 1년 하면 돌잔치를 해줄 정도로 이직이 잦다라고 토로했다. 다음은 한 사무처장과 의료노조 사무실에서 나눈 인터뷰를 일문일답으로 정리한 것이다. 환자를 간호하는 것 이외에 맡은 업무가 많은가. 인력이 많이 부족한 탓이다. 간호를 하려면 처방전을 확인하고 환자가 먹을 약을 챙겨줘야 한다. 교대할 때 주사 응급 물품 수액 등 수십 수백 품목의 유효기간과 개수를 일일이 확인해야 한다. 환자의 혈액 채취나 검사도 병행해야 한다. 환자의 위생도 봐줘야 하고 침상 시트도 갈아줘야 한다. 합병증이 안 생기게 환자를 교육하는 것도 간호사 몫이다. 응급 환자가 오면 일이 안 될 정도다. 간호사들은 밥을 마신다  지난 5월 12일 세계 간호사의 날 기념 일자리 창출 촉구 기자회견에서 한미정 보건의료노조 사무처장이 피켓을 들고 있다.  전국보건의료노조 밥 먹는 건 어떤가. 밥을 먹는 속도가 대체로 5분을 넘질 않는다지난 5월 31일에 발표된 고려대 노동문제연구소 2017 보건의료노동자 정기 실태조사에 따르면 간호사 응답자 1만6943명 중 45가 이동휴게 시간을 포함해한 끼를 먹는 데 20분 미만을 쓰는 것으로 나타났다. 또 주당 식사를 거르는 횟수도 3회 15 5회 10에 달했다. 신참은 일도 잘 못하는데 밥을 늦게 먹으면 뭐라 말을 들으니 밥을 입안으로 그냥 밀어 넣는다. 이 닦을 시간도 없다. 물 한 모금 못 먹고 일할 때도 많다. 특히 간호사들이 생리대를 갈 시간이 없다. 화장실도 자주 못가니 간호사들은 방광염과 변비도 많이 걸린다. 기본적인 생리 욕구를 챙기면 이기적인 간호사가 돼버리는 게 현실이다. 초과로 일하는 시간이 많을 것 같은데.종합병원 간호사는 보통 3교대로 운용된다. 오전과 오후를 맡는 데이는 병원마다 차이는 있지만 보통 단체 협약에 출근을 오전7시 30분으로 규정하고 있다. 하지만 인수인계를 해줘야 해서 1시간 일찍 나온다. 또 오후 3시 30분이 퇴근이라 하면 실제는 오후 4시나 5시에야 퇴근한다. 나이트는 일반적으로 밤 8시 30분에서 다음날 오전8시 30분 적어도 12시간 일하는데 근무 인정은 9시간 내외에 그치는 경우가 잦다. 그런데 초과 수당은 잘 지급되지 않는다.5에서 3시간은 무료로 노동하는 거다. 병원은 재정적으로 감당해야 할 게 많으니 안 주고 싶어하는 거다. 병원과 협상을 하면 초과근무를 줄이겠다 하지만 기본 업무가 줄지 않는데 그럴 수 있겠나. 나이트 근무는 다른 교대 근무보다 체력적으로 힘들지 않나. 보통 월평균 67번을 나이트로 근무하는데 일할 걸생각하면 우울하다. 밤엔 환자들이 잠을 자니 간호사를 줄인다. 중환자는 쭉 돌봐줘야 한다. 전날 처치가 제대로 이뤄졌는지 살펴보고 치료할 때 빠진 건 없었는지 본다. 밤에 일을 하고 아침에 보면 가스가 배에 가득 찰 정도다. 일을 마치고 나면힘이 없어 옷을 갈아입지못한다. 그 시간들이 너무나 괴롭다. 눈물이 쏟아질 때가 있다. 눈만 멀뚱멀뚱한데 이 정신 상태로 자야 하니. 동료나 상사와 가족계획을 상의하기도  아직도 간호사들은 가족계획을 직장과 상의해야 하는 상황에 놓여 있다. 사진은 기사 속 언급된 병원과 무관함을 알려드립니다.  보건의료노조 제공 임신 순번제와 태움간호사 사이에서 벌어지는 폭언과 괴롭힘을 뜻함 등의 부조리도 계속 제기되고 있는 문제인데.순번을 정해 임신하는 건 여전히 있다. 근무조 다섯 명 중 두 명이 임신하면 그 둘을 밤 근무에서 빼줘야 하지 않겠나. 남은 세 명이 일을 더 자주하는 불이익을 받는다. 결국 임신을 남편하고 상의하는 게 아니라 동료와 상사하고 상의해야 한다고려대 노동문제연구소의 2017년조사 결과최근 3년 내 임신과 출산을 경험한 여성 3628명 중 응답자의 30.3가 임신 결정이 자유롭지 못했다고 응답했다. 육아휴직에 들어가도 대체 인력이 바로 투입 안 되는 경우가 잦다.그러니 눈치가 보여 육아휴직을 쓰지 못하기도 한다.태움의 근본 원인도 결국엔 인력의 부족이라고 본다. 사람을 인격적으로 존중하고 도와줘야 하지만 적은 인력으로 그게 가능하겠나. 너네 엄마는 이렇게 일하는 거 아냐는 식으로 심한 말이 나온다. 산적한 문제들을 어떻게 풀어야 한다고 보나. 상급종합병원의 경우새 간호사는 오는데 일도 가중되고 있으니 인간답게 일할 환경이 아니다.중소병원은 간호사를 구하기 어려워 문을 닫고 있다. 간호사는 공공의 일을 한다. 인력 부족으로 사람의 목숨이 위험해질 수 있다
한빛원전 4호기 철판 부식 이어 콘크리트 곳곳 구멍 확인	http://news.naver.com/main/read.nhn?oid=001&sid1=101&aid=0009436105&mid=shm&viewType=pc&mode=LSD&nh=20170726235405	영광 장아름 기자  한빛원전 4호기가 철판 부식에 이어 콘크리트 벽 곳곳에서 구멍이 발견됐다.한빛원전  TV    26일 한빛 원전본부에 따르면 한빛원전 4호기의 상부 원형 돔과 하부 경계지점에서 가로 14 세로 20 크기 샘플 58개를 채취한 결과 57개에서 빈 공간공극이 발견됐다.    한빛원전은 앞서 지난 5월 계획예방정비 도중 4호기 격납건물 철판의 상부 원형 돔과 하부의 경계인 높이 68 지점에서 철판 부식 현상을 발견하고 부식 원인을 조사하고 있었다.    이 과정에서 철판을 감싸고 있던 콘크리트의 공극을 발견한 것이다.    격납건물은 방사능 외부 누출을 막기 위한 1.2 두께의 콘크리트 외벽과 철판으로 싸여 있다.    공극의 크기는 각각 112가량으로 확인됐다.    한빛원전은 지난 5월 철판 13곳의 두께가 설계기준 6 관리기준 5.85인 것으로 파악했으며 최근 2.5cm 간격으로 정밀조사를 한 결과 기준치에 미달하는 부식 부위가 120곳에 달하는 것으로 보고 있다.    한빛원전은 콘크리트 공극이 철판 부식에 영향을 끼쳤을 가능성이 있는 것으로 보고 정확한 원인을 조사 중이다
'총각네 야채가게' 성공 이면에…욕설·상납 '도 넘은 갑질'	http://news.naver.com/main/read.nhn?oid=055&sid1=101&aid=0000552713&mid=shm&viewType=pc&mode=LSD&nh=20170726215902	우리 사회의 여러 성공 신화 가운데 채소와 과일 전문 프랜차이즈인 총각네 야채가게가 있습니다. 행상으로 시작해 연 매출 4백억 원대 업체를 키워낸 이영석 대표는 장사의 신으로 불리면서 이 씨의 성공담을 소재로 한 뮤지컬과 드라마까지 제작됐습니다. 그런데 이 성공 신화의 뒤에는 욕설을 하고 따귀를 때리고 금품 상납까지 요구하는 도를 넘는 갑질이 있었다는 주장이 제기됐습니다.기자총각네 야채가게는 가맹점을 설립하는 방식이 일반 프랜차이즈와 다릅니다.외부 모집이 아닌 본사 직원들 가운데 선발해 가맹점 점주가 되게 합니다.총각네 야채가게 가맹점주  젊은 사람들이 돈이 없잖아요. 그런데 일부만 부담하면 나머지는 본사에서 매장 오픈하는 비용을 대줘요. 그런 부분에서 도움을 많이 받기 때문에 직원들이 이영석 대표를 신봉하는 수준이죠.가맹점 차릴 때 드는 월세 보증금과 권리금 인테리어 비용 같은 목돈을 본사가 우선대주고 가맹점주가 갚아 나가는 방식입니다.최영기변호사  그런 과정을 통해서 출점이 이뤄진다고 하면 안 그래도 본사에 비해 가맹 사업자가 열위한 위치에 있을 수밖에 없는데 특히나 구조적으로 열위한 위치일 수밖에 없죠.이렇다 보니 금품상납 요구가 이어져도 거스르기 힘들었다고 전직 점주들은 얘기합니다.총각네 야채가게 전직 가맹점주  점주들 단톡방에 이영석 대표 말이 올라왔어요. 나 이거스쿠터 사줄 사람하면서 스쿠터 사진이랑 같이 올라왔던 걸로 기억해요. 제일 처음에 손든 사람이 사주기로.이영석 대표는 해당점주가 먼저 선물하고 싶다고 해서 자신이 비용의 반을 보탰다고 해명했습니다.이 대표 생일 전날에는 잊지 말고 축하 메시지라도 보내라고 본사가 공지를 띄웠고 스승의 날에는 이 대표가 직접 점주들 채팅방에서 찾아도 오고 선물도 준 점장들에게 감사하다고 운을 떼더니 감사하다는 말 한마디 안 한 점주들은 앞으로 연락하지 말라며 쓰레기 같은 놈들이라고 욕을 했습니다.욕설은 2주에 한 번 열리는 가맹점주 교육에서도 있었다고 합니다.총각네 야채가게 전직 점주  점장들 교육하는 중간에 이영석 대표한테 쌍욕을 들은 거죠. 점장들 다 보는 데서 개XX야 너는 부모 될 자격도 없는 XX야. 진짜 너무 심하더라고요 창피함이.심지어는 이영석 대표가 영업 자세를 강조하겠다며 교육 중에 점주의 따귀를 때리는 일도 있었습니다.총각네 야채가게 전직 점주  이 대표가 점주 한 명을 지목하더니 너 똥개야 진돗개야 물어본 다음에 진돗갭니다라고 답을 하니까 때렸어요. 그러더니 한 번 더 물을게. 너 똥개야 진돗개야 진돗갭니다 답하니까 한 번 더 때리고 나서 멈추더라고요. 이런 교육을 받으면 점주들이 위축되겠죠.이영석총각네 야채가게 대표  따귀를 때리기 전에 미리 사전에 맞는 점주와 저희가 다 짜고 한 거예요. 내가 이렇게 할 테니까 기분 나빠하지 말고. 형이 너 사랑하는 거 알지 하고 때린 거예요. 나쁜 쪽으로만 몰려면 제 행동 하나하나가 다 나쁠 겁니다 아마.전직 점주들은 이 외에도 똥개 교육이라는 유료 교육도 문제가 있다고 말합니다.총각네 야채가게  직원똥개 교육 수강  500만 원을 내고 교육을 받을 수 있는 여건이 되는 사람은 거의 없죠. 그런데 이걸 하지 않으면 앞으로 매장 운영을 할 수 없다고 얘기를 하니까 울며 겨자 먹기로 하는 경우가 많았죠.이 대표는 무료로 교육 받는 경우도 있다고 해명했는데 공정거래위원회는 유료 교육을 받아야만 가맹점을 내주는 방식이라면 가맹비를 사전에 받는 행위여서 위법이라고 지적했습니다.배선경변호사  가게에 점원으로 들어가서 배워서 주인이 독립을 시켜주는 잘만 운영된다면 권장할 만한 시스템인데 이게 가맹사업 외피를 입으면 갑과 을의 관계가 너무 극심하게 나타나는 거죠.이영석 대표는 오늘26일 자신의 잘못은 모두 반성하고 시정하겠다고 밝혔고 일부 현직 점주들은 자신들은 갑질이라 느끼지 않았다며 이미지 훼손에 따른 피해를 걱정했습니다
"여기서 나가!" 놀이도 배움도 밀려나는 장애아동	http://news.naver.com/main/read.nhn?oid=448&sid1=102&aid=0000217501&mid=shm&mode=LSD&nh=20170726231949	모든 어린이는 충분히 쉬고 놀 권리가 있다 유엔아동권리협약 31조입니다. 그러나 보이지 않는 벽은 놀이터에서도 장애아동과 비장애아동을 갈라놓습니다. 장애아동 특수학교는 15년째 단 한 개도 짓지 못했습니다. 성숙한 사회 어른들의 역할을 다시 생각하게 하는 포커스입니다.리포트그네를 타는 8살 성준이 엄청 신이 났군요. 성준아 기분이 어때 좋아요 그네가 독특하게 생겼죠 다리가 불편한 아이들도 탈 수 있게 만들어진 겁니다. 이런 놀이터 처음 와보니깐 신기해요 희귀병으로 휠체어에 앉은 2년전부터 성준이는 친구들과 놀 곳을 잃었습니다. 권세영  성준이 어머니아주 많이 놀고 싶어했죠. 워낙에 활동적인 아이였고 하지만 장애인과 비장애인이 한데 어울려 놀 수 있는 이런 놀이터는 전국에 딱 하나 뿐입니다. 휠체어가 탈 수 있는 특수 그네입니다. 휠체어를 타고 들어가 줄을 당기면 이렇게 그네가 흔들립니다. 세계적인 소프라노 조수미씨가 3년전부터 특수 제작해 기부하고 있습니다. 조수미  성악가우리나라엔 아직 하나도 없고 그런 걸 듣고서 사실 충격을 받았어요 하지만 놀이기구가 아니란 이유로 놀이터에서 쫓겨났습니다. 그래서 휠체어 그네는 이렇게 휑한 공터에 놓을 수 밖에 없습니다. 송태희  특수학교 교장장애인들은 놀이기구를 타고 싶을까 뭐 이런 생각조차 하지 않는 것 같아요. 사회가 장애아동들은 교육에서도 밀려납니다. 유치원에서 나온 7살 은창이. 갑자기 내리막 길을 내달립니다. 은창이 엄마은창아 잠깐 멈춰 은창이는 발달장애가 있습니다. 엄마는 한 순간도 은창이에게서 눈을 뗄 수 없습니다. 초록불에 건너는 거야 내년엔 특수학교를 보내야 하는데 걱정이 태산입니다. 김정아  은창이 엄마SKY 대학 입시만큼이나 어렵다. 그 정도로 학교가 없어요 발달장애를 가진 안지현양은 새벽 6시에 일어납니다. 특수학교가 1시간 반이나 떨어진 곳에 있기 때문입니다. 이은자  안지현양 엄마아이 입장에서 왜 그 시간에 일어나야 되는지 모르잖아요. 깨우면 짜증 많이 내고. 집 근처에 생길 거라던 특수학교. 처음엔 희망이었지만 이젠 또 한 번의 절망입니다. 이곳에 들어설 예정인 발달장애 학생들을 위한 특수학교는 2019년 3월 개교를 목표로 하고 있지만 주민 반발로 인해 아직 공사 시작조차 하지 못했습니다. 주민들이 특수학교를 반대하는 이유는. 주민집값이 떨어지니까 주민휠체어 타는 사람 전부 이리로 몰아 넣고. 주민그냥 받아들이면 강서구 구민들은 XX이야 보이지 않는 벽에 막힌 장애아동들은 놀 곳도 배울 곳도 잃어갑니다.com윤재민 기자차순우 기자김송이인턴기자  뉴스제보  이메일tvchosunchosun
박 정부 '불법폭력시위단체' 목록에 보수단체는 '0'	http://news.naver.com/main/read.nhn?oid=437&sid1=100&aid=0000159354&mid=shm&viewType=pc&mode=LSD&nh=20170726220645	경찰청은 매년 불법폭력시위단체를 지정해서 그 목록을 관리하고 있습니다. JTBC가 박근혜 정부 4년 동안의 목록을 입수했는데 불법폭력시위단체로 지목된 진보성향 단체와 보수단체의 비율이 570이었습니다. 정권 내내 보수단체는 불이익을 걱정하지 않아도 됐다는 얘기입니다. 서복현 기자의 단독 보도입니다. 기자경찰청이 박근혜 정부 4년 동안 지정한 불법폭력시위단체는 총 57곳입니다.매년 자체 위원회를 열어 의결했는데 2013년에 2개 2014년 14개에서 2015년에는 30개로 급격히 늘었고 지난해에는 11곳을 지정했습니다.목록을 보니 각 노조와 진보단체 세월호 관련 단체들이 포함됐습니다.경찰이 사실상 불법 단체로 낙인찍은 겁니다.경찰 폭행과 도로점거 등이 이유였는데 과격 시위 논란이 일었던 보수단체들은 단 1곳도 포함되지 않았습니다.어버이연합의 경우 2015년 10월 집회 현장에 나온 경찰서장을 폭행하는 사건도 있었지만 목록에는 없습니다.노웅래국회 교육문화체육관광위원  불법폭력시위단체에서 보수단체만 전부 빼버린 것은 명백한 편파적인 결정이다 이렇게 밖에 볼 수 없지요.특히 이 목록은 각 부처들과 공유돼 보조금 지급이나 정부 지원 사업 심사에도 반영됩니다. 박근혜 정부 시절 보수단체는 시위로 인한 불이익은 받지 않았던 셈입니다.앞서 청와대 민정수석실에서는 보수단체 지원 정황이 담긴 박근혜 정부 문건이 발견되기도 했습니다.kr JTBC 뉴스 공식 SNS 트위터 페이스북 유튜브Copyright by JTBChttpjtbc
